Title,URL
"Tái đắc cử Chủ tịch Hà Nội, ông Chu Ngọc Anh nói về 3 lĩnh vực đột phá",https://tienphong.vn/tai-dac-cu-chu-tich-ha-noi-ong-chu-ngoc-anh-noi-ve-3-linh-vuc-dot-pha-post1348614.tpo
Tích hợp nhiều loại giấy tờ vào căn cước công dân gắn chíp,https://tienphong.vn/tich-hop-nhieu-loai-giay-to-vao-can-cuoc-cong-dan-gan-chip-post1348294.tpo
"Cơ sở dữ liệu quốc gia về dân cư: Bảo mật cao, không lộ thông tin cá nhân",https://tienphong.vn/co-so-du-lieu-quoc-gia-ve-dan-cu-bao-mat-cao-khong-lo-thong-tin-ca-nhan-post1347933.tpo
Báo in sẽ qua cơn bĩ cực?,https://tienphong.vn/bao-in-se-qua-con-bi-cuc-post1347536.tpo
Cận cảnh thiết bị hiện đại dùng đọc dữ liệu căn cước công dân gắn chíp,https://tienphong.vn/can-canh-thiet-bi-hien-dai-dung-doc-du-lieu-can-cuoc-cong-dan-gan-chip-post1347781.tpo
Kỳ thi Đánh giá năng lực đợt 1 của ĐH Quốc gia Hà Nội: Đề thi thể hiện rõ sự phân hóa,https://tienphong.vn/ky-thi-danh-gia-nang-luc-dot-1-cua-dh-quoc-gia-ha-noi-de-thi-the-hien-ro-su-phan-hoa-post1344801.tpo
Bắt đầu đợt 1 kỳ thi Đánh giá năng lực của ĐHQG Hà Nội,https://tienphong.vn/bat-dau-dot-1-ky-thi-danh-gia-nang-luc-cua-dhqg-ha-noi-post1344751.tpo
900 thí sinh đầu tiên thi đánh giá năng lực của Đại học Quốc gia Hà Nội,https://tienphong.vn/900-thi-sinh-dau-tien-thi-danh-gia-nang-luc-cua-dai-hoc-quoc-gia-ha-noi-post1344740.tpo
Clip nhạy cảm của NSƯT Đức Hải đang khiến mạng xã hội 'sốc tung nóc',https://tienphong.vn/clip-nhay-cam-cua-nsut-duc-hai-dang-khien-mang-xa-hoi-soc-tung-noc-post1343821.tpo
Công an điều tra vụ nhận tiền tỷ để mua nhà ở xã hội rồi bỏ trốn,https://tienphong.vn/cong-an-dieu-tra-vu-nhan-tien-ty-de-mua-nha-o-xa-hoi-roi-bo-tron-post1343245.tpo
Từ 1/6 sử dụng thẻ BHYT điện tử thay thế thẻ giấy trên cả nước,https://tienphong.vn/tu-16-su-dung-the-bhyt-dien-tu-thay-the-the-giay-tren-ca-nuoc-post1341757.tpo
"Trưa 26/5, thêm 40 ca mắc mới COVID-19 ",https://tienphong.vn/trua-265-them-40-ca-mac-moi-covid-19-post1340104.tpo
Chàng CEO 8X ứng cử Hội đồng Nhân dân thành phố,https://tienphong.vn/chang-ceo-8x-ung-cu-hoi-dong-nhan-dan-thanh-pho-post1339023.tpo
"Vướng dịch, hơn 13.000 công nhân, tình nguyện viên sẽ bầu cử cho đại biểu tại Bắc Giang",https://tienphong.vn/vuong-dich-hon-13000-cong-nhan-tinh-nguyen-vien-se-bau-cu-cho-dai-bieu-tai-bac-giang-post1338364.tpo
Nhật Bản hỗ trợ Việt Nam tối đa để bảo đảm vắc-xin COVID-19,https://tienphong.vn/nhat-ban-ho-tro-viet-nam-toi-da-de-bao-dam-vac-xin-covid-19-post1337430.tpo
Thủ tướng: Khát vọng lớn nhưng cán bộ không xứng tầm thì không làm được việc ,https://tienphong.vn/thu-tuong-khat-vong-lon-nhung-can-bo-khong-xung-tam-thi-khong-lam-duoc-viec-post1335685.tpo
Thí sinh còn 1 tuần đăng ký nguyện vọng,https://tienphong.vn/thi-sinh-con-1-tuan-dang-ky-nguyen-vong-post1333901.tpo
"TS Trần Du Lịch: ‘Giao thông TPHCM thế này, đừng bao giờ nói liên kết vùng…’ ",https://tienphong.vn/ts-tran-du-lich-giao-thong-tphcm-the-nay-dung-bao-gio-noi-lien-ket-vung-post1333729.tpo
Chủ tịch Hà Nội: Phải thực hiện bằng được việc cải tạo chung cư cũ,https://tienphong.vn/chu-tich-ha-noi-phai-thuc-hien-bang-duoc-viec-cai-tao-chung-cu-cu-post1329700.tpo
Cơn say lan đột biến,https://tienphong.vn/con-say-lan-dot-bien-post1329167.tpo
Góc khuất tham nhũng vặt,https://tienphong.vn/goc-khuat-tham-nhung-vat-post1328525.tpo
"Xây dựng Chính phủ liêm chính, hiệu quả ",https://tienphong.vn/xay-dung-chinh-phu-liem-chinh-hieu-qua-post1328549.tpo
"Công khai, minh bạch trong bổ nhiệm cán bộ",https://tienphong.vn/cong-khai-minh-bach-trong-bo-nhiem-can-bo-post1326828.tpo
"Mở rộng địa giới TPHCM, thúc đẩy phát triển về Cần Giờ ",https://tienphong.vn/mo-rong-dia-gioi-tphcm-thuc-day-phat-trien-ve-can-gio-post1324259.tpo
Vì sao nói Viettel là biểu tượng của doanh nghiệp Việt đi ra thế giới?,https://tienphong.vn/vi-sao-noi-viettel-la-bieu-tuong-cua-doanh-nghiep-viet-di-ra-the-gioi-post1324087.tpo
Doanh nghiệp Nhà nước dẫn dắt nền kinh tế số: Hồi sinh và dẫn dắt,https://tienphong.vn/doanh-nghiep-nha-nuoc-dan-dat-nen-kinh-te-so-hoi-sinh-va-dan-dat-post1322862.tpo
VNPT ra mắt dịch vụ bảo vệ an toàn thông tin cho các doanh nghiệp và tổ chức,https://tienphong.vn/vnpt-ra-mat-dich-vu-bao-ve-an-toan-thong-tin-cho-cac-doanh-nghiep-va-to-chuc-post1321381.tpo
Viettel tìm kiếm sinh viên tài năng tham gia kiến tạo xã hội số,https://tienphong.vn/viettel-tim-kiem-sinh-vien-tai-nang-tham-gia-kien-tao-xa-hoi-so-post1326306.tpo
Hà Nội đặt mục tiêu trong TOP 5 về chuyển đổi số,https://tienphong.vn/ha-noi-dat-muc-tieu-trong-top-5-ve-chuyen-doi-so-post1319766.tpo
Fucoidan đồng hành cùng sức khỏe của bạn,https://tienphong.vn/fucoidan-dong-hanh-cung-suc-khoe-cua-ban-post1318861.tpo
"Đấu tranh phòng chống tham nhũng, tiêu cực là nhiệm vụ trọng tâm của nhiệm kỳ Đại hội XIII",https://tienphong.vn/dau-tranh-phong-chong-tham-nhung-tieu-cuc-la-nhiem-vu-trong-tam-cua-nhiem-ky-dai-hoi-xiii-post1315770.tpo
"Hệ thống cơ sở dữ liệu quốc gia về dân cư: Hiện đại, đồng bộ, bảo mật cao",https://tienphong.vn/he-thong-co-so-du-lieu-quoc-gia-ve-dan-cu-hien-dai-dong-bo-bao-mat-cao-post1315731.tpo
"Cần minh bạch việc nhận, dùng tiền công đức qua ví điện tử MoMo",https://tienphong.vn/can-minh-bach-viec-nhan-dung-tien-cong-duc-qua-vi-dien-tu-momo-post1315375.tpo
Chính phủ thảo luận để sớm đưa vắc-xin ngừa COVID-19 đến người dân ,https://tienphong.vn/chinh-phu-thao-luan-de-som-dua-vac-xin-ngua-covid-19-den-nguoi-dan-post1310545.tpo
Khơi dậy khát vọng phát triển đất nước của toàn dân tộc,https://tienphong.vn/khoi-day-khat-vong-phat-trien-dat-nuoc-cua-toan-dan-toc-post1308748.tpo
"Tổng Bí thư, Chủ tịch nước: Nhân dân là trung tâm, là chủ thể của công cuộc đổi mới",https://tienphong.vn/tong-bi-thu-chu-tich-nuoc-nhan-dan-la-trung-tam-la-chu-the-cua-cong-cuoc-doi-moi-post1308578.tpo
Con trai dọa nổ bình gas để ‘vòi’ tiền gia đình,https://tienphong.vn/con-trai-doa-no-binh-gas-de-voi-tien-gia-dinh-post1308403.tpo
Tập trung xây dựng chính quyền đô thị thông minh cho Thủ đô,https://tienphong.vn/tap-trung-xay-dung-chinh-quyen-do-thi-thong-minh-cho-thu-do-post1307205.tpo
Kỳ thi đánh giá năng lực của ĐH Quốc gia Hà Nội có gì?,https://tienphong.vn/ky-thi-danh-gia-nang-luc-cua-dh-quoc-gia-ha-noi-co-gi-post1305550.tpo
Fucoidan đồng hành cùng sức khỏe của bạn,https://tienphong.vn/fucoidan-dong-hanh-cung-suc-khoe-cua-ban-post1303569.tpo
"Xây dựng Tòa án điện tử để phục vụ chỉ đạo, điều hành",https://tienphong.vn/xay-dung-toa-an-dien-tu-de-phuc-vu-chi-dao-dieu-hanh-post1304997.tpo
Viettel Store chính thức có nhận diện thương hiệu mới ,https://tienphong.vn/viettel-store-chinh-thuc-co-nhan-dien-thuong-hieu-moi-post1304696.tpo
Viettel công bố nhận diện thương hiệu mới với sứ mệnh kiến tạo xã hội số,https://tienphong.vn/viettel-cong-bo-nhan-dien-thuong-hieu-moi-voi-su-menh-kien-tao-xa-hoi-so-post1304024.tpo
"Chuyển giao Chính phủ cũ và mới là việc bình thường, luôn có sự kế thừa",https://tienphong.vn/chuyen-giao-chinh-phu-cu-va-moi-la-viec-binh-thuong-luon-co-su-ke-thua-post1302957.tpo
"Tuyên dương 145 học sinh, sinh viên, thanh niên dân tộc thiểu số tiêu biểu",https://tienphong.vn/tuyen-duong-145-hoc-sinh-sinh-vien-thanh-nien-dan-toc-thieu-so-tieu-bieu-post1301772.tpo
"Tổng Bí thư, Chủ tịch nước: Hãy làm việc hết sức mình, vì dân, vì đất nước ",https://tienphong.vn/tong-bi-thu-chu-tich-nuoc-hay-lam-viec-het-suc-minh-vi-dan-vi-dat-nuoc-post1301375.tpo
Nền tảng Hocmai.vn giành giải ở hạng mục Thu hẹp khoảng cách số ,https://tienphong.vn/nen-tang-hocmaivn-gianh-giai-o-hang-muc-thu-hep-khoang-cach-so-post1300349.tpo
Tổng công ty Mạng lưới Viettel nhận danh hiệu Anh hùng Lao động,https://tienphong.vn/tong-cong-ty-mang-luoi-viettel-nhan-danh-hieu-anh-hung-lao-dong-post1301823.tpo
Điện Quang đạt top 10 sản phẩm số xuất sắc Make in Viet Nam,https://tienphong.vn/dien-quang-dat-top-10-san-pham-so-xuat-sac-make-in-viet-nam-post1300159.tpo
Thủ tướng: Tòa án là 'thành trì bảo vệ công lý',https://tienphong.vn/thu-tuong-toa-an-la-thanh-tri-bao-ve-cong-ly-post1299519.tpo
Tập đoàn Hưng Thịnh ký kết hợp tác chiến lược cùng Tập đoàn FPT,https://tienphong.vn/tap-doan-hung-thinh-ky-ket-hop-tac-chien-luoc-cung-tap-doan-fpt-post1298745.tpo
"Vượt bão COVID-19, 'ông lớn' Việt Nam vẫn đạt doanh thu khủng",https://tienphong.vn/vuot-bao-covid-19-ong-lon-viet-nam-van-dat-doanh-thu-khung-post1298267.tpo
Mobifone và SCTV ký kết hợp tác chiến lược toàn diện,https://tienphong.vn/mobifone-va-sctv-ky-ket-hop-tac-chien-luoc-toan-dien-post1297733.tpo
Bộ Tài chính giải bài toán cân đối ngân sách trong đại dịch Covid-19,https://tienphong.vn/bo-tai-chinh-giai-bai-toan-can-doi-ngan-sach-trong-dai-dich-covid-19-post1296981.tpo
Truyền thanh thông minh: Giải pháp kết nối Chính phủ và người dân trong mục tiêu phát triể,https://tienphong.vn/truyen-thanh-thong-minh-giai-phap-ket-noi-chinh-phu-va-nguoi-dan-trong-muc-tieu-phat-trie-post1295739.tpo
"Viettel Cloud: Nền tảng đám mây “Make in Viettel” cho chính quyền điện tử, doanh nghiệp số",https://tienphong.vn/viettel-cloud-nen-tang-dam-may-make-in-viettel-cho-chinh-quyen-dien-tu-doanh-nghiep-so-post1294784.tpo
VNPT Cloud đạt Chứng nhận nền tảng điện toán đám mây an toàn,https://tienphong.vn/vnpt-cloud-dat-chung-nhan-nen-tang-dien-toan-dam-may-an-toan-post1294675.tpo
"Doanh nghiệp, tổ chức “bắt tay” cùng chuyển đổi số",https://tienphong.vn/doanh-nghiep-to-chuc-bat-tay-cung-chuyen-doi-so-post1294535.tpo
Giải pháp thanh toán VNPAY-QR giúp VNPAY chinh phục Thương hiệu Quốc gia Việt Nam ,https://tienphong.vn/giai-phap-thanh-toan-vnpay-qr-giup-vnpay-chinh-phuc-thuong-hieu-quoc-gia-viet-nam-post1293441.tpo
"Showbiz 26/11: Bị nghi 'đá xéo' Thủy Tiên, Cát Phượng chính thức lên tiếng",https://tienphong.vn/showbiz-2611-bi-nghi-da-xeo-thuy-tien-cat-phuong-chinh-thuc-len-tieng-post1293188.tpo
"Huyền thoại Maradona qua đời, dân mạng lại tưởng nhớ Madonna và gọi là 'nữ hoàng bóng đá'",https://tienphong.vn/huyen-thoai-maradona-qua-doi-dan-mang-lai-tuong-nho-madonna-va-goi-la-nu-hoang-bong-da-post1293090.tpo
Chuyển đổi số để người dân được hưởng những dịch vụ tốt nhất,https://tienphong.vn/chuyen-doi-so-de-nguoi-dan-duoc-huong-nhung-dich-vu-tot-nhat-post1291532.tpo
Viettel thuộc Top 10 thương hiệu có trải nghiệm khách hàng tốt nhất,https://tienphong.vn/viettel-thuoc-top-10-thuong-hieu-co-trai-nghiem-khach-hang-tot-nhat-post1290977.tpo
Thủ tướng khai trương Ứng dụng Bảo hiểm Xã hội số - VssID,https://tienphong.vn/thu-tuong-khai-truong-ung-dung-bao-hiem-xa-hoi-so-vssid-post1290596.tpo
"Đăng video khoả thân tắm cùng chồng trẻ, cựu siêu mẫu Heidi Klum bị chỉ trích",https://tienphong.vn/dang-video-khoa-than-tam-cung-chong-tre-cuu-sieu-mau-heidi-klum-bi-chi-trich-post1290574.tpo
Việt Nam cần xây dựng xa lộ cáp quang biển lớn hướng đến kiến tạo xã hội số ,https://tienphong.vn/viet-nam-can-xay-dung-xa-lo-cap-quang-bien-lon-huong-den-kien-tao-xa-hoi-so-post1289546.tpo
Bộ Xây dựng đứng cuối bảng về ứng dụng công nghệ thông tin,https://tienphong.vn/bo-xay-dung-dung-cuoi-bang-ve-ung-dung-cong-nghe-thong-tin-post1289331.tpo
Vinh danh Viettel vì thành tích xuất sắc trong xây dựng và thực hành văn hóa doanh nghiệp,https://tienphong.vn/vinh-danh-viettel-vi-thanh-tich-xuat-sac-trong-xay-dung-va-thuc-hanh-van-hoa-doanh-nghiep-post1289336.tpo
Thủ tướng đề xuất sáng kiến trồng một tỷ cây xanh trong 5 năm,https://tienphong.vn/thu-tuong-de-xuat-sang-kien-trong-mot-ty-cay-xanh-trong-5-nam-post1289017.tpo
"Bắc Ninh hợp tác Viettel xây dựng chính quyền điện tử, đô thị thông minh",https://tienphong.vn/bac-ninh-hop-tac-viettel-xay-dung-chinh-quyen-dien-tu-do-thi-thong-minh-post1288174.tpo
"'Đến năm 2030, Việt Nam sẽ trở thành quốc gia số'",https://tienphong.vn/den-nam-2030-viet-nam-se-tro-thanh-quoc-gia-so-post1286395.tpo
Kiều bào hiến kế khắc phục tác động của dịch COVID-19,https://tienphong.vn/kieu-bao-hien-ke-khac-phuc-tac-dong-cua-dich-covid-19-post1286345.tpo
"Xây dựng chính quyền điện tử, nâng cao hiệu quả giải quyết công việc ",https://tienphong.vn/xay-dung-chinh-quyen-dien-tu-nang-cao-hieu-qua-giai-quyet-cong-viec-post1286145.tpo
Góp ý dự thảo văn kiện Đại hội XIII: Loại trừ cho bằng được 'lợi ích nhóm',https://tienphong.vn/gop-y-du-thao-van-kien-dai-hoi-xiii-loai-tru-cho-bang-duoc-loi-ich-nhom-post1285312.tpo
FPT là nơi làm việc tốt nhất ngành CNTT,https://tienphong.vn/fpt-la-noi-lam-viec-tot-nhat-nganh-cntt-post1284393.tpo
Sáu điểm mới nổi bật của Dự thảo Báo cáo chính trị Đại hội lần thứ XIII của Đảng,https://tienphong.vn/sau-diem-moi-noi-bat-cua-du-thao-bao-cao-chinh-tri-dai-hoi-lan-thu-xiii-cua-dang-post1283919.tpo
Dự thảo Báo cáo chính trị của BCH T.Ư Đảng khóa XII tại Đại hội đại biểu toàn quốc lần thứ XIII của Đảng,https://tienphong.vn/du-thao-bao-cao-chinh-tri-cua-bch-tu-dang-khoa-xii-tai-dai-hoi-dai-bieu-toan-quoc-lan-thu-xiii-cua-dang-post1283813.tpo
Đoàn thanh niên báo Tiền Phong tặng sân chơi thiếu nhi cho trẻ em miền biển,https://tienphong.vn/doan-thanh-nien-bao-tien-phong-tang-san-choi-thieu-nhi-cho-tre-em-mien-bien-post1281193.tpo
Bí thư Vương Đình Huệ: Nhân sự đại hội Đảng bộ Hà Nội được xem xét thấu đáo ,https://tienphong.vn/bi-thu-vuong-dinh-hue-nhan-su-dai-hoi-dang-bo-ha-noi-duoc-xem-xet-thau-dao-post1280913.tpo
"Các dự thảo văn kiện trình Đại hội XIII được chuẩn bị rất công phu, bài bản",https://tienphong.vn/cac-du-thao-van-kien-trinh-dai-hoi-xiii-duoc-chuan-bi-rat-cong-phu-bai-ban-post1280730.tpo
Những điểm mới và cốt lõi trong báo cáo Chính trị của Đà Nẵng,https://tienphong.vn/nhung-diem-moi-va-cot-loi-trong-bao-cao-chinh-tri-cua-da-nang-post1279901.tpo
Hé lộ về 'làn gió mới' trên thị trường Internet cáp quang!,https://tienphong.vn/he-lo-ve-lan-gio-moi-tren-thi-truong-internet-cap-quang-post1276350.tpo
Doanh nghiệp viễn thông Việt Nam gặt hái tại Giải thưởng Kinh doanh Quốc tế 2020,https://tienphong.vn/doanh-nghiep-vien-thong-viet-nam-gat-hai-tai-giai-thuong-kinh-doanh-quoc-te-2020-post1273876.tpo
Vì sao những phụ nữ này thích khỏa thân trong nhà?,https://tienphong.vn/vi-sao-nhung-phu-nu-nay-thich-khoa-than-trong-nha-post1270951.tpo
"Chuẩn bị thật tốt Đại hội XIII, đưa đất nước bước vào một giai đoạn phát triển mới",https://tienphong.vn/chuan-bi-that-tot-dai-hoi-xiii-dua-dat-nuoc-buoc-vao-mot-giai-doan-phat-trien-moi-post1270774.tpo
Hương Giang đối đầu với Tóc Tiên tranh biện quyết liệt về ‘Tim nóng - Đầu lạnh’,https://tienphong.vn/huong-giang-doi-dau-voi-toc-tien-tranh-bien-quyet-liet-ve-tim-nong-dau-lanh-post1266494.tpo
Bí thư Vương Đình Huệ: Huy động tối đa nguồn lực xây dựng ĐHQGHN tại Hòa Lạc,https://tienphong.vn/bi-thu-vuong-dinh-hue-huy-dong-toi-da-nguon-luc-xay-dung-dhqghn-tai-hoa-lac-post1266495.tpo
Viettel được công nhận là công ty Việt Nam có ảnh hưởng lớn nhất châu Á,https://tienphong.vn/viettel-duoc-cong-nhan-la-cong-ty-viet-nam-co-anh-huong-lon-nhat-chau-a-post1265003.tpo
"Xét thị thực du học Mỹ trở lại từ 15/7, không xét cho sinh viên học trực tuyến 100%",https://tienphong.vn/xet-thi-thuc-du-hoc-my-tro-lai-tu-157-khong-xet-cho-sinh-vien-hoc-truc-tuyen-100-post1256514.tpo
Thủ tướng mong muốn Ninh Bình trở thành tỉnh có động lực tăng trưởng mạnh,https://tienphong.vn/thu-tuong-mong-muon-ninh-binh-tro-thanh-tinh-co-dong-luc-tang-truong-manh-post1255888.tpo
Smartphone 5G Việt Nam đầu tiên và công nghệ dẫn dắt đến tương lai,https://tienphong.vn/smartphone-5g-viet-nam-dau-tien-va-cong-nghe-dan-dat-den-tuong-lai-post1255010.tpo
"Ngồi nhà đăng ký ô tô, xe máy qua mạng từ 15/8",https://tienphong.vn/ngoi-nha-dang-ky-o-to-xe-may-qua-mang-tu-158-post1254796.tpo
Đà Nẵng dành gói ưu đãi 200 tỷ đồng để người dân vay trả nợ tiền đất,https://tienphong.vn/da-nang-danh-goi-uu-dai-200-ty-dong-de-nguoi-dan-vay-tra-no-tien-dat-post1254497.tpo
“Khoảng lặng” - Triển lãm tranh từ thiện dành cho trẻ khó khăn,https://tienphong.vn/khoang-lang-trien-lam-tranh-tu-thien-danh-cho-tre-kho-khan-post1253419.tpo
"Viettel tiên phong kiến tạo xã hội số, xây dựng tổ hợp công nghiệp công nghệ cao",https://tienphong.vn/viettel-tien-phong-kien-tao-xa-hoi-so-xay-dung-to-hop-cong-nghiep-cong-nghe-cao-post1253233.tpo
Cuộc thi Vô địch tin học văn phòng Thế giới – Viettel 2020 và những con số ấn tượng,https://tienphong.vn/cuoc-thi-vo-dich-tin-hoc-van-phong-the-gioi-viettel-2020-va-nhung-con-so-an-tuong-post1252822.tpo
"Khai trương trung tâm điều hành thông minh, Hà Giang tạo đột phá xây dựng chính quyền điện",https://tienphong.vn/khai-truong-trung-tam-dieu-hanh-thong-minh-ha-giang-tao-dot-pha-xay-dung-chinh-quyen-dien-post1252068.tpo
Đăng ký xét tuyển sinh đại học: 'Mưa' nguyện vọng,https://tienphong.vn/dang-ky-xet-tuyen-sinh-dai-hoc-mua-nguyen-vong-post1251578.tpo
"Tham thì thâm, Neymar thua kiện Barcelona số tiền cực lớn",https://tienphong.vn/tham-thi-tham-neymar-thua-kien-barcelona-so-tien-cuc-lon-post1249830.tpo
Tìm ra Hoa khôi cuộc thi Tài sắc nữ sinh Báo chí 2020,https://tienphong.vn/tim-ra-hoa-khoi-cuoc-thi-tai-sac-nu-sinh-bao-chi-2020-post1248958.tpo
Khát vọng sống của hơn 80 trẻ 'có H',https://tienphong.vn/khat-vong-song-cua-hon-80-tre-co-h-post1247656.tpo
Bộ Chính trị kết luận chưa điều chỉnh lương cán bộ từ 1/7,https://tienphong.vn/bo-chinh-tri-ket-luan-chua-dieu-chinh-luong-can-bo-tu-17-post1246228.tpo
"Hà Nội: Đột phá cải cách thể chế, quản lý theo mô hình chính quyền đô thị",https://tienphong.vn/ha-noi-dot-pha-cai-cach-the-che-quan-ly-theo-mo-hinh-chinh-quyen-do-thi-post1244357.tpo
"Tiên phong kiến tạo xã hội số, Viettel giữ vững ngôi vị dẫn đầu giải thưởng sao khuê",https://tienphong.vn/tien-phong-kien-tao-xa-hoi-so-viettel-giu-vung-ngoi-vi-dan-dau-giai-thuong-sao-khue-post1241119.tpo
Thị trường ôtô Việt Nam 'thất bát' trong tháng 4,https://tienphong.vn/thi-truong-oto-viet-nam-that-bat-trong-thang-4-post1239706.tpo
'Đừng để gói 62.000 tỷ xảy ra sai phạm như vụ mua máy xét nghiệm',https://tienphong.vn/dung-de-goi-62000-ty-xay-ra-sai-pham-nhu-vu-mua-may-xet-nghiem-post1238249.tpo
Dịch vụ công trực tuyến Kho bạc Nhà nước: Nền móng của kho bạc số,https://tienphong.vn/dich-vu-cong-truc-tuyen-kho-bac-nha-nuoc-nen-mong-cua-kho-bac-so-post1256929.tpo
"Nâng cao chất lượng phục vụ, nền móng của kho bạc số",https://tienphong.vn/nang-cao-chat-luong-phuc-vu-nen-mong-cua-kho-bac-so-post1255060.tpo
Cửa ngõ Sài Gòn kẹt xe kinh hoàng ngày đầu đợt nghỉ lễ ,https://tienphong.vn/cua-ngo-sai-gon-ket-xe-kinh-hoang-ngay-dau-dot-nghi-le-post1236461.tpo
Viettel chuyển sang kinh doanh trên nền tảng số để chống tác động của dịch COVID-19,https://tienphong.vn/viettel-chuyen-sang-kinh-doanh-tren-nen-tang-so-de-chong-tac-dong-cua-dich-covid-19-post1236211.tpo
Vượt qua stress trong mùa dịch,https://tienphong.vn/vuot-qua-stress-trong-mua-dich-post1230938.tpo
"Thư nước Mỹ: Về nhà là nhất, nhưng mình chọn ở lại cách ly xã hội “vì chúng ta“!",https://tienphong.vn/thu-nuoc-my-ve-nha-la-nhat-nhung-minh-chon-o-lai-cach-ly-xa-hoi-vi-chung-ta-post1226718.tpo
Chất lượng mạng 3G/4G Viettel tốt nhất Việt Nam,https://tienphong.vn/chat-luong-mang-3g4g-viettel-tot-nhat-viet-nam-post1227016.tpo
"Giữa bão dịch Covid-19, doanh thu Viettel vẫn tăng 12,8%",https://tienphong.vn/giua-bao-dich-covid-19-doanh-thu-viettel-van-tang-128-post1221232.tpo
"Thầy giáo ""soái ca"" hút hồn sinh viên nhờ khả năng vẽ bằng phấn bảng cực đỉnh",https://tienphong.vn/thay-giao-soai-ca-hut-hon-sinh-vien-nho-kha-nang-ve-bang-phan-bang-cuc-dinh-post1218129.tpo
Nhiều nhân tố mới có thành tích nổi bật,https://tienphong.vn/nhieu-nhan-to-moi-co-thanh-tich-noi-bat-post1167463.tpo
Trào lưu 'một mình' bùng nổ,https://tienphong.vn/trao-luu-mot-minh-bung-no-post1165949.tpo
"Vietcombank quyên góp gần 9 tỷ đồng, mang Tết ấm đến với người nghèo",https://tienphong.vn/vietcombank-quyen-gop-gan-9-ty-dong-mang-tet-am-den-voi-nguoi-ngheo-post1164870.tpo
Tấm bánh nghĩa tình mùa 9: Tết của sự sẻ chia,https://tienphong.vn/tam-banh-nghia-tinh-mua-9-tet-cua-su-se-chia-post1163784.tpo
10 sự kiện ICT nổi bật trong năm 2019 ,https://tienphong.vn/10-su-kien-ict-noi-bat-trong-nam-2019-post1159294.tpo
Bản tin 8H: Thủ tướng làm Chủ tịch Ủy ban quốc gia về Chính phủ điện tử,https://tienphong.vn/ban-tin-8h-thu-tuong-lam-chu-tich-uy-ban-quoc-gia-ve-chinh-phu-dien-tu-post1154418.tpo
Bộ TT&TT:  Không gian mạng là tương lai thịnh vượng của chúng ta,https://tienphong.vn/bo-tttt-khong-gian-mang-la-tuong-lai-thinh-vuong-cua-chung-ta-post1153404.tpo
Bộ trưởng Nguyễn Mạnh Hùng: Đã hết thời giấu kín sự cố tấn công mạng,https://tienphong.vn/bo-truong-nguyen-manh-hung-da-het-thoi-giau-kin-su-co-tan-cong-mang-post1153371.tpo
VNPT đóng góp tích cực trong xây dựng Chính phủ điện tử,https://tienphong.vn/vnpt-dong-gop-tich-cuc-trong-xay-dung-chinh-phu-dien-tu-post1145237.tpo
Tương lai của Viettel Telecom năm 2025,https://tienphong.vn/tuong-lai-cua-viettel-telecom-nam-2025-post1145202.tpo
Các sản phẩm số của Viettel thắng lớn ở 'giải Oscar' của giới kinh doanh quốc tế,https://tienphong.vn/cac-san-pham-so-cua-viettel-thang-lon-o-giai-oscar-cua-gioi-kinh-doanh-quoc-te-post1144874.tpo
"Viettel liên tục lọt Top thương hiệu giá trị nhất VN, được định giá 4,3 tỷ USD",https://tienphong.vn/viettel-lien-tuc-lot-top-thuong-hieu-gia-tri-nhat-vn-duoc-dinh-gia-43-ty-usd-post1139345.tpo
Thủ tướng phát biểu tại Diễn đàn Cải cách và Phát triển Việt Nam 2019,https://tienphong.vn/thu-tuong-phat-bieu-tai-dien-dan-cai-cach-va-phat-trien-viet-nam-2019-post1138491.tpo
Thủ tướng: Không chỉ ước mơ mà phải hành động,https://tienphong.vn/thu-tuong-khong-chi-uoc-mo-ma-phai-hanh-dong-post1138484.tpo
"Tập đoàn LOTTE chạy vì cộng đồng, tặng hàng trăm suất quà từ thiện",https://tienphong.vn/tap-doan-lotte-chay-vi-cong-dong-tang-hang-tram-suat-qua-tu-thien-post1133296.tpo
Bộ trưởng Nguyễn Mạnh Hùng: Cần đào tạo gấp 1.000 chuyên gia công nghệ số,https://tienphong.vn/bo-truong-nguyen-manh-hung-can-dao-tao-gap-1000-chuyen-gia-cong-nghe-so-post1132717.tpo
Bị lừa hơn 300 triệu đồng để 'làm lễ' khiến bạn trai cũ quay lại,https://tienphong.vn/bi-lua-hon-300-trieu-dong-de-lam-le-khien-ban-trai-cu-quay-lai-post1132561.tpo
"Phát động Cuộc thi Viết về BHXH, BHYT",https://tienphong.vn/phat-dong-cuoc-thi-viet-ve-bhxh-bhyt-post1129587.tpo
Cộng đồng người Việt Nam tại Nhật Bản là 'tài sản chung quý giá',https://tienphong.vn/cong-dong-nguoi-viet-nam-tai-nhat-ban-la-tai-san-chung-quy-gia-post1121451.tpo
Chùm ảnh hài hước “Chết ở các địa danh nổi tiếng”,https://tienphong.vn/chum-anh-hai-huoc-chet-o-cac-dia-danh-noi-tieng-post1211974.tpo
Muôn vẻ cảm xúc thí sinh sau khi hoàn thành kỳ thi THPT quốc gia 2019,https://tienphong.vn/muon-ve-cam-xuc-thi-sinh-sau-khi-hoan-thanh-ky-thi-thpt-quoc-gia-2019-post1211877.tpo
Đổi mới sáng tạo là yêu cầu bắt buộc ở Viettel,https://tienphong.vn/doi-moi-sang-tao-la-yeu-cau-bat-buoc-o-viettel-post1119307.tpo
Những phim Việt có cảnh nóng gây tranh cãi nhận nhiều giải thưởng quốc tế,https://tienphong.vn/nhung-phim-viet-co-canh-nong-gay-tranh-cai-nhan-nhieu-giai-thuong-quoc-te-post1111078.tpo
Vingroup và Viettel ký thỏa thuận hợp tác để đem đến dịch vụ tốt nhất cho khách ,https://tienphong.vn/vingroup-va-viettel-ky-thoa-thuan-hop-tac-de-dem-den-dich-vu-tot-nhat-cho-khach-post1110761.tpo
11 thông tin cần xóa ngay trên Facebook,https://tienphong.vn/11-thong-tin-can-xoa-ngay-tren-facebook-post1110525.tpo
