Title,URL
MobiFone tham dự Diễn đàn quốc gia về Phát triển doanh nghiệp công nghệ số,https://tienphong.vn/mobifone-tham-du-dien-dan-quoc-gia-ve-phat-trien-doanh-nghiep-cong-nghe-so-post1496816.tpo
"Thủ tướng: Bảo vệ an ninh, lợi ích quốc gia từ sớm, từ xa",https://tienphong.vn/thu-tuong-bao-ve-an-ninh-loi-ich-quoc-gia-tu-som-tu-xa-post1496527.tpo
"68 km đường bờ biển, một vùng của Bỉ sản xuất 2,3 tỷ W điện gió",https://tienphong.vn/68-km-duong-bo-bien-mot-vung-cua-bi-san-xuat-23-ty-w-dien-gio-post1495662.tpo
EVN có 2 sản phẩm được công nhận giải thưởng công nghệ số 'Make in Viet Nam' ,https://tienphong.vn/evn-co-2-san-pham-duoc-cong-nhan-giai-thuong-cong-nghe-so-make-in-viet-nam-post1495243.tpo
Gỡ điểm nghẽn để Nghệ An thực sự trở thành trung tâm vùng Bắc Trung Bộ ,https://tienphong.vn/go-diem-nghen-de-nghe-an-thuc-su-tro-thanh-trung-tam-vung-bac-trung-bo-post1494822.tpo
Đoàn đại biểu Đảng ta kết thúc tốt đẹp chuyến thăm và dự Đại hội Đảng Cách mạng Tanzania,https://tienphong.vn/doan-dai-bieu-dang-ta-ket-thuc-tot-dep-chuyen-tham-va-du-dai-hoi-dang-cach-mang-tanzania-post1494792.tpo
Người nổi tiếng gửi lời tâm huyết tới đại hội,https://tienphong.vn/nguoi-noi-tieng-gui-loi-tam-huyet-toi-dai-hoi-post1494244.tpo
Câu chuyện một đứa trẻ được sinh ra tại Hà Lan và đăng ký 'công dân số',https://tienphong.vn/cau-chuyen-mot-dua-tre-duoc-sinh-ra-tai-ha-lan-va-dang-ky-cong-dan-so-post1494672.tpo
Tăng cường hợp tác Việt Nam-Tanzania trong lĩnh vực thông tin và truyền thông,https://tienphong.vn/tang-cuong-hop-tac-viet-nam-tanzania-trong-linh-vuc-thong-tin-va-truyen-thong-post1494026.tpo
MISA EMIS đạt Top 10 Sản phẩm số xuất sắc cho Xã hội số tại Make in Viet Nam 2022,https://tienphong.vn/misa-emis-dat-top-10-san-pham-so-xuat-sac-cho-xa-hoi-so-tai-make-in-viet-nam-2022-post1493910.tpo
04 giải pháp số của VNPT được vinh danh tại Giải thưởng Make in Viet Nam năm 2022,https://tienphong.vn/04-giai-phap-so-cua-vnpt-duoc-vinh-danh-tai-giai-thuong-make-in-viet-nam-nam-2022-post1493397.tpo
Hai sản phẩm của EVNCPC giật giải 'Sản phẩm công nghệ số Make in Việt Nam 2022',https://tienphong.vn/hai-san-pham-cua-evncpc-giat-giai-san-pham-cong-nghe-so-make-in-viet-nam-2022-post1493398.tpo
Hội thảo 'Xu hướng giám sát an ninh trong chuyển đổi số' lần đầu tiên được tổ chức tại Hà Nội,https://tienphong.vn/hoi-thao-xu-huong-giam-sat-an-ninh-trong-chuyen-doi-so-lan-dau-tien-duoc-to-chuc-tai-ha-noi-post1493360.tpo
Gần 1.400 công ty công nghệ số Việt Nam mạnh mẽ vươn ra thế giới,https://tienphong.vn/gan-1400-cong-ty-cong-nghe-so-viet-nam-manh-me-vuon-ra-the-gioi-post1493321.tpo
Xây dựng lực lượng công an có bản lĩnh và tuyệt đối trung thành,https://tienphong.vn/xay-dung-luc-luong-cong-an-co-ban-linh-va-tuyet-doi-trung-thanh-post1493070.tpo
Tập 2 Người đẹp Nhân ái: Thí sinh Hoa hậu Việt Nam xúc động với câu chuyện hòn tẩy,https://tienphong.vn/tap-2-nguoi-dep-nhan-ai-thi-sinh-hoa-hau-viet-nam-xuc-dong-voi-cau-chuyen-hon-tay-post1492178.tpo
Trải nghiệm công nghệ VinaPhone 5G với các thiết bị tiên tiến nhất tại Techfest Việt Nam 2022,https://tienphong.vn/trai-nghiem-cong-nghe-vinaphone-5g-voi-cac-thiet-bi-tien-tien-nhat-tai-techfest-viet-nam-2022-post1491815.tpo
Bộ Chính trị: Bảo đảm hạ tầng TPHCM đi trước một bước ,https://tienphong.vn/bo-chinh-tri-bao-dam-ha-tang-tphcm-di-truoc-mot-buoc-post1491779.tpo
"Bộ Chính trị: Phát triển TPHCM thành 'đầu tàu' về kinh tế số, xã hội số",https://tienphong.vn/bo-chinh-tri-phat-trien-tphcm-thanh-dau-tau-ve-kinh-te-so-xa-hoi-so-post1491578.tpo
Tập đoàn Xăng dầu Việt Nam khởi động đề án Chuyển đổi số toàn diện cùng Tập đoàn FPT,https://tienphong.vn/tap-doan-xang-dau-viet-nam-khoi-dong-de-an-chuyen-doi-so-toan-dien-cung-tap-doan-fpt-post1499111.tpo
Tổng Bí thư Nguyễn Phú Trọng: Tạo đột phá để phát huy lợi thế vượt trội Vùng đồng bằng sông Hồng ,https://tienphong.vn/tong-bi-thu-nguyen-phu-trong-tao-dot-pha-de-phat-huy-loi-the-vuot-troi-vung-dong-bang-song-hong-post1490790.tpo
Tổng Bí thư Nguyễn Phú Trọng: Vùng đồng bằng sông Hồng phải đi đầu trong đổi mới sáng tạo (*),https://tienphong.vn/tong-bi-thu-nguyen-phu-trong-vung-dong-bang-song-hong-phai-di-dau-trong-doi-moi-sang-tao-post1490691.tpo
Tổng Bí thư Nguyễn Phú Trọng chủ trì Hội nghị phát triển vùng đồng bằng sông Hồng,https://tienphong.vn/tong-bi-thu-nguyen-phu-trong-chu-tri-hoi-nghi-phat-trien-vung-dong-bang-song-hong-post1490562.tpo
Nâng cao nhận thức của thanh niên Bắc Kạn về chuyển đổi số,https://tienphong.vn/nang-cao-nhan-thuc-cua-thanh-nien-bac-kan-ve-chuyen-doi-so-post1488793.tpo
"Phát triển Vùng Bắc Trung Bộ và Duyên hải Trung bộ mạnh về biển, giàu từ biển ",https://tienphong.vn/phat-trien-vung-bac-trung-bo-va-duyen-hai-trung-bo-manh-ve-bien-giau-tu-bien-post1486919.tpo
"Thủ tướng Phạm Minh Chính: ASEAN cần mở cửa mạnh mẽ thị trường, tháo gỡ các rào cản thương mại",https://tienphong.vn/thu-tuong-pham-minh-chinh-asean-can-mo-cua-manh-me-thi-truong-thao-go-cac-rao-can-thuong-mai-post1485615.tpo
MobiFone được vinh danh Thương hiệu quốc gia Việt Nam 2022,https://tienphong.vn/mobifone-duoc-vinh-danh-thuong-hieu-quoc-gia-viet-nam-2022-post1484675.tpo
Mời tham gia góp ý Báo cáo chính trị Đại hội Đoàn toàn quốc lần thứ XII,https://tienphong.vn/moi-tham-gia-gop-y-bao-cao-chinh-tri-dai-hoi-doan-toan-quoc-lan-thu-xii-post1483869.tpo
Chất vấn Bộ trưởng về việc livestream của bà Nguyễn Phương Hằng,https://tienphong.vn/chat-van-bo-truong-ve-viec-livestream-cua-ba-nguyen-phuong-hang-post1483718.tpo
MobiFone khai trương mạng 5G tại Phú Quốc,https://tienphong.vn/mobifone-khai-truong-mang-5g-tai-phu-quoc-post1483398.tpo
Chuyển đổi số trước tiên là phải chuyển đổi về nhận thức,https://tienphong.vn/chuyen-doi-so-truoc-tien-la-phai-chuyen-doi-ve-nhan-thuc-post1482273.tpo
'Khát vọng xây dựng đất nước Việt Nam hùng cường',https://tienphong.vn/khat-vong-xay-dung-dat-nuoc-viet-nam-hung-cuong-post1482056.tpo
Cần Thơ xác định chuyển đổi số trên 3 trụ cột,https://tienphong.vn/can-tho-xac-dinh-chuyen-doi-so-tren-3-tru-cot-post1482048.tpo
"Chuyển đổi số là cơ hội để các tỉnh ĐBSCL bứt phá, vươn lên",https://tienphong.vn/chuyen-doi-so-la-co-hoi-de-cac-tinh-dbscl-but-pha-vuon-len-post1481553.tpo
"Đại hội Đoàn tỉnh Lai Châu: Cần giáo dục kỹ năng sống, nâng cao 'sức đề kháng' cho thanh niên",https://tienphong.vn/dai-hoi-doan-tinh-lai-chau-can-giao-duc-ky-nang-song-nang-cao-suc-de-khang-cho-thanh-nien-post1480944.tpo
Chủ tịch UBND TPHCM Phan Văn Mãi: TPHCM phối hợp xây dựng đề án Cảng trung chuyển quốc tế Cần Giờ,https://tienphong.vn/chu-tich-ubnd-tphcm-phan-van-mai-tphcm-phoi-hop-xay-dung-de-an-cang-trung-chuyen-quoc-te-can-gio-post1480540.tpo
"Thí điểm chính sách mới vượt trội, có khả năng cạnh tranh quốc tế ở vùng Đông Nam Bộ",https://tienphong.vn/thi-diem-chinh-sach-moi-vuot-troi-co-kha-nang-canh-tranh-quoc-te-o-vung-dong-nam-bo-post1480508.tpo
EVNSPC bám sát và đảm bảo hoàn thành các mục tiêu chuyển đổi số,https://tienphong.vn/evnspc-bam-sat-va-dam-bao-hoan-thanh-cac-muc-tieu-chuyen-doi-so-post1480224.tpo
Khơi dậy khát vọng xây dựng và phát triển quê hương Tiền Giang,https://tienphong.vn/khoi-day-khat-vong-xay-dung-va-phat-trien-que-huong-tien-giang-post1479476.tpo
Chủ tịch Meey Land: 'Start-up Việt đang cảm thấy cô đơn',https://tienphong.vn/chu-tich-meey-land-start-up-viet-dang-cam-thay-co-don-post1478653.tpo
Bí thư TPHCM Nguyễn Văn Nên: 'Cái gốc để tạo nên cán bộ chính là giao việc',https://tienphong.vn/bi-thu-tphcm-nguyen-van-nen-cai-goc-de-tao-nen-can-bo-chinh-la-giao-viec-post1478627.tpo
CEO Unitel: Chiến lược về chuyển đổi số của chúng tôi tại Lào đã thay đổi rất lớn,https://tienphong.vn/ceo-unitel-chien-luoc-ve-chuyen-doi-so-cua-chung-toi-tai-lao-da-thay-doi-rat-lon-post1478650.tpo
"Chú trọng phát hiện, đào tạo cán bộ Đoàn lâu dài từ nguồn học sinh, sinh viên",https://tienphong.vn/chu-trong-phat-hien-dao-tao-can-bo-doan-lau-dai-tu-nguon-hoc-sinh-sinh-vien-post1478615.tpo
"Đoàn thanh niên TPHCM cần nỗ lực nhiều hơn nữa, thể hiện rõ nét hơn vai trò đầu tàu",https://tienphong.vn/doan-thanh-nien-tphcm-can-no-luc-nhieu-hon-nua-the-hien-ro-net-hon-vai-tro-dau-tau-post1478601.tpo
Chủ tịch Meey Land: 'Start-up Việt đang cảm thấy cô đơn',https://tienphong.vn/chu-tich-meey-land-start-up-viet-dang-cam-thay-co-don-post1478577.tpo
Thêm 9 dự án nhà ở xã hội được vay vốn hỗ trợ lãi suất 2%,https://tienphong.vn/them-9-du-an-nha-o-xa-hoi-duoc-vay-von-ho-tro-lai-suat-2-post1478245.tpo
"'Tuổi trẻ xứ Lạng cần phát huy khát vọng, tiên phong hành động'",https://tienphong.vn/tuoi-tre-xu-lang-can-phat-huy-khat-vong-tien-phong-hanh-dong-post1478154.tpo
MobiFone vào Top 10 Thương hiệu mạnh Việt Nam ngành Công nghệ năm 2022,https://tienphong.vn/mobifone-vao-top-10-thuong-hieu-manh-viet-nam-nganh-cong-nghe-nam-2022-post1478013.tpo
"Hỗ trợ chuyển đổi số cho nông dân, đi đầu trong khởi nghiệp, lập nghiệp",https://tienphong.vn/ho-tro-chuyen-doi-so-cho-nong-dan-di-dau-trong-khoi-nghiep-lap-nghiep-post1477892.tpo
Bí thư T.Ư Đoàn Nguyễn Minh Triết định hướng thực hiện chuyển đổi số với thanh niên Bình Phước ,https://tienphong.vn/bi-thu-tu-doan-nguyen-minh-triet-dinh-huong-thuc-hien-chuyen-doi-so-voi-thanh-nien-binh-phuoc-post1477740.tpo
Tuổi trẻ Công an TPHCM chung sức chuyển đổi số quốc gia,https://tienphong.vn/tuoi-tre-cong-an-tphcm-chung-suc-chuyen-doi-so-quoc-gia-post1477420.tpo
"Cà Mau: Chuyển đổi số chỉ thành công khi người dân hiểu, tham gia và trở thành công dân số",https://tienphong.vn/ca-mau-chuyen-doi-so-chi-thanh-cong-khi-nguoi-dan-hieu-tham-gia-va-tro-thanh-cong-dan-so-post1477036.tpo
Bảo hiểm Xã hội Việt Nam đón đầu xu hướng chuyển đổi số,https://tienphong.vn/bao-hiem-xa-hoi-viet-nam-don-dau-xu-huong-chuyen-doi-so-post1476977.tpo
"BHXH Việt Nam chuyển đổi số mạnh mẽ vì sự hài lòng người dân, doanh nghiệp",https://tienphong.vn/bhxh-viet-nam-chuyen-doi-so-manh-me-vi-su-hai-long-nguoi-dan-doanh-nghiep-post1476963.tpo
"BHXH Việt Nam: Chuyển đổi số lấy người dân, doanh nghiệp làm trung tâm phục vụ",https://tienphong.vn/bhxh-viet-nam-chuyen-doi-so-lay-nguoi-dan-doanh-nghiep-lam-trung-tam-phuc-vu-post1476962.tpo
Hà Tĩnh thúc đẩy triển khai chuyển đổi số trên nhiều lĩnh vực,https://tienphong.vn/ha-tinh-thuc-day-trien-khai-chuyen-doi-so-tren-nhieu-linh-vuc-post1476750.tpo
Tuổi trẻ Bộ Tư lệnh 86 với chuyển đổi số trong Bộ Quốc phòng,https://tienphong.vn/tuoi-tre-bo-tu-lenh-86-voi-chuyen-doi-so-trong-bo-quoc-phong-post1476696.tpo
"Cần thu hút chuyên gia, nhân lực chất lượng cao phục vụ chuyển đổi số ngành công an",https://tienphong.vn/can-thu-hut-chuyen-gia-nhan-luc-chat-luong-cao-phuc-vu-chuyen-doi-so-nganh-cong-an-post1476682.tpo
"Ngày mai, khai mạc Tuần lễ Số Quốc tế Việt Nam 2022",https://tienphong.vn/ngay-mai-khai-mac-tuan-le-so-quoc-te-viet-nam-2022-post1476600.tpo
Agribank vinh dự nhận giải thưởng Chuyển đổi Số Việt Nam năm 2022 ,https://tienphong.vn/agribank-vinh-du-nhan-giai-thuong-chuyen-doi-so-viet-nam-nam-2022-post1476576.tpo
Bạn cần đọc gì để hưởng ứng Ngày Chuyển đổi số quốc gia?,https://tienphong.vn/ban-can-doc-gi-de-huong-ung-ngay-chuyen-doi-so-quoc-gia-post1476504.tpo
Bản tin Hình sự: Triệt phá đường dây môi giới mại dâm ở Bảo Lộc,https://tienphong.vn/ban-tin-hinh-su-triet-pha-duong-day-moi-gioi-mai-dam-o-bao-loc-post1476444.tpo
Bắt đối tượng xã hội 'số má' ở Bắc Giang,https://tienphong.vn/bat-doi-tuong-xa-hoi-so-ma-o-bac-giang-post1476251.tpo
Tuổi trẻ Quảng Ninh có nhiệm vụ quảng bá hình ảnh quê hương ra thế giới,https://tienphong.vn/tuoi-tre-quang-ninh-co-nhiem-vu-quang-ba-hinh-anh-que-huong-ra-the-gioi-post1475889.tpo
Thúc đẩy chương trình chuyển đổi số tỉnh Thanh Hóa,https://tienphong.vn/thuc-day-chuong-trinh-chuyen-doi-so-tinh-thanh-hoa-post1475724.tpo
Tỉnh Đoàn Quảng Trị và FPT hợp tác thúc đẩy chuyển đổi số,https://tienphong.vn/tinh-doan-quang-tri-va-fpt-hop-tac-thuc-day-chuyen-doi-so-post1475350.tpo
"Bí thư T.Ư Đoàn Ngô Văn Cương: Cấp bộ Đoàn TT-Huế phải quyết liệt, nhanh chóng chuyển đổi số",https://tienphong.vn/bi-thu-tu-doan-ngo-van-cuong-cap-bo-doan-tt-hue-phai-quyet-liet-nhanh-chong-chuyen-doi-so-post1475066.tpo
Đại hội Đoàn tỉnh TT-Huế lần thứ XVI: Nhiều mục tiêu quan trọng trong nhiệm kỳ mới,https://tienphong.vn/dai-hoi-doan-tinh-tt-hue-lan-thu-xvi-nhieu-muc-tieu-quan-trong-trong-nhiem-ky-moi-post1475048.tpo
Đoàn thanh niên cần có giải pháp cải cách hành chính để hỗ trợ nhân dân tốt hơn,https://tienphong.vn/doan-thanh-nien-can-co-giai-phap-cai-cach-hanh-chinh-de-ho-tro-nhan-dan-tot-hon-post1475041.tpo
Khát vọng xây dựng TT-Huế trở thành thành phố trực thuộc Trung ương,https://tienphong.vn/khat-vong-xay-dung-tt-hue-tro-thanh-thanh-pho-truc-thuoc-trung-uong-post1474907.tpo
"Anh Nguyễn Thanh Hoài tái đắc cử Bí thư Tỉnh Đoàn TT-Huế khóa XVI, nhiệm kỳ 2022 - 2027",https://tienphong.vn/anh-nguyen-thanh-hoai-tai-dac-cu-bi-thu-tinh-doan-tt-hue-khoa-xvi-nhiem-ky-2022-2027-post1474846.tpo
"Lạng Sơn: Công khai, minh bạch thu hút đầu tư",https://tienphong.vn/lang-son-cong-khai-minh-bach-thu-hut-dau-tu-post1474690.tpo
"Tuổi trẻ Quảng Ngãi có vai trò, trách nhiệm rất lớn đối với sự phát triển địa phương",https://tienphong.vn/tuoi-tre-quang-ngai-co-vai-tro-trach-nhiem-rat-lon-doi-voi-su-phat-trien-dia-phuong-post1474495.tpo
Bí thư Tỉnh ủy Thái Thanh Quý: Tuổi trẻ Nghệ An đóng góp vào sự phát triển của tỉnh,https://tienphong.vn/bi-thu-tinh-uy-thai-thanh-quy-tuoi-tre-nghe-an-dong-gop-vao-su-phat-trien-cua-tinh-post1474427.tpo
"Tập trung giải pháp xây dựng Đoàn, Hội ở các doanh nghiệp ngoài nhà nước",https://tienphong.vn/tap-trung-giai-phap-xay-dung-doan-hoi-o-cac-doanh-nghiep-ngoai-nha-nuoc-post1473678.tpo
Bí thư Tỉnh ủy Sơn La nhấn mạnh 5 nhiệm vụ trọng tâm cho Tỉnh Đoàn khóa XIII,https://tienphong.vn/bi-thu-tinh-uy-son-la-nhan-manh-5-nhiem-vu-trong-tam-cho-tinh-doan-khoa-xiii-post1471993.tpo
"Tuổi trẻ Đắk Nông đi đầu trong chuyển đổi số, quảng bá du lịch",https://tienphong.vn/tuoi-tre-dak-nong-di-dau-trong-chuyen-doi-so-quang-ba-du-lich-post1471771.tpo
5G MobiFone đã phủ sóng ở Nha Trang,https://tienphong.vn/5g-mobifone-da-phu-song-o-nha-trang-post1471788.tpo
"Tạo thêm mô hình mới, cách làm hay mang đặc trưng của tuổi trẻ Hà Nam",https://tienphong.vn/tao-them-mo-hinh-moi-cach-lam-hay-mang-dac-trung-cua-tuoi-tre-ha-nam-post1471737.tpo
Thứ trưởng Bộ TT&TT Nguyễn Thanh Lâm được giao quản lý lĩnh vực báo chí,https://tienphong.vn/thu-truong-bo-tttt-nguyen-thanh-lam-duoc-giao-quan-ly-linh-vuc-bao-chi-post1471551.tpo
"Ứng dụng VssID-BHXH số: Hỗ trợ người dân tiếp cận thông tin, theo dõi quyền lợi BHXH, BHYT",https://tienphong.vn/ung-dung-vssid-bhxh-so-ho-tro-nguoi-dan-tiep-can-thong-tin-theo-doi-quyen-loi-bhxh-bhyt-post1470889.tpo
"Tuổi trẻ Quảng Trị phải luôn mang trong mình tinh thần kế thừa, ý chí và nghị lực",https://tienphong.vn/tuoi-tre-quang-tri-phai-luon-mang-trong-minh-tinh-than-ke-thua-y-chi-va-nghi-luc-post1470222.tpo
Bí thư T.Ư Đoàn Nguyễn Ngọc Lương: Nâng cao năng lực số cho thanh niên Thái Bình phát triển,https://tienphong.vn/bi-thu-tu-doan-nguyen-ngoc-luong-nang-cao-nang-luc-so-cho-thanh-nien-thai-binh-phat-trien-post1470210.tpo
Xây dựng lớp thanh niên Quảng Bình phát triển toàn diện,https://tienphong.vn/xay-dung-lop-thanh-nien-quang-binh-phat-trien-toan-dien-post1469983.tpo
Bộ Thông tin và Truyền thông bổ nhiệm lãnh đạo nhiều đơn vị,https://tienphong.vn/bo-thong-tin-va-truyen-thong-bo-nhiem-lanh-dao-nhieu-don-vi-post1468478.tpo
Đêm hội trăng rằm cho trẻ em ở trung tâm bảo trợ xã hội Thanh Hoá,https://tienphong.vn/dem-hoi-trang-ram-cho-tre-em-o-trung-tam-bao-tro-xa-hoi-thanh-hoa-post1467499.tpo
"Năm 2025, kinh tế số chiếm 25% GRDP của TPHCM",https://tienphong.vn/nam-2025-kinh-te-so-chiem-25-grdp-cua-tphcm-post1467079.tpo
'Kiềng ba chân' của Jang Kều ,https://tienphong.vn/kieng-ba-chan-cua-jang-keu-post1466060.tpo
Phát huy vai trò thanh niên tiêu biểu trong cộng đồng tôn giáo,https://tienphong.vn/phat-huy-vai-tro-thanh-nien-tieu-bieu-trong-cong-dong-ton-giao-post1466346.tpo
"Tổ chức Đoàn tỉnh Bắc Giang cần chăm lo cho thanh niên, lao động trẻ trong khu công nghiệp",https://tienphong.vn/to-chuc-doan-tinh-bac-giang-can-cham-lo-cho-thanh-nien-lao-dong-tre-trong-khu-cong-nghiep-post1466105.tpo
MobiFone gặp gỡ và giới thiệu giải pháp dành cho khách hàng doanh nghiệp tại Hải Phòng năm 2022,https://tienphong.vn/mobifone-gap-go-va-gioi-thieu-giai-phap-danh-cho-khach-hang-doanh-nghiep-tai-hai-phong-nam-2022-post1466115.tpo
Thông tin về thanh toán trực tuyến lệ phí xét tuyển,https://tienphong.vn/thong-tin-ve-thanh-toan-truc-tuyen-le-phi-xet-tuyen-post1465234.tpo
Hà Nội sẽ có thêm sân bay và đường Vành đai 5,https://tienphong.vn/ha-noi-se-co-them-san-bay-va-duong-vanh-dai-5-post1465048.tpo
mobiAgri và ClipTV của MobiFone giành giải vàng tại giải thưởng Stevie Awards,https://tienphong.vn/mobiagri-va-cliptv-cua-mobifone-gianh-giai-vang-tai-giai-thuong-stevie-awards-post1464718.tpo
Cảnh báo mạo danh cơ quan Bảo hiểm xã hội hỗ trợ nhận trợ cấp,https://tienphong.vn/canh-bao-mao-danh-co-quan-bao-hiem-xa-hoi-ho-tro-nhan-tro-cap-post1464254.tpo
Cảnh báo mạo danh cơ quan BHXH hỗ trợ nhận trợ cấp,https://tienphong.vn/canh-bao-mao-danh-co-quan-bhxh-ho-tro-nhan-tro-cap-post1464150.tpo
Cảnh báo mạo danh cơ quan BHXH hỗ trợ nhận trợ cấp,https://tienphong.vn/canh-bao-mao-danh-co-quan-bhxh-ho-tro-nhan-tro-cap-post1464151.tpo
Bứt tốc chuyển đổi số với hệ sinh thái sản phẩm quản lý và khai thác dữ liệu toàn diện từ FSI ,https://tienphong.vn/but-toc-chuyen-doi-so-voi-he-sinh-thai-san-pham-quan-ly-va-khai-thac-du-lieu-toan-dien-tu-fsi-post1463860.tpo
"Cách đổi, cập nhật số điện thoại, thư điện tử trên ứng dụng VssID – BHXH số",https://tienphong.vn/cach-doi-cap-nhat-so-dien-thoai-thu-dien-tu-tren-ung-dung-vssid-bhxh-so-post1463558.tpo
Bác giúp việc dùng ví điện tử và mục tiêu xây dựng thế hệ số của Viettel ở Đông Timor ,https://tienphong.vn/bac-giup-viec-dung-vi-dien-tu-va-muc-tieu-xay-dung-the-he-so-cua-viettel-o-dong-timor-post1463049.tpo
Chuyển đổi số phải là công cụ quan trọng trong xây dựng nền kinh tế độc lập tự chủ,https://tienphong.vn/chuyen-doi-so-phai-la-cong-cu-quan-trong-trong-xay-dung-nen-kinh-te-doc-lap-tu-chu-post1463312.tpo
"Tạp chí CAND xứng đáng là cơ quan lý luận chính trị, pháp luật, nghiệp vụ của Bộ Công an",https://tienphong.vn/tap-chi-cand-xung-dang-la-co-quan-ly-luan-chinh-tri-phap-luat-nghiep-vu-cua-bo-cong-an-post1462763.tpo
"Cách đổi, cập nhật số điện thoại, thư điện tử trên ứng dụng VssID – BHXH số",https://tienphong.vn/cach-doi-cap-nhat-so-dien-thoai-thu-dien-tu-tren-ung-dung-vssid-bhxh-so-post1462497.tpo
"Cách đổi, cập nhật số điện thoại, thư điện tử trên ứng dụng VssID - BHXH số",https://tienphong.vn/cach-doi-cap-nhat-so-dien-thoai-thu-dien-tu-tren-ung-dung-vssid-bhxh-so-post1462470.tpo
"Thủ tướng Chính phủ thăm, làm việc với Viettel",https://tienphong.vn/thu-tuong-chinh-phu-tham-lam-viec-voi-viettel-post1462167.tpo
Việt Nam sẽ có thành phố sân bay vào năm 2030?,https://tienphong.vn/viet-nam-se-co-thanh-pho-san-bay-vao-nam-2030-post1462223.tpo
KienlongBank và Unicloud hợp tác triển khai lắp đặt 1.000 máy STM tại vùng sâu vùng xa,https://tienphong.vn/kienlongbank-va-unicloud-hop-tac-trien-khai-lap-dat-1000-may-stm-tai-vung-sau-vung-xa-post1462026.tpo
Tây Ninh: Phấn đấu có 50 doanh nghiệp lĩnh vực công nghệ số,https://tienphong.vn/tay-ninh-phan-dau-co-50-doanh-nghiep-linh-vuc-cong-nghe-so-post1460508.tpo
Thành Đoàn Huế đặt chỉ tiêu 100% cơ sở Đoàn tổ chức phong trào tình nguyện vì cuộc sống cộng đồng,https://tienphong.vn/thanh-doan-hue-dat-chi-tieu-100-co-so-doan-to-chuc-phong-trao-tinh-nguyen-vi-cuoc-song-cong-dong-post1460531.tpo
Bí thư Tỉnh ủy Bình Thuận Dương Văn An: Thanh niên phải nỗ lực rèn luyện để cống hiến,https://tienphong.vn/bi-thu-tinh-uy-binh-thuan-duong-van-an-thanh-nien-phai-no-luc-ren-luyen-de-cong-hien-post1460410.tpo
"Bộ Thông tin và Truyền thông thành lập 3 đơn vị mới, xóa 4 đơn vị",https://tienphong.vn/bo-thong-tin-va-truyen-thong-thanh-lap-3-don-vi-moi-xoa-4-don-vi-post1458150.tpo
Mobifone ký kết thỏa thuận hợp tác chiến lược về chuyển đổi số với UBND tỉnh Vĩnh Long ,https://tienphong.vn/mobifone-ky-ket-thoa-thuan-hop-tac-chien-luoc-ve-chuyen-doi-so-voi-ubnd-tinh-vinh-long-post1457250.tpo
"Giáo dục đoàn viên, thanh niên là nòng cốt thúc đẩy chuyển đổi số",https://tienphong.vn/giao-duc-doan-vien-thanh-nien-la-nong-cot-thuc-day-chuyen-doi-so-post1457179.tpo
Giải mã sự ‘kỳ lạ’ về dữ liệu vận hành của một ứng dụng từ Thừa Thiên Huế,https://tienphong.vn/giai-ma-su-ky-la-ve-du-lieu-van-hanh-cua-mot-ung-dung-tu-thua-thien-hue-post1456601.tpo
"Từ những vụ bất chấp nguy hiểm để quay clip câu view: TikTok ngày càng nhiều ""rác""?",https://tienphong.vn/tu-nhung-vu-bat-chap-nguy-hiem-de-quay-clip-cau-view-tiktok-ngay-cang-nhieu-rac-post1455847.tpo
Lực lượng Cảnh sát nhân dân: Viết tiếp những bản anh hùng ca chiến thắng,https://tienphong.vn/luc-luong-canh-sat-nhan-dan-viet-tiep-nhung-ban-anh-hung-ca-chien-thang-post1454389.tpo
" Đắk Nông huy động hơn 3,5 tỷ đồng cho chiến dịch tình nguyện hè",https://tienphong.vn/dak-nong-huy-dong-hon-35-ty-dong-cho-chien-dich-tinh-nguyen-he-post1452510.tpo
Nhiều tỉnh 'cam kết' không sử dụng trẻ em quay xổ số ,https://tienphong.vn/nhieu-tinh-cam-ket-khong-su-dung-tre-em-quay-xo-so-post1451937.tpo
Kỳ thi 'Chuyển Đổi Số' cho hàng chục triệu lao động Việt Nam,https://tienphong.vn/ky-thi-chuyen-doi-so-cho-hang-chuc-trieu-lao-dong-viet-nam-post1451728.tpo
"Học phí, sách giáo khoa: Thủ tướng yêu cầu giảm chi phí, không gây khó khăn cho phụ huynh",https://tienphong.vn/hoc-phi-sach-giao-khoa-thu-tuong-yeu-cau-giam-chi-phi-khong-gay-kho-khan-cho-phu-huynh-post1450954.tpo
Huyện Nhà Bè phát triển lên thẳng thành phố thuộc TPHCM thay vì lên quận,https://tienphong.vn/huyen-nha-be-phat-trien-len-thang-thanh-pho-thuoc-tphcm-thay-vi-len-quan-post1450016.tpo
Đề xuất chuyển khu chế xuất Tân Thuận thành nơi hậu cần cho trung tâm Tài chính quốc tế,https://tienphong.vn/de-xuat-chuyen-khu-che-xuat-tan-thuan-thanh-noi-hau-can-cho-trung-tam-tai-chinh-quoc-te-post1449420.tpo
Tuổi trẻ Hải Phòng hỗ trợ người dân ứng dụng công nghệ vào cuộc sống ,https://tienphong.vn/tuoi-tre-hai-phong-ho-tro-nguoi-dan-ung-dung-cong-nghe-vao-cuoc-song-post1448981.tpo
Mobifone ký kết thỏa thuận hợp tác chuyển đổi số với UBND tỉnh Thanh Hóa ,https://tienphong.vn/mobifone-ky-ket-thoa-thuan-hop-tac-chuyen-doi-so-voi-ubnd-tinh-thanh-hoa-post1448065.tpo
Tặng 1.000 máy tính cho học sinh Hà Giang,https://tienphong.vn/tang-1000-may-tinh-cho-hoc-sinh-ha-giang-post1447964.tpo
Thủ tướng Phạm Minh Chính: Báo chí cần đi đầu trong những vấn đề lớn của đất nước,https://tienphong.vn/thu-tuong-pham-minh-chinh-bao-chi-can-di-dau-trong-nhung-van-de-lon-cua-dat-nuoc-post1447732.tpo
"Trưởng Ban kinh tế Trung ương: Bình Dương phải ‘thông minh hơn, tốt đẹp hơn và đáng sống hơn'",https://tienphong.vn/truong-ban-kinh-te-trung-uong-binh-duong-phai-thong-minh-hon-tot-dep-hon-va-dang-song-hon-post1447623.tpo
Không tuỳ tiện điều chỉnh quy hoạch cục bộ,https://tienphong.vn/khong-tuy-tien-dieu-chinh-quy-hoach-cuc-bo-post1446925.tpo
Đà Nẵng ra mắt Tuyến phố thanh toán không tiền mặt,https://tienphong.vn/da-nang-ra-mat-tuyen-pho-thanh-toan-khong-tien-mat-post1446584.tpo
