Title,URL
18 dự án chuyển đổi số điện tử được triển khai tại Quảng Trị,https://tienphong.vn/18-du-an-chuyen-doi-so-dien-tu-duoc-trien-khai-tai-quang-tri-post1571305.tpo
"Bộ trưởng Nội vụ: Hướng đến xây dựng xã hội lưu trữ, quốc gia lưu trữ",https://tienphong.vn/bo-truong-noi-vu-huong-den-xay-dung-xa-hoi-luu-tru-quoc-gia-luu-tru-post1570081.tpo
Tập đoàn công nghệ hàng đầu Trung Quốc quan tâm xây dựng cơ sở hạ tầng số tại Việt Nam,https://tienphong.vn/tap-doan-cong-nghe-hang-dau-trung-quoc-quan-tam-xay-dung-co-so-ha-tang-so-tai-viet-nam-post1569732.tpo
Doanh nghiệp muốn vay nghìn tỷ làm dự án NƠXH tại Hải Phòng,https://tienphong.vn/doanh-nghiep-muon-vay-nghin-ty-lam-du-an-noxh-tai-hai-phong-post1568235.tpo
VNPT HKD và OneSME được vinh danh tại Lễ công bố giải pháp đổi mới sáng tạo Việt Nam 2023,https://tienphong.vn/vnpt-hkd-va-onesme-duoc-vinh-danh-tai-le-cong-bo-giai-phap-doi-moi-sang-tao-viet-nam-2023-post1567401.tpo
Cơ hội thanh niên phát huy vai trò tiên phong chuyển đổi số ,https://tienphong.vn/co-hoi-thanh-nien-phat-huy-vai-tro-tien-phong-chuyen-doi-so-post1567146.tpo
"Ngày 2/9, nghe nữ giáo viên chia sẻ về môn học Lịch sử?",https://tienphong.vn/ngay-29-nghe-nu-giao-vien-chia-se-ve-mon-hoc-lich-su-post1565678.tpo
"Mỗi công dân đều có 3 dãy số định danh cần nhớ, đó là những dãy số định danh nào?",https://tienphong.vn/moi-cong-dan-deu-co-3-day-so-dinh-danh-can-nho-do-la-nhung-day-so-dinh-danh-nao-post1564322.tpo
Mở rộng thông tin lưu trữ trên thẻ căn cước là một sự cải tiến rất cần thiết,https://tienphong.vn/mo-rong-thong-tin-luu-tru-tren-the-can-cuoc-la-mot-su-cai-tien-rat-can-thiet-post1563975.tpo
"Tìm giải pháp công nghệ 'dữ liệu với cuộc sống', bạn trẻ có cơ hội ẵm hàng trăm triệu đồng",https://tienphong.vn/tim-giai-phap-cong-nghe-du-lieu-voi-cuoc-song-ban-tre-co-co-hoi-am-hang-tram-trieu-dong-post1563708.tpo
Thủ tướng: Không gian mạng đã trở thành không gian chiến lược,https://tienphong.vn/thu-tuong-khong-gian-mang-da-tro-thanh-khong-gian-chien-luoc-post1563557.tpo
 Thủ khoa Quản trị chất lượng giáo dục: Mọi sự cố gắng luôn được nhận được thành tích xứng đáng,https://tienphong.vn/thu-khoa-quan-tri-chat-luong-giao-duc-moi-su-co-gang-luon-duoc-nhan-duoc-thanh-tich-xung-dang-post1562587.tpo
Vụ chi 400 triệu lương hưu cho người chết: Trách nhiệm thuộc ai?,https://tienphong.vn/vu-chi-400-trieu-luong-huu-cho-nguoi-chet-trach-nhiem-thuoc-ai-post1562572.tpo
Trung ương Đoàn ký kết thỏa thuận hợp tác với BIDV giai đoạn 2023 - 2025,https://tienphong.vn/trung-uong-doan-ky-ket-thoa-thuan-hop-tac-voi-bidv-giai-doan-2023-2025-post1562520.tpo
"Đổi thay từ chuyển đổi số (Bài cuối): Chuyển mình mạnh mẽ, kết quả ấn tượng",https://tienphong.vn/doi-thay-tu-chuyen-doi-so-bai-cuoi-chuyen-minh-manh-me-ket-qua-an-tuong-post1561221.tpo
"Dù 'Trường tương tư' có 'hot' đến đâu, 'Tương Liễu' Đàn Kiện Thứ quyết không tái hợp 'Cảnh' Đặng Vi",https://tienphong.vn/du-truong-tuong-tu-co-hot-den-dau-tuong-lieu-dan-kien-thu-quyet-khong-tai-hop-canh-dang-vi-post1561325.tpo
Tỉnh Đoàn TT-Huế ra mắt nền tảng số Đoàn Thanh niên trên Hue-S,https://tienphong.vn/tinh-doan-tt-hue-ra-mat-nen-tang-so-doan-thanh-nien-tren-hue-s-post1561327.tpo
Bắc Giang thông qua đề án thành lập thị xã Việt Yên,https://tienphong.vn/bac-giang-thong-qua-de-an-thanh-lap-thi-xa-viet-yen-post1560713.tpo
Các tỉnh thành ồ ạt gọi vốn đầu tư nhà ở xã hội,https://tienphong.vn/cac-tinh-thanh-o-at-goi-von-dau-tu-nha-o-xa-hoi-post1557485.tpo
"Đà Nẵng dẫn đầu chuyển đổi số, Hà Nội top cuối về chính quyền số",https://tienphong.vn/da-nang-dan-dau-chuyen-doi-so-ha-noi-top-cuoi-ve-chinh-quyen-so-post1557423.tpo
Ứng dụng công nghệ trong học tiếng Anh: Bệ phóng giúp con bứt phá giới hạn ngay từ tiểu học,https://tienphong.vn/ung-dung-cong-nghe-trong-hoc-tieng-anh-be-phong-giup-con-but-pha-gioi-han-ngay-tu-tieu-hoc-post1555247.tpo
"Đẩy mạnh đổi mới, sáng tạo, đáp ứng tốt hơn nữa yêu cầu của sự nghiệp chấn hưng văn hóa",https://tienphong.vn/day-manh-doi-moi-sang-tao-dap-ung-tot-hon-nua-yeu-cau-cua-su-nghiep-chan-hung-van-hoa-post1554582.tpo
Thanh niên khẳng định vai trò xung kích trong chuyển đổi số,https://tienphong.vn/thanh-nien-khang-dinh-vai-tro-xung-kich-trong-chuyen-doi-so-post1554451.tpo
Ông Trần Cẩm Tú làm Trưởng đoàn kiểm tra 885 của Bộ Chính trị về công tác cán bộ,https://tienphong.vn/ong-tran-cam-tu-lam-truong-doan-kiem-tra-885-cua-bo-chinh-tri-ve-cong-tac-can-bo-post1554414.tpo
Tuổi trẻ Hải Phòng ra quân chung tay xây dựng nông thôn mới,https://tienphong.vn/tuoi-tre-hai-phong-ra-quan-chung-tay-xay-dung-nong-thon-moi-post1553942.tpo
Hướng dẫn cách đổi số điện thoại trên ứng dụng VNeID,https://tienphong.vn/huong-dan-cach-doi-so-dien-thoai-tren-ung-dung-vneid-post1553171.tpo
Chủ tịch Quốc hội: Hoa Kỳ là đối tác rất quan trọng ,https://tienphong.vn/chu-tich-quoc-hoi-hoa-ky-la-doi-tac-rat-quan-trong-post1553534.tpo
Chủ tịch Hà Nội: Nghiên cứu xây dựng đường vành đai 5 vùng Thủ đô,https://tienphong.vn/chu-tich-ha-noi-nghien-cuu-xay-dung-duong-vanh-dai-5-vung-thu-do-post1553026.tpo
"VNPT tiên phong kết nối, đồng hành thúc đẩy triển khai hiệu quả Đề án 06",https://tienphong.vn/vnpt-tien-phong-ket-noi-dong-hanh-thuc-day-trien-khai-hieu-qua-de-an-06-post1550975.tpo
"Tổng cục Thuế cải cách quy trình một cửa tiếp nhận, xử lý thủ tục hành chính ",https://tienphong.vn/tong-cuc-thue-cai-cach-quy-trinh-mot-cua-tiep-nhan-xu-ly-thu-tuc-hanh-chinh-post1554827.tpo
Viettel Digital và Lazada Việt Nam hợp tác thúc đẩy mua sắm không tiền mặt ,https://tienphong.vn/viettel-digital-va-lazada-viet-nam-hop-tac-thuc-day-mua-sam-khong-tien-mat-post1550179.tpo
Đã phát sinh dư nợ tín dụng của gói 120.000 tỷ đồng,https://tienphong.vn/da-phat-sinh-du-no-tin-dung-cua-goi-120000-ty-dong-post1548746.tpo
"Hơn 74 nghìn tổ công nghệ số cộng đồng 'đi từng ngõ, gõ từng nhà'",https://tienphong.vn/hon-74-nghin-to-cong-nghe-so-cong-dong-di-tung-ngo-go-tung-nha-post1546744.tpo
Thủ tướng Chính phủ Phạm Minh Chính thăm ‘thành phố trong mơ’ của Trung Quốc,https://tienphong.vn/thu-tuong-chinh-phu-pham-minh-chinh-tham-thanh-pho-trong-mo-cua-trung-quoc-post1546885.tpo
Dấu ấn nổi bật về đề án sân khấu truyền hình ở Hải Phòng,https://tienphong.vn/dau-an-noi-bat-ve-de-an-san-khau-truyen-hinh-o-hai-phong-post1545772.tpo
Thanh niên tình nguyện hỗ trợ người dân làm dịch vụ công trực tuyến,https://tienphong.vn/thanh-nien-tinh-nguyen-ho-tro-nguoi-dan-lam-dich-vu-cong-truc-tuyen-post1545262.tpo
Bảo mật thông tin cơ sở dữ liệu quốc gia về dân cư ,https://tienphong.vn/bao-mat-thong-tin-co-so-du-lieu-quoc-gia-ve-dan-cu-post1545123.tpo
"Đại biểu Quốc hội: Không nên bỏ 'quê quán', ảnh chụp phải đúng, đẹp trên căn cước ",https://tienphong.vn/dai-bieu-quoc-hoi-khong-nen-bo-que-quan-anh-chup-phai-dung-dep-tren-can-cuoc-post1545077.tpo
"Đấu giá tài nguyên viễn thông: Mã đẹp, số đẹp sẽ do thị trường quyết định",https://tienphong.vn/dau-gia-tai-nguyen-vien-thong-ma-dep-so-dep-se-do-thi-truong-quyet-dinh-post1544980.tpo
"Phát hiện, kiến nghị xử lý trò chơi trực tuyến có yếu tố bạo lực, trái truyền thống văn hóa dân tộc",https://tienphong.vn/phat-hien-kien-nghi-xu-ly-tro-choi-truc-tuyen-co-yeu-to-bao-luc-trai-truyen-thong-van-hoa-dan-toc-post1543204.tpo
Phó Thủ tướng: Tỷ lệ thanh toán không tiền mặt cao hơn mục tiêu đề ra,https://tienphong.vn/pho-thu-tuong-ty-le-thanh-toan-khong-tien-mat-cao-hon-muc-tieu-de-ra-post1543505.tpo
"'Phát huy vai trò gương mẫu, đi đầu trong xây dựng, chỉnh đốn Đảng'",https://tienphong.vn/phat-huy-vai-tro-guong-mau-di-dau-trong-xay-dung-chinh-don-dang-post1543144.tpo
Phát triển giáo dục và đào tạo vùng Đồng bằng sông Hồng,https://tienphong.vn/phat-trien-giao-duc-va-dao-tao-vung-dong-bang-song-hong-post1542922.tpo
Hành lang pháp lý bảo vệ chủ thể dữ liệu,https://tienphong.vn/hanh-lang-phap-ly-bao-ve-chu-the-du-lieu-post1542236.tpo
5 tháng gần 60.000 người Việt ra nước ngoài tìm việc ,https://tienphong.vn/5-thang-gan-60000-nguoi-viet-ra-nuoc-ngoai-tim-viec-post1542180.tpo
Chuyển đổi số trong giáo dục đại học: Nhiều thách thức,https://tienphong.vn/chuyen-doi-so-trong-giao-duc-dai-hoc-nhieu-thach-thuc-post1542033.tpo
Á hậu Trịnh Thùy Linh: ‘Chuyển đổi số sẽ giúp nền kinh tế Yên Bái tăng tốc’,https://tienphong.vn/a-hau-trinh-thuy-linh-chuyen-doi-so-se-giup-nen-kinh-te-yen-bai-tang-toc-post1541408.tpo
Toàn cảnh Hội thảo 'Thúc đẩy chuyển đổi số khu vực trung du và miền núi phía Bắc',https://tienphong.vn/toan-canh-hoi-thao-thuc-day-chuyen-doi-so-khu-vuc-trung-du-va-mien-nui-phia-bac-post1541471.tpo
"Á hậu Thùy Linh, Ngọc Hằng khoe sắc với trang phục thổ cẩm Tây Bắc ",https://tienphong.vn/a-hau-thuy-linh-ngoc-hang-khoe-sac-voi-trang-phuc-tho-cam-tay-bac-post1541430.tpo
"Cầu nối thúc đẩy chuyển đổi số khu vực trung du, miền núi phía Bắc",https://tienphong.vn/cau-noi-thuc-day-chuyen-doi-so-khu-vuc-trung-du-mien-nui-phia-bac-post1541416.tpo
‘Làn sóng’ chuyển đổi số lan tỏa mạnh mẽ khắp các địa phương ở Yên Bái,https://tienphong.vn/lan-song-chuyen-doi-so-lan-toa-manh-me-khap-cac-dia-phuong-o-yen-bai-post1541414.tpo
Không còn tình trạng ‘cá lớn nuốt cá bé’ mà là ‘cá nhanh nuốt cá chậm’,https://tienphong.vn/khong-con-tinh-trang-ca-lon-nuot-ca-be-ma-la-ca-nhanh-nuot-ca-cham-post1541396.tpo
Hội thảo 'Thúc đẩy chuyển đổi số khu vực Trung du và miền núi phía Bắc' sẵn sàng hiến kế,https://tienphong.vn/hoi-thao-thuc-day-chuyen-doi-so-khu-vuc-trung-du-va-mien-nui-phia-bac-san-sang-hien-ke-post1541264.tpo
Đánh thức nhiều tiềm năng ,https://tienphong.vn/danh-thuc-nhieu-tiem-nang-post1541041.tpo
Doanh nghiệp Chuyển đổi số - bảo vệ môi trường để bắt kịp xu thế,https://tienphong.vn/doanh-nghiep-chuyen-doi-so-bao-ve-moi-truong-de-bat-kip-xu-the-post1540286.tpo
Nhiều địa phương trên cả nước ra quân chiến dịch Thanh niên tình nguyện Hè năm 2023,https://tienphong.vn/nhieu-dia-phuong-tren-ca-nuoc-ra-quan-chien-dich-thanh-nien-tinh-nguyen-he-nam-2023-post1539849.tpo
Lộ diện các dự án nhà ở xã hội được vay vốn gói 120.000 tỷ đồng,https://tienphong.vn/lo-dien-cac-du-an-nha-o-xa-hoi-duoc-vay-von-goi-120000-ty-dong-post1538843.tpo
Thay đổi chính sách visa để du lịch Việt Nam cất cánh ,https://tienphong.vn/thay-doi-chinh-sach-visa-de-du-lich-viet-nam-cat-canh-post1537941.tpo
Xây dựng văn hóa doanh nghiệp đạt chuẩn VHKD Việt Nam để vươn ra toàn cầu,https://tienphong.vn/xay-dung-van-hoa-doanh-nghiep-dat-chuan-vhkd-viet-nam-de-vuon-ra-toan-cau-post1537640.tpo
"Làm thế nào để phát huy vai trò, trách nhiệm của thanh niên trong chuyển đổi số?",https://tienphong.vn/lam-the-nao-de-phat-huy-vai-tro-trach-nhiem-cua-thanh-nien-trong-chuyen-doi-so-post1537475.tpo
Trao quyết định bổ nhiệm tân Bộ trưởng Bộ Tài nguyên và Môi trường,https://tienphong.vn/trao-quyet-dinh-bo-nhiem-tan-bo-truong-bo-tai-nguyen-va-moi-truong-post1537395.tpo
Sự phát triển kinh tế phải là thước đo 'tín nhiệm' cán bộ ,https://tienphong.vn/su-phat-trien-kinh-te-phai-la-thuoc-do-tin-nhiem-can-bo-post1535925.tpo
Ngành nghề nào giảm lao động lớn nhất ở TPHCM năm 2023?,https://tienphong.vn/nganh-nghe-nao-giam-lao-dong-lon-nhat-o-tphcm-nam-2023-post1535464.tpo
Tình trạng sợ trách nhiệm của một bộ phận không nhỏ cán bộ là vấn đề rất đáng lo ngại (*),https://tienphong.vn/tinh-trang-so-trach-nhiem-cua-mot-bo-phan-khong-nho-can-bo-la-van-de-rat-dang-lo-ngai-post1535157.tpo
Phát động cuộc thi thử thách công dân số trong học sinh Hà Nội,https://tienphong.vn/phat-dong-cuoc-thi-thu-thach-cong-dan-so-trong-hoc-sinh-ha-noi-post1534499.tpo
"Đoàn viên, thanh niên TP. HCM hướng dẫn người dân, doanh nghiệp sử dụng dịch vụ công trực tuyến",https://tienphong.vn/doan-vien-thanh-nien-tp-hcm-huong-dan-nguoi-dan-doanh-nghiep-su-dung-dich-vu-cong-truc-tuyen-post1534003.tpo
Hà Tĩnh hoàn thành cấp hơn 1 triệu CCCD gắn chip ,https://tienphong.vn/ha-tinh-hoan-thanh-cap-hon-1-trieu-cccd-gan-chip-post1533778.tpo
Viettel IDC đồng hành KardiaChain thúc đẩy phát triển blockchain Việt Nam ,https://tienphong.vn/viettel-idc-dong-hanh-kardiachain-thuc-day-phat-trien-blockchain-viet-nam-post1533530.tpo
Đẩy mạnh chuyển đổi số doanh nghiệp với diễn đàn phát triển kinh tế năm 2023,https://tienphong.vn/day-manh-chuyen-doi-so-doanh-nghiep-voi-dien-dan-phat-trien-kinh-te-nam-2023-post1533620.tpo
"Sợ bị AI làm chủ, đông đảo người hào hứng tham gia khóa học ứng dụng AI của Aptech",https://tienphong.vn/so-bi-ai-lam-chu-dong-dao-nguoi-hao-hung-tham-gia-khoa-hoc-ung-dung-ai-cua-aptech-post1533413.tpo
Thanh niên tiên phong thích nghi với chuyển đổi số,https://tienphong.vn/thanh-nien-tien-phong-thich-nghi-voi-chuyen-doi-so-post1532774.tpo
15 triệu công nhân cần thích nghi với chuyển đổi số,https://tienphong.vn/15-trieu-cong-nhan-can-thich-nghi-voi-chuyen-doi-so-post1532712.tpo
Bộ TT&TT phân công nhiệm vụ giữa Bộ trưởng và các Thứ trưởng,https://tienphong.vn/bo-tttt-phan-cong-nhiem-vu-giua-bo-truong-va-cac-thu-truong-post1532574.tpo
Sinh viên là lực lượng nòng cốt phát triển hệ sinh thái đổi mới sáng tạo,https://tienphong.vn/sinh-vien-la-luc-luong-nong-cot-phat-trien-he-sinh-thai-doi-moi-sang-tao-post1531944.tpo
Viettel Store ưu đãi đến 14 triệu đồng mừng sinh nhật tuổi 17,https://tienphong.vn/viettel-store-uu-dai-den-14-trieu-dong-mung-sinh-nhat-tuoi-17-post1531257.tpo
Chủ tịch tỉnh Quảng Nam đối thoại với thanh niên: Cần tiên phong trong chuyển đổi số,https://tienphong.vn/chu-tich-tinh-quang-nam-doi-thoai-voi-thanh-nien-can-tien-phong-trong-chuyen-doi-so-post1530210.tpo
Bộ Công An và Tập đoàn VNPT ký thỏa thuận hợp tác ,https://tienphong.vn/bo-cong-an-va-tap-doan-vnpt-ky-thoa-thuan-hop-tac-post1529962.tpo
Công bố trang vàng chuyển đổi số cho doanh nghiệp,https://tienphong.vn/cong-bo-trang-vang-chuyen-doi-so-cho-doanh-nghiep-post1529185.tpo
"Gia Lai quyết tâm chuyển đổi số trên cả 3 trụ cột: Chính quyền số, Kinh tế số và Xã hội số",https://tienphong.vn/gia-lai-quyet-tam-chuyen-doi-so-tren-ca-3-tru-cot-chinh-quyen-so-kinh-te-so-va-xa-hoi-so-post1528202.tpo
"Hợp tác cùng VNPT, Tuyên Quang quyết tâm chuyển đổi số toàn diện",https://tienphong.vn/hop-tac-cung-vnpt-tuyen-quang-quyet-tam-chuyen-doi-so-toan-dien-post1527834.tpo
"Ông Nguyễn Quang Tuấn đã nộp hơn 6,2 tỷ đồng",https://tienphong.vn/ong-nguyen-quang-tuan-da-nop-hon-62-ty-dong-post1526659.tpo
"Ngày mai, cựu Giám đốc BV Tim Hà Nội cùng đồng phạm hầu tòa ",https://tienphong.vn/ngay-mai-cuu-giam-doc-bv-tim-ha-noi-cung-dong-pham-hau-toa-post1526505.tpo
Hành trình 'khởi nghiệp' và tương lai của nhà mạng viễn thông di động đầu tiên ,https://tienphong.vn/hanh-trinh-khoi-nghiep-va-tuong-lai-cua-nha-mang-vien-thong-di-dong-dau-tien-post1525768.tpo
"‘Xã 4.0’ và nỗ lực phổ cập thanh toán, tài chính số của Viettel Money",https://tienphong.vn/xa-40-va-no-luc-pho-cap-thanh-toan-tai-chinh-so-cua-viettel-money-post1524884.tpo
19 luật sư tham gia bào chữa cho cựu Giám đốc Bệnh viện Tim Hà Nội và các bị cáo,https://tienphong.vn/19-luat-su-tham-gia-bao-chua-cho-cuu-giam-doc-benh-vien-tim-ha-noi-va-cac-bi-cao-post1522196.tpo
"Trung Nguyên Legend chính thức mở văn phòng tại Gangnam, Seoul, Hàn Quốc",https://tienphong.vn/trung-nguyen-legend-chinh-thuc-mo-van-phong-tai-gangnam-seoul-han-quoc-post1521815.tpo
Trung Nguyên Legend chính thức mở văn phòng đại diện tại Hàn Quốc,https://tienphong.vn/trung-nguyen-legend-chinh-thuc-mo-van-phong-dai-dien-tai-han-quoc-post1521345.tpo
"Chủ tịch UBND tỉnh Bình Định đối thoại với thanh niên về xây dựng, phát triển nguồn nhân lực trẻ",https://tienphong.vn/chu-tich-ubnd-tinh-binh-dinh-doi-thoai-voi-thanh-nien-ve-xay-dung-phat-trien-nguon-nhan-luc-tre-post1520567.tpo
"Hơn 800 công trình, phần việc ý nghĩa của tuổi trẻ Nghệ An trong Tháng Thanh niên",https://tienphong.vn/hon-800-cong-trinh-phan-viec-y-nghia-cua-tuoi-tre-nghe-an-trong-thang-thanh-nien-post1519329.tpo
2 ứng dụng dùng thay cho giấy tờ tùy thân khi thực hiện các thủ tục hành chính,https://tienphong.vn/2-ung-dung-dung-thay-cho-giay-to-tuy-than-khi-thuc-hien-cac-thu-tuc-hanh-chinh-post1518368.tpo
Thầy Nguyễn Đồng Anh: Giảng viên thời đại số cần trở thành phiên bản tốt nhất của chính mình,https://tienphong.vn/thay-nguyen-dong-anh-giang-vien-thoi-dai-so-can-tro-thanh-phien-ban-tot-nhat-cua-chinh-minh-post1514804.tpo
Chủ tịch Quốc hội gặp mặt Đoàn đại biểu phụ nữ Công an nhân dân ,https://tienphong.vn/chu-tich-quoc-hoi-gap-mat-doan-dai-bieu-phu-nu-cong-an-nhan-dan-post1515405.tpo
Điều tra vụ lừa đảo làm hồ sơ rút Bảo hiểm xã hội 1 lần,https://tienphong.vn/dieu-tra-vu-lua-dao-lam-ho-so-rut-bao-hiem-xa-hoi-1-lan-post1514571.tpo
Thủ tướng kiện toàn thành viên Ủy ban Quốc gia về chuyển đổi số,https://tienphong.vn/thu-tuong-kien-toan-thanh-vien-uy-ban-quoc-gia-ve-chuyen-doi-so-post1513794.tpo
Tỉnh Đoàn Bình Dương ra mắt 7 đội hình tình nguyện tại Lễ khởi động Tháng Thanh niên năm 2023,https://tienphong.vn/tinh-doan-binh-duong-ra-mat-7-doi-hinh-tinh-nguyen-tai-le-khoi-dong-thang-thanh-nien-nam-2023-post1513689.tpo
Công nghệ từ trái tim: Cách tiếp cận để Việt Nam song hành thế giới,https://tienphong.vn/cong-nghe-tu-trai-tim-cach-tiep-can-de-viet-nam-song-hanh-the-gioi-post1513429.tpo
Robot AI tương tác trực tiếp trong Đại hội Hội Sinh viên trường ĐH Kinh tế - Luật (ĐHQG TP. HCM),https://tienphong.vn/robot-ai-tuong-tac-truc-tiep-trong-dai-hoi-hoi-sinh-vien-truong-dh-kinh-te-luat-dhqg-tp-hcm-post1513018.tpo
"TT-Huế ra quân Tháng Thanh niên, phát động đẩy mạnh chuyển đổi số",https://tienphong.vn/tt-hue-ra-quan-thang-thanh-nien-phat-dong-day-manh-chuyen-doi-so-post1512963.tpo
"Tỉnh Đoàn Sóc Trăng, Trà Vinh khởi động Tháng thanh niên 2023",https://tienphong.vn/tinh-doan-soc-trang-tra-vinh-khoi-dong-thang-thanh-nien-2023-post1512940.tpo
"Phó Thủ tướng Trần Hồng Hà: Bảo đảm văn hóa phát triển cân đối với chính trị, kinh tế",https://tienphong.vn/pho-thu-tuong-tran-hong-ha-bao-dam-van-hoa-phat-trien-can-doi-voi-chinh-tri-kinh-te-post1512322.tpo
"Nữ sinh sư phạm là đảng viên, đạt thành tích học tập xuất sắc",https://tienphong.vn/nu-sinh-su-pham-la-dang-vien-dat-thanh-tich-hoc-tap-xuat-sac-post1511504.tpo
HIEUTHUHAI bị lột đồ trên sóng truyền hình Việt: Phản cảm và quấy rối tình dục?,https://tienphong.vn/hieuthuhai-bi-lot-do-tren-song-truyen-hinh-viet-phan-cam-va-quay-roi-tinh-duc-post1511763.tpo
Quay phim nhiều tờ 500.000 đồng trên bàn của CSGT rồi tống tiền,https://tienphong.vn/quay-phim-nhieu-to-500000-dong-tren-ban-cua-csgt-roi-tong-tien-post1510825.tpo
Tuổi trẻ Thái Nguyên ra mắt đội hình xung kích chuyển đổi số,https://tienphong.vn/tuoi-tre-thai-nguyen-ra-mat-doi-hinh-xung-kich-chuyen-doi-so-post1510632.tpo
"Hà Nội lập Ban chỉ đạo xây dựng chính quyền điện tử, chuyển đổi số",https://tienphong.vn/ha-noi-lap-ban-chi-dao-xay-dung-chinh-quyen-dien-tu-chuyen-doi-so-post1509882.tpo
Ba đặc điểm quan trọng của tạp chí ,https://tienphong.vn/ba-dac-diem-quan-trong-cua-tap-chi-post1509048.tpo
Thủ tướng tìm hiểu về triết lý quy hoạch và bí quyết xây dựng thành phố thông minh của Singapore,https://tienphong.vn/thu-tuong-tim-hieu-ve-triet-ly-quy-hoach-va-bi-quyet-xay-dung-thanh-pho-thong-minh-cua-singapore-post1508823.tpo
"Các hệ thống thông tin, ứng dụng dùng chung là nền tảng cốt lõi để xây dựng nền hành chính Thủ đô ",https://tienphong.vn/cac-he-thong-thong-tin-ung-dung-dung-chung-la-nen-tang-cot-loi-de-xay-dung-nen-hanh-chinh-thu-do-post1508842.tpo
Huawei Việt Nam hỗ trợ công nghệ cho giáo dục vùng cao,https://tienphong.vn/huawei-viet-nam-ho-tro-cong-nghe-cho-giao-duc-vung-cao-post1508660.tpo
Công dân Việt Nam dưới 14 tuổi sẽ được cấp thẻ Căn cước công dân như thế nào?,https://tienphong.vn/cong-dan-viet-nam-duoi-14-tuoi-se-duoc-cap-the-can-cuoc-cong-dan-nhu-the-nao-post1506613.tpo
Hà Nội muốn 80% dân số trưởng thành có điện thoại thông minh,https://tienphong.vn/ha-noi-muon-80-dan-so-truong-thanh-co-dien-thoai-thong-minh-post1505079.tpo
"Quyết tâm cao, nỗ lực lớn, hành động quyết liệt trên tất cả các mặt công tác",https://tienphong.vn/quyet-tam-cao-no-luc-lon-hanh-dong-quyet-liet-tren-tat-ca-cac-mat-cong-tac-post1505100.tpo
"Đoàn thanh niên mang Tết ấm đến bệnh nhân nghèo, rửa xe gây quỹ giúp học sinh khó khăn",https://tienphong.vn/doan-thanh-nien-mang-tet-am-den-benh-nhan-ngheo-rua-xe-gay-quy-giup-hoc-sinh-kho-khan-post1504835.tpo
Cựu Giám đốc Bệnh viện Tim Hà Nội bị truy tố ở khung tới 20 năm tù ,https://tienphong.vn/cuu-giam-doc-benh-vien-tim-ha-noi-bi-truy-to-o-khung-toi-20-nam-tu-post1504158.tpo
Thường trực Ban Bí thư Võ Văn Thưởng chủ trì triển khai Nghị quyết 31 tại TPHCM,https://tienphong.vn/thuong-truc-ban-bi-thu-vo-van-thuong-chu-tri-trien-khai-nghi-quyet-31-tai-tphcm-post1503625.tpo
Bản quy hoạch tinh hoa cho cả hiện tại và tương lai,https://tienphong.vn/ban-quy-hoach-tinh-hoa-cho-ca-hien-tai-va-tuong-lai-post1502259.tpo
Xây dựng Thái Nguyên sớm trở thành tỉnh công nghiệp theo hướng hiện đại (*),https://tienphong.vn/xay-dung-thai-nguyen-som-tro-thanh-tinh-cong-nghiep-theo-huong-hien-dai-post1502359.tpo
"Tổng Bí thư yêu cầu chăm lo tốt hơn gia đình chính sách, người có công ",https://tienphong.vn/tong-bi-thu-yeu-cau-cham-lo-tot-hon-gia-dinh-chinh-sach-nguoi-co-cong-post1502341.tpo
Năm chuyển đổi số các hoạt động của Đoàn,https://tienphong.vn/nam-chuyen-doi-so-cac-hoat-dong-cua-doan-post1502057.tpo
 Quốc hội thông qua Quy hoạch tổng thể quốc gia,https://tienphong.vn/quoc-hoi-thong-qua-quy-hoach-tong-the-quoc-gia-post1501999.tpo
"Thanh Hóa: Trao quà Tết cho cựu TNXP, thương bệnh binh và những người có hoàn cảnh khó khăn",https://tienphong.vn/thanh-hoa-trao-qua-tet-cho-cuu-tnxp-thuong-benh-binh-va-nhung-nguoi-co-hoan-canh-kho-khan-post1501614.tpo
Doanh thu từ không gian mới của MobiFone tăng trưởng hơn 60%,https://tienphong.vn/doanh-thu-tu-khong-gian-moi-cua-mobifone-tang-truong-hon-60-post1501362.tpo
Doanh thu từ không gian mới của MobiFone tăng trưởng hơn 60%,https://tienphong.vn/doanh-thu-tu-khong-gian-moi-cua-mobifone-tang-truong-hon-60-post1501337.tpo
Chương trình chính luận đặc biệt về Việt Nam và Thế Giới năm 2022,https://tienphong.vn/chuong-trinh-chinh-luan-dac-biet-ve-viet-nam-va-the-gioi-nam-2022-post1500997.tpo
"Loại bỏ tư tưởng bàn lùi, lo đấu tranh chống tham nhũng sẽ cản trở sự phát triển (*)",https://tienphong.vn/loai-bo-tu-tuong-ban-lui-lo-dau-tranh-chong-tham-nhung-se-can-tro-su-phat-trien-post1500574.tpo
"Lựa chọn người thật sự liêm chính, vì nước, vì dân vào vị trí lãnh đạo",https://tienphong.vn/lua-chon-nguoi-that-su-liem-chinh-vi-nuoc-vi-dan-vao-vi-tri-lanh-dao-post1500534.tpo
Thí điểm chính sách đột phá cho TPHCM ,https://tienphong.vn/thi-diem-chinh-sach-dot-pha-cho-tphcm-post1500384.tpo
"Bộ Chính trị: Ban hành các chính sách vượt trội, đột phá cho TPHCM",https://tienphong.vn/bo-chinh-tri-ban-hanh-cac-chinh-sach-vuot-troi-dot-pha-cho-tphcm-post1500288.tpo
Dòng máu da vàng trên đất Mỹ,https://tienphong.vn/dong-mau-da-vang-tren-dat-my-post1499848.tpo
Thủ tướng giao Bộ Công an chủ trì xây dựng Trung tâm Dữ liệu quốc gia,https://tienphong.vn/thu-tuong-giao-bo-cong-an-chu-tri-xay-dung-trung-tam-du-lieu-quoc-gia-post1498150.tpo
Thủ tướng chủ trì Hội nghị sơ kết một năm triển khai Đề án 06,https://tienphong.vn/thu-tuong-chu-tri-hoi-nghi-so-ket-mot-nam-trien-khai-de-an-06-post1498120.tpo
"Hải Phòng đẩy mạnh chuyển đổi kinh tế số, xã hội số",https://tienphong.vn/hai-phong-day-manh-chuyen-doi-kinh-te-so-xa-hoi-so-post1497134.tpo
