Title,URL
Xây dựng chương trình đối tác số toàn diện Việt Nam - Lào,https://tienphong.vn/xay-dung-chuong-trinh-doi-tac-so-toan-dien-viet-nam-lao-post1445263.tpo
"10 năm qua, mỗi giờ, Viettel có một ý tưởng mới",https://tienphong.vn/10-nam-qua-moi-gio-viettel-co-mot-y-tuong-moi-post1443118.tpo
Doanh nghiệp Proptech và bước chuyển mình trong kỷ nguyên số,https://tienphong.vn/doanh-nghiep-proptech-va-buoc-chuyen-minh-trong-ky-nguyen-so-post1441602.tpo
Mái nhà che chở cho người lầm lỡ,https://tienphong.vn/mai-nha-che-cho-cho-nguoi-lam-lo-post1440964.tpo
Chia sẻ định hướng phát triển của Việt Nam tại Diễn đàn kinh tế thế giới,https://tienphong.vn/chia-se-dinh-huong-phat-trien-cua-viet-nam-tai-dien-dan-kinh-te-the-gioi-post1440956.tpo
Thanh Hoá: Nhiều giải pháp thúc đẩy chuyển đổi số cho doanh nghiệp ,https://tienphong.vn/thanh-hoa-nhieu-giai-phap-thuc-day-chuyen-doi-so-cho-doanh-nghiep-post1440845.tpo
"Thủ tướng về đến Hà Nội, kết thúc tốt đẹp chuyến thăm và làm việc tại Hoa Kỳ",https://tienphong.vn/thu-tuong-ve-den-ha-noi-ket-thuc-tot-dep-chuyen-tham-va-lam-viec-tai-hoa-ky-post1439491.tpo
Các tập đoàn hàng đầu niêm yết tại sàn chứng khoán New York đề xuất gì với Thủ tướng?,https://tienphong.vn/cac-tap-doan-hang-dau-niem-yet-tai-san-chung-khoan-new-york-de-xuat-gi-voi-thu-tuong-post1439085.tpo
Triển khai nền tảng 'công dân số xứ Lạng',https://tienphong.vn/trien-khai-nen-tang-cong-dan-so-xu-lang-post1438019.tpo
"BIDV thực hiện chương trình “Trao máy tính, gửi tương lai” và trồng cây xanh tại Thanh Hóa",https://tienphong.vn/bidv-thuc-hien-chuong-trinh-trao-may-tinh-gui-tuong-lai-va-trong-cay-xanh-tai-thanh-hoa-post1437139.tpo
"Thủ tướng: Quảng Nam ưu tiên phát triển 'xanh', nhanh và bền vững",https://tienphong.vn/thu-tuong-quang-nam-uu-tien-phat-trien-xanh-nhanh-va-ben-vung-post1436548.tpo
Thủ tướng Nhật Bản kết thúc tốt đẹp chuyến thăm chính thức Việt Nam,https://tienphong.vn/thu-tuong-nhat-ban-ket-thuc-tot-dep-chuyen-tham-chinh-thuc-viet-nam-post1435230.tpo
Cảnh báo giả mạo tổng đài chăm sóc khách hàng ngành Điện,https://tienphong.vn/canh-bao-gia-mao-tong-dai-cham-soc-khach-hang-nganh-dien-post1433596.tpo
Tạo sự chuyển biến có tính đột phá phát triển vùng Đồng bằng sông Cửu Long,https://tienphong.vn/tao-su-chuyen-bien-co-tinh-dot-pha-phat-trien-vung-dong-bang-song-cuu-long-post1432883.tpo
"Bỏ mô hình thanh tra cấp huyện, xóa 'dàn đều' về biên chế?",https://tienphong.vn/bo-mo-hinh-thanh-tra-cap-huyen-xoa-dan-deu-ve-bien-che-post1431822.tpo
Hội thảo khoa học định hướng chiến lược quy hoạch tỉnh Bình Dương bước vào vòng 2,https://tienphong.vn/hoi-thao-khoa-hoc-dinh-huong-chien-luoc-quy-hoach-tinh-binh-duong-buoc-vao-vong-2-post1428716.tpo
Lễ ký kết thỏa thuận hợp tác về chuyển đổi số trên địa bàn huyện Ea H’Leo ,https://tienphong.vn/le-ky-ket-thoa-thuan-hop-tac-ve-chuyen-doi-so-tren-dia-ban-huyen-ea-hleo-post1428709.tpo
"Bí thư thứ nhất T.Ư Đoàn đối thoại với người trẻ: Trọng tâm khởi nghiệp, lập nghiệp ",https://tienphong.vn/bi-thu-thu-nhat-tu-doan-doi-thoai-voi-nguoi-tre-trong-tam-khoi-nghiep-lap-nghiep-post1425717.tpo
Viettel đẩy mạnh tuyển thực tập sinh phục vụ các dự án chuyển đổi số quốc gia,https://tienphong.vn/viettel-day-manh-tuyen-thuc-tap-sinh-phuc-vu-cac-du-an-chuyen-doi-so-quoc-gia-post1425047.tpo
Phụ nữ Viettel - Thành công đến từ những cơ hội ‘không phân biệt’,https://tienphong.vn/phu-nu-viettel-thanh-cong-den-tu-nhung-co-hoi-khong-phan-biet-post1423775.tpo
Thuế môi trường với xăng dầu góp bao nhiêu tiền cho ngân sách? ,https://tienphong.vn/thue-moi-truong-voi-xang-dau-gop-bao-nhieu-tien-cho-ngan-sach-post1422583.tpo
Nữ quân nhân trẻ nhất dự Đại hội Phụ nữ toàn quốc,https://tienphong.vn/nu-quan-nhan-tre-nhat-du-dai-hoi-phu-nu-toan-quoc-post1421997.tpo
"Thủ tướng hoan nghênh việc bãi bỏ văn bằng, chứng chỉ, quy định không cần thiết",https://tienphong.vn/thu-tuong-hoan-nghenh-viec-bai-bo-van-bang-chung-chi-quy-dinh-khong-can-thiet-post1421853.tpo
"Xây dựng hệ thống và cấp định danh phương tiện, bất động sản",https://tienphong.vn/xay-dung-he-thong-va-cap-dinh-danh-phuong-tien-bat-dong-san-post1420202.tpo
Tiên phong kiến tạo xã hội số,https://tienphong.vn/tien-phong-kien-tao-xa-hoi-so-post1419513.tpo
Hệ thống Kho bạc Nhà nước góp phần xây dựng Chính phủ số,https://tienphong.vn/he-thong-kho-bac-nha-nuoc-gop-phan-xay-dung-chinh-phu-so-post1434759.tpo
CSGT Hà Nội thông tin về 9 bước nộp phạt qua mạng tại nhà từ ngày mai,https://tienphong.vn/csgt-ha-noi-thong-tin-ve-9-buoc-nop-phat-qua-mang-tai-nha-tu-ngay-mai-post1419573.tpo
"Cần Thơ, Đà Nẵng khởi động Tháng Thanh niên với nhiều hoạt động ý nghĩa ",https://tienphong.vn/can-tho-da-nang-khoi-dong-thang-thanh-nien-voi-nhieu-hoat-dong-y-nghia-post1419369.tpo
Chansung (2PM) gây tranh cãi lớn vì chia sẻ niềm vui khi chuẩn bị cho đám cưới,https://tienphong.vn/chansung-2pm-gay-tranh-cai-lon-vi-chia-se-niem-vui-khi-chuan-bi-cho-dam-cuoi-post1419242.tpo
"7 loại giấy tờ quan trọng sẽ được thay bằng dữ liệu điện tử, bạn đã cập nhật mới chưa?",https://tienphong.vn/7-loai-giay-to-quan-trong-se-duoc-thay-bang-du-lieu-dien-tu-ban-da-cap-nhat-moi-chua-post1417963.tpo
Thẻ Hưu trí – Giải pháp hữu hiệu cho người cao tuổi trong mùa dịch bệnh,https://tienphong.vn/the-huu-tri-giai-phap-huu-hieu-cho-nguoi-cao-tuoi-trong-mua-dich-benh-post1418339.tpo
"Nhập tịch cả một đội hình, Trung Quốc vẫn thua tan tác ở Olympic",https://tienphong.vn/nhap-tich-ca-mot-doi-hinh-trung-quoc-van-thua-tan-tac-o-olympic-post1416916.tpo
"Giải mã giá trị thương hiệu Viettel đạt gần 9 tỷ USD, vượt Spotify, Qualcomm",https://tienphong.vn/giai-ma-gia-tri-thuong-hieu-viettel-dat-gan-9-ty-usd-vuot-spotify-qualcomm-post1416649.tpo
Ông Tào Đức Thắng chính thức làm Chủ tịch kiêm Tổng giám đốc Viettel,https://tienphong.vn/ong-tao-duc-thang-chinh-thuc-lam-chu-tich-kiem-tong-giam-doc-viettel-post1414922.tpo
"Thủ tướng Phạm Minh Chính: 'Đi từng ngõ, gõ từng nhà, rà từng người để không ai thiếu Tết'",https://tienphong.vn/thu-tuong-pham-minh-chinh-di-tung-ngo-go-tung-nha-ra-tung-nguoi-de-khong-ai-thieu-tet-post1413515.tpo
"Diễm My 9X bị người lạ giật micro khóc lóc tại sự kiện, netizen: ""Bớt chiêu trò giùm đi!""",https://tienphong.vn/diem-my-9x-bi-nguoi-la-giat-micro-khoc-loc-tai-su-kien-netizen-bot-chieu-tro-gium-di-post1412653.tpo
Nỗ lực vượt qua khó khăn hoàn thành kế hoạch 2021,https://tienphong.vn/no-luc-vuot-qua-kho-khan-hoan-thanh-ke-hoach-2021-post1407962.tpo
Kiều bào tại TPHCM xúc động trước hình ảnh lãnh đạo Trung ương xông pha vào tâm dịch,https://tienphong.vn/kieu-bao-tai-tphcm-xuc-dong-truoc-hinh-anh-lanh-dao-trung-uong-xong-pha-vao-tam-dich-post1412356.tpo
Thêm hơn 4000 học sinh nhận máy tính bảng và tài khoản MobiEdu,https://tienphong.vn/them-hon-4000-hoc-sinh-nhan-may-tinh-bang-va-tai-khoan-mobiedu-post1412285.tpo
Thanh Hóa: Hướng tới mục tiêu trở thành cực tăng trưởng mới,https://tienphong.vn/thanh-hoa-huong-toi-muc-tieu-tro-thanh-cuc-tang-truong-moi-post1412201.tpo
Cải cách tư pháp nhằm xây dựng và hoàn thiện Nhà nước pháp quyền ,https://tienphong.vn/cai-cach-tu-phap-nham-xay-dung-va-hoan-thien-nha-nuoc-phap-quyen-post1410265.tpo
Sự kiện nổi bật của Kho bạc Nhà nước năm 2021,https://tienphong.vn/su-kien-noi-bat-cua-kho-bac-nha-nuoc-nam-2021-post1434770.tpo
Công bố quyết định nhân sự ở Bộ Thông tin và Truyền thông,https://tienphong.vn/cong-bo-quyet-dinh-nhan-su-o-bo-thong-tin-va-truyen-thong-post1408647.tpo
Người khó khăn ở TP.HCM sẽ được hỗ trợ mua điện thoại thông minh để thúc đẩy chuyển đổi số,https://tienphong.vn/nguoi-kho-khan-o-tphcm-se-duoc-ho-tro-mua-dien-thoai-thong-minh-de-thuc-day-chuyen-doi-so-post1408454.tpo
Đề xuất hỗ trợ điện thoại thông minh cho người nghèo ở TPHCM,https://tienphong.vn/de-xuat-ho-tro-dien-thoai-thong-minh-cho-nguoi-ngheo-o-tphcm-post1407983.tpo
Xử lý nghiêm vi phạm tập trung đông người,https://tienphong.vn/xu-ly-nghiem-vi-pham-tap-trung-dong-nguoi-post1407310.tpo
Toàn văn phát biểu của Tổng Bí thư tại Hội nghị Chính phủ với các địa phương,https://tienphong.vn/toan-van-phat-bieu-cua-tong-bi-thu-tai-hoi-nghi-chinh-phu-voi-cac-dia-phuong-post1407215.tpo
"Xây dựng cán bộ CAND: 'Có trái tim nóng, cái đầu lạnh, đôi chân vững chắc, bàn tay sạch' ",https://tienphong.vn/xay-dung-can-bo-cand-co-trai-tim-nong-cai-dau-lanh-doi-chan-vung-chac-ban-tay-sach-post1404882.tpo
"Năm 2021, VNPT hoàn thành ‘mục tiêu kép’ với nhiều dấu ấn",https://tienphong.vn/nam-2021-vnpt-hoan-thanh-muc-tieu-kep-voi-nhieu-dau-an-post1404115.tpo
Vĩnh Phúc ưu tiên triển khai kế hoạch chuyển đổi số năm 2022,https://tienphong.vn/vinh-phuc-uu-tien-trien-khai-ke-hoach-chuyen-doi-so-nam-2022-post1404109.tpo
10 sự kiện nổi bật năm 2021,https://tienphong.vn/10-su-kien-noi-bat-nam-2021-post1403638.tpo
"Đoàn thanh niên xứng đáng là lực lượng tiên phong, cánh tay đắc lực và là niềm tin của Đảng",https://tienphong.vn/doan-thanh-nien-xung-dang-la-luc-luong-tien-phong-canh-tay-dac-luc-va-la-niem-tin-cua-dang-post1402936.tpo
MobiFone tự tin tham gia xây dựng nền tảng chuyển đổi số quốc gia,https://tienphong.vn/mobifone-tu-tin-tham-gia-xay-dung-nen-tang-chuyen-doi-so-quoc-gia-post1402074.tpo
"Tổng Bí thư gợi mở, nhấn mạnh 6 vấn đề của đối ngoại ",https://tienphong.vn/tong-bi-thu-goi-mo-nhan-manh-6-van-de-cua-doi-ngoai-post1401253.tpo
Lộ diện những chủ nhân giải thưởng Diễn đàn Quốc gia Doanh nghiệp Công nghệ số,https://tienphong.vn/lo-dien-nhung-chu-nhan-giai-thuong-dien-dan-quoc-gia-doanh-nghiep-cong-nghe-so-post1400466.tpo
MobiFone nổi bật tại Diễn đàn Quốc gia phát triển doanh nghiệp công nghệ số lần thứ III,https://tienphong.vn/mobifone-noi-bat-tai-dien-dan-quoc-gia-phat-trien-doanh-nghiep-cong-nghe-so-lan-thu-iii-post1400828.tpo
Meey Land nhận giải thưởng DN Chuyển đổi số xuất sắc tại Vietnam Digital Awards 2021,https://tienphong.vn/meey-land-nhan-giai-thuong-dn-chuyen-doi-so-xuat-sac-tai-vietnam-digital-awards-2021-post1400395.tpo
'Chiến tranh nhân dân' và chuyển đổi số sẽ giúp chiến thắng COVID-19,https://tienphong.vn/chien-tranh-nhan-dan-va-chuyen-doi-so-se-giup-chien-thang-covid-19-post1398607.tpo
EVN làm đường dây trị giá 588 tỷ đồng để mua điện từ Lào,https://tienphong.vn/evn-lam-duong-day-tri-gia-588-ty-dong-de-mua-dien-tu-lao-post1397083.tpo
MobiFone eOffice – Bộ giải pháp số hóa văn phòng toàn diện,https://tienphong.vn/mobifone-eoffice-bo-giai-phap-so-hoa-van-phong-toan-dien-post1396104.tpo
VNPT trở thành nhà cung cấp dịch vụ Mobile Money đầu tiên tại Việt Nam,https://tienphong.vn/vnpt-tro-thanh-nha-cung-cap-dich-vu-mobile-money-dau-tien-tai-viet-nam-post1395897.tpo
"Vĩnh Phúc có sóng 5G, đẩy nhanh số hóa chính quyền điện tử",https://tienphong.vn/vinh-phuc-co-song-5g-day-nhanh-so-hoa-chinh-quyen-dien-tu-post1395851.tpo
Toàn văn tuyên bố chung Việt Nam – Nhật Bản,https://tienphong.vn/toan-van-tuyen-bo-chung-viet-nam-nhat-ban-post1395716.tpo
 Tổng Bí thư Nguyễn Phú Trọng: Văn hoá còn thì Dân tộc còn,https://tienphong.vn/tong-bi-thu-nguyen-phu-trong-van-hoa-con-thi-dan-toc-con-post1395683.tpo
"Báo chí Thái Lan khảo sát CĐV nhà: Chẳng ngại gì, ngại mỗi đội tuyển Việt Nam",https://tienphong.vn/bao-chi-thai-lan-khao-sat-cdv-nha-chang-ngai-gi-ngai-moi-doi-tuyen-viet-nam-post1395602.tpo
"Thủ tướng: Hiện đại hóa lĩnh vực tài chính, ngân hàng để đi đầu trong chuyển đổi số",https://tienphong.vn/thu-tuong-hien-dai-hoa-linh-vuc-tai-chinh-ngan-hang-de-di-dau-trong-chuyen-doi-so-post1395520.tpo
Trường hợp nào đổi Chứng minh nhân dân sang Căn cước công dân gắn chip được giữ nguyên số?,https://tienphong.vn/truong-hop-nao-doi-chung-minh-nhan-dan-sang-can-cuoc-cong-dan-gan-chip-duoc-giu-nguyen-so-post1395027.tpo
Giáo dục thông minh đến đâu vẫn cần những người thầy tâm tuệ,https://tienphong.vn/giao-duc-thong-minh-den-dau-van-can-nhung-nguoi-thay-tam-tue-post1394658.tpo
Lấy lại mật khẩu ứng dụng VssID miễn phí qua thư điện tử,https://tienphong.vn/lay-lai-mat-khau-ung-dung-vssid-mien-phi-qua-thu-dien-tu-post1392258.tpo
MobiFone chính thức được cấp phép kinh doanh dịch vụ chứng thực chữ ký số công cộng,https://tienphong.vn/mobifone-chinh-thuc-duoc-cap-phep-kinh-doanh-dich-vu-chung-thuc-chu-ky-so-cong-cong-post1392452.tpo
Công an xã chính quy góp phần tạo nên kỳ tích trong chiến dịch làm căn cước công dân,https://tienphong.vn/cong-an-xa-chinh-quy-gop-phan-tao-nen-ky-tich-trong-chien-dich-lam-can-cuoc-cong-dan-post1392080.tpo
Kỹ năng cho gia đình trẻ ứng phó trong cuộc sống bình thường mới,https://tienphong.vn/ky-nang-cho-gia-dinh-tre-ung-pho-trong-cuoc-song-binh-thuong-moi-post1391183.tpo
Cách lấy lại mật khẩu đăng nhập ứng dụng VssID,https://tienphong.vn/cach-lay-lai-mat-khau-dang-nhap-ung-dung-vssid-post1391080.tpo
"Bí thư Thành ủy Hà Nội: ‘Cam kết bảo vệ quyền, lợi ích chính đáng của doanh nghiệp’",https://tienphong.vn/bi-thu-thanh-uy-ha-noi-cam-ket-bao-ve-quyen-loi-ich-chinh-dang-cua-doanh-nghiep-post1390919.tpo
VNPT và Babylon hợp tác trong lĩnh vực y tế số ,https://tienphong.vn/vnpt-va-babylon-hop-tac-trong-linh-vuc-y-te-so-post1390286.tpo
Vinamilk ủng hộ 10 tỷ đồng và góp 1 triệu ly sữa cho trẻ em có hoàn cảnh khó khăn,https://tienphong.vn/vinamilk-ung-ho-10-ty-dong-va-gop-1-trieu-ly-sua-cho-tre-em-co-hoan-canh-kho-khan-post1386841.tpo
"Đại học Bách khoa Hà Nội thành lập 3 trường trực thuộc, mở rộng nhiều cơ hội cho thí sinh",https://tienphong.vn/dai-hoc-bach-khoa-ha-noi-thanh-lap-3-truong-truc-thuoc-mo-rong-nhieu-co-hoi-cho-thi-sinh-post1384903.tpo
Viettel được công nhận là thương hiệu hàng đầu của Việt Nam,https://tienphong.vn/viettel-duoc-cong-nhan-la-thuong-hieu-hang-dau-cua-viet-nam-post1384789.tpo
Mobifone được vinh danh top 10 ngành dịch vụ số - bán lẻ ,https://tienphong.vn/mobifone-duoc-vinh-danh-top-10-nganh-dich-vu-so-ban-le-post1384490.tpo
Việt Nam phấn đấu đưa kinh tế số chiếm trên 20% tỷ trọng GDP vào năm 2025 ,https://tienphong.vn/viet-nam-phan-dau-dua-kinh-te-so-chiem-tren-20-ty-trong-gdp-vao-nam-2025-post1384388.tpo
Chuyện chưa kể về sàn thương mại điện tử thuần Việt ,https://tienphong.vn/chuyen-chua-ke-ve-san-thuong-mai-dien-tu-thuan-viet-post1383530.tpo
"BIDV chung tay cùng nhiều tỉnh, thành vượt qua COVID-19",https://tienphong.vn/bidv-chung-tay-cung-nhieu-tinh-thanh-vuot-qua-covid-19-post1383823.tpo
Chuyển đổi số doanh nghiệp toàn diện với gói giải pháp MobiFone Smart Office,https://tienphong.vn/chuyen-doi-so-doanh-nghiep-toan-dien-voi-goi-giai-phap-mobifone-smart-office-post1383095.tpo
Tuyển sinh đại học 2021: Ðua nhau tuyển vượt chỉ tiêu ,https://tienphong.vn/tuyen-sinh-dai-hoc-2021-dua-nhau-tuyen-vuot-chi-tieu-post1382151.tpo
"Xác định rõ chủ trương về phòng, chống dịch và phục hồi kinh tế trong tình hình mới ",https://tienphong.vn/xac-dinh-ro-chu-truong-ve-phong-chong-dich-va-phuc-hoi-kinh-te-trong-tinh-hinh-moi-post1382031.tpo
Cán bộ đoàn được tiếp động lực khi có định hướng đầu ra,https://tienphong.vn/can-bo-doan-duoc-tiep-dong-luc-khi-co-dinh-huong-dau-ra-post1381347.tpo
"Gói hỗ trợ 30 nghìn tỷ đồng, người lao động có thể nhận tiền sau 10 ngày nộp hồ sơ",https://tienphong.vn/goi-ho-tro-30-nghin-ty-dong-nguoi-lao-dong-co-the-nhan-tien-sau-10-ngay-nop-ho-so-post1381353.tpo
MobiFone mang sóng 4G đến với học sinh biển đảo miền Trung,https://tienphong.vn/mobifone-mang-song-4g-den-voi-hoc-sinh-bien-dao-mien-trung-post1380970.tpo
"Đức hỗ trợ bổ sung 2,6 triệu liều vắc-xin cho Việt Nam",https://tienphong.vn/duc-ho-tro-bo-sung-26-trieu-lieu-vac-xin-cho-viet-nam-post1380128.tpo
Hình ảnh dân Hà Nội đổ xô làm thủ tục nhà đất ngày đầu nới giãn cách,https://tienphong.vn/hinh-anh-dan-ha-noi-do-xo-lam-thu-tuc-nha-dat-ngay-dau-noi-gian-cach-post1378290.tpo
Huế làm gì để phục hồi du lịch sau đại dịch?,https://tienphong.vn/hue-lam-gi-de-phuc-hoi-du-lich-sau-dai-dich-post1377321.tpo
"TPHCM cần thêm gần 1,9 triệu liều vắc xin COVID-19 đến cuối tháng 9 ",https://tienphong.vn/tphcm-can-them-gan-19-trieu-lieu-vac-xin-covid-19-den-cuoi-thang-9-post1377185.tpo
Mất 2 năm doanh nghiệp thủy sản mới có thể phục hồi sản xuất?,https://tienphong.vn/mat-2-nam-doanh-nghiep-thuy-san-moi-co-the-phuc-hoi-san-xuat-post1377070.tpo
"Thủ tướng Phạm Minh Chính: 'VUSTA phát huy tốt vai trò hạt nhân tư vấn, phản biện...'",https://tienphong.vn/thu-tuong-pham-minh-chinh-vusta-phat-huy-tot-vai-tro-hat-nhan-tu-van-phan-bien-post1376524.tpo
BIDV ủng hộ 25 tỷ đồng chung tay thực hiện chương trình ‘Sóng và máy tính cho em’,https://tienphong.vn/bidv-ung-ho-25-ty-dong-chung-tay-thuc-hien-chuong-trinh-song-va-may-tinh-cho-em-post1376393.tpo
"EVN ủng hộ 24.000 máy tính cho chương trình ""Sóng và máy tính cho em"" ",https://tienphong.vn/evn-ung-ho-24000-may-tinh-cho-chuong-trinh-song-va-may-tinh-cho-em-post1375691.tpo
"Chương trình ""Sóng và máy tính cho em"": Không để bất cứ học sinh nào bị bỏ lại phía sau",https://tienphong.vn/chuong-trinh-song-va-may-tinh-cho-em-khong-de-bat-cu-hoc-sinh-nao-bi-bo-lai-phia-sau-post1375525.tpo
Bộ trưởng Nguyễn Mạnh Hùng chia sẻ về chương trình 'Sóng và máy tính cho em',https://tienphong.vn/bo-truong-nguyen-manh-hung-chia-se-ve-chuong-trinh-song-va-may-tinh-cho-em-post1375522.tpo
Ủng hộ hơn 1 triệu máy tính trong chương trình 'Sóng và máy tính cho em',https://tienphong.vn/ung-ho-hon-1-trieu-may-tinh-trong-chuong-trinh-song-va-may-tinh-cho-em-post1375465.tpo
Số ca tử vong giảm sâu nhưng nhiều F0 chưa nhận được thuốc,https://tienphong.vn/so-ca-tu-vong-giam-sau-nhung-nhieu-f0-chua-nhan-duoc-thuoc-post1375145.tpo
"Hà Nội ra sao sau 50 ngày giãn cách phòng, chống dịch?",https://tienphong.vn/ha-noi-ra-sao-sau-50-ngay-gian-cach-phong-chong-dich-post1374973.tpo
Việt Nam đề nghị đẩy nhanh tiến trình liên kết kinh tế ASEAN – Trung Quốc,https://tienphong.vn/viet-nam-de-nghi-day-nhanh-tien-trinh-lien-ket-kinh-te-asean-trung-quoc-post1374831.tpo
Chân dung Thứ trưởng 8X làm Phó chủ tịch Hội LHTN Việt Nam,https://tienphong.vn/chan-dung-thu-truong-8x-lam-pho-chu-tich-hoi-lhtn-viet-nam-post1374460.tpo
"Báo Tiền Phong phát động chương trình ""Máy tính cho em"" hỗ trợ học sinh hoàn cảnh khó khăn",https://tienphong.vn/bao-tien-phong-phat-dong-chuong-trinh-may-tinh-cho-em-ho-tro-hoc-sinh-hoan-canh-kho-khan-post1374407.tpo
Báo Tiền Phong phát động chương trình 'Máy tính cho em',https://tienphong.vn/bao-tien-phong-phat-dong-chuong-trinh-may-tinh-cho-em-post1374305.tpo
Giấy đi đường không chạm ,https://tienphong.vn/giay-di-duong-khong-cham-post1374241.tpo
"Hà Nội duyệt mục tiêu đứng top 3 công nghệ, chuyển đổi số năm 2030",https://tienphong.vn/ha-noi-duyet-muc-tieu-dung-top-3-cong-nghe-chuyen-doi-so-nam-2030-post1374113.tpo
Không đảm bảo đường truyền học trực tuyến: Bộ GD&ĐT 'cầu cứu' Bộ TT&TT,https://tienphong.vn/khong-dam-bao-duong-truyen-hoc-truc-tuyen-bo-gddt-cau-cuu-bo-tttt-post1373963.tpo
"Thủ tướng yêu cầu Bộ Quốc phòng, cùng 10 địa phương sẵn sàng hỗ trợ Hà Nội chống dịch",https://tienphong.vn/thu-tuong-yeu-cau-bo-quoc-phong-cung-10-dia-phuong-san-sang-ho-tro-ha-noi-chong-dich-post1373844.tpo
Chỉ 30-40% doanh nghiệp thuỷ sản đủ năng lực phục hồi sản xuất sau giãn cách,https://tienphong.vn/chi-30-40-doanh-nghiep-thuy-san-du-nang-luc-phuc-hoi-san-xuat-sau-gian-cach-post1373274.tpo
Phát hiện bị nợ Bảo hiểm xã hội qua ứng dụng VssID,https://tienphong.vn/phat-hien-bi-no-bao-hiem-xa-hoi-qua-ung-dung-vssid-post1371554.tpo
"TPHCM: Tập trung thực hiện giảm tử vong, chặn nguy cơ lây nhiễm",https://tienphong.vn/tphcm-tap-trung-thuc-hien-giam-tu-vong-chan-nguy-co-lay-nhiem-post1371267.tpo
Chủ tịch Quốc hội: Cơ sở dữ liệu quốc gia về dân cư là tài sản quốc gia,https://tienphong.vn/chu-tich-quoc-hoi-co-so-du-lieu-quoc-gia-ve-dan-cu-la-tai-san-quoc-gia-post1370317.tpo
Sáng 27/8 Nghệ An thêm 24 ca dương tính SARS-CoV-2,https://tienphong.vn/sang-278-nghe-an-them-24-ca-duong-tinh-sars-cov-2-post1370061.tpo
F0 mới phát hiện sẽ tăng cao những ngày tới,https://tienphong.vn/f0-moi-phat-hien-se-tang-cao-nhung-ngay-toi-post1368980.tpo
"Ngày đầu TPHCM siết chặt giãn cách, giảm 85% phương tiện ra đường",https://tienphong.vn/ngay-dau-tphcm-siet-chat-gian-cach-giam-85-phuong-tien-ra-duong-post1368803.tpo
"Tổng Bí thư: Danh dự mới là điều thiêng liêng, cao quý nhất!",https://tienphong.vn/tong-bi-thu-danh-du-moi-la-dieu-thieng-lieng-cao-quy-nhat-post1364853.tpo
VNPT cùng Lào Cai thúc đẩy Chính quyền điện tử và chuyển đổi số ,https://tienphong.vn/vnpt-cung-lao-cai-thuc-day-chinh-quyen-dien-tu-va-chuyen-doi-so-post1363119.tpo
Giám đốc ĐHQG TP. HCM: Mỗi sinh viên hãy nêu cao ý thức phòng dịch COVID-19,https://tienphong.vn/giam-doc-dhqg-tp-hcm-moi-sinh-vien-hay-neu-cao-y-thuc-phong-dich-covid-19-post1360148.tpo
Bình Thuận triệt phá đường dây làm giấy tờ giả 'khủng',https://tienphong.vn/binh-thuan-triet-pha-duong-day-lam-giay-to-gia-khung-post1358165.tpo
"Các chiến sĩ CSGT, cơ động không quản nắng mưa ngày đêm bám chốt kiểm dịch",https://tienphong.vn/cac-chien-si-csgt-co-dong-khong-quan-nang-mua-ngay-dem-bam-chot-kiem-dich-post1357343.tpo
"Thăm hỏi, tặng quà cho thương bệnh binh, người có công ở Thanh Hóa",https://tienphong.vn/tham-hoi-tang-qua-cho-thuong-benh-binh-nguoi-co-cong-o-thanh-hoa-post1356624.tpo
"Bình Dương dự kiến cách ly toàn xã hội, chỉ cho phép doanh nghiệp ‘3 tại chỗ’ hoạt động",https://tienphong.vn/binh-duong-du-kien-cach-ly-toan-xa-hoi-chi-cho-phep-doanh-nghiep-3-tai-cho-hoat-dong-post1356257.tpo
Xin 'rút' sau 3 ngày làm giám đốc Bệnh viện Hồi sức COVID-19 lớn nhất TPHCM,https://tienphong.vn/xin-rut-sau-3-ngay-lam-giam-doc-benh-vien-hoi-suc-covid-19-lon-nhat-tphcm-post1356047.tpo
"Nhiều công nhân mắc COVID-19 khi 'vừa cách ly, vừa sản xuất'",https://tienphong.vn/nhieu-cong-nhan-mac-covid-19-khi-vua-cach-ly-vua-san-xuat-post1355793.tpo
"Nếu không giảm số ca mắc và tử vong do COVID-19, TPHCM phải tiếp tục giãn cách",https://tienphong.vn/neu-khong-giam-so-ca-mac-va-tu-vong-do-covid-19-tphcm-phai-tiep-tuc-gian-cach-post1355805.tpo
TPHCM cân nhắc mở chợ giữa đường cung cấp thực phẩm cho dân,https://tienphong.vn/tphcm-can-nhac-mo-cho-giua-duong-cung-cap-thuc-pham-cho-dan-post1355761.tpo
"Sau 1 tuần cách ly xã hội, số ca mắc COVID-19 ở TPHCM chưa có biểu hiện giảm",https://tienphong.vn/sau-1-tuan-cach-ly-xa-hoi-so-ca-mac-covid-19-o-tphcm-chua-co-bieu-hien-giam-post1355749.tpo
Công bố Báo cáo tổng quan nông nghiệp số Việt Nam 2021,https://tienphong.vn/cong-bo-bao-cao-tong-quan-nong-nghiep-so-viet-nam-2021-post1354531.tpo
Tổng Bí thư: Giới thiệu nhân sự lãnh đạo các cơ quan Nhà nước là việc rất hệ trọng,https://tienphong.vn/tong-bi-thu-gioi-thieu-nhan-su-lanh-dao-cac-co-quan-nha-nuoc-la-viec-rat-he-trong-post1352288.tpo
Giám đốc Công an tỉnh Bắc Giang công bố đường dây nóng hỗ trợ doanh nghiệp,https://tienphong.vn/giam-doc-cong-an-tinh-bac-giang-cong-bo-duong-day-nong-ho-tro-doanh-nghiep-post1349617.tpo
CẬP NHẬT DỊCH NGÀY 25/6: TPHCM thêm 19 ca mắc mới COVID-19 tại một chợ đầu mối,https://tienphong.vn/cap-nhat-dich-ngay-256-tphcm-them-19-ca-mac-moi-covid-19-tai-mot-cho-dau-moi-post1349158.tpo
Bà Nguyễn Thị Lệ tái đắc cử Chủ tịch HĐND TPHCM khóa X ,https://tienphong.vn/ba-nguyen-thi-le-tai-dac-cu-chu-tich-hdnd-tphcm-khoa-x-post1348849.tpo
Hành trình thần tốc xây dựng Cơ sở dữ liệu Quốc gia về dân cư,https://tienphong.vn/hanh-trinh-than-toc-xay-dung-co-so-du-lieu-quoc-gia-ve-dan-cu-post1348858.tpo
