Title,URL
"Người trẻ ngày càng lệ thuộc vào smartphone ?: Là điều tất yếu, tuy nhiên…",/nguoi-tre-ngay-cang-le-thuoc-vao-smartphone-la-dieu-tat-yeu-tuy-nhien-185230919213545295.htm
Agency Truyền thông đa phương tiện giúp doanh nghiệp bạn kết nối khách hàng tiềm năng,/agency-truyen-thong-da-phuong-tien-giup-doanh-nghiep-ban-ket-noi-khach-hang-tiem-nang-185230918101847874.htm
Không kiểm tra miệng có đúng quy định?,/khong-kiem-tra-mieng-co-dung-quy-dinh-185230917131538009.htm
Việt Nam sẽ trở thành quốc gia số,/viet-nam-se-tro-thanh-quoc-gia-so-185230825155258263.htm
Hồng Kông gọi blockchain là 'bước đột phá',/hong-kong-goi-blockchain-la-buoc-dot-pha-185230830135804512.htm
Nối nghiệp gia đình: Thu nhập khấm khá từ nghề viết liễn,/noi-nghiep-gia-dinh-thu-nhap-kham-kha-tu-nghe-viet-lien-18523082219503489.htm
'Tòa soạn số' trở thành xu thế tất yếu của các cơ quan báo chí,/toa-soan-so-tro-thanh-xu-the-tat-yeu-cua-cac-co-quan-bao-chi-185230817161508021.htm
Công nghệ số 'phủ sóng' bảo tàng,/cong-nghe-so-phu-song-bao-tang-185230815200642818.htm
Đơn vị tiên phong xây dựng phần mềm quản lý hoạt động Đoàn,/don-vi-tien-phong-xay-dung-phan-mem-quan-ly-hoat-dong-doan-185230814164951219.htm
Chuyển đổi số báo chí coi độc giả là trung tâm,/chuyen-doi-so-bao-chi-coi-doc-gia-la-trung-tam-185230811183256658.htm
Nhiều giải thưởng hấp dẫn tại Hội thi Bí thư Đoàn cơ sở giỏi toàn quốc,/nhieu-giai-thuong-hap-dan-tai-hoi-thi-bi-thu-doan-co-so-gioi-toan-quoc-185230807143518304.htm
Trường ĐH Tây Đô triển khai trường học thông minh,/truong-dh-tay-do-trien-khai-truong-hoc-thong-minh-185230719205356447.htm
BAOVIET GO ra mắt Bảo hiểm xe ô tô ứng dụng công nghệ số ,/baoviet-go-ra-mat-bao-hiem-xe-o-to-ung-dung-cong-nghe-so-185230719182401135.htm
Phát động giải thưởng 'Sản phẩm công nghệ số Make in Viet Nam' năm 2023,/phat-dong-giai-thuong-san-pham-cong-nghe-so-make-in-viet-nam-nam-2023-185230712113527806.htm
Ứng dụng công nghệ số để xây dựng nông thôn mới,/ung-dung-cong-nghe-so-de-xay-dung-nong-thon-moi-185230710120529988.htm
"Thành ""nhà thông thái"" trong tiết kiệm điện bằng những thiết bị thông minh thời đại 4.0",/thanh-nha-thong-thai-trong-tiet-kiem-dien-bang-nhung-thiet-bi-thong-minh-thoi-dai-40-185230707163210194.htm
Triển lãm Biztech Việt Nam 2023 thúc đẩy chuyển đổi số,/trien-lam-biztech-viet-nam-2023-thuc-day-chuyen-doi-so-185230707161559472.htm
Công nghệ số hóa và đám mây: Yếu tố cốt lõi cho bản sắc Techcombank,/cong-nghe-so-hoa-va-dam-may-yeu-to-cot-loi-cho-ban-sac-techcombank-18523070715114626.htm
"Trường Đại học Phenikaa mở ngành Kỹ thuật phần mềm, đáp ứng nhu cầu công nghệ số",/truong-dai-hoc-phenikaa-mo-nganh-ky-thuat-phan-mem-dap-ung-nhu-cau-cong-nghe-so-185230703172700309.htm
"Xu hướng mới trong lĩnh vực tài chính, kế toán, kiểm toán thời công nghệ số",/xu-huong-moi-trong-linh-vuc-tai-chinh-ke-toan-kiem-toan-thoi-cong-nghe-so-1852307011551563.htm
Ông Nguyễn Văn Thể: ‘Bí thư Đoàn phải là những người đi trước trong chuyển đổi số’,/ong-nguyen-van-the-bi-thu-doan-phai-la-nhung-nguoi-di-truoc-trong-chuyen-doi-so-185230628143810449.htm
"Nhà báo phải đặt lợi ích của Tổ quốc, danh dự của cá nhân lên từng trang viết",/nha-bao-phai-dat-loi-ich-cua-to-quoc-danh-du-cua-ca-nhan-len-tung-trang-viet-185230621214641975.htm
Tác nghiệp thời số hóa,/tac-nghiep-thoi-so-hoa-185230618091342985.htm
Schneider Electric cam kết phát triển năng lượng bền vững,/schneider-electric-cam-ket-phat-trien-nang-luong-ben-vung-185230620130343266.htm
Chuyển đổi số: Chính sách chưa theo kịp thực tiễn,/chuyen-doi-so-chinh-sach-chua-theo-kip-thuc-tien-185230619075806862.htm
"Tìm con đường riêng của Việt Nam để công nghiệp hóa, hiện đại hóa",/tim-con-duong-rieng-cua-viet-nam-de-cong-nghiep-hoa-hien-dai-hoa-185230615010234804.htm
"Đồng loạt triển khai 75 công trình, phần việc thanh niên",/dong-loat-trien-khai-75-cong-trinh-phan-viec-thanh-nien-185230603161241191.htm
Ứng dụng công nghệ số trong các hoạt động tình nguyện hè,/ung-dung-cong-nghe-so-trong-cac-hoat-dong-tinh-nguyen-he-185230601100226831.htm
Cấp mới tên miền gắn liền chuyển đổi số từ ngày 1.6,/cap-moi-ten-mien-gan-lien-chuyen-doi-so-tu-ngay-16-185230531125422186.htm
Meey Map: Nền tảng bản đồ tra cứu quy hoạch đạt ‘TOP Công nghiệp 4.0 Việt Nam’,/tien-phong-chuyen-doi-so-cmcn-40-meey-land-tiep-tuc-chinh-phuc-i40-awards-185230528072954926.htm
PVcomBank tiên phong ứng dụng cơ sở dữ liệu quốc gia về dân cư,/pvcombank-tien-phong-ung-dung-co-so-du-lieu-quoc-gia-ve-dan-cu-185230527121856478.htm
Giải pháp nâng cao năng lực số cho thanh niên,/giai-phap-nang-cao-nang-luc-so-cho-thanh-nien-18523052016083405.htm
Gỡ khó cho nhân lực chuyển đổi số,/go-kho-cho-nhan-luc-chuyen-doi-so-185230515111045065.htm
Doanh nghiệp tại Việt Nam thích nghi nhanh với xu hướng chuyển đổi số,/doanh-nghiep-tai-viet-nam-thich-nghi-nhanh-voi-xu-huong-chuyen-doi-so-185230515113544639.htm
Đà Nẵng chủ động giải 'bài toán' nhân lực chuyển đổi số,/da-nang-chu-dong-giai-bai-toan-nhan-luc-chuyen-doi-so-185230510075629209.htm
Nhân lực chuyển đổi số chưa đáp ứng 50% nhu cầu,/nhan-luc-chuyen-doi-so-chua-dap-ung-50-nhu-cau-185230507002734074.htm
MoMo nhận giải thưởng Top 10 Sao Khuê 2023 với Ví Trả Sau,/momo-nhan-giai-thuong-top-10-sao-khue-2023-voi-vi-tra-sau-185230505131949193.htm
Đào tạo nhân lực để chuyển đổi số hiệu quả,/dao-tao-nhan-luc-de-chuyen-doi-so-hieu-qua-185230414164956313.htm
MobiFone - 30 năm hành trình và giá trị tiên phong trong lĩnh vực công nghệ Việt,/mobifone-30-nam-hanh-trinh-va-gia-tri-tien-phong-trong-linh-vuc-cong-nghe-viet-185230412110254418.htm
EVNHANOI ứng dụng công nghệ số trong việc chăm sóc khách hàng,/evnhanoi-ung-dung-cong-nghe-so-trong-viec-cham-soc-khach-hang-185230410155245951.htm
10.000 sinh viên được tham gia mô hình giáo dục đại học số,/10000-sinh-vien-duoc-tham-gia-mo-hinh-giao-duc-dai-hoc-so-185230325164130141.htm
"Thời đại số là cơ hội, thách thức với các đoàn viên",/thoi-dai-so-la-co-hoi-thach-thuc-voi-cac-doan-vien-185230325153209722.htm
Chủ tịch UBND tỉnh Bình Định đối thoại với thanh niên,/chu-tich-ubnd-tinh-binh-dinh-doi-thoai-voi-thanh-nien-185230325123208144.htm
Chinh phục khách hàng số từ những ‘điểm chạm’ khác biệt,/chinh-phuc-khach-hang-so-tu-nhung-diem-cham-khac-biet-185230323164529907.htm
Bình Định và Viettel hợp tác chuyển đổi số,/binh-dinh-va-viettel-hop-tac-chuyen-doi-so-185230322191018737.htm
Meey Land được công nhận là doanh nghiệp KHCN với nhiều sản phẩm đột phá,/meey-land-duoc-cong-nhan-la-doanh-nghiep-khcn-voi-nhieu-san-pham-dot-pha-185230320110345296.htm
BEST Express nhận giải Rồng Vàng 2023,/best-express-nhan-giai-rong-vang-2023-185230320071902393.htm
Gofiber - Ngôi sao sáng trong ngành cho thuê hosting,/gofiber-ngoi-sao-sang-trong-nganh-cho-thue-hosting-185230316123240001.htm
Gen Z biết gì về chủ đề Tháng Thanh niên 2023?,/gen-z-biet-gi-ve-chu-de-thang-thanh-nien-2023-185230314133747737.htm
Đọc 'chiến lược 5T' dưới đây để thoát khỏi việc lướt TikTok quên cả thời gian,/doc-chien-luoc-5t-duoi-day-de-thoat-khoi-viec-luot-tiktok-quen-ca-thoi-gian-185230314085028411.htm
Thanh niên phủ sóng chuyển đổi số,/thanh-nien-phu-song-chuyen-doi-so-185230313000347632.htm
VinaPhone 5G giới thiệu trải nghiệm công nghệ cao tại Lễ hội cà phê Buôn Ma Thuột,/vinaphone-5g-gioi-thieu-trai-nghiem-cong-nghe-cao-tai-le-hoi-ca-phe-buon-ma-thuot-18523031110191977.htm
Lợi thế của nữ lãnh đạo trong dòng chảy công nghệ số,/loi-the-cua-nu-lanh-dao-trong-dong-chay-cong-nghe-so-18523030917184822.htm
Tháng Thanh niên năm 2023: 'Tuổi trẻ tiên phong chuyển đổi số',/thang-thanh-nien-nam-2023-tuoi-tre-tien-phong-chuyen-doi-so-185230224230247827.htm
Hỗ trợ doanh nghiệp công nghệ số VN vươn ra thế giới,/ho-tro-doanh-nghiep-cong-nghe-so-vn-vuon-ra-the-gioi-185230224011504099.htm
Mở chiến dịch hỗ trợ doanh nghiệp công nghệ số Việt Nam vươn ra thế giới,/mo-chien-dich-ho-tro-doanh-nghiep-cong-nghe-so-viet-nam-vuon-ra-the-gioi-185230223160355179.htm
"Trường ĐH Giao thông vận tải dành nhiều chỉ tiêu cho ngành giao thông, CNTT",/truong-dh-giao-thong-van-tai-danh-nhieu-chi-tieu-cho-nganh-giao-thong-cntt-185230216171755149.htm
Công nghệ phục vụ sứ mệnh 'vì một cuộc sống thuận ích hơn',/cong-nghe-phuc-vu-su-menh-vi-mot-cuoc-song-thuan-ich-hon-185230207163715875.htm
Chuyển đổi số đồng bộ trên các mặt công tác của Đoàn,/chuyen-doi-so-dong-bo-tren-cac-mat-cong-tac-cua-doan-1851540541.htm
Ứng dụng công nghệ số trong các dự án giao thông của Đèo Cả,/ung-dung-cong-nghe-so-trong-cac-du-an-giao-thong-cua-deo-ca-1851532642.htm
Tổng công ty Điện lực TP.HCM áp dụng công nghệ số vào hoạt động kinh doanh,/tong-cong-ty-dien-luc-tphcm-ap-dung-cong-nghe-so-vao-hoat-dong-kinh-doanh-1851532087.htm
"Tập huấn kỹ năng ứng dụng công nghệ số vào sản xuất tin, bài trên báo chí",/tap-huan-ky-nang-ung-dung-cong-nghe-so-vao-san-xuat-tin-bai-tren-bao-chi-1851530159.htm
EVNCPC có 2 sản phẩm được trao giải thưởng công nghệ số Make in Việt Nam 2022,/evncpc-co-2-san-pham-duoc-trao-giai-thuong-cong-nghe-so-make-in-viet-nam-2022-1851529897.htm
Doanh thu công nghiệp công nghệ số ước đạt hơn 148 tỉ USD dù nhiều khó khăn,/doanh-thu-cong-nghiep-cong-nghe-so-uoc-dat-hon-148-ti-usd-du-nhieu-kho-khan-1851529203.htm
Ứng dụng công nghệ để quản trị rủi ro trong vay ngang hàng,/ung-dung-cong-nghe-de-quan-tri-rui-ro-trong-vay-ngang-hang-1851528685.htm
Phát triển bền vững - ‘chìa khóa vàng’ cho doanh nghiệp hoạt động trong ngành nông nghiệp,/phat-trien-ben-vung-chia-khoa-vang-cho-doanh-nghiep-hoat-dong-trong-nganh-nong-nghiep-1851526127.htm
Người gieo trồng cảm xúc,/nguoi-gieo-trong-cam-xuc-1851523251.htm
Ra mắt Làng Blockchain thúc đẩy sự phát triển công nghệ số,/ra-mat-lang-blockchain-thuc-day-su-phat-trien-cong-nghe-so-1851519187.htm
Nhà cung cấp các giải pháp công nghệ số hiệu quả,/nha-cung-cap-cac-giai-phap-cong-nghe-so-hieu-qua-1851510051.htm
Thập kỷ chuyển mình ngoạn mục của công nghệ số,/thap-ky-chuyen-minh-ngoan-muc-cua-cong-nghe-so-1851509249.htm
Đưa bánh mì Việt Nam lên không gian ảo,/dua-banh-mi-viet-nam-len-khong-gian-ao-1851509127.htm
Tuổi trẻ Bình Định tổ chức nhiều hoạt động hưởng ứng ngày Chuyển đổi số quốc gia,/tuoi-tre-binh-dinh-to-chuc-nhieu-hoat-dong-huong-ung-ngay-chuyen-doi-so-quoc-gia-1851508064.htm
EVNHANOI: Ứng dụng công nghệ số vào công tác kinh doanh và dịch vụ khách hàng,/evnhanoi-ung-dung-cong-nghe-so-vao-cong-tac-kinh-doanh-va-dich-vu-khach-hang-1851507031.htm
Mạng 5G MobiFone phủ sóng tại Khánh Hòa từ tháng 9.2022,/mang-5g-mobifone-phu-song-tai-khanh-hoa-tu-thang-92022-1851502597.htm
Đà Nẵng tập huấn chuyển đổi số cộng đồng,/da-nang-tap-huan-chuyen-doi-so-cong-dong-1851501360.htm
Chia sẻ về cách nhận biết các dấu hiệu lừa đảo và trộm cắp thông tin,/chia-se-ve-cach-nhan-biet-cac-dau-hieu-lua-dao-va-trom-cap-thong-tin-1851500096.htm
Dự án căn hộ Việt kết hợp bệnh viện chăm sóc sức khỏe cho người cao tuổi,/du-an-can-ho-viet-ket-hop-benh-vien-cham-soc-suc-khoe-cho-nguoi-cao-tuoi-1851490748.htm
Chuyển đổi số y tế phục vụ bệnh nhân,/chuyen-doi-so-y-te-phuc-vu-benh-nhan-1851487933.htm
Điểm cộng từ chiến lược đầu tư nguồn nhân sự chất lượng cao tại DatVietVAC,/diem-cong-tu-chien-luoc-dau-tu-nguon-nhan-su-chat-luong-cao-tai-datvietvac-1851487419.htm
Dấu ấn công nghệ số tại Đại hội Đoàn TP.Hải Phòng,/dau-an-cong-nghe-so-tai-dai-hoi-doan-tp-hai-phong-1851486537.htm
Hiệu quả từ Ứng dụng quét mã vật tư bằng QR tại Nhiệt điện Duyên Hải,/hieu-qua-tu-ung-dung-quet-ma-vat-tu-bang-qr-tai-nhiet-dien-duyen-hai-1851483116.htm
Bí thư Trung ương Đoàn thăm đội tình nguyện làm việc có ích cho nông dân,/bi-thu-trung-uong-doan-tham-doi-tinh-nguyen-lam-viec-co-ich-cho-nong-dan-1851478921.htm
Hướng tới môi trường văn hóa lành mạnh cho giới trẻ trên không gian mạng (*),/huong-toi-moi-truong-van-hoa-lanh-manh-cho-gioi-tre-tren-khong-gian-mang-1851477952.htm
Đưa chuyển đổi số đến tận tay người dân,/dua-chuyen-doi-so-den-tan-tay-nguoi-dan-1851472820.htm
Google đồng hành cùng trẻ em thời đại công nghệ số,/google-dong-hanh-cung-tre-em-thoi-dai-cong-nghe-so-1851472467.htm
Mirae Asset Prévoir chính thức ra mắt nền tảng bảo hiểm công nghệ số,/mirae-asset-prevoir-chinh-thuc-ra-mat-nen-tang-bao-hiem-cong-nghe-so-1851470966.htm
Agribank góp phần thúc đẩy thanh toán không dùng tiền mặt,/agribank-gop-phan-thuc-day-thanh-toan-khong-dung-tien-mat-1851469606.htm
Khám phá 'tiệm kim hoàn 4.0' vừa xuất hiện trên Shark Tank mùa 5,/kham-pha-tiem-kim-hoan-4-0-vua-xuat-hien-tren-shark-tank-mua-5-1851467666.htm
Xây dựng đối tác số chiến lược Việt Nam - Lào,/xay-dung-doi-tac-so-chien-luoc-viet-nam-lao-1851467580.htm
"Thời của bảo hiểm dễ hiểu, thời của công nghệ thông minh",/thoi-cua-bao-hiem-de-hieu-thoi-cua-cong-nghe-thong-minh-1851465952.htm
Khuyến khích các doanh nhân công nghệ tại Mỹ về Việt Nam phát triển,/khuyen-khich-cac-doanh-nhan-cong-nghe-tai-my-ve-viet-nam-phat-trien-1851460613.htm
Quảng Bình: Nâng cao nhận thức cho bà con dân tộc thiểu số về tục tảo hôn,/quang-binh-nang-cao-nhan-thuc-cho-ba-con-dan-toc-thieu-so-ve-tuc-tao-hon-1851455568.htm
Xu hướng thanh toán số của giới trẻ và kỹ năng giao dịch an toàn bảo mật,/xu-huong-thanh-toan-so-cua-gioi-tre-va-ky-nang-giao-dich-an-toan-bao-mat-1851453633.htm
10.10 là ngày chuyển đổi số quốc gia,/10-10-la-ngay-chuyen-doi-so-quoc-gia-1851451547.htm
"Tăng nhận thức thiếu niên miền núi về mua bán người, tảo hôn qua công nghệ số",/tang-nhan-thuc-thieu-nien-mien-nui-ve-mua-ban-nguoi-tao-hon-qua-cong-nghe-so-1851446704.htm
HDBank đẩy mạnh công nghệ số và nông nghiệp công nghệ cao tại Tây Nam bộ,/hdbank-day-manh-cong-nghe-so-va-nong-nghiep-cong-nghe-cao-tai-tay-nam-bo-1851446275.htm
HLV Nguyễn Đức Thắng nắn nót viết thư tay cảm ơn người hâm mộ,/hlv-nguyen-duc-thang-nan-not-viet-thu-tay-cam-on-nguoi-ham-mo-1851436309.htm
Số hóa radio bằng trí tuệ nhân tạo 'made in Vietnam',/so-hoa-radio-bang-tri-tue-nhan-tao-made-in-vietnam-1851425487.htm
Dòng vốn M&A đang dịch chuyển sang lĩnh vực công nghệ số,/dong-von-m-a-dang-dich-chuyen-sang-linh-vuc-cong-nghe-so-1851420864.htm
Cơ hội nào trong ngành công nghiệp blockchain cho người Việt trẻ?,/co-hoi-nao-trong-nganh-cong-nghiep-blockchain-cho-nguoi-viet-tre-1851420485.htm
Triển khai dự án bệnh viện thông minh đầu tiên tại Ninh Thuận,/trien-khai-du-an-benh-vien-thong-minh-dau-tien-tai-ninh-thuan-1851419330.htm
"Ai cũng có điện thoại để chụp hình lung linh, thợ ảnh làm sao để 'đắt show'?",/ai-cung-co-dien-thoai-de-chup-hinh-lung-linh-tho-anh-lam-sao-de-dat-show-1851418082.htm
Cựu Chủ tịch Hà Nội cáo buộc cấp dưới bịa đặt việc chỉ đạo gặp Nhật Cường,/cuu-chu-tich-ha-noi-cao-buoc-cap-duoi-bia-dat-viec-chi-dao-gap-nhat-cuong-1851415920.htm
Ứng dụng công nghệ số vào giao dịch bất động sản tại Hà Nội,/ung-dung-cong-nghe-so-vao-giao-dich-bat-dong-san-tai-ha-noi-1851413501.htm
Nhu cầu lớn về tuyển dụng các ngành liên quan công nghệ số,/nhu-cau-lon-ve-tuyen-dung-cac-nganh-lien-quan-cong-nghe-so-1851412637.htm
Tin tức giáo dục đặc biệt 18.12: Lưu ý về các ngành học mới năm 2022,/tin-tuc-giao-duc-dac-biet-18-12-luu-y-ve-cac-nganh-hoc-moi-nam-2022-1851412663.htm
Triển lãm 'Người học trưởng ngu ngốc' của Nguyễn Hoàng Giang và Gabriel Hensche,/trien-lam-nguoi-hoc-truong-ngu-ngoc-cua-nguyen-hoang-giang-va-gabriel-hensche-1851412454.htm
Việt Nam nằm trong nhóm tăng trưởng nhanh nhất thế giới về internet,/viet-nam-nam-trong-nhom-tang-truong-nhanh-nhat-the-gioi-ve-internet-1851411132.htm
VNPT xuất sắc giành 1 giải vàng và 1 bạc của Make in Viet Nam 2021,/vnpt-xuat-sac-gianh-1-giai-vang-va-1-bac-cua-make-in-viet-nam-2021-1851410879.htm
"Doanh nghiệp, người dân là trọng tâm chuyển đổi số",/doanh-nghiep-nguoi-dan-la-trong-tam-chuyen-doi-so-1851410669.htm
Covid-19 khiến doanh nghiệp đẩy nhanh chuyển đổi số,/covid-19-khien-doanh-nghiep-day-nhanh-chuyen-doi-so-1851410499.htm
GapoWork được vinh danh chuyển đổi số tiêu biểu Việt Nam 2021,/gapowork-duoc-vinh-danh-chuyen-doi-so-tieu-bieu-viet-nam-2021-1851410053.htm
"Tư duy lại về công nghiệp hóa, hiện đại hóa",/tu-duy-lai-ve-cong-nghiep-hoa-hien-dai-hoa-1851408796.htm
VIDEX 2021 ứng dụng công nghệ để xúc tiến thương mại,/videx-2021-ung-dung-cong-nghe-de-xuc-tien-thuong-mai-1851407063.htm
Thủ tướng: 'Việt Nam có khả năng thích ứng cao với chuyển đổi số',/thu-tuong-viet-nam-co-kha-nang-thich-ung-cao-voi-chuyen-doi-so-1851404597.htm
Hậu Covid-19: sự bùng nổ công nghệ số ngành y tế,/hau-covid-19-su-bung-no-cong-nghe-so-nganh-y-te-1851398278.htm
Công nghệ với bảo tàng đã như 'cá với nước',/cong-nghe-voi-bao-tang-da-nhu-ca-voi-nuoc-1851395404.htm
Công nghệ số có thể đem lại 74 tỉ USD cho Việt Nam,/cong-nghe-so-co-the-dem-lai-74-ti-usd-cho-viet-nam-1851392327.htm
Thủ tướng Phạm Minh Chính: Chuyển đổi số là hướng đi đúng đắn,/thu-tuong-pham-minh-chinh-chuyen-doi-so-la-huong-di-dung-dan-1851390370.htm
Hai sáng lập KardiaChain trở thành cổ đông chiến lược của Decom Holdings,/hai-sang-lap-kardiachain-tro-thanh-co-dong-chien-luoc-cua-decom-holdings-1851114764.htm
VNPT Elearning không đơn thuần học trực tuyến mà là giải pháp số hóa giáo dục,/vnpt-elearning-khong-don-thuan-hoc-truc-tuyen-ma-la-giai-phap-so-hoa-giao-duc-1851113732.htm
Đà Nẵng kỳ vọng nền kinh tế số,/da-nang-ky-vong-nen-kinh-te-so-1851113443.htm
"Thủ tướng: Tận dụng cơ hội phòng, chống đại dịch Covid-19 để chuyển đổi số",/thu-tuong-tan-dung-co-hoi-phong-chong-dai-dich-covid-19-de-chuyen-doi-so-1851107866.htm
Giảm nguy cơ lây nhiễm Covid với giao dịch trực tuyến tiện ích của VNPT,/giam-nguy-co-lay-nhiem-covid-voi-giao-dich-truc-tuyen-tien-ich-cua-vnpt-1851105154.htm
Điện lực TP.HCM đã chuyển đổi số thành công như thế nào?,/dien-luc-tphcm-da-chuyen-doi-so-thanh-cong-nhu-the-nao-1851094486.htm
Các công ty công nghệ số ‘ngược dòng’ trong đại dịch Covid-19,/cac-cong-ty-cong-nghe-so-nguoc-dong-trong-dai-dich-covid-19-1851083731.htm
Tham quan trực tuyến nhà máy Ajinomoto nhờ công nghệ số hóa không gian,/tham-quan-truc-tuyen-nha-may-ajinomoto-nho-cong-nghe-so-hoa-khong-gian-1851083439.htm
Tạo hành lang thu hút doanh nghiệp công nghệ số,/tao-hanh-lang-thu-hut-doanh-nghiep-cong-nghe-so-1851081410.htm
Phát động giải thưởng Sản phẩm công nghệ số Make in Vietnam,/phat-dong-giai-thuong-san-pham-cong-nghe-so-make-in-vietnam-1851079966.htm
‘Kích hoạt nhanh tay - Mê say nhận quà’ cùng ứng dụng Agribank E-Mobile Banking,/kich-hoat-nhanh-tay-me-say-nhan-qua-cung-ung-dung-agribank-e-mobile-banking-1851079925.htm
"'Ứng dụng One IBC Digital sẽ kết nối, phục vụ khách hàng khắp thế giới'",/ung-dung-one-ibc-digital-se-ket-noi-phuc-vu-khach-hang-khap-the-gioi-1851079375.htm
Điện lực Gia Lai áp dụng công nghệ số trong quản lý vận hành lưới điện,/dien-luc-gia-lai-ap-dung-cong-nghe-so-trong-quan-ly-van-hanh-luoi-dien-1851079510.htm
Tin tặc tấn công đường ống dẫn dầu Colonial như thế nào?,/tin-tac-tan-cong-duong-ong-dan-dau-colonial-nhu-the-nao-1851066311.htm
EVNHANOI: Đẩy mạnh ứng dụng công nghệ số trong kinh doanh và dịch vụ khách hàng,/evnhanoi-day-manh-ung-dung-cong-nghe-so-trong-kinh-doanh-va-dich-vu-khach-hang-1851066152.htm
Trao giải thưởng 100 triệu đồng cho công trình sáng tạo vì giáo dục,/trao-giai-thuong-100-trieu-dong-cho-cong-trinh-sang-tao-vi-giao-duc-1851061734.htm
Điều kiện nào để có trường học thông minh?,/dieu-kien-nao-de-co-truong-hoc-thong-minh-1851060723.htm
MSB đặt mục tiêu đạt 3.280 tỉ đồng lợi nhuận trước thuế năm 2021,/msb-dat-muc-tieu-dat-3280-ti-dong-loi-nhuan-truoc-thue-nam-2021-1851049073.htm
Tội phạm mạng khiến thế giới mất tiền 'khủng',/toi-pham-mang-khien-the-gioi-mat-tien-khung-1851040011.htm
Nguy cơ lao động Việt Nam thất nghiệp cao trước làn sóng công nghệ số,/nguy-co-lao-dong-viet-nam-that-nghiep-cao-truoc-lan-song-cong-nghe-so-1851030430.htm
Ngân hàng đầu tiên công bố kết quả kinh doanh 2020 ngay ngày đầu năm mới,/ngan-hang-dau-tien-cong-bo-ket-qua-kinh-doanh-2020-ngay-ngay-dau-nam-moi-1851025533.htm
Thời đại 4.0 mở lối phát triển mới cho tài chính tiêu dùng,/thoi-dai-40-mo-loi-phat-trien-moi-cho-tai-chinh-tieu-dung-1851024854.htm
"Ưu tiên nghiên cứu, phát triển và ứng dụng AI, Blockchain…",/uu-tien-nghien-cuu-phat-trien-va-ung-dung-ai-blockchain-1851022690.htm
Các doanh nghiệp ‘bắt tay’ cùng chuyển đổi số,/cac-doanh-nghiep-bat-tay-cung-chuyen-doi-so-1851016724.htm
"Năm 2030, người giúp việc sẽ phải là cử nhân tâm lý?",/nam-2030-nguoi-giup-viec-se-phai-la-cu-nhan-tam-ly-1851016137.htm
Xúc tiến xây dựng bản đồ ẩm thực Việt Nam,/xuc-tien-xay-dung-ban-do-am-thuc-viet-nam-1851002455.htm
Ngân hàng có nền tảng số tốt sẽ có lợi thế trong cuộc đua thị phần,/ngan-hang-co-nen-tang-so-tot-se-co-loi-the-trong-cuoc-dua-thi-phan-185995033.htm
VNPT - Bảo vệ thông tin khách hàng bằng AI,/vnpt-bao-ve-thong-tin-khach-hang-bang-ai-185994663.htm
Tin tức giáo dục đặc biệt trên báo in ngày mai 11.9.2020,/tin-tuc-giao-duc-dac-biet-tren-bao-in-ngay-mai-1192020-185992878.htm
'Đo nồng độ cồn trong máu' đoạt giải nhất cuộc thi ứng dụng công nghệ số,/do-nong-do-con-trong-mau-doat-giai-nhat-cuoc-thi-ung-dung-cong-nghe-so-185969353.htm
VNPT - Nền móng cho Chính phủ điện tử,/vnpt-nen-mong-cho-chinh-phu-dien-tu-185924989.htm
Generali Việt Nam ứng dụng công nghệ số gây quỹ từ thiện một tỉ đồng,/generali-viet-nam-ung-dung-cong-nghe-so-gay-quy-tu-thien-mot-ti-dong-185918070.htm
"Số hóa việc lì xì, ngân hàng áp dụng như thế nào?",/so-hoa-viec-li-xi-ngan-hang-ap-dung-nhu-the-nao-185915350.htm
Tự vệ thời @,/tu-ve-thoi--185913618.htm
Thủ tướng gợi ý đổi tên Bộ Thông tin Truyền thông thành Bộ Truyền thông và Kinh tế số,/kinh-te-so-la-dong-luc-de-viet-nam-tien-nhanh-185913103.htm
Thủ tướng: Việt Nam có thể là biểu tượng trỗi dậy tiếp theo của châu Á,/thu-tuong-viet-nam-co-the-la-bieu-tuong-troi-day-tiep-theo-cua-chau-a-185913012.htm
Người tiêu dùng không trung thành với thương hiệu nào,/nguoi-tieu-dung-khong-trung-thanh-voi-thuong-hieu-nao-185906559.htm
"Công nghệ hóa sản phẩm, dịch vụ thanh toán - bước tiến của VietinBank",/cong-nghe-hoa-san-pham-dich-vu-thanh-toan-buoc-tien-cua-vietinbank-185906060.htm
Công ty Điện lực Gia Lai vận hành lưới điện bằng công nghệ số,/cong-ty-dien-luc-gia-lai-van-hanh-luoi-dien-bang-cong-nghe-so-185903616.htm
TPBank ứng dụng nhiều công nghệ số cho sản phẩm thẻ,/tpbank-ung-dung-nhieu-cong-nghe-so-cho-san-pham-the-185884273.htm
Ca sĩ Hoàng Bách và các hot mom Việt nói gì về cách dạy con thời nay?,/ca-si-hoang-bach-va-cac-hot-mom-viet-noi-gi-ve-cach-day-con-thoi-nay-185883546.htm
Thanh toán tại 60 nhãn hàng lớn bằng ví điện tử của Quest Group,/thanh-toan-tai-60-nhan-hang-lon-bang-vi-dien-tu-cua-quest-group-185881475.htm
Việt Nam nhận thêm khoản 'siêu' đầu tư 500 triệu USD để phát triển công nghệ số,/viet-nam-nhan-them-khoan-sieu-dau-tu-500-trieu-usd-de-phat-trien-cong-nghe-so-185878934.htm
Ưu đãi ngập tràn tại Chez Dental Clinic - Nha khoa ‘Một lần hẹn’,/uu-dai-ngap-tran-tai-chez-dental-clinic-nha-khoa-mot-lan-hen-185873251.htm
Chez Dental Clinic - Phòng khám nha khoa công nghệ số,/chez-dental-clinic-phong-kham-nha-khoa-cong-nghe-so-185872886.htm
