Title,URL
"Điểm tin 18h: Đã có thông báo thu hồi đất, vẫn cho tách thửa; Anh xem Wagner là tổ chức khủng bố",/diem-tin-18h-da-co-thong-bao-thu-hoi-dat-van-cho-tach-thua-anh-xem-wagner-la-to-chuc-khung-bo-20230916161413715.htm
Xóa tư cách chức vụ với hai nguyên phó chủ tịch tỉnh Thanh Hóa,/xoa-tu-cach-chuc-vu-voi-hai-nguyen-pho-chu-tich-tinh-thanh-hoa-20230913223944204.htm
Vì sao có cựu quan chức nhận tiền vụ Việt Á nhưng không bị xử lý tội nhận hối lộ?,/vi-sao-co-cuu-quan-chuc-nhan-tien-vu-viet-a-nhung-khong-bi-xu-ly-toi-nhan-hoi-lo-20230909180338568.htm
An Giang thu hồi 6 giấy phép khai thác cát trái quy định,/an-giang-thu-hoi-6-giay-phep-khai-thac-cat-trai-quy-dinh-20230908153441803.htm
Trung Quốc cấm dùng iPhone tại một số cơ quan chính phủ,/trung-quoc-cam-dung-iphone-tai-mot-so-co-quan-chinh-phu-20230906183320516.htm
Kinh tế Trung Quốc: Khủng hoảng niềm tin,/kinh-te-trung-quoc-khung-hoang-niem-tin-20230831164414416.htm
Thủ tướng trả lời đại biểu TP.HCM về gỡ vướng cho Công ty vận hành metro Bến Thành - Suối Tiên,/thu-tuong-tra-loi-dai-bieu-tp-hcm-ve-go-vuong-cho-cong-ty-van-hanh-metro-ben-thanh-suoi-tien-20230902161628975.htm
Thủ tướng Chính phủ dự lễ khởi công nhà ga sân bay Long Thành,/thu-tuong-chinh-phu-du-le-khoi-cong-nha-ga-san-bay-long-thanh-20230831162350042.htm
Tin tức sáng 28-8: Không cắt điện dịp lễ 2-9 trừ sự cố; Giá thép lại 'dò đáy',/tin-tuc-sang-28-8-khong-cat-dien-dip-le-2-9-tru-su-co-gia-thep-lai-do-day-20230827212541579.htm
Trung Quốc và thách thức thay đổi mô hình tăng trưởng,/trung-quoc-va-thach-thuc-thay-doi-mo-hinh-tang-truong-20230825085348892.htm
Thủ tướng chỉ đạo 'nóng' ngăn chặn tín dụng đen,/thu-tuong-chi-dao-nong-ngan-chan-tin-dung-den-20230825080434077.htm
"Thủ tướng ra hạn 2 ngày hoàn thành sửa thông tư 06, gỡ vướng về vốn",/thu-tuong-ra-han-2-ngay-hoan-thanh-sua-thong-tu-06-go-vuong-ve-von-20230823182943794.htm
"Nội các trẻ, học vấn cao của Campuchia",/noi-cac-tre-hoc-van-cao-cua-campuchia-20230823083215702.htm
Trung Quốc ngừng công bố số liệu thất nghiệp của thanh niên,/trung-quoc-ngung-cong-bo-so-lieu-that-nghiep-cua-thanh-nien-20230815154206064.htm
Lại nóng chuyện học phí đại học,/lai-nong-chuyen-hoc-phi-dai-hoc-20230808231147652.htm
Phó thủ tướng Trần Lưu Quang làm tổ trưởng Tổ công tác cải cách thủ tục hành chính,/pho-thu-tuong-tran-luu-quang-lam-to-truong-to-cong-tac-cai-cach-thu-tuc-hanh-chinh-20230806194927678.htm
Nỗi lòng người công nhân trước 2 phương án hạn chế rút bảo hiểm xã hội một lần,/noi-long-nguoi-cong-nhan-truoc-2-phuong-an-han-che-rut-bao-hiem-xa-hoi-mot-lan-20230806173445027.htm
"Mới nửa năm, Nga đã chi hết tiền quốc phòng cho cả năm 2023?",/moi-nua-nam-nga-da-chi-het-tien-quoc-phong-cho-ca-nam-2023-20230804163326697.htm
Thủ tướng chủ trì hội nghị tháo gỡ khó khăn cho thị trường bất động sản,/thu-tuong-chu-tri-hoi-nghi-thao-go-kho-khan-cho-thi-truong-bat-dong-san-20230803154228401.htm
100.000 người tị nạn Ukraine đối diện viễn cảnh phải rời nước Anh,/100-000-nguoi-ti-nan-ukraine-doi-dien-vien-canh-phai-roi-nuoc-anh-20230803151450828.htm
Thị trường bất động sản được tháo gỡ thế nào?,/thi-truong-bat-dong-san-duoc-thao-go-the-nao-20230803135218529.htm
Đề xuất dùng ngân sách hỗ trợ người dân tham gia bảo hiểm xã hội,/de-xuat-dung-ngan-sach-ho-tro-nguoi-dan-tham-gia-bao-hiem-xa-hoi-20230728190349563.htm
Tin tức sáng 27-7: Bắt 52 người trốn truy nã nhờ thông tin cấp căn cước công dân,/tin-tuc-sang-27-7-bat-52-nguoi-tron-truy-na-nho-thong-tin-cap-can-cuoc-cong-dan-20230726133511502.htm
"Campuchia trẻ hóa chính phủ sau bầu cử, đa số sẽ dưới 50 tuổi",/campuchia-tre-hoa-chinh-phu-sau-bau-cu-da-so-se-duoi-50-tuoi-20230726122633757.htm
"Đằng sau những số chuyến, số người của ""chuyến bay giải cứu""",/dang-sau-nhung-so-chuyen-so-nguoi-cua-chuyen-bay-giai-cuu-20230721104635137.htm
"Thanh tra phát hiện vi phạm kinh tế hơn 337.000 tỉ đồng, chuyển cơ quan điều tra cả nghìn vụ",/thanh-tra-phat-hien-vi-pham-kinh-te-hon-337-000-ti-dong-chuyen-co-quan-dieu-tra-ca-nghin-vu-20230722085252956.htm
"Trung Quốc xây dựng 3 triệu trạm phát, bỏ xa Mỹ trong cuộc đua 5G",/trung-quoc-xay-dung-3-trieu-tram-phat-bo-xa-my-trong-cuoc-dua-5g-20230720201732546.htm
"Phải ra công văn đính chính nghị định 35 vừa ban hành, Bộ Xây dựng nói gì?",/phai-ra-cong-van-dinh-chinh-nghi-dinh-35-vua-ban-hanh-bo-xay-dung-noi-gi-20230715140333581.htm
"Nghiên cứu, xây dựng đề án cơ cấu tổ chức Chính phủ khóa mới",/nghien-cuu-xay-dung-de-an-co-cau-to-chuc-chinh-phu-khoa-moi-20230710190332923.htm
Thủ tướng Phạm Minh Chính: Ưu tiên đầu tư đường sắt TP.HCM - Cần Thơ,/thu-tuong-pham-minh-chinh-uu-tien-dau-tu-duong-sat-tp-hcm-can-tho-20230708132445531.htm
Chính phủ tháo nút thắt cho Công ty Metro số 1 có vốn hoạt động,/chinh-phu-thao-nut-that-cho-cong-ty-metro-so-1-co-von-hoat-dong-20230702123002913.htm
"Tăng lương hưu, trợ cấp bảo hiểm xã hội và trợ cấp hằng tháng từ 1-7",/tang-luong-huu-tro-cap-bao-hiem-xa-hoi-va-tro-cap-hang-thang-tu-1-7-20230629182611589.htm
Muốn tham gia đấu giá biển số ô tô từ 1-7 cần làm gì?,/muon-tham-gia-dau-gia-bien-so-o-to-tu-1-7-can-lam-gi-20230629102340588.htm
"Ô tô trong nước được trợ lực nhờ chính sách mới, liệu có giảm giá?",/o-to-trong-nuoc-duoc-tro-luc-nho-chinh-sach-moi-lieu-co-giam-gia-20230621203006555.htm
Bộ trưởng Hàn Quốc: Sẽ tham mưu Chính phủ tăng ngành nghề và số lao động từ Việt Nam,/bo-truong-han-quoc-se-tham-muu-chinh-phu-tang-nganh-nghe-va-so-lao-dong-tu-viet-nam-20230621181713816.htm
Lãi suất trái phiếu giảm do chính sách nới lỏng tiền tệ,/lai-suat-trai-phieu-giam-do-chinh-sach-noi-long-tien-te-20230621144804797.htm
"Bộ Nội vụ nghiên cứu giảm hợp lý số lượng bộ, cơ quan ngang bộ",/bo-noi-vu-nghien-cuu-giam-hop-ly-so-luong-bo-co-quan-ngang-bo-20230616070519292.htm
"Công nghệ thông tin - viễn thông Việt Nam là điểm sáng, doanh thu tới 148 tỉ USD",/cong-nghe-thong-tin-vien-thong-viet-nam-la-diem-sang-doanh-thu-toi-148-ti-usd-20230612201147092.htm
Đại lý ô tô làm đăng kiểm mong sớm có thông tư hướng dẫn,/dai-ly-o-to-lam-dang-kiem-mong-som-co-thong-tu-huong-dan-2023061108371223.htm
"Bỏ chức danh trưởng công an xã, công chức xã tăng theo quy mô dân số",/bo-chuc-danh-truong-cong-an-xa-cong-chuc-xa-tang-theo-quy-mo-dan-so-20230610110323792.htm
"Hãng xe làm kiểm định, khi nào?",/hang-xe-lam-kiem-dinh-khi-nao-20230609092524706.htm
Mở đường cho các hãng xe lập trung tâm đăng kiểm,/mo-duong-cho-cac-hang-xe-lap-trung-tam-dang-kiem-20230608103543841.htm
Thiếu điện: Hàng loạt câu hỏi dành cho EVN,/thieu-dien-hang-loat-cau-hoi-danh-cho-evn-20230608081543981.htm
Phó thủ tướng Trần Hồng Hà chỉ đạo gỡ khó cho Khu liên hợp thể thao quốc gia Mỹ Đình,/pho-thu-tuong-tran-hong-ha-chi-dao-go-kho-cho-khu-lien-hop-the-thao-quoc-gia-my-dinh-20230607190028428.htm
Bổ sung sân bay Gia Bình của Bộ Công an vào danh mục các sân bay tiềm năng,/bo-sung-san-bay-gia-binh-cua-bo-cong-an-vao-danh-muc-cac-san-bay-tiem-nang-20230606185436395.htm
Gói phục hồi kinh tế được triển khai thế nào?,/goi-hoi-phuc-kinh-te-duoc-trien-khai-the-nao-20230530104018816.htm
"Hiểu đúng về cấm bếp từ, bếp hồng ngoại",/hieu-dung-ve-cam-bep-tu-bep-hong-ngoai-20230528095438804.htm
Tán thành ban hành nghị quyết mới về đột phá cho TP.HCM,/tan-thanh-ban-hanh-nghi-quyet-moi-ve-dot-pha-cho-tp-hcm-2023052709435309.htm
"Trình Quốc hội đề xuất thêm 6 vị trí thăng hàm thượng tướng, thiếu tướng công an",/trinh-quoc-hoi-de-xuat-them-6-vi-tri-thang-ham-thuong-tuong-thieu-tuong-cong-an-20230527083442008.htm
"Loại máy điều hòa, máy giặt, tủ lạnh… nào bị cấm kinh doanh từ 15-7?",/loai-may-dieu-hoa-may-giat-tu-lanh-nao-bi-cam-kinh-doanh-tu-15-7-20230526190940633.htm
Bí ẩn người làm bảo vật quốc gia - Kỳ cuối: Vinh dự của người nặn tượng Bác Hồ,/bi-an-nguoi-lam-bao-vat-quoc-gia-ky-cuoi-vinh-du-cua-nguoi-nan-tuong-bac-ho-20230525103411835.htm
Nghiên cứu mở văn phòng xúc tiến du lịch Việt Nam ở nước ngoài,/nghien-cuu-mo-van-phong-xuc-tien-du-lich-viet-nam-o-nuoc-ngoai-20230519015622424.htm
"Bộ Y tế chịu trách nhiệm nếu để thiếu thuốc, vắc xin tiêm chủng mở rộng",/bo-y-te-chiu-trach-nhiem-neu-de-thieu-thuoc-vac-xin-tiem-chung-mo-rong-20230518181913933.htm
"Chính phủ lo doanh nghiệp bán tài sản, rút khỏi thị trường có thể 'diễn biến phức tạp'",/chinh-phu-lo-doanh-nghiep-ban-tai-san-rut-khoi-thi-truong-co-the-dien-bien-phuc-tap-20230518101956089.htm
9 nhóm được tăng lương cơ sở từ 1-7,/9-nhom-duoc-tang-luong-co-so-tu-1-7-20230515121304363.htm
1 năm phục hồi kinh tế - xã hội: Giảm thuế chục ngàn tỉ,/1-nam-phuc-hoi-kinh-te-xa-hoi-giam-thue-chuc-ngan-ti-20230509102317067.htm
Các lãnh đạo nước ngoài nào tới dự lễ duyệt binh ở Nga?,/cac-lanh-dao-nuoc-ngoai-nao-toi-du-le-duyet-binh-o-nga-20230509091609623.htm
Dự kiến đấu giá biển số xe ô tô nào?,/du-kien-dau-gia-bien-so-xe-oto-nao-20230506072528639.htm
Tai nạn giao thông giảm trong 5 ngày nghỉ lễ,/tai-nan-giao-thong-giam-trong-5-ngay-nghi-le-20230503173327196.htm
Bộ Công an: Đổi tên căn cước công dân thành căn cước không tác động đến chi phí xã hội,/bo-cong-an-doi-ten-can-cuoc-cong-dan-thanh-can-cuoc-khong-tac-dong-den-chi-phi-xa-hoi-20230501135111805.htm
Trung Quốc: Phụ nữ độc thân sẽ được đông lạnh trứng và thụ tinh nhân tạo?,/trung-quoc-phu-nu-doc-than-se-duoc-dong-lanh-trung-va-thu-tinh-nhan-tao-20230430164604323.htm
"Đề xuất thêm 6 vị trí được thăng hàm thượng tướng, thiếu tướng công an",/de-xuat-them-6-vi-tri-duoc-thang-ham-thuong-tuong-thieu-tuong-cong-an-20230427091140653.htm
Chính phủ ra nghị quyết hỗ trợ khách hàng vay tiêu dùng,/chinh-phu-ra-nghi-quyet-ho-tro-khach-hang-vay-tieu-dung-20230423175315517.htm
Sẽ hình thành doanh nghiệp tư nhân có vai trò dẫn dắt các ngành trọng điểm,/se-hinh-thanh-doanh-nghiep-tu-nhan-co-vai-tro-dan-dat-cac-nganh-trong-diem-20230421204149912.htm
Thêm 9 bang ở Mỹ kiện Google vì độc quyền quảng cáo số,/them-9-bang-o-my-kien-google-vi-doc-quyen-quang-cao-so-20230418113950245.htm
Gia hạn thời gian làm xong metro số 2 đến năm 2030,/gia-han-thoi-gian-lam-xong-metro-so-2-den-nam-2030-20230417180627462.htm
"13 bộ, cơ quan trung ương có tỉ lệ giải ngân 0%",/13-bo-co-quan-trung-uong-co-ti-le-giai-ngan-0-20230413164002891.htm
4 lãnh đạo cấp thứ trưởng chuẩn bị nghỉ hưu theo chế độ,/4-lanh-dao-cap-thu-truong-chuan-bi-nghi-huu-theo-che-do-20230407225729367.htm
Chính thức trình Quốc hội chính sách visa mới,/chinh-thuc-trinh-quoc-hoi-chinh-sach-visa-moi-20230401221028281.htm
Canada nới lỏng quy định mua nhà của người nước ngoài,/canada-noi-long-quy-dinh-mua-nha-cua-nguoi-nuoc-ngoai-20230331131119855.htm
Ai Cập điều chỉnh quy định cấp thị thực nhằm thu hút du khách,/ai-cap-dieu-chinh-quy-dinh-cap-thi-thuc-nham-thu-hut-du-khach-20230329160033178.htm
Miễn phí dịch vụ chữ ký số VNPT SmartCA khi giao dịch trên cổng dịch vụ công,/mien-phi-dich-vu-chu-ky-so-vnpt-smartca-khi-giao-dich-tren-cong-dich-vu-cong-20230322160737352.htm
Thanh tra Chính phủ yêu cầu làm rõ sai phạm dự án khu dân cư Phước Tân ở Đồng Nai,/thanh-tra-chinh-phu-yeu-cau-lam-ro-sai-pham-du-an-khu-dan-cu-phuoc-tan-o-dong-nai-20230320165353273.htm
Infineon đưa các thiết kế sạc nhanh DC tiết kiệm năng lượng vào cuộc sống,/infineon-dua-cac-thiet-ke-sac-nhanh-dc-tiet-kiem-nang-luong-vao-cuoc-song-20230320093052966.htm
"Không dễ có ""công chức GPT""",/khong-de-co-cong-chuc-gpt-20230308092304176.htm
"Kiến nghị hệ số điều chỉnh giá đất cần phủ tới xã, phường, thị trấn",/kien-nghi-he-so-dieu-chinh-gia-dat-can-phu-toi-xa-phuong-thi-tran-20230314133627846.htm
Trung Quốc tự tin với dàn lãnh đạo mới,/trung-quoc-tu-tin-voi-dan-lanh-dao-moi-20230313224324031.htm
Giãn hoãn nợ cho dự án bất động sản khả thi,/gian-hoan-no-cho-du-an-bat-dong-san-kha-thi-20230312232342473.htm
Thanh tra Chính phủ vạch hàng loạt sai phạm trong quản lý đất đai tại Cà Mau,/thanh-tra-chinh-phu-vach-hang-loat-sai-pham-trong-quan-ly-dat-dai-tai-ca-mau-20230310190405275.htm
Trị căn bệnh 'không có giấy không được',/tri-can-benh-khong-co-giay-khong-duoc-20230306075820633.htm
Công ty Metro số 1 TP.HCM 'hết tiền': Trình Thủ tướng phương án trước 8-3,/cong-ty-metro-so-1-tp-hcm-het-tien-trinh-thu-tuong-phuong-an-truoc-8-3-20230304125324219.htm
Chính phủ ban hành nghị định mới gỡ 'nút thắt' về trang thiết bị y tế,/chinh-phu-ban-hanh-nghi-dinh-moi-go-nut-that-ve-trang-thiet-bi-y-te-20230303202348203.htm
Tuyển sinh lớp 10 nhân đôi hệ số điểm toán - văn có còn phù hợp?,/tuyen-sinh-lop-10-nhan-doi-he-so-diem-toan-van-co-con-phu-hop-2023030318533659.htm
Thị trường bất động sản Trung Quốc trong 'cơn khát' tín dụng,/thi-truong-bat-dong-san-trung-quoc-trong-con-khat-tin-dung-20230301143932696.htm
Thủ tướng: Không yêu cầu xác nhận cư trú trong giải quyết thủ tục hành chính,/thu-tuong-khong-yeu-cau-xac-nhan-cu-tru-trong-giai-quyet-thu-tuc-hanh-chinh-20230225133206404.htm
Bộ trưởng Nguyễn Kim Sơn lý giải vì sao giá sách giáo khoa mới cao hơn,/bo-truong-nguyen-kim-son-ly-giai-vi-sao-gia-sach-giao-khoa-moi-cao-hon-20230215170611484.htm
Nhật Bản dự kiến sử dụng robot giao hàng,/nhat-ban-du-kien-su-dung-robot-giao-hang-20230213112529174.htm
Hai câu hỏi của Thủ tướng khi thăm mô hình thành phố thông minh Singapore,/hai-cau-hoi-cua-thu-tuong-khi-tham-mo-hinh-thanh-pho-thong-minh-singapore-20230209183528314.htm
Thủ tướng phê duyệt điều chỉnh thời gian hoàn thành metro số 1,/thu-tuong-phe-duyet-dieu-chinh-thoi-gian-hoan-thanh-metro-so-1-20230208214005092.htm
Sử dụng dữ liệu cá nhân không cần 'xin phép' khi nào?,/su-dung-du-lieu-ca-nhan-khong-can-xin-phep-khi-nao-20230208100107901.htm
Chính phủ giao nhiệm vụ gì cho Hà Nội để thu nhập mỗi người năm 2045 hơn 36.000 USD?,/chinh-phu-giao-nhiem-vu-gi-cho-ha-noi-de-thu-nhap-moi-nguoi-nam-2045-hon-36-000-usd-20230207202706389.htm
Thêm 31.392 tỉ đồng cho Bộ Giao thông vận tải làm 5 dự án cao tốc,/them-31-392-ti-dong-cho-bo-giao-thong-van-tai-lam-5-du-an-cao-toc-2023020621301793.htm
Nguyên Chủ tịch nước Nguyễn Xuân Phúc nói về lý do xin thôi nhiệm vụ,/nguyen-chu-tich-nuoc-nguyen-xuan-phuc-noi-ve-ly-do-xin-thoi-nhiem-vu-20230204164137368.htm
"Bộ Nông nghiệp và Phát triển nông thôn điều động, bổ nhiệm nhiều lãnh đạo chủ chốt",/bo-nong-nghiep-va-phat-trien-nong-thon-dieu-dong-bo-nhiem-nhieu-lanh-dao-chu-chot-20230116183421909.htm
Chuyển cơ quan điều tra các gói thầu mua sắm trang thiết bị y tế tại nhiều bệnh viện TP.HCM,/chuyen-co-quan-dieu-tra-cac-goi-thau-mua-sam-trang-thiet-bi-y-te-tai-nhieu-benh-vien-tp-hcm-20230111160703714.htm
Bí thư Hải Phòng Trần Lưu Quang trở thành tân phó thủ tướng,/bi-thu-hai-phong-tran-luu-quang-tro-thanh-tan-pho-thu-tuong-20230105160837327.htm
Bộ trưởng Trần Hồng Hà trở thành tân phó thủ tướng,/bo-truong-tran-hong-ha-tro-thanh-tan-pho-thu-tuong-2023010516021702.htm
"Chính thức miễn nhiệm hai phó thủ tướng Phạm Bình Minh, Vũ Đức Đam",/chinh-thuc-mien-nhiem-hai-pho-thu-tuong-pham-binh-minh-vu-duc-dam-20230105144738253.htm
"Chủ tịch Quốc hội: Xem xét phê chuẩn miễn nhiệm, bổ nhiệm một số thành viên Chính phủ",/chu-tich-quoc-hoi-xem-xet-phe-chuan-mien-nhiem-bo-nhiem-mot-so-thanh-vien-chinh-phu-20230105082157905.htm
Thái Lan tăng trợ cấp phúc lợi xã hội cho người dân,/thai-lan-tang-tro-cap-phuc-loi-xa-hoi-cho-nguoi-dan-20230104105828362.htm
Kỳ họp Quốc hội bất thường dự kiến phê chuẩn miễn nhiệm và bổ nhiệm hai phó thủ tướng,/ky-hop-quoc-hoi-bat-thuong-du-kien-phe-chuan-mien-nhiem-va-bo-nhiem-hai-pho-thu-tuong-20230103161113039.htm
Phó thủ tướng Phạm Bình Minh: Chỉ số sẵn sàng trí tuệ nhân tạo Việt Nam xếp hạng 55 toàn cầu,/pho-thu-tuong-pham-binh-minh-chi-so-san-sang-tri-tue-nhan-tao-viet-nam-xep-hang-55-toan-cau-2023010310512935.htm
Hai bộ bị kiến nghị kiểm điểm trách nhiệm liên quan dự án sử dụng trái phiếu Chính phủ,/hai-bo-bi-kien-nghi-kiem-diem-trach-nhiem-lien-quan-du-an-su-dung-trai-phieu-chinh-phu-20221229140157999.htm
Có dấu hiệu nâng giá chênh lệch đấu thầu 41 tỉ đồng cho ba thiết bị do Sở Y tế TP.HCM làm chủ đầu tư,/co-dau-hieu-nang-gia-chenh-lech-dau-thau-41-ti-dong-cho-ba-thiet-bi-do-so-y-te-tp-hcm-lam-chu-dau-tu-20221223203148232.htm
Nhiều gói thầu thiết bị y tế chống dịch COVID-19 ở TP.HCM có dấu hiệu nâng giá cao bất thường,/nhieu-goi-thau-thiet-bi-y-te-chong-dich-covid-19-o-tp-hcm-co-dau-hieu-nang-gia-cao-bat-thuong-20221223180234242.htm
"'Gặp Thủ tướng, các địa phương lại xin tháo gỡ cho cây cầu, vài công trình vì ngoài tầm giải quyết'",/gap-thu-tuong-cac-dia-phuong-lai-xin-thao-go-cho-cay-cau-vai-cong-trinh-vi-ngoai-tam-giai-quyet-2022121414132995.htm
"Trường Đại học Hồng Đức đào tạo đa ngành hiệu quả, hướng tới chất lượng cao",/truong-dai-hoc-hong-duc-dao-tao-da-nganh-hieu-qua-huong-toi-chat-luong-cao-20221128113823516.htm
Một tỉnh miền núi đề nghị trả nợ vay lại trước hạn hơn 33 tỉ đồng,/mot-tinh-mien-nui-de-nghi-tra-no-vay-lai-truoc-han-hon-33-ti-dong-20221128160228961.htm
"Yêu cầu giảm hợp lý số lượng các bộ, cơ quan ngang bộ, thí điểm sắp xếp đơn vị hành chính cấp tỉnh",/yeu-cau-giam-hop-ly-so-luong-cac-bo-co-quan-ngang-bo-thi-diem-sap-xep-don-vi-hanh-chinh-cap-tinh-20221128120348134.htm
Cụ thể hóa hành động phát triển đột phá vùng Đông Nam Bộ,/cu-the-hoa-hanh-dong-phat-trien-dot-pha-vung-dong-nam-bo-20221123203723892.htm
Bầu cử Malaysia: Hệ thống hai đảng chi phối đã bị phá vỡ,/bau-cu-malaysia-he-thong-hai-dang-chi-phoi-da-bi-pha-vo-20221120124641056.htm
Tin sáng 17-11: Hai phương án đầu tư sân bay Côn Đảo; Metro số 1 TP.HCM dự kiến xong cuối năm 2023,/tin-sang-17-11-hai-phuong-an-dau-tu-san-bay-con-dao-metro-so-1-tp-hcm-du-kien-xong-cuoi-2023-20221116214458191.htm
"Quốc hội giao Chính phủ đề xuất cơ chế, chính sách đặc thù phát triển TP.HCM",/quoc-hoi-giao-chinh-phu-de-xuat-co-che-chinh-sach-dac-thu-phat-trien-tp-hcm-20221115155402756.htm
Sunshine Group chính thức đồng hành cùng VCCI hỗ trợ chuyển đổi số cho doanh nghiệp vừa và nhỏ,/sunshine-group-chinh-thuc-dong-hanh-cung-vcci-ho-tro-chuyen-doi-so-cho-doanh-nghiep-vua-va-nho-20221111161345812.htm
"Thanh tra việc quản lý quỹ phát triển đất, nhà ở tại TP.HCM và Hà Nội",/thanh-tra-viec-quan-ly-quy-phat-trien-dat-nha-o-tai-tp-hcm-va-ha-noi-20221110222204538.htm
Doanh nghiệp bất động sản kiến nghị Thủ tướng 9 giải pháp ‘cứu’ thị trường và doanh nghiệp,/doanh-nghiep-bat-dong-san-kien-nghi-thu-tuong-9-giai-phap-cuu-thi-truong-va-doanh-nghiep-20221109223132342.htm
Vì sao phải trình Quốc hội bổ sung thông tin nơi sinh trên hộ chiếu?,/vi-sao-phai-trinh-quoc-hoi-bo-sung-thong-tin-noi-sinh-tren-ho-chieu-20221107091537272.htm
"Chặn 'nguồn cơn' khiếu nại, khiếu kiện đất đai - Kỳ 1: Kẻ khóc, người cười quanh việc thu hồi đất",/chan-nguon-con-khieu-nai-khieu-kien-dat-dai-ky-1-ke-khoc-nguoi-cuoi-quanh-viec-thu-hoi-dat-2022110708384291.htm
"Gian nan tìm hướng giải bài toán tro, xỉ tại các nhà máy nhiệt điện",/gian-nan-tim-huong-giai-bai-toan-tro-xi-tai-cac-nha-may-nhiet-dien-20221106112650246.htm
Hơn 270.000 hộ dân vượt ngưỡng nghèo sau 20 năm,/hon-270-000-ho-dan-vuot-nguong-ngheo-sau-20-nam-20221104173652587.htm
"Phó thủ tướng Lê Văn Thành: Nhiều vi phạm xây dựng không phép, vượt tầng chưa được xử lý kịp thời",/pho-thu-tuong-le-van-thanh-nhieu-vi-pham-xay-dung-khong-phep-vuot-tang-chua-duoc-xu-ly-kip-thoi-2022110409112488.htm
Canada sẽ đón 500.000 người nhập cư vào năm 2025,/canada-se-don-500000-nguoi-nhap-cu-vao-nam-2025-20221103135432603.htm
Tin sáng 3-11: Bốn thành viên Chính phủ trả lời chất vấn; TP.HCM xử lý 'xe dù bến cóc' mỗi ngày,/tin-sang-3-11-bon-thanh-vien-chinh-phu-tra-loi-chat-van-tp-hcm-xu-ly-xe-du-ben-coc-moi-ngay-20221102193852167.htm
"Thời gian xử lý các vụ án cách xa thời điểm vi phạm khiến tài sản bị tẩu tán, che giấu",/thoi-gian-xu-ly-cac-vu-an-cach-xa-thoi-diem-vi-pham-khien-tai-san-bi-tau-tan-che-giau-20221031075541714.htm
Số thuế doanh nghiệp tạm nộp bốn quý không thấp hơn 80% của năm,/so-thue-doanh-nghiep-tam-nop-bon-quy-khong-thap-hon-80-cua-nam-20221030225653438.htm
"Có tâm lý e ngại, sợ sai khi thực hiện chương trình phục hồi kinh tế - xã hội",/co-tam-ly-e-ngai-so-sai-khi-thuc-hien-chuong-trinh-phuc-hoi-kinh-te-xa-hoi-20221017095852097.htm
"14 người nộp lại quà tặng trong năm 2022, tổng số tiền hơn 260 triệu đồng",/14-nguoi-nop-lai-qua-tang-trong-nam-2022-tong-so-tien-hon-260-trieu-dong-2022101610484128.htm
Sáp nhập đơn vị hành chính: Muốn tinh phải gọn,/sap-nhap-don-vi-hanh-chinh-muon-tinh-phai-gon-20221007110406806.htm
Sẽ ngăn chặn dịch vụ nội dung số xuyên biên giới không thực hiện đúng quy định,/se-ngan-chan-dich-vu-noi-dung-so-xuyen-bien-gioi-khong-thuc-hien-dung-quy-dinh-20221012172430193.htm
Chủ tịch Quốc hội: Chỉ nên để một mức giá khởi điểm đấu giá biển số ô tô trên toàn quốc,/chu-tich-quoc-hoi-chi-nen-de-mot-muc-gia-khoi-diem-dau-gia-bien-so-o-to-tren-toan-quoc-20221011144202897.htm
Liên bộ Công Thương - Tài chính đã làm hết trách nhiệm chưa?,/lien-bo-cong-thuong-tai-chinh-da-lam-het-trach-nhiem-chua-20221011030613414.htm
"Thông điệp của Chính phủ về chuyển đổi số quốc gia: Phải để người dân, doanh nghiệp hưởng lợi",/thong-diep-cua-chinh-phu-ve-chuyen-doi-so-quoc-gia-phai-de-nguoi-dan-doanh-nghiep-huong-loi-20221010102658404.htm
Tinh giản bộ máy: Vẫn chưa thấy tinh thần cải cách,/tinh-gian-bo-may-van-chua-thay-tinh-than-cai-cach-20221007150645347.htm
Đề xuất cơ chế xử lý hình sự với hành vi làm giàu bất hợp pháp,/de-xuat-co-che-xu-ly-hinh-su-voi-hanh-vi-lam-giau-bat-hop-phap-20221005132015716.htm
"Quân khu 5 huy động xe đặc chủng, máy bay cùng 53.000 quân chống bão",/quan-khu-5-huy-dong-xe-dac-chung-may-bay-cung-53-000-quan-chong-bao-20220927111712863.htm
Tin thế giới 26-9: Philippines đình trệ vì bão Noru; Ukraine nhận hệ thống phòng không tối tân Mỹ,/tin-the-gioi-26-9-philippines-dinh-tre-vi-bao-noru-ukraine-nhan-he-thong-phong-khong-toi-tan-my-2022092605374666.htm
Tin sáng 24-9: Khởi công cầu Nhơn Trạch TP.HCM; Tôm xuất khẩu của Việt Nam tăng tốt,/tin-sang-24-9-khoi-cong-cau-nhon-trach-tp-hcm-tom-xuat-khau-cua-viet-nam-tang-tot-20220923230922417.htm
Cần có quy định công khai quà tặng,/can-co-quy-dinh-cong-khai-qua-tang-20220918082938136.htm
"Thủ tướng giao nhiệm vụ ổn định kinh tế, kiểm soát lạm phát",/thu-tuong-giao-nhiem-vu-on-dinh-kinh-te-kiem-soat-lam-phat-20220917223804586.htm
Đề xuất Chính phủ cho doanh nghiệp tạm nộp 80% tiền thuế thu nhập 4 quý,/de-xuat-chinh-phu-cho-doanh-nghiep-tam-nop-80-tien-thue-thu-nhap-4-quy-20220914191249347.htm
"TP.HCM, Hà Nội đứng đầu về số tiền hỗ trợ từ quỹ bảo hiểm thất nghiệp",/tp-hcm-ha-noi-dung-dau-ve-so-tien-ho-tro-tu-quy-bao-hiem-that-nghiep-20220912173216222.htm
PVN kiến nghị Thủ tướng tháo gỡ khó khăn nhiều dự án lớn,/pvn-kien-nghi-thu-tuong-thao-go-kho-khan-nhieu-du-an-lon-20220911093416446.htm
Tại sao năm nào các bộ cũng phải có ý kiến và trình đề xuất số ngày nghỉ Tết?,/tai-sao-nam-nao-cac-bo-cung-phai-co-y-kien-va-trinh-de-xuat-so-ngay-nghi-tet-20220909100908341.htm
"Đấu giá biển số ô tô: Đề xuất không cho chuyển nhượng, tặng, thừa kế biển số trúng đấu giá",/dau-gia-bien-so-o-to-de-xuat-khong-cho-chuyen-nhuong-tang-thua-ke-bien-so-trung-dau-gia-20220909152510393.htm
