Title,URL
Giải mã chiến lược Chuyển đổi số hiệu quả dành cho doanh nghiệp,/giai-ma-chien-luoc-chuyen-doi-so-hieu-qua-danh-cho-doanh-nghiep-20230919161903988.htm
"Pin xe đạp, xe máy điện có những loại nào, độ an toàn ra sao?",/pin-xe-dap-xe-may-dien-co-nhung-loai-nao-co-do-an-toan-ra-sao-20230918191211991.htm
Tiềm năng to lớn từ kinh tế số để quảng bá sản phẩm OCOP,/tiem-nang-to-lon-tu-kinh-te-so-de-quang-ba-san-pham-ocop-20230916174957051.htm
Lần đầu tổ chức diễn đàn quốc gia về kinh tế số - xã hội số,/lan-dau-to-chuc-dien-dan-quoc-gia-ve-kinh-te-so-xa-hoi-so-20230914132116446.htm
Bắt kẻ cấu kết với nhân viên ngân hàng để mua bán thông tin tài khoản,/bat-ke-cau-ket-voi-nhan-vien-ngan-hang-de-mua-ban-thong-tin-tai-khoan-20230912175137984.htm
Tầm nhìn 'hổ châu Á',/tam-nhin-ho-chau-a-20230911083836378.htm
Nhiều hợp đồng tỉ đô chờ ký trong chuyến thăm của tổng thống Mỹ,/nhieu-hop-dong-ti-do-cho-ky-trong-chuyen-tham-cua-tong-thong-my-20230909164454673.htm
Trang bị ‘kỹ năng mềm’ cho sinh viên,/trang-bi-ky-nang-mem-cho-sinh-vien-20230909113247697.htm
Audi Q8 2024 ra mắt: Đèn ban ngày cho người dùng tự thiết kế,/audi-q8-2024-ra-mat-den-ban-ngay-cho-nguoi-dung-tu-thiet-ke-20230906182801019.htm
Chuyển đổi số báo chí: nhiều điều mong muốn nhưng chưa làm được,/chuyen-doi-so-bao-chi-nhieu-dieu-mong-muon-nhung-chua-lam-duoc-20230907185611568.htm
Cảnh báo thủ đoạn nhờ khách sạn đặt tiệc để lừa đảo,/canh-bao-thu-doan-nho-khach-san-dat-tiec-de-lua-dao-20230907101000274.htm
ChatGPT có thể thay thế sách và tự đọc sách không?,/chatgpt-co-the-thay-the-sach-va-tu-doc-sach-khong-20230901174543195.htm
Mỹ buộc tội người giúp buôn lậu vi điện tử sang Nga,/my-buoc-toi-nguoi-giup-buon-lau-vi-dien-tu-sang-nga-2023090107332096.htm
Điểm tin 18h: Phà Vàm cống chạy lại từ 1-9; Ca sĩ bán kẹo kéo thi hoa hậu Hoàn vũ Việt Nam,/diem-tin-18h-pha-vam-cong-chay-lai-tu-1-9-ca-si-ban-keo-keo-thi-hoa-hau-hoan-vu-viet-nam-20230831164435194.htm
Nông thôn mới Quảng Trị chuyển biến mạnh mẽ từ lượng sang chất,/nong-thon-moi-quang-tri-chuyen-bien-manh-me-tu-luong-sang-chat-20230831104518078.htm
Kinh tế Trung Quốc: Nỗi lo giảm phát,/kinh-te-trung-quoc-noi-lo-giam-phat-20230825090128892.htm
Lệch pha công nghệ metro: Không ổn,/lech-pha-cong-nghe-metro-khong-on-20230822093535959.htm
Start-up Việt nhộn nhịp xuất ngoại,/start-up-viet-nhon-nhip-xuat-ngoai-20230820212500461.htm
Vụ Việt Á: Cơ quan điều tra nói gì về trách nhiệm của lãnh đạo Bộ Khoa học và Công nghệ?,/vu-viet-a-co-quan-dieu-tra-noi-gi-ve-trach-nhiem-cua-lanh-dao-bo-khoa-hoc-va-cong-nghe-20230819151050788.htm
Các tỉ phú công nghệ đổ xô đến Ukraine,/cac-ti-phu-cong-nghe-do-xo-den-ukraine-20230817105013701.htm
Vụ Trung tâm Ứng dụng tiến bộ khoa học công nghệ Bạc Liêu tự đóng cửa: nguyên giám đốc đòi nợ lương,/vu-trung-tam-ung-dung-tien-bo-khoa-hoc-cong-nghe-bac-lieu-tu-dong-cua-nguyen-giam-doc-doi-no-luong-20230817164735214.htm
Xây dựng ‘tòa soạn số’ để phục vụ bạn đọc tốt hơn,/xay-dung-toa-soan-so-de-phuc-vu-ban-doc-tot-hon-20230817144140344.htm
Khi điện thoại 'nửa kia' có app hẹn hò,/khi-dien-thoai-nua-kia-co-app-hen-ho-20230813100431693.htm
Chia lại miếng bánh bản đồ,/chia-lai-mieng-banh-ban-do-20230802090504801.htm
"Làm sếp của những người thông minh, dễ hay khó?",/lam-sep-cua-nhung-nguoi-thong-minh-de-hay-kho-20230720145834102.htm
Bản sao kỹ thuật số thời GPT,/ban-sao-ky-thuat-so-thoi-gpt-20230727161234119.htm
Tài xế xe công nghệ ám ảnh với tiền trả góp,/tai-xe-xe-cong-nghe-am-anh-voi-tien-tra-gop-2023080322454538.htm
Chơi xổ số vui theo nhu cầu,/choi-xo-so-vui-theo-nhu-cau-20230801135945893.htm
Ứng dụng công nghệ trong học tiếng Anh: bệ phóng giúp con bứt phá,/ung-dung-cong-nghe-trong-hoc-tieng-anh-be-phong-giup-con-but-pha-20230729054038447.htm
Tin tức thế giới 28-7: Ukraine giữ thiết quân luật; Tình báo Mỹ khẳng định Trung Quốc giúp Nga,/tin-tuc-the-gioi-28-7-ukraine-giu-thiet-quan-luat-tinh-bao-my-khang-dinh-trung-quoc-giup-nga-20230728055444023.htm
Đọc báo cùng bạn 25-7: Gỡ trăn trở cho 'liệt sĩ sống',/doc-bao-cung-ban-25-7-go-tran-tro-cho-liet-si-song-2023072503524158.htm
Xe đạp có công nghệ cảnh báo va chạm như ô tô,/xe-dap-co-cong-nghe-canh-bao-va-cham-nhu-o-to-20230719151123507.htm
Trung ương Đoàn phát động xây dựng 'Làng quê đáng sống',/trung-uong-doan-phat-dong-xay-dung-lang-que-dang-song-20230723161112668.htm
‘Nuôi heo đất’ thời công nghệ số,/nuoi-heo-dat-thoi-cong-nghe-so-20230718164113531.htm
Báo Mỹ: Nỗ lực số hóa của Việt Nam thúc đẩy phong trào khởi nghiệp,/bao-my-no-luc-so-hoa-cua-viet-nam-thuc-day-phong-trao-khoi-nghiep-20230713153747457.htm
Thúc đẩy sản phẩm công nghệ số Make in Viet Nam ra thị trường nước ngoài,/thuc-day-san-pham-cong-nghe-so-make-in-viet-nam-ra-thi-truong-nuoc-ngoai-20230712104211986.htm
"Chuyện dài thu ""thuế dẫn bài"" từ Google, Facebook",/chuyen-dai-thu-thue-dan-bai-tu-google-facebook-20230707105504348.htm
Chuyển đổi số không khó khăn vì công nghệ,/chuyen-doi-so-khong-kho-khan-vi-cong-nghe-20230706120545293.htm
VIB ra mắt ứng dụng ngân hàng số tích hợp Soft POS,/vib-ra-mat-ung-dung-ngan-hang-so-tich-hop-soft-pos-20230705184840448.htm
Úc tài trợ thêm 17 triệu AUD cho đổi mới sáng tạo của Việt Nam,/uc-tai-tro-them-17-trieu-aud-cho-doi-moi-sang-tao-cua-viet-nam-20230630193247862.htm
Sẽ vinh danh Top 10 doanh nghiệp công nghệ số xuất sắc Việt Nam 2023,/se-vinh-danh-top-10-doanh-nghiep-cong-nghe-so-xuat-sac-viet-nam-2023-20230627190238198.htm
"Để an toàn, bảo mật cho khách hàng, Vietcombank điều chỉnh phí dịch vụ thẻ",/de-an-toan-bao-mat-cho-khach-hang-vietcombank-dieu-chinh-phi-dich-vu-the-20230626161317321.htm
VNPAY triển khai hàng trăm ưu đãi hấp dẫn hưởng ứng Ngày không tiền mặt 2023,/vnpay-trien-khai-hang-tram-uu-dai-hap-dan-huong-ung-ngay-khong-tien-mat-2023-20230626131356712.htm
Chuyển đổi số cán bộ,/chuyen-doi-so-can-bo-20230626090044324.htm
Cán bộ 'yếu' công nghệ thông tin không được xét khen thưởng,/can-bo-yeu-cong-nghe-thong-tin-khong-duoc-xet-khen-thuong-20230624100822342.htm
Việt Nam là quốc gia tăng trưởng nhanh về ứng dụng ngân hàng số,/viet-nam-la-quoc-gia-tang-truong-nhanh-ve-ung-dung-ngan-hang-so-20230620191526876.htm
Trung Quốc phản đối quan chức Anh gặp lãnh đạo Đài Loan,/trung-quoc-phan-doi-quan-chuc-anh-gap-lanh-dao-dai-loan-20230618213423012.htm
Ứng dụng công nghệ ngăn tảo hôn,/ung-dung-cong-nghe-ngan-tao-hon-20230618000207239.htm
Quan chức cấp cao của Đài Loan gặp một loạt thành viên chính phủ Anh,/quan-chuc-cap-cao-cua-dai-loan-gap-mot-loat-thanh-vien-chinh-phu-anh-20230617115613322.htm
Người làm báo cần thay đổi tư duy để tham gia vào chuyển đổi số,/nguoi-lam-bao-can-thay-doi-tu-duy-de-tham-gia-vao-chuyen-doi-so-20230616195248894.htm
Chân dung chi tiết của một giám đốc công nghệ thông tin (phần 1),/chan-dung-chi-tiet-cua-mot-giam-doc-cong-nghe-thong-tin-phan-1-20230608161337323.htm
"Công nghệ thông tin - viễn thông Việt Nam là điểm sáng, doanh thu tới 148 tỉ USD",/cong-nghe-thong-tin-vien-thong-viet-nam-la-diem-sang-doanh-thu-toi-148-ti-usd-20230612201147092.htm
CEO Ngân hàng ACB: Chuyển đổi số phải quyết liệt và đi vào thực chất,/ceo-ngan-hang-acb-chuyen-doi-so-phai-quyet-liet-va-di-vao-thuc-chat-20230606092043324.htm
"Honduras mở đại sứ quán tại Trung Quốc, quan chức cấp cao Đài Loan sắp thăm Anh",/honduras-mo-dai-su-quan-tai-trung-quoc-quan-chuc-cap-cao-dai-loan-sap-tham-anh-20230611122111533.htm
Đã đến lúc sửa đổi Luật Báo chí 2016 để phù hợp với thực tiễn,/da-den-luc-sua-doi-luat-bao-chi-2016-de-phu-hop-voi-thuc-tien-202306101423053.htm
'Chuyển đổi số để người dân hạnh phúc hơn',/chuyen-doi-so-de-nguoi-dan-hanh-phuc-hon-20230609173153815.htm
Có cơ chế tháo gỡ cho dự án công viên phần mềm số 2 Đà Nẵng,/co-co-che-thao-go-cho-du-an-cong-vien-phan-mem-so-2-da-nang-20230608095320611.htm
"Cơn sốt ""toàn nhập"" trong phòng triển lãm",/con-sot-toan-nhap-trong-phong-trien-lam-20230601085946775.htm
Nghệ thuật vị AI,/nghe-thuat-vi-ai-20230524090632072.htm
Bộ Thông tin và Truyền thông đánh giá mức độ chuyển đổi số của các cơ quan báo chí,/bo-thong-tin-va-truyen-thong-danh-gia-muc-do-chuyen-doi-so-cua-cac-co-quan-bao-chi-20230603084324442.htm
EVNCPC liên tục đoạt giải thưởng cao trong sáng tạo khoa học,/evncpc-lien-tuc-doat-giai-thuong-cao-trong-sang-tao-khoa-hoc-20230601112930112.htm
"Từ ngày 1-6, cá nhân được đăng ký tên miền .vn với lệ phí siêu rẻ",/tu-ngay-1-6-ca-nhan-duoc-dang-ky-ten-mien-vn-voi-le-phi-sieu-re-20230531213919526.htm
'Vắc xin số' bảo vệ trẻ trên mạng,/vac-xin-so-bao-ve-tre-tren-mang-20230530230927312.htm
Nghiên cứu chính sách thử nghiệm thu hút tập đoàn công nghệ số hàng đầu thế giới,/nghien-cuu-chinh-sach-thu-nghiem-thu-hut-tap-doan-cong-nghe-so-hang-dau-the-gioi-20230525061312814.htm
VIETMAP: hành trình trở thành thương hiệu hàng đầu lĩnh vực bản đồ số,/vietmap-hanh-trinh-tro-thanh-thuong-hieu-hang-dau-linh-vuc-ban-do-so-20230524172545352.htm
Khai thác dữ liệu số là ‘mỏ vàng’ cho tăng trưởng kinh tế,/khai-thac-du-lieu-so-la-mo-vang-cho-tang-truong-kinh-te-20230524162054498.htm
Samsung mang chương trình giáo dục công nghệ toàn cầu đến miền Trung,/samsung-mang-chuong-trinh-giao-duc-cong-nghe-toan-cau-den-mien-trung-2023052319001674.htm
Tiếp tục xử lý các sai phạm ở Sở Khoa học và Công nghệ Đồng Nai,/tiep-tuc-xu-ly-cac-sai-pham-o-so-khoa-hoc-cong-nghe-dong-nai-20230523145505245.htm
Công nghệ cao - trụ cột phát triển Đà Nẵng trong tương lai,/cong-nghe-cao-tru-cot-phat-trien-da-nang-trong-tuong-lai-202305221631157.htm
Đón hè năng động cùng Lễ hội thiếu nhi lần đầu tổ chức ở TP.HCM,/don-he-nang-dong-cung-le-hoi-thieu-nhi-lan-dau-to-chuc-o-tp-hcm-20230522132423129.htm
Bảo vệ dữ liệu cá nhân tại Việt Nam: Pháp lý đầu tiên và con đường dài phía trước,/bao-ve-du-lieu-ca-nhan-tai-viet-nam-phap-ly-dau-tien-va-con-duong-dai-phia-truoc-2023050511342229.htm
VietinBank: 97% giao dịch khách hàng thực hiện trên kênh số,/vietinbank-97-giao-dich-khach-hang-thuc-hien-tren-kenh-so-20230519182241288.htm
Đề xuất WTO kết nối đưa sản phẩm của Việt Nam ra thế giới,/de-xuat-wto-ket-noi-dua-san-pham-cua-viet-nam-ra-the-gioi-20230519163024726.htm
Tin tức sáng 19-5: Đề xuất ngừng nhà máy đạm Cà Mau và Phú Mỹ nhường khí cho điện,/tin-tuc-sang-19-5-de-xuat-ngung-nha-may-dam-ca-mau-va-phu-my-nhuong-khi-cho-dien-20230518152521363.htm
Ba công nghệ định hình xu hướng tiếp thị số,/ba-cong-nghe-dinh-hinh-xu-huong-tiep-thi-so-20230517143226008.htm
"Tin tức sáng 15-5: El Nino quay lại, nhiều nơi đối mặt nắng nóng kỷ lục",/tin-tuc-sang-15-5-el-nino-quay-lai-nhieu-noi-doi-mat-nang-nong-ky-luc-20230510141748572.htm
"Giới trẻ Trung Quốc: Gõ mõ online, thành tâm hướng thiện",/gioi-tre-trung-quoc-go-mo-online-thanh-tam-huong-thien-20230504082930456.htm
"Game hóa bài giảng, học sinh có học tốt hơn?",/game-hoa-bai-giang-hoc-sinh-co-hoc-tot-hon-20230513165208901.htm
Triển khai nhiều giải pháp giải quyết thủ tục hưởng BHXH một lần,/trien-khai-nhieu-giai-phap-giai-quyet-thu-tuc-huong-bhxh-mot-lan-20230510161433615.htm
Business Analyst (BA) là ai? Vị trí BA phụ trách những công việc gì? (phần 1),/business-analyst-ba-la-ai-vi-tri-ba-phu-trach-nhung-cong-viec-gi-phan-1-20230510113026464.htm
"15 triệu công nhân, kỹ sư... cần thích nghi với chuyển đổi số",/15-trieu-cong-nhan-ky-su-can-thich-nghi-voi-chuyen-doi-so-20230509111323024.htm
Ba người bị phạt vì chuyển người chết do bệnh thành 'bị đâm nhiều nhát',/ba-nguoi-bi-phat-vi-chuyen-nguoi-chet-do-benh-thanh-bi-dam-nhieu-nhat-2023050611414295.htm
Ngân hàng Agribank giành 'cú đúp' giải thưởng Sao Khuê 2023,/ngan-hang-agribank-gianh-cu-dup-giai-thuong-sao-khue-2023-20230505174425953.htm
Chuyển đổi số ngành GTVT và bài toán nguồn nhân lực,/chuyen-doi-so-nganh-gtvt-va-bai-toan-nguon-nhan-luc-20230422093714467.htm
Chuyên viên Marketing là ai? Kỹ năng cần có và điều kiện ứng tuyển (phần 2),/chuyen-vien-marketing-la-ai-ky-nang-can-co-va-dieu-kien-ung-tuyen-phan-2-20230421142839325.htm
Tạo môi trường thuận lợi để mọi người viết và đọc sách,/tao-moi-truong-thuan-loi-de-moi-nguoi-viet-va-doc-sach-20230421195036407.htm
Đột phá trong ngành công nghiệp dược phẩm nhờ ứng dụng AI,/dot-pha-trong-nganh-cong-nghiep-duoc-pham-nho-ung-dung-ai-20230419142057446.htm
Thái Lan áp dụng nhận dạng khuôn mặt trong kiểm soát dịch bệnh,/thai-lan-ap-dung-nhan-dang-khuon-mat-trong-kiem-soat-dich-benh-20230417155551203.htm
AI giúp chúng ta 'gặp lại' người thân đã khuất?,/ai-giup-chung-ta-gap-lai-nguoi-than-da-khuat-20230414230732374.htm
7 điều ứng viên cần biết về vị trí giao dịch viên (Phần 1),/7-dieu-ung-vien-can-biet-ve-vi-tri-giao-dich-vien-phan-1-20230406160439435.htm
"‘Xã 4.0’ và nỗ lực phổ cập thanh toán, tài chính số của Viettel Money",/xa-40-va-no-luc-pho-cap-thanh-toan-tai-chinh-so-cua-viettel-money-20230410174420623.htm
Gen Z tìm gì qua kính ngắm máy ảnh kỹ thuật số?,/gen-z-tim-gi-qua-kinh-ngam-may-anh-ky-thuat-so-20230322094414004.htm
Cây xăng bơm thiếu nhưng tự làm tròn số tiền do lỗi mạch điện,/cay-xang-bom-thieu-nhung-tu-lam-tron-so-tien-do-loi-mach-dien-2023040412533428.htm
Generali là FDI hàng đầu về trải nghiệm khách hàng tại Việt Nam,/generali-la-fdi-hang-dau-ve-trai-nghiem-khach-hang-tai-viet-nam-20230330102541843.htm
"Sau điều tra của Tuổi Trẻ, các nền tảng quảng bá ‘siêu giảm béo’ của Americare clinic… biến mất",/sau-dieu-tra-cua-tuoi-tre-cac-nen-tang-quang-ba-sieu-giam-beo-cua-americare-clinic-bien-mat-20230327112236999.htm
Tạo bình đẳng cho người dân khi tiếp cận dịch vụ chuyển đổi số,/tao-binh-dang-cho-nguoi-dan-khi-tiep-can-dich-vu-chuyen-doi-so-20230325104405814.htm
EC đề xuất các quy định mới để giảm thiểu rác thải công nghệ,/ec-de-xuat-cac-quy-dinh-moi-de-giam-thieu-rac-thai-cong-nghe-2023032413594633.htm
Agribank Lâm Đồng hướng tới ngân hàng hiện đại chuyên nghiệp - số hóa,/agribank-lam-dong-huong-toi-ngan-hang-hien-dai-chuyen-nghiep-so-hoa-20230324150750219.htm
"Công nghệ AI giúp nông dân dự báo sản lượng, quản lý mùa vụ trồng trọt",/cong-nghe-ai-giup-nong-dan-du-bao-san-luong-quan-ly-mua-vu-trong-trot-20230323163000535.htm
"Ngân hàng chạy đua đầu tư công nghệ, thu hút khách hàng",/ngan-hang-chay-dua-dau-tu-cong-nghe-thu-hut-khach-hang-20230323155249041.htm
Miễn phí dịch vụ chữ ký số VNPT SmartCA khi giao dịch trên cổng dịch vụ công,/mien-phi-dich-vu-chu-ky-so-vnpt-smartca-khi-giao-dich-tren-cong-dich-vu-cong-20230322160737352.htm
VUS tổ chức trao chứng chỉ quốc tế Cambridge cho 1.516 học viên,/vus-to-chuc-trao-chung-chi-quoc-te-cambridge-cho-1-516-hoc-vien-20230321170528022.htm
Microsoft sẽ tích hợp ChatGPT vào các ứng dụng hỗ trợ giáo viên,/microsoft-se-tich-hop-chatgpt-vao-cac-ung-dung-ho-tro-giao-vien-2023031814195364.htm
Hé lộ lý do ô tô dễ bị hack hơn điện thoại: Tới từ chính nhà sản xuất?,/he-lo-ly-do-o-to-de-bi-hack-hon-dien-thoai-toi-tu-chinh-nha-san-xuat-20230309112913526.htm
Để con không bị nhấn chìm trong Internet,/de-con-khong-bi-nhan-chim-trong-internet-20230310225345537.htm
Du học đón đầu xu thế chuyển đổi kỹ thuật số,/du-hoc-don-dau-xu-the-chuyen-doi-ky-thuat-so-20230308123035193.htm
Cả ngàn người hớn hở tham gia phiên chợ thanh toán bằng lá cây ở Đồng Nai,/ca-ngan-nguoi-hon-ho-tham-gia-phien-cho-thanh-toan-bang-la-cay-o-dong-nai-2023030820192119.htm
"Thủ tướng gợi mở hướng hợp tác Việt Nam - Nhật Bản: đổi mới công nghệ, phát triển xanh",/thu-tuong-goi-mo-huong-hop-tac-viet-nam-nhat-ban-doi-moi-cong-nghe-phat-trien-xanh-20230307095007684.htm
"Nội thất ô tô bất thường nhất thế giới: Vô lăng dị, ghế sofa, táp lô gây ‘nhức nhối’ đều có đủ",/noi-that-o-to-bat-thuong-nhat-the-gioi-vo-lang-di-ghe-sofa-tap-lo-gay-nhuc-nhoi-deu-co-du-20230306114620317.htm
"Người khuyết tật truyền nghị lực trên mạng xã hội - Kỳ cuối: Đừng khóc, hãy yêu mình và yêu người",/nguoi-khuyet-tat-truyen-nghi-luc-tren-mang-xa-hoi-ky-cuoi-dung-khoc-hay-yeu-minh-va-yeu-nguoi-20230305230604376.htm
Viettel công bố hợp tác với Intel và Qualcomm tại MWC 2023,/viettel-cong-bo-hop-tac-voi-intel-va-qualcomm-tai-mwc-2023-20230302212017242.htm
"Đọc báo cùng bạn 1-3: Công ty 'ma' tung hoành, vì sao?",/doc-bao-cung-ban-1-3-cong-ty-ma-tung-hoanh-vi-sao-20230301030522267.htm
Ứng dụng công nghệ số trong phỏng vấn thực tập tốt nghiệp tại UEF,/ung-dung-cong-nghe-so-trong-phong-van-thuc-tap-tot-nghiep-tai-uef-20230225111524834.htm
Thủ tướng: Không yêu cầu xác nhận cư trú trong giải quyết thủ tục hành chính,/thu-tuong-khong-yeu-cau-xac-nhan-cu-tru-trong-giai-quyet-thu-tuc-hanh-chinh-20230225133206404.htm
Nguồn thu nào cho báo chí Việt thời công nghệ số?,/nguon-thu-nao-cho-bao-chi-viet-thoi-cong-nghe-so-20230224144810992.htm
Tháng Thanh niên: Tuổi trẻ tiên phong chuyển đổi số,/thang-thanh-nien-tuoi-tre-tien-phong-chuyen-doi-so-20230222150412252.htm
Phát triển ứng dụng 'Đồng Nai CĐS' mang lại tiện ích cho người dân,/phat-trien-ung-dung-dong-nai-cds-mang-lai-tien-ich-cho-nguoi-dan-20230221145949582.htm
Đua thành doanh nghiệp công nghệ,/dua-thanh-doanh-nghiep-cong-nghe-20230219233645293.htm
Đặc quyền cho chủ thẻ tín dụng trên ngân hàng số MyVIB 2.0,/dac-quyen-cho-chu-the-tin-dung-tren-ngan-hang-so-myvib-20-20230218112113873.htm
"Đi tìm ""dấu chân AI""",/di-tim-dau-chan-ai-20230210114429083.htm
Công nghệ đắt tiền đang khiến độ đáng tin cậy của xe sang giảm sút,/cong-nghe-dat-tien-dang-khien-do-dang-tin-cay-cua-xe-sang-giam-sut-20230214213107858.htm
"Lần đầu TP.HCM không thiếu máu dịp Tết, nhờ ứng dụng Giọt máu vàng",/lan-dau-tp-hcm-khong-thieu-mau-dip-tet-nho-ung-dung-giot-mau-vang-20230216120533207.htm
Shopee dự đoán 3 xu hướng tiêu dùng nổi bật tại Việt Nam năm 2023,/shopee-du-doan-3-xu-huong-tieu-dung-noi-bat-tai-viet-nam-nam-2023-20230214154418874.htm
Người dùng Việt dành hơn 37 triệu giờ mua hàng qua livestream trên một nền tảng thương mại điện tử,/nguoi-dung-viet-danh-hon-37-trieu-gio-mua-hang-qua-livestream-tren-mot-nen-tang-thuong-mai-dien-tu-20230214130759287.htm
"99% mô hình nuôi biển tại Việt Nam là nhỏ lẻ, cần gỡ nút thắt về chính sách để nuôi công nghiệp",/99-mo-hinh-nuoi-bien-tai-viet-nam-la-nho-le-can-go-nut-that-ve-chinh-sach-de-nuoi-cong-nghiep-20230214110657254.htm
Bộ Chính trị: Đưa Việt Nam vào tốp đầu châu Á về công nghệ sinh học,/bo-chinh-tri-dua-viet-nam-vao-top-dau-chau-a-ve-cong-nghe-sinh-hoc-20230206175035667.htm
Chung sống cùng ChatGPT,/chung-song-cung-chatgpt-20230206072452247.htm
"Năm 2022: MB làm chủ công nghệ, tiếp tục ghi dấu ấn chuyển đổi số",/nam-2022-mb-lam-chu-cong-nghe-tiep-tuc-ghi-dau-an-chuyen-doi-so-20230201105328979.htm
Nhật hạn chế xuất khẩu công nghệ qua Nga và Trung Quốc,/nhat-han-che-xuat-khau-cong-nghe-qua-nga-va-trung-quoc-20230127105000134.htm
"Gần Tết, bắt được xe công nghệ cứ như... trúng số",/gan-tet-bat-duoc-xe-cong-nghe-cu-nhu-trung-so-20230118162649227.htm
"Mê ""nhìn lại"", quên nhìn lại an toàn dữ liệu",/me-nhin-lai-quen-nhin-lai-an-toan-du-lieu-20230104091825363.htm
Làm vườn 'thu hoạch' data,/lam-vuon-thu-hoach-data-20230109085513042.htm
Bệnh viện đông sinh ra 'cò' khám bệnh?,/benh-vien-dong-sinh-ra-co-kham-benh-20230108134310735.htm
Kiến nghị tiếp tục khai thác cầu tàu bến Bạch Đằng phục vụ du lịch đường thủy,/kien-nghi-tiep-tuc-khai-thac-cau-tau-ben-bach-dang-phuc-vu-du-lich-duong-thuy-20230107145735578.htm
"Năm 2022, TP.HCM chi 10.000 tỉ đồng cho khoa học công nghệ",/nam-2022-tp-hcm-chi-10-000-ti-dong-cho-khoa-hoc-cong-nghe-20230106171221924.htm
Trung Quốc mở 'chợ' tài sản kỹ thuật số,/trung-quoc-mo-cho-tai-san-ky-thuat-so-20230104113246154.htm
Hút tiền từ trung tâm dữ liệu ở Việt Nam,/hut-tien-tu-trung-tam-du-lieu-o-viet-nam-20230102233503088.htm
"Công đoàn Tổng công ty Điện lực miền Nam hoàn thành nhiệm vụ, về đích trước 3 tháng",/cong-doan-tong-cong-ty-dien-luc-mien-nam-hoan-thanh-nhiem-vu-ve-dich-truoc-3-thang-20221231143726998.htm
Trung tâm công nghệ cao Trung Quốc bỏ hạn chế mua bất động sản để kích cầu,/trung-tam-cong-nghe-cao-trung-quoc-bo-han-che-mua-bat-dong-san-de-kich-cau-20221230211258717.htm
Điện lực Bình Thuận ứng dụng chuyển đổi số trong dịch vụ khách hàng,/dien-luc-binh-thuan-ung-dung-chuyen-doi-so-trong-dich-vu-khach-hang-20221230083246186.htm
Công ty Điện lực Đồng Tháp áp dụng chuyển đổi số trong 6 lĩnh vực cốt lõi,/cong-ty-dien-luc-dong-thap-ap-dung-chuyen-doi-so-trong-6-linh-vuc-cot-loi-20221228114526048.htm
"Năm 2022, nhiều cơ quan báo chí đã tiếp cận công nghệ làm báo hiện đại",/nam-2022-nhieu-co-quan-bao-chi-da-tiep-can-cong-nghe-lam-bao-hien-dai-20221224103208675.htm
Điện lực TP.HCM được chứng nhận hình thành doanh nghiệp số,/dien-luc-tp-hcm-duoc-chung-nhan-hinh-thanh-doanh-nghiep-so-20221221134929378.htm
Apple sản xuất MacBook tại Việt Nam vào năm 2023,/apple-san-xuat-macbook-tai-viet-nam-vao-nam-2023-20221220145146567.htm
Phụ phẩm gạo lên sàn thương mại điện tử hy vọng giao dịch được 50.000 tấn/tháng,/phu-pham-gao-len-san-thuong-mai-dien-tu-hy-vong-giao-dich-duoc-50-000-tan-thang-2022121911551454.htm
‘Sau một năm nếu không hoàn thành nhiệm vụ thì chủ động xin từ chức’,/sau-mot-nam-neu-khong-hoan-thanh-nhiem-vu-thi-chu-dong-xin-tu-chuc-20221218113807626.htm
EU dọa trừng phạt Elon Musk vì Twitter đình chỉ tài khoản nhà báo,/eu-doa-trung-phat-elon-musk-vi-twitter-dinh-chi-tai-khoan-nha-bao-20221217071736838.htm
"Samsung Innovation Campus: Giáo dục nguồn nhân lực chủ chốt, làm chủ tương lai 4.0",/samsung-innovation-campus-giao-duc-nguon-nhan-luc-chu-chot-lam-chu-tuong-lai-40-20221216083415616.htm
"Ứng dụng công nghệ sẽ giúp 'chốt đơn' nhà, đất nhanh hơn",/ung-dung-cong-nghe-se-giup-chot-don-nha-dat-nhanh-hon-20221215113225979.htm
Agribank Digital chinh phục khách hàng đam mê công nghệ,/agribank-digital-chinh-phuc-khach-hang-dam-me-cong-nghe-20221214075124254.htm
Đại biểu 'gen Z' dự Đại hội Đoàn XII có thành tích đáng nể,/dai-bieu-gen-z-du-dai-hoi-doan-xii-co-thanh-tich-dang-ne-20221213101746931.htm
OCB ‘trình làng’ hệ sinh thái ngân hàng số có tính ứng dụng cao,/ocb-trinh-lang-he-sinh-thai-ngan-hang-so-co-tinh-ung-dung-cao-20221212075915242.htm
"Mazda6 2024 chưa biến thành 'xe sang cầu sau' như lời đồn, chỉ nâng cấp nhỏ để giữ khách",/mazda6-2024-chua-bien-thanh-xe-sang-cau-sau-nhu-loi-don-chi-nang-cap-nho-de-giu-khach-20221209155126792.htm
Tăng cường hợp tác Việt Nam - Tanzania trong lĩnh vực thông tin và truyền thông,/tang-cuong-hop-tac-viet-nam-tanzania-trong-linh-vuc-thong-tin-va-truyen-thong-20221210142456136.htm
VieON giành thêm giải thưởng công nghệ danh giá,/vieon-gianh-them-giai-thuong-cong-nghe-danh-gia-20221209080330328.htm
EVNCPC có hai sản phẩm được trao giải thưởng công nghệ số ‘Make in Việt Nam 2022’,/evncpc-co-hai-san-pham-duoc-trao-giai-thuong-cong-nghe-so-make-in-viet-nam-2022-20221208165538909.htm
Xuất khẩu của ngành công nghệ số năm 2022 đạt 136 tỉ USD,/xuat-khau-cua-nganh-cong-nghe-so-nam-2022-dat-136-ti-usd-2022120813052635.htm
Saigon Co.op và VNPay ký kết chiến lược thúc đẩy công nghệ số,/saigon-co-op-va-vnpay-ky-ket-chien-luoc-thuc-day-cong-nghe-so-2022120809464725.htm
VNPAY-POS lọt ‘Top 10 sản phẩm - dịch vụ Tin dùng Việt Nam 2022’,/vnpay-pos-lot-top-10-san-pham-dich-vu-tin-dung-viet-nam-2022-20221207212123532.htm
Phát triển hệ sinh thái y tế số cùng IVIRSE,/phat-trien-he-sinh-thai-y-te-so-cung-ivirse-20221206140536918.htm
