Title,URL
Washington Post: Tìm thấy tài liệu năng lực hạt nhân nước ngoài tại tư dinh ông Trump,/tim-thay-tai-lieu-nang-luc-hat-nhan-nuoc-ngoai-tai-tu-dinh-ong-trump-20220907090556807.htm
Nghịch lý cấm nuôi bò và bắt khí carbonic,/nghich-ly-cam-nuoi-bo-va-bat-khi-carbonic-20220831094608896.htm
Thường vụ Quốc hội không đồng ý chuyển tiền dành cho y tế sang làm đường,/thuong-vu-quoc-hoi-khong-dong-y-chuyen-tien-danh-cho-y-te-sang-lam-duong-2022082918484212.htm
"Kiên Giang có chỉ số PCI, SIPAS tốt, doanh nghiệp có thể vào đầu tư nhiều",/kien-giang-co-chi-so-pci-sipas-tot-doanh-nghiep-co-the-vao-dau-tu-nhieu-20220822133902319.htm
Thái Lan sẽ cấp 'thị thực vàng' có giá trị 10 năm thu hút chuyên gia nước ngoài,/thai-lan-se-cap-thi-thuc-vang-co-gia-tri-10-nam-thu-hut-chuyen-gia-nuoc-ngoai-20220822135830799.htm
Sinh và nuôi dạy tốt 10 con ở Nga được tặng danh hiệu 'Bà mẹ anh hùng',/sinh-va-nuoi-day-tot-10-con-o-nga-duoc-tang-danh-hieu-ba-me-anh-hung-20220818211906952.htm
Australia xem xét nâng trần nhập cư để tăng nguồn cung lao động,/australia-xem-xet-nang-tran-nhap-cu-de-tang-nguon-cung-lao-dong-2022081710474015.htm
Lãnh đạo Việt Nam điện thăm hỏi Hàn Quốc sau trận mưa lớn và dài nhất 115 năm,/lanh-dao-viet-nam-dien-tham-hoi-han-quoc-sau-tran-mua-lon-va-dai-nhat-115-nam-20220810175658389.htm
"Khẩn trương hoàn thành cơ sở dữ liệu đất đai quốc gia, thí điểm mô hình đại học số",/khan-truong-hoan-thanh-co-so-du-lieu-dat-dai-quoc-gia-thi-diem-mo-hinh-dai-hoc-so-20220808193706122.htm
"Từ 1-9, gửi hàng trên xe khách phải cung cấp 6 thông tin",/tu-1-9-gui-hang-tren-xe-khach-phai-cung-cap-6-thong-tin-20220807091748511.htm
"Làm nhà ở xã hội: Doanh nghiệp có đất, tiền nhưng nản vì thủ tục",/lam-nha-o-xa-hoi-doanh-nghiep-co-dat-tien-nhung-nan-vi-thu-tuc-20220805230234714.htm
Bộ Thông tin và truyền thông thành lập 3 đơn vị chuyên về chuyển đổi số,/bo-thong-tin-va-truyen-thong-thanh-lap-3-don-vi-chuyen-ve-chuyen-doi-so-20220727170013707.htm
Thủ tướng thị sát nhà ga tuyến metro số 1 Bến Thành - Suối Tiên,/thu-tuong-thi-sat-nha-ga-tuyen-metro-so-1-ben-thanh-suoi-tien-20220727080240758.htm
"Giá xăng dầu giảm, Chính phủ vẫn tiếp tục nhắc nghiên cứu giảm thuế, phí để hạ giá",/gia-xang-dau-giam-chinh-phu-van-tiep-tuc-nhac-nghien-cuu-giam-thue-phi-de-ha-gia-20220725183303884.htm
"Trình Ủy ban Thường vụ Quốc hội nghị quyết giảm thuế bảo vệ môi trường đối với xăng, dầu, mỡ nhờn",/trinh-uy-ban-thuong-vu-quoc-hoi-nghi-quyet-giam-thue-bao-ve-moi-truong-doi-voi-xang-dau-mo-nhon-20220703192549548.htm
Vì sao tiền hỗ trợ bảo vệ rừng chưa đến tay người dân?,/vi-sao-tien-ho-tro-bao-ve-rung-chua-den-tay-nguoi-dan-20220629122535217.htm
Việt Nam bắt đầu có hệ thống huấn luyện thực chiến về an ninh mạng,/viet-nam-bat-dau-co-he-thong-huan-luyen-thuc-chien-ve-an-ninh-mang-20220628165034754.htm
"Mỗi năm có hơn 20 triệu người phải rời bỏ nhà cửa do bão, lũ lụt",/moi-nam-co-hon-20-trieu-nguoi-phai-roi-bo-nha-cua-do-bao-lu-lut-20220628122554224.htm
"Xuất khẩu nông sản đạt gần 28 tỉ USD trong 6 tháng, Mỹ là thị trường lớn nhất",/xuat-khau-nong-san-dat-gan-28-ti-usd-trong-6-thang-my-la-thi-truong-lon-nh-20220628094416569.htm
JICA kiến nghị về việc Công ty metro số 1 TP.HCM hết tiền hoạt động,/jica-kien-nghi-ve-viec-cong-ty-metro-so-1-tp-hcm-het-tien-hoat-dong-20220624172833208.htm
"Động đất mạnh ở Afghanistan, ít nhất 1.000 người chết",/dong-dat-manh-o-afghanistan-it-nhat-1-000-nguoi-chet-20220622123328465.htm
Tin sáng 22-6: TP.HCM bàn cách thoát ế cho bến xe Miền Đông mới; Cho phép cơ chế đặc thù với Đà Nẵng,/tin-sang-22-6-tp-hcm-ban-cach-thoat-e-cho-ben-mien-dong-moi-cho-phep-co-che-dac-thu-voi-da-nang-20220621225342353.htm
Mỗi cầu thủ Saudi Arabia 'bỏ túi' hơn 6 tỉ đồng nhờ vô địch U23 châu Á,/moi-cau-thu-saudi-arabia-bo-tui-hon-6-ti-dong-nho-vo-dich-u23-chau-a-20220620133333892.htm
Phó thủ tướng Chính phủ tham quan và trải nghiệm triển lãm tại Ngày không tiền mặt,/pho-thu-tuong-chinh-phu-tham-quan-va-trai-nghiem-trien-lam-tai-ngay-khong-tien-mat-20220617172408283.htm
Vì sao người Đức chê vé 9 euro?,/vi-sao-nguoi-duc-che-ve-9-euro-20220614232958307.htm
"Úc đền hơn nửa tỉ USD vì hủy mua tàu ngầm, Pháp dịu giọng",/uc-den-hon-nua-ti-usd-vi-huy-mua-tau-ngam-phap-diu-giong-20220611110214356.htm
"Hai năm, Chính phủ chi hơn 351.000 tỉ để chống dịch COVID-19",/hai-nam-chinh-phu-chi-hon-351000-ti-de-chong-dich-covid-19-20220609105233316.htm
Điều chỉnh phân công công tác Phó thủ tướng thường trực Phạm Bình Minh,/dieu-chinh-phan-cong-cong-tac-pho-thu-tuong-thuong-truc-pham-binh-minh-20220608173003338.htm
Trung Quốc thúc đẩy chi tiêu bán lẻ bằng phiếu ưu đãi mua sắm,/trung-quoc-thuc-day-chi-tieu-ban-le-bang-phieu-uu-dai-mua-sam-20220606143226208.htm
TP.HCM đề xuất tăng hình phạt đối với tín dụng đen,/tp-hcm-de-xuat-tang-hinh-phat-doi-voi-tin-dung-den-20220604173430833.htm
"Trung tướng Tô Ân Xô: 'Khi công an khám xét, có bị can để hơn 10 tỉ đồng trong ngăn kéo'",/trung-tuong-to-an-xo-khi-cong-an-kham-xet-co-bi-can-de-hon-10-ti-dong-trong-ngan-keo-20220604174814046.htm
Toyota Innova 'tặng lạc' để cứu vãn doanh số,/toyota-innova-tang-lac-de-cuu-van-doanh-s-20220603152810338.htm
Mỗi người dân Việt Nam sẽ đều có tài khoản nhận hỗ trợ từ Chính phủ,/moi-nguoi-dan-viet-nam-se-deu-co-tai-khoan-nhan-ho-tro-tu-chinh-phu-20220530195952464.htm
"Intel tiếp tục đầu tư vào Việt Nam, quy mô gấp nhiều lần hiện nay",/intel-tiep-tuc-dau-tu-vao-viet-nam-quy-mo-gap-nhieu-lan-hien-nay-20220527194220124.htm
Thái Lan chi 140 tỉ đồng tiền thưởng cho SEA Games 31,/thai-lan-chi-140-ti-dong-tien-thuong-cho-sea-games-31-20220527100602336.htm
Meey Land với chuyển đổi số lĩnh vực bất động sản,/meey-land-voi-chuyen-doi-so-linh-vuc-bat-dong-san-20220524162116161.htm
Thủ tướng Phạm Minh Chính rung chuông kết thúc phiên giao dịch tại Sàn chứng khoán New York,/thu-tuong-pham-minh-chinh-rung-chuong-ket-thuc-phien-giao-dich-tai-san-chung-khoan-new-york-20220517071910046.htm
Các bệnh viện đề xuất gì sau văn bản dừng thanh toán bảo hiểm y tế chi phí dịch vụ kỹ thuật?,/cac-benh-vien-de-xuat-gi-sau-van-ban-dung-thanh-toan-bao-hiem-y-te-chi-phi-dich-vu-ky-thuat-20220514120530004.htm
Mỹ tăng gấp đôi số điểm phát thuốc điều trị COVID-19 miễn phí,/my-tang-gap-doi-so-diem-phat-thuoc-dieu-tri-covid-19-mien-phi-20220427140019201.htm
"Thanh tra mua sắm kit xét nghiệm ở Bộ Y tế, Hà Nội, TP.HCM: Phát hiện dấu hiệu vi phạm pháp luật",/thanh-tra-mua-sam-kit-xet-nghiem-o-bo-y-te-ha-noi-tp-hcm-phat-hien-dau-hieu-vi-pham-phap-luat-20220425133928545.htm
"Ca Omicron giảm mạnh, Hàn Quốc bỏ hầu hết hạn chế",/ca-omicron-giam-manh-han-quoc-bo-hau-het-han-che-20220415111819414.htm
Co-opBank triển khai hóa đơn điện tử - Bước tiến trong hành trình chuyển đổi số,/co-opbank-trien-khai-hoa-don-dien-tu-buoc-tien-trong-hanh-trinh-chuyen-doi-so-20220401171004727.htm
"Dịch COVID-19 nóng ở Thượng Hải, châu Âu tiếp tục nới lỏng hạn chế",/dich-covid-19-nong-o-thuong-hai-chau-au-tiep-tuc-noi-long-han-che-20220327104218631.htm
Chính phủ đồng ý chủ trương kéo dài thời gian thí điểm xử lý nợ xấu,/chinh-phu-dong-y-chu-truong-keo-dai-thoi-gian-thi-diem-xu-ly-no-xau-20220326185247019.htm
Thu hồi giấy phép nhập khẩu phim khi nội dung phim vi phạm quy định cấm,/thu-hoi-giay-phep-nhap-khau-phim-khi-noi-dung-phim-vi-pham-quy-dinh-cam-20220325212700526.htm
Hà Nội chốt phương án đề xuất xây dựng ga ngầm C9 cạnh hồ Gươm,/ha-noi-chot-phuong-an-de-xuat-xay-dung-ga-ngam-c9-canh-ho-guom-20220323155102228.htm
Đã đến lúc chọn lọc đầu tư FDI,/da-den-luc-chon-loc-dau-tu-fdi-20220319085031024.htm
'Nới' giới hạn giờ làm thêm của người lao động lên tối đa 72 giờ/tháng là quá cao,/noi-gioi-han-gio-lam-them-cua-nguoi-lao-dong-len-toi-da-72-gio-thang-la-qua-cao-20220310172908574.htm
Cộng đồng mạng ủng hộ Ukraine gần 8 triệu USD tiền điện tử sau 1 ngày,/cong-dong-mang-ung-ho-ukraine-gan-8-trieu-usd-tien-dien-tu-sau-1-ngay-20220228174557612.htm
Thủ tướng: Nhanh chóng đưa công dân Việt Nam rời khỏi khu vực nguy hiểm ở Ukraine,/thu-tuong-nhanh-chong-dua-cong-dan-viet-nam-roi-khoi-khu-vuc-nguy-hiem-o-ukraine-20220226183158343.htm
Đừng để doanh nghiệp như 'cá trên thớt',/dung-de-doanh-nghiep-nhu-ca-tren-thot-20220221225722025.htm
Giảm thuế VAT chưa được suôn sẻ!,/giam-thue-vat-chua-duoc-suon-se-20220219084151362.htm
Định mức nhà ở công vụ từ biệt thự 500m2 đến bình quân tối thiểu 12m2/người,/dinh-muc-nha-o-cong-vu-tu-biet-thu-500m2-den-binh-quan-toi-thieu-12m2-nguoi-20220218201923409.htm
Chậm tiêm liều nhắc lại khiến Omicron bùng phát ở Nhật,/cham-tiem-lieu-nhac-lai-khien-omicron-bung-phat-o-nhat-20220217070402704.htm
"Việt Nam chi hơn 23,7 triệu USD mua đất xây trụ sở đại sứ quán tại Mỹ",/viet-nam-chi-hon-23-7-trieu-usd-mua-dat-xay-tru-so-dai-su-quan-tai-my-20220215122222295.htm
Thủ tướng quyết định chỉ định thầu xây lắp dự án cao tốc Bắc - Nam phía Đông giai đoạn 2021-2025,/thu-tuong-quyet-dinh-chi-dinh-thau-xay-lap-du-an-cao-toc-bac-nam-phia-dong-giai-doan-2021-2025-20220211104110159.htm
Thủ tướng: Chủ động xả trạm khi ùn tắc kéo dài trên tuyến kết nối các đầu mối giao thông lớn,/thu-tuong-chu-dong-xa-tram-khi-un-tac-keo-dai-tren-tuyen-ket-noi-cac-dau-moi-giao-thong-lon-20220208184732389.htm
"Cựu quân nhân Mỹ xả súng giết 26 người, chính quyền phải bồi thường 230 triệu USD",/cuu-quan-nhan-my-xa-sung-giet-26-nguoi-chinh-quyen-phai-boi-thuong-230-trieu-usd-20220208083245625.htm
"Chính phủ đồng ý mua 21,9 triệu liều vắc xin Pfizer cho trẻ từ 5 đến dưới 12 tuổi",/chinh-phu-dong-y-mua-219-trieu-lieu-vac-xin-pfizer-cho-tre-tu-5-den-duoi-12-tuoi-20220205195214189.htm
Hung thủ các vụ xả súng thảm sát tại Mỹ hầu hết có ý định tự sát,/hung-thu-cac-vu-xa-sung-tham-sat-tai-my-hau-het-co-y-dinh-tu-sat-2022020512150984.htm
TP.HCM đạt 'vùng xanh' trong 5 tuần liên tiếp,/tp-hcm-dat-vung-xanh-trong-5-tuan-lien-tiep-20220205095005025.htm
Singapore: Quán ăn bình dân lên mạng,/singapore-quan-an-binh-dan-len-mang-20220112190514832.htm
"Từng dè dặt với tiền điện tử, Ấn Độ tính làm đồng rupee 'phiên bản số'",/tung-de-dat-voi-tien-dien-tu-an-do-tinh-lam-dong-rupee-phien-ban-so-20220202185304971.htm
"Doanh nghiệp, chuyên gia đề nghị mở cửa du lịch quốc tế từ ngày 1-2",/doanh-nghiep-chuyen-gia-de-nghi-mo-cua-du-lich-quoc-te-tu-ngay-1-2-20220124195048424.htm
Thủ tướng yêu cầu nghiên cứu mở cửa các rạp chiếu phim trên toàn quốc,/thu-tuong-yeu-cau-nghien-cuu-mo-cua-cac-rap-chieu-phim-tren-toan-quoc-20220123072405641.htm
Chính phủ Áo dành ra 1 tỉ euro thưởng người dân chịu tiêm chủng,/chinh-phu-ao-danh-ra-1-ti-euro-thuong-nguoi-dan-chiu-tiem-chung-20220120190855013.htm
Hành trình marathon bền bỉ của siêu ứng dụng MoMo,/hanh-trinh-marathon-ben-bi-cua-sieu-ung-dung-momo-20220112183549985.htm
"Thăng Long tứ trấn, Tây Sơn Thượng Đạo... được xếp hạng di tích quốc gia đặc biệt",/thang-long-tu-tran-tay-son-thuong-dao-duoc-xep-hang-di-tich-quoc-gia-dac-biet-2022011821495548.htm
Nhật Bản sẽ cho phép một số sinh viên nước ngoài nhập cảnh,/nhat-ban-se-cho-phep-mot-so-sinh-vien-nuoc-ngoai-nhap-canh-20220118141322643.htm
"2 tuần liên tiếp, TP.HCM duy trì 'vùng xanh'",/2-tuan-lien-tiep-tp-hcm-duy-tri-vung-xanh-20220115100424469.htm
Djokovic bị Chính phủ Úc hủy visa lần thứ hai,/djokovic-bi-chinh-phu-uc-huy-visa-lan-thu-hai-20220114142849333.htm
Đề xuất ‘nới’ trần giờ làm thêm tối đa 72 giờ/tháng,/de-xuat-noi-tran-gio-lam-them-toi-da-72-gio-thang-20220112112509863.htm
Chính phủ 'chốt' 9 ngày nghỉ Tết Nguyên đán và 2 ngày nghỉ Quốc khánh 2022,/chinh-phu-chot-9-ngay-nghi-tet-nguyen-dan-va-2-ngay-nghi-quoc-khanh-2022-2022011121254179.htm
Ngân hàng sẽ triển khai gói hỗ trợ lãi suất 2% cho doanh nghiệp,/ngan-hang-se-trien-khai-goi-ho-tro-lai-suat-2-cho-doanh-nghiep-20220110185854604.htm
Vì sao Hải Phòng nâng cấp độ dịch lên vùng đỏ dù chưa đến mức?,/vi-sao-hai-phong-nang-cap-do-dich-len-vung-do-du-chua-den-muc-20220109123400367.htm
Vụ HoREA 'phản pháo' ý kiến đại biểu Quốc hội: Phải sử dụng hiệu quả đất đai,/vu-horea-phan-phao-y-kien-dai-bieu-quoc-hoi-phai-su-dung-hieu-qua-dat-dai-20220108185611438.htm
"Suất đầu tư 200 tỉ đồng/km đường cao tốc Bắc - Nam, đại biểu Quốc hội lo ‘hơi cao’",/suat-dau-tu-200-ti-dong-km-duong-cao-toc-bac-nam-dai-bieu-quoc-hoi-lo-hoi-cao-20220106184319979.htm
"Tin sáng 6-1: Tốc độ lây của Omicron gấp 7 lần ở nhóm chưa tiêm vắc xin, gấp 3 lần ở nhóm tiêm đủ",/tin-sang-6-1-toc-do-lay-cua-omicron-gap-7-lan-o-nhom-chua-tiem-vac-xin-gap-3-lan-o-nhom-tiem-du-20220105203128633.htm
Trung Quốc kêu gọi đảng viên sinh 3 con để làm gương,/trung-quoc-keu-goi-dang-vien-sinh-3-con-de-lam-guong-20220105103332018.htm
"Chứng khoán vượt đỉnh 1.500 điểm trong phiên đầu năm, kỳ vọng gói kích thích kinh tế",/chung-khoan-vuot-dinh-1-500-diem-trong-phien-dau-nam-ky-vong-goi-kich-thich-kinh-te-20220104101936673.htm
Chính phủ đề xuất giảm thuế giá trị gia tăng từ 10% xuống 8%,/chinh-phu-de-xuat-giam-thue-gia-tri-gia-tang-tu-10-xuong-8-20220103225630549.htm
"Mở lại đường bay thương mại với Nhật, kiều bào mừng vì kịp về quê ăn Tết",/mo-lai-duong-bay-thuong-mai-voi-nhat-kieu-bao-mung-vi-kip-ve-que-an-tet-20220101174923012.htm
Philippines siết quy định chống dịch với 13 triệu dân ở thủ đô,/philippines-siet-quy-dinh-chong-dich-voi-13-trieu-dan-o-thu-do-20211231214611473.htm
Thuốc điều trị COVID-19 chính thức được kinh doanh thương mại tại Lào,/thuoc-dieu-tri-covid-19-chinh-thuc-duoc-kinh-doanh-thuong-mai-tai-lao-20211230143214752.htm
"Chủ nhà hàng, quán bar ở Ý yêu cầu chính phủ hỗ trợ vì thất thu dịp kinh doanh cuối năm",/chu-nha-hang-quan-bar-o-y-yeu-cau-chinh-phu-ho-tro-vi-that-thu-dip-kinh-doanh-cuoi-nam-20211229221312112.htm
"Chống dịch hiệu quả, thủ tướng Nhật Bản được tín nhiệm cao",/chong-dich-hieu-qua-thu-tuong-nhat-ban-duoc-tin-nhiem-cao-20211227093653981.htm
Trải nghiệm thực tế ảo sẽ góp phần hồi phục du lịch,/trai-nghiem-thuc-te-ao-se-gop-phan-hoi-phuc-du-lich-20211222093508305.htm
"Năm 2021, VNPT hoàn thành 'mục tiêu kép' với nhiều dấu ấn",/nam-2021-vnpt-hoan-thanh-muc-tieu-kep-voi-nhieu-dau-an-20211224192121649.htm
Thủ tướng: Hoàn thành tiêm mũi thứ 3 cho người từ 18 tuổi trở lên trong quý 1-2022,/thu-tuong-hoan-thanh-tiem-mui-thu-3-cho-nguoi-tu-18-tuoi-tro-len-trong-quy-1-2022-20211223225324359.htm
Xuất khẩu vũ khí của Mỹ thời Biden giảm mạnh so với thời Trump,/xuat-khau-vu-khi-cua-my-thoi-biden-giam-manh-so-voi-thoi-trump-2021122305584728.htm
Nhiều nước phải điều chỉnh quy định chống dịch vì Omicron,/nhieu-nuoc-phai-dieu-chinh-quy-dinh-chong-dich-vi-omicron-2021122222475785.htm
Kiến nghị Thủ tướng cho người Việt ở nước ngoài về nước theo chương trình du lịch,/kien-nghi-thu-tuong-cho-nguoi-viet-o-nuoc-ngoai-ve-nuoc-theo-chuong-trinh-du-lich-20211216184852152.htm
"Thủ tướng: Phải đổi mới sáng tạo trong y tế, không thể cái gì cũng đi xin, đi mua",/thu-tuong-phai-doi-moi-sang-tao-trong-y-te-khong-the-cai-gi-cung-di-xin-di-mua-20211214181151193.htm
Thanh tra Chính phủ: Bình Thuận thiếu sót liên quan một số dự án bất động sản,/thanh-tra-chinh-phu-binh-thuan-thieu-sot-lien-quan-mot-so-du-an-bat-dong-san-20211214180326653.htm
Thí điểm khôi phục chuyến bay quốc tế từ ngày 1-1-2022,/thi-diem-khoi-phuc-chuyen-bay-quoc-te-tu-ngay-1-1-2022-20211210235005316.htm
Thủ tướng sẽ tham dự Diễn đàn Quốc gia phát triển doanh nghiệp công nghệ số,/thu-tuong-se-tham-du-dien-dan-quoc-gia-phat-trien-doanh-nghiep-cong-nghe-so-20211207201042799.htm
Tỉ lệ trẻ em đuối nước ở Việt Nam vẫn gấp 3 lần nước thu nhập cao,/ti-le-tre-em-duoi-nuoc-o-viet-nam-van-gap-3-lan-nuoc-thu-nhap-cao-20211130141309455.htm
"Các nhà khoa học kinh ngạc, chính phủ nhiều nước lo lắng trước 'siêu đột biến'",/cac-nha-khoa-hoc-kinh-ngac-chinh-phu-nhieu-nuoc-lo-lang-truoc-sieu-dot-bien-20211127000753056.htm
"Diễn đàn Trí thức trẻ Việt Nam gửi gắm nhiều ý kiến, tham luận tâm huyết",/dien-dan-tri-thuc-tre-viet-nam-gui-gam-nhieu-y-kien-tham-luan-tam-huyet-20211126165929986.htm
"Trí thức trẻ mạnh dạn đón đầu, công cuộc chuyển đổi số mới nhanh",/tri-thuc-tre-manh-dan-don-dau-cong-cuoc-chuyen-doi-so-moi-nhanh-20211125154232348.htm
Nửa triệu liều AstraZeneca do Argentina tặng về đến Hà Nội,/nua-trieu-lieu-astrazeneca-do-argentina-tang-ve-den-ha-noi-20211124193502488.htm
AEON sẽ tăng gấp đôi trung tâm thương mại tại Việt Nam,/aeon-se-tang-gap-doi-trung-tam-thuong-mai-tai-viet-nam-20211123212018641.htm
"Công ty Điện lực Gia Định: số hóa trong quản lý kinh doanh, dịch vụ khách hàng",/cong-ty-dien-luc-gia-dinh-so-hoa-trong-quan-ly-kinh-doanh-dich-vu-khach-hang-20211121154123169.htm
Đề xuất sửa Luật kinh doanh bất động sản của Bộ Xây dựng gây tranh cãi,/de-xuat-sua-luat-kinh-doanh-bat-dong-san-cua-bo-xay-dung-gay-tranh-cai-20211118131756555.htm
Số phận kỳ lạ của Julian Assange,/so-phan-ky-la-cua-julian-assange-1615912.htm
3 mục tiêu tiêm chủng vào đầu năm 2022,/3-muc-tieu-tiem-chung-vao-dau-nam-2022-20211114071615815.htm
Chủ tịch tỉnh chịu trách nhiệm nếu chậm giải phóng mặt bằng dự án điện,/chu-tich-tinh-chiu-trach-nhiem-neu-cham-giai-phong-mat-bang-du-an-dien-20211112170529723.htm
Tuyến vận tải ven biển là ưu tiên số 1 để giảm tải cho đường bộ,/tuyen-van-tai-ven-bien-la-uu-tien-so-1-de-giam-tai-cho-duong-bo-20211110152256588.htm
"Thủ tướng ra quyết định 33, thêm nhiều người nhận hỗ trợ từ gói 26.000 tỉ đồng",/thu-tuong-ra-quyet-dinh-33-them-nhieu-nguoi-nhan-ho-tro-tu-goi-26-000-ti-don-20211109191740313.htm
"Tin sáng 9-11: Số ca mắc tăng, TP.HCM mở rộng xét nghiệm, không hạn chế đi lại",/tin-sang-9-10-so-ca-mac-tang-tp-hcm-mo-rong-xet-nghiem-khong-han-che-di-lai-20211109071901967.htm
Nâng hạn mức bảo hiểm tiền gửi,/nang-han-muc-bao-hiem-tien-gui-20211027132633766.htm
Đề xuất Thủ tướng cho doanh nghiệp chưa phải tạm nộp 75% số thuế thu nhập 3 quý,/de-xuat-thu-tuong-cho-doanh-nghiep-chua-phai-tam-nop-75-so-thue-thu-nhap-3-quy-20211103200610623.htm
Sử dụng khu vực biển thu tiền ra sao?,/su-dung-khu-vuc-bien-thu-tien-ra-sao-20211102203913025.htm
Singapore cảnh báo nước này sẽ có 2.000 người chết/năm vì COVID-19,/singapore-canh-bao-nuoc-nay-se-co-2000-nguoi-chet-nam-vi-covid-19-2021110117041481.htm
Tin sáng 30-10: Việt Nam chuẩn bị bay quốc tế; hoãn ban hành quy định giá xét nghiệm,/tin-sang-30-10-viet-nam-chuan-bi-bay-quoc-te-hoan-ban-hanh-quy-dinh-gia-xet-nghiem-20211030071001394.htm
Singapore bắt đầu sử dụng thẻ căn cước cá nhân kỹ thuật số,/singapore-bat-dau-su-dung-the-can-cuoc-ca-nhan-ky-thuat-so-20211029144326372.htm
Anh chấp nhận 'hộ chiếu vắc xin' của Việt Nam,/anh-chap-nhan-ho-chieu-vac-xin-cua-viet-nam-20211029122045499.htm
Singapore lần đầu tiên ghi nhận hơn 5.000 ca COVID-19 mới,/singapore-lan-dau-tien-ghi-nhan-hon-5000-ca-covid-19-moi-20211027233046467.htm
"Ngày 26-10, Nga có số ca tử vong vì COVID-19 cao nhất, sẽ đóng cửa toàn quốc",/ngay-26-10-nga-co-so-ca-tu-vong-vi-covid-19-cao-nhat-se-dong-cua-toan-quoc-20211026163038208.htm
Sở Y tế TP.HCM trình 4 kịch bản chống dịch COVID-19 không có chi viện,/so-y-te-tp-hcm-trinh-4-kich-ban-chong-dich-covid-19-khong-co-chi-vien-20211025164533771.htm
"TP.HCM công bố cấp độ dịch, 9 vùng xanh, 1 vùng cam, còn lại là vàng",/tp-hcm-cong-bo-cap-do-dich-9-vung-xanh-1-vung-cam-con-lai-la-vang-20211024140728172.htm
Nước Anh đứng trước thách thức bùng dịch trở lại,/nuoc-anh-dung-truoc-thach-thuc-bung-dich-tro-lai-20211021153819265.htm
Lào sẽ sử dụng ôtô điện để phục vụ các quan chức cấp cao,/lao-se-su-dung-oto-dien-de-phuc-vu-cac-quan-chuc-cap-cao-20211021142925211.htm
TP.HCM yêu cầu khẩn trương xác định cấp độ dịch theo nghị quyết 128,/tp-hcm-yeu-cau-khan-truong-xac-dinh-cap-do-dich-theo-nghi-quyet-128-20211020152731096.htm
CDC Hà Nội: Toàn thành phố đều là 'vùng xanh',/cdc-ha-noi-toan-thanh-pho-deu-la-vung-xanh-20211015184046754.htm
"Không ít tỉnh thành vẫn áp dụng chỉ thị 15, 16, 19, tại sao?",/khong-it-tinh-thanh-van-ap-dung-chi-thi-15-16-19-tai-sao-20211014221052103.htm
"Địa phương bỏ ngay quy định trái với trung ương, nơi kiểm soát được dịch cho đi học từ tháng 10",/dia-phuong-bo-ngay-quy-dinh-trai-voi-trung-uong-noi-kiem-soat-duoc-dich-cho-di-hoc-tu-thang-10-20211014163958401.htm
"Taliban và phái đoàn Mỹ - EU lần đầu hội đàm, EU cam kết viện trợ 1,2 tỉ USD",/taliban-va-phai-doan-my-eu-lan-dau-hoi-dam-eu-cam-ket-vien-tro-12-ti-usd-20211013063118783.htm
Thủ tướng: Khai mở các giá trị của chuyển đổi số để phục hồi kinh tế sau đại dịch,/thu-tuong-khai-mo-cac-gia-tri-cua-chuyen-doi-so-de-phuc-hoi-kinh-te-sau-dai-dich-20211012213232271.htm
Việt Nam tổ chức sự kiện toàn cầu trên nền tảng số Make in Vietnam,/viet-nam-to-chuc-su-kien-toan-cau-tren-nen-tang-so-make-in-vietnam-20211012121546943.htm
TP.HCM: Cử tri kiến nghị bán đấu giá đất vàng nhà khách Chính phủ thu ngân sách,/tp-hcm-cu-tri-kien-nghi-ban-dau-gia-dat-vang-nha-khach-chinh-phu-thu-ngan-sach-20211005131358276.htm
Sử dụng công nghệ để phòng chống dịch hiệu quả hơn,/su-dung-cong-nghe-de-phong-chong-dich-hieu-qua-hon-20211003230354666.htm
"Từ 0h ngày 1-10, Bình Định cho phép các hoạt động tập trung không quá 30 người",/tu-0h-ngay-1-10-binh-dinh-cho-phep-cac-hoat-dong-tap-trung-khong-qua-30-nguoi-20210929181857924.htm
"Thêm 2,6 triệu liều vắc xin Đức tặng về đến TP.HCM",/them-26-trieu-lieu-vac-xin-duc-tang-ve-den-tphcm-20210927190650256.htm
Gần 10 triệu ca phá thai mỗi năm ở Trung Quốc,/gan-10-trieu-ca-pha-thai-moi-nam-o-trung-quoc-20210927133950044.htm
"Trích 30.000 tỉ đồng hỗ trợ người lao động, doanh nghiệp tạm dừng đóng Quỹ bảo hiểm thất nghiệp",/trich-30-000-ti-dong-ho-tro-nguoi-lao-dong-doanh-nghiep-tam-dung-dong-quy-bao-hiem-that-nghiep-20210924173352887.htm
“Virus đói” và một đại dịch khác,/virus-doi-va-mot-dai-dich-khac-1605119.htm
Giá khí đốt tăng cao gây ảnh hưởng lớn đến ngành công nghiệp thực phẩm Anh,/gia-khi-dot-tang-cao-gay-anh-huong-lon-den-nganh-cong-nghiep-thuc-pham-anh-20210921144209157.htm
2 phương pháp điều trị mà GS Nguyễn Thanh Liêm đề xuất có ý nghĩa ra sao?,/2-phuong-phap-dieu-tri-ma-gs-nguyen-thanh-liem-de-xuat-co-y-nghia-ra-sao-20210921133723374.htm
Đề xuất tăng mức phạt vi phạm giao thông đường bộ: Lên bao nhiêu?,/de-xuat-tang-muc-phat-vi-pham-giao-thong-duong-bo-len-bao-nhieu-20210920172212466.htm
Hơn 850.000 liều vắc xin AstraZeneca Đức tặng Việt Nam tới Hà Nội,/hon-850-000-lieu-vac-xin-astrazeneca-duc-tang-viet-nam-toi-ha-noi-20210916142916013.htm
"Hỗ trợ doanh nghiệp, người dân 140.000 tỉ để vượt qua khó khăn dịch COVID-19",/ho-tro-doanh-nghiep-nguoi-dan-140000-ti-de-vuot-qua-kho-khan-dich-covid-19-20210916133729978.htm
"TP.HCM: Từ ngày 16-9, ngành nghề nào được mở cửa?",/tp-hcm-tu-ngay-16-9-nganh-nghe-nao-duoc-mo-cua-20210821150034525.htm
Nhật Bản thông báo viện trợ cho Việt Nam thêm 400.000 liều vắc xin AstraZeneca,/nhat-ban-thong-bao-vien-tro-cho-viet-nam-them-400-000-lieu-vac-xin-astrazeneca-2021091411100789.htm
Nhà chưa giàu nhưng tồn quỹ lớn,/nha-chua-giau-nhung-ton-quy-lon-1602429.htm
Bắt bà Lê Thị Kim Phi vì sử dụng Facebook kết bạn tổ chức phản động lật đổ chính quyền,/bat-ba-le-thi-kim-phi-vi-su-dung-facebook-ket-ban-to-chuc-phan-dong-lat-do-chinh-quyen-20210910151622337.htm
