Title,URL
MB ra mắt sản phẩm vay vốn tín chấp đồng hành cùng doanh nghiệp,/mb-ra-mat-san-pham-vay-von-tin-chap-dong-hanh-cung-doanh-nghiep-20230920093508889.htm
Lần đầu tổ chức diễn đàn quốc gia về kinh tế số - xã hội số,/lan-dau-to-chuc-dien-dan-quoc-gia-ve-kinh-te-so-xa-hoi-so-20230914132116446.htm
Lần đầu tiên Việt Nam trao giải thưởng cho nội dung số,/lan-dau-tien-viet-nam-trao-giai-thuong-cho-noi-dung-so-20230912150425049.htm
TP.HCM đề xuất cho thí điểm dạy lái xe ô tô online,/tp-hcm-de-xuat-cho-thi-diem-day-lai-xe-o-to-online-20230823194646403.htm
Tranh chấp 3.000 video Wolfoo: 'Yêu cầu YouTube tuân thủ pháp luật Việt Nam',/tranh-chap-3-000-video-wolfoo-yeu-cau-youtube-tuan-thu-phap-luat-viet-nam-20230803170630789.htm
Nộp lệ phí xét tuyển đại học 2023 bằng MoMo: Không rành công nghệ cũng thanh toán dễ dàng,/nop-le-phi-xet-tuyen-dai-hoc-2023-bang-momo-khong-ranh-cong-nghe-cung-thanh-toan-de-dang-20230730080911933.htm
Nga thử nghiệm giao dịch đồng ruble kỹ thuật số,/nga-thu-nghiem-giao-dich-dong-ruble-ky-thuat-so-20230726143340068.htm
Số người dùng mạng xã hội Threads của Meta 'lao dốc',/so-nguoi-dung-mang-xa-hoi-threads-cua-meta-lao-doc-20230724142903287.htm
Gia tăng nhu cầu nhân lực ngành truyền thông số,/gia-tang-nhu-cau-nhan-luc-nganh-truyen-thong-so-20230724082427141.htm
Chuyển đổi số Quảng Ngãi đảo chiều ấn tượng,/chuyen-doi-so-quang-ngai-dao-chieu-an-tuong-20230713145643729.htm
"Chạy đua AI Mỹ - Trung: Thua nghiên cứu, thắng ứng dụng",/chay-dua-ai-my-trung-thua-nghien-cuu-thang-ung-dung-2023062310491114.htm
Ngân hàng số MyVIB 2.0 ngày càng thu hút lượt yêu thích trên mạng xã hội,/ngan-hang-so-myvib-20-ngay-cang-thu-hut-luot-yeu-thich-tren-mang-xa-hoi-20230627101503375.htm
"Hải Đăng Doo hợp tác với nghệ sĩ Thái, làm mới bản hit viral khắp thế giới",/hai-dang-doo-hop-tac-voi-nghe-si-thai-lam-moi-ban-hit-viral-khap-the-gioi-20230622174026772.htm
Cẩn trọng với bia miệng trên mạng,/can-trong-voi-bia-mieng-tren-mang-20230617090954683.htm
"Công nghệ thông tin - viễn thông Việt Nam là điểm sáng, doanh thu tới 148 tỉ USD",/cong-nghe-thong-tin-vien-thong-viet-nam-la-diem-sang-doanh-thu-toi-148-ti-usd-20230612201147092.htm
"Tin tức giải trí ngày 16-5: Tiểu Vy được khen, đêm nhạc BlackPink bị chê",/tin-tuc-giai-tri-ngay-16-5-tieu-vy-duoc-khen-dem-nhac-blackpink-bi-che-20230516162917653.htm
"Sau điều tra của Tuổi Trẻ, các nền tảng quảng bá ‘siêu giảm béo’ của Americare clinic… biến mất",/sau-dieu-tra-cua-tuoi-tre-cac-nen-tang-quang-ba-sieu-giam-beo-cua-americare-clinic-bien-mat-20230327112236999.htm
Thí điểm mô hình đại học số tại 5 cơ sở giáo dục đại học,/thi-diem-mo-hinh-dai-hoc-so-tai-5-co-so-giao-duc-dai-hoc-20230325152221192.htm
"Start-up Việt chuyển đổi số cho doanh nghiệp, 180.000 người dùng hằng ngày",/start-up-viet-chuyen-doi-so-cho-doanh-nghiep-180-000-nguoi-dung-hang-ngay-20230316174230848.htm
"'Tiếng nói tuổi trẻ - Hành động của Đoàn': Lan tỏa tình yêu biển đảo, đất nước",/tieng-noi-tuoi-tre-hanh-dong-cua-doan-lan-toa-tinh-yeu-bien-dao-dat-nuoc-2023031714181592.htm
Số hóa du lịch An Giang trên nền tảng mạng xã hội,/so-hoa-du-lich-an-giang-tren-nen-tang-mang-xa-hoi-20230315161321139.htm
Bùng nổ truyền hình lãng mạn nhưng người Hàn Quốc ngại kết hôn,/bung-no-truyen-hinh-lang-man-nhung-nguoi-han-quoc-ngai-ket-hon-2023030614163797.htm
'Chỉ là sau này' của Hoàng Anh Duy càn quét các bảng xếp hạng,/chi-la-sau-nay-cua-hoang-anh-duy-can-quet-cac-bang-xep-hang-20230303072428232.htm
VIB: Giao dịch qua các nền tảng số tăng trưởng 26 lần trong 5 năm,/vib-giao-dich-qua-cac-nen-tang-so-tang-truong-26-lan-trong-5-nam-20230227141451049.htm
Phát triển ứng dụng 'Đồng Nai CĐS' mang lại tiện ích cho người dân,/phat-trien-ung-dung-dong-nai-cds-mang-lai-tien-ich-cho-nguoi-dan-20230221145949582.htm
Ra mắt ứng dụng 'Đồng Nai CĐS' hỗ trợ người dân và doanh nghiệp,/ra-mat-ung-dung-dong-nai-cds-ho-tro-nguoi-dan-va-doanh-nghiep-20230220171324282.htm
TP.HCM: 4 triệu lượt người đọc sách điện tử trong năm 2022,/tp-hcm-4-trieu-luot-nguoi-doc-sach-dien-tu-trong-nam-2022-20230218121942116.htm
VNG đầu tư phát triển nền tảng quản lý đa đám mây CloudVerse,/vng-dau-tu-phat-trien-nen-tang-quan-ly-da-dam-may-cloudverse-2023011216465436.htm
"Phim truyền hình Việt 'ăn mắm quen, ăn thịt có được?'",/phim-truyen-hinh-viet-an-mam-quen-an-thit-co-duoc-20230106103115967.htm
Như chưa hề có cuộc chia ly: 'Con quý như kim cương',/nhu-chua-he-co-cuoc-chia-ly-con-quy-nhu-kim-cuong-20230102212650098.htm
Techcombank và MISA cùng doanh nghiệp chuyển đổi số,/techcombank-va-misa-cung-doanh-nghiep-chuyen-doi-so-20221229183121134.htm
Khám phá 5 tính năng mới trên BIZ MBBank cho doanh nghiệp,/kham-pha-5-tinh-nang-moi-tren-biz-mbbank-cho-doanh-nghiep-20221229102706216.htm
Chuyện Đỗ Thị Hà khóc hơn 5 phút đêm chung kết hoa hậu: thần thái hay 'ô dề'?,/chuyen-do-thi-ha-khoc-hon-5-phut-dem-chung-ket-hoa-hau-than-thai-hay-o-de-20221224093126472.htm
"Năm 2022, nhiều cơ quan báo chí đã tiếp cận công nghệ làm báo hiện đại",/nam-2022-nhieu-co-quan-bao-chi-da-tiep-can-cong-nghe-lam-bao-hien-dai-20221224103208675.htm
Talkshow Đi cùng thương hiệu: Khám phá 1.001 kinh nghiệm xây dựng thương hiệu,/talkshow-di-cung-thuong-hieu-kham-pha-1-001-kinh-nghiem-xay-dung-thuong-hieu-20221217083427958.htm
Khám phá hệ sinh thái tiện ích trên ngân hàng số MyVIB 2.0,/kham-pha-he-sinh-thai-tien-ich-tren-ngan-hang-so-myvib-2-0-20221212150752277.htm
"Thủ tướng Hà Lan 'chọc' Tổng thống Biden: 'Xin lỗi Joe, bóng đá đã chiến thắng'",/thu-tuong-ha-lan-choc-tong-thong-biden-xin-loi-joe-bong-da-da-chien-thang-20221204165304516.htm
Elon Musk tuyên bố lượt đăng ký người dùng mới của Twitter cao kỷ lục,/elon-musk-tuyen-bo-luot-dang-ky-nguoi-dung-moi-cua-twitter-cao-ky-luc-2022112723394729.htm
"Ronaldo, Messi được tìm kiếm nhiều nhất trên Google năm 2022",/ronaldo-messi-duoc-tim-kiem-nhieu-nhat-tren-google-nam-2022-20221123085907482.htm
VIB ghi đậm dấu ấn thương hiệu tại The Masked Singer Vietnam,/vib-ghi-dam-dau-an-thuong-hieu-tai-the-masked-singer-vietnam-20221121094810739.htm
Giải mã thành công của hợp tác giữa game show ca nhạc với thương hiệu ngân hàng,/giai-ma-thanh-cong-cua-hop-tac-giua-game-show-ca-nhac-voi-thuong-hieu-ngan-hang-20221118125221125.htm
Tin sáng 4-11: Chuẩn bị thông xe hầm chui trước bến xe Miền Đông mới; đầu tư cao tốc Tân Phú-Bảo Lộc,/tin-sang-4-11-chuan-bi-thong-xe-ham-chui-truoc-ben-xe-mien-dong-moi-dau-tu-cao-toc-tan-phu-bao-loc-20221103192728505.htm
Hệ sinh thái Thương mại điện tử: chất xúc tác cho chuyển đổi số bền vững,/he-sinh-thai-thuong-mai-dien-tu-chat-xuc-tac-cho-chuyen-doi-so-ben-vung-20221101153219034.htm
Văn hóa doanh nghiệp - nền tảng để chuyển đổi số thành công,/van-hoa-doanh-nghiep-nen-tang-de-chuyen-doi-so-thanh-cong-20221031162933799.htm
Chủ tịch Phan Văn Mãi: Mục tiêu đến 2025 TP.HCM vận hành nền hành chính trên nền tảng số,/chu-tich-phan-van-mai-muc-tieu-den-2025-tp-hcm-van-hanh-nen-hanh-chinh-tren-nen-tang-so-20221029165338192.htm
Vinanutrifood hỗ trợ doanh nghiệp nhỏ bán hàng trên nền tảng số,/vinanutrifood-ho-tro-doanh-nghiep-nho-ban-hang-tren-nen-tang-so-20221027162410771.htm
Chủ tịch Vinanutrifood tiết lộ 'bí kíp' chốt vạn đơn hàng qua nền tảng số,/chu-tich-vinanutrifood-tiet-lo-bi-kip-chot-van-don-hang-qua-nen-tang-so-20221024142130259.htm
VieON - 'Động cơ' công nghệ của hệ sinh thái DatVietVAC,/vieon-dong-co-cong-nghe-cua-he-sinh-thai-datvietvac-20221023165559965.htm
MB ‘thắng lớn’ tại giải thưởng Chuyển đổi số Việt Nam 2022,/mb-thang-lon-tai-giai-thuong-chuyen-doi-so-viet-nam-2022-20221011191907041.htm
Meey Map: Sự khác biệt trong tra cứu quy hoạch bất động sản,/meey-map-su-khac-biet-trong-tra-cuu-quy-hoach-bat-dong-san-20221010162818438.htm
Nhật Bản đặt lộ trình chuyển đổi sang sách giáo khoa kỹ thuật số,/nhat-ban-dat-lo-trinh-chuyen-doi-sang-sach-giao-khoa-ky-thuat-so-20221007140954487.htm
Bộ Thông tin và Truyền thông công bố nền tảng số phục vụ người dân,/bo-thong-tin-va-truyen-thong-cong-bo-nen-tang-so-phuc-vu-nguoi-dan-20221007131623793.htm
VIB đến gần hơn với người trẻ qua The Masked Singer,/vib-den-gan-hon-voi-nguoi-tre-qua-the-masked-singer-20221006222245923.htm
"Trải nghiệm 15 xe điện, phóng viên Mỹ chỉ ra những tính năng ưng ý nhất",/trai-nghiem-15-xe-dien-phong-vien-my-chi-ra-nhung-tinh-nang-ung-y-nhat-20220927154525326.htm
89% người tiêu dùng Việt Nam hiện đang quản lý tài chính cá nhân trên nền tảng số,/89-nguoi-tieu-dung-viet-nam-hien-dang-quan-ly-tai-chinh-ca-nhan-tren-nen-tang-so-20220922194335846.htm
MyVIB 2.0 nâng tầm trải nghiệm với nhiều tiện ích miễn phí và ưu đãi hấp dẫn,/myvib-20-nang-tam-trai-nghiem-voi-nhieu-tien-ich-mien-phi-va-uu-dai-hap-dan-20220922160609998.htm
Ngân hàng số Cake mở thẻ tín dụng online trong 2 phút,/ngan-hang-so-cake-mo-the-tin-dung-online-trong-2-phut-2022091510414815.htm
Đà Nẵng: Mỗi người dân một QR code làm hồ sơ công dân,/da-nang-moi-nguoi-dan-1-qr-code-lam-ho-so-cong-dan-20220913151644163.htm
Giới trẻ hào hứng với thẻ tín dụng mDigi của MSB,/gioi-tre-hao-hung-voi-the-tin-dung-mdigi-cua-msb-20220908162105572.htm
"Leonardo DiCaprio chỉ hẹn hò với những cô gái dưới 25 tuổi, có bình thường không?",/leonardo-dicaprio-chi-hen-ho-voi-nhung-co-gai-duoi-25-tuoi-co-binh-thuong-khong-20220904153002929.htm
Bí quyết cô gái 22 tuổi mua nhà sau 3 năm đi làm,/bi-quyet-co-gai-22-tuoi-mua-nha-sau-3-nam-di-lam-20220820105321891.htm
Gojek: Doanh số các nhà bán hàng trực tuyến tăng gấp 3 lần,/gojek-doanh-so-cac-nha-ban-hang-truc-tuyen-tang-gap-3-lan-20220812142217216.htm
Chương trình phát thanh giải trí trực tuyến: Nỗi lo bản quyền âm nhạc,/chuong-trinh-phat-thanh-giai-tri-truc-tuyen-noi-lo-ban-quyen-am-nhac-20220805150100392.htm
"Cơ quan thuế rà soát truy thu, chủ shop online tìm trăm đường... trốn biệt",/co-quan-thue-ra-soat-truy-thu-chu-shop-online-tim-tram-duong-tron-biet-2022080508301017.htm
Sàn TMĐT Năng Lượng Việt Nam ra mắt nền tảng số mới,/san-tmdt-nang-luong-viet-nam-ra-mat-nen-tang-so-moi-20220729192716777.htm
"Giao dịch tiền mặt đã giảm mạnh, vì sao?",/giao-dich-tien-mat-da-giam-manh-vi-sao-20220720170653833.htm
'Một điểm chạm - Ngàn ưu đãi' với Omni BIDV iBank,/mot-diem-cham-ngan-uu-dai-voi-omni-bidv-ibank-20220716131617662.htm
"Chuyển đổi số nhưng chương trình cứng nhắc, giáo viên sẽ mất khả năng sáng tạo",/chuyen-doi-so-nhung-chuong-trinh-cung-nhac-giao-vien-se-mat-kha-nang-sang-tao-2022071412422737.htm
Manulife Việt Nam ra mắt nền tảng học tập mới phục vụ 60.000 tư vấn viên tài chính,/manulife-viet-nam-ra-mat-nen-tang-hoc-tap-moi-phuc-vu-60000-tu-van-vien-tai-chinh-20220712074937878.htm
TikTok bị kiện vì tuyên truyền nội dung độc hại,/tiktok-bi-kien-vi-tuyen-truyen-noi-dung-doc-hai-20220708151620886.htm
TopenLand hợp tác với các tập đoàn công nghệ hàng đầu,/topenland-hop-tac-voi-cac-tap-doan-cong-nghe-hang-dau-20220630113451764.htm
"Chuyển đổi số ngành báo chí: 'Podcast là thực tế, không còn là xu hướng'",/chuyen-doi-so-nganh-bao-chi-podcast-la-thuc-te-khong-con-la-xu-huong-20220627121607719.htm
Omni BIDV iBank - trải nghiệm ngân hàng số vượt trội dành cho doanh nghiệp,/omni-bidv-ibank-trai-nghiem-ngan-hang-so-vuot-troi-danh-cho-doanh-nghiep-20220612132548511.htm
Người dân tỉnh Long An có thể tìm việc trực tuyến qua ứng dụng Long An ID,/nguoi-dan-tinh-long-an-co-the-tim-viec-truc-tuyen-qua-ung-dung-long-an-id-20220608172352631.htm
TikTok cho phép chủ tài khoản thu phí đăng ký xem hằng tháng để kiếm tiền,/tiktok-cho-phep-chu-tai-khoan-thu-phi-dang-ky-xem-hang-thang-de-kiem-tien-20220524083705681.htm
"VEPR dự báo tăng trưởng kinh tế năm 2022 từ 5,2 - 6,2%, lạm phát là nỗi lo lớn nhất",/vepr-du-bao-tang-truong-kinh-te-nam-2022-tu-5-2-6-2-lam-phat-la-noi-lo-lon-nhat-20220520133126327.htm
"Không chân, hai lần vượt cửa tử vẫn lạc quan sống",/khong-chan-hai-lan-vuot-cua-tu-van-lac-quan-song-20220517093520264.htm
VNPT hợp tác với công ty hàng đầu của Mỹ phát triển 5G,/vnpt-hop-tac-voi-cong-ty-hang-dau-cua-my-phat-trien-5g-20220512181127694.htm
MV There’s no one at all của Sơn Tùng M-TP chính thức 'bay màu' khỏi YouTube,/mv-theres-no-one-at-all-cua-son-tung-m-tp-chinh-thuc-bay-mau-khoi-youtube-20220506172204172.htm
"Cuộc chiến streaming: Netflix sẩy chân, cả làng lo lắng",/cuoc-chien-streaming-netflix-say-chan-ca-lang-lo-lang-1643112.htm
"TikTok và ""hashtag phước lành"" cho ngành xuất bản",/tiktok-va-hashtag-phuoc-lanh-cho-nganh-xuat-ban-1641728.htm
Triệu người mê có mấy người mua?,/trieu-nguoi-me-co-may-nguoi-mua-1641734.htm
Nền tảng ‘xóa mù’ kỹ năng số miễn phí cho người trẻ,/nen-tang-xoa-mu-ky-nang-so-mien-phi-cho-nguoi-tre-20220420115632029.htm
VPBank NEO đạt giải ứng dụng ngân hàng điện tử tốt nhất Việt Nam,/vpbank-neo-dat-giai-ung-dung-ngan-hang-dien-tu-tot-nhat-viet-nam-2022040818371617.htm
Meta lên kế hoạch tích hợp tiền điện tử vào các ứng dụng,/meta-co-ke-hoach-tich-hop-tien-dien-tu-vao-cac-ung-dung-20220408093657161.htm
"Chủ tịch Hà Nội: 'Sẽ mở thêm một số dịch vụ để phục vụ sản xuất, kinh doanh'",/chu-tich-ha-noi-se-mo-them-mot-so-dich-vu-de-phuc-vu-san-xuat-kinh-doanh-20220406114624096.htm
EU nhất trí với những quy định mới quản lý các ông lớn công nghệ,/eu-nhat-tri-voi-nhung-quy-dinh-moi-quan-ly-cac-ong-lon-cong-nghe-20220325110918229.htm
Dân Thượng Hải đổ xô mua hàng tích trữ vì sợ chính quyền phong tỏa,/dan-thuong-hai-do-xo-mua-hang-tich-tru-vi-so-chinh-quyen-phong-toa-2022032318361525.htm
Hội An quảng bá du lịch trên nền tảng Metaverse,/hoi-an-quang-ba-du-lich-tren-nen-tang-metaverse-20220312151545159.htm
Thỏa sức sáng tạo đặt tên tài khoản theo sở thích trên VPBank NEO,/thoa-suc-sang-tao-dat-ten-tai-khoan-theo-so-thich-tren-vpbank-neo-20220310200437671.htm
Trên mặt trận không tiếng súng,/tren-mat-tran-khong-tieng-sung-1632864.htm
Lần đầu tiên xuất hiện ATM dành cho NFT,/lan-dau-tien-xuat-hien-atm-danh-cho-nft-20220303173625194.htm
Doanh nghiệp xuất khẩu than trời vì 'cửa khẩu số' nhiều lỗi,/doanh-nghiep-xuat-khau-than-troi-vi-cua-khau-so-nhieu-loi-20220227135153934.htm
Quảng Nam mở tour du lịch số,/quang-nam-mo-tour-du-lich-so-202202270850038.htm
VIB tiếp tục bứt phá với nền tảng số hóa hiện đại,/vib-tiep-tuc-but-pha-voi-nen-tang-so-hoa-hien-dai-20220215203557543.htm
Harry - Meghan 'đắp chiếu' hai hợp đồng 124 triệu USD suốt một năm,/harry-meghan-dap-chieu-hai-hop-dong-124-trieu-usd-suot-mot-nam-2022012960569154.htm
Ngắt tiếng Quốc ca khi phát sóng trận bóng đá Việt Nam - Lào: ‘Bộ không có lỗi’,/ngat-tieng-quoc-ca-khi-phat-song-tran-bong-da-viet-nam-lao-bo-khong-co-loi-20220120214804461.htm
"Chọn lời hay, lẽ phải trên mạng xã hội",/chon-loi-hay-le-phai-tren-mang-xa-hoi-20220119213123435.htm
"Hai tỉ phú Elon Musk, Jack Dorsey cùng nói về thế hệ Internet 3.0 - Web3",/hai-ti-phu-elon-musk-jack-dorsey-cung-noi-ve-the-he-internet-3-0-web3-20211222143535234.htm
Người dân ở đâu không còn cần đến giấy tờ hành chính?,/nguoi-dan-o-dau-khong-con-can-den-giay-to-hanh-chinh-20211219005422599.htm
Việt Nam có nền tảng Chính quyền số toàn diện đầu tiên,/viet-nam-co-nen-tang-chinh-quyen-so-toan-dien-dau-tien-20211218184406844.htm
"Thúc đẩy chuyển đổi số, phục hồi kinh tế sau đại dịch bằng những nền tảng Make in Vietnam",/thuc-day-chuyen-doi-so-phuc-hoi-kinh-te-sau-dai-dich-bang-nhung-nen-tang-make-in-vietnam-20211211114617916.htm
"'Quốc ca Việt Nam đang được phát chính thức trên Chinhphu.vn, không ai có quyền ngăn chặn'",/quoc-ca-viet-nam-dang-duoc-phat-chinh-thuc-tren-chinhphu-vn-khong-ai-co-quyen-ngan-chan-20211207211118011.htm
Ngân hàng vào cuộc giải bài toán minh bạch từ thiện trên nền tảng số,/ngan-hang-vao-cuoc-giai-bai-toan-minh-bach-tu-thien-tren-nen-tang-so-20211204150452803.htm
VPBank nhận giải thưởng 'Ngân hàng số sáng tạo nhất 2021',/vpbank-nhan-giai-thuong-ngan-hang-so-sang-tao-nhat-2021-20211127095242869.htm
"'Khu đất vàng' trong vũ trụ ảo Metaverse được bán với giá 2,43 triệu USD",/khu-dat-vang-trong-vu-tru-ao-metaverse-duoc-ban-voi-gia-2-43-trieu-usd-20211125100514412.htm
Bà Rịa - Vũng Tàu: Tích hợp chữ ký số trên nền tảng di động vào dịch vụ công,/ba-ria-vung-tau-tich-hop-chu-ky-so-tren-nen-tang-di-dong-vao-dich-vu-cong-20211123112627246.htm
Thành phố thông minh - 'Sức bật' mới của địa phương trong kỷ nguyên số,/thanh-pho-thong-minh-suc-bat-moi-cua-dia-phuong-trong-ky-nguyen-so-20211115181622471.htm
"Cá nhân tham gia vận động, quyên góp từ thiện: hướng tới sự minh bạch, chuyên nghiệp",/ca-nhan-tham-gia-van-dong-quyen-gop-tu-thien-huong-toi-su-minh-bach-chuyen-nghiep-20211109153523896.htm
Dịch vụ ngân hàng số hàng đầu dành cho doanh nghiệp,/dich-vu-ngan-hang-so-hang-dau-danh-cho-doanh-nghiep-20211109174719453.htm
"Đại biểu Quốc hội tích cực đổi mới, chuyển đổi số trong kỳ họp thứ 2, Quốc hội khóa XV",/dai-bieu-quoc-hoi-tich-cuc-doi-moi-chuyen-doi-so-trong-ky-hop-thu-2-quoc-hoi-khoa-xv-20211108190733774.htm
Bộ trưởng Bộ Tài chính: Thiết kế gói hỗ trợ lãi suất từ 10.000 - 20.000 tỉ đồng,/bo-truong-bo-tai-chinh-thiet-ke-goi-ho-tro-lai-suat-tu-10000-20000-ti-dong-20211028104855238.htm
Số hóa cơ sở hạ tầng – Nền tảng cho thành phố thông minh,/so-hoa-co-so-ha-tang-nen-tang-cho-thanh-pho-thong-minh-20211018133144991.htm
Tọa đàm ‘Vì an sinh thành phố - Netflix chung tay cùng nghệ sĩ’,/toa-dam-vi-an-sinh-thanh-pho-netflix-chung-tay-cung-nghe-si-20211017084334947.htm
Doanh nghiệp cần làm gì để tăng sức đề kháng trước mọi đại dịch?,/doanh-nghiep-can-lam-gi-de-tang-suc-de-khang-truoc-moi-dai-dich-20211014182146701.htm
Việt Nam tổ chức sự kiện toàn cầu trên nền tảng số Make in Vietnam,/viet-nam-to-chuc-su-kien-toan-cau-tren-nen-tang-so-make-in-vietnam-20211012121546943.htm
Nỗi niềm shipper mùa dịch,/noi-niem-shipper-mua-dich-1607912.htm
FPT Play phát sóng trận Trung Quốc - Việt Nam trên đa nền tảng,/fpt-play-phat-song-tran-trung-quoc-viet-nam-tren-da-nen-tang-20211005221345784.htm
"Chữ ký số: Cơ hội và thách thức, mở lối thành công trong chuyển đổi số",/chu-ky-so-co-hoi-va-thach-thuc-mo-loi-thanh-cong-trong-chuyen-doi-so-20211004233336901.htm
Giải pháp Ngân hàng số toàn diện hàng đầu dành cho doanh nghiệp: BIZ MBBank,/giai-phap-ngan-hang-so-toan-dien-hang-dau-danh-cho-doanh-nghiep-biz-mbbank-20210922180957948.htm
Thiết bị CNTT - Nền tảng của chuyển đổi số trong giáo dục,/thiet-bi-cntt-nen-tang-cua-chuyen-doi-so-trong-giao-duc-20210921173507021.htm
"Sinh viên sáng tạo các ‘phòng chờ ảo’, giảm thời gian thăm khám ở bệnh viện",/sinh-vien-sang-tao-cac-phong-cho-ao-giam-thoi-gian-tham-kham-o-benh-vien-20210921093148276.htm
Bắc Kinh lập web cho người dân tố các trang game online sai phạm,/bac-kinh-lap-web-cho-nguoi-dan-to-cac-trang-game-online-sai-pham-20210917095421148.htm
Kết nối người lao động với doanh nghiệp giữa đại dịch COVID-19,/ket-noi-nguoi-lao-dong-voi-doanh-nghiep-giua-dai-dich-covid-19-2021091309102666.htm
"Techcombank: Tối ưu trải nghiệm số hóa, vượt trội lợi ích cho khách hàng",/techcombank-toi-uu-trai-nghiem-so-hoa-vuot-troi-loi-ich-cho-khach-hang-20210910123152233.htm
Tin tặc trả lại 260 triệu USD đánh cắp vì 'không hứng thú với tiền',/tin-tac-tra-lai-260-trieu-usd-danh-cap-vi-khong-hung-thu-voi-tien-20210812070624384.htm
Cùng hiến kế TP.HCM nâng tầm quốc tế: Một thế hệ khoa học sẽ đưa TP.HCM vươn tầm quốc tế,/cung-hien-ke-tp-hcm-nang-tam-quoc-te-mot-the-he-khoa-hoc-se-dua-tp-hcm-vuon-tam-quoc-te-20210811113345892.htm
"Vụ đánh cắp tiền điện tử lớn kỷ lục, mất 600 triệu USD",/vu-danh-cap-tien-dien-tu-lon-ky-luc-mat-600-trieu-usd-20210811095737742.htm
Hiến kế 'TP.HCM nâng tầm quốc tế': Cấp thiết chính quyền số,/hien-ke-tp-hcm-nang-tam-quoc-te-cap-thiet-chinh-quyen-so-20210727231540399.htm
Facebook bác chỉ trích 'giết người' của Tổng thống Biden giữa đại dịch,/facebook-bac-chi-trich-giet-nguoi-cua-tong-thong-biden-giua-dai-dich-20210718060206911.htm
"Kết nối tiêu thụ nhãn lồng Hưng Yên tới hơn 21 quốc gia, bán hàng qua thương mại điện tử",/ket-noi-tieu-thu-nhan-long-hung-yen-toi-hon-21-quoc-gia-ban-hang-qua-thuong-mai-dien-tu-20210715154231546.htm
Ra mắt KinhDoanhSo - Trung tâm đào tạo và hỗ trợ doanh nghiệp chuyển đổi số,/ra-mat-kinhdoanhso-trung-tam-dao-tao-va-ho-tro-doanh-nghiep-chuyen-doi-so-20210715132515222.htm
Việt Nam đứng đầu Đông Nam Á về số sinh viên du học Mỹ,/viet-nam-dung-dau-dong-nam-a-ve-so-sinh-vien-du-hoc-my-20210707091743866.htm
Amazon ‘ép’ các nhà bán hàng bán rẻ cổ phần?,/amazon-ep-cac-nha-ban-hang-ban-re-co-phan-20210630103336017.htm
"Singapore sẵn sàng hợp tác với Việt Nam về tiếp cận vắc xin, kinh tế số",/singapore-san-sang-hop-tac-voi-viet-nam-ve-tiep-can-vac-xin-kinh-te-so-20210621130136837.htm
Sự viết và sự đọc của hoa hậu Nguyễn Thu Thủy,/su-viet-va-su-doc-cua-hoa-hau-nguyen-thu-thuy-20210607145309359.htm
Những video tỉ view và “khán giả mặc tã” của YouTube,/nhung-video-ti-view-va-khan-gia-mac-ta-cua-youtube-1583510.htm
HDBank số hóa quy trình mở tài khoản tại quầy,/hdbank-so-hoa-quy-trinh-mo-tai-khoan-tai-quay-20210505185107625.htm
Đánh thức du lịch bằng nền tảng số,/danh-thuc-du-lich-bang-nen-tang-so-1580702.htm
Nhà hát Sydney Opera House ra mắt nền tảng phát sóng trực tuyến mới,/nha-hat-sydney-opera-house-ra-mat-nen-tang-phat-song-truc-tuyen-moi-20210407143741615.htm
Kinh tế số: Thách thức với cơ quan thuế,/kinh-te-so-thach-thuc-voi-co-quan-thue-1579631.htm
Thúc đẩy kinh tế số bằng nền tảng công nghệ Việt,/thuc-day-kinh-te-so-bang-nen-tang-cong-nghe-viet-20210327164701075.htm
Game show về cộng đồng LGBT: Lo ngại những góc nhìn chệch hướng,/game-show-ve-cong-dong-lgbt-lo-ngai-nhung-goc-nhin-chech-huong-20210327091103388.htm
Google chịu trả tiền cho truyền thông Ý,/google-chiu-tra-tien-cho-truyen-thong-y-20210325194523912.htm
"Đoạn tweet đầu tiên trên thế giới bán được 2,9 triệu USD",/doan-tweet-dau-tien-tren-the-gioi-ban-duoc-2-9-trieu-usd-20210323100806606.htm
Lưỡng đảng Mỹ đồng lòng cứu báo chí,/luong-dang-my-dong-long-cuu-bao-chi-20210316203756854.htm
"Thu hút khách hàng bằng trải nghiệm và số hóa, ngân hàng bứt phá dẫn đầu",/thu-hut-khach-hang-bang-trai-nghiem-va-so-hoa-ngan-hang-but-pha-dan-dau-20210315145548587.htm
Chất lượng không khí các đô thị phía Bắc tiếp tục ở mức xấu,/chat-luong-khong-khi-cac-do-thi-phia-bac-tiep-tuc-o-muc-xau-20210220162718988.htm
VPBank với chiến dịch đặc biệt ‘Tết cách ly - Không cách lòng’,/vpbank-voi-chien-dich-dac-biet-tet-cach-ly-khong-cach-long-20210209160720027.htm
Chủ động và tiện lợi khi chăm sóc sức khỏe trên nền tảng số Zoop Care,/chu-dong-va-tien-loi-khi-cham-soc-suc-khoe-tren-nen-tang-so-zoop-care-20210128145937131.htm
"TNEX Merchant: giải pháp tiếp cận khách hàng, tăng doanh thu cho cửa hàng",/tnex-merchant-giai-phap-tiep-can-khach-hang-tang-doanh-thu-cho-cua-hang-20210127111141014.htm
Startup livestream của Việt Nam nhận vốn triệu USD,/startup-livestream-cua-viet-nam-nhan-von-trieu-usd-20210118162540596.htm
Ngân hàng số đầu tiên trên nền tảng ứng dụng gọi xe Be,/ngan-hang-so-dau-tien-tren-nen-tang-ung-dung-goi-xe-be-20210112190210076.htm
Hỗ trợ báo chí tăng tốc chuyển đổi số trong năm 2021,/ho-tro-bao-chi-tang-toc-chuyen-doi-so-trong-nam-2021-20210112171230239.htm
Công bố chương trình hỗ trợ chuyển đổi số cho doanh nghiệp vừa và nhỏ,/cong-bo-chuong-trinh-ho-tro-chuyen-doi-so-cho-doanh-nghiep-vua-va-nho-20210112131726495.htm
