Title,URL
Chính phủ lâm thời của Taliban toàn đàn ông,/chinh-phu-lam-thoi-cua-taliban-toan-dan-ong-20210908105858269.htm
Mỹ lo ngại về bộ máy chính phủ lâm thời Afghanistan,/my-lo-ngai-ve-bo-may-chinh-phu-lam-thoi-afghanistan-20210908085852774.htm
Thái Lan muốn mở cửa một số điểm du lịch trong tháng 10,/thai-lan-muon-mo-cua-mot-so-diem-du-lich-trong-thang-10-20210906185658687.htm
Google chặn các tài khoản Gmail của chính quyền cũ ở Afghanistan,/google-chan-cac-tai-khoan-gmail-cua-chinh-quyen-cu-o-afghanistan-20210904092501418.htm
"Số ca COVID-19 cao nhất trong 2 tháng, Ấn Độ lo khi sắp vào mùa tựu trường và lễ hội",/so-ca-covid-19-cao-nhat-trong-2-thang-an-do-lo-khi-sap-vao-mua-tuu-truong-va-le-hoi-20210902135218493.htm
"Đề nghị sửa đổi quy định để nhiều người dân, doanh nghiệp được hỗ trợ từ gói 26.000 tỉ đồng",/de-nghi-sua-doi-quy-dinh-de-nhieu-nguoi-dan-doanh-nghiep-duoc-ho-tro-tu-goi-26-000-ti-dong-20210831135828535.htm
Cuba chấp nhận sử dụng đồng tiền số,/cuba-chap-nhan-su-dung-dong-tien-so-2021083014483248.htm
"TP.HCM xin tăng cường 4.000 cán bộ chiến sĩ Quân khu 7, 2.000 y bác sĩ và 30 xe cứu thương",/tp-hcm-xin-tang-cuong-4-000-can-bo-chien-si-quan-khu-7-2-000-y-bac-si-va-30-xe-cuu-thuong-20210821094640807.htm
Tranh cãi về việc tiêm mũi 3 vaccine COVID-19,/tranh-cai-ve-viec-tiem-mui-3-vaccine-covid-19-1598158.htm
Anh sẽ tiếp nhận 20.000 người tị nạn Afghanistan,/anh-se-tiep-nhan-20-000-nguoi-ti-nan-afghanistan-20210818111639857.htm
Cóp nhặt hy vọng nhỏ nhoi,/cop-nhat-hy-vong-nho-nhoi-1593728.htm
Phụ nữ Afghanistan hoang mang trước tương lai bất định,/phu-nu-afghanistan-hoang-mang-truoc-tuong-lai-bat-dinh-20210816142011861.htm
Chính phủ đồng ý mua bổ sung gần 20 triệu liều vắc xin Pfizer,/chinh-phu-dong-y-mua-bo-sung-gan-20-trieu-lieu-vac-xin-pfizer-20210815064830568.htm
Các tỉnh kiến nghị gia hạn giá ưu đãi cho điện gió vì COVID-19,/cac-tinh-kien-nghi-gia-han-gia-uu-dai-cho-dien-gio-vi-covid-19-20210813151246383.htm
"Thủ tướng chỉ thị đẩy mạnh công tác quy hoạch, kế hoạch sử dụng đất",/thu-tuong-chi-thi-day-manh-cong-tac-quy-hoach-ke-hoach-su-dung-dat-20210812164120364.htm
"Châu Âu ngừng xét nghiệm miễn phí, người chưa tiêm phải trả tiền",/chau-au-ngung-xet-nghiem-mien-phi-nguoi-chua-tiem-phai-tra-tien-2021081123112639.htm
"An Giang: Hơn 50.000 lao động tự do sẽ được hỗ trợ 1,5 triệu đồng/lần/người",/an-giang-hon-50-000-lao-dong-tu-do-se-duoc-ho-tro-1-5-trieu-dong-lan-nguoi-20210811084522771.htm
CH Czech nhượng lại 500.000 liều vắc xin COVID-19 cho Việt Nam,/ch-czech-nhuong-lai-500000-lieu-vac-xin-covid-19-cho-viet-nam-20210809193441719.htm
Trường Tiền - chuyện chưa kể cây cầu lịch sử: Kỳ cuối: Trường Tiền - sức sống trường cửu,/truong-tien-chuyen-chua-ke-cay-cau-lich-su-ky-cuoi-truong-tien-suc-song-truong-cuu-20210809095554847.htm
"Được chỉ định thầu trang thiết bị, thuốc chống dịch COVID-19",/duoc-chi-dinh-thau-trang-thiet-bi-thuoc-chong-dich-covid-19-20210807092456107.htm
Hơn 300 thí sinh Đồng Nai thi tốt nghiệp trong thời giãn cách,/hon-300-thi-sinh-dong-nai-dang-ky-du-thi-tot-nghiep-thpt-dac-biet-20210805195120518.htm
"Bệnh viện Bạch Mai cùng MB triển khai thanh toán số an toàn, tiện lợi",/benh-vien-bach-mai-cung-mb-trien-khai-thanh-toan-so-an-toan-tien-loi-20210731115508022.htm
Thủ tướng: Giảm tiền điện trong 2 tháng cho người dân ở nơi giãn cách theo chỉ thị 16,/thu-tuong-giam-tien-dien-trong-2-thang-cho-nguoi-dan-o-noi-gian-cach-theo-chi-thi-16-20210731184412944.htm
Công an TP.HCM nêu cụ thể đặc điểm nhận diện người được ra đường,/cong-an-tp-hcm-neu-cu-the-dac-diem-nhan-dien-nguoi-ra-duong-20210730124057037.htm
Tổng thống Philippines muốn 'tiêm vắc xin cho bất kỳ ai muốn tiêm',/tong-thong-philippines-muon-tiem-vac-xin-cho-bat-ky-ai-muon-tiem-20210729061320687.htm
Loạt dự án sai quy hoạch tại Hà Nội bị Thanh tra Chính phủ 'điểm danh',/loat-du-an-sai-quy-hoach-tai-ha-noi-bi-thanh-tra-chinh-phu-diem-danh-20210728162617177.htm
Quốc hội đồng ý giảm 1 phó thủ tướng trong nhiệm kỳ 2021-2026,/quoc-hoi-dong-y-giam-1-pho-thu-tuong-trong-nhiem-ky-2021-2026-20210728091242012.htm
CH Czech viện trợ 250.000 liều vắc xin COVID-19 cho Việt Nam,/ch-czech-vien-tro-250-000-lieu-vac-xin-covid-19-cho-viet-nam-20210727121117306.htm
Thêm 'vũ khí' mạnh cho Chính phủ chống dịch,/them-vu-khi-manh-cho-chinh-phu-chong-dich-20210726011940841.htm
Mỗi ngày hơn 5 trẻ em Việt Nam chết đuối,/moi-ngay-hon-5-tre-em-viet-nam-chet-duoi-20210724195614813.htm
Chiều nay Chính phủ trình Quốc hội các giải pháp tăng cường phòng chống COVID-19,/chieu-nay-chinh-phu-trinh-quoc-hoi-cac-giai-phap-tang-cuong-phong-chong-covid-19-20210724102739121.htm
"Chính phủ Serbia hứa thưởng 1,9 tỉ đồng cho mỗi huy chương vàng ở Olympic Tokyo",/chinh-phu-serbia-hua-thuong-1-9-ti-dong-cho-moi-huy-chuong-vang-o-olympic-tokyo-20210724091314978.htm
Thanh tra Chính phủ tái kết luận các hộ khiếu nại ở 5 khu phố thuộc 3 phường trong ranh Thủ Thiêm,/thanh-tra-chinh-phu-tai-ket-luan-cac-ho-khieu-nai-o-5-khu-pho-thuoc-3-phuong-trong-ranh-thu-thiem-2021072219363438.htm
TP.HCM được phân bổ nhiều nhất trong số vắc xin đã về Việt Nam,/tphcm-duoc-phan-bo-nhieu-nhat-trong-so-vac-xin-da-ve-viet-nam-20210722084309839.htm
Người dân khó khăn vẫn phải đợi Hà Nội ban hành chính sách,/nguoi-dan-kho-khan-van-phai-doi-ha-noi-ban-hanh-chinh-sach-20210721181828125.htm
"Chính phủ ban hành nghị quyết về phòng, chống dịch COVID-19",/chinh-phu-ban-hanh-nghi-quyet-ve-phong-chong-dich-covid-19-20210721062251238.htm
Tài xế chở hàng ở miền Tây: 'chờ thông thoáng',/tai-xe-cho-hang-o-mien-tay-cho-thong-thoang-20210720074140813.htm
Anh cho đội ngũ y tế miễn cách ly sau phơi nhiễm COVID-19,/anh-cho-doi-ngu-y-te-mien-cach-ly-sau-phoi-nhiem-covid-19-2021071910122769.htm
Long An bắt đầu hỗ trợ 20.000 người lao động tự do,/long-an-bat-dau-ho-tro-20-000-nguoi-lao-dong-tu-do-20210712202202935.htm
Trị nghiêm người chống đối,/tri-nghiem-nguoi-chong-doi-20210712000330534.htm
"Các nước châu Á ghi nhận số ca COVID-19 kỷ lục, nhận thêm vắc xin",/cac-nuoc-chau-a-ghi-nhan-so-ca-covid-19-ky-luc-nhan-them-vac-xin-20210710100606443.htm
"Thanh tra Chính phủ sửa đổi, bổ sung kết luận sai phạm đất đai ở Lâm Đồng",/thanh-tra-chinh-phu-sua-doi-bo-sung-ket-luan-sai-pham-dat-dai-o-lam-dong-20210709151250964.htm
Đức viện trợ vắc xin cho nước nghèo,/duc-vien-tro-vac-xin-cho-nuoc-ngheo-20210709084333337.htm
"Đức chuyển vắc xin AstraZeneca cho nước nghèo, không mua thêm",/duc-chuyen-vac-xin-astrazeneca-cho-nuoc-ngheo-khong-mua-them-20210708064319983.htm
Tôn lạnh Việt Nam không phải chịu thuế chống bán phá giá từ Indonesia,/ton-lanh-viet-nam-khong-phai-chiu-thue-chong-ban-pha-gia-tu-indonesia-20210707144754376.htm
Hơn 400 vụ xả súng trong dịp Quốc khánh Mỹ,/hon-400-vu-xa-sung-trong-dip-quoc-khanh-my-20210706115647374.htm
Chính phủ ban hành gói hỗ trợ 26.000 tỉ cho người lao động và doanh nghiệp,/chinh-phu-ban-hanh-goi-ho-tro-26-000-ti-cho-nguoi-lao-dong-va-doanh-nghiep-20210701184453236.htm
Chuyển 2 vụ sai phạm tại Khu liên hợp thể thao quốc gia sang cơ quan điều tra,/chuyen-2-vu-sai-pham-tai-khu-lien-hop-the-thao-quoc-gia-sang-co-quan-dieu-tra-20210628164546911.htm
Vụ bác sĩ được ‘giải oan’ sau 32 năm khiếu nại: Trường ĐH Y - dược Thái Nguyên cố tình 'làm khó',/vu-bac-si-duoc-giai-oan-sau-32-nam-khieu-nai-truong-dh-y-duoc-thai-nguyen-co-tinh-lam-kho-20210628193645847.htm
Vĩnh Long đề nghị Chính phủ chi viện gần 750.000 liều vắc xin,/vinh-long-de-nghi-chinh-phu-chi-vien-gan-750000-lieu-vac-xin-20210623114453847.htm
"Thanh tra Chính phủ lập tổ liên ngành xử lý khiếu nại, tố cáo đất đai kéo dài tại Hà Nam",/thanh-tra-chinh-phu-lap-to-lien-nganh-xu-ly-khieu-nai-to-cao-dat-dai-keo-dai-tai-ha-nam-20210620140415468.htm
Mua vaccine: Miễn trừ và trù trừ,/mua-vaccine-mien-tru-va-tru-tru-1584748.htm
"Tăng mức phạt vi phạm hành chính trong giáo dục, người làm sai có thể bị phạt tới 150 triệu",/tang-muc-phat-vi-pham-hanh-chinh-trong-giao-duc-nguoi-lam-sai-co-the-bi-phat-toi-150-trieu-20210617154136504.htm
"Lô vắc xin Pfizer đầu tiên về Việt Nam vào tháng 7, hãng chỉ đàm phán với chính phủ",/lo-vac-xin-pfizer-dau-tien-ve-viet-nam-vao-thang-7-hang-chi-dam-phan-voi-chinh-phu-2021061614563187.htm
TP.HCM: Nhiều vi phạm trong chuyển đổi nhà đất công,/tp-hcm-nhieu-vi-pham-trong-chuyen-doi-nha-dat-cong-20210615084717168.htm
"Đội tuyển Việt Nam ủng hộ 300 triệu đồng cho Quỹ vắc xin phòng, chống COVID-19",/doi-tuyen-viet-nam-ung-ho-300-trieu-dong-cho-quy-vac-xin-phong-chong-covid-19-20210608171616122.htm
'Chính quyền dân sự' Myanmar mời nhóm Rohingya gia nhập,/chinh-quyen-dan-su-myanmar-moi-nhom-rohingya-gia-nhap-20210604104059468.htm
Anh đối mặt làn sóng dịch thứ 3 vì biến thể ở Ấn Độ?,/anh-doi-mat-lan-song-dich-thu-3-vi-bien-the-o-an-do-20210531171003691.htm
Bộ trưởng Bộ GD-ĐT Nguyễn Kim Sơn được bổ nhiệm chủ tịch Hội đồng Giáo sư nhà nước,/bo-truong-bo-gd-dt-nguyen-kim-son-duoc-bo-nhiem-chu-tich-hoi-dong-giao-su-nha-nuoc-20210525191317582.htm
"Quân đội Mali bắt giữ tổng thống, thủ tướng",/quan-doi-mali-bat-giu-tong-thong-thu-tuong-20210525080430794.htm
Vietcombank hỗ trợ gần 70 tỉ đồng cho phòng chống dịch COVID-19,/vietcombank-ho-tro-gan-70-ti-dong-cho-phong-chong-dich-covid-19-20210524092624247.htm
Thành viên Tổ Thông tin đáp ứng nhanh nhận bằng khen của Thủ tướng,/thanh-vien-to-thong-tin-dap-ung-nhanh-nhan-bang-khen-cua-thu-tuong-20210522202622219.htm
Cá nhân đã được nhận thế chấp 'sổ đỏ',/ca-nhan-da-duoc-nhan-the-chap-so-do-20210522081253591.htm
Thủ tướng ký ban hành Nghị quyết về mua vắc xin COVID-19,/thu-tuong-ky-ban-hanh-nghi-quyet-ve-mua-vac-xin-covid-19-20210519063053334.htm
Thủ tướng: Đợt dịch này 'mầm bệnh xuất phát từ bên ngoài',/thu-tuong-dot-dich-nay-mam-benh-xuat-phat-tu-ben-ngoai-20210517192047225.htm
Thủ tướng: Chưa giao một số nhiệm vụ phòng cháy chữa cháy cho bảo vệ dân phố,/thu-tuong-chua-giao-mot-so-nhiem-vu-phong-chay-chua-chay-cho-bao-ve-dan-pho-20210513161726097.htm
Báo cáo Thủ tướng lần 2 ‘xin’ chủ trương đầu tư dự án có casino ở Vân Đồn,/bao-cao-thu-tuong-lan-2-xin-chu-truong-dau-tu-du-an-co-casino-o-van-don-20210511135025531.htm
Bộ trưởng Nguyễn Thanh Long: Cố gắng năm nay tiêm vắc xin quy mô lớn nhất lịch sử,/bo-truong-nguyen-thanh-long-co-gang-nam-nay-tiem-vac-xin-quy-mo-lon-nhat-lich-su-20210511123957619.htm
"Ấn Độ giảm số ca COVID-19, giới chuyên gia vẫn kêu gọi phong tỏa",/an-do-giam-so-ca-covid-19-gioi-chuyen-gia-van-keu-goi-phong-toa-2021051014451046.htm
"Thừa Thiên Huế phong tỏa một xã, giãn cách xã hội toàn huyện Phong Điền",/thua-thien-hue-phong-toa-mot-xa-gian-cach-xa-hoi-toan-huyen-phong-dien-20210509112347003.htm
"Nghỉ lễ 1-5, trường ĐH kích hoạt phòng thủ COVID-19, chuyển sang học online",/nghi-le-1-5-truong-dh-kich-hoat-phong-thu-covid-19-chuyen-sang-hoc-online-20210501095555911.htm
Báo Khmer Times: Campuchia 'có thể' tăng hơn 800 ca COVID-19 trong 1 ngày 29-4,/bao-khmer-times-campuchia-co-the-tang-hon-800-ca-covid-19-trong-1-ngay-29-4-20210429101013164.htm
"Điều chỉnh địa giới, lập các thị trấn thuộc Đồng Nai, Thanh Hóa, Tuyên Quang, Hà Nội",/dieu-chinh-dia-gioi-lap-cac-thi-tran-thuoc-dong-nai-thanh-hoa-tuyen-quang-ha-noi-20210427090951396.htm
"New York Times: Ấn Độ khủng hoảng thực sự, số người chết vì COVID-19 cao hơn báo cáo",/new-york-times-an-do-khung-hoang-thuc-su-so-nguoi-chet-vi-covid-19-cao-hon-bao-cao-20210425075937118.htm
"Nguy cơ bùng phát dịch từ nhập cảnh trái phép, Thủ tướng yêu cầu không lơ là, chủ quan",/nguy-co-bung-phat-dich-tu-nhap-canh-trai-phep-thu-tuong-yeu-cau-khong-lo-la-chu-quan-2021042407572658.htm
Thái Lan tăng thêm 1.577 ca COVID-19 trong một ngày,/thai-lan-tang-them-1-577-ca-covid-19-trong-mot-ngay-20210416125831339.htm
Nhà buôn cá Hàn phản đối Nhật xả 1 tỉ tấn nước thải Fukushima ra biển,/nha-buon-ca-han-phan-doi-nhat-xa-1-ti-tan-nuoc-thai-fukushima-ra-bien-20210415195901016.htm
Nhật xem xét hủy bỏ Thế vận hội 2021 vì dịch bệnh tăng vọt,/nhat-xem-xet-huy-bo-the-van-hoi-2021-vi-dich-benh-tang-vot-2021041510562749.htm
Đề xuất chế độ cho những người cần bảo vệ khẩn cấp,/de-xuat-che-do-cho-nhung-nguoi-can-bao-ve-khan-cap-20210413103331895.htm
"Thái Lan ghi nhận ca COVID-19 cao kỷ lục gần 4 con số, Campuchia thêm 277 ca",/thai-lan-ghi-nhan-ca-covid-19-cao-ky-luc-gan-4-con-so-campuchia-them-277-ca-20210412123258336.htm
Cựu bí thư Thành ủy Huế bị yêu cầu truy thu tiền giao đất,/cuu-bi-thu-thanh-uy-tp-hue-bi-yeu-cau-truy-thu-tien-giao-dat-2021041015230351.htm
"Các nước thiếu nguồn cung, vắc xin Trung Quốc lại đắt hàng",/cac-nuoc-thieu-nguon-cung-vac-xin-trung-quoc-lai-dat-hang-20210409205405639.htm
Các tân bộ trưởng ưu tiên nhiệm vụ gì?,/cac-tan-bo-truong-uu-tien-nhiem-vu-gi-20210409081316493.htm
Quốc hội phê chuẩn 2 phó thủ tướng và 12 thành viên Chính phủ mới,/quoc-hoi-phe-chuan-2-pho-thu-tuong-va-12-thanh-vien-chinh-phu-moi-20210408092705633.htm
"TP.HCM: Từ 1-7, công chức phường thuộc biên chế công chức quận",/tphcm-tu-1-7-cong-chuc-phuong-thuoc-bien-che-cong-chuc-quan-20210407153630954.htm
COVID-19 tấn công Chính phủ Thái Lan,/covid-19-tan-cong-chinh-phu-thai-lan-202104071414329.htm
Gần nửa số ca COVID-19 mới của Mỹ tập trung tại 5 bang,/gan-nua-so-ca-covid-19-moi-cua-my-tap-trung-tai-5-bang-20210407112946011.htm
Trình Quốc hội miễn nhiệm Phó thủ tướng Trịnh Đình Dũng và một số bộ trưởng,/trinh-quoc-hoi-mien-nhiem-pho-thu-tuong-trinh-dinh-dung-va-mot-so-bo-truong-20210407091950947.htm
Thử thách nào cho Quốc hội khóa mới?,/thu-thach-nao-cho-quoc-hoi-khoa-moi-20210401082343516.htm
"“Hộ chiếu vaccine”: Lúc cần không có, lúc có như không",/ho-chieu-vaccine-luc-can-khong-co-luc-co-nhu-khong-1578966.htm
HOREA gửi  công văn cho Thủ tướng và Bộ Xây dựng cảnh báo nguy cơ 'ách tắc',/horea-gui-cong-van-cho-thu-tuong-va-bo-xay-dung-canh-bao-nguy-co-ach-tac-20210330174829941.htm
Bắc Ninh chi 185 tỉ đồng tiêm vắc xin ngừa COVID-19 cho 300.000 người ưu tiên,/bac-ninh-chi-185-ti-dong-tiem-vac-xin-ngua-covid-19-cho-300-000-nguoi-uu-tien-20210319082754137.htm
"Campuchia ghi nhận 105 ca COVID-19 một ngày, cao nhất từ đầu dịch",/campuchia-ghi-nhan-105-ca-covid-19-mot-ngay-cao-nhat-tu-dau-dich-20210316142635355.htm
Số ca mắc COVID-19 tại Israel tiếp tục giảm nhờ hiệu quả tiêm vaccine,/so-ca-mac-covid-19-tai-israel-tiep-tuc-giam-nho-hieu-qua-tiem-vaccine-20210316135245199.htm
Ai làm lỡ nhịp nâng hạng môi trường kinh doanh?,/ai-lam-lo-nhip-nang-hang-moi-truong-kinh-doanh-20210316082011976.htm
HƯỚNG TỚI VIỆT NAM SỐ: Tăng tốc xây dựng chính quyền điện tử,/huong-toi-viet-nam-so-tang-toc-xay-dung-chinh-quyen-dien-tu-20210309170614676.htm
Đừng mơ xin xỏ bản quyền vắc xin COVID từ các ông lớn,/dung-mo-xin-xo-ban-quyen-vac-xin-covid-tu-cac-ong-lon-20210305114313744.htm
Nhật kéo dài tình trạng khẩn cấp thêm hai tuần ở vùng thủ đô Tokyo,/nhat-keo-dai-tinh-trang-khan-cap-them-hai-tuan-o-vung-thu-do-tokyo-20210303183405737.htm
"Mở văn phòng 'chui', tuyển sinh du học bằng… văn bản giả",/mo-van-phong-chui-tuyen-sinh-du-hoc-bang-van-ban-gia-20210303074301348.htm
"Vụ án Trịnh Xuân Thanh là đại án, khen thưởng là bình thường",/vu-an-trinh-xuan-thanh-la-dai-an-khen-thuong-la-binh-thuong-20210302182111805.htm
Việt Nam chính thức có hệ thống dữ liệu quốc gia về dân cư,/viet-nam-chinh-thuc-co-he-thong-du-lieu-quoc-gia-ve-dan-cu-20210225175015261.htm
"'Có vắc xin nhập khẩu, vắc xin sản xuất trong nước vẫn là ưu tiên số 1'",/co-vac-xin-nhap-khau-vac-xin-san-xuat-trong-nuoc-van-la-uu-tien-so-1-20210225182548199.htm
'Giải oan' cho bác sĩ Nguyễn Ngọc Lợi sau 32 năm khiếu nại,/giai-oan-cho-bac-si-nguyen-ngoc-loi-sau-32-nam-khieu-nai-20210223171544283.htm
Đề nghị cho Hà Nội tăng số lượng đại biểu HĐND chuyên trách,/de-nghi-cho-ha-noi-tang-so-luong-dai-bieu-hdnd-chuyen-trach-20210222171046394.htm
Thái Lan cho phép đấu giá biển số ô tô mang tên người,/thai-lan-cho-phep-dau-gia-bien-so-o-to-mang-ten-nguoi-20210204140504749.htm
Bộ GD-ĐT: Tuyển ứng viên cho học bổng du học toàn phần tại Trung Quốc,/bo-gd-dt-tuyen-ung-vien-cho-hoc-bong-du-hoc-toan-phan-tai-trung-quoc-20210201104848056.htm
HƯỚNG TỚI VIỆT NAM SỐ: Tiên phong dẫn dắt chuyển đổi số quốc gia,/huong-toi-viet-nam-so-tien-phong-dan-dat-chuyen-doi-so-quoc-gia-20210126224206105.htm
Angela Merkel: Vòng khiêu vũ cuối cùng,/angela-merkel-vong-khieu-vu-cuoi-cung-1576001.htm
Hàn Quốc tìm cách 'sống chung' với tình trạng tỉ lệ sinh thấp,/han-quoc-tim-cach-song-chung-voi-tinh-trang-ti-le-sinh-thap-20210129143711137.htm
"Thủ tướng chỉ thị: Phong tỏa thành phố Chí Linh, đóng cửa sân bay Vân Đồn",/thu-tuong-chi-thi-phong-toa-thanh-pho-chi-linh-dong-cua-san-bay-van-don-20210128155349959.htm
Công cuộc số hóa: Lời giải cho bài toán chi phí của doanh nghiệp Việt,/cong-cuoc-so-hoa-loi-giai-cho-bai-toan-chi-phi-cua-doanh-nghiep-viet-20210122161050877.htm
Vì sao hàng chục ngàn người Ấn Độ trốn tiêm vắc xin COVID-19?,/vi-sao-hang-chuc-ngan-nguoi-an-do-tron-tiem-vac-xin-covid-19-20210119061322194.htm
TP.HCM vẫn cần viện trợ từ cộng đồng quốc tế,/tp-hcm-van-can-vien-tro-tu-cong-dong-quoc-te-20210112131317829.htm
Ngân hàng vẫn được tự quyết ‘room’ ngoại,/ngan-hang-van-duoc-tu-quyet-room-ngoai-20210111163037039.htm
Nước Anh ngày thứ 5 liên tiếp ghi nhận ca COVID-19 mới trên 50.000,/nuoc-anh-ngay-thu-5-lien-tiep-ghi-nhan-ca-covid-19-moi-tren-50-000-20210103081008748.htm
Hướng tới Việt Nam số: Tăng tốc chuyển đổi số quốc gia,/huong-toi-viet-nam-so-tang-toc-chuyen-doi-so-quoc-gia-20201231092725888.htm
Iran bồi thường 150.000 USD mỗi nạn nhân trong vụ bắn nhầm máy bay,/iran-boi-thuong-150-000-usd-moi-nan-nhan-trong-vu-ban-nham-may-bay-20201230235401853.htm
Cổng Dịch vụ công quốc gia: Người dân được xin cấp phép xây dựng nhà qua mạng,/cong-dich-vu-cong-quoc-gia-nguoi-dan-duoc-xin-cap-phep-xay-dung-nha-qua-mang-20201230151546398.htm
Doanh nghiệp Trung Quốc nợ khủng,/doanh-nghiep-trung-quoc-no-khung-20201230083952515.htm
Người Mỹ đã có 'phao cứu sinh',/nguoi-my-da-co-phao-cuu-sinh-20201229085131224.htm
Ca mổ tách rời Trúc Nhi - Diệu Nhi vào top 10 sự kiện khoa học công nghệ,/ca-mo-tach-roi-truc-nhi-dieu-nhi-lot-top-10-su-kien-khoa-hoc-cong-nghe-20201223164924373.htm
"Một năm, 13.000 doanh nghiệp công nghệ số ra đời",/mot-nam-13000-doanh-nghiep-cong-nghe-so-ra-doi-20201223153026244.htm
Ngoại trưởng Pompeo: 'Chính Nga tấn công mạng vào chính phủ Mỹ',/ngoai-truong-pompeo-chinh-nga-tan-cong-mang-vao-chinh-phu-my-20201219143616499.htm
Làm chủ 'cuộc chơi' chuyển đổi số,/lam-chu-cuoc-choi-chuyen-doi-so-20201217221452198.htm
Chính sách về hưu trước tuổi áp dụng từ 1-1-2021,/chinh-sach-ve-huu-truoc-tuoi-moi-ap-dung-tu-1-1-2021-20201216123757459.htm
"2,7 tỉ người không nhận được hỗ trợ từ chính phủ trong đại dịch COVID-19",/2-7-ti-nguoi-khong-nhan-duoc-ho-tro-tu-chinh-phu-trong-dai-dich-covid-19-20201215090114751.htm
Hướng tới Việt Nam số: VNPT được vinh danh nhiều hạng mục top 10 doanh nghiệp CNTT 2020,/huong-toi-viet-nam-so-vnpt-duoc-vinh-danh-nhieu-hang-muc-top-10-doanh-nghiep-cntt-2020-20201214214708385.htm
"Từ ngày 1-1-2021, thí điểm giao dân phòng, dân phố tham gia chữa cháy",/tu-ngay-1-1-2021-thi-diem-giao-dan-phong-dan-pho-tham-gia-chua-chay-20201214075830495.htm
Hà Nội: Đội quản lý trật tự xây dựng đô thị được thí điểm thêm 3 năm,/ha-noi-doi-quan-ly-trat-tu-xay-dung-do-thi-duoc-thi-diem-them-3-nam-20201211133850145.htm
Bộ Giáo dục tuyển ứng viên cho 200 suất học bổng du học Hungary 2021,/bo-giao-duc-tuyen-ung-vien-cho-200-suat-hoc-bong-du-hoc-hungary-2021-20201209152740887.htm
Khẩn trương đề xuất chính sách quản lý cho thuốc lá thế hệ mới,/khan-truong-de-xuat-chinh-sach-quan-ly-cho-thuoc-la-the-he-moi-20201208091755014.htm
Thanh tra Chính phủ chỉ ra hàng loạt sai phạm đất đai tại tỉnh Bắc Giang,/thanh-tra-chinh-phu-chi-ra-hang-loat-sai-pham-dat-dai-tai-tinh-bac-giang-20201205102920669.htm
"Bắc Kinh cài cắm người, mua gần hết báo tiếng Hoa ở Úc",/bac-kinh-cai-cam-nguoi-mua-gan-het-bao-tieng-hoa-o-uc-20201204190555928.htm
Thủ tướng chỉ thị cấp bách tăng cường quản lý chất thải rắn,/thu-tuong-chi-thi-cap-bach-tang-cuong-quan-ly-chat-thai-ran-20201202114058842.htm
Thủ tướng yêu cầu xử lý nghiêm mua bán biển số giả sau phản ánh của Tuổi Trẻ,/thu-tuong-yeu-cau-xu-ly-nghiem-mua-ban-bien-so-gia-sau-phan-anh-cua-tuoi-tre-20201201111059164.htm
Đối thoại Thủ Thiêm: Thanh tra và người dân vẫn khác quan điểm về ranh quy hoạch,/khieu-nai-thu-thiem-thanh-tra-noi-du-co-so-nha-dan-nam-trong-quy-hoach-dan-khong-dong-20201127155747953.htm
"Nepal, Trung Quốc cùng công bố độ cao mới của đỉnh Everest",/nepal-trung-quoc-cung-cong-bo-do-cao-moi-cua-dinh-everest-20201127141135972.htm
Nhật tạm ngưng kích cầu du lịch tại Osaka và Hokkaido do COVID-19,/nhat-tam-ngung-kich-cau-du-lich-tai-osaka-va-hokkaido-do-covid-19-20201124180148325.htm
Viettel chia sẻ kinh nghiệm xây dựng thương hiệu với các doanh nghiệp 'Make in Vietnam',/viettel-chia-se-kinh-nghiem-xay-dung-thuong-hieu-voi-cac-doanh-nghiep-make-in-vietnam-20201123151009792.htm
Chuyển đổi số để người dân được hưởng những dịch vụ tốt nhất,/chuyen-doi-so-de-nguoi-dan-duoc-huong-nhung-dich-vu-tot-nhat-20201120104951083.htm
Tại sao lãnh đạo các hãng làm vắc xin COVID-19 lại bán cổ phiếu rất trúng giá?,/tai-sao-lanh-dao-cac-hang-lam-vac-xin-covid-19-lai-ban-co-phieu-rat-trung-gia-20201116134911015.htm
Số doanh nghiệp Nhật Bản đưa ra chương trình nghỉ hưu sớm tăng mạnh,/so-doanh-nghiep-nhat-ban-dua-ra-chuong-trinh-nghi-huu-som-tang-manh-20201110143036573.htm
Lực lượng công an là chỗ dựa vững chắc của đồng bào trong hoạn nạn,/luc-luong-cong-an-la-cho-dua-vung-chac-cua-dong-bao-trong-hoan-nan-20201109192030877.htm
"Đảng của bà San Suu Kyi tuyên bố chiến thắng, chờ xem quân đội làm gì",/dang-cua-ba-san-suu-kyi-tuyen-bo-chien-thang-cho-xem-quan-doi-lam-gi-20201109161126863.htm
"Giãn, xóa nợ cho người dân và doanh nghiệp bị thiệt hại do mưa lũ và bão số 9",/gian-xoa-no-cho-nguoi-dan-va-doanh-nghiep-bi-thiet-hai-do-mua-lu-va-bao-so-9-20201029205035245.htm
"Diễn viên 'Hạ cánh nơi anh', 'Thế giới hôn nhân' được Hàn Quốc trao bằng khen",/dien-vien-ha-canh-noi-anh-the-gioi-hon-nhan-duoc-han-quoc-trao-bang-khen-2020102818385664.htm
Chánh văn phòng Nhà Trắng: Chính phủ Mỹ không có ý định kiểm soát đại dịch,/chanh-van-phong-nha-trang-chinh-phu-my-khong-co-y-dinh-kiem-soat-dai-dich-2020102609171988.htm
Các chuyên gia nói gì về thay thế Nghị định 64 gây tranh cãi?,/cac-chuyen-gia-noi-gi-ve-thay-the-nghi-dinh-64-gay-tranh-cai-2020102422590132.htm
Trốn thuế sẽ bị phạt tiền từ 1 - 3 lần số thuế trốn,/tron-thue-se-bi-phat-tien-tu-1-3-lan-so-thue-tron-20201021231824092.htm
Chính phủ đề nghị chưa tăng lương cơ sở năm 2021,/chinh-phu-de-nghi-chua-tang-luong-co-so-nam-2021-20201020170352221.htm
"Khai mạc kỳ họp thứ 10, bàn chống dịch và duy trì tăng trưởng năm 2021",/khai-mac-ky-hop-10-ban-chong-dich-va-duy-tri-tang-truong-nam-2021-20201020081525135.htm
"Sợ COVID-19, biểu tình, dân Mỹ mua súng tăng vọt",/so-covid-19-bieu-tinh-dan-my-mua-sung-tang-vot-2020101607070507.htm
Kinh tế số nóng lên sau dịch COVID-19,/kinh-te-so-nong-len-sau-dich-covid-19-20201012210326756.htm
Nhật Bản xem xét nới lỏng quy định cách ly đối với trường hợp nhập cảnh,/nhat-ban-xem-xet-noi-long-quy-dinh-cach-ly-doi-voi-truong-hop-nhap-canh-20201009144549502.htm
