Title,URL
"Chênh hơn 100 triệu đồng, nên mua bản nào của Hyundai Creta 2022?",/chenh-hon-100-trieu-dong-nen-mua-ban-nao-cua-hyundai-creta-2022-20220315153256844.htm
Tài xế tắt app,/tai-xe-tat-app-2022031363115771.htm
Fintech VNPAY bắt tay Visa hỗ trợ ngân hàng chuyển đổi số,/fintech-vnpay-bat-tay-visa-ho-tro-ngan-hang-chuyen-doi-so-2022030918061936.htm
FPT Retail kỷ niệm 10 năm đồng hành cùng người dùng Việt Nam,/fpt-retail-ky-niem-10-nam-dong-hanh-cung-nguoi-dung-viet-nam-20220307160806645.htm
"Y tế số giảm rủi ro lây nhiễm, tăng tiện ích chăm sóc sức khỏe người dân",/y-te-so-giam-rui-ro-lay-nhiem-tang-tien-ich-cham-soc-suc-khoe-nguoi-dan-20220304141221266.htm
Lần đầu tiên xuất hiện ATM dành cho NFT,/lan-dau-tien-xuat-hien-atm-danh-cho-nft-20220303173625194.htm
Học sinh tranh tài tại 'trường thi ảo' lớn nhất 2022,/hoc-sinh-tranh-tai-tai-truong-thi-ao-lon-nhat-2022-20220303104759329.htm
"HDBank, Thought Machine ký thỏa thuận tăng cường phát triển số hóa cho lĩnh vực tài chính, ngân hàng",/hdbank-thought-machine-ky-thoa-thuan-tang-cuong-phat-trien-so-hoa-cho-linh-vuc-tai-chinh-ngan-hang-20220226113351253.htm
Vì sao Công ty metro số 1 TP.HCM thiếu tiền để hoạt động?,/vi-sao-cong-ty-metro-so-1-tp-hcm-thieu-tien-de-hoat-dong-20220225110801294.htm
TP.HCM sẽ hình thành các trung tâm giúp doanh nghiệp cải tiến công nghệ,/tphcm-se-hinh-thanh-cac-trung-tam-giup-doanh-nghiep-cai-tien-cong-nghe-20220224182143338.htm
Sự bứt phá của doanh nghiệp an ninh mạng Việt Nam và bài học chiến lược từ Viettel,/su-but-pha-cua-doanh-nghiep-an-ninh-mang-viet-nam-va-bai-hoc-chien-luoc-tu-viettel-20220219182140858.htm
Hải Phòng: Thay đổi nhận thức để chuyển đổi số thành công,/hai-phong-thay-doi-nhan-thuc-de-chuyen-doi-so-thanh-cong-2022021209512583.htm
Chuyển đổi số - Chuyển đổi tương lai,/chuyen-doi-so-chuyen-doi-tuong-lai-2022020109104593.htm
"Xin số tài khoản thầy cô để 'tặng quà Tết', nên không?",/xin-so-tai-khoan-thay-co-de-tang-qua-tet-nen-khong-2022012708543455.htm
Ta của tương lai,/ta-cua-tuong-lai-1626243.htm
"Cước xe công nghệ 2 và 4 bánh bất ngờ tăng vọt, có lúc không kêu được",/cuoc-xe-cong-nghe-2-va-4-banh-bat-ngo-tang-vot-co-luc-khong-keu-duoc-2022012708140615.htm
"Chọn lời hay, lẽ phải trên mạng xã hội",/chon-loi-hay-le-phai-tren-mang-xa-hoi-20220119213123435.htm
Nghiên cứu 65.000 phụ nữ: Vắc xin công nghệ mRNA an toàn với thai kỳ,/nghien-cuu-65-000-phu-nu-vac-xin-cong-nghe-mrna-an-toan-voi-thai-ky-20220118225106775.htm
Israel xuất hiện hàng nghìn triệu phú mới nhờ công nghệ,/israel-xuat-hien-hang-nghin-trieu-phu-moi-nho-cong-nghe-20220117145425042.htm
M&A lĩnh vực công nghệ số là mảng đầu tư đầy hứa hẹn,/ma-linh-vuc-cong-nghe-so-la-mang-dau-tu-day-hua-hen-20220114081449994.htm
Bộ Nông nghiệp và phát triển nông thôn kiểm tra chợ đầu mối Bình Điền lúc rạng sáng,/bo-nong-nghiep-va-phat-trien-nong-thon-kiem-tra-cho-dau-moi-binh-dien-luc-rang-sang-2022011309410432.htm
realme vừa ra mắt sản phẩm đầu tiên năm 2022,/realme-vua-ra-mat-san-pham-dau-tien-nam-2022-20220112102259164.htm
VNPT góp phần chống COVID-19 bằng công nghệ,/vnpt-gop-phan-chong-covid-19-bang-cong-nghe-20220111111409948.htm
"EVNGENCO3 nhận giải thưởng: Sản phẩm, giải pháp công nghệ số tiêu biểu năm 2021",/evngenco3-nhan-giai-thuong-san-pham-giai-phap-cong-nghe-so-tieu-bieu-nam-2021-20220110164527547.htm
Tài xế xe công nghệ tại Hà Nội trúng Jackpot Vietlott hơn 214 tỉ đồng,/tai-xe-xe-cong-nghe-tai-ha-noi-trung-jackpot-vietlott-hon-214-ti-dong-20220107230331772.htm
Đua mở chuỗi bán lẻ công nghệ,/dua-mo-chuoi-ban-le-cong-nghe-20220102075215705.htm
Chuyển đổi số & chuyện chống dịch,/chuyen-doi-so-chuyen-chong-dich-1621224.htm
"Triệt phá đường dây cá độ bóng đá tiền tỉ, bắt giữ 13 con bạc",/triet-pha-duong-day-ca-do-bong-da-tien-ti-bat-giu-13-con-bac-20211229132644007.htm
FPT đồng hành với Đà Nẵng xây dựng thành phố thông minh,/fpt-dong-hanh-voi-da-nang-xay-dung-thanh-pho-thong-minh-20211228221903774.htm
Chủ động thay đổi giúp Trường ĐH Nguyễn Tất Thành vượt qua đại dịch,/chu-dong-thay-doi-giup-truong-dh-nguyen-tat-thanh-vuot-qua-dai-dich-20211228163506961.htm
Nhật Bản ứng dụng công nghệ kỹ thuật số để 'hồi sinh' du lịch,/nhat-ban-ung-dung-cong-nghe-ky-thuat-so-de-hoi-sinh-du-lich-20211228133904727.htm
"Mua kit xét nghiệm bị 'thổi giá' của Công ty Việt Á, đòi lại tiền được không?",/mua-kit-xet-nghiem-bi-thoi-gia-cua-cong-ty-viet-a-doi-lai-tien-duoc-khong-20211226173302457.htm
"Năm 2021, VNPT hoàn thành 'mục tiêu kép' với nhiều dấu ấn",/nam-2021-vnpt-hoan-thanh-muc-tieu-kep-voi-nhieu-dau-an-20211224192121649.htm
Sống ở chung cư có công nghệ 4.0 càng tốt hơn,/song-o-chung-cu-co-cong-nghe-4-0-cang-tot-hon-20211224084755845.htm
Shopee tiếp tục vào danh sách ‘100 nơi làm việc tốt nhất Việt Nam 2021’,/shopee-tiep-tuc-vao-danh-sach-100-noi-lam-viec-tot-nhat-viet-nam-2021-20211223151424275.htm
Hai bệnh viện ở TP.HCM mua kit xét nghiệm của Việt Á tổng cộng hơn 32 tỉ đồng,/hai-benh-vien-o-tp-hcm-mua-kit-xet-nghiem-cua-viet-a-tong-cong-hon-32-ti-dong-20211223111613066.htm
Chuyển đổi số báo chí là quá trình không thể đảo ngược,/chuyen-doi-so-bao-chi-la-qua-trinh-khong-the-dao-nguoc-20211223103617448.htm
Báo chí tăng tốc chuyển đổi số,/bao-chi-tang-toc-chuyen-doi-so-20211223090034814.htm
Chuyển đổi số được sẽ giảm 'chi phí chìm' cho doanh nghiệp,/chuyen-doi-so-duoc-se-giam-chi-phi-chim-cho-doanh-nghiep-20211221094940617.htm
Công nghệ trí tuệ nhân tạo của VNPT 'đắt hàng' trong nền kinh tế số,/cong-nghe-tri-tue-nhan-tao-cua-vnpt-dat-hang-trong-nen-kinh-te-so-20211222133725846.htm
Startup Việt nhận giải thưởng quốc tế chuyển đổi số giáo dục qua công nghệ,/startup-viet-nhan-giai-thuong-quoc-te-chuyen-doi-so-giao-duc-qua-cong-nghe-20211221171930991.htm
Vụ 'thổi giá' kit xét nghiệm Việt Á: Lợi dụng chống dịch bất chấp luật pháp,/vu-thoi-gia-kit-xet-nghiem-viet-a-loi-dung-chong-dich-bat-chap-luat-phap-20211222083616988.htm
Công nghệ số giúp ngành giao nhận hàng đạt hiệu quả khó ngờ,/cong-nghe-so-giup-nganh-giao-nhan-hang-dat-hieu-qua-kho-ngo-20211214100220421.htm
Bình Dương có mua kit xét nghiệm của Công ty Việt Á,/binh-duong-co-mua-kit-xet-nghiem-cua-cong-ty-viet-a-20211220182325155.htm
Gia Lai chỉ mua kit xét nghiệm của Việt Á dùng cho 1 ngày vì giá quá cao,/gia-lai-chi-mua-kit-xet-nghiem-cua-viet-a-dung-cho-1-ngay-vi-gia-qua-cao-20211220100828805.htm
10 tài năng trẻ nhận giải thưởng Quả cầu vàng 2021,/10-tai-nang-tre-nhan-giai-thuong-qua-cau-vang-2021-20211220084019839.htm
Thủ tướng yêu cầu đẩy mạnh chuyển đổi số để phát triển vận tải biển,/thu-tuong-yeu-cau-day-manh-chuyen-doi-so-de-phat-trien-van-tai-bien-20211219123223956.htm
Việt Nam có nền tảng Chính quyền số toàn diện đầu tiên,/viet-nam-co-nen-tang-chinh-quyen-so-toan-dien-dau-tien-20211218184406844.htm
"SOVICO hợp tác với HCL Technologies Limited nghiên cứu, phát triển công nghệ",/sovico-hop-tac-voi-hcl-technologies-limited-nghien-cuu-phat-trien-cong-nghe-20211217201706104.htm
Chuyển đổi số tại AIA Việt Nam: Nâng tầm trải nghiệm khách hàng,/chuyen-doi-so-tai-aia-viet-nam-nang-tam-trai-nghiem-khach-hang-20211217165625321.htm
Chủ tịch Phan Văn Mãi: Chuyển đổi số có sứ mệnh mới hậu COVID-19,/chu-tich-phan-van-mai-chuyen-doi-so-co-su-menh-moi-hau-covid-19-20211216100452446.htm
Thiếu tướng Lê Đăng Dũng: Viettel không bao giờ dừng ở gia công mà phải làm chủ công nghệ lõi,/thieu-tuong-le-dang-dung-viettel-khong-bao-gio-dung-o-gia-cong-ma-phai-lam-chu-cong-nghe-loi-20211215144822763.htm
Khai trương trung tâm điều hành đô thị thông minh đầu tiên tại Đồng Tháp,/khai-truong-trung-tam-dieu-hanh-do-thi-thong-minh-dau-tien-tai-dong-thap-20211212161359972.htm
"Chuyển đổi số: Phải nhanh hơn, mạnh hơn!",/chuyen-doi-so-phai-nhanh-hon-manh-hon-2021121208255986.htm
Chuyển đổi số sẽ dẫn dắt phục hồi kinh tế sau dịch,/chuyen-doi-so-se-dan-dat-phuc-hoi-kinh-te-sau-dich-20211211193633888.htm
"Thúc đẩy chuyển đổi số, phục hồi kinh tế sau đại dịch bằng những nền tảng Make in Vietnam",/thuc-day-chuyen-doi-so-phuc-hoi-kinh-te-sau-dai-dich-bang-nhung-nen-tang-make-in-vietnam-20211211114617916.htm
"Khám chữa bệnh từ xa: Tốt cho bệnh nhân, an toàn cho bệnh viện",/kham-chua-benh-tu-xa-tot-cho-benh-nhan-an-toan-cho-benh-vien-20211209100222158.htm
Vì sao mua vé số qua Vietlott SMS đang trở thành xu hướng?,/vi-sao-mua-ve-so-qua-vietlott-sms-dang-tro-thanh-xu-huong-20211209110322517.htm
Nâng tầm nhân lực công nghệ thông tin,/nang-tam-nhan-luc-cong-nghe-thong-tin-20211209083142085.htm
Thủ tướng sẽ tham dự Diễn đàn Quốc gia phát triển doanh nghiệp công nghệ số,/thu-tuong-se-tham-du-dien-dan-quoc-gia-phat-trien-doanh-nghiep-cong-nghe-so-20211207201042799.htm
"Thủ tướng: 'Muốn chuyển đổi số, công nghệ số phải có xã hội số, công dân số'",/thu-tuong-muon-chuyen-doi-so-cong-nghe-so-phai-co-xa-hoi-so-cong-dan-so-20211206131205508.htm
VIDEX 2021 ứng dụng công nghệ để xúc tiến thương mại,/videx-2021-ung-dung-cong-nghe-de-xuc-tien-thuong-mai-20211201164136622.htm
Dấu ấn 10 năm của Vietlott – Mới! Để tốt hơn,/dau-an-10-nam-cua-vietlott-moi-de-tot-hon-20211130235759513.htm
eKYC và chiến lược số hóa của HDBank,/ekyc-va-chien-luoc-so-hoa-cua-hdbank-20211130161212799.htm
Nhiều hiến kế giải pháp công nghệ phát triển TP.HCM,/nhieu-hien-ke-giai-phap-cong-nghe-phat-trien-tp-hcm-20211127123246649.htm
Hiến kế giải pháp công nghệ phát triển TP.HCM: Tạo môi trường sáng tạo cho sinh viên,/hien-ke-giai-phap-cong-nghe-phat-trien-tp-hcm-tao-moi-truong-sang-tao-cho-sinh-vien-20211127084741527.htm
Hiến kế giải pháp công nghệ phát triển TP.HCM: 4 lĩnh vực nên ưu tiên đầu tư,/hien-ke-giai-phap-cong-nghe-phat-trien-tphcm-4-linh-vuc-nen-uu-tien-dau-tu-20211125093751711.htm
Khởi động diễn đàn 'Hiến kế giải pháp công nghệ phát triển TP.HCM',/khoi-dong-dien-dan-hien-ke-giai-phap-cong-nghe-phat-trien-tp-hcm-20211122084149627.htm
"F0 gia tăng, TP.HCM cần thêm 100.000 liều thuốc kháng virus Molnupiravir",/f0-gia-tang-tp-hcm-can-them-100-000-lieu-thuoc-khang-virus-molnupiravir-20211119125027346.htm
Chứng khoán Yuanta Việt Nam tăng vốn điều lệ lên 2.000 tỉ đồng,/chung-khoan-yuanta-viet-nam-tang-von-dieu-le-len-2000-ti-dong-20211118072206691.htm
Chữ ký số cá nhân: Cơ hội đón đầu chuyển đổi số trong lĩnh vực tài chính,/chu-ky-so-ca-nhan-co-hoi-don-dau-chuyen-doi-so-trong-linh-vuc-tai-chinh-202111161825043.htm
Tham gia bình chọn Quả cầu vàng năm 2021,/tham-gia-binh-chon-qua-cau-vang-nam-2021-20211116115954659.htm
Thành phố thông minh - 'Sức bật' mới của địa phương trong kỷ nguyên số,/thanh-pho-thong-minh-suc-bat-moi-cua-dia-phuong-trong-ky-nguyen-so-20211115181622471.htm
Việt Nam - hành trình phóng vệ tinh vào vũ trụ - Kỳ 4: Bóng hồng trong chế tạo vệ tinh,/viet-nam-hanh-trinh-phong-ve-tinh-vao-vu-tru-ky-4-bong-hong-trong-che-tao-ve-tinh-20211114095426388.htm
Quảng Ninh thông qua 5 nghị quyết quan trọng,/quang-ninh-thong-qua-5-nghi-quyet-quan-trong-20211113170351668.htm
Điện lực miền Trung đoạt giải nhất Sáng tạo khoa học công nghệ Việt Nam,/dien-luc-mien-trung-dat-giai-nhat-sang-tao-khoa-hoc-cong-nghe-viet-nam-20211113103157952.htm
Sống thật trong không gian ảo: Giấc mơ ngày một gần hơn,/song-that-trong-khong-gian-ao-giac-mo-ngay-mot-gan-hon-1614744.htm
"Đại biểu Quốc hội tích cực đổi mới, chuyển đổi số trong kỳ họp thứ 2, Quốc hội khóa XV",/dai-bieu-quoc-hoi-tich-cuc-doi-moi-chuyen-doi-so-trong-ky-hop-thu-2-quoc-hoi-khoa-xv-20211108190733774.htm
"Người dùng Twitter muốn tỉ phú Elon Musk bán cổ phần Tesla, ông Elon Musk cam kết sẽ làm như vậy",/nguoi-dung-twitter-muon-ti-phu-elon-musk-ban-co-phan-tesla-ong-elon-musk-cam-ket-se-lam-nhu-vay-20211108074027233.htm
Đọc báo cùng bạn 6-11: Làm lãnh đạo không được lòng dân là thất bại,/doc-bao-cung-ban-6-11-lam-lanh-dao-khong-duoc-long-dan-la-that-bai-20211106030141797.htm
"Ra mắt không gian sáng tạo số mới nhất, MB đón đầu công nghệ ngành ngân hàng Việt",/ra-mat-khong-gian-sang-tao-so-moi-nhat-mb-don-dau-cong-nghe-nganh-ngan-hang-viet-20211104174622569.htm
"Thúc đẩy thanh toán không dùng tiền mặt để phòng chống tham nhũng, chống rửa tiền",/thuc-day-thanh-toan-khong-dung-tien-mat-de-phong-chong-tham-nhung-chong-rua-tien-20211028192301391.htm
Số lượng 'kỳ lân' mới ở Ấn Độ vượt xa Trung Quốc,/so-luong-ky-lan-moi-o-an-do-vuot-xa-trung-quoc-20211028150314358.htm
Hãng bay Mỹ thử nghiệm nhận diện khuôn mặt thay cho thẻ lên máy bay,/hang-bay-my-thu-nghiem-nhan-dien-khuon-mat-thay-cho-the-len-may-bay-20211028104604293.htm
Tư vấn: Ứng dụng công nghệ mới theo dõi đường huyết liên tục trong quản lý đái tháo đường,/tu-van-ung-dung-cong-nghe-moi-theo-doi-duong-huyet-lien-tuc-trong-quan-ly-dai-thao-duong-20211027090155262.htm
Công ty Nhiệt điện Phú Mỹ áp dụng ứng dụng Base trong chuyển đổi số doanh nghiệp,/cong-ty-nhiet-dien-phu-my-ap-dung-ung-dung-base-trong-chuyen-doi-so-doanh-nghiep-20211026145252567.htm
Agribank Chi nhánh Bắc TP.HCM thông báo tuyển dụng lao động năm 2021,/agribank-chi-nhanh-bac-tphcm-thong-bao-tuyen-dung-lao-dong-nam-2021-20211024145236087.htm
Biến COVID-19 thành cơ hội để Việt Nam đột phá vươn lên về công nghệ,/bien-covid-19-thanh-co-hoi-de-viet-nam-dot-pha-vuon-len-ve-cong-nghe-20211018151308097.htm
Số hóa cơ sở hạ tầng – Nền tảng cho thành phố thông minh,/so-hoa-co-so-ha-tang-nen-tang-cho-thanh-pho-thong-minh-20211018133144991.htm
Công nghệ “tối ưu hóa miếng ăn”,/cong-nghe-toi-uu-hoa-mieng-an-1609333.htm
Thủy điện Buôn Kuốp ứng dụng công nghệ trong phòng chống thiên tai,/thuy-dien-buon-kuop-ung-dung-cong-nghe-trong-phong-chong-thien-tai-20211015105248623.htm
Vietlott được vinh danh Top 10 thương hiệu mạnh ngành Dịch vụ số Việt Nam 2021,/vietlott-duoc-vinh-danh-top-10-thuong-hieu-manh-nganh-dich-vu-so-viet-nam-2021-20211014103415032.htm
Thủ tướng: Khai mở các giá trị của chuyển đổi số để phục hồi kinh tế sau đại dịch,/thu-tuong-khai-mo-cac-gia-tri-cua-chuyen-doi-so-de-phuc-hoi-kinh-te-sau-dai-dich-20211012213232271.htm
Dai-ichi Life Việt Nam nhận giải thưởng về chuyển đổi số,/dai-ichi-life-viet-nam-nhan-giai-thuong-ve-chuyen-doi-so-20211011181729111.htm
Úc lập ủy ban giám sát thông tin sai lệch trên Internet,/uc-lap-uy-ban-giam-sat-thong-tin-sai-lech-tren-internet-20211011141327334.htm
Nỗi niềm shipper mùa dịch,/noi-niem-shipper-mua-dich-1607912.htm
TP.HCM: Nhiều hoạt động trong Tuần lễ học tập suốt đời 2021,/tp-hcm-nhieu-hoat-dong-trong-tuan-le-hoc-tap-suot-doi-2021-2021100618321689.htm
KSF Group và chiến lược 'tối ưu cho người dùng bằng các điểm chạm',/ksf-group-va-chien-luoc-toi-uu-cho-nguoi-dung-bang-cac-diem-cham-20211006130444969.htm
"Chữ ký số: Cơ hội và thách thức, mở lối thành công trong chuyển đổi số",/chu-ky-so-co-hoi-va-thach-thuc-mo-loi-thanh-cong-trong-chuyen-doi-so-20211004233336901.htm
Sử dụng công nghệ để phòng chống dịch hiệu quả hơn,/su-dung-cong-nghe-de-phong-chong-dich-hieu-qua-hon-20211003230354666.htm
Ứng dụng PC-COVID cần khắc phục những vấn đề gì về bảo mật?,/ung-dung-pc-covid-can-khac-phuc-nhung-van-de-gi-ve-bao-mat-20211003153201012.htm
"Hậu COVID, doanh nghiệp sẽ phải 'biến đổi' như thế nào?",/hau-covid-doanh-nghiep-se-phai-bien-doi-nhu-the-nao-20210930112858195.htm
Nâng cao năng lực quản lý bằng công nghệ 3D ở Thủy điện Thác Mơ,/nang-cao-nang-luc-quan-ly-bang-cong-nghe-3d-o-thuy-dien-thac-mo-20210929143919627.htm
Phục hồi ngành F&B: Trăm sự nhờ shipper,/phuc-hoi-nganh-fb-tram-su-nho-shipper-20210928204659626.htm
Giải pháp Ngân hàng số toàn diện hàng đầu dành cho doanh nghiệp: BIZ MBBank,/giai-phap-ngan-hang-so-toan-dien-hang-dau-danh-cho-doanh-nghiep-biz-mbbank-20210922180957948.htm
MBBank đồng hành cùng cộng đồng trong công tác thiện nguyện minh bạch,/mbbank-dong-hanh-cung-cong-dong-trong-cong-tac-thien-nguyen-minh-bach-20210922134433551.htm
Agribank Chi nhánh 3 thông báo tuyển dụng,/agribank-chi-nhanh-3-thong-bao-tuyen-dung-20210921160348426.htm
"Sinh viên sáng tạo các ‘phòng chờ ảo’, giảm thời gian thăm khám ở bệnh viện",/sinh-vien-sang-tao-cac-phong-cho-ao-giam-thoi-gian-tham-kham-o-benh-vien-20210921093148276.htm
Thủ tướng Phạm Minh Chính đề nghị Áo chuyển nhượng vắc xin còn dư,/thu-tuong-pham-minh-chinh-de-nghi-ao-chuyen-nhuong-vac-xin-con-du-20210917095321977.htm
Xổ số Max 3D - cách chơi quen thuộc với người Việt Nam,/xo-so-max-3d-cach-choi-quen-thuoc-voi-nguoi-viet-nam-20210916220618781.htm
Bảo tàng Lịch sử quốc gia đưa khách tham quan online các bảo vật bằng công nghệ 3D,/bao-tang-lich-su-quoc-gia-dua-khach-tham-quan-online-cac-bao-vat-bang-cong-nghe-3d-20210915123101924.htm
Ngày càng nhiều tập đoàn công nghệ tự phát triển chip riêng,/ngay-cang-nhieu-tap-doan-cong-nghe-tu-phat-trien-chip-rieng-20210909150151107.htm
"Số hóa ngân hàng, khách hàng được lợi gì?",/so-hoa-ngan-hang-khach-hang-duoc-loi-gi-20210908123718525.htm
Giải mã thành công của LazMall - trung tâm mua sắm trực tuyến hàng đầu Đông Nam Á,/giai-ma-thanh-cong-cua-lazmall-trung-tam-mua-sam-truc-tuyen-hang-dau-dong-nam-a-20210908140246224.htm
Gen Z thúc đẩy hệ sinh thái tiện ích ngân hàng số trong đại dịch,/gen-z-thuc-day-he-sinh-thai-tien-ich-ngan-hang-so-trong-dai-dich-20210908101451502.htm
TP.HCM: Shipper được hoạt động tại 'vùng đỏ',/tphcm-shipper-duoc-hoat-dong-tai-vung-do-20210901152523642.htm
Điện lực miền Nam chuyển đổi số: Ngày mai bắt đầu từ hôm nay,/dien-luc-mien-nam-chuyen-doi-so-ngay-mai-bat-dau-tu-hom-nay-20210830152701529.htm
FPT hỗ trợ thiết bị công nghệ cho 5 bệnh viện dã chiến tại Cần Thơ,/fpt-ho-tro-thiet-bi-cong-nghe-cho-5-benh-vien-da-chien-tai-can-tho-20210830120713707.htm
PTC2 triển khai giám sát và kiểm tra y tế bằng công nghệ số,/ptc2-trien-khai-giam-sat-va-kiem-tra-y-te-bang-cong-nghe-so-20210830121429638.htm
Người tiêu dùng thông minh thời 4.0: Chủ động bảo vệ trước rủi ro,/nguoi-tieu-dung-thong-minh-thoi-40-chu-dong-bao-ve-truoc-rui-ro-20210825132309566.htm
"HỎI - ĐÁP về dịch COVID-19: Đã tiêm mũi 1 vắc xin COVID-19, tiêm mũi 2 ra sao?",/hoi-dap-ve-dich-covid-19-da-tiem-mui-1-vac-xin-covid-19-tiem-mui-2-ra-sao-20210825150046329.htm
‘Chuẩn bị hành trang tương lai số và công nghệ cho mỗi sinh viên’,/chuan-bi-hanh-trang-tuong-lai-so-va-cong-nghe-cho-moi-sinh-vien-2021082414202764.htm
Áp dụng công nghệ số tăng cường hợp tác liên nghị viện ASEAN,/ap-dung-cong-nghe-so-tang-cuong-hop-tac-lien-nghi-vien-asean-20210823140037472.htm
Đọc báo cùng bạn 20-8: Tập trung xét nghiệm mở rộng 'vùng xanh',/doc-bao-cung-ban-20-8-tap-trung-xet-nghiem-mo-rong-vung-xanh-2021082003071147.htm
YouTube thêm công nghệ giúp người dùng dễ tìm thấy video mong muốn,/youtube-them-cong-nghe-giup-nguoi-dung-de-tim-thay-video-mong-muon-20210819111228999.htm
Lý do ngành Công nghệ thông tin trở thành ngành hot năm 2021,/ly-do-nganh-cong-nghe-thong-tin-tro-thanh-nganh-hot-nam-2021-2021081615244252.htm
Lợi thế nổi bật khi học Trí tuệ nhân tạo (AI) tại SIU,/loi-the-noi-bat-khi-hoc-tri-tue-nhan-tao-ai-tai-siu-20210814155700302.htm
Tuổi Trẻ Cười số 15-8-2021: Cô hồn và Cô Vít,/tuoi-tre-cuoi-so-15-8-2021-co-hon-va-co-vit-2021081395840157.htm
Hiến kế 'TP.HCM nâng tầm quốc tế': TP.HCM - thành phố số,/hien-ke-tphcm-nang-tam-quoc-te-tphcm-thanh-pho-so-20210812101902149.htm
"Ra mắt hệ thống dữ liệu và các nền tảng phòng chống dịch thống nhất, liên thông",/ra-mat-he-thong-du-lieu-va-cac-nen-tang-phong-chong-dich-thong-nhat-lien-thong-20210808204745383.htm
Tổng công ty Điện lực TP.HCM: Con người là trung tâm của chuyển đổi số,/tong-cong-ty-dien-luc-tp-hcm-con-nguoi-la-trung-tam-cua-chuyen-doi-so-20210807094213978.htm
ĐH Quốc gia Hà Nội công bố ngưỡng đầu vào qua xét tuyển điểm thi tốt nghiệp,/dh-quoc-gia-ha-noi-cong-bo-nguong-dau-vao-qua-xet-tuyen-diem-thi-tot-nghiep-20210803132335514.htm
Hiến kế 'TP.HCM nâng tầm quốc tế': Cấp thiết chính quyền số,/hien-ke-tp-hcm-nang-tam-quoc-te-cap-thiet-chinh-quyen-so-20210727231540399.htm
"Khuyến khích xã hội hóa, phát triển ""quỹ vắc xin""",/khuyen-khich-xa-hoi-hoa-phat-trien-quy-vac-xin-20210722100317166.htm
TP.HCM yêu cầu khẩn các quận huyện mở rộng thêm 10 nhóm lao động tự do nhận hỗ trợ,/tp-hcm-yeu-cau-khan-cac-quan-huyen-mo-rong-them-10-nhom-lao-dong-tu-do-nhan-ho-tro-20210720162735997.htm
Ngành điện TP.HCM sẽ sớm hoàn thành chuyển đổi số,/nganh-dien-tphcm-se-som-hoan-thanh-chuyen-doi-so-20210718224644443.htm
CEO Vietlott - Công nghệ giúp thay đổi nhận thức về vé số,/ceo-vietlott-cong-nghe-giup-thay-doi-nhan-thuc-ve-ve-so-202107180022466.htm
"'Săn' Jackpot ở bất cứ đâu, tại sao không?",/san-jackpot-o-bat-cu-dau-tai-sao-khong-20210716162515732.htm
Công nghệ số giúp Điện lực TP.HCM cấp điện ổn định trong mùa dịch,/cong-nghe-so-giup-dien-luc-tphcm-cap-dien-on-dinh-trong-mua-dich-20210716113418305.htm
Trường Đại học Văn Lang bất ngờ mở ngành hot Thương mại điện tử,/truong-dai-hoc-van-lang-bat-ngo-mo-nganh-hot-thuong-mai-dien-tu-20210714161523533.htm
Tuổi Trẻ Cười số 15-7-2021: Bữa cơm trong tâm dịch,/tuoi-tre-cuoi-so-15-7-2021-bua-com-trong-tam-dich-2021071398837159.htm
Úc phát triển thành công công nghệ đo đường huyết không cần lấy máu,/uc-phat-trien-thanh-cong-cong-nghe-do-duong-huyet-khong-can-lay-mau-20210713110955703.htm
HỎI - ĐÁP về dịch COVID-19: Chỉ thị 16 được áp dụng như thế nào tại TP.HCM từ 0h ngày 9-7?,/hoi-dap-ve-dich-covid-19-chi-thi-16-duoc-ap-dung-nhu-the-nao-tai-tp-hcm-tu-0h-ngay-9-7-20210708161349434.htm
Triệt phá đường dây đánh bạc qua mạng với số tiền giao dịch trên 50 tỉ đồng,/triet-pha-duong-day-danh-bac-qua-mang-voi-so-tien-giao-dich-tren-50-ti-dong-bat-giu-6-con-bac-2021070712545385.htm
Nutricare: Dây chuyền triệu đô cho giấc mơ 'dinh dưỡng vượt trội',/nutricare-day-chuyen-trieu-do-cho-giac-mo-dinh-duong-vuot-troi-20210702160207785.htm
Ứng dụng công nghệ số trong cảnh báo xả nước điều tiết hồ chứa và chạy máy từ xa,/ung-dung-cong-nghe-so-trong-canh-bao-xa-nuoc-dieu-tiet-ho-chua-va-chay-may-tu-xa-2021062816223269.htm
Bộ trưởng Lê Minh Hoan: Làm nông hiện nay phải tính đến 'thương hiệu',/bo-truong-le-minh-hoan-lam-nong-hien-nay-phai-tinh-den-thuong-hieu-20210628130426983.htm
Doanh nghiệp công nghệ Việt xây dựng cơ sở dữ liệu quốc gia về dân cư như thế nào?,/doanh-nghiep-cong-nghe-viet-xay-dung-co-so-du-lieu-quoc-gia-ve-dan-cu-nhu-the-nao-20210625182753734.htm
Lừa đảo học sinh nộp tiền để chiếm ưu thế xét tuyển học bạ,/lua-dao-hoc-sinh-nop-tien-de-chiem-uu-the-xet-tuyen-hoc-ba-20210623111634285.htm
"TP.HCM: Tập trung quá 3 người nơi công cộng, vẫn bán ở chợ tạm... bị phạt thế nào?",/tp-hcm-tap-trung-qua-3-nguoi-noi-cong-cong-van-ban-o-cho-tam-bi-phat-the-nao-20210620180734583.htm
Cam go chủ quyền số,/cam-go-chu-quyen-so-1584749.htm
Ưu tiên xây dựng thương hiệu quốc gia cho sản phẩm công nghệ số 'Make in Vietnam',/uu-tien-xay-dung-thuong-hieu-quoc-gia-cho-san-pham-cong-nghe-so-make-in-vietnam-20210618133945728.htm
Triển khai chiến dịch tiêm chủng lớn nhất trong lịch sử,/trien-khai-chien-dich-tiem-chung-lon-nhat-trong-lich-su-20210616025345916.htm
"PVOil thu hồi văn bản buộc nhân viên phải nghỉ việc nếu làm thêm shipper, taxi công nghệ...",/pvoil-thu-hoi-van-ban-buoc-nhan-vien-phai-nghi-viec-neu-lam-them-shipper-taxi-cong-nghe-20210615115644133.htm
Một phụ nữ bị lừa chiếm đoạt hơn 1 tỉ đồng vì nộp tiền vào tài khoản lạ,/mot-phu-nu-bi-lua-chiem-doat-hon-1-ti-dong-vi-nop-tien-vao-tai-khoan-la-20210614134906607.htm
