Title,URL
"Bộ Công an đã giảm 6 tổng cục, hơn 1.000 đơn vị cấp phòng",/bo-cong-an-da-giam-6-tong-cuc-hon-1-000-don-vi-cap-phong-20201008133141898.htm
Anh công bố chương trình mới về hỗ trợ việc làm,/anh-cong-bo-chuong-trinh-moi-ve-ho-tro-viec-lam-20200925140930089.htm
"Đề xuất xây dựng bản đồ số, khoanh vùng an toàn du lịch",/de-xuat-xay-dung-ban-do-so-khoanh-vung-an-toan-du-lich-20200918092527959.htm
Nghị sĩ Nhật đề xuất tổ chức tập trận chung với Mỹ ở biển Hoa Đông,/nghi-si-nhat-de-xuat-to-chuc-tap-tran-chung-voi-my-o-bien-hoa-dong-2020091721392786.htm
Nhóm các nước giàu mua hơn nửa số liều vắc xin COVID-19 được hứa hẹn trong tương lai,/nhom-cac-nuoc-giau-mua-hon-nua-so-lieu-vac-xin-covid-19-duoc-hua-hen-trong-tuong-lai-20200917102634493.htm
Nhiệm kỳ này giảm hơn 334.000 biên chế thuộc Chính phủ quản lý,/nhiem-ky-nay-giam-hon-334-000-bien-che-thuoc-chinh-phu-quan-ly-20200916165247907.htm
Chính phủ Pháp trả 84% lương cho bố mẹ ở nhà trông con nghỉ học tránh COVID-19,/chinh-phu-phap-tra-84-luong-cho-bo-me-o-nha-trong-con-nghi-hoc-tranh-covid-19-20200914140243879.htm
Tàu metro Bến Thành - Suối Tiên dự kiến về Việt Nam tháng 10,/tau-metro-ben-thanh-suoi-tien-du-kien-ve-viet-nam-thang-10-20200907125603295.htm
Chính phủ thống nhất để Bộ Công an sát hạch cấp bằng lái xe,/chinh-phu-thong-nhat-de-bo-cong-an-sat-hach-cap-bang-lai-xe-20200906211831214.htm
TP.HCM chuẩn bị gì cho nhân sự khóa tới?,/tp-hcm-chuan-bi-gi-cho-nhan-su-khoa-toi-20200905013215376.htm
EU khuyến cáo không nên rút ngắn thời gian cách ly 14 ngày,/eu-khuyen-cao-khong-nen-rut-ngan-thoi-gian-cach-ly-14-ngay-20200904101428979.htm
"Người Đức trêu ngươi chính quyền, tụ tập xuống đường biểu tình",/nguoi-duc-treu-nguoi-chinh-quyen-tu-tap-xuong-duong-bieu-tinh-20200829205543659.htm
Cán bộ liên quan sai phạm ở Phú Quốc giữ vị trí khác tương đương hoặc cao hơn chức cũ,/can-bo-lien-quan-sai-pham-o-phu-quoc-giu-vi-tri-khac-tuong-duong-hoac-cao-hon-chuc-cu-20200822085944102.htm
6 tháng đầu năm doanh thu tập đoàn Viettel đạt 120 nghìn tỉ,/6-thang-dau-nam-doanh-thu-tap-doan-viettel-dat-120-nghin-ti-20200821144741254.htm
Hàn Quốc siết chặt một số quy định về cho thuê nhà,/han-quoc-siet-chat-mot-so-quy-dinh-ve-cho-thue-nha-20200820152524651.htm
"Xây dựng Chính phủ số, liêm chính, minh bạch, hành động",/xay-dung-chinh-phu-so-liem-chinh-minh-bach-hanh-dong-20200820074622955.htm
Phòng thí nghiệm hàng đầu Ấn Độ: Có thể 1/4 dân số Ấn Độ đã mắc COVID-19,/phong-thi-nghiem-hang-dau-an-do-co-the-1-4-dan-so-an-do-da-mac-covid-19-20200819235159401.htm
"Biểu tình ở Thái Lan kêu gọi chính phủ từ chức, lớn nhất kể từ sau đảo chính 2014",/bieu-tinh-o-thai-lan-keu-goi-chinh-phu-tu-chuc-lon-nhat-ke-tu-sau-dao-chinh-2014-20200817090853223.htm
"Dự báo dịch bệnh còn phức tạp, Đà Nẵng tiếp tục cách ly toàn xã hội",/du-bao-dich-benh-con-phuc-tap-da-nang-tiep-tuc-cach-ly-toan-xa-hoi-20200811114823273.htm
Thủ tướng Nguyễn Xuân Phúc : Dập dịch trong ít nhất hai tuần tới,/thu-tuong-nguyen-xuan-phuc-dap-dich-trong-it-nhat-hai-tuan-toi-20200808072733278.htm
Tổ chức thi tốt nghiệp THPT trong tình huống đặc biệt,/to-chuc-thi-tot-nghiep-thpt-trong-tinh-huong-dac-biet-20200804094945008.htm
Thái Lan dọa xử Facebook vì để dịch tự động sai về hoàng gia,/thai-lan-doa-xu-facebook-vi-de-dich-tu-dong-sai-ve-hoang-gia-20200803233428946.htm
Điều tra của BBC: Số tử vong vì COVID-19 ở Iran gấp 3 lần số liệu chính thức,/dieu-tra-cua-bbc-so-tu-vong-vi-covid-19-o-iran-gap-3-lan-so-lieu-chinh-thuc-2020080311275634.htm
"Đề xuất áp dụng chỉ thị 19 tại TP.HCM: không tập trung quá 20 người, giãn cách 1m",/de-xuat-ap-dung-chi-thi-19-tai-tp-hcm-khong-tap-trung-qua-20-nguoi-gian-cach-1-met-20200731220037938.htm
"Đà Nẵng dừng các hoạt động tập trung đông người, không thiết yếu từ 13h trưa nay 26-7",/da-nang-dung-cac-hoat-dong-tap-trung-dong-nguoi-khong-thiet-yeu-tu-13h-trua-nay-26-7-20200726100519258.htm
Thủ tướng chỉ thị dừng nhập khẩu động vật hoang dã,/thu-tuong-chi-thi-dung-nhap-khau-dong-vat-hoang-da-20200723192002393.htm
Công nhận TP Long Xuyên trở thành đô thị loại I,/cong-nhan-tp-long-xuyen-tro-thanh-do-thi-loai-i-20200723124200295.htm
"30 doanh nghiệp Nhật được Chính phủ hỗ trợ giảm phụ thuộc Trung Quốc, một nửa hoạt động ở VN",/30-doanh-nghiep-nhat-duoc-chinh-phu-ho-tro-giam-phu-thuoc-trung-quoc-mot-nua-hoat-dong-o-vn-20200721085022088.htm
"Giáo viên tại các trường tư thục, trường nghề được hỗ trợ gói 62.000 tỉ",/giao-vien-tai-cac-truong-tu-thuc-truong-nghe-duoc-ho-tro-goi-62-000-ti-20200716095728668.htm
Các nước hồi hộp chờ số phận VCK U19 châu Á 2020,/cac-nuoc-hoi-hop-cho-so-phan-vck-u19-chau-a-2020-20200716101158713.htm
'Người sắt' có thể vắng mặt tại SEA Games 31,/nguoi-sat-co-the-vang-mat-tai-sea-games-31-20200711091705745.htm
Một quý đón 18 đoàn thanh tra: Đường cao tốc cho doanh nghiệp bị kẹt xe?,/mot-quy-don-18-doan-thanh-tra-duong-cao-toc-cho-doanh-nghiep-bi-ket-xe-2020070851615835.htm
Ông Pompeo: Mỹ sẽ giới hạn thị thực một số quan chức Trung Quốc,/ong-pompeo-my-se-gioi-han-thi-thuc-mot-so-quan-chuc-trung-quoc-20200708072618682.htm
Bác sĩ Fauci: Mỹ có thể ghi nhận 100.000 ca COVID-19 mỗi ngày,/bac-si-fauci-my-co-the-ghi-nhan-100000-ca-covid-19-moi-ngay-20200701071524195.htm
Phó thủ tướng Phạm Bình Minh chỉ đạo gỡ vướng giải ngân ODA của TP.HCM,/pho-thu-tuong-pham-binh-minh-chi-dao-go-vuong-giai-ngan-oda-cua-tp-hcm-20200629140509509.htm
Phó thủ tướng Phạm Bình Minh thị sát tuyến metro Bến Thành - Suối Tiên,/pho-thu-tuong-pham-binh-minh-thi-sat-tuyen-metro-so-ben-thanh-suoi-tien-20200629101033931.htm
Chính thức giảm một nửa lệ phí trước bạ ôtô từ hôm nay 28-6,/chinh-thuc-giam-mot-nua-le-phi-truoc-ba-oto-tu-hom-nay-28-6-20200628134505472.htm
"Mỹ gửi nhầm 1,4 tỉ USD tiền hỗ trợ COVID-19 cho 1 triệu người chết",/my-gui-nham-1-4-ti-usd-tien-ho-tro-covid-19-cho-1-trieu-nguoi-chet-20200626091820258.htm
"Thủ tướng chỉ đạo giải quyết các kiến nghị, tháo gỡ khó khăn cho Đà Nẵng",/thu-tuong-chi-dao-giai-quyet-cac-kien-nghi-thao-go-kho-khan-cho-da-nang-20200626094300742.htm
"Kinh tế đêm, động lực mới cho ngành du lịch",/kinh-te-dem-dong-luc-moi-cho-nganh-du-lich-20200626074234321.htm
Mỹ sẽ hỗ trợ tài chính cho các công ty viễn thông dùng công nghệ 5G từ đối thủ của Huawei,/my-se-ho-tro-tai-chinh-cho-cac-cong-ty-vien-thong-dung-cong-nghe-5g-tu-doi-thu-cua-huawei-20200624071544072.htm
Du khách Việt Nam vào Singapore có thể tự cách ly ở nhà,/du-khach-viet-nam-vao-singapore-co-the-tu-cach-ly-o-nha-20200616154350038.htm
Ấn Độ dùng 500 toa tàu làm bệnh viện dã chiến cho bệnh nhân COVID-19,/an-do-dung-500-toa-tau-lam-benh-vien-da-chien-cho-benh-nhan-covid-19-20200614195926337.htm
Giả danh chủ tịch tỉnh yêu cầu chủ tịch huyện chuyển tiền 'làm quà' cho khách,/gia-danh-chu-tich-tinh-yeu-cau-chu-tich-huyen-chuyen-tien-lam-qua-cho-khach-20200614143401933.htm
Thủ tướng quy định khu vực cấm bay và hạn chế tàu bay không người lái,/thu-tuong-quy-dinh-khu-vuc-cam-bay-va-han-che-tau-bay-khong-nguoi-lai-20200612223808843.htm
Việt Nam chia sẻ với Mỹ về những thiệt hại do biểu tình bạo lực,/viet-nam-chia-se-voi-my-ve-nhung-thiet-hai-do-bieu-tinh-bao-luc-20200611152714111.htm
Quốc hội đồng ý cho ông Vương Đình Huệ thôi chức phó thủ tướng,/quoc-hoi-dong-y-cho-ong-vuong-dinh-hue-thoi-chuc-vu-pho-thu-tuong-20200611092254946.htm
Đức xác nhận Mỹ đã thông báo kế hoạch rút bớt quân đồn trú,/duc-xac-nhan-my-da-thong-bao-ke-hoach-rut-bot-quan-don-tru-20200610224355326.htm
"Có người nhiễm virus corona, Hà Lan sẽ tiêu diệt toàn bộ chồn tại các trang trại",/co-nguoi-nhiem-virus-corona-ha-lan-se-tieu-diet-toan-bo-chon-tai-cac-trang-trai-2020060409335325.htm
Người nước ngoài đến Phú Quốc được miễn thị thực 30 ngày,/nguoi-nuoc-ngoai-den-phu-quoc-duoc-mien-thi-thuc-30-ngay-20200602095351313.htm
Trường hợp nào được xác định đang đóng bảo hiểm thất nghiệp?,/truong-hop-nao-duoc-xac-dinh-dang-dong-bao-hiem-that-nghiep-20200601175816057.htm
"Tổng thầu muốn giải ngân 50 triệu USD, chưa rõ khi nào xong đường sắt Cát Linh - Hà Đông",/tong-thau-muon-giai-ngan-50-trieu-usd-chua-ro-khi-nao-xong-duong-sat-cat-linh-ha-dong-20200601171950186.htm
Thủ tướng yêu cầu TP.HCM bứt tốc để trở thành đô thị hiện đại,/thu-tuong-yeu-cau-tp-hcm-but-toc-de-tro-thanh-do-thi-hien-dai-20200529195915523.htm
Thủ tướng thúc giục việc xử lý nghiêm các hành vi xâm hại trẻ em,/thu-tuong-thuc-giuc-viec-xu-ly-nghiem-cac-hanh-vi-xam-hai-tre-em-20200526180851756.htm
Đề xuất giảm 30% thuế thu nhập cho hơn 700.000 doanh nghiệp,/de-xuat-giam-30-thue-thu-nhap-cho-hon-700-000-doanh-nghiep-20200525191737028.htm
"Hơn 8,2 triệu khách hàng miền Nam được giảm 3.580 tỉ đồng tiền điện",/hon-82-trieu-khach-hang-mien-nam-duoc-giam-3580-ti-dong-tien-dien-20200524190947133.htm
Hàng trăm ngàn tỉ đồng quỹ bảo hiểm xã hội được sử dụng thế nào?,/hang-tram-ngan-ti-dong-quy-bao-hiem-xa-hoi-duoc-su-dung-the-nao-20200523111715042.htm
"Đảo Phú Quốc bị 'băm nát': Xử lý cán bộ, khắc phục thế nào?",/dao-phu-quoc-bi-bam-nat-xu-ly-can-bo-khac-phuc-the-nao-20200523075230876.htm
Tăng cường bảo vệ lao động ở nước ngoài,/tang-cuong-bao-ve-lao-dong-o-nuoc-ngoai-20200522075854996.htm
"Ca nhiễm nước ngoài về còn nhiều, Việt Nam chưa công bố hết dịch COVID-19",/ca-nhiem-nuoc-ngoai-ve-con-nhieu-viet-nam-chua-cong-bo-het-dich-covid-19-20200521190829726.htm
Estonia thử nghiệm hộ chiếu miễn dịch số cho công sở,/estonia-thu-nghiem-ho-chieu-mien-dich-so-cho-cong-so-20200521101219561.htm
"Vay đúng mức, xài đúng nơi",/vay-dung-muc-xai-dung-noi-20200520231834488.htm
Chính phủ đề nghị Quốc hội điều chỉnh chỉ tiêu tăng trưởng GDP năm 2020,/chinh-phu-de-nghi-quoc-hoi-dieu-chinh-chi-tieu-tang-truong-gdp-nam-2020-20200520095317129.htm
Chuyển đổi 8 dự án đường cao tốc Bắc - Nam sang đầu tư công có lợi hơn,/chuyen-doi-8-du-an-duong-cao-toc-bac-nam-sang-dau-tu-cong-co-loi-hon-20200515191959728.htm
Đề xuất chi bổ sung hơn 11 tỉ đồng cho người bán vé số dạo tại TP.HCM,/de-xuat-chi-bo-sung-hon-11-ty-dong-cho-nguoi-ban-ve-so-dao-tai-tphcm-20200512183428735.htm
Chờ ngày khán giả đến sân xem V-League,/cho-ngay-khan-gia-den-san-xem-v-league-20200508100216593.htm
Gần 20.000 thanh thiếu niên không thi thực hành vẫn được cấp giấy phép lái xe,/gan-20000-thanh-thieu-nien-khong-thi-thuc-hanh-van-duoc-cap-giay-phep-lai-xe-20200507161535262.htm
TP.HCM đề xuất thực hiện tuyến metro Bến Thành - Tân Kiên,/tp-hcm-de-xuat-thuc-hien-tuyen-metro-ben-thanh-tan-kien-20200506121922342.htm
Lào Cai muốn giảm đầu tư sân bay Sa Pa từ 7.110 tỉ còn 4.200 tỉ,/lao-cai-muon-giam-dau-tu-san-bay-sa-pa-tu-7-110-ti-con-4-200-ti-20200505220618447.htm
"Từ 1-5: Được nộp tiền bảo lãnh xe vi phạm giao thông, không được hành nghề massage ở nước ngoài",/tu-1-5-duoc-nop-tien-bao-lanh-xe-vi-pham-giao-thong-khong-duoc-hanh-nghe-massage-o-nuoc-ngoai-2020050211193926.htm
Nga lo kinh tế không chịu nổi vì dịch COVID-19,/nga-lo-kinh-te-khong-chiu-noi-vi-dich-covid-19-20200429085013709.htm
"Không được xây sân golf trên đất quốc phòng, an ninh",/khong-duoc-xay-san-golf-tren-dat-quoc-phong-an-ninh-20200427202250532.htm
Vì sao Bộ Y tế hạn chế doanh nghiệp xuất khẩu khẩu trang y tế?,/vi-sao-bo-y-te-han-che-doanh-nghiep-xuat-khau-khau-trang-y-te-20200423171353118.htm
"Bình Phước chi hơn 2,2 tỉ đồng hỗ trợ người bán vé số",/binh-phuoc-chi-hon-2-2-ti-dong-ho-tro-nguoi-ban-ve-so-20200422174226035.htm
"Giảm biên chế, tiết kiệm được 6.000 tỉ đồng",/giam-bien-che-tiet-kiem-duoc-6-000-ti-dong-20200422140334144.htm
Vợ Beckham bị chỉ trích vì nhân viên nhận 80% lương hỗ trợ của chính phủ,/vo-beckham-bi-chi-trich-vi-nhan-vien-nhan-80-luong-ho-tro-cua-chinh-phu-20200419234730265.htm
Bộ Tài chính vẫn giữ mức giảm trừ gia cảnh 11 triệu đồng: Đừng đẩy khó cho dân,/bo-tai-chinh-van-giu-muc-giam-tru-gia-canh-11-trieu-dong-dung-day-kho-cho-dan-202004190836329.htm
Vietnam Airlines đưa 50 công dân Ý về nước và 4 tấn thiết bị hỗ trợ chống dịch,/vietnam-airlines-dua-50-cong-dan-y-ve-nuoc-va-4-tan-thiet-bi-ho-tro-chong-dich-202004181010418.htm
"Đà Lạt cho mở lại khách sạn, hàng quán ăn uống",/da-lat-cho-mo-lai-khach-san-hang-quan-an-uong-20200417094134736.htm
Đề xuất đưa hướng dẫn viên du lịch tự do vào danh sách hỗ trợ từ gói 62.000 tỉ đồng,/de-xuat-dua-huong-dan-vien-du-lich-tu-do-vao-danh-sach-ho-tro-tu-goi-62-000-ti-20200415175612626.htm
"TP.HCM, Hà Nội và một số địa phương 'cách ly xã hội' đến 22-4",/tp-hcm-ha-noi-va-mot-so-dia-phuong-cach-ly-xa-hoi-den-22-4-20200415125714369.htm
Bí thư Hà Nội đề xuất cách ly xã hội đến 30-4,/bi-thu-ha-noi-de-xuat-cach-ly-xa-hoi-den-30-4-20200415105504488.htm
Dân số Nhật Bản giảm ở mức kỷ lục trong năm 2019,/dan-so-nhat-ban-giam-o-muc-ky-luc-trong-nam-2019-20200415101617743.htm
"Bệnh nhân người Anh ca nặng đã khỏi bệnh, ra viện trong đêm để về nước",/benh-nhan-nguoi-anh-ca-nang-da-khoi-benh-ra-vien-trong-dem-de-ve-nuoc-20200413225548219.htm
Ngày 15-4 sẽ quyết định cách ly xã hội tiếp hay không,/ngay-15-4-se-quyet-dinh-cach-ly-xa-hoi-tiep-hay-khong-20200413193019013.htm
Thủ tướng cho xuất khẩu gạo trở lại nhưng phải đảm bảo an ninh lương thực,/thu-tuong-cho-xuat-khau-gao-tro-lai-nhung-phai-dam-bao-an-ninh-luong-thuc-20200410214142064.htm
Yêu cầu Tổng công ty Đường sắt thu hồi hai lô đất vàng ở Hà Nội,/yeu-cau-tong-cong-ty-duong-sat-thu-hoi-hai-lo-dat-vang-o-ha-noi-20200409205829658.htm
"Chuyển 8 dự án đường cao tốc Bắc - Nam sang đầu tư công, khởi công trong tháng 8",/chuyen-8-du-an-duong-cao-toc-bac-nam-sang-dau-tu-cong-khoi-cong-trong-thang-8-20200408145919734.htm
Hội Nhà báo kiến nghị Chính phủ hỗ trợ báo chí vượt khó thời dịch COVID-19,/hoi-nha-bao-kien-nghi-chinh-phu-ho-tro-bao-chi-vuot-kho-thoi-dich-covid-19-20200407195728114.htm
"Chậm nhất ngày 10-4, TP.HCM trao tiền hỗ trợ tận tay người bán vé số",/cham-nhat-ngay-10-4-tphcm-trao-tien-ho-tro-tan-tay-nguoi-ban-ve-so-20200407103832092.htm
Du học sinh cảm thấy bị chính quyền Úc vô cảm bỏ rơi giữa dịch,/du-hoc-sinh-cam-thay-bi-chinh-quyen-uc-vo-cam-bo-roi-giua-dich-2020040614320072.htm
Bộ trưởng Mai Tiến Dũng: 'Ngăn sông cấm chợ' là sai chỉ đạo của Thủ tướng,/bo-truong-mai-tien-dung-ngan-song-cam-cho-la-sai-chi-dao-cua-thu-tuong-20200402204356934.htm
Mỹ đổi cách chống dịch COVID-19: đánh vào nỗi sợ hãi,/my-doi-cach-chong-dich-covid-19-danh-vao-noi-so-hai-20200402105030676.htm
"Hàng đầy ắp nhưng chợ, siêu thị vắng vẻ trong ngày đầu cách ly xã hội",/hang-day-ap-nhung-cho-sieu-thi-vang-ve-trong-ngay-dau-cach-ly-xa-hoi-20200401173307951.htm
"Đà Nẵng dừng nhận hồ sơ trực tiếp, chỉ xử lý qua mạng để chống dịch",/da-nang-dung-nhan-ho-so-truc-tiep-chi-xu-ly-qua-mang-de-chong-dich-20200331204300741.htm
Dịch COVID-19 tối 31-3: Indonesia tuyên bố tình trạng khẩn cấp quốc gia,/dich-covid-19-toi-31-3-indonesia-tuyen-bo-tinh-trang-khan-cap-quoc-gia-20200331184318001.htm
Chỉ cho phép xuất khẩu 400.000 tấn gạo trong tháng 4,/chi-cho-phep-xuat-khau-400-000-tan-gao-trong-thang-4-20200330091347238.htm
"Grab chi 70 tỉ đồng hỗ trợ tài xế, nhà hàng vượt qua dịch COVID-19",/grab-chi-70-ti-dong-ho-tro-tai-xe-nha-hang-vuot-qua-dich-covid-19-20200330112726069.htm
Anh biến sân bay Birmingham thành nhà xác tạm khổng lồ,/anh-bien-san-bay-birmingham-thanh-nha-xac-tam-khong-lo-2020032810481883.htm
Khách sạn Đà Nẵng dừng nhận khách từ ngày 28-3 đến 15-4,/khach-san-da-nang-dung-nhan-khach-tu-ngay-28-3-den-15-4-20200327180405428.htm
Vì sao Bộ Công thương đề xuất tạm dừng rồi lại cho xuất khẩu gạo trở lại?,/vi-sao-bo-cong-thuong-de-xuat-tam-dung-roi-lai-cho-xuat-khau-gao-tro-lai-20200325120939077.htm
"Trung Quốc dỡ phong tỏa Hồ Bắc, 50 triệu dân được tự do đi lại",/trung-quoc-do-phong-toa-ho-bac-50-trieu-dan-duoc-tu-do-di-lai-20200325093908674.htm
"Nam Phi thành tâm dịch châu Phi, tuyên bố tình trạng thảm họa quốc gia",/nam-phi-thanh-tam-dich-chau-phi-tuyen-bo-tinh-trang-tham-hoa-quoc-gia-2020032322191696.htm
"Ấn Độ ngưng tàu lửa ở Mumbai phòng COVID-19, ảnh hưởng 8 triệu người",/an-do-ngung-tau-lua-o-mumbai-phong-covid-19-anh-huong-8-trieu-nguoi-2020032310554651.htm
"Quốc hội yêu cầu tiếp tục đánh giá về 'cấm, không cấm' dịch vụ đòi nợ thuê",/quoc-hoi-yeu-cau-tiep-tuc-danh-gia-ve-cam-khong-cam-dich-vu-doi-no-thue-20200323095927809.htm
Xác định lộ trình phổ cập smartphone giá rẻ cho người dân,/xac-dinh-lo-trinh-pho-cap-smartphone-gia-re-cho-nguoi-dan-20200320174607613.htm
Tin tặc giả thông báo của Thủ tướng về COVID-19,/tin-tac-gia-thong-bao-cua-thu-tuong-ve-covid-19-20200319115718717.htm
Thủ tướng đồng ý xây cầu qua sông Lô nối Vĩnh Phúc - Phú Thọ,/thu-tuong-dong-y-xay-cau-qua-song-lo-noi-vinh-phuc-phu-tho-20200317234648476.htm
Nhật Bản: Số đơn đặt hàng chế tạo tăng trở lại,/nhat-ban-so-don-dat-hang-che-tao-tang-tro-lai-20200317141406011.htm
"Khách tới siêu thị, sân bay không mang khẩu trang, miễn phục vụ",/khach-toi-sieu-thi-san-bay-khong-mang-khau-trang-mien-phuc-vu-20200317080601622.htm
Phố Wall trải qua ngày giao dịch đen tối nhất trong 30 năm,/pho-wall-trai-qua-ngay-giao-dich-den-toi-nhat-trong-30-nam-20200317074924156.htm
Sức khỏe bệnh nhân COVID-19 thứ 52 ở Quảng Ninh tiến triển tích cực,/suc-khoe-benh-nhan-covid-19-thu-52-o-quang-ninh-tien-trien-tich-cuc-20200312162105824.htm
Ngày đầu áp dụng việc đeo khẩu trang nơi công cộng: Người đeo người không,/ngay-dau-ap-dung-viec-deo-khau-trang-noi-cong-cong-nguoi-deo-nguoi-khong-20200316112251783.htm
Cố vấn Anh: 60% dân số Anh mắc COVID-19 sẽ tạo 'miễn dịch cộng đồng',/co-van-anh-60-dan-so-anh-mac-covid-19-se-tao-mien-dich-cong-dong-20200313195626332.htm
"Thủ tướng ký điều chỉnh dự án cơ sở dữ liệu dân cư, giảm được gần 300 tỉ đồng",/thu-tuong-ky-dieu-chinh-du-an-co-so-du-lieu-dan-cu-giam-duoc-gan-300-ti-dong-20200313190353052.htm
Thống nhất chuyển sang đầu tư công 3 dự án đường cao tốc Bắc - Nam,/thong-nhat-chuyen-sang-dau-tu-cong-3-du-an-duong-cao-toc-bac-nam-2020031221333893.htm
Thủ tướng chỉ thị sẵn sàng phương án cách ly trên diện rộng để phòng COVID-19,/thu-tuong-chi-thi-san-sang-phuong-an-cach-ly-tren-dien-rong-de-phong-covid-19-20200311173519419.htm
TP.HCM được thí điểm cơ chế đặc thù rút ngắn thời gian bồi thường tái định cư,/tphcm-duoc-thi-diem-co-che-dac-thu-rut-ngan-thoi-gian-boi-thuong-tai-dinh-cu-20200310224056095.htm
Tiết kiệm 460 tỉ đồng mỗi năm nhờ điện tử hóa báo cáo Chính phủ,/tiet-kiem-460-ti-dong-moi-nam-nho-dien-tu-hoa-bao-cao-chinh-phu-20200310202341782.htm
"Ý mời bác sĩ nghỉ hưu, tuyển thêm 20.000 nhân viên y tế cùng chống COVID-19",/y-moi-bac-si-nghi-huu-tuyen-them-20-000-nhan-vien-y-te-cung-chong-covid-19-20200309122348103.htm
Bộ Giao thông Vận tải đề nghị cho Bamboo Airways mở rộng đội tàu bay,/bo-giao-thong-van-tai-de-nghi-cho-bamboo-airways-mo-rong-doi-tau-bay-20200303145104921.htm
Xe công nghệ chọn phương thức hoạt động mới,/xe-cong-nghe-chon-phuong-thuc-hoat-dong-moi-20200302223807318.htm
"Premier League có thể hoãn vì COVID-19, Liverpool nguy cơ mất chức vô địch",/premier-league-co-the-hoan-vi-covid-19-liverpool-nguy-co-mat-chuc-vo-dich-20200229062053354.htm
Campuchia kéo dài thời gian cho vé tham quan khu di sản Angkor,/campuchia-keo-dai-thoi-gian-cho-ve-tham-quan-khu-di-san-angkor-20200227104927223.htm
Iran bác tin 50 người chết vì COVID-19 ở thành phố Qom,/iran-bac-tin-50-nguoi-chet-vi-covid-19-o-thanh-pho-qom-20200224164604936.htm
Số ca nhiễm COVID-19 toàn cầu sẽ gấp 3 lần nếu tiêu chuẩn cao như Singapore?,/so-ca-nhiem-covid-19-toan-cau-se-gap-3-lan-neu-tieu-chuan-cao-nhu-singapore-2020021617482984.htm
Băng rôn chống virus corona 'khó đỡ' của người dân Trung Quốc,/bang-ron-chong-virus-corona-kho-do-cua-nguoi-dan-trung-quoc-2020032054333156.htm
Hà Nội sẽ giảm 5 đơn vị hành chính cấp xã,/ha-noi-se-giam-5-don-vi-hanh-chinh-cap-xa-20200210163900132.htm
Thủ tướng quyết định công bố dịch do virus corona tại Việt Nam,/thu-tuong-quyet-dinh-cong-bo-dich-do-virus-corona-tai-viet-nam-20200201161415067.htm
Khẳng định vai trò dẫn dắt trong chuyển đổi số của nền kinh tế,/khang-dinh-vai-tro-dan-dat-trong-chuyen-doi-so-cua-nen-kinh-te-20200123120759729.htm
Thành phố Pleiku trở thành đô thị loại I,/thanh-pho-pleiku-tro-thanh-do-thi-loai-i-20200122182039033.htm
Gần 80 tù nhân 'cực kỳ nguy hiểm' đào hầm vượt ngục,/gan-80-tu-nhan-cuc-ky-nguy-hiem-dao-ham-vuot-nguc-20200120100720596.htm
Chính phủ Venezuela sẽ áp dụng một số biện pháp mới nhằm tăng cường khả năng lưu hành của đồng tiền,/chinh-phu-venezuela-se-ap-dung-mot-so-bien-phap-moi-nham-tang-cuong-kha-nang-luu-hanh-cua-dong-tien-20200116145237881.htm
Xe vi phạm nên giữ biển số hay giữ xe?,/xe-vi-pham-nen-giu-bien-so-hay-giu-xe-20200111214931509.htm
Ấn Độ: cứ 15 phút có một phụ nữ bị cưỡng hiếp,/an-do-cu-15-phut-co-mot-phu-nu-bi-cuong-hiep-2020011010165965.htm
Nhật viện trợ ODA không hoàn lại giúp xây dựng hệ thống thông tin Chính phủ,/nhat-vien-tro-oda-khong-hoan-lai-giup-xay-dung-he-thong-thong-tin-chinh-phu-20200109205049642.htm
"Bộ trưởng Mai Tiến Dũng: ‘Vẽ quá nhiều, doanh nghiệp kêu là phải xem lại'",/bo-truong-mai-tien-dung-ve-qua-nhieu-doanh-nghiep-keu-la-phai-xem-lai-20200106122349922.htm
"Uống rượu bia vẫn chạy xe, 615 người bị phạt 816.800.000 đồng",/uong-ruou-bia-van-chay-xe-615-nguoi-bi-phat-816-800-000-dong-20200104172235664.htm
Có nên 'giam' xe vi phạm quá lâu?,/co-nen-giam-xe-vi-pham-qua-lau-20200103232147968.htm
"Ôtô đi vào làn thu phí tự động mà không nộp phí tự động, phạt đến 2 triệu đồng",/oto-di-vao-lan-thu-phi-tu-dong-ma-khong-nop-phi-tu-dong-phat-den-2-trieu-dong-201912311417009.htm
"Uống rượu, dù chạy xe đạp vẫn bị phạt đến 600.000 đồng",/uong-ruou-du-chay-xe-dap-van-bi-phat-den-600-000-dong-20191231114337772.htm
Đà Nẵng được quyền điều tiết hồ chứa ở Quảng Nam khi thiếu nước,/da-nang-duoc-quyen-dieu-tiet-ho-chua-o-quang-nam-khi-thieu-nuoc-20191230094134964.htm
Chính phủ thúc làm nhanh đề án đấu giá biển số xe,/chinh-phu-thuc-lam-nhanh-de-an-dau-gia-bien-so-xe-2019121314332734.htm
"Sau 4 lần chỉ đạo Hà Nội vẫn chậm trễ, Thủ tướng yêu cầu dứt điểm vụ 8B Lê Trực",/sau-4-lan-chi-dao-ha-noi-van-cham-tre-thu-tuong-yeu-cau-dut-diem-vu-8b-le-truc-20191206165804492.htm
"Dự án giao thông trọng điểm chậm tiến độ, Thủ tướng chỉ đạo gỡ mặt bằng",/du-an-giao-thong-trong-diem-cham-tien-do-thu-tuong-chi-dao-go-mat-bang-20191204204851958.htm
"Mỹ doạ áp thuế đến 100% đối với 2,4 tỉ USD hàng nhập khẩu từ Pháp",/my-doa-ap-thue-den-100-doi-voi-24-ti-usd-hang-nhap-khau-tu-phap-20191203100531581.htm
"2030 dân số Việt Nam đạt 104 triệu người, phát huy lợi thế dân số vàng",/2030-dan-so-viet-nam-dat-104-trieu-nguoi-phat-huy-loi-the-dan-so-vang-2019112707342811.htm
Luật mở đường cho cải cách chính quyền đô thị,/luat-mo-duong-cho-cai-cach-chinh-quyen-do-thi-20191123082144503.htm
"Dân TP.HCM được cấp đổi bằng lái xe qua mạng 'mọi lúc, mọi nơi' từ đầu tháng tới",/dan-tp-hcm-duoc-cap-doi-bang-lai-xe-qua-mang-moi-luc-moi-noi-tu-dau-thang-toi-20191122190951586.htm
"Được tự nguyện từ chức, cấp quận không cần có HĐND phường",/duoc-tu-nguyen-tu-chuc-cap-quan-khong-can-co-hdnd-phuong-2019112215372407.htm
