Title,URL
Viettel Money phiên bản 6.8 nâng tầm trải nghiệm số,/viettel-money-phien-ban-6-8-nang-tam-trai-nghiem-so-20230808110928711.htm
Xu hướng trải nghiệm ứng dụng ngân hàng của người dùng,/xu-huong-trai-nghiem-ung-dung-ngan-hang-cua-nguoi-dung-20221101171725212.htm
"MSB ‘trình làng’ thẻ mDigi, mang đậm phong cách thế hệ số",/msb-trinh-lang-the-mdigi-mang-dam-phong-cach-the-he-so-20220912145818284.htm
Trải nghiệm số dành cho doanh nghiệp xuất nhập khẩu trên BIZ MBBANK: không chỉ tiện mà còn nhanh,/trai-nghiem-so-danh-cho-doanh-nghiep-xuat-nhap-khau-tren-biz-mbbank-khong-chi-tien-ma-con-nhanh-20220824210707587.htm
"Techcombank: Tối ưu trải nghiệm số hóa, vượt trội lợi ích cho khách hàng",/techcombank-toi-uu-trai-nghiem-so-hoa-vuot-troi-loi-ich-cho-khach-hang-20210910123152233.htm
MB – FTU Digital Hub góp phần mở ra trải nghiệm số cho sinh viên Ngoại thương,/mb-ftu-digital-hub-gop-phan-mo-ra-trai-nghiem-so-cho-sinh-vien-ngoai-thuong-20210310155924099.htm
Hanwha Life Việt Nam: trải nghiệm số và giải pháp cuộc sống tốt đẹp hơn,/hanwha-life-viet-nam-trai-nghiem-so-va-giai-phap-cuoc-song-tot-dep-hon-20201129110921458.htm
Nỗ lực số hóa của VPBank,/no-luc-so-hoa-cua-vpbank-20190507172730284.htm
