Title,URL
Đà Nẵng lần thứ 3 liên tiếp được vinh danh 'thành phố thông minh',/da-nang-lan-thu-3-lien-tiep-duoc-vinh-danh-thanh-pho-thong-minh-2022120209211414.htm
Mỹ phê duyệt SpaceX triển khai lên đến 7.500 vệ tinh,/my-phe-duyet-spacex-trien-khai-len-den-7500-ve-tinh-20221202070945068.htm
"Những ""vị thần"" được sùng bái ở Thung lũng Silicon",/nhung-vi-than-duoc-sung-bai-o-thung-lung-silicon-20221116090000954.htm
Tây Ninh thúc đẩy chuyển đổi số trong lĩnh vực nông nghiệp,/tay-ninh-thuc-day-chuyen-doi-so-trong-linh-vuc-nong-nghiep-20221123174837759.htm
Khô mắt - chứng bệnh ai cũng có nguy cơ mắc phải,/kho-mat-chung-benh-ai-cung-co-nguy-co-mac-phai-20221122164340493.htm
Công nghệ bắt việt vị bán tự động hoạt động như thế nào?,/cong-nghe-bat-viet-vi-ban-tu-dong-hoat-dong-nhu-the-nao-20221122084544961.htm
7 tính năng cực xịn nên xuất hiện trên mọi ô tô trong tương lai,/7-tinh-nang-cuc-xin-nen-xuat-hien-tren-moi-o-to-trong-tuong-lai-20221121130403719.htm
Cận cảnh nhà ga Khu công nghệ cao của tuyến metro số 1 sắp hoàn thành,/can-canh-nha-ga-khu-cong-nghe-cao-cua-tuyen-metro-so-1-sap-hoan-thanh-20221116231305051.htm
Đà Nẵng: Chuyển đổi số giúp cuộc sống dân thuận tiện hơn,/da-nang-chuyen-doi-so-giup-cuoc-song-dan-thuan-tien-hon-20221116144652767.htm
Trường đại học số khai giảng khóa đầu tiên,/truong-dai-hoc-so-khai-giang-khoa-dau-tien-20221117112249219.htm
EVNHANOI ứng dụng công nghệ và chuyển đổi số để nâng cao chất lượng phục vụ,/evnhanoi-ung-dung-cong-nghe-va-chuyen-doi-so-de-nang-cao-chat-luong-phuc-vu-20221117095906578.htm
"Tuổi Trẻ Cuối Tuần số 45-2022: ""Kỳ World Cup của công nghệ""",/tuoi-tre-cuoi-tuan-so-45-2022-ky-world-cup-cua-cong-nghe-20221116210654501.htm
Khan hiếm nhân sự công nghệ thông tin thực hiện đề án y tế thông minh,/khan-hiem-nhan-su-cong-nghe-thong-tin-thuc-hien-de-an-y-te-thong-minh-2022111515494578.htm
"Agribank chung tay thúc đẩy tín dụng xanh, ngân hàng xanh",/agribank-chung-tay-thuc-day-tin-dung-xanh-ngan-hang-xanh-20221114165046247.htm
Sunshine Group chính thức đồng hành cùng VCCI hỗ trợ chuyển đổi số cho doanh nghiệp vừa và nhỏ,/sunshine-group-chinh-thuc-dong-hanh-cung-vcci-ho-tro-chuyen-doi-so-cho-doanh-nghiep-vua-va-nho-20221111161345812.htm
Lao động trình độ cao đi làm shipper có đáng lo ngại?,/lao-dong-trinh-do-cao-di-lam-shipper-co-dang-lo-ngai-20221110182002878.htm
Thế hệ sinh viên Gen Z tiêu dùng thông minh,/the-he-sinh-vien-gen-z-tieu-dung-thong-minh-20221110154819351.htm
Thủ tướng nêu sáng kiến 'phục hồi toàn diện' cho các doanh nghiệp ASEAN,/thu-tuong-neu-sang-kien-phuc-hoi-toan-dien-cho-cac-doanh-nghiep-asean-20221110151233143.htm
"Chuyện ""táo"" và ""hoa""",/chuyen-tao-va-hoa-20221104105616944.htm
The Verge: Số người dùng Twitter cao kỷ lục sau khi ông Musk tiếp quản,/the-verge-so-nguoi-dung-twitter-cao-ky-luc-sau-khi-ong-musk-tiep-quan-20221108115324065.htm
"Quản lý tài xế công nghệ, youtuber được không?",/quan-ly-tai-xe-cong-nghe-youtuber-duoc-khong-20221125120640337.htm
"'Đô' lên, giá iPhone lên theo khá mạnh",/do-len-gia-iphone-len-theo-kha-manh-20221105081127718.htm
Tin sáng 4-11: Chuẩn bị thông xe hầm chui trước bến xe Miền Đông mới; đầu tư cao tốc Tân Phú-Bảo Lộc,/tin-sang-4-11-chuan-bi-thong-xe-ham-chui-truoc-ben-xe-mien-dong-moi-dau-tu-cao-toc-tan-phu-bao-loc-20221103192728505.htm
Giao Hàng Tiết Kiệm tự chủ công nghệ để số hóa mọi hoạt động,/giao-hang-tiet-kiem-tu-chu-cong-nghe-de-so-hoa-moi-hoat-dong-20221102214844291.htm
"92% doanh nghiệp có nhu cầu chuyển đổi số, nhưng không biết bắt đầu từ đâu",/92-doanh-nghiep-co-nhu-cau-chuyen-doi-so-nhung-khong-biet-bat-dau-tu-dau-20221102164618692.htm
Công nghệ mang đến nhiều tiện lợi cho cuộc sống như thế nào?,/cong-nghe-mang-den-nhieu-tien-loi-cho-cuoc-song-nhu-the-nao-20221101084245746.htm
"Thêm 10 trường đại học, vì sao chất lượng nguồn nhân lực ĐBSCL vẫn thấp?",/them-10-truong-dai-hoc-vi-sao-chat-luong-nguon-nhan-luc-dbscl-van-thap-20221030173526508.htm
Cuộc thi ‘Lan tỏa năng lượng tích cực 2022’: Nông trại 4.0 và mong ước giúp bà con cùng làm giàu,/cuoc-thi-lan-toa-nang-luong-tich-cuc-2022-nong-trai-40-va-mong-uoc-giup-ba-con-cung-lam-giau-20221026132356875.htm
"Subaru Forester 2023 giá từ 969 triệu đồng tại Việt Nam: Thiết kế mới, thêm công nghệ an toàn",/subaru-forester-2023-gia-tu-969-trieu-dong-tai-viet-nam-thiet-ke-moi-them-cong-nghe-an-toan-20221025224020297.htm
Facebook cam kết hỗ trợ Việt Nam phát triển kinh tế số,/facebook-cam-ket-ho-tro-viet-nam-phat-trien-kinh-te-so-20221025152409576.htm
VieON - 'Động cơ' công nghệ của hệ sinh thái DatVietVAC,/vieon-dong-co-cong-nghe-cua-he-sinh-thai-datvietvac-20221023165559965.htm
"Logistics Việt gia tăng sức cạnh tranh, kéo giảm chi phí",/logistics-viet-gia-tang-suc-canh-tranh-keo-giam-chi-phi-20221019132757579.htm
Hàn Quốc thúc đẩy ứng dụng căn cước điện tử,/han-quoc-thuc-day-ung-dung-can-cuoc-dien-tu-20221018163412583.htm
Nâng tầm dịch vụ ngân hàng số,/nang-tam-dich-vu-ngan-hang-so-20221016084309774.htm
ACB ra mắt trợ lý ảo thông minh - AI BOT thế hệ mới,/acb-ra-mat-tro-ly-ao-thong-minh-ai-bot-the-he-moi-20221014195904824.htm
Tuần lễ đổi mới sáng tạo và chuyển đổi số TP.HCM: Trải nghiệm công nghệ thanh toán của Sacombank,/tuan-le-doi-moi-sang-tao-va-chuyen-doi-so-tphcm-trai-nghiem-cong-nghe-thanh-toan-cua-sacombank-20221015084519836.htm
Cam kết cung cấp dịch vụ điện toán đám mây cho mỗi người dân,/cam-ket-cung-cap-dich-vu-dien-toan-dam-may-cho-moi-nguoi-dan-20221014172651292.htm
‘Chuyển đổi số mà không có dữ liệu như xe không có xăng’,/chuyen-doi-so-ma-khong-co-du-lieu-nhu-xe-khong-co-xang-20221014120309677.htm
Khơi thông nguồn dữ liệu phát triển công nghệ,/khoi-thong-nguon-du-lieu-phat-trien-cong-nghe-20221014084339775.htm
Các tập đoàn công nghệ Trung Quốc đầu tư lớn vào ngành công nghiệp thần tượng ảo,/cac-tap-doan-cong-nghe-trung-quoc-dau-tu-lon-vao-nganh-cong-nghiep-than-tuong-ao-20221012170704758.htm
"90% giao dịch ngân hàng thực hiện qua kênh số, làm sao để an toàn?",/90-giao-dich-ngan-hang-thuc-hien-qua-kenh-so-lam-sao-de-an-toan-2022101116504604.htm
Giải thưởng Chuyển đổi số Việt Nam 2022 vinh danh TNG Holdings Vietnam,/giai-thuong-chuyen-doi-so-viet-nam-2022-vinh-danh-tng-holdings-vietnam-2022101011253527.htm
Việt Nam đăng cai Tuần lễ số quốc tế 2022,/viet-nam-dang-cai-tuan-le-so-quoc-te-2022-20221010105112941.htm
Meey Land và giải pháp tối ưu chuyển đổi số cho doanh nghiệp bất động sản,/meey-land-va-giai-phap-toi-uu-chuyen-doi-so-cho-doanh-nghiep-bat-dong-san-20221008180608449.htm
Có sẵn tiền trong túi nhưng vẫn ít nhà sản xuất gỗ Việt 'dám' đầu tư công nghệ,/co-san-tien-trong-tui-nhung-van-it-nha-san-xuat-go-viet-dam-dau-tu-cong-nghe-20221005144432765.htm
Có thể dự báo chính xác 75% về vùng mưa tại TP.HCM,/ung-dung-ai-du-bao-ngap-som-cho-tphcm-20221005065805066.htm
"Trung Quốc còn đóng cửa, Ấn Độ tung tiền kéo nhà máy về mình",/trung-quoc-con-dong-cua-an-do-tung-tien-keo-nha-may-ve-minh-20221003110843305.htm
Google Dịch chính thức rút lui khỏi thị trường Trung Quốc,/google-dich-chinh-thuc-rut-lui-khoi-thi-truong-trung-quoc-20221003095404892.htm
Công nghệ số cho dịch vụ ngành điện Hà Nội thuận tiện hơn,/cong-nghe-so-cho-dich-vu-nganh-dien-ha-noi-thuan-tien-hon-20220929224024004.htm
Bộ Thông tin và Truyền thông: Tháng 10 là 'tháng tiêu dùng số',/bo-thong-tin-va-truyen-thong-thang-10-la-thang-tieu-dung-so-20220929182139527.htm
AI - giúp việc hiệu quả của ngành y tế,/ai-giup-viec-hieu-qua-cua-nganh-y-te-20220929083639895.htm
"Công nghệ số, stress, lười vận động làm gia tăng người trẻ bị suy giảm nhận thức",/cong-nghe-so-stress-luoi-van-dong-lam-gia-tang-nguoi-tre-bi-suy-giam-nhan-thuc-20220928092454503.htm
Bingo18 - xổ số thời 4.0 của Vietlott,/bingo18-xo-so-thoi-40-cua-vietlott-20220927082411478.htm
Ba Huân bắt tay FPT chuyển đổi số,/ba-huan-bat-tay-fpt-chuyen-doi-so-20220924104909464.htm
Doanh nghiệp biết chuyển đổi số là cần nhưng vẫn thấy khó,/doanh-nghiep-biet-chuyen-doi-so-la-can-nhung-van-thay-kho-20220920162932935.htm
Giao thông Tân Sơn Nhất vẫn rối,/giao-thong-tan-son-nhat-van-roi-20220916080939549.htm
Không xét thi đua cán bộ có điểm thi đánh giá năng lực ứng dụng công nghệ thông tin dưới trung bình,/khong-xet-thi-dua-can-bo-co-diem-thi-danh-gia-nang-luc-ung-dung-cong-nghe-thong-tin-duoi-trung-binh-20220915100052485.htm
Infographic hướng dẫn xử lý khi bị nhắn tin gọi điện 'khủng bố' đòi nợ dù không vay tiền,/infographic-huong-dan-xu-ly-khi-bi-nhan-tin-goi-dien-khung-bo-doi-no-du-khong-vay-tien-20220909121504012.htm
Những công nghệ nổi bật của Ngân hàng số MyVIB 2.0,/nhung-cong-nghe-noi-bat-cua-ngan-hang-so-myvib-20-2022090516334062.htm
Khó tin: Chính quyền Nhật còn xài đĩa mềm lưu trữ,/kho-tin-chinh-quyen-nhat-con-xai-dia-mem-luu-tru-20220905140535811.htm
Thâm Quyến gia hạn biện pháp chống dịch COVID-19 đến cuối tuần,/tham-quyen-gia-han-bien-phap-chong-dich-covid-19-den-cuoi-tuan-20220902152706169.htm
Chiêm ngưỡng hai ứng dụng trong xây dựng vừa được vinh danh của Portcoast,/chiem-nguong-hai-ung-dung-trong-xay-dung-vua-duoc-vinh-danh-cua-portcoast-20220901174131112.htm
PC Quảng Nam đưa các dịch vụ điện đến với cộng đồng,/pc-quang-nam-dua-cac-dich-vu-dien-den-voi-cong-dong-20220825153042942.htm
‘Cận cảnh’ quầy giao dịch số phục vụ khách hàng của Điện lực miền Trung,/can-canh-quay-giao-dich-so-phuc-vu-khach-hang-cua-dien-luc-mien-trung-20220824110128627.htm
Bứt tốc chuyển đổi số với giải pháp quản lý và khai thác dữ liệu toàn diện,/but-toc-chuyen-doi-so-voi-giai-phap-quan-ly-va-khai-thac-du-lieu-toan-dien-20220823111426957.htm
"Chuyển đổi số: nghe nói rất nhiều, nhưng doanh nghiệp chưa biết bắt đầu từ đâu",/chuyen-doi-so-nghe-noi-rat-nhieu-nhung-doanh-nghiep-chua-biet-bat-dau-tu-dau-20220823123756791.htm
Dự án căn hộ tiên phong kết hợp bệnh viện chăm sóc sức khỏe cho người già,/du-an-can-ho-tien-phong-ket-hop-benh-vien-cham-soc-suc-khoe-cho-nguoi-gia-20220823073759357.htm
Chương trình đào tạo phù hợp xu thế chuyển đổi số ngành Tài chính - Kinh tế,/chuong-trinh-dao-tao-phu-hop-xu-the-chuyen-doi-so-nganh-tai-chinh-kinh-te-20220821231922254.htm
Thi tìm kiếm ý tưởng ứng dụng chuyển đổi số trong lĩnh vực giáo dục,/thi-tim-kiem-y-tuong-ung-dung-chuyen-doi-so-trong-linh-vuc-giao-duc-20220820152444886.htm
Ngân hàng chuyển đổi số bứt tốc cùng doanh nghiệp SMEs,/ngan-hang-chuyen-doi-so-but-toc-cung-doanh-nghiep-smes-20220819085321028.htm
"Sau 30 năm, Viettel đã trở thành tập đoàn kinh tế nhà nước hàng đầu Việt Nam",/sau-30-nam-viettel-da-tro-thanh-tap-doan-kinh-te-nha-nuoc-hang-dau-vn-20220817150930676.htm
Gần 2.000 bạn trẻ tìm hiểu về 'tổ công nghệ số cộng đồng',/gan-2-000-ban-tre-tim-hieu-ve-to-cong-nghe-so-cong-dong-20220812105207255.htm
"Chuyển đổi số, tăng sức cạnh tranh cho doanh nghiệp du lịch",/chuyen-doi-so-tang-suc-canh-tranh-cho-doanh-nghiep-du-lich-20220811122705128.htm
"Xăng đã giảm giá, giá cước vận tải vẫn cao là không sòng phẳng",/xang-da-giam-gia-gia-cuoc-van-tai-van-cao-la-khong-song-phang-20220810231147103.htm
Chùm ảnh thực tế đầu tiên của Toyota Vios đời mới: Nội thất đen bớt sang hơn bản quảng cáo,/chum-anh-thuc-te-dau-tien-cua-toyota-vios-doi-moi-noi-that-den-bot-sang-hon-ban-quang-c-20220810141234563.htm
Thanh niên không thể đứng ngoài quá trình chuyển đổi số,/thanh-nien-khong-the-dung-ngoai-qua-trinh-chuyen-doi-so-20220810124052251.htm
MB vào Top 4 ngân hàng thương mại uy tín Việt Nam 2022,/mb-vao-top-4-ngan-hang-thuong-mai-uy-tin-viet-nam-2022-20220804183955243.htm
Hấp dẫn triển lãm Blockchain Global Day 2022,/hap-dan-trien-lam-blockchain-global-day-2022-20220729163121102.htm
Sacombank tăng cường sức mạnh nội lực trong thời đại số,/sacombank-tang-cuong-suc-manh-noi-luc-trong-thoi-dai-so-20220728184051779.htm
Bộ Thông tin và truyền thông thành lập 3 đơn vị chuyên về chuyển đổi số,/bo-thong-tin-va-truyen-thong-thanh-lap-3-don-vi-chuyen-ve-chuyen-doi-so-20220727170013707.htm
Hệ thống bán lẻ đang thay đổi,/he-thong-ban-le-dang-thay-doi-20220726084831616.htm
"Malaysia thử nghiệm 5G, hỗ trợ cho người kinh doanh",/malaysia-thu-nghiem-5g-ho-tro-cho-nguoi-kinh-doanh-20220723211116114.htm
"7 bán tải bị đánh giá yếu/kém trong bài kiểm tra dây an toàn, có Ford Ranger",/7-ban-tai-bi-danh-gia-yeu-kem-trong-bai-kiem-tra-day-an-toan-co-ford-ranger-2022072210205299.htm
CyStack hợp tác VinCSS phát triển phần mềm quản lý mật khẩu,/cystack-hop-tac-vincss-phat-trien-phan-mem-quan-ly-mat-khau-20220721172546409.htm
"Giao dịch tiền mặt đã giảm mạnh, vì sao?",/giao-dich-tien-mat-da-giam-manh-vi-sao-20220720170653833.htm
"67.300 doanh nghiệp công nghệ số, doanh thu ngành thông tin truyền thông đạt hơn 1,8 triệu tỉ đồng",/67-300-doanh-nghiep-cong-nghe-so-doanh-thu-nganh-thong-tin-truyen-thong-dat-hon-1-8-trieu-ti-dong-20220719152850883.htm
SBT nhận giải thưởng Top Doanh nghiệp 4.0 Việt Nam 2022,/sbt-nhan-giai-thuong-top-doanh-nghiep-4-0-viet-nam-2022-20220719101233433.htm
Công an Phú Yên điều tra các gói thầu mua sắm liên quan đến Việt Á,/cong-an-phu-yen-dieu-tra-cac-goi-thau-mua-sam-lien-quan-den-viet-a-20220718133759642.htm
VitaDairy đạt giải thưởng Top Công nghiệp 4.0 Việt Nam,/vitadairy-dat-giai-thuong-top-cong-nghiep-40-viet-nam-202207181110518.htm
"Chuyển đổi số nhưng chương trình cứng nhắc, giáo viên sẽ mất khả năng sáng tạo",/chuyen-doi-so-nhung-chuong-trinh-cung-nhac-giao-vien-se-mat-kha-nang-sang-tao-2022071412422737.htm
Manulife Việt Nam ra mắt nền tảng học tập mới phục vụ 60.000 tư vấn viên tài chính,/manulife-viet-nam-ra-mat-nen-tang-hoc-tap-moi-phuc-vu-60000-tu-van-vien-tai-chinh-20220712074937878.htm
'Hồ sơ Uber' khổng lồ chấn động: Bí mật sau cuộc mở rộng của Uber trên toàn cầu,/ho-so-uber-khong-lo-chan-dong-bi-mat-sau-cuoc-mo-rong-cua-uber-tren-toan-cau-20220711071250833.htm
Ghế ngồi xịn nhất thế giới trên xe Bentley độc đáo như thế nào?,/ghe-ngoi-xin-nhat-the-gioi-tren-xe-bentley-doc-dao-nhu-the-nao-2022070714324047.htm
CEO SIHUB 'giải oan' tiếng xấu của blockchain,/ceo-sihub-giai-oan-tieng-xau-cua-blockchain-20220707150138145.htm
'Nhiệm vụ mới' mùa thi tốt nghiệp THPT 2022: Giữ đồ cho thí sinh,/nhiem-vu-moi-mua-thi-tot-nghiep-thpt-2022-giu-do-cho-thi-sinh-20220707085229481.htm
Chuyển đổi số của Việt Nam gặp trở ngại vì thủ tục hành chính không theo kịp,/chuyen-doi-so-cua-viet-nam-gap-tro-ngai-vi-thu-tuc-hanh-chinh-khong-theo-kip-20220706180604549.htm
Tài xế taxi công nghệ kiếm được nhiều tiền hơn khi chuyển sang dùng xe điện,/tai-xe-taxi-cong-nghe-kiem-duoc-nhieu-tien-hon-khi-chuyen-sang-dung-xe-dien-20220705154203479.htm
OneHub Saigon: Vườn ươm công nghệ của nền kinh tế mới,/onehub-saigon-vuon-uom-cong-nghe-cua-nen-kinh-te-moi-2022052214180987.htm
TopenLand hợp tác với các tập đoàn công nghệ hàng đầu,/topenland-hop-tac-voi-cac-tap-doan-cong-nghe-hang-dau-20220630113451764.htm
"Mỹ: Bùng nổ hẹn hò lãng mạn trên mạng rồi 'bùng', thiệt hại 770 triệu USD",/my-bung-no-hen-ho-lang-man-tren-mang-roi-bung-thiet-hai-770-trieu-usd-2022063011552262.htm
SUV bán tại Việt Nam Volkswagen Touareg sẽ thay đổi ra sao khi nâng cấp cuối năm nay?,/suv-ban-tai-viet-nam-volkswagen-touareg-se-thay-doi-ra-sao-khi-nang-cap-cuoi-nam-nay-20220628105221461.htm
Tuổi trẻ Hải Phòng ra quân 218 tổ 'công nghệ số cộng đồng' phục vụ người dân,/tuoi-tre-hai-phong-ra-quan-218-to-cong-nghe-so-cong-dong-phuc-vu-nguoi-dan-20220626155005755.htm
"Doanh nghiệp Việt - Úc tìm kiếm hợp tác năng lượng sạch, nông nghiệp công nghệ cao",/doanh-nghiep-viet-uc-tim-kiem-hop-tac-nang-luong-sach-nong-nghiep-cong-nghe-cao-20220616110626353.htm
Xăng tăng cao gây rối loạn trong dịch vụ xe công nghệ,/xang-tang-cao-gay-roi-loan-trong-dich-vu-xe-cong-nghe-2022061522505075.htm
"Phục vụ 10 triệu khách hàng, Sacombank tuyển dụng thêm nhân sự",/phuc-vu-10-trieu-khach-hang-sacombank-tuyen-dung-them-nhan-su-20220615080927297.htm
"Việt Nam - Lào tăng cường hợp tác về bưu chính, viễn thông, tần số vô tuyến điện",/viet-nam-lao-tang-cuong-hop-tac-ve-buu-chinh-vien-thong-tan-so-vo-tuyen-dien-2022061109151742.htm
Người dân tỉnh Long An có thể tìm việc trực tuyến qua ứng dụng Long An ID,/nguoi-dan-tinh-long-an-co-the-tim-viec-truc-tuyen-qua-ung-dung-long-an-id-20220608172352631.htm
'Gen Z' Viettel phát triển ứng dụng nhận biết cảm xúc của khách hàng qua giọng nói,/gen-z-viettel-phat-trien-ung-dung-nhan-biet-cam-xuc-cua-khach-hang-qua-giong-noi-20220607140134911.htm
Techcombank tiếp tục được vinh danh 8 giải thưởng về thanh toán thẻ,/techcombank-tiep-tuc-duoc-vinh-danh-8-giai-thuong-ve-thanh-toan-the-20220603062612315.htm
Chuẩn bị 400 nhân viên vận hành metro số 1 Bến Thành - Suối Tiên,/chuan-bi-400-nhan-vien-van-hanh-metro-1-ben-thanh-suoi-tien-20220531173236627.htm
"Cùng tham gia khởi tạo gương mặt số, xây dựng trang web cá nhân",/cung-tham-gia-khoi-tao-guong-mat-so-xay-dung-trang-web-ca-nhan-20220530173033821.htm
Giải bài toán bảo mật cho doanh nghiệp chuyển đổi số,/giai-bai-toan-bao-mat-cho-doanh-nghiep-chuyen-doi-so-202205301045233.htm
FPT trình diễn hệ sinh thái chuyển đổi số đột phá,/fpt-trinh-dien-he-sinh-thai-chuyen-doi-so-dot-pha-20220525173915065.htm
Chủ xe Honda Civic dùng xích trói bánh vào cửa xe đề phòng trộm cắp,/chu-xe-honda-civic-dung-xich-troi-banh-vao-cua-xe-de-phong-trom-cap-20220525102821436.htm
Đứt gãy công nghệ và sự phân hóa thị trường lao động,/dut-gay-cong-nghe-va-su-phan-hoa-thi-truong-lao-dong-1646989.htm
Ứng dụng công nghệ giúp khách hàng gần hơn với cấp nước,/ung-dung-cong-nghe-giup-khach-hang-gan-hon-voi-cap-nuoc-20220524112035914.htm
Cuộc đua cameraphone: Theo ‘chấm’ hay theo công nghệ mới?,/cuoc-dua-cameraphone-theo-cham-hay-theo-cong-nghe-moi-20220521084046602.htm
"Đến năm 2025, TP.HCM đầu tư cho khoa học công nghệ đạt trên 2% tổng chi ngân sách",/den-nam-2025-tp-hcm-dau-tu-cho-khoa-hoc-cong-nghe-dat-tren-2-tong-chi-ngan-sach-20220520162323602.htm
Be Group phối hợp ngân hàng số Cake hỗ trợ tài xế vay tiêu dùng,/be-group-phoi-hop-ngan-hang-so-cake-ho-tro-tai-xe-vay-tieu-dung-20220519174046498.htm
Lạc Dương quyết tâm thực hiện chuyển đổi số - xây dựng đô thị thông minh,/lac-duong-quyet-tam-thuc-hien-chuyen-doi-so-xay-dung-do-thi-thong-minh-20220519113239924.htm
Những tên tuổi nào sẽ có mặt tại Hội nghị thượng đỉnh Blockchain Việt Nam 2022?,/nhung-ten-tuoi-nao-se-co-mat-tai-hoi-nghi-thuong-dinh-blockchain-viet-nam-2022-20220518161304236.htm
Giám đốc Sở Khoa học - công nghệ TP.HCM: Chuyển đổi số trước hết phải từ tư duy,/giam-doc-so-khoa-hoc-cong-nghe-tp-hcm-chuyen-doi-so-truoc-het-phai-tu-tu-duy-20220518131037115.htm
Innity được trao chứng nhận về an toàn thương hiệu và chống gian lận quảng cáo,/innity-duoc-trao-chung-nhan-ve-an-toan-thuong-hieu-va-chong-gian-lan-quang-cao-20220517091357786.htm
"Xăng tăng mà cước chưa tăng, shipper chọn... tắt app",/xang-tang-ma-cuoc-chua-tang-shipper-chon-tat-app-20220513095205313.htm
VNPT hợp tác với công ty hàng đầu của Mỹ phát triển 5G,/vnpt-hop-tac-voi-cong-ty-hang-dau-cua-my-phat-trien-5g-20220512181127694.htm
Năm 2025 Đà Nẵng hướng tới 50% dân số mua sắm trực tuyến,/nam-2025-da-nang-huong-toi-50-dan-so-mua-sam-truc-tuyen-20220510142306557.htm
Big Tech mất hơn 1.000 tỉ USD trong 3 phiên giao dịch sau khi Mỹ tăng lãi suất,/big-tech-mat-hon-1-000-ti-usd-trong-3-phien-giao-dich-sau-khi-my-tang-lai-suat-20220510094433567.htm
Loạt ôtô an toàn nhất tại Mỹ: Nhiều mẫu bán chạy ở Việt Nam,/loat-oto-an-toan-nhat-tai-my-nhieu-mau-ban-chay-o-viet-nam-20220509160013994.htm
Thang máy KONE DX - nâng tầm trải nghiệm nhờ tích hợp công nghệ tân tiến,/thang-may-kone-dx-nang-tam-trai-nghiem-nho-tich-hop-cong-nghe-tan-tien-20220509110211773.htm
Ứng dụng công nghệ quản lý hút thuốc nơi công cộng,/ung-dung-cong-nghe-quan-ly-hut-thuoc-noi-cong-cong-20220506140204297.htm
Trung Quốc thử nghiệm vắc xin chống biến thể Omicron,/trung-quoc-thu-nghiem-vac-xin-chong-bien-the-omicron-20220501192737674.htm
"Google sẽ xóa các kết quả tìm kiếm có địa chỉ nhà, số điện thoại, email",/google-se-xoa-cac-ket-qua-tim-kiem-co-dia-chi-nha-so-dien-thoai-email-2022042812383879.htm
"Đề nghị tổ chức lại Tổng cục Dân số, sáp nhập nhiều vụ, cục thuộc Bộ Y tế",/de-nghi-to-chuc-lai-tong-cuc-dan-so-sap-nhap-nhieu-vu-cuc-thuoc-bo-y-te-20220427082003372.htm
Học tài chính - ngân hàng: Thích ứng nhanh với kỷ nguyên ngân hàng số,/hoc-tai-chinh-ngan-hang-thich-ung-nhanh-voi-ky-nguyen-ngan-hang-so-20220425182401362.htm
"Với công nghệ di động, đến máy bơm nước cũng... thông minh",/voi-cong-nghe-di-dong-den-may-bom-nuoc-cung-thong-minh-20220423161849273.htm
Công nghệ số đã giúp khách hàng hoàn tất thủ tục vay mua ô tô trong... 5 phút,/cong-nghe-so-da-giup-khach-hang-hoan-tat-thu-tuc-vay-mua-o-to-trong-5-phut-20220421185857859.htm
Giải pháp lưu trữ tài liệu toàn diện được ALS và FSI ra mắt,/giai-phap-luu-tru-tai-lieu-toan-dien-duoc-als-va-fsi-ra-mat-20220421134341102.htm
Ngày hội sách và ngày hội văn hoá đọc lần 1 năm 2022,/ngay-hoi-sach-va-ngay-hoi-van-hoa-doc-lan-1-nam-2022-2022042111342189.htm
Doanh nghiệp sống sót tốt hơn nhờ chuyển đổi số,/doanh-nghiep-song-sot-tot-hon-nho-chuyen-doi-so-20220421155325174.htm
Đồng Tháp khai trương Trung tâm chuyển đổi số,/dong-thap-khai-truong-trung-tam-chuyen-doi-so-20220418120425697.htm
Chuyển đổi số sẽ ‘mở khóa’ tiềm năng kinh tế cho TP.HCM,/chuyen-doi-so-se-mo-khoa-tiem-nang-kinh-te-cho-tphcm-20220416165407492.htm
Doanh nghiệp Việt dẫn dắt chuyển đổi số quốc gia,/doanh-nghiep-viet-dan-dat-chuyen-doi-so-quoc-gia-20220415192053891.htm
Bí thư Nguyễn Văn Nên: 'Kiến tạo mô hình phát triển kinh tế TP.HCM lâu dài',/bi-thu-nguyen-van-nen-kien-tao-mo-hinh-phat-trien-kinh-te-tp-hcm-lau-dai-20220415084958256.htm
Tập đoàn Điện lực Việt Nam tổ chức Hội nghị Tự động hóa trong chuyển đổi số,/tap-doan-dien-luc-viet-nam-to-chuc-hoi-nghi-tu-dong-hoa-trong-chuyen-doi-so-20220412154745464.htm
HDBank đẩy mạnh công nghệ số và nông nghiệp công nghệ cao tại Tây Nam Bộ,/hdbank-day-manh-cong-nghe-so-va-nong-nghiep-cong-nghe-cao-tai-tay-nam-bo-20220407150421617.htm
Nhiều đổi mới trong tuyển sinh lớp 10 tại TP.HCM,/nhieu-doi-moi-trong-tuyen-sinh-lop-10-tai-tp-hcm-20220407110339938.htm
Tổng công ty Khánh Việt đạt giải thưởng TOP 100 Sao Vàng Đất Việt 2021,/tong-cong-ty-khanh-viet-dat-giai-thuong-top-100-sao-vang-dat-viet-2021-2022040408191221.htm
"Triệt xóa nhóm đăng tin sai sự thật trên mạng để lừa đảo, chiếm đoạt hơn 3 tỉ đồng",/triet-xoa-nhom-dang-tin-sai-su-that-tren-mang-de-lua-dao-chiem-doat-hon-3-ti-dong-2022033006124858.htm
"Giúp 'Gen Z' loại bỏ thông tin xấu, độc như thế nào trên không gian mạng?",/giup-gen-z-loai-bo-thong-tin-xau-doc-nhu-the-nao-tren-khong-gian-mang-20220329181324062.htm
Bảo hiểm Bảo Long - tăng tốc trong cuộc đua số hóa,/bao-hiem-bao-long-tang-toc-trong-cuoc-dua-so-hoa-20220329140522211.htm
Hỗ trợ 30.000 doanh nghiệp vừa và nhỏ chuyển đổi số,/ho-tro-30000-doanh-nghiep-vua-va-nho-chuyen-doi-so-2022032417154819.htm
Những xu hướng công nghệ tương lai 'chào đời' vào năm 2021,/nhung-xu-huong-cong-nghe-tuong-lai-chao-doi-vao-nam-2021-20220323013902488.htm
LG và những điểm nhấn công nghệ giúp định hình phong cách sống năm 2022,/lg-va-nhung-diem-nhan-cong-nghe-giup-dinh-hinh-phong-cach-song-nam-2022-20220322191505796.htm
Khi Trung Quốc phải 'bấm nút dừng',/khi-trung-quoc-phai-bam-nut-dung-20220316101733671.htm
