Title,URL
Tìm kiếm giải pháp Chuyển đổi số quốc gia với Viet Solutions 2021,/tim-kiem-giai-phap-chuyen-doi-so-quoc-gia-voi-viet-solutions-2021-20210610150847961.htm
Giải thưởng VinFuture thu hút nhiều nhà khoa học hàng đầu thế giới tham gia,/giai-thuong-vinfuture-thu-hut-nhieu-nha-khoa-hoc-hang-dau-the-gioi-tham-gia-20210610142514049.htm
Bước tiến chuyển đổi số của bảo hiểm phi nhân thọ Cathay Việt Nam,/buoc-tien-chuyen-doi-so-cua-bao-hiem-phi-nhan-tho-cathay-viet-nam-20210609175204261.htm
Các công ty công nghệ ở Trung Quốc chê nhân viên trên 35 tuổi là 'quá già',/cac-cong-ty-cong-nghe-o-trung-quoc-che-nhan-vien-tren-35-tuoi-la-qua-gia-20210606113647338.htm
COVID-19 khiến vốn đầu tư vào các startup Việt Nam giảm gần 48%,/covid-19-khien-von-dau-tu-vao-cac-startup-viet-nam-giam-gan-48-2021053100283176.htm
EVNGENCO 2 nghiên cứu triển khai số hóa 3D thiết bị nhà máy điện,/evngenco-2-nghien-cuu-trien-khai-so-hoa-3d-thiet-bi-nha-may-dien-20210528145438588.htm
Tận dụng công nghệ để chống dịch,/tan-dung-cong-nghe-de-chong-dich-20210526085235799.htm
Facebook đạt doanh thu cao hơn trong mùa dịch nhưng đóng thuế ít đi,/facebook-dat-doanh-thu-cao-hon-trong-mua-dich-nhung-dong-thue-it-di-20210523212514798.htm
"Elon Musk 'bẻ lái', Bitcoin ngã nhào",/elon-musk-be-lai-bitcoin-nga-nhao-20210515101343699.htm
Trường đại học Tài Chính Ngân Hàng Hà Nội tuyển sinh năm học 2021- 2022,/truong-dai-hoc-tai-chinh-ngan-hang-ha-noi-tuyen-sinh-nam-hoc-2021-2022-20210514185632811.htm
"Giả thầy cô lừa sinh viên nộp tiền học lại, thi lại",/gia-thay-co-lua-sinh-vien-nop-tien-hoc-lai-thi-lai-20210511152759307.htm
Công nghệ OCR và cách mạng số hóa trong ngành bảo hiểm,/cong-nghe-ocr-va-cach-mang-so-hoa-trong-nganh-bao-hiem-20210508141408554.htm
Các ông lớn công nghệ bị xem là mối đe dọa lớn nhất cho nền dân chủ,/cac-ong-lon-cong-nghe-bi-xem-la-moi-de-doa-lon-nhat-cho-nen-dan-chu-20210505200358087.htm
HDBank số hóa quy trình mở tài khoản tại quầy,/hdbank-so-hoa-quy-trinh-mo-tai-khoan-tai-quay-20210505185107625.htm
Ly kỳ giải cứu tàu ngầm dưới biển khơi - Kỳ 1: Buồng lặn cứu mạng 33 người,/ly-ky-giai-cuu-tau-ngam-duoi-bien-khoi-ky-1-buong-lan-cuu-mang-33-nguoi-20210503101335446.htm
TP Thủ Đức sẽ là nơi của những thử nghiệm mới,/tp-thu-duc-se-la-noi-cua-nhung-thu-nghiem-moi-20210427152635177.htm
Ngân hàng chi lớn cho cuộc đua trí tuệ nhân tạo,/ngan-hang-chi-lon-cho-cuoc-dua-tri-tue-nhan-tao-2021042910551564.htm
Đà Nẵng tiếp tục dẫn đầu bảng xếp hạng ứng dụng công nghệ thông tin 2020,/da-nang-tiep-tuc-dan-dau-bang-xep-hang-ung-dung-cong-nghe-thong-tin-2020-20210427131640131.htm
'Thừa Thiên Huế nên coi mình là một quốc gia thu nhỏ để thực hiện chuyển đổi số',/thua-thien-hue-nen-coi-minh-la-mot-quoc-gia-thu-nho-de-thuc-hien-chuyen-doi-so-2021042711412385.htm
Màn trình diễn mãn nhãn bằng công nghệ XR chuẩn quốc tế,/man-trinh-dien-man-nhan-bang-cong-nghe-xr-chuan-quoc-te-20210426182802698.htm
Long An và giấc mơ mang tầm quốc tế,/long-an-va-giac-mo-mang-tam-quoc-te-20210417230445437.htm
NovaGroup cùng Viettel hợp tác chiến lược trong chuyển đổi số,/novagroup-cung-viettel-hop-tac-chien-luoc-trong-chuyen-doi-so-2021041522022402.htm
Gắn chip,/gan-chip-20210410224024742.htm
Doanh nghiệp đầu tư lớn cho chuyển đổi số,/doanh-nghiep-dau-tu-lon-cho-chuyen-doi-so-20210410090039895.htm
Kỹ năng cho trẻ em trong thời đại số,/ky-nang-cho-tre-em-trong-thoi-dai-so-20210410090749535.htm
"Bắc Giang đẩy mạnh chuyển đổi số, xây dựng chính quyền điện tử",/bac-giang-day-manh-chuyen-doi-so-xay-dung-chinh-quyen-dien-tu-20210403132328546.htm
Thúc đẩy kinh tế số bằng nền tảng công nghệ Việt,/thuc-day-kinh-te-so-bang-nen-tang-cong-nghe-viet-20210327164701075.htm
'Đồ chơi' cờ bạc bịp có chứa chất phóng xạ vẫn tung hoành,/do-choi-co-bac-bip-co-chua-chat-phong-xa-van-tung-hoanh-20210327231057699.htm
Ảnh vệ tinh tiết lộ số lượng lớn tàu Trung Quốc ở Đá Ba Đầu không đánh bắt cá,/anh-ve-tinh-tiet-lo-so-luong-lon-tau-trung-quoc-o-da-ba-dau-khong-danh-bat-ca-20210326160458924.htm
"Làm chủ công nghệ lõi, thúc đẩy bảo hộ sáng chế nhằm nâng cao năng lực cạnh tranh",/lam-chu-cong-nghe-loi-thuc-day-bao-ho-sang-che-nham-nang-cao-nang-luc-canh-tranh-20210318235737621.htm
Chuyển đổi số: Hiểu sao cho đúng?,/chuyen-doi-so-hieu-sao-cho-dung-1577879.htm
Lãnh đạo TP.HCM thăm Công viên phần mềm Quang Trung,/lanh-dao-tp-hcm-tham-cong-vien-phan-mem-quang-trung-20210316172444125.htm
"Chủ tịch Quốc hội: 'Chúng tôi cũng đi trước về công nghệ số, chẳng kém bên Chính phủ'",/chu-tich-quoc-hoi-chung-toi-cung-di-truoc-ve-cong-nghe-so-chang-kem-ben-chinh-phu-20210316154607278.htm
Sân chơi học thuật của sinh viên Công nghệ thông tin trường Hutech,/san-choi-hoc-thuat-cua-sinh-vien-cong-nghe-thong-tin-truong-hutech-20210311161745798.htm
ĐH Kiến trúc Hà Nội giảm học phí cho thí sinh đăng ký vào một số ngành,/dh-kien-truc-ha-noi-giam-hoc-phi-cho-thi-sinh-dang-ky-vao-mot-so-nganh-20210311172522117.htm
HƯỚNG TỚI VIỆT NAM SỐ: Công nghệ tuyển sinh đầu cấp thời 4.0,/huong-toi-viet-nam-so-cong-nghe-tuyen-sinh-dau-cap-thoi-4-0-20210310080302696.htm
Giải pháp truyền thông trong thời đại kỷ nguyên số - Yếu tố sống còn của doanh nghiệp,/giai-phap-truyen-thong-trong-thoi-dai-ky-nguyen-so-yeu-to-song-con-cua-doanh-nghiep-20210308160455313.htm
Mỹ dùng công nghệ đấu với Trung Quốc,/my-dung-cong-nghe-dau-voi-trung-quoc-20210303073556435.htm
Lãnh đạo Dân chủ ở Thượng viện Mỹ quyết chống sự trỗi dậy của Trung Quốc,/lanh-dao-dan-chu-o-thuong-vien-my-quyet-chong-su-troi-day-cua-trung-quoc-20210224062954126.htm
"Doanh số điện thoại thông minh giảm, Huawei chuyển sang các trại nuôi heo",/doanh-so-ban-dien-thoai-thong-minh-giam-huawei-chuyen-sang-cac-trang-trai-nuoi-lon-20210219145942973.htm
OPPO góp 4 trong 5 smartphone bán chạy nhất tháng 1-2021,/oppo-gop-4-trong-5-smartphone-ban-chay-nhat-thang-1-2021-20210202114053598.htm
HƯỚNG TỚI VIỆT NAM SỐ: Tiên phong dẫn dắt chuyển đổi số quốc gia,/huong-toi-viet-nam-so-tien-phong-dan-dat-chuyen-doi-so-quoc-gia-20210126224206105.htm
Mục tiêu 1.000 người dân có 1 doanh nghiệp công nghệ số,/muc-tieu-1000-nguoi-dan-co-1-doanh-nghiep-cong-nghe-so-2021012814202467.htm
Thúc đẩy mạnh mẽ chuyển đổi số quốc gia,/thuc-day-manh-me-chuyen-doi-so-quoc-gia-20210126231116727.htm
18 sản phẩm vào chung khảo Nhân tài Đất Việt 'Sức mạnh chuyển đổi Số',/18-san-pham-vao-chung-khao-nhan-tai-dat-viet-suc-manh-chuyen-doi-so-20210126113107998.htm
Nga phản đối Mỹ ủng hộ biểu tình đòi thả chính trị gia đối lập Navalny,/nga-phan-doi-my-ung-ho-bieu-tinh-doi-tha-chinh-tri-gia-doi-lap-navalny-20210125185117377.htm
Công cuộc số hóa: Lời giải cho bài toán chi phí của doanh nghiệp Việt,/cong-cuoc-so-hoa-loi-giai-cho-bai-toan-chi-phi-cua-doanh-nghiep-viet-20210122161050877.htm
Việt Nam có chưa đến 1 bác sĩ và 2 y tá cho 1.000 người dân,/viet-nam-co-chua-den-1-bac-si-va-2-y-ta-cho-1-000-nguoi-dan-20210120123645118.htm
"Vì sao 1,2 tỉ người Trung Quốc chỉ dùng 100 họ?",/vi-sao-12-ti-nguoi-trung-quoc-chi-dung-100-ho-20210117220806991.htm
Midtjylland và bóng đá ở thì tương lai,/midtjylland-va-bong-da-o-thi-tuong-lai-1574897.htm
"Trúc Nhân gặp bác tài tên Văn Mai Hương, chuyện gì thế?",/truc-nhan-gap-bac-tai-ten-van-mai-huong-chuyen-gi-the-2021011637960157.htm
Công bố chương trình hỗ trợ chuyển đổi số cho doanh nghiệp vừa và nhỏ,/cong-bo-chuong-trinh-ho-tro-chuyen-doi-so-cho-doanh-nghiep-vua-va-nho-20210112131726495.htm
Trao giải nhì sản phẩm số tiềm năng 2020 cho ứng dụng 3D trong Y học của ĐH Duy Tân,/trao-giai-nhi-san-pham-so-tiem-nang-2020-cho-ung-dung-3d-trong-y-hoc-cua-dh-duy-tan-20210111122258685.htm
"Tận dụng lợi thế công nghệ, ba nhà mạng lớn mang tới cách mua vé số tự chọn theo kiểu mới",/tan-dung-loi-the-cong-nghe-ba-nha-mang-lon-mang-toi-cach-mua-ve-so-tu-chon-theo-kieu-moi-20210111114836169.htm
J&T Express 'bắt tay' Haravan tích hợp nhiều tiện ích cho người kinh doanh online,/jt-express-bat-tay-haravan-tich-hop-nhieu-tien-ich-cho-nguoi-kinh-doanh-online-20210108144231724.htm
Tiếp tục giải bí ẩn “vaccine thần tốc”,/tiep-tuc-giai-bi-an-vaccine-than-toc-1574414.htm
Ngân hàng thu hút nhân tài bằng công nghệ,/ngan-hang-thu-hut-nhan-tai-bang-cong-nghe-20210107180124568.htm
58 học viên lái tàu metro số 1 bị ngưng học vì chưa đóng phí đào tạo,/58-hoc-vien-lai-tau-metro-so-1-bi-ngung-hoc-vi-chua-dong-phi-dao-tao-20210107111709551.htm
"Công ty CP Lê Bảo Minh, 24 năm hoàn thành  cầu nối công nghệ thế giới và người tiêu dùng Việt",/cong-ty-cp-le-bao-minh-24-nam-hoan-thanh-cau-noi-cong-nghe-the-gioi-va-nguoi-tieu-dung-viet-20210106172612404.htm
"Mạng 5G, ứng dụng truy vết COVID-19... vào sự kiện ICT tiêu biểu năm 2020",/mang-5g-ung-dung-truy-vet-covid-19-vao-su-kien-ict-tieu-bieu-nam-2020-20201231122336289.htm
Để không còn chen lấn khám chữa bệnh,/de-khong-con-chen-lan-kham-chua-benh-20201229222040767.htm
Đề xuất UBND TP Thủ Đức có phòng khoa học - công nghệ,/de-xuat-ubnd-tp-thu-duc-co-phong-khoa-hoc-cong-nghe-20201224112608756.htm
"Hướng tới Việt Nam số: Không 'Make in Vietnam', không thể tự cường",/huong-toi-viet-nam-so-khong-make-in-vietnam-khong-the-tu-cuong-20201224094810751.htm
Ca mổ tách rời Trúc Nhi - Diệu Nhi vào top 10 sự kiện khoa học công nghệ,/ca-mo-tach-roi-truc-nhi-dieu-nhi-lot-top-10-su-kien-khoa-hoc-cong-nghe-20201223164924373.htm
"Một năm, 13.000 doanh nghiệp công nghệ số ra đời",/mot-nam-13000-doanh-nghiep-cong-nghe-so-ra-doi-20201223153026244.htm
Phó thủ tướng Vũ Đức Đam: 'Trao sứ mệnh tiên phong để phát triển cho công nghệ',/pho-thu-tuong-vu-duc-dam-trao-su-menh-tien-phong-de-phat-trien-cho-cong-nghe-20201223162405468.htm
50 sản phẩm nhận giải thưởng 'Sản phẩm công nghệ số Make in Viet Nam',/50-san-pham-nhan-giai-thuong-san-pham-cong-nghe-so-make-in-viet-nam-20201221160110167.htm
Shinhan Finance ra mắt iShinhan 3.0 ứng dụng các giải pháp công nghệ toàn diện,/shinhan-finance-ra-mat-ishinhan-30-ung-dung-cac-giai-phap-cong-nghe-toan-dien-20201221110655387.htm
"Dữ liệu của tất cả học sinh TP.HCM đã được số hóa, mã hóa",/du-lieu-cua-tat-ca-hoc-sinh-tp-hcm-da-duoc-so-hoa-ma-hoa-20201218161029662.htm
Thí điểm kinh doanh đặt cược bóng đá quốc tế tại VN: Cần đẩy nhanh việc thực hiện,/thi-diem-kinh-doanh-dat-cuoc-bong-da-quoc-te-tai-vn-can-day-nhanh-viec-thuc-hien-20201217201231737.htm
Thêm một loại hình giải trí có thưởng ứng dụng công nghệ tại Việt Nam,/them-mot-loai-hinh-giai-tri-co-thuong-ung-dung-cong-nghe-tai-viet-nam-20201215120117533.htm
Hướng tới Việt Nam số: Doanh nghiệp công nghệ số là chủ lực,/huong-toi-viet-nam-so-doanh-nghiep-cong-nghe-so-la-chu-luc-20201215092337602.htm
Hướng tới Việt Nam số: VNPT được vinh danh nhiều hạng mục top 10 doanh nghiệp CNTT 2020,/huong-toi-viet-nam-so-vnpt-duoc-vinh-danh-nhieu-hang-muc-top-10-doanh-nghiep-cntt-2020-20201214214708385.htm
Chuyển đổi số quốc gia: Cần kết nối và chia sẻ nguồn lực,/chuyen-doi-so-quoc-gia-can-ket-noi-va-chia-se-nguon-luc-20201214155335481.htm
Trí nhớ nhân tạo còn thua xa trí nhớ tự nhiên,/tri-nho-nhan-tao-con-thua-xa-tri-nho-tu-nhien-2020121341062615.htm
"Thủ tướng: Tiếp tục xây dựng một lớp nông dân mới, nắm chắc kinh tế số",/thu-tuong-tiep-tuc-xay-dung-mot-lop-nong-dan-moi-nam-chac-kinh-te-so-20201212184523358.htm
Xổ số và công nghệ: Sự kết hợp tất yếu vì lợi ích người chơi,/xo-so-va-cong-nghe-su-ket-hop-tat-yeu-vi-loi-ich-nguoi-choi-20201210104741767.htm
"Bắt nhóm người giả danh công an, viện kiểm sát đe dọa chiếm đoạt hàng trăm tỉ",/bat-nhom-nguoi-gia-danh-cong-an-vien-kiem-sat-de-doa-chiem-doat-hang-tram-ti-20201209175120221.htm
In thận nhân tạo bằng công nghệ 3D từ tế bào gốc,/in-than-nhan-tao-bang-cong-nghe-3d-tu-te-bao-goc-2020113017315982.htm
Hanwha Life Việt Nam: trải nghiệm số và giải pháp cuộc sống tốt đẹp hơn,/hanwha-life-viet-nam-trai-nghiem-so-va-giai-phap-cuoc-song-tot-dep-hon-20201129110921458.htm
"Không cần tuyển thêm telesale, một trung tâm ngoại ngữ tăng thêm 30% học viên như thế nào?",/khong-can-tuyen-them-telesale-mot-trung-tam-ngoai-ngu-tang-them-30-hoc-vien-nhu-the-nao-20201127102653905.htm
COVID-19 thúc đẩy chuyển đổi số tại Việt Nam nhanh hơn bao giờ hết,/covid-19-thuc-day-chuyen-doi-so-tai-viet-nam-nhanh-hon-bao-gio-het-20201127104134652.htm
"TP.HCM tăng đầu tư thiết bị để phạt nguội, CSGT ít ra đường hơn",/tp-hcm-tang-dau-tu-thiet-bi-de-phat-nguoi-cstg-it-ra-duong-hon-20201126111524567.htm
Xe buýt mini công nghệ đang 'kẹt bánh',/xe-buyt-mini-cong-nghe-dang-ket-banh-20201126082827961.htm
"Đà Nẵng, thành phố thông minh nhất Việt Nam 2020",/da-nang-thanh-pho-thong-minh-nhat-viet-nam-2020-20201124202703816.htm
Bộ trưởng Huỳnh Thành Đạt lần đầu trải lòng về nhiệm vụ mới,/bo-truong-huynh-thanh-dat-lan-dau-trai-long-ve-nhiem-vu-moi-20201123175910589.htm
Viettel chia sẻ kinh nghiệm xây dựng thương hiệu với các doanh nghiệp 'Make in Vietnam',/viettel-chia-se-kinh-nghiem-xay-dung-thuong-hieu-voi-cac-doanh-nghiep-make-in-vietnam-20201123151009792.htm
"Sử dụng hình ảnh 3D, công nghệ thực tế ảo để tăng sức hút du lịch TP.HCM",/su-dung-hinh-anh-3d-cong-nghe-thuc-te-ao-de-tang-suc-hut-du-lich-tp-hcm-20201120091443364.htm
Đọc báo cùng bạn 16-11: Phải quản lý chặt người nghiện ma túy,/doc-bao-cung-ban-16-11-phai-quan-ly-chat-nguoi-nghien-ma-tuy-20201116041429244.htm
Kết nối doanh nghiệp đồng bằng sông Cửu Long với các doanh nghiệp kiều bào tại Hoa Kỳ,/ket-noi-doanh-nghiep-dong-bang-song-cuu-long-voi-cac-doanh-nghiep-kieu-bao-tai-hoa-ky-20201113144540911.htm
Chuyển đổi số tạo bước chuyển mạnh tại Sacombank,/chuyen-doi-so-tao-buoc-chuyen-manh-tai-sacombank-2020111015274585.htm
Cách thức một nền dân chủ lớn vận hành,/cach-thuc-mot-nen-dan-chu-lon-van-hanh-1569881.htm
Chỉ đường thời công nghệ,/chi-duong-thoi-cong-nghe-2020110110615865.htm
"Sống lệ thuộc công nghệ, nhiều người Hàn Quốc cần 'thải độc kỹ thuật số'",/song-le-thuoc-cong-nghe-nhieu-nguoi-han-quoc-can-thai-doc-ky-thuat-so-20201030135944824.htm
Lần đầu có website ảnh chân dung ‘Mẹ Việt Nam anh hùng’,/lan-dau-co-website-anh-chan-dung-me-viet-nam-anh-hung-20201030102641598.htm
Eximbank phát hành thẻ ghi nợ nội địa Chip VCCS,/eximbank-phat-hanh-the-ghi-no-noi-dia-chip-vccs-2020102618050696.htm
"Kết quả gây sốc, 95% doanh nghiệp thừa nhận đổi mới công nghệ thất bại",/ket-qua-gay-soc-95-doanh-nghiep-thua-nhan-doi-moi-cong-nghe-that-bai-20201021171102201.htm
Chủ tịch ADB hối thúc các nước ASEAN mở rộng đầu tư vào kỹ thuật số,/chu-tich-adb-hoi-thuc-cac-nuoc-asean-mo-rong-dau-tu-vao-ky-thuat-so-20201021133610441.htm
Nền tảng công nghệ Việt được dùng tổ chức sự kiện trực tuyến toàn cầu về công nghệ số,/nen-tang-cong-nghe-viet-duoc-dung-to-chuc-su-kien-truc-tuyen-toan-cau-ve-cong-nghe-so-20201020195851813.htm
Thư viện đại học Việt Nam kết nối dữ liệu sách từ ĐH Harvard,/thu-vien-dai-hoc-viet-nam-ket-noi-du-lieu-sach-tu-dh-harvard-20201013122339164.htm
Kinh tế số nóng lên sau dịch COVID-19,/kinh-te-so-nong-len-sau-dich-covid-19-20201012210326756.htm
TP.HCM ra mắt Không gian sáng tạo và trải nghiệm chuyển đổi số,/tp-hcm-ra-mat-khong-gian-sang-tao-va-trai-nghiem-chuyen-doi-so-20201012132507484.htm
"Nhặt được 4 cọc tiền to, nữ sinh viên Hutech liền mang nộp công an",/nhat-duoc-4-coc-tien-to-nu-sinh-vien-hutech-lien-mang-nop-cong-an-20201011174633825.htm
Tài sản các tỉ phú thế giới tăng kỷ lục trong đại dịch,/tai-san-cac-ti-phu-the-gioi-tang-ky-luc-trong-dai-dich-20201007214010899.htm
Bí kíp chuyển đổi số hiệu quả cho doanh nghiệp,/bi-kip-chuyen-doi-so-hieu-qua-cho-doanh-nghiep-20201007090647252.htm
Bộ Xây dựng yêu cầu EVN rà soát lại chất lượng cột điện,/bo-xay-dung-yeu-cau-evn-ra-soat-lai-chat-luong-cot-dien-20201003141620452.htm
Xây dựng Bách khoa toàn thư mở đầu tiên bktt.vn của Việt Nam,/xay-dung-bach-khoa-toan-thu-mo-dau-tien-bktt-vn-cua-viet-nam-20201001164144234.htm
TP.HCM học được gì từ quá trình chuyển đổi số của Singapore?,/tp-hcm-hoc-duoc-gi-tu-qua-trinh-chuyen-doi-so-cua-singapore-20200930134029362.htm
Vì sao Ngoại hạng Anh hứng mưa phạt đền?,/vi-sao-ngoai-hang-anh-hung-mua-phat-den-2020092873630715.htm
1.000 điểm cầu khám chữa bệnh từ xa ở Việt Nam: Dùng công nghệ số chữa bệnh,/1000-diem-cau-kham-chua-benh-tu-xa-o-viet-nam-dung-cong-nghe-so-chua-benh-20200926082311254.htm
Việt Nam lần đầu tiên tổ chức hội nghị và triển lãm Thế giới số toàn cầu,/viet-nam-lan-dau-tien-to-chuc-hoi-nghi-va-trien-lam-the-gioi-so-toan-cau-20200925170337224.htm
"Triệt xóa đường dây đánh bạc qua mạng 3.000 tỉ ở Đà Nẵng, Gia Lai",/triet-xoa-duong-day-danh-bac-qua-mang-3000-ti-o-da-nang-gia-lai-20200924082244423.htm
Bad Luck - truyện tranh phiên bản moving toon 'trở lại lợi hại hơn xưa',/bad-luck-truyen-tranh-phien-ban-moving-toon-tro-lai-loi-hai-hon-xua-2020092199593152.htm
Nhiều Ngân hàng thay đổi cấu trúc sau COVID-19,/nhieu-ngan-hang-thay-doi-cau-truc-sau-covid-19-20200918160626373.htm
Lèo lái con thuyền công nghệ sách nói,/leo-lai-con-thuyen-cong-nghe-sach-noi-20200918090212191.htm
VinSmart ra smartphone camera ẩn đầu tiên ở Việt Nam,/vinsmart-ra-smartphone-camera-an-dau-tien-o-viet-nam-20200917171811897.htm
Newness : Tình yêu thời hiện đại: chán thì có sao?,/newness-tinh-yeu-thoi-hien-dai-chan-thi-co-sao-20200914212021337.htm
Anh tài công nghệ góp kinh nghiệm chuyển đổi số,/anh-tai-cong-nghe-gop-kinh-nghiem-chuyen-doi-so-20200911203145577.htm
Tái tạo nụ cười hoàn hảo với công nghệ nha khoa 4.0,/tai-tao-nu-cuoi-hoan-hao-voi-cong-nghe-nha-khoa-4-0-20200910152758047.htm
"Khởi nghiệp đổi mới sáng tạo trong nông nghiệp, bứt phá từ đại dịch",/khoi-nghiep-doi-moi-sang-tao-trong-nong-nghiep-but-pha-tu-dai-dich-20200909165938635.htm
Bắt 2 lãnh đạo công ty nâng khống giá thiết bị y tế tại Bệnh viện Bạch Mai,/bat-2-lanh-dao-cong-ty-nang-khong-gia-thiet-bi-y-te-tai-benh-vien-bach-mai-20200901215411766.htm
Đánh ghen bằng quay clip tung lên mạng,/danh-ghen-bang-quay-clip-tung-len-mang-20200830025914761.htm
Tìm các sản phẩm 'Make in Vietnam' xuất sắc góp phần phát triển kinh tế số,/tim-cac-san-pham-make-in-vietnam-xuat-sac-gop-phan-phat-trien-kinh-te-so-20200819164427745.htm
VietinBank iPay Mobile - Ứng dụng ngân hàng hiểu bạn hơn ai hết,/vietinbank-ipay-mobile-ung-dung-ngan-hang-hieu-ban-hon-ai-het-20200811134912809.htm
Bộ Thông tin và truyền thông ra mắt nền tảng số Make in Vietnam - akaChain,/bo-thong-tin-va-truyen-thong-ra-mat-nen-tang-so-make-in-vietnam-akachain-20200813160012247.htm
Chubb Life Việt Nam giới thiệu công cụ eKYC - Định danh khách hàng điện tử,/chubb-life-viet-nam-gioi-thieu-cong-cu-ekyc-dinh-danh-khach-hang-dien-tu-20200730165302091.htm
Indonesia thu thuế VAT các hãng công nghệ nước ngoài,/indonesia-thu-thue-vat-cac-hang-cong-nghe-nuoc-ngoai-20200728100507968.htm
100% ngân hàng Việt Nam đã phát triển kênh bán hàng qua công nghệ số,/100-ngan-hang-viet-nam-da-phat-trien-kenh-ban-hang-qua-cong-nghe-so-20200715161151665.htm
"Bình Phước đầu tư 180 tỉ đồng nâng cấp, mở rộng đường nối Bình Dương",/binh-phuoc-dau-tu-180-ti-dong-nang-cap-mo-rong-duong-noi-binh-duong-20200714130425652.htm
Thêm quy định ghi nhãn... quá khó,/them-quy-dinh-ghi-nhan-qua-kho-20200711080529247.htm
Triển khai dịch vụ ngân hàng số trên phần mềm kế toán,/trien-khai-dich-vu-ngan-hang-so-tren-phan-mem-ke-toan-20200710192557155.htm
Viet Solutions 2020: Sân chơi tìm kiếm giải pháp chuyển đổi số Việt Nam,/viet-solutions-2020-san-choi-tim-kiem-giai-phap-chuyen-doi-so-viet-nam-20200708182209871.htm
"1,6 triệu xe kinh doanh vận tải phải đổi sang biển số màu vàng",/1-6-trieu-xe-kinh-doanh-van-tai-phai-doi-sang-bien-so-mau-vang-20200708073940211.htm
Đưa mạng 5G vào khai thác từ tháng 10-2020,/dua-mang-5g-vao-khai-thac-tu-thang-10-2020-20200706165922525.htm
"Trong 5 năm, Viettel đã tạo ra hơn 1,2 triệu tỉ đồng",/trong-5-nam-viettel-da-tao-ra-hon-1-2-trieu-ti-dong-20200702162826393.htm
Giáo dục phổ thông thế kỷ 21 tại trường THPT FPT Đà Nẵng,/giao-duc-pho-thong-the-ky-21-tai-truong-thpt-fpt-da-nang-20200625161513705.htm
Phó thủ tướng Phạm Bình Minh thị sát tuyến metro Bến Thành - Suối Tiên,/pho-thu-tuong-pham-binh-minh-thi-sat-tuyen-metro-so-ben-thanh-suoi-tien-20200629101033931.htm
Ngành công nghiệp ô tô tại Việt Nam: Khan hiếm nhân lực,/nganh-cong-nghiep-o-to-tai-viet-nam-khan-hiem-nhan-luc-20200626100326717.htm
"Từ 24h ngày 30-6, ngừng phát sóng truyền hình analog tại 21 tỉnh",/tu-24h-30-6-ngung-phat-song-truyen-hinh-analog-tai-21-tinh-2020062714291948.htm
Moving toon - xu hướng đọc truyện thời công nghệ số,/moving-toon-xu-huong-doc-truyen-thoi-cong-nghe-so-2020062423824158.htm
Mỹ sẽ hỗ trợ tài chính cho các công ty viễn thông dùng công nghệ 5G từ đối thủ của Huawei,/my-se-ho-tro-tai-chinh-cho-cac-cong-ty-vien-thong-dung-cong-nghe-5g-tu-doi-thu-cua-huawei-20200624071544072.htm
"Giả website Bộ Công an, phát tán phần mềm gián điệp VN84App",/gia-website-bo-cong-an-phat-tan-phan-mem-gian-diep-vn84app-20200623093029482.htm
Đại sứ Mỹ tại Việt Nam Daniel Kritenbrink: Việt Nam đang có phong độ tốt,/dai-su-my-tai-viet-nam-daniel-kritenbrink-viet-nam-dang-co-phong-do-tot-20200623075416083.htm
Bí quyết cân bằng cho giới nữ có nhiều áp lực: Một chút 'không công nghệ',/bi-quyet-can-bang-cho-gioi-nu-co-nhieu-ap-luc-mot-chut-khong-cong-nghe-20200620095604999.htm
"Xác thực vân tay, khuôn mặt khi giao dịch ngân hàng lên ngôi",/xac-thuc-van-tay-khuon-mat-khi-giao-dich-ngan-hang-len-ngoi-2020061808340144.htm
Cận cảnh các nhà ga trên cao tuyến metro Bến Thành - Suối Tiên,/can-canh-cac-nha-ga-tren-cao-tuyen-metro-ben-thanh-suoi-tien-2020061610504397.htm
Thị trường nhân lực IT và cơn khát tuyển dụng,/thi-truong-nhan-luc-it-va-con-khat-tuyen-dung-20200602202754618.htm
Bảo hiểm dữ liệu và an ninh mạng thời kỳ 4.0,/bao-hiem-du-lieu-va-an-ninh-mang-thoi-ky-4-0-20200527141238354.htm
Khởi động chiến dịch chuyển đổi số bằng công nghệ điện toán đám mây,/khoi-dong-chien-dich-chuyen-doi-so-bang-cong-nghe-dien-toan-dam-may-20200522120642067.htm
Apple đã chuyển một phần sản xuất AirPods từ Trung Quốc sang Việt Nam,/apple-da-chuyen-mot-phan-san-xuat-airpods-tu-trung-quoc-sang-viet-nam-20200522090153198.htm
Lừa đảo thời công nghệ số và cách tự bảo vệ,/lua-dao-thoi-cong-nghe-so-va-cach-tu-bao-ve-20200518140004703.htm
Học công nghệ kỹ thuật ô tô thời 4.0 - ‘Cơ ngơi thực hành’ là yếu tố số 1,/hoc-cong-nghe-ky-thuat-o-to-thoi-40-co-ngoi-thuc-hanh-la-yeu-to-so-1-20200512141650713.htm
Tạm giữ thanh niên đi xe máy đâm chết người phụ nữ trong đêm,/tam-giu-thanh-nien-di-xe-may-dam-chet-nguoi-phu-nu-trong-dem-20200511174545999.htm
Prudential Việt Nam chi hơn 1 triệu USD để huấn luyện 'khởi nghiệp trực tuyến',/prudential-viet-nam-chi-hon-1-trieu-usd-de-huan-luyen-khoi-nghiep-truc-tuyen-20200511143508399.htm
"Cầu thủ 'truyền hình' cho khán giả tại gia, fan từ nhà 'truyền tiếng' đến sân",/cau-thu-truyen-hinh-cho-khan-gia-tai-gia-fan-tu-nha-truyen-tieng-den-san-2020042957174815.htm
"UNESCO: 50% học sinh, sinh viên thiếu máy tính để học trực tuyến",/unesco-50-hoc-sinh-sinh-vien-thieu-may-tinh-de-hoc-truc-tuyen-20200423141312755.htm
Đây mới là cuộc sống online và công nghệ hữu ích đích thực ,/day-moi-la-cuoc-song-online-va-cong-nghe-huu-ich-dich-thuc-1555428.htm
Đặt mục tiêu 60% người Việt sử dụng mạng xã hội nội địa,/dat-muc-tieu-60-nguoi-viet-su-dung-mang-xa-hoi-noi-dia-20200408175144367.htm
