Title,URL,Publish Date,Mentioned Times,Word Count
EVNSPC bám sát và đảm bảo hoàn thành các mục tiêu chuyển đổi số,https://tienphong.vn/evnspc-bam-sat-va-dam-bao-hoan-thanh-cac-muc-tieu-chuyen-doi-so-post1480224.tpo,2022-10-22,3,1531
EVNHANOI chuyển đổi thành doanh nghiệp hoạt động theo mô hình doanh nghiệp số ,https://tienphong.vn/evnhanoi-chuyen-doi-thanh-doanh-nghiep-hoat-dong-theo-mo-hinh-doanh-nghiep-so-post1458283.tpo,2022-08-02,3,1241
Hội Truyền thông số đề nghị cơ quan nhà nước vào cuộc vụ tranh chấp bản quyền 'sói Wolfoo',https://tienphong.vn/hoi-truyen-thong-so-de-nghi-co-quan-nha-nuoc-vao-cuoc-vu-tranh-chap-ban-quyen-soi-wolfoo-post1478071.tpo,2022-10-14,1,1190
Nhiệt điện Duyên Hải ứng dụng 'Quản lý Lịch chuyển đổi định kỳ thiết bị',https://tienphong.vn/nhiet-dien-duyen-hai-ung-dung-quan-ly-lich-chuyen-doi-dinh-ky-thiet-bi-post1476130.tpo,2022-10-08,2,1220
Tổng công ty Phát điện 1 kỷ niệm 10 năm thành lập,https://tienphong.vn/tong-cong-ty-phat-dien-1-ky-niem-10-nam-thanh-lap-post1499255.tpo,2022-12-29,2,967
Cao tốc Bến Lức - Long Thành: Nhà thầu đòi bồi thường hơn 1.600 tỷ đồng,https://tienphong.vn/cao-toc-ben-luc-long-thanh-nha-thau-doi-boi-thuong-hon-1600-ty-dong-post1498509.tpo,2022-12-27,1,763
"Năm 2022, EVNGENCO2 vượt qua khó khăn, hoàn thành nhiệm vụ",https://tienphong.vn/nam-2022-evngenco2-vuot-qua-kho-khan-hoan-thanh-nhiem-vu-post1498448.tpo,2022-12-26,1,1463
EVNHCMC được trao giải thưởng Doanh nghiệp sáng tạo ASEAN năm 2022,https://tienphong.vn/evnhcmc-duoc-trao-giai-thuong-doanh-nghiep-sang-tao-asean-nam-2022-post1498280.tpo,2022-12-26,3,1053
EVNSPC: Chuyển đổi số trong công tác chăm sóc khách hàng,https://tienphong.vn/evnspc-chuyen-doi-so-trong-cong-tac-cham-soc-khach-hang-post1496413.tpo,2022-12-19,1,760
EVNSPC: Khẳng định quyết tâm chuyển đổi số toàn diện của ngành Điện ,https://tienphong.vn/evnspc-khang-dinh-quyet-tam-chuyen-doi-so-toan-dien-cua-nganh-dien-post1496414.tpo,2022-12-19,1,817
Đoàn Thanh niên EVN: Khẳng định vai trò tiên phong trong phong trào sáng tạo trẻ,https://tienphong.vn/doan-thanh-nien-evn-khang-dinh-vai-tro-tien-phong-trong-phong-trao-sang-tao-tre-post1495085.tpo,2022-12-14,1,1312
MobiFone và Cục Truyền thông CAND ký hợp tác trong lĩnh vực chuyển đổi số,https://tienphong.vn/mobifone-va-cuc-truyen-thong-cand-ky-hop-tac-trong-linh-vuc-chuyen-doi-so-post1493641.tpo,2022-12-09,1,1098
Gần 1.400 công ty công nghệ số Việt Nam mạnh mẽ vươn ra thế giới,https://tienphong.vn/gan-1400-cong-ty-cong-nghe-so-viet-nam-manh-me-vuon-ra-the-gioi-post1493321.tpo,2022-12-08,1,1172
Tập đoàn Xăng dầu Việt Nam khởi động đề án Chuyển đổi số toàn diện cùng Tập đoàn FPT,https://tienphong.vn/tap-doan-xang-dau-viet-nam-khoi-dong-de-an-chuyen-doi-so-toan-dien-cung-tap-doan-fpt-post1499111.tpo,2022-12-01,2,1250
"‘Quên’ 184 tỷ đồng và 4 khu đất khi cổ phần hoá, nhóm cựu lãnh đạo Cienco 1 bị đề nghị truy tố",https://tienphong.vn/quen-184-ty-dong-va-4-khu-dat-khi-co-phan-hoa-nhom-cuu-lanh-dao-cienco-1-bi-de-nghi-truy-to-post1491323.tpo,2022-12-01,0,737
Hệ sinh thái số ngân hàng: Cơ hội tăng trưởng cho doanh nghiệp,https://tienphong.vn/he-sinh-thai-so-ngan-hang-co-hoi-tang-truong-cho-doanh-nghiep-post1490231.tpo,2022-11-28,1,1325
Thúc đẩy chuyển đổi số trong lĩnh vực điện lực,https://tienphong.vn/thuc-day-chuyen-doi-so-trong-linh-vuc-dien-luc-post1489807.tpo,2022-11-26,2,953
Tổng Công ty Điện lực miền Nam có tân Chủ tịch Hội đồng thành viên,https://tienphong.vn/tong-cong-ty-dien-luc-mien-nam-co-tan-chu-tich-hoi-dong-thanh-vien-post1488356.tpo,2022-11-21,1,921
Traphaco và hành trình tiên phong thổi hồn sống hiện đại vào đông dược,https://tienphong.vn/traphaco-va-hanh-trinh-tien-phong-thoi-hon-song-hien-dai-vao-dong-duoc-post1486227.tpo,2022-11-14,1,1144
MB: 28 năm chinh phục khách hàng bằng trải nghiệm ,https://tienphong.vn/mb-28-nam-chinh-phuc-khach-hang-bang-trai-nghiem-post1483672.tpo,2022-11-04,1,819
"Nhiệt điện Duyên Hải: Chuyển đổi số, phương thức hoạt động thông minh, hiệu quả, tiết kiệm",https://tienphong.vn/nhiet-dien-duyen-hai-chuyen-doi-so-phuong-thuc-hoat-dong-thong-minh-hieu-qua-tiet-kiem-post1482475.tpo,2022-10-31,1,1143
"Bà Rịa-Vũng Tàu còn tồn 73,4 tỉ đồng tiền huy động phòng chống COVID-19",https://tienphong.vn/ba-ria-vung-tau-con-ton-734-ti-dong-tien-huy-dong-phong-chong-covid-19-post1481557.tpo,2022-10-27,1,495
Bộ Công Thương điểm tên loạt doanh nghiệp không nhập xăng dầu,https://tienphong.vn/bo-cong-thuong-diem-ten-loat-doanh-nghiep-khong-nhap-xang-dau-post1480821.tpo,2022-10-24,1,980
Tiết lộ bất ngờ về 'ông chủ' của mỏ titan vừa sạt lở kinh hoàng ở Bình Thuận,https://tienphong.vn/tiet-lo-bat-ngo-ve-ong-chu-cua-mo-titan-vua-sat-lo-kinh-hoang-o-binh-thuan-post1479161.tpo,2022-10-18,1,1319
"Petrolimex: Đẩy mạnh kinh doanh sản phẩm năng lượng xanh, chuyển đổi số toàn diện",https://tienphong.vn/petrolimex-day-manh-kinh-doanh-san-pham-nang-luong-xanh-chuyen-doi-so-toan-dien-post1478379.tpo,2022-10-15,1,1173
MobiFone vào Top 10 Thương hiệu mạnh Việt Nam ngành Công nghệ năm 2022,https://tienphong.vn/mobifone-vao-top-10-thuong-hieu-manh-viet-nam-nganh-cong-nghe-nam-2022-post1478013.tpo,2022-10-14,2,1146
Kỳ vọng Đoàn Khối Doanh nghiệp T.Ư là đầu tàu về đổi mới sáng tạo và chuyển đổi số,https://tienphong.vn/ky-vong-doan-khoi-doanh-nghiep-tu-la-dau-tau-ve-doi-moi-sang-tao-va-chuyen-doi-so-post1478002.tpo,2022-10-14,1,1683
“Đột kích” cơ sở thẩm mỹ khám chữa bệnh chui,https://tienphong.vn/dot-kich-co-so-tham-my-kham-chua-benh-chui-post1477311.tpo,2022-10-12,0,531
EVN nhận giải thưởng doanh nghiệp chuyển đổi số xuất sắc Việt Nam năm 2022,https://tienphong.vn/evn-nhan-giai-thuong-doanh-nghiep-chuyen-doi-so-xuat-sac-viet-nam-nam-2022-post1476833.tpo,2022-10-10,2,1084
"Ngày mai, khai mạc Tuần lễ Số Quốc tế Việt Nam 2022",https://tienphong.vn/ngay-mai-khai-mac-tuan-le-so-quoc-te-viet-nam-2022-post1476600.tpo,2022-10-10,1,427
Hà Nội công khai nhiều đơn vị nợ tiền tỷ bảo hiểm xã hội,https://tienphong.vn/ha-noi-cong-khai-nhieu-don-vi-no-tien-ty-bao-hiem-xa-hoi-post1472523.tpo,2022-09-26,0,891
15 doanh nghiệp CNTT Việt Nam vào top nghìn tỷ đồng,https://tienphong.vn/15-doanh-nghiep-cntt-viet-nam-vao-top-nghin-ty-dong-post1468543.tpo,2022-09-10,1,762
"Cựu chủ tịch xã lĩnh 72 tháng tù vì rút tiền chống dịch để biếu xén, tiếp khách",https://tienphong.vn/cuu-chu-tich-xa-linh-72-thang-tu-vi-rut-tien-chong-dich-de-bieu-xen-tiep-khach-post1466446.tpo,2022-09-01,0,465
"Amway khai trương khu phức hợp kinh doanh và trải nghiệm hiện đại, sang trọng, trẻ trung ",https://tienphong.vn/amway-khai-truong-khu-phuc-hop-kinh-doanh-va-trai-nghiem-hien-dai-sang-trong-tre-trung-post1465533.tpo,2022-08-29,1,1011
Sắp xét xử cựu chủ tịch xã bị cáo buộc 'rút ruột' tiền chống dịch tả lợn,https://tienphong.vn/sap-xet-xu-cuu-chu-tich-xa-bi-cao-buoc-rut-ruot-tien-chong-dich-ta-lon-post1463004.tpo,2022-08-19,0,500
"Quản lý, vận hành lưới điện miền Nam: Mạnh mẽ số hóa ",https://tienphong.vn/quan-ly-van-hanh-luoi-dien-mien-nam-manh-me-so-hoa-post1459941.tpo,2022-08-10,1,1749
Giải mã sự ‘kỳ lạ’ về dữ liệu vận hành của một ứng dụng từ Thừa Thiên Huế,https://tienphong.vn/giai-ma-su-ky-la-ve-du-lieu-van-hanh-cua-mot-ung-dung-tu-thua-thien-hue-post1456601.tpo,2022-07-26,0,1882
Công ty Cổ phần Đầu tư và Xây dựng số 4 thông báo chào bán 32.000.000 cổ phiếu ra công chúng,https://tienphong.vn/cong-ty-co-phan-dau-tu-va-xay-dung-so-4-thong-bao-chao-ban-32000000-co-phieu-ra-cong-chung-post1455872.tpo,2022-07-23,1,746
Bất động sản Thủ Thiêm còn hấp dẫn sau khi 4 doanh nghiệp trúng đấu giá bỏ cọc?,https://tienphong.vn/bat-dong-san-thu-thiem-con-hap-dan-sau-khi-4-doanh-nghiep-trung-dau-gia-bo-coc-post1454052.tpo,2022-07-16,0,1217
Kỳ thi 'Chuyển Đổi Số' cho hàng chục triệu lao động Việt Nam,https://tienphong.vn/ky-thi-chuyen-doi-so-cho-hang-chuc-trieu-lao-dong-viet-nam-post1451728.tpo,2022-07-07,1,844
"Công ty Nhiệt điện Mông Dương: Ổn định sản xuất, duy trì tốc độ tăng trưởng ",https://tienphong.vn/cong-ty-nhiet-dien-mong-duong-on-dinh-san-xuat-duy-tri-toc-do-tang-truong-post1450931.tpo,2022-07-04,2,1408
"Chuyển đổi số doanh nghiệp - khởi đầu nhỏ, hiệu quả lớn",https://tienphong.vn/chuyen-doi-so-doanh-nghiep-khoi-dau-nho-hieu-qua-lon-post1449824.tpo,2022-06-30,1,1133
Anh Dương Thái Anh được bầu làm Bí thư Đoàn Thanh niên Tập đoàn EVN,https://tienphong.vn/anh-duong-thai-anh-duoc-bau-lam-bi-thu-doan-thanh-nien-tap-doan-evn-post1449716.tpo,2022-06-30,1,1242
"Nóng việc mua xăng từ Malaysia, dự trữ xăng dầu của doanh nghiệp: Bộ Công Thương nói gì?",https://tienphong.vn/nong-viec-mua-xang-tu-malaysia-du-tru-xang-dau-cua-doanh-nghiep-bo-cong-thuong-noi-gi-post1446573.tpo,2022-06-16,1,1165
Công bố logo Đại hội Đoàn Khối Doanh nghiệp T.Ư lần thứ IV,https://tienphong.vn/cong-bo-logo-dai-hoi-doan-khoi-doanh-nghiep-tu-lan-thu-iv-post1437617.tpo,2022-05-11,0,625
"Xuất khẩu thuận lợi, thủy sản lãi lớn, nhiều chủ DN lọt top giàu trên sàn chứng khoán",https://tienphong.vn/xuat-khau-thuan-loi-thuy-san-lai-lon-nhieu-chu-dn-lot-top-giau-tren-san-chung-khoan-post1435343.tpo,2022-05-02,1,872
VietCredit thăng hạng vượt bậc đứng thứ 3 trong bảng FAST500,https://tienphong.vn/vietcredit-thang-hang-vuot-bac-dung-thu-3-trong-bang-fast500-post1433868.tpo,2022-04-26,1,983
"Năm 2022, MB xác định tầm nhìn “Trở thành Doanh nghiệp số, Tập đoàn tài chính dẫn đầu”",https://tienphong.vn/nam-2022-mb-xac-dinh-tam-nhin-tro-thanh-doanh-nghiep-so-tap-doan-tai-chinh-dan-dau-post1433497.tpo,2022-04-25,1,897
Mobifone vinh dự nhận 9 giải thưởng Sao Khuê 2022,https://tienphong.vn/mobifone-vinh-du-nhan-9-giai-thuong-sao-khue-2022-post1433192.tpo,2022-04-24,1,842
EVNGENCO3 đẩy mạnh tự động hóa ,https://tienphong.vn/evngenco3-day-manh-tu-dong-hoa-post1431633.tpo,2022-04-18,1,1121
"MobiFone tuổi 29: chuyển đổi số toàn diện, nhắm đích DN số hàng đầu",https://tienphong.vn/mobifone-tuoi-29-chuyen-doi-so-toan-dien-nham-dich-dn-so-hang-dau-post1430985.tpo,2022-04-15,1,1182
"VNPT trình diễn nền tảng, hệ sinh thái ứng dụng chuyển đổi số",https://tienphong.vn/vnpt-trinh-dien-nen-tang-he-sinh-thai-ung-dung-chuyen-doi-so-post1431167.tpo,2022-04-15,2,1512
"MobiFone tuổi 29: chuyển đổi số toàn diện, nhắm đích DN số hàng đầu",https://tienphong.vn/mobifone-tuoi-29-chuyen-doi-so-toan-dien-nham-dich-dn-so-hang-dau-post1430726.tpo,2022-04-14,1,1182
Agribank - Tự hào hành trình 34 năm phát triển (26/3/1988 - 26/3/2022),https://tienphong.vn/agribank-tu-hao-hanh-trinh-34-nam-phat-trien-2631988-2632022-post1425946.tpo,2022-03-25,1,1750
Agribank - Tự hào hành trình 34 năm phát triển (26/3/1988 - 26/3/2022),https://tienphong.vn/agribank-tu-hao-hanh-trinh-34-nam-phat-trien-2631988-2632022-post1436292.tpo,2022-03-24,1,1833
"Tuổi trẻ MobiFone: Nhiều cách làm hay, sáng tạo trong công tác đoàn thanh niên",https://tienphong.vn/tuoi-tre-mobifone-nhieu-cach-lam-hay-sang-tao-trong-cong-tac-doan-thanh-nien-post1424749.tpo,2022-03-21,1,1017
VLC thông báo phát hành cổ phiếu để hoán đổi theo hợp đồng sáp nhập,https://tienphong.vn/vlc-thong-bao-phat-hanh-co-phieu-de-hoan-doi-theo-hop-dong-sap-nhap-post1413031.tpo,2022-01-30,2,1254
VLC thông báo phát hành cổ phiếu để hoán đổi theo hợp đồng sáp nhập,https://tienphong.vn/vlc-thong-bao-phat-hanh-co-phieu-de-hoan-doi-theo-hop-dong-sap-nhap-post1413030.tpo,2022-01-29,2,1254
VLC thông báo phát hành cổ phiếu để hoán đổi theo hợp đồng sáp nhập,https://tienphong.vn/vlc-thong-bao-phat-hanh-co-phieu-de-hoan-doi-theo-hop-dong-sap-nhap-post1413032.tpo,2022-01-28,2,1254
Điều chuyển công tác người ký văn bản xin doanh nghiệp nửa tỷ để đón Tết 'tươi vui' ,https://tienphong.vn/dieu-chuyen-cong-tac-nguoi-ky-van-ban-xin-doanh-nghiep-nua-ty-de-don-tet-tuoi-vui-post1409805.tpo,2022-01-15,1,461
Tập đoàn Mavin được vinh danh là Doanh nghiệp sáng tạo nhất ASEAN 2021,https://tienphong.vn/tap-doan-mavin-duoc-vinh-danh-la-doanh-nghiep-sang-tao-nhat-asean-2021-post1407530.tpo,2022-01-07,1,736
Petrolimex lan tỏa ‘thanh toán thông minh - lợi ích đồng hành’,https://tienphong.vn/petrolimex-lan-toa-thanh-toan-thong-minh-loi-ich-dong-hanh-post1407000.tpo,2022-01-05,2,956
"Năm 2021, VNPT hoàn thành ‘mục tiêu kép’ với nhiều dấu ấn",https://tienphong.vn/nam-2021-vnpt-hoan-thanh-muc-tieu-kep-voi-nhieu-dau-an-post1404115.tpo,2021-12-24,1,1219
Điện lực Việt Nam - 67 năm “Thắp sáng niềm tin”,https://tienphong.vn/dien-luc-viet-nam-67-nam-thap-sang-niem-tin-post1403257.tpo,2021-12-21,1,1258
"Các doanh nghiệp, nền tảng số là tài nguyên, dữ liệu của Việt Nam",https://tienphong.vn/cac-doanh-nghiep-nen-tang-so-la-tai-nguyen-du-lieu-cua-viet-nam-post1400442.tpo,2021-12-11,3,1154
"EVNGENCO3 nhận giải thưởng 'Sản phẩm, giải pháp công nghệ số tiêu biểu năm 2021' ",https://tienphong.vn/evngenco3-nhan-giai-thuong-san-pham-giai-phap-cong-nghe-so-tieu-bieu-nam-2021-post1400271.tpo,2021-12-10,1,838
Kết nối khát vọng doanh nghiệp số vươn tầm khu vực,https://tienphong.vn/ket-noi-khat-vong-doanh-nghiep-so-vuon-tam-khu-vuc-post1397720.tpo,2021-12-02,1,612
MobiFone eOffice – Bộ giải pháp số hóa văn phòng toàn diện,https://tienphong.vn/mobifone-eoffice-bo-giai-phap-so-hoa-van-phong-toan-dien-post1396104.tpo,2021-11-26,1,1262
"Diễn đàn Doanh nghiệp 2022: ""Nhận diện thị trường và phương thức thích ứng""",https://tienphong.vn/dien-dan-doanh-nghiep-2022-nhan-dien-thi-truong-va-phuong-thuc-thich-ung-post1395690.tpo,2021-11-25,0,1389
"""TRƯỜNG HỌC hay TRƯỜNG ĐỜI 3"": Dạy thế nào và học gì trong kỷ nguyên số hóa?",https://tienphong.vn/truong-hoc-hay-truong-doi-3-day-the-nao-va-hoc-gi-trong-ky-nguyen-so-hoa-post1395045.tpo,2021-11-23,0,737
Chuyển đổi số thúc đẩy đào tạo lao động ,https://tienphong.vn/chuyen-doi-so-thuc-day-dao-tao-lao-dong-post1394872.tpo,2021-11-22,1,906
Dạy thế nào và học gì trong kỷ nguyên số?,https://tienphong.vn/day-the-nao-va-hoc-gi-trong-ky-nguyen-so-post1394877.tpo,2021-11-22,0,749
"Chuyển đổi số ở EVNNPC: Tăng tiện ích cho khách hàng, giảm chi phí cho doanh nghiệp",https://tienphong.vn/chuyen-doi-so-o-evnnpc-tang-tien-ich-cho-khach-hang-giam-chi-phi-cho-doanh-nghiep-post1394134.tpo,2021-11-18,2,1344
"EVNGENCO1 đặt mục tiêu trở thành doanh nghiệp số sáng tạo, văn hóa mạnh",https://tienphong.vn/evngenco1-dat-muc-tieu-tro-thanh-doanh-nghiep-so-sang-tao-van-hoa-manh-post1393809.tpo,2021-11-17,1,752
Tiêm vắc xin ngừa COVID-19 cho trẻ em phải có sự đồng ý của phụ huynh,https://tienphong.vn/tiem-vac-xin-ngua-covid-19-cho-tre-em-phai-co-su-dong-y-cua-phu-huynh-post1386711.tpo,2021-10-21,0,1122
One Mount đồng hành cùng Việt Nam kiến tạo hệ sinh thái công nghệ toàn diện,https://tienphong.vn/one-mount-dong-hanh-cung-viet-nam-kien-tao-he-sinh-thai-cong-nghe-toan-dien-post1385757.tpo,2021-10-18,1,1377
Doanh nghiệp cần sẵn sàng đón đầu nhu cầu tiêu dùng dịp cuối năm để tăng trưởng,https://tienphong.vn/doanh-nghiep-can-san-sang-don-dau-nhu-cau-tieu-dung-dip-cuoi-nam-de-tang-truong-post1384510.tpo,2021-10-15,1,785
"Chiến lược phát triển EVN đến 2030: Trở thành Tập đoàn kinh tế mạnh, bền vững ",https://tienphong.vn/chien-luoc-phat-trien-evn-den-2030-tro-thanh-tap-doan-kinh-te-manh-ben-vung-post1384772.tpo,2021-10-14,2,1318
Mobifone được vinh danh top 10 ngành dịch vụ số - bán lẻ ,https://tienphong.vn/mobifone-duoc-vinh-danh-top-10-nganh-dich-vu-so-ban-le-post1384490.tpo,2021-10-13,1,867
Hướng tới chuyển đổi thành doanh nghiệp số ,https://tienphong.vn/huong-toi-chuyen-doi-thanh-doanh-nghiep-so-post1383522.tpo,2021-10-12,2,709
Hơn 1.000m3 gỗ công sản 'tiền tỷ' mục nát: Chi thêm ngân sách kiểm đếm lại,https://tienphong.vn/hon-1000m3-go-cong-san-tien-ty-muc-nat-chi-them-ngan-sach-kiem-dem-lai-post1383450.tpo,2021-10-10,0,634
EVNNPC có tân Chủ tịch và Tổng Giám đốc ,https://tienphong.vn/evnnpc-co-tan-chu-tich-va-tong-giam-doc-post1399237.tpo,2021-10-07,1,767
Giải pháp điều hòa thương mại hữu hiệu trong bối cảnh dịch COVID-19,https://tienphong.vn/giai-phap-dieu-hoa-thuong-mai-huu-hieu-trong-boi-canh-dich-covid-19-post1380718.tpo,2021-09-30,1,993
"Chuyển đổi số để đáp ứng yêu cầu của khách hàng ở mọi lúc, mọi nơi",https://tienphong.vn/chuyen-doi-so-de-dap-ung-yeu-cau-cua-khach-hang-o-moi-luc-moi-noi-post1380042.tpo,2021-09-27,3,1102
"Xe chở mấy trăm con lợn, hàng nghìn con gà mà sang tải thì doanh nghiệp sống sao nổi?",https://tienphong.vn/xe-cho-may-tram-con-lon-hang-nghin-con-ga-ma-sang-tai-thi-doanh-nghiep-song-sao-noi-post1375713.tpo,2021-09-13,0,1124
Vì sao hàng quán ở TPHCM vẫn 'cửa đóng then cài'?,https://tienphong.vn/vi-sao-hang-quan-o-tphcm-van-cua-dong-then-cai-post1374910.tpo,2021-09-11,0,818
Đẩy mạnh số hóa dịch vụ điện lực khu vực miền Nam,https://tienphong.vn/day-manh-so-hoa-dich-vu-dien-luc-khu-vuc-mien-nam-post1371744.tpo,2021-09-01,2,1553
Thực hư chuyện doanh nghiệp nhập 15 triệu liều vắc- xin Pfizer?,https://tienphong.vn/thuc-hu-chuyen-doanh-nghiep-nhap-15-trieu-lieu-vac-xin-pfizer-post1370820.tpo,2021-08-29,0,1592
EVNCPC: Đẩy mạnh chuyển đổi số trong công tác quản lý kỹ thuật và dịch vụ khách hàng,https://tienphong.vn/evncpc-day-manh-chuyen-doi-so-trong-cong-tac-quan-ly-ky-thuat-va-dich-vu-khach-hang-post1370790.tpo,2021-08-29,1,1022
Chuyển đổi số - chìa khóa cho phát triển đào tạo nguồn nhân lực kế toán,https://tienphong.vn/chuyen-doi-so-chia-khoa-cho-phat-trien-dao-tao-nguon-nhan-luc-ke-toan-post1369743.tpo,2021-08-26,1,1364
"Tăng cường chuyển đổi số để phục hồi sản xuất, kinh doanh",https://tienphong.vn/tang-cuong-chuyen-doi-so-de-phuc-hoi-san-xuat-kinh-doanh-post1369170.tpo,2021-08-25,1,1101
"'Hơn bao giờ hết, đại dịch COVID-19 đặt ra những yêu cầu cấp bách'",https://tienphong.vn/hon-bao-gio-het-dai-dich-covid-19-dat-ra-nhung-yeu-cau-cap-bach-post1368709.tpo,2021-08-23,1,1017
"Cựu Chủ tịch SADECO tham ô tài sản, cho nhân viên đi du lịch châu Âu trái luật ",https://tienphong.vn/cuu-chu-tich-sadeco-tham-o-tai-san-cho-nhan-vien-di-du-lich-chau-au-trai-luat-post1364269.tpo,2021-08-10,0,758
EVNCPC: Hiệu quả từ “Văn phòng số”,https://tienphong.vn/evncpc-hieu-qua-tu-van-phong-so-post1363085.tpo,2021-08-06,1,1246
Đấu giá cổ phần Nhà nước đang... thoát ế ! ,https://tienphong.vn/dau-gia-co-phan-nha-nuoc-dang-thoat-e-post1362476.tpo,2021-08-04,0,683
Thuỷ điện Bản Vẽ xây dựng thành công ứng dụng theo dõi thông số nhà máy điện,https://tienphong.vn/thuy-dien-ban-ve-xay-dung-thanh-cong-ung-dung-theo-doi-thong-so-nha-may-dien-post1360815.tpo,2021-07-30,1,915
"Nâng khống giá dịch vụ xuất nhập khẩu, chiếm đoạt 13 tỷ của công ty",https://tienphong.vn/nang-khong-gia-dich-vu-xuat-nhap-khau-chiem-doat-13-ty-cua-cong-ty-post1353618.tpo,2021-07-09,0,507
Công cụ giúp nhận diện khách hàng trong thế giới số ,https://tienphong.vn/cong-cu-giup-nhan-dien-khach-hang-trong-the-gioi-so-post1351173.tpo,2021-07-02,1,1337
BIDV - ERP Connection: Giải pháp hỗ trợ doanh nghiệp chuyển đổi số hiệu quả,https://tienphong.vn/bidv-erp-connection-giai-phap-ho-tro-doanh-nghiep-chuyen-doi-so-hieu-qua-post1351078.tpo,2021-07-01,1,640
Chuyển đổi số và chìa khóa thành công tại EVNGENCO 3,https://tienphong.vn/chuyen-doi-so-va-chia-khoa-thanh-cong-tai-evngenco-3-post1350576.tpo,2021-06-29,1,1206
Gỗ nhựa Việt Ý - khẳng định vị thế thương hiệu gỗ nhựa hàng đầu thị trường,https://tienphong.vn/go-nhua-viet-y-khang-dinh-vi-the-thuong-hieu-go-nhua-hang-dau-thi-truong-post1346324.tpo,2021-06-15,1,800
"Bắc Ninh lập 2 chốt liên ngành kiểm soát người, phương tiện ra vào tỉnh",https://tienphong.vn/bac-ninh-lap-2-chot-lien-nganh-kiem-soat-nguoi-phuong-tien-ra-vao-tinh-post1336905.tpo,2021-05-15,0,463
Vega City Nha Trang: Khẳng định pháp lý đảm bảo cho đối tác và các nhà đầu tư,https://tienphong.vn/vega-city-nha-trang-khang-dinh-phap-ly-dam-bao-cho-doi-tac-va-cac-nha-dau-tu-post1335826.tpo,2021-05-12,1,1012
EVN SPC tích cực chuyển đổi số,https://tienphong.vn/evn-spc-tich-cuc-chuyen-doi-so-post1331773.tpo,2021-05-02,2,789
"EVNNPC đảm bảo cấp điện cho phát triển kinh tế, xã hội 27 tỉnh, thành phố phía Bắc",https://tienphong.vn/evnnpc-dam-bao-cap-dien-cho-phat-trien-kinh-te-xa-hoi-27-tinh-thanh-pho-phia-bac-post1329373.tpo,2021-04-19,1,919
TH tiên phong chuyển đổi số lên nền tảng quản trị hiện đại hàng đầu thế giới,https://tienphong.vn/th-tien-phong-chuyen-doi-so-len-nen-tang-quan-tri-hien-dai-hang-dau-the-gioi-post1317689.tpo,2021-03-05,1,1205
Tuổi trẻ đất Thủ mở ‘Gian hàng 0 đồng’ phục vụ dân khu vực bị phong tỏa,https://tienphong.vn/tuoi-tre-dat-thu-mo-gian-hang-0-dong-phuc-vu-dan-khu-vuc-bi-phong-toa-post1311508.tpo,2021-02-05,0,407
Hiện thực khát vọng hùng cường,https://tienphong.vn/hien-thuc-khat-vong-hung-cuong-post1308538.tpo,2021-01-26,1,1483
Eurowindow ghi danh vào Bảng xếp hạng 500 Doanh nghiệp lớn nhất Việt Nam 2020,https://tienphong.vn/eurowindow-ghi-danh-vao-bang-xep-hang-500-doanh-nghiep-lon-nhat-viet-nam-2020-post1304945.tpo,2021-01-12,1,923
"Bứt phá sau COVID-19, doanh nghiệp rót đầu tư 'khủng' chuyển đổi số",https://tienphong.vn/but-pha-sau-covid-19-doanh-nghiep-rot-dau-tu-khung-chuyen-doi-so-post1303859.tpo,2021-01-07,2,669
"Đón năm mới, ‘soi’ kết quả giáo dục năm 2020",https://tienphong.vn/don-nam-moi-soi-ket-qua-giao-duc-nam-2020-post1301973.tpo,2021-01-01,1,5056
"Thái Nguyên phấn đấu thuộc nhóm 10 tỉnh, thành dẫn đầu về chuyển đổi số",https://tienphong.vn/thai-nguyen-phan-dau-thuoc-nhom-10-tinh-thanh-dan-dau-ve-chuyen-doi-so-post1302349.tpo,2020-12-31,2,756
Việt Nam tăng tốc chuyển đổi số trong y tế,https://tienphong.vn/viet-nam-tang-toc-chuyen-doi-so-trong-y-te-post1301863.tpo,2020-12-30,1,1182
"Phải sống, không 'chết' vì du lịch",https://tienphong.vn/phai-song-khong-chet-vi-du-lich-post1301733.tpo,2020-12-30,1,1166
EVN triển khai ‘Hóa đơn tiền điện ứng dụng QR code’,https://tienphong.vn/evn-trien-khai-hoa-don-tien-dien-ung-dung-qr-code-post1296644.tpo,2020-12-10,1,957
"Viettel Cloud: Nền tảng đám mây “Make in Viettel” cho chính quyền điện tử, doanh nghiệp số",https://tienphong.vn/viettel-cloud-nen-tang-dam-may-make-in-viettel-cho-chinh-quyen-dien-tu-doanh-nghiep-so-post1294784.tpo,2020-12-03,0,595
Quỹ đầu tư VIC Partners rót vốn vào startup công nghệ Callio,https://tienphong.vn/quy-dau-tu-vic-partners-rot-von-vao-startup-cong-nghe-callio-post1294217.tpo,2020-12-01,1,282
Eurowindow - Tự hào 5 lần liên tiếp đạt Thương hiệu quốc gia,https://tienphong.vn/eurowindow-tu-hao-5-lan-lien-tiep-dat-thuong-hieu-quoc-gia-post1293298.tpo,2020-11-27,1,906
283 sản phẩm đạt Thương hiệu quốc gia Việt Nam năm 2020,https://tienphong.vn/283-san-pham-dat-thuong-hieu-quoc-gia-viet-nam-nam-2020-post1293043.tpo,2020-11-26,0,1104
Hiểu về chuyển đổi số theo cách của Thomas M. Siebel ,https://tienphong.vn/hieu-ve-chuyen-doi-so-theo-cach-cua-thomas-m-siebel-post1285590.tpo,2020-10-27,1,1002
EVN cùng một số đơn vị của ngành Điện được vinh danh Doanh nghiệp chuyển đổi số xuất sắc,https://tienphong.vn/evn-cung-mot-so-don-vi-cua-nganh-dien-duoc-vinh-danh-doanh-nghiep-chuyen-doi-so-xuat-sac-post1285433.tpo,2020-10-27,1,1055
"Số điện thoại đẹp, tên miền internet sẽ được đấu giá thế nào?",https://tienphong.vn/so-dien-thoai-dep-ten-mien-internet-se-duoc-dau-gia-the-nao-post1283719.tpo,2020-10-20,0,1178
Thường trực Ban Bí thư Trần Quốc Vượng chỉ đạo Đại hội Đảng bộ Gia Lai,https://tienphong.vn/thuong-truc-ban-bi-thu-tran-quoc-vuong-chi-dao-dai-hoi-dang-bo-gia-lai-post1277928.tpo,2020-09-28,0,992
Hé lộ về 'làn gió mới' trên thị trường Internet cáp quang!,https://tienphong.vn/he-lo-ve-lan-gio-moi-tren-thi-truong-internet-cap-quang-post1276350.tpo,2020-09-22,1,1344
Thanh tra Chính phủ kết luận vụ việc liên quan 'Vũ nhôm',https://tienphong.vn/thanh-tra-chinh-phu-ket-luan-vu-viec-lien-quan-vu-nhom-post1266180.tpo,2020-08-15,1,949
