Title,URL,Publish Date,Mentioned Times,Word Count
"Phát nhầm đề thi, bất ngờ thay đổi lịch thi môn toán kỳ khảo sát chất lượng học sinh lớp 9",/phat-nham-de-thi-bat-ngo-thay-doi-lich-thi-mon-toan-ky-khao-sat-chat-luong-hoc-sinh-lop-9-20220427090711726.htm,2022-04-27,0,857
Chủ tịch UBND TP.HCM Phan Văn Mãi: Đẩy mạnh làm nhà ở xã hội,/chu-tich-ubnd-tp-hcm-phan-van-mai-day-manh-lam-nha-o-xa-hoi-20220426175509541.htm,2022-04-26,0,1313
Quá nửa dân Đức phản đối cung cấp vũ khí hạng nặng cho Ukraine,/qua-nua-dan-duc-phan-doi-cung-cap-vu-khi-hang-nang-cho-ukraine-20220424070539294.htm,2022-04-24,0,947
Chỉ số giá nhà ở Việt Nam cao hơn 20 lần so với thu nhập trung bình,/chi-so-gia-nha-o-viet-nam-cao-hon-20-lan-so-voi-thu-nhap-trung-binh-20220420175514828.htm,2022-04-20,0,1129
Xử lý thực phẩm chức năng 'nổ' như thần dược,/xu-ly-thuc-pham-chuc-nang-no-nhu-than-duoc-20220419225531048.htm,2022-04-20,0,903
Đồng Tháp khai trương Trung tâm chuyển đổi số,/dong-thap-khai-truong-trung-tam-chuyen-doi-so-20220418120425697.htm,2022-04-18,1,838
Úc cảnh báo vấn nạn tin giả trước thềm tổng tuyển cử,/uc-canh-bao-van-nan-tin-gia-truoc-them-tong-tuyen-cu-20220418110106841.htm,2022-04-18,0,647
Không 'chia bánh' với gói hỗ trợ,/khong-chia-banh-voi-goi-ho-tro-20220416221135468.htm,2022-04-17,0,1168
Dân mạng trầm trồ người đàn ông bấm ngẫu nhiên được biển số xe ‘5 số 9’,/dan-mang-tram-tro-nguoi-dan-ong-bam-ngau-nhien-duoc-bien-so-xe-5-so-9-20220414195353735.htm,2022-04-14,0,747
Lương hưu đủ sống!,/luong-huu-du-song-20220414094704425.htm,2022-04-14,0,1039
Cảnh giác với chiêu thức tuyển dụng lao động qua mạng xã hội để lừa đảo,/canh-giac-voi-chieu-thuc-tuyen-dung-lao-dong-qua-mang-xa-hoi-de-lua-dao-20220408150442352.htm,2022-08-04,0,1226
"Từng chỉ trích Twitter giờ lại gia nhập, tỉ phú Musk sẽ làm gì với Twitter?",/tung-chi-trich-twitter-gio-lai-gia-nhap-ti-phu-musk-se-lam-gi-voi-twitter-20220407073835807.htm,2022-07-04,0,1283
"Người dân đổ dồn làm thủ tục bảo hiểm xã hội một lần, nhiều nơi quá tải",/nguoi-dan-do-don-lam-thu-tuc-bao-hiem-xa-hoi-mot-lan-nhieu-noi-qua-tai-20220406174421013.htm,2022-06-04,0,1016
Chương trình mục tiêu quốc gia cho vùng đồng bào dân tộc thiểu số ĐBSCL,/chuong-trinh-muc-tieu-quoc-gia-cho-vung-dong-bao-dan-toc-thieu-so-dbscl-20220405133813915.htm,2022-05-04,0,1020
Cầu thủ đội Nam Định lên mạng bức xúc vì chậm lương thưởng hàng tháng,/cau-thu-doi-nam-dinh-len-mang-buc-xuc-vi-cham-luong-thuong-hang-thang-20220331212751796.htm,2022-03-31,0,867
"Khẳng định Bộ nhận diện SEA Games 31 đảm bảo tính pháp lý, an ninh mạng sẽ xử lý người đăng tin sai",/khang-dinh-bo-nhan-dien-sea-games-31-dam-bao-tinh-phap-ly-an-ninh-mang-se-xu-ly-nguoi-dang-tin-sai-20220321094016846.htm,2022-03-21,0,1013
"Chấn chỉnh những hiện tượng 'cướp vợ', 'bắt vợ' phản cảm ở vùng cao",/chan-chinh-nhung-hien-tuong-cuop-vo-bat-vo-phan-cam-o-vung-cao-20220319143914393.htm,2022-03-19,0,964
Phó chủ tịch Hà Nội: Đẩy mạnh triển khai chữ ký số để giải quyết thủ tục bảo hiểm xã hội cho F0,/pho-chu-tich-ha-noi-day-manh-trien-khai-chu-ky-so-de-giai-quyet-thu-tuc-bao-hiem-xa-hoi-cho-f0-20220317190002989.htm,2022-03-17,0,1347
"'Quân xanh - quân đỏ', 'xã hội đen' đe dọa người tham gia đấu giá đất",/quan-xanh-quan-do-xa-hoi-den-de-doa-nguoi-tham-gia-dau-gia-dat-20220315140421728.htm,2022-03-15,0,1345
TP.HCM xây dựng ứng dụng trí tuệ nhân tạo để giám sát mạng xã hội,/tp-hcm-xay-dung-ung-dung-tri-tue-nhan-tao-de-giam-sat-mang-xa-hoi-20220309180639.htm,2022-09-03,1,1159
F0 chỉ cần quay video gửi trạm y tế là có giấy xác nhận hưởng BHXH,/f0-chi-can-quay-video-gui-tram-y-te-la-co-giay-xac-nhan-huong-bhxh-2022030815152251.htm,2022-08-03,0,1011
Yêu cầu Sở Lao động - thương binh và xã hội TP.HCM công khai việc nhận tiền hỗ trợ chống COVID-19,/yeu-cau-so-lao-dong-thuong-binh-va-xa-hoi-tp-hcm-cong-khai-viec-nhan-tien-ho-tro-chong-covid-19-20220307205619042.htm,2022-07-03,0,802
Chen lấn đi xin giấy xác nhận hết COVID-19 ở Đà Nẵng,/chen-lan-di-xin-giay-xac-nhan-het-covid-19-o-da-nang-20220305153128989.htm,2022-05-03,0,1059
Học sinh quận nào ở TP.HCM mắc COVID-19 nhiều nhất?,/hoc-sinh-quan-nao-o-tp-hcm-mac-covid-19-nhieu-nhat-20220304094904709.htm,2022-04-03,0,1488
Học sinh tranh tài tại 'trường thi ảo' lớn nhất 2022,/hoc-sinh-tranh-tai-tai-truong-thi-ao-lon-nhat-2022-20220303104759329.htm,2022-03-03,0,888
TP.HCM giải thể thêm bệnh viện điều trị COVID-19 và trung tâm cách ly tập trung,/tp-hcm-giai-the-them-benh-vien-dieu-tri-covid-19-va-trung-tam-cach-ly-tap-trung-20220301170301864.htm,2022-01-03,0,749
"TP.HCM có khoảng 963.000 trẻ từ 5-11 tuổi cần tiêm vắc xin, chờ Bộ Y tế ‘phát lệnh’",/tp-hcm-co-khoang-963-000-tre-tu-5-11-tuoi-can-tiem-vac-xin-cho-bo-y-te-phat-lenh-20220301104141506.htm,2022-01-03,0,1177
Cộng đồng mạng ủng hộ Ukraine gần 8 triệu USD tiền điện tử sau 1 ngày,/cong-dong-mang-ung-ho-ukraine-gan-8-trieu-usd-tien-dien-tu-sau-1-ngay-20220228174557612.htm,2022-02-28,0,837
Quản lý thị trường yêu cầu kiểm tra thuốc điều trị và bộ xét nghiệm COVID-19,/quan-ly-thi-truong-yeu-cau-kiem-tra-thuoc-dieu-tri-va-bo-kit-test-covid-19-20220223135956026.htm,2022-02-23,0,829
"Người dân TP.HCM có thể đến một số quận, huyện nhận làm hồ sơ cấp CCCD, đóng bảo hiểm trước 1-6-2022",/nguoi-dan-tp-hcm-co-the-den-mot-so-quan-huyen-nhan-lam-ho-so-cap-cccd-dong-bao-hiem-truoc-1-6-2022-20220219110416651.htm,2022-02-19,0,879
"Nhặt được 50 triệu giữa đường, người đàn ông đăng lên mạng tìm người mất để trả lại",/nhat-duoc-50-trieu-giua-duong-nguoi-dan-ong-dang-len-mang-tim-nguoi-mat-de-tra-lai-20220218113440947.htm,2022-02-18,0,967
"Lùm xùm 'bài báo quốc tế', một ứng viên giáo sư xin rút khỏi danh sách đăng ký",/lum-xum-bai-bao-quoc-te-mot-ung-vien-giao-su-xin-rut-khoi-danh-sach-dang-ky-2022021811385153.htm,2022-02-18,0,1288
Cảnh giác một số nhóm hỗ trợ tư vấn trên mạng cho F0 để bán thuốc,/canh-giac-mot-so-nhom-ho-tro-tu-van-tren-mang-cho-f0-de-ban-thuoc-20220217114020213.htm,2022-02-17,0,964
Xin điều chỉnh dự án du lịch để... bán nhà ở,/xin-dieu-chinh-du-an-du-lich-de-ban-nha-o-20220216003930697.htm,2022-02-16,0,1794
Hải Phòng: Thay đổi nhận thức để chuyển đổi số thành công,/hai-phong-thay-doi-nhan-thuc-de-chuyen-doi-so-thanh-cong-2022021209512583.htm,2022-12-02,0,1050
Mạnh dạn bình thường mới sau Tết,/manh-dan-binh-thuong-moi-sau-tet-2022021208163271.htm,2022-12-02,0,3267
Ra mắt cuốn sách mới của Tổng bí thư Nguyễn Phú Trọng,/ra-mat-cuon-sach-moi-cua-tong-bi-thu-nguyen-phu-trong-20220209140941095.htm,2022-09-02,0,1025
"COVID-19 thế giới ngày 7-2: Ca COVID-19 một số nước tăng kỷ lục, nhưng du lịch vẫn kỳ vọng hồi sinh",/covid-19-the-gioi-ngay-7-2-ca-covid-19-mot-so-nuoc-tang-ky-luc-nhung-du-lich-van-ky-vong-hoi-sinh-20220207055221719.htm,2022-07-02,0,1201
"Vô tư chào bán nanh, móng, da... hổ ngày cận Tết",/vo-tu-chao-ban-nanh-mong-da-ho-ngay-can-tet-2022012805331745.htm,2022-01-28,0,1493
Ca mắc COVID-19 tại Hàn Quốc tăng cao kỷ lục dù siết giãn cách,/ca-mac-covid-19-tai-han-quoc-tang-cao-ky-luc-du-siet-gian-cach-20220125092709977.htm,2022-01-25,0,730
Đưa mai lên mạng thay vì ra ngoài đường dựng lều bạt rồi ngồi chờ khách,/dua-mai-len-mang-thay-vi-ra-ngoai-duong-dung-leu-bat-roi-ngoi-cho-khach-20220117151035691.htm,2022-01-18,0,1346
"Đà Nẵng không ngăn sông cấm chợ, không ngăn cản người dân đi lại",/da-nang-khong-ngan-song-cam-cho-khong-ngan-can-nguoi-dan-di-lai-20220117174936933.htm,2022-01-17,0,704
Chìm đắm trong mạng xã hội như 'mua dây buộc mình' với cô đơn,/chim-dam-trong-mang-xa-hoi-nhu-mua-day-buoc-minh-voi-co-don-20220117091244297.htm,2022-01-17,0,1276
Video: Khi gen Z đánh mất chính mình trên mạng xã hội,/video-khi-gen-z-danh-mat-chinh-minh-tren-mang-xa-hoi-20220116222501384.htm,2022-01-16,0,614
Điện lực miền Nam hướng đến năm 2022 với nhiều kỳ vọng,/dien-luc-mien-nam-huong-den-nam-2022-voi-nhieu-ky-vong-20220114180332747.htm,2022-01-14,0,561
Đề xuất ‘nới’ trần giờ làm thêm tối đa 72 giờ/tháng,/de-xuat-noi-tran-gio-lam-them-toi-da-72-gio-thang-20220112112509863.htm,2022-12-01,0,1106
Xem cú đánh một tay ghi điểm khó tin ở giải Masters,/xem-cu-danh-mot-tay-ghi-diem-kho-tin-o-giai-masters-20220111102748463.htm,2022-11-01,0,651
TP.HCM nghiên cứu hỗ trợ điện thoại thông minh cho người nghèo để chuyển đổi số,/tp-hcm-nghien-cuu-ho-tro-dien-thoai-thong-minh-cho-nguoi-ngheo-de-chuyen-doi-so-20220108111123175.htm,2022-08-01,1,1316
Đề xuất chính quyền TP Thủ Đức có thẩm quyền tương đương cấp tỉnh?,/de-xuat-chinh-quyen-tp-thu-duc-co-tham-quyen-tuong-duong-cap-tinh-20220107173704112.htm,2022-07-01,0,1223
"12 hoạt động, sự kiện tiêu biểu của Đoàn năm 2021",/12-hoat-dong-su-kien-tieu-bieu-cua-doan-nam-2021-20220106102119321.htm,2022-07-01,0,1541
Mỹ lo Omicron gây gián đoạn xã hội,/my-lo-omicron-gay-gian-doan-xa-hoi-20220103225435717.htm,2022-04-01,0,1364
Công an TP.HCM: Vụ bé gái 8 tuổi bị bạo hành tử vong sẽ làm 'án điểm',/cong-an-tp-hcm-vu-be-gai-8-tuoi-bi-bao-hanh-tu-vong-se-lam-an-diem-20211231193030725.htm,2021-12-31,0,1145
Trải nghiệm thực tế ảo sẽ góp phần hồi phục du lịch,/trai-nghiem-thuc-te-ao-se-gop-phan-hoi-phuc-du-lich-20211222093508305.htm,2021-12-27,2,1317
"Tuyển sinh đại học 2022: Ưu tiên hoạt động xã hội, văn thể mỹ...",/tuyen-sinh-dai-hoc-2022-uu-tien-hoat-dong-xa-hoi-van-the-my-20211225200230571.htm,2021-12-26,0,1889
Phó Ban Tuyên giáo Trung ương Trần Thanh Lâm chỉ ra loạt bất cập trong hoạt động báo chí,/pho-ban-tuyen-giao-trung-uong-tran-thanh-lam-chi-ra-loat-bat-cap-trong-hoat-dong-bao-chi-20211224103912667.htm,2021-12-24,0,1356
Đọc báo cùng bạn 23-12: Nên xã hội hóa tiêm vắc xin từ mũi 3,/doc-bao-cung-ban-23-12-nen-xa-hoi-hoa-tiem-vac-xin-tu-mui-3-20211223024950103.htm,2021-12-23,0,462
Nếu căn cước công dân gắn chip tích hợp thêm...,/neu-can-cuoc-cong-dan-gan-chip-tich-hop-them-20211222090712918.htm,2021-12-23,2,914
"Các 'ông lớn' vừa có ý định đầu tư, cọc bêtông liền mọc tua tủa",/cac-ong-lon-vua-co-y-dinh-dau-tu-coc-be-tong-lien-moc-tua-tua-20211215164238215.htm,2021-12-17,0,1481
Gánh nặng 'chưa giàu đã già',/ganh-nang-chua-giau-da-gia-20211216073224062.htm,2021-12-16,0,1449
Chủ tịch Phan Văn Mãi: Chuyển đổi số có sứ mệnh mới hậu COVID-19,/chu-tich-phan-van-mai-chuyen-doi-so-co-su-menh-moi-hau-covid-19-20211216100452446.htm,2021-12-16,1,1267
Người khen kẻ chê việc tỉ phú Elon Musk được chọn là Nhân vật của năm 2021,/nguoi-khen-ke-che-viec-ti-phu-elon-musk-duoc-chon-la-nhan-vat-cua-nam-2021-20211214105703069.htm,2021-12-14,0,845
Khai trương trung tâm điều hành đô thị thông minh đầu tiên tại Đồng Tháp,/khai-truong-trung-tam-dieu-hanh-do-thi-thong-minh-dau-tien-tai-dong-thap-20211212161359972.htm,2021-12-12,0,852
1 triệu thẻ ePass và câu chuyện kiến tạo xã hội số của Viettel trong lĩnh vực giao thông,/1-trieu-the-epass-va-cau-chuyen-kien-tao-xa-hoi-so-cua-viettel-trong-linh-vuc-giao-thong-20211211152626194.htm,2021-11-12,2,1422
Thanh niên ASEAN góp sáng kiến đẩy lùi COVID-19,/thanh-nien-asean-gop-sang-kien-day-lui-covid-19-20211209161015838.htm,2021-09-12,0,858
Thủ tướng: Tập trung chuyển đổi số để tạo thuận lợi cho người hưởng bảo hiểm xã hội,/thu-tuong-tap-trung-chuyen-doi-so-de-tao-thuan-loi-cho-nguoi-huong-bao-hiem-xa-hoi-20211208225231667.htm,2021-08-12,0,1172
"Đọc báo cùng bạn 7-12: Cuối năm, ngăn tín dụng đen thế nào?",/doc-bao-cung-ban-7-12-cuoi-nam-ngan-tin-dung-den-the-nao-20211207050446251.htm,2021-07-12,2,419
Cổ động viên Đông Nam Á: 'Việt Nam quá mạnh so với Lào',/co-dong-vien-dong-nam-a-viet-nam-qua-manh-so-voi-lao-20211206221137386.htm,2021-06-12,0,737
"Thủ tướng: 'Muốn chuyển đổi số, công nghệ số phải có xã hội số, công dân số'",/thu-tuong-muon-chuyen-doi-so-cong-nghe-so-phai-co-xa-hoi-so-cong-dan-so-20211206131205508.htm,2021-06-12,2,1170
Dấu ấn 10 năm của Vietlott – Mới! Để tốt hơn,/dau-an-10-nam-cua-vietlott-moi-de-tot-hon-20211130235759513.htm,2021-01-12,0,1524
"700.000 người hưởng bảo hiểm xã hội 1 lần, Tổng liên đoàn Lao động lo ngại",/700-000-nguoi-huong-bao-hiem-xa-hoi-1-lan-tong-lien-doan-lao-dong-lo-ngai-20211130172410067.htm,2021-11-30,0,996
Cùng con vào thời đại số: Cẩn trọng với 'thử thách trực tuyến',/cung-con-vao-thoi-dai-so-can-trong-voi-thu-thach-truc-tuyen-20211128232959724.htm,2021-11-29,0,1871
Ngành ngân hàng mang đến lợi ích nhiều hơn cho cộng đồng nhờ… số hóa,/nganh-ngan-hang-mang-den-loi-ich-nhieu-hon-cho-cong-dong-nho-so-hoa-20211124180414639.htm,2021-11-26,0,1161
Bí quyết từ chuyên gia: Cách giúp trẻ năng động mọi lúc mọi nơi,/bi-quyet-tu-chuyen-gia-cach-giup-tre-nang-dong-moi-luc-moi-noi-20211124152518655.htm,2021-11-24,0,1665
Bà Rịa - Vũng Tàu: Tích hợp chữ ký số trên nền tảng di động vào dịch vụ công,/ba-ria-vung-tau-tich-hop-chu-ky-so-tren-nen-tang-di-dong-vao-dich-vu-cong-20211123112627246.htm,2021-11-23,2,702
Khởi động diễn đàn 'Hiến kế giải pháp công nghệ phát triển TP.HCM',/khoi-dong-dien-dan-hien-ke-giai-phap-cong-nghe-phat-trien-tp-hcm-20211122084149627.htm,2021-11-22,4,2153
"Công ty Điện lực Gia Định: số hóa trong quản lý kinh doanh, dịch vụ khách hàng",/cong-ty-dien-luc-gia-dinh-so-hoa-trong-quan-ly-kinh-doanh-dich-vu-khach-hang-20211121154123169.htm,2021-11-22,0,1929
Bắt giam cựu nhân viên bưu điện xã lừa đảo hơn 2 tỉ đồng,/bat-giam-cuu-nhan-vien-buu-dien-xa-lua-dao-hon-2-ti-dong-20211118151726287.htm,2021-11-18,0,764
"Học sinh bị cách ly trong lán trại với tấm bạt, manh chiếu: Không đúng",/hoc-sinh-bi-cach-ly-trong-lan-trai-voi-tam-bat-manh-chieu-khong-dung-2021111508434016.htm,2021-11-15,0,844
8 Rue de l'Humanité - Số 8 Đường Nhân Đạo: Trong khó khăn cần một tiếng cười,/8-rue-de-l-humanite-so-8-duong-nhan-dao-trong-kho-khan-can-mot-tieng-cuoi-20211114093323191.htm,2021-11-14,0,1392
Quảng Ninh thông qua 5 nghị quyết quan trọng,/quang-ninh-thong-qua-5-nghi-quyet-quan-trong-20211113170351668.htm,2021-11-13,0,981
Khảo sát của CNN: Đa số tin Facebook làm xã hội Mỹ xấu đi,/khao-sat-cua-cnn-da-so-tin-facebook-lam-xa-hoi-my-xau-di-20211110214933289.htm,2021-10-11,0,708
"Rà soát để hỗ trợ, dân số Bình Tân ‘đột nhiên’ tăng từ 815.000 lên 1,017 triệu người",/ra-soat-de-ho-tro-dan-so-binh-tan-dot-nhien-tang-tu-815-000-len-1-017-trieu-nguoi-20211110113636141.htm,2021-10-11,0,1342
Lấy mật khẩu vào ứng dụng bảo hiểm xã hội phải trả phí tin nhắn 1.000 đồng,/lay-mat-khau-vao-ung-dung-bao-hiem-xa-hoi-phai-tra-phi-tin-nhan-1-000-dong-20211107133604713.htm,2021-07-11,1,891
Facebook: Việt Nam sẽ có 53 triệu người tiêu dùng số vào cuối năm 2021,/facebook-viet-nam-se-co-53-trieu-nguoi-tieu-dung-so-vao-cuoi-nam-2021-20211103111621043.htm,2021-03-11,0,777
Đẩy mạnh phát triển nhân lực có kỹ năng nghề,/day-manh-phat-trien-nhan-luc-co-ky-nang-nghe-20211101194732782.htm,2021-02-11,0,1317
Vì sao tỉ phú Zuckerberg phải đổi tên Công ty Facebook?,/vi-sao-ti-phu-zuckerberg-phai-doi-ten-cong-ty-facebook-20211029092842789.htm,2021-10-29,0,913
Giả mạo nhắn tin lừa người lao động về tiền hỗ trợ từ quỹ bảo hiểm thất nghiệp,/gia-mao-nhan-tin-lua-nguoi-lao-dong-ve-tien-ho-tro-tu-quy-bao-hiem-that-nghiep-20211028172242463.htm,2021-10-28,0,726
Đẩy mạnh chuyển đổi số,/day-manh-chuyen-doi-so-20211028092327275.htm,2021-10-28,0,1690
Lạc Dương xây dựng hệ thống quản lý nông nghiệp thông minh,/lac-duong-xay-dung-he-thong-quan-ly-nong-nghiep-thong-minh-20211027183143222.htm,2021-10-27,0,1255
Xóm 'ổ chuột' giữa làng biệt thự ở Hà Nội,/xom-o-chuot-giua-lang-biet-thu-o-ha-noi-20211024222557293.htm,2021-10-25,0,1974
"Singapore giãn cách thêm 1 tháng, chi tiền hỗ trợ đến cả người bán hàng rong",/singapore-gian-cach-them-1-thang-chi-tien-ho-tro-den-ca-nguoi-ban-hang-rong-20211021082843028.htm,2021-10-21,0,934
Đọc báo cùng bạn 21-10: Vì sao học sinh 'vùng xanh' chưa trở lại trường?,/doc-bao-cung-ban-21-10-vi-sao-hoc-sinh-vung-xanh-chua-tro-lai-truong-20211021053447187.htm,2021-10-21,0,450
Vụ giá nước máy tăng gấp nhiều lần: Dawaco điều chỉnh cách tính giá nước,/vu-gia-nuoc-may-tang-gap-nhieu-lan-dawaco-dieu-chinh-cach-tinh-gia-nuoc-20211016171633783.htm,2021-10-16,0,772
Bí thư Tỉnh ủy Bến Tre: Chốt kiểm tra không được gây khó người dân,/bi-thu-tinh-uy-ben-tre-chot-kiem-tra-khong-duoc-gay-kho-nguoi-dan-2021101517442356.htm,2021-10-15,0,1207
Những ai được bổ sung nhận hỗ trợ từ gói 26.000 tỉ đồng?,/nhung-ai-duoc-bo-sung-nhan-ho-tro-tu-goi-26-000-ti-dong-20211014153318476.htm,2021-10-14,0,1140
Dịch bệnh cơ bản được kiểm soát trên phạm vi toàn quốc,/dich-benh-co-ban-duoc-kiem-soat-tren-pham-vi-toan-quoc-20211009094744617.htm,2021-09-10,0,1014
"Quay lại nhịp sống đời thường bỗng thấy bất an, 'sợ đám đông'?",/quay-lai-nhip-song-doi-thuong-bong-thay-bat-an-so-dam-dong-20211008202405038.htm,2021-09-10,0,1473
Viettel sẽ hợp tác với 16 đội tham gia Viet Solutions 2021,/viettel-se-hop-tac-voi-16-doi-tham-gia-viet-solutions-2021-20211007131428186.htm,2021-07-10,2,822
Khởi tố người kêu gọi từ thiện trên Facebook rồi ăn chặn tiền,/khoi-to-nguoi-keu-goi-tu-thien-tren-facebook-roi-an-chan-tien-20211007105118831.htm,2021-07-10,0,920
TP.HCM: Nhiều hoạt động trong Tuần lễ học tập suốt đời 2021,/tp-hcm-nhieu-hoat-dong-trong-tuan-le-hoc-tap-suot-doi-2021-2021100618321689.htm,2021-06-10,0,1026
FPT Play phát sóng trận Trung Quốc - Việt Nam trên đa nền tảng,/fpt-play-phat-song-tran-trung-quoc-viet-nam-tren-da-nen-tang-20211005221345784.htm,2021-06-10,0,1446
'Không có chuyện đoàn hàng trăm người dân đi bộ qua Tây Nguyên',/khong-co-chuyen-doan-hang-tram-nguoi-dan-di-bo-qua-tay-nguyen-20211005110006312.htm,2021-05-10,0,1188
Infographic số ca COVID-19 tại các quận huyện ở TP.HCM ngày 4-10,/infographic-so-ca-covid-19-tai-cac-quan-huyen-o-tphcm-ngay-4-10-20211004182822994.htm,2021-04-10,0,393
"TP.HCM đã tiêm 11,3 triệu liều vắc xin, hơn 60% người được tiêm mũi 2",/tp-hcm-da-tiem-11-3-trieu-lieu-vac-xin-hon-60-nguoi-duoc-tiem-mui-2-20211004102151116.htm,2021-04-10,0,799
"TP.HCM đã tiêm 10,7 triệu liều vắc xin, có 62,7% người trên 65 tuổi tiêm mũi 2",/tphcm-da-tiem-107-trieu-lieu-vac-xin-co-627-nguoi-tren-65-tuoi-tiem-mui-2-20211002131311566.htm,2021-02-10,0,952
"Thủ tướng đề nghị người dân kiềm chế, không di chuyển tự phát làm lây lan dịch bệnh",/thu-tuong-de-nghi-nguoi-dan-kiem-che-khong-di-chuyen-tu-phat-lam-lay-lan-dich-benh-20211002104559877.htm,2021-02-10,0,1129
Phụ huynh đăng ký đón con về TP.HCM như thế nào?,/phu-huynh-dang-ky-don-con-ve-tp-hcm-nhu-the-nao-20211002092459558.htm,2021-02-10,0,1237
Chàng trai đều đặn 'chia' học bổng với bệnh nhân nghèo suốt 9 năm,/chang-trai-deu-dan-chia-hoc-bong-voi-benh-nhan-ngheo-suot-9-nam-20210928211143004.htm,2021-09-29,0,1501
Vạ vật vì kẹt tại các chốt kiểm soát dịch vào tỉnh Trà Vinh,/va-vat-vi-ket-tai-cac-chot-kiem-soat-dich-vao-tinh-tra-vinh-2021092513302207.htm,2021-09-25,0,990
Bà Rịa - Vũng Tàu: Muốn ra khỏi tỉnh phải được UBND tỉnh cho phép!,/ba-ria-vung-tau-muon-ra-khoi-tinh-phai-duoc-ubnd-tinh-cho-phep-20210924142410219.htm,2021-09-24,0,1162
Tà đạo biến tướng hoạt động rầm rộ trên mạng,/ta-dao-bien-tuong-hoat-dong-ram-ro-tren-mang-20210923162321121.htm,2021-09-23,0,1168
COVID-19 đã thúc đẩy hành trình chuyển đổi số ngân hàng như thế nào?,/covid-19-da-thuc-day-hanh-trinh-chuyen-doi-so-ngan-hang-nhu-the-nao-20210923120656867.htm,2021-09-23,0,1295
MBBank đồng hành cùng cộng đồng trong công tác thiện nguyện minh bạch,/mbbank-dong-hanh-cung-cong-dong-trong-cong-tac-thien-nguyen-minh-bach-20210922134433551.htm,2021-09-22,0,1160
Học online không thể xuề xòa,/hoc-online-khong-the-xue-xoa-20210921222720738.htm,2021-09-22,0,2043
Cảnh báo tội phạm mạng nở rộ trên Telegram,/canh-bao-toi-pham-mang-no-ro-tren-telegram-2021091715480708.htm,2021-09-17,0,726
Hà Nội xem xét nới lỏng một số hoạt động dựa trên thực tế sau 15-9,/ha-noi-xem-xet-noi-long-mot-so-hoat-dong-dua-tren-thuc-te-sau-15-9-2021091419484643.htm,2021-09-14,0,890
"Vượt 1.000 ca COVID-19, Bình Phước siết chặt cửa ngõ, giãn cách nhiều nơi theo chỉ thị 16",/vuot-1-000-ca-covid-19-binh-phuoc-siet-chat-cua-ngo-gian-cach-nhieu-noi-theo-chi-thi-16-20210914131048701.htm,2021-09-14,0,949
TP.HCM chưa đạt tiêu chí giảm dịch trước ngày 15-9 ở điểm nào?,/tp-hcm-chua-dat-tieu-chi-giam-dich-truoc-ngay-15-9-o-diem-nao-20210913182607636.htm,2021-09-13,0,1395
"Không thấy nhân viên ghi chỉ số, sao vẫn có hóa đơn tiền nước?",/khong-thay-nhan-vien-ghi-chi-so-sao-van-co-hoa-don-tien-nuoc-20210913160457422.htm,2021-09-13,0,1048
"TP.HCM sẽ tiếp tục giãn cách thêm, dự kiến đến cuối tháng 9",/tp-hcm-se-tiep-tuc-gian-cach-them-du-kien-den-cuoi-thang-9-20210913163222116.htm,2021-09-13,0,2805
Phát động trực tuyến các hoạt động kỷ niệm 60 năm mở đường Hồ Chí Minh trên biển,/phat-dong-truc-tuyen-cac-hoat-dong-ky-niem-60-nam-mo-duong-ho-chi-minh-tren-bien-2021091313442124.htm,2021-09-13,0,1017
Bí thư Nguyễn Văn Nên: Nhiều khả năng thu hẹp khu vực giãn cách theo chỉ thị 16,/bi-thu-nguyen-van-nen-nhieu-kha-nang-thu-hep-khu-vuc-gian-cach-theo-chi-thi-16-20210912141929107.htm,2021-12-09,0,1212
Miền Trung vất vả chạy bão trong giãn cách,/mien-trung-vat-va-chay-bao-trong-gian-cach-20210912003345188.htm,2021-12-09,0,1623
"Phú Yên tiếp tục giãn cách xã hội theo chỉ thị 15, 16",/phu-yen-tiep-tuc-gian-cach-xa-hoi-theo-chi-thi-15-16-20210911173128222.htm,2021-11-09,0,744
"Kẻ thua bạc 'sắm hai vai' gây ra 14 vụ lừa đảo, chiếm đoạt 3 tỉ đồng",/ke-thua-bac-sam-hai-vai-gay-ra-14-vu-lua-dao-chiem-doat-3-ti-dong-20210911145553233.htm,2021-11-09,0,1142
"Từ ngày 12-9, Phan Thiết kiểm soát người và phương tiện ra vào trung tâm như thế nào?",/tu-ngay-12-9-phan-thiet-kiem-soat-nguoi-va-phuong-tien-ra-vao-trung-tam-nhu-the-nao-20210911091741113.htm,2021-11-09,0,1029
Bạn trẻ khắp nơi chuẩn bị sống 'bình thường mới',/ban-tre-khap-noi-chuan-bi-song-binh-thuong-moi-20210910210451786.htm,2021-11-09,0,1451
"TP.HCM dự kiến thí điểm thẻ xanh, thẻ vàng COVID-19",/tphcm-du-kien-thi-diem-the-xanh-the-vang-covid-19-20210910201313696.htm,2021-10-09,0,1549
EuroCham: Chính sách '3 tại chỗ' cần được tinh chỉnh,/eurocham-chinh-sach-3-tai-cho-can-duoc-tinh-chinh-2021091015253697.htm,2021-10-09,0,932
NovaWorld Phan Thiet tham gia Sáng kiến Liên Hiệp Quốc,/novaworld-phan-thiet-tham-gia-sang-kien-lien-hiep-quoc-20210909220622991.htm,2021-10-09,0,1440
Dùng tài khoản cá nhân quyên tiền từ thiện: Pháp luật quy định thế nào?,/dung-tai-khoan-ca-nhan-quyen-tien-tu-thien-phap-luat-quy-dinh-the-nao-20210908104356493.htm,2021-08-09,0,1705
"Nguy cơ tổn thương gan do tùy tiện dùng thuốc hạ sốt, giảm đau",/nguy-co-ton-thuong-gan-do-tuy-tien-dung-thuoc-ha-sot-giam-dau-20210908011046334.htm,2021-08-09,0,1800
Bình Phước giãn cách huyện Chơn Thành và Bù Đăng theo chỉ thị 16 trong 15 ngày,/binh-phuoc-gian-cach-huyen-chon-thanh-va-bu-dang-theo-chi-thi-16-trong-15-ngay-20210908080902217.htm,2021-08-09,0,728
"Khởi tố quản lý, bảo vệ khách sạn ở phố cổ Hà Nội cho khách mua bán dâm giữa mùa dịch",/khoi-to-quan-ly-bao-ve-khach-san-o-pho-co-ha-noi-cho-khach-mua-ban-dam-giua-mua-dich-2021090620575631.htm,2021-06-09,0,780
"Thị trường ảm đạm, Yamaha và Honda làm mới sản phẩm xe máy tại Việt Nam",/thi-truong-am-dam-yamaha-va-honda-lam-moi-san-pham-xe-may-tai-viet-nam-20210906094821281.htm,2021-06-09,0,777
Hát mừng Quốc khánh từ bệnh viện dã chiến: 'Chưa bao giờ 'gần' khán giả như thế',/hat-mung-quoc-khanh-tu-benh-vien-da-chien-chua-bao-gio-gan-khan-gia-nhu-the-20210902075129188.htm,2021-02-09,0,1028
