Title,URL,Publish Date,Mentioned Times,Word Count
Kỳ vọng công nghệ cải thiện thói quen đọc sách,/ky-vong-cong-nghe-cai-thien-thoi-quen-doc-sach-2021041910105353.htm,2021-04-19,0,1213
Ngăn 'cơn sóng' bạo lực học đường,/ngan-con-song-bao-luc-hoc-duong-20210417101627363.htm,2021-04-17,0,916
Đề xuất chế độ cho những người cần bảo vệ khẩn cấp,/de-xuat-che-do-cho-nhung-nguoi-can-bao-ve-khan-cap-20210413103331895.htm,2021-04-13,0,931
Khởi tố 3 người trong đường dây đưa người vượt biên qua Campuchia 'tìm việc lương cao',/khoi-to-3-nguoi-trong-duong-day-dua-nguoi-vuot-bien-qua-campuchia-tim-viec-luong-cao-20210409153828679.htm,2021-09-04,0,911
"Khởi tố 6 bị can lừa đảo, chiếm đoạt tiền tỉ các quý bà đơn thân",/khoi-to-6-bi-can-lua-dao-chiem-doat-tien-ti-cac-quy-ba-don-than-2021040515570865.htm,2021-05-04,0,1018
Thời hạn vay vốn ưu đãi mua nhà ở xã hội tối đa 25 năm,/thoi-han-vay-von-uu-dai-mua-nha-o-xa-hoi-toi-da-25-nam-20210405143824721.htm,2021-05-04,0,657
Chủ tịch UBND TP.HCM Nguyễn Thành Phong: Quận 1 phải đi đầu chuyển đổi số,/chu-tich-ubnd-tphcm-nguyen-thanh-phong-quan-1-phai-di-dau-chuyen-doi-so-20210402203654504.htm,2021-02-04,1,973
"Ukraine: Nhiều xe tăng, khí tài quân sự Nga áp sát biên giới, Mỹ cảnh báo Matxcơva",/ukraine-nhieu-xe-tang-khi-tai-quan-su-nga-ap-sat-bien-gioi-my-canh-bao-matxcova-20210402055136419.htm,2021-02-04,0,1064
Số người tham gia bảo hiểm xã hội tự nguyện tại Việt Nam còn quá thấp,/so-nguoi-tham-gia-bao-hiem-xa-hoi-tu-nguyen-tai-viet-nam-con-qua-thap-20210331124222392.htm,2021-03-31,0,914
'Quái xế' thời 4.0 lên mạng rủ rê đi 'bão đêm' công khai: 'Tao chơi nè',/quai-xe-thoi-4-0-len-mang-ru-re-di-bao-dem-cong-khai-tao-choi-ne-20210330075355928.htm,2021-03-30,0,1474
Đổi thẻ bảo hiểm y tế ra sao từ 1-4?,/doi-the-bao-hiem-y-te-ra-sao-tu-1-4-20210329222619399.htm,2021-03-30,0,897
"GDP quý 1 tăng 4,48%",/gdp-quy-1-tang-4-48-202103291110225.htm,2021-03-29,0,983
Thủ tướng chỉ đạo xử lý các vấn đề để ‘trái tim cả nước’ mạnh khỏe,/thu-tuong-chi-dao-xu-ly-cac-van-de-de-trai-tim-ca-nuoc-manh-khoe-20210328180728804.htm,2021-03-28,0,1312
TP.HCM: Nêu tên 2 bệnh nhân khám bảo hiểm y tế trên 50 lần,/tp-hcm-neu-ten-2-benh-nhan-kham-bao-hiem-y-te-tren-50-lan-20210325181504715.htm,2021-03-25,0,559
Làm rõ việc bệnh viện chỉ cho bệnh nhân khám 1 chuyên khoa trong ngày,/lam-ro-viec-benh-vien-chi-cho-benh-nhan-kham-1-chuyen-khoa-trong-ngay-20210324122705607.htm,2021-03-24,0,711
"Mâu thuẫn chuyện đi đường, nam thanh niên bị ăn đòn vì hỏi 'có việc gì đấy?'",/mau-thuan-chuyen-di-duong-nam-thanh-nien-bi-an-don-vi-hoi-co-viec-gi-day-20210321165825902.htm,2021-03-21,0,1021
Số ca mắc COVID-19 tại Israel tiếp tục giảm nhờ hiệu quả tiêm vaccine,/so-ca-mac-covid-19-tai-israel-tiep-tuc-giam-nho-hieu-qua-tiem-vaccine-20210316135245199.htm,2021-03-16,0,614
Hải Dương tiếp tục giãn cách xã hội đến hết tháng 3,/hai-duong-tiep-tuc-gian-cach-xa-hoi-den-het-thang-3-20210316093750966.htm,2021-03-16,0,1175
"Từ 20-3, phải dành tối thiểu 1/3 diện tích kinh doanh cho người tái định cư thuê",/tu-20-3-phai-danh-toi-thieu-1-3-dien-tich-kinh-doanh-cho-nguoi-tai-dinh-cu-thue-20210314114008472.htm,2021-03-14,0,798
"Dự án đường vành đai ở TP.HCM, Hà Nội: Khi nào 'hồi sinh'?",/du-an-duong-vanh-dai-o-tp-hcm-ha-noi-khi-nao-hoi-sinh-20210314082752059.htm,2021-03-14,0,3514
Viettel IDC tiên phong giải quyết các vấn đề của xã hội thời đại số,/viettel-idc-tien-phong-giai-quyet-cac-van-de-cua-xa-hoi-thoi-dai-so-20210313172748559.htm,2021-03-13,0,1425
Đọc báo cùng bạn 9-3: Khởi động chiến dịch tiêm chủng quy mô nhất,/doc-bao-cung-ban-9-3-khoi-dong-chien-dich-tiem-chung-quy-mo-nhat-20210309041126813.htm,2021-09-03,0,429
"Mê 'chắc trúng 100%', đặt cược hơn 140 triệu đồng rồi phải đi báo... công an",/me-chac-trung-100-dat-cuoc-hon-140-trieu-dong-roi-phai-di-bao-cong-an-20210305195451939.htm,2021-05-03,0,903
Tạm dừng hoạt động tất cả chốt kiểm soát dịch nội tỉnh Quảng Ninh,/tam-dung-hoat-dong-tat-ca-chot-kiem-soat-dich-noi-tinh-quang-ninh-20210302155732526.htm,2021-02-03,0,1126
Nữ tu quỳ xin cảnh sát Myanmar ngừng trấn áp người biểu tình,/nu-tu-quy-xin-canh-sat-myanmar-ngung-tran-ap-nguoi-bieu-tinh-20210301160712079.htm,2021-01-03,0,885
"Thủ tướng: Phân phối vắc xin công bằng, minh bạch, một số nơi được xã hội hóa",/thu-tuong-phan-phoi-vac-xin-cong-bang-minh-bach-mot-so-noi-duoc-xa-hoi-hoa-20210225181302594.htm,2021-02-25,0,968
"7 người ở Hà Nội bị phạt 52,5 triệu đồng vì đưa tin vịt về COVID-19",/7-nguoi-o-ha-noi-bi-phat-52-5-trieu-dong-vi-dua-tin-vit-ve-covid-19-20210208191141802.htm,2021-08-02,0,927
"Hà Nội nóng COVID-19, Bộ trưởng Y tế 'nóng ruột' muốn làm việc với Hà Nội",/ha-noi-nong-covid-19-bo-truong-y-te-nong-ruot-muon-lam-viec-voi-ha-noi-20210201170828471.htm,2021-01-02,0,1121
COVID-19 'bộc lộ một cách tàn bạo' khoảng cách công nghệ,/covid-19-boc-lo-mot-cach-tan-bao-khoang-cach-cong-nghe-20210130095000451.htm,2021-01-30,0,1596
Nhiều người Việt tin cuộc sống sẽ trở lại bình thường vào cuối năm 2021,/nhieu-nguoi-viet-tin-cuoc-song-se-tro-lai-binh-thuong-vao-cuoi-nam-2021-20210129200457851.htm,2021-01-29,0,891
TP.HCM đề xuất chi thêm 1.000 tỉ đồng sau khi thông tuyến bảo hiểm y tế,/de-xuat-chi-them-1-000-ti-dong-sau-khi-thong-tuyen-bao-hiem-y-te-20210121135012795.htm,2021-01-21,0,606
Nhạc sĩ Trần Tiến: 'Tôi chưa chết mà sao lại rủa cho tôi chết?',/nhac-si-tran-tien-toi-chua-chet-ma-sao-lai-rua-cho-toi-chet-20210119112427141.htm,2021-01-19,0,729
Nhà Trắng công bố 603 thành tựu của chính quyền ông Trump,/nha-trang-cong-bo-603-thanh-tuu-cua-chinh-quyen-ong-trump-20210118182257524.htm,2021-01-18,0,1062
Cơ hội đầu tư hấp dẫn với căn hộ giá tầm trung tại khu Tây Nam TP.HCM,/co-hoi-dau-tu-hap-dan-voi-can-ho-gia-tam-trung-tai-khu-tay-nam-tphcm-20210114101310367.htm,2021-01-14,0,1033
Hỗ trợ báo chí tăng tốc chuyển đổi số trong năm 2021,/ho-tro-bao-chi-tang-toc-chuyen-doi-so-trong-nam-2021-20210112171230239.htm,2021-12-01,0,977
Hàn Quốc tuyên bố chặn được đợt bùng dịch thứ 3,/han-quoc-tuyen-bo-chan-duoc-dot-bung-dich-thu-3-20210103204205788.htm,2021-03-01,0,756
Trợ cấp hằng tháng đối với Bà mẹ Việt Nam anh hùng bằng 3 lần mức chuẩn,/tro-cap-hang-thang-doi-voi-ba-me-viet-nam-anh-hung-bang-3-lan-muc-chuan-20201231104131275.htm,2020-12-31,0,946
"Chuyển đổi số để thay đổi thói quen, suy nghĩ, cách làm trong y tế",/chuyen-doi-so-de-thay-doi-thoi-quen-suy-nghi-cach-lam-trong-y-te-20201230153712607.htm,2020-12-30,1,1164
Lại cần chung tay,/lai-can-chung-tay-20201230075338639.htm,2020-12-30,0,914
"6.000 học sinh dự tư vấn tuyển sinh tại Hải Phòng: Kinh tế số, nên học ngành nào?",/6-000-hoc-sinh-du-tu-van-tuyen-sinh-tai-hai-phong-kinh-te-so-nen-hoc-nganh-nao-2020122709434352.htm,2020-12-27,0,1429
"Người Mỹ mua tới 21 triệu khẩu súng trong năm 2020, vì sao?",/nguoi-my-mua-toi-21-trieu-khau-sung-trong-nam-2020-vi-sao-20201224165054306.htm,2020-12-24,0,822
Một thanh niên lừa cả trăm 'phi công' đăng ký 'phục vụ' phụ nữ lớn tuổi,/mot-thanh-nien-lua-ca-tram-phi-cong-dang-ky-phuc-vu-phu-nu-lon-tuoi-20201224161625647.htm,2020-12-24,0,652
Cát Tường Group - rộn rã nhịp sống mùa lễ hội,/cat-tuong-group-ron-ra-nhip-song-mua-le-hoi-20201216225920835.htm,2020-12-17,0,1407
'Bệnh nhân cô đơn' đã lừa các trung tâm bảo trợ xã hội như thế nào?,/benh-nhan-co-don-da-lua-cac-trung-tam-bao-tro-xa-hoi-nhu-the-nao-20201216183327585.htm,2020-12-16,0,1363
"Số ca COVID-19 tăng cao nhất trong 9 tháng, Hàn Quốc nâng mức giãn cách xã hội",/so-ca-covid-19-tang-cao-nhat-trong-9-thang-han-quoc-nang-muc-gian-cach-xa-hoi-20201206140313074.htm,2020-06-12,0,727
Người tham gia bảo hiểm xã hội tự nguyện tăng nhanh,/nguoi-tham-gia-bao-hiem-xa-hoi-tu-nguyen-tang-nhanh-2020120218314906.htm,2020-02-12,0,902
Đóng hơn 1 triệu coi trực tiếp hình ảnh nhạy cảm của khách hàng tại các spa làm đẹp?,/dong-hon-1-trieu-coi-truc-tiep-hinh-anh-nhay-cam-cua-khach-hang-tai-cac-spa-lam-dep-20201130220407884.htm,2020-01-12,0,2012
Cà Mau: Bệnh viện và đối tác lời to vì thu theo 'mức giá tạm thời',/ca-mau-benh-vien-va-doi-tac-loi-to-vi-thu-theo-muc-gia-tam-thoi-202011291702333.htm,2020-11-29,0,962
"Tra cứu, theo dõi ra sao để đảm bảo tiền bảo hiểm an toàn?",/tra-cuu-theo-doi-ra-sao-de-dam-bao-tien-bao-hiem-an-toan-20201126165702438.htm,2020-11-27,2,687
Ngân hàng Thế giới và Chính phủ Úc sẽ hỗ trợ Việt Nam thanh toán không dùng tiền mặt,/ngan-hang-the-gioi-va-chinh-phu-uc-se-ho-tro-viet-nam-thanh-toan-khong-dung-tien-mat-20201125115655853.htm,2020-11-25,0,1154
"Tràn lan app phi pháp với đủ kiểu 'bán thân', livestream khiêu dâm",/tran-lan-app-phi-phap-voi-du-kieu-ban-than-livestream-khieu-dam-20201124074842556.htm,2020-11-24,1,1853
"Nữ sinh Thanh Hóa bị 'đánh hội đồng', bạn bè xung quanh hò reo quay clip",/nu-sinh-thanh-hoa-bi-danh-hoi-dong-ban-be-xung-quanh-ho-reo-quay-clip-20201118231154552.htm,2020-11-18,0,715
Thủ tướng yêu cầu phổ cập các ứng dụng số ‘có lợi cho người dân’,/thu-tuong-yeu-cau-pho-cap-cac-ung-dung-so-co-loi-cho-nguoi-dan-20201116193058124.htm,2020-11-16,3,792
Ông Trump khoe đã có 73 triệu phiếu hợp lệ bầu cho ông,/ong-trump-khoe-da-co-73-trieu-phieu-hop-le-bau-cho-ong-20201112121141853.htm,2020-12-11,0,960
Việt Nam cần xây dựng xa lộ cáp quang biển lớn hướng đến mục tiêu kiến tạo xã hội số,/viet-nam-can-xay-dung-xa-lo-cap-quang-bien-lon-huong-den-muc-tieu-kien-tao-xa-hoi-so-20201112085241756.htm,2020-12-11,2,1584
Viettel: Doanh nghiệp xuất sắc trong xây dựng và thực hành văn hoá doanh nghiệp,/viettel-doanh-nghiep-xuat-sac-trong-xay-dung-va-thuc-hanh-van-hoa-doanh-nghiep-20201111152934438.htm,2020-12-11,3,752
"Chỉ tiêu tăng trưởng năm 2021 là 6%, GDP bình quân đầu người 3.700 USD",/quoc-hoi-giao-chi-tieu-tang-truong-nam-2021-6-gdp-binh-quan-dau-nguoi-3700-usd-20201111083914387.htm,2020-11-11,0,1105
Twitter cảnh báo: Chưa nên gọi ông Biden là ‘tổng thống đắc cử’,/twitter-canh-bao-chua-nen-goi-ong-biden-la-tong-thong-dac-cu-20201107070328806.htm,2020-07-11,0,898
"Ứng dụng số tra cứu đóng bao nhiêu tiền bảo hiểm, được thụ hưởng ra sao...",/ung-dung-so-tra-cuu-dong-bao-nhieu-tien-bao-hiem-duoc-thu-huong-ra-sao-20201105194233194.htm,2020-05-11,2,655
"Sửa nhà, khám bệnh cho bà con vùng bão lũ",/sua-nha-kham-benh-cho-ba-con-vung-bao-lu-20201103193655757.htm,2020-04-11,0,1288
Bộ trưởng Phùng Xuân Nhạ giải thích giá sách lớp 1 mới gấp đôi bộ cũ ra sao?,/bo-truong-phung-xuan-nha-giai-thich-gia-sach-lop-1-moi-gap-doi-bo-cu-ra-sao-20201103171538154.htm,2020-03-11,0,1012
"Sống lệ thuộc công nghệ, nhiều người Hàn Quốc cần 'thải độc kỹ thuật số'",/song-le-thuoc-cong-nghe-nhieu-nguoi-han-quoc-can-thai-doc-ky-thuat-so-20201030135944824.htm,2020-10-30,0,1384
Thông tin người dân bị kẹt tại bè nuôi trồng thủy sản ở Đầm Môn sai sự thật,/thong-tin-nguoi-dan-bi-ket-tai-be-nuoi-trong-thuy-san-o-dam-mon-sai-su-that-20201028123311657.htm,2020-10-28,0,674
EU phát hành trái phiếu xã hội đầu tiên,/eu-phat-hanh-trai-phieu-xa-hoi-dau-tien-20201023140139154.htm,2020-10-23,0,651
Nước Mỹ đối mặt làn sóng dịch bệnh COVID-19 thứ ba,/nuoc-my-doi-mat-lan-song-dich-benh-covid-19-thu-ba-20201020101647696.htm,2020-10-20,0,724
Nhật Bản: Giãn cách xã hội giúp gia tăng doanh số bán nhạc cụ,/nhat-ban-gian-cach-xa-hoi-giup-gia-tang-doanh-so-ban-nhac-cu-20201019144808336.htm,2020-10-19,0,807
Gánh 'giữ chồng' trĩu nặng vai...,/ganh-giu-chong-triu-nang-vai-20201017085733097.htm,2020-10-17,0,2052
Gần 70% doanh nghiệp TP.HCM đang gặp khó khăn,/gan-70-doanh-nghiep-tp-hcm-dang-gap-kho-khan-20201014191029382.htm,2020-10-14,0,800
Trên 31% người lao động tham gia bảo hiểm xã hội,/tren-31-nguoi-lao-dong-tham-gia-bao-hiem-xa-hoi-20201014182123707.htm,2020-10-14,0,668
Bệnh viện Đa khoa Thanh Vũ Medic Bạc Liêu:  Hợp tác tiến tới mô hình bệnh viện thông minh,/benh-vien-da-khoa-thanh-vu-medic-bac-lieu-hop-tac-tien-toi-mo-hinh-benh-vien-thong-minh-20201014135946409.htm,2020-10-14,0,1561
Ecopark ủng hộ đồng bào nghèo miền Trung 5 tỉ đồng khắc phục hậu quả bão lũ,/ecopark-ung-ho-dong-bao-ngheo-mien-trung-5-ti-dong-khac-phuc-hau-qua-bao-lu-20201013165826324.htm,2020-10-13,0,833
Đề xuất kéo dài thời gian hỗ trợ cho doanh nghiệp bị ảnh hưởng bởi dịch COVID-19,/de-xuat-keo-dai-thoi-gian-ho-tro-cho-doanh-nghiep-bi-anh-huong-boi-dich-covid-19-2020100916403888.htm,2020-09-10,0,1145
"Twitter gỡ các bài trù ẻo ông Trump chết, nghị sĩ Dân Chủ hỏi sao bài trù Obama không gỡ?",/twitter-go-cac-bai-tru-eo-ong-trump-chet-nghi-si-dan-chu-hoi-sao-bai-tru-obama-khong-go-20201006063536195.htm,2020-06-10,0,972
"Xuân Trình trở lại, kịch phản biện xã hội thắng thế",/xuan-trinh-tro-lai-kich-phan-bien-xa-hoi-thang-the-20201005091859889.htm,2020-05-10,0,1382
Thứ trưởng Nguyễn Đình Toàn xin lỗi người dân Quảng Bình,/thu-truong-nguyen-dinh-toan-xin-loi-nguoi-dan-quang-binh-20200930164728835.htm,2020-09-30,0,608
TP.HCM: Khai mạc tuần lễ hưởng ứng học tập suốt đời,/tphcm-khai-mac-tuan-le-huong-ung-hoc-tap-suot-doi-20200930110538671.htm,2020-09-30,0,753
"Hàng ngàn doanh nghiệp bán buôn, bán lẻ rời thị trường",/hang-ngan-doanh-nghiep-ban-buon-ban-le-roi-thi-truong-20200925161459738.htm,2020-09-28,0,985
"Rao bán ổi 'sỉ lẻ' qua mạng, một phụ nữ bị đánh thuốc mê cướp rất nhiều vòng vàng",/rao-ban-oi-si-le-qua-mang-mot-phu-nu-bi-danh-thuoc-me-cuop-rat-nhieu-vong-vang-20200921170201418.htm,2020-09-21,0,849
Emmy lạ thường thời COVID-19: Nhiều nghệ sĩ nhận giải ở cửa nhà mình,/emmy-la-thuong-thoi-covid-19-nhieu-nghe-si-nhan-giai-o-cua-nha-minh-20200921093738736.htm,2020-09-21,0,1234
"Bị soi mói, chỉ trích vì là... Bùi Tiến Dũng",/bi-soi-moi-chi-trich-vi-la-bui-tien-dung-20200917144443298.htm,2020-09-17,0,1035
Tìm lại được điện thoại bị mất thì thấy toàn hình 'tự sướng' của... khỉ,/tim-lai-duoc-dien-thoai-bi-mat-thi-thay-toan-hinh-tu-suong-cua-khi-20200916110733363.htm,2020-09-16,0,822
Bồi đắp lòng tin,/boi-dap-long-tin-20200915075848362.htm,2020-09-15,0,937
"Mạo danh bảo hiểm xã hội lừa tiền qua đầu số 0555.., 8009...",/mao-danh-bao-hiem-xa-hoi-lua-tien-qua-dau-so-0555-8009-20200914180446885.htm,2020-09-14,0,859
Chính phủ Pháp trả 84% lương cho bố mẹ ở nhà trông con nghỉ học tránh COVID-19,/chinh-phu-phap-tra-84-luong-cho-bo-me-o-nha-trong-con-nghi-hoc-tranh-covid-19-20200914140243879.htm,2020-09-14,0,839
Kết quả xét xử một số vụ án ‘chưa được dư luận xã hội đồng tình’,/ket-qua-xet-xu-mot-so-vu-an-chua-duoc-du-luan-xa-hoi-dong-tinh-20200914103959051.htm,2020-09-14,0,1453
CNN tố người ủng hộ ông Trump ở Nevada không tuân thủ giãn cách xã hội,/cnn-to-nguoi-ung-ho-ong-trump-o-nevada-khong-tuan-thu-gian-cach-xa-hoi-20200913093420833.htm,2020-09-13,0,839
Khánh Hòa bỏ giãn cách xã hội từ 0h ngày 5-9,/khanh-hoa-bo-gian-cach-xa-hoi-tu-0h-ngay-5-9-20200904183318022.htm,2020-04-09,0,689
"Hào quang mặt trời xuất hiện giữa trưa, người dân thích thú 'khoe' trên mạng",/hao-quang-mat-troi-xuat-hien-giua-trua-nguoi-dan-thich-thu-khoe-tren-mang-20200824135053388.htm,2020-08-24,0,560
80% dân Đông Nam Á lạc quan tin mình an toàn khi online mùa dịch,/80-dan-dong-nam-a-lac-quan-tin-minh-an-toan-khi-online-mua-dich-20200819121451318.htm,2020-08-19,0,794
ĐH Quốc gia TP.HCM dời thi đánh giá năng lực đến ngày 30-8,/dh-quoc-gia-tp-hcm-doi-thi-danh-gia-nang-luc-den-ngay-30-8-20200812151507979.htm,2020-12-08,0,826
Trường Đại học Tây Đô chung tay phòng chống dịch COVID-19,/truong-dai-hoc-tay-do-chung-tay-phong-chong-dich-covid-19-2020081118011904.htm,2020-12-08,0,978
Tổ chức thi tốt nghiệp THPT trong tình huống đặc biệt,/to-chuc-thi-tot-nghiep-thpt-trong-tinh-huong-dac-biet-20200804094945008.htm,2020-04-08,0,2060
Thái Lan dọa xử Facebook vì để dịch tự động sai về hoàng gia,/thai-lan-doa-xu-facebook-vi-de-dich-tu-dong-sai-ve-hoang-gia-20200803233428946.htm,2020-03-08,0,726
Mở rộng xét nghiệm COVID-19 thế nào?,/mo-rong-xet-nghiem-covid-19-the-nao-20200803090215004.htm,2020-03-08,0,839
"Thủ tướng: TP.HCM chưa nên giãn cách xã hội, đồng ý đưa 400 người kẹt ở Đà Nẵng về địa phương",/thu-tuong-tp-hcm-chua-nen-gian-cach-xa-hoi-dong-y-dua-400-nguoi-ket-o-da-nang-ve-dia-phuong-2020080216291569.htm,2020-02-08,0,3525
Hàng trăm tê giác được cứu khỏi bọn săn trộm nhờ các biện pháp phong tỏa,/hang-tram-te-giac-duoc-cuu-khoi-bon-san-trom-nho-cac-bien-phap-phong-toa-20200802140549919.htm,2020-02-08,0,616
Giãn cách: 'Quảng Nam cố lên nghe',/gian-cach-quang-nam-co-len-nghe-20200802104850293.htm,2020-02-08,0,1051
Mai Linh bị tung tin lập đội taxi phục vụ khách nói tiếng Hoa,/mai-linh-bi-tung-tin-lap-doi-taxi-phuc-vu-khach-noi-tieng-hoa-20200728212541659.htm,2020-07-28,0,794
Đà Nẵng tăng cấp độ chống dịch lên toàn thành phố,/da-nang-tang-cap-do-chong-dich-len-toan-thanh-pho-20200728103544934.htm,2020-07-28,0,740
"Trước giờ cách ly Đà Nẵng, khách đi máy bay giảm, đường bộ tăng",/truoc-gio-cach-ly-da-nang-khach-di-may-bay-giam-duong-bo-tang-20200727223624029.htm,2020-07-27,0,875
Indonesia vượt 100.000 ca nhiễm sau 1 tháng thiết lập 'bình thường mới',/indonesia-vuot-100000-ca-nhiem-sau-1-thang-thiet-lap-binh-thuong-moi-2020072720182759.htm,2020-07-27,0,1063
Đà Nẵng sẽ 'cách ly xã hội' thế nào từ 0h ngày 28-7?,/da-nang-se-cach-ly-xa-hoi-the-nao-tu-0h-ngay-28-7-20200727172441642.htm,2020-07-27,0,1084
"Dễ dãi trước ống kính, phiền lắm đấy!",/de-dai-truoc-ong-kinh-phien-lam-day-20200726103051618.htm,2020-07-26,0,1355
Giám đốc Sở Nội vụ TP.HCM thông tin việc cán bộ bị khởi tố,/bo-nhiem-can-bo-co-so-ho-vi-chua-lay-y-kien-bo-cong-an-20200723150900285.htm,2020-07-23,0,663
Zombie: Dòng phim thây ma xác sống kinh sợ tại sao lại 'quyến rũ' đến thế?,/zombie-dong-phim-thay-ma-xac-song-kinh-so-tai-sao-lai-quyen-ru-den-the-20200723093234847.htm,2020-07-23,0,1815
Khổ vì mua nhầm nhà ở xã hội cho thuê,/kho-vi-mua-nham-nha-o-xa-hoi-cho-thue-20200723082548152.htm,2020-07-23,0,1283
Chương trình 'Tư duy thời đại số' của Facebook dạy gì ở Việt Nam?,/chuong-trinh-tu-duy-thoi-dai-so-cua-facebook-day-gi-o-viet-nam-20200722152558826.htm,2020-07-22,0,594
Hơn 55% thí sinh thi khoa học xã hội: Xét tuyển sẽ khó khăn?,/hon-55-thi-sinh-thi-khoa-hoc-xa-hoi-xet-tuyen-se-kho-khan-20200721221552931.htm,2020-07-22,0,1430
Các nước hồi hộp chờ số phận VCK U19 châu Á 2020,/cac-nuoc-hoi-hop-cho-so-phan-vck-u19-chau-a-2020-20200716101158713.htm,2020-07-16,0,732
Hàn Quốc tổ chức tang lễ trực tuyến cho cố thị trưởng Seoul,/han-quoc-to-chuc-tang-le-truc-tuyen-cho-co-thi-truong-seoul-20200712211737363.htm,2020-12-07,0,749
Hà Nội đo độ hài lòng của người dân về sự phục vụ của 50 đơn vị,/ha-noi-do-do-hai-long-cua-nguoi-dan-ve-su-phuc-vu-cua-50-don-vi-20200709154628847.htm,2020-09-07,0,864
"Không cho 41 học sinh học tiếp sau lùm xùm học phí, Trường Việt Úc nói gì?",/khong-cho-41-hoc-sinh-hoc-tiep-sau-lum-xum-hoc-phi-truong-viet-uc-noi-gi-20200703220415783.htm,2020-04-07,0,895
Một thành phố Hàn Quốc lại siết giãn cách xã hội khi số ca mới tăng cao,/mot-thanh-pho-han-quoc-lai-siet-gian-cach-xa-hoi-khi-so-ca-moi-tang-cao-20200703102226356.htm,2020-03-07,0,891
Thủ tướng Ấn Độ 'nghỉ chơi' mạng Weibo của Trung Quốc,/thu-tuong-an-do-nghi-choi-mang-weibo-cua-trung-quoc-2020070211490352.htm,2020-02-07,0,759
"7,8 triệu người mất việc, nghỉ luân phiên do dịch bệnh",/7-8-trieu-nguoi-mat-viec-nghi-luan-phien-do-dich-benh-20200629151855254.htm,2020-06-29,0,1398
Ông chủ Facebook mất hơn 7 tỉ USD vì bị tẩy chay quảng cáo,/ong-chu-facebook-mat-hon-7-ti-do-vi-bi-tay-chay-quang-cao-20200628115350486.htm,2020-06-28,0,898
"Tuổi thơ, nhớ mùi mồ hôi của má",/tuoi-tho-nho-mui-mo-hoi-cua-ma-20200627210747303.htm,2020-06-28,0,1068
Trường nghề đang khởi sắc thì... gặp dịch,/truong-nghe-dang-khoi-sac-thi-gap-dich-20200623201728111.htm,2020-06-24,0,1270
"Trường nghề khó khăn do COVID-19, 5 tháng tuyển chưa được 25% chỉ tiêu 2020",/truong-nghe-kho-khan-do-covid-19-5-thang-tuyen-chua-duoc-25-chi-tieu-2020-20200623085327663.htm,2020-06-23,0,962
Đừng vô tư giữ 'hàng nóng',/dung-vo-tu-giu-hang-nong-2020062220020749.htm,2020-06-23,0,1186
Phá đường dây mua bán linh kiện súng săn lậu trên mạng xã hội,/bat-duong-day-mua-ban-linh-kien-sung-san-lau-tren-mang-xa-hoi-20200622124357167.htm,2020-06-22,0,846
Sinh viên bị lừa khi đi tìm việc nhẹ lương cao,/sinh-vien-bi-lua-khi-di-tim-viec-nhe-luong-cao-20200618222341192.htm,2020-06-19,0,1571
Thi tốt nghiệp THPT hai môn tổ hợp trong một buổi,/thi-tot-nghiep-thpt-hai-mon-to-hop-trong-mot-buoi-20200617100548869.htm,2020-06-17,0,798
'Người dân tộc đang thưa vắng dần những bộ quần áo truyền thống',/nguoi-dan-toc-dang-thua-vang-dan-nhung-bo-quan-ao-truyen-thong-20200612175104773.htm,2020-12-06,0,1501
"Rộng mở cơ hội cho SV học văn báo chí, văn hóa du lịch, QHQT",/rong-mo-co-hoi-cho-sv-hoc-van-bao-chi-van-hoa-du-lich-qhqt-20200611085442304.htm,2020-12-06,0,1864
"Miệt mài giảm giá, các hãng bán được 19.081 xe hơi trong tháng 5",/miet-mai-giam-gia-cac-hang-ban-duoc19-081-xe-hoi-trong-thang-5-20200611200649774.htm,2020-11-06,0,860
Bảo hiểm xã hội Cà Mau 'phản ứng' kết luận thanh tra,/bao-hiem-xa-hoi-ca-mau-phan-ung-ket-luan-thanh-tra-20200610184711594.htm,2020-10-06,0,963
"Vừa nới giãn cách, Indonesia tăng 1.241 ca trong 24 giờ",/vua-noi-gian-cach-indonesia-tang-1-241-ca-trong-24-gio-20200610182742231.htm,2020-10-06,0,986
Bộ Công thương: Thông tin ‘100% người dân hài lòng việc tăng giá điện’ là bịa đặt,/bo-cong-thuong-thong-tin-100-nguoi-dan-hai-long-viec-tang-gia-dien-la-bia-dat-20200609192458222.htm,2020-09-06,0,815
"Nhạc chế phủ sóng mạng xã hội, đạt top trending trên YouTube",/nhac-che-phu-song-mang-xa-hoi-dat-top-trending-tren-youtube-20200603074208941.htm,2020-03-06,0,1258
Trung tâm hành chính Tây Sài Gòn và cơ hội từ tuyến Metro 3A,/trung-tam-hanh-chinh-tay-sai-gon-va-co-hoi-tu-tuyen-metro-3a-202005291024411.htm,2020-03-06,0,1335
"Đã hỗ trợ 60% người khó khăn do COVID-19, Chính phủ giục đẩy nhanh",/da-ho-tro-60-nguoi-kho-khan-do-covid-19-chinh-phu-giuc-day-nhanh-20200602175324207.htm,2020-02-06,0,1107
Hà Nội muốn tự quyết thu phí cao hơn mức chung,/ha-noi-muon-tu-quyet-thu-phi-cao-hon-muc-chung-20200601092447577.htm,2020-01-06,0,1200
"Số ca nhiễm cúm, thủy đậu, sởi giảm nhờ giãn cách xã hội chống COVID-19",/so-ca-nhiem-cum-thuy-dau-soi-giam-nho-gian-cach-xa-hoi-chong-covid-19-20200529165154064.htm,2020-05-31,0,983
Chuẩn nghèo mới sẽ nâng lên gấp đôi,/chuan-ngheo-moi-se-nang-len-gap-doi-20200529100301242.htm,2020-05-29,0,1652
Giảm mức đóng bảo hiểm nếu không vi phạm an toàn lao động và nợ bảo hiểm,/giam-muc-dong-bao-hiem-neu-khong-vi-pham-an-toan-lao-dong-va-no-bao-hiem-20200528214631928.htm,2020-05-29,0,797
"Gần 100.000 ca tử vong, nhiều người Mỹ vẫn đổ xô ra biển dịp cuối tuần",/gan-100000-ca-tu-vong-nhieu-nguoi-my-van-do-xo-ra-bien-dip-cuoi-tuan-20200526105338928.htm,2020-05-26,0,983
"Chủ tịch Quốc hội xem kịch Lưu Quang Vũ về bệnh dối trá, phô trương của một thời",/chu-tich-quoc-hoi-xem-kich-luu-quang-vu-ve-benh-doi-tra-pho-truong-cua-mot-thoi-20200524092332568.htm,2020-05-24,0,1450
Hàng trăm ngàn tỉ đồng quỹ bảo hiểm xã hội được sử dụng thế nào?,/hang-tram-ngan-ti-dong-quy-bao-hiem-xa-hoi-duoc-su-dung-the-nao-20200523111715042.htm,2020-05-23,0,1162
"Vay đúng mức, xài đúng nơi",/vay-dung-muc-xai-dung-noi-20200520231834488.htm,2020-05-21,0,1046
Tiêm bổ sung vắcxin bị trễ lịch,/tiem-bo-sung-vacxin-bi-tre-lich-2020051810081436.htm,2020-05-18,0,1355
"Chàng trai bán nhà, 'bán thân' để chữa ung thư cho mẹ",/chang-trai-ban-nha-ban-than-de-chua-ung-thu-cho-me-20200515110102774.htm,2020-05-15,0,1521
