Title,URL,Publish Date,Mentioned Times,Word Count
"Đề nghị sửa đổi quy định để nhiều người dân, doanh nghiệp được hỗ trợ từ gói 26.000 tỉ đồng",/de-nghi-sua-doi-quy-dinh-de-nhieu-nguoi-dan-doanh-nghiep-duoc-ho-tro-tu-goi-26-000-ti-dong-20210831135828535.htm,2021-08-31,0,1138
"Bình Phước: Giãn cách xã hội thêm 7 ngày tại huyện Lộc Ninh, nhiều biện pháp tăng cường",/binh-phuoc-gian-cach-xa-hoi-them-7-ngay-tai-huyen-loc-ninh-nhieu-bien-phap-tang-cuong-20210830235947793.htm,2021-08-31,0,933
Phóng viên kỳ cựu 67 tuổi tác nghiệp giữa bão gây tranh cãi tại Mỹ,/phong-vien-ky-cuu-67-tuoi-tac-nghiep-giua-bao-gay-tranh-cai-tai-my-20210830205309188.htm,2021-08-30,0,983
"Chi phí vận chuyển 'đẩy' CPI của TP.HCM tháng 8 tăng 0,33%",/chi-phi-van-chuyen-day-cpi-cua-tp-hcm-thang-8-tang-0-33-20210830120910041.htm,2021-08-30,0,958
Cùng con vào thời đại số: Tuyên chiến với nội dung 'bẩn',/cung-con-vao-thoi-dai-so-tuyen-chien-voi-noi-dung-ban-20210830081608454.htm,2021-08-30,0,1925
Công an Hà Nội tăng gấp đôi tổ tuần tra kiểm soát cơ động mạnh,/cong-an-ha-noi-tang-gap-doi-to-tuan-tra-kiem-soat-co-dong-manh-20210829194542228.htm,2021-08-29,0,804
"1 tuần giãn cách, TP.HCM xử phạt 6.296 trường hợp, đi chợ giúp 411.922 hộ dân",/1-tuan-gian-cach-tp-hcm-xu-phat-6-296-truong-hop-di-cho-giup-411-922-ho-dan-20210829183413123.htm,2021-08-29,0,892
"TP.HCM đã lấy hơn 1,4 triệu mẫu test nhanh, tỉ lệ dương tính 3,8%",/tp-hcm-da-lay-hon-1-4-trieu-mau-test-nhanh-ti-le-duong-tinh-3-8-20210829123323265.htm,2021-08-29,0,785
"TP.HCM: F0 cộng đồng tăng rất mạnh ngày 28-8, chiếm hơn 90% số ca mới",/tp-hcm-f0-cong-dong-tang-rat-manh-ngay-28-8-chiem-hon-90-so-ca-moi-20210828213455497.htm,2021-08-28,0,969
TP.HCM ngày 26-8: Tỉ lệ F0 trong cộng đồng giảm nhẹ nhưng vẫn ở mức cao,/tp-hcm-ngay-26-8-ti-le-f0-trong-cong-dong-giam-nhe-nhung-van-o-muc-cao-20210826213949852.htm,2021-08-26,0,808
"Thủ tướng: TP.HCM phải đảm bảo lương thực, thực phẩm để dân yên tâm ở nhà",/thu-tuong-tp-hcm-phai-dam-bao-luong-thuc-thuc-pham-de-dan-yen-tam-o-nha-20210826091701866.htm,2021-08-26,0,1867
Hà Nội: Xử phạt trung bình mỗi ngày 1.000 trường hợp vi phạm chống dịch,/ha-noi-xu-phat-trung-binh-moi-ngay-1000-truong-hop-vi-pham-chong-dich-20210826060517611.htm,2021-08-26,0,1051
"Nhiều quận, huyện ở TP.HCM phát hiện bao nhiêu F0 mới thì bấy nhiêu ca cộng đồng",/nhieu-quan-huyen-o-tp-hcm-phat-hien-bao-nhieu-f0-moi-thi-bay-nhieu-ca-cong-dong-20210824222600541.htm,2021-08-24,0,903
"TP.HCM bổ sung đối tượng được ra đường, nêu rõ nhóm người không cần giấy đi đường khi qua chốt",/tp-hcm-bo-sung-doi-tuong-duoc-ra-duong-neu-ro-nhom-nguoi-khong-can-giay-di-duong-khi-qua-chot-20210823184622548.htm,2021-08-23,0,933
Học sách điện tử thế nào để hiệu quả?,/hoc-sach-dien-tu-the-nao-de-hieu-qua-20210823004354887.htm,2021-08-23,0,1887
UBND TP.HCM chỉ thị khẩn: Yêu cầu giãn cách triệt để tại 312 xã phường,/ubnd-tp-hcm-chi-thi-khan-yeu-cau-gian-cach-triet-de-tai-312-xa-phuong-20210822200437354.htm,2021-08-22,0,1017
"Tin COVID-19 sáng 22-8: Cho phép lưu hành thêm vắc xin Pfizer, Bình Dương thắt chặt để chống dịch",/tin-covid-19-sang-22-8-cho-phep-luu-hanh-them-vac-xin-pfizer-binh-duong-that-chat-de-chong-dich-20210821212950184.htm,2021-08-22,0,1678
Chủ tịch Hà Nội ra công điện số 19 về tiếp tục giãn cách xã hội,/chu-tich-ha-noi-ra-cong-dien-so-19-ve-tiep-tuc-gian-cach-xa-hoi-20210820173003122.htm,2021-08-21,0,1258
"Từ 0h ngày 23-8, những ai được phép ra đường?",/tu-0h-ngay-23-8-nhung-ai-duoc-phep-ra-duong-20210821152713545.htm,2021-08-21,0,1346
"Vì sao dưới 100 ca mới/ngày, Hà Nội vẫn tiếp tục giãn cách diện rộng?",/vi-sao-duoi-100-ca-moi-ngay-ha-noi-van-tiep-tuc-gian-cach-dien-rong-2021082021115539.htm,2021-08-20,0,947
"Lần đầu đi chợ bằng thẻ, nhiều bà con TP Vinh phải quay về vì... hết thịt",/lan-dau-di-cho-bang-the-nhieu-ba-con-tp-vinh-phai-quay-ve-vi-het-thit-20210820102415046.htm,2021-08-20,0,1105
'Đây chính là nhảy đường phố' 4 và nhiều chương trình giải trí đặc sắc trên VieON cho ngày giãn cách,/day-chinh-la-nhay-duong-pho-4-va-nhieu-chuong-trinh-giai-tri-dac-sac-tren-vieon-cho-ngay-gian-cach-20210820100645442.htm,2021-08-20,0,1230
TP Nha Trang cho cư dân 'vùng xanh' được tập thể dục ngoài trời,/tp-nha-trang-cho-cu-dan-vung-xanh-duoc-tap-the-duc-ngoai-troi-20210819205024723.htm,2021-08-19,0,1054
YouTube thêm công nghệ giúp người dùng dễ tìm thấy video mong muốn,/youtube-them-cong-nghe-giup-nguoi-dung-de-tim-thay-video-mong-muon-20210819111228999.htm,2021-08-19,0,917
TP.HCM: 7 công trình cấp bách không bị tạm ngưng thi công do dịch COVID-19,/tphcm-7-cong-trinh-cap-bach-khong-bi-tam-ngung-thi-cong-do-dich-covid-19-20210818155139342.htm,2021-08-18,0,772
"F0 trong cộng đồng đang tăng mạnh tại quận 8, quận 3, quận 1, Bình Tân, Tân Phú",/f0-trong-cong-dong-dang-tang-manh-tai-quan-8-quan-3-quan-1-binh-tan-tan-phu-20210817083038995.htm,2021-08-17,0,849
Lập bệnh viện điều trị COVID-19 tại chỗ cho bệnh nhân ở Trung tâm Công tác xã hội tỉnh Tiền Giang,/lap-benh-vien-dieu-tri-covid-19-tai-cho-cho-benh-nhan-o-trung-tam-cong-tac-xa-hoi-tinh-tien-giang-20210816155052705.htm,2021-08-16,0,874
Lợi thế nổi bật khi học Trí tuệ nhân tạo (AI) tại SIU,/loi-the-noi-bat-khi-hoc-tri-tue-nhan-tao-ai-tai-siu-20210814155700302.htm,2021-08-16,0,1629
TP.HCM: Những nhóm đối tượng nào được hoạt động từ ngày 16-8?,/tp-hcm-nhung-nhom-doi-tuong-nao-duoc-hoat-dong-tu-ngay-16-8-20210815204937805.htm,2021-08-15,0,280
Hà Nội công khai số đường dây nóng 0243.834.4643 hỗ trợ gói 26.000 tỉ đồng,/ha-noi-cong-khai-so-duong-day-nong-0243-834-4643-ho-tro-goi-26-000-ti-dong-20210812110236592.htm,2021-12-08,0,994
"Vietlott phát hành trở lại xổ số Keno tại 40 tỉnh, thành phố",/vietlott-phat-hanh-tro-lai-xo-so-keno-tai-40-tinh-thanh-pho-20210811213411674.htm,2021-12-08,0,762
"Messi vừa ký hợp đồng, trang Instagram của PSG tăng 4 triệu người theo dõi",/messi-vua-ky-hop-dong-trang-instagram-cua-psg-tang-4-trieu-nguoi-theo-doi-20210811120544729.htm,2021-11-08,0,662
Bộ GD-ĐT: 'Năm 2022 thi tốt nghiệp THPT theo hình thức tự luận' là tin giả,/bo-gd-dt-nam-2022-thi-tot-nghiep-thpt-theo-hinh-thuc-tu-luan-la-tin-gia-20210811101437595.htm,2021-11-08,0,676
"Nhóm 'bác sĩ Khoa': người thật, tài khoản giả",/nhom-bac-si-khoa-nguoi-that-tai-khoan-gia-20210811092805031.htm,2021-11-08,0,1553
Cho con 'tư duy thời đại số',/cho-con-tu-duy-thoi-dai-so-2021080910212841.htm,2021-09-08,0,1972
Hà Nội 'không tiếp tục giãn cách thì khó bảo vệ thành quả chống dịch',/ha-noi-khong-tiep-tuc-gian-cach-thi-kho-bao-ve-thanh-qua-chong-dich-20210806200527254.htm,2021-06-08,0,1094
Chính thức: Hà Nội tiếp tục giãn cách xã hội theo chỉ thị 16 đến 6h ngày 23-8,/chinh-thuc-ha-noi-tiep-tuc-gian-cach-xa-hoi-theo-chi-thi-16-den-6h-ngay-23-8-20210806163344324.htm,2021-06-08,0,1391
Hơn 300 thí sinh Đồng Nai thi tốt nghiệp trong thời giãn cách,/hon-300-thi-sinh-dong-nai-dang-ky-du-thi-tot-nghiep-thpt-dac-biet-20210805195120518.htm,2021-05-08,0,1143
Vi phạm chỉ thị giãn cách xã hội ở Đà Nẵng sẽ bị xử phạt ra sao?,/vi-pham-chi-thi-gian-cach-xa-hoi-o-da-nang-se-bi-xu-phat-ra-sao-20210802115227015.htm,2021-02-08,0,1014
"TP.HCM: 1.200 đội tiêm vắc xin, mỗi đội phấn đấu 200 mũi tiêm/ngày",/tp-hcm-1-200-doi-tiem-vac-xin-moi-doi-phan-dau-200-mui-tiem-ngay-20210801225233456.htm,2021-02-08,0,1449
Từ 0h ngày 2-8: TP.HCM tiếp tục giãn cách xã hội theo chỉ thị 16 thêm 14 ngày,/tu-0h-ngay-2-8-tp-hcm-tiep-tuc-gian-cach-xa-hoi-theo-chi-thi-16-them-14-ngay-2021080112264013.htm,2021-01-08,0,1406
Thủ tướng: Giảm tiền điện trong 2 tháng cho người dân ở nơi giãn cách theo chỉ thị 16,/thu-tuong-giam-tien-dien-trong-2-thang-cho-nguoi-dan-o-noi-gian-cach-theo-chi-thi-16-20210731184412944.htm,2021-07-31,0,813
Các tỉnh thành tiếp tục thực hiện chỉ thị 16 và 16 tăng cường sau ngày 1-8,/cac-tinh-thanh-tiep-tuc-thuc-hien-chi-thi-16-va-16-tang-cuong-sau-ngay-1-8-20210731175200129.htm,2021-07-31,0,242
Ông Biden nói Mỹ ‘rất có thể’ siết giãn cách vì biến thể Delta,/ong-biden-noi-my-rat-co-the-siet-gian-cach-vi-bien-the-delta-20210731150029107.htm,2021-07-31,0,704
Hà Nội quy định mẫu giấy tờ cho các trường hợp được lưu thông trong giãn cách xã hội,/ha-noi-quy-dinh-mau-giay-to-cho-cac-truong-hop-duoc-luu-thong-trong-gian-cach-xa-hoi-20210729174534435.htm,2021-07-29,0,1310
TP.HCM hướng dẫn kiểm soát người di chuyển trong thời gian thực hiện chỉ thị 16,/tphcm-huong-dan-kiem-soat-nguoi-di-chuyen-trong-thoi-gian-thuc-hien-chi-thi-16-2021072915101039.htm,2021-07-29,0,1360
Bộ Lao động công bố 6 số điện thoại đường dây nóng giải đáp gói 26.000 tỉ đồng,/bo-lao-dong-cong-bo-6-so-dien-thoai-duong-day-nong-giai-dap-goi-26-000-ti-dong-20210729090503157.htm,2021-07-29,0,799
"Đăng tin 'tào lao' nói 'Hà Nội có khoảng 3.000 chốt', nhận phạt 12,5 triệu đồng",/dang-tin-tao-lao-noi-ha-noi-co-khoang-3-000-chot-nhan-phat-12-5-trieu-dong-20210728195906018.htm,2021-07-28,0,645
"Hà Nội xử phạt nhiều người bán hàng rong, tập thể dục",/ha-noi-xu-phat-nhieu-nguoi-ban-hang-rong-tap-the-duc-20210728110854313.htm,2021-07-28,0,1248
Bộ Y tế rút công văn 5944 'chỉ định thầu' thuốc y học cổ truyền hỗ trợ điều trị COVID-19 'gây bão',/bo-y-te-rut-cong-van-5944-chi-dinh-thau-thuoc-y-hoc-co-truyen-ho-tro-dieu-tri-covid-19-gay-bao-20210726101619271.htm,2021-07-26,0,899
"Đồng Tháp tiếp tục giãn cách theo chỉ thị 16, Long An điều chỉnh số liệu mắc COVID-19",/dong-thap-tiep-tuc-gian-cach-theo-chi-thi-16-long-an-dieu-chinh-so-lieu-mac-covid-19-20210724150911691.htm,2021-07-24,0,850
"Cử tri đề nghị chấn chỉnh quảng cáo sai sự thật có nghệ sĩ, diễn viên",/cu-tri-de-nghi-chan-chinh-quang-cao-sai-su-that-co-nghe-si-dien-vien-20210722085723896.htm,2021-07-22,0,1171
'Những hạt ngọc long lanh vẫn chiếm đa số trong xã hội',/nhung-hat-ngoc-long-lanh-van-chiem-da-so-trong-xa-hoi-20210721194250916.htm,2021-07-21,0,1139
Trung tâm báo chí lên tiếng về thông tin sai sự thật vụ tự thiêu ở Thủ Đức,/trung-tam-bao-chi-len-tieng-ve-thong-tin-sai-su-that-vu-tu-thieu-o-thu-duc-20210720230009951.htm,2021-07-20,0,672
TP.HCM yêu cầu khẩn các quận huyện mở rộng thêm 10 nhóm lao động tự do nhận hỗ trợ,/tp-hcm-yeu-cau-khan-cac-quan-huyen-mo-rong-them-10-nhom-lao-dong-tu-do-nhan-ho-tro-20210720162735997.htm,2021-07-20,0,1221
"Các thực phẩm bổ sung như vitamin C, D, E… có ngừa được COVID-19?",/cac-thuc-pham-bo-sung-nhu-vitamin-c-d-e-co-ngua-duoc-covid-19-20210720135749825.htm,2021-07-20,0,1110
Tài xế chở hàng ở miền Tây: 'chờ thông thoáng',/tai-xe-cho-hang-o-mien-tay-cho-thong-thoang-20210720074140813.htm,2021-07-20,0,1269
Anh cho đội ngũ y tế miễn cách ly sau phơi nhiễm COVID-19,/anh-cho-doi-ngu-y-te-mien-cach-ly-sau-phoi-nhiem-covid-19-2021071910122769.htm,2021-07-19,0,814
Facebook bác chỉ trích 'giết người' của Tổng thống Biden giữa đại dịch,/facebook-bac-chi-trich-giet-nguoi-cua-tong-thong-biden-giua-dai-dich-20210718060206911.htm,2021-07-18,0,736
Thủ tướng ra chỉ thị phát động thi đua phát triển kinh tế - xã hội,/thu-tuong-ra-chi-thi-phat-dong-thi-dua-phat-trien-kinh-te-xa-hoi-20210716191430348.htm,2021-07-16,1,1700
Bình Phước thực hiện chỉ thị 16 thêm tại TP Đồng Xoài và huyện Đồng Phú,/binh-phuoc-thuc-hien-chi-thi-16-them-tai-tp-dong-xoai-va-huyen-dong-phu-20210716123735718.htm,2021-07-16,0,948
TP.HCM sau 7 ngày giãn cách xã hội theo chỉ thị 16: Số ca cộng đồng đã giảm,/tp-hcm-sau-7-ngay-gian-cach-xa-hoi-theo-chi-thi-16-so-ca-cong-dong-da-giam-20210715144421941.htm,2021-07-15,0,2951
Indonesia điêu đứng với số ca nhiễm mới kỷ lục do biến thể Delta,/indonesia-dieu-dung-voi-so-ca-nhiem-moi-ky-luc-do-bien-the-delta-20210714195653429.htm,2021-07-14,0,885
"Từ 0h ngày 15-7, Tây Ninh áp dụng chỉ thị 16 nhiều nơi, còn lại toàn tỉnh theo chỉ thị 15",/tu-0h-ngay-15-7-tay-ninh-ap-dung-chi-thi-16-nhieu-noi-con-lai-toan-tinh-theo-chi-thi-15-20210714151617938.htm,2021-07-14,0,835
Cùng con vào thời đại số: Kế hoạch số cho gia đình,/cung-con-vao-thoi-dai-so-ke-hoach-so-cho-gia-dinh-20210714102613819.htm,2021-07-14,0,2036
Nhiều con hẻm bị chặn bằng dây kẽm gai: Địa phương nói gì?,/nhieu-con-hem-bi-chan-bang-day-kem-gai-dia-phuong-noi-gi-2021071216101304.htm,2021-12-07,0,1231
"TP.HCM phạt không khẩu trang, ra đường không lý do chính đáng... hơn 1,2 tỉ đồng",/tp-hcm-phat-khong-khau-trang-ra-duong-khong-ly-do-chinh-dang-hon-1-2-ti-dong-2021071019430379.htm,2021-10-07,0,1224
An Giang giãn cách xã hội toàn tỉnh theo chỉ thị 15 từ 0h ngày 11-7,/an-giang-gian-cach-xa-hoi-toan-tinh-theo-chi-thi-15-tu-0h-ngay-11-7-20210710150635574.htm,2021-10-07,0,1453
"Vĩnh Long bắt đầu giãn cách xã hội 4 huyện, thành",/vinh-long-bat-dau-gian-cach-xa-hoi-4-huyen-thanh-20210709130423573.htm,2021-09-07,0,983
Tận dụng triệt để 15 ngày dập dịch,/tan-dung-triet-de-15-ngay-dap-dich-20210709075814391.htm,2021-09-07,0,2245
TikTok xác nhận ứng dụng của họ ‘có chút trục trặc’,/tiktok-xac-nhan-ung-dung-cua-ho-co-chut-truc-trac-20210707065205641.htm,2021-07-07,0,659
Cùng con vào thời đại số - Mạng xã hội: khắc tinh mùa thi,/cung-con-vao-thoi-dai-so-mang-xa-hoi-khac-tinh-mua-thi-20210705090717004.htm,2021-05-07,0,1982
"Đọc báo cùng bạn 5-7: Cao điểm chống dịch ở TP.HCM phải nhanh, quyết liệt",/doc-bao-cung-ban-5-7-cao-diem-chong-dich-o-tphcm-phai-nhanh-quyet-liet-20210705070420086.htm,2021-05-07,0,418
Chính phủ ban hành gói hỗ trợ 26.000 tỉ cho người lao động và doanh nghiệp,/chinh-phu-ban-hanh-goi-ho-tro-26-000-ti-cho-nguoi-lao-dong-va-doanh-nghiep-20210701184453236.htm,2021-01-07,0,1556
"Từ 7h hôm nay 1-7: Giãn cách xã hội thị trấn Long Bình theo chỉ thị 15, một số nơi theo chỉ thị 16",/tu-7h-hom-nay-1-7-gian-cach-xa-hoi-thi-tran-long-binh-theo-chi-thi-15-mot-so-noi-theo-chi-thi-16-20210630222132169.htm,2021-01-07,0,919
Bắt 'Trai họ Lê' lừa đảo bán máy may công nghiệp trên mạng xã hội chiếm đoạt tiền tỉ,/bat-trai-ho-le-lua-dao-ban-may-may-cong-nghiep-tren-mang-xa-hoi-chiem-doat-tien-ti-20210630103534109.htm,2021-06-30,0,767
GDP 6 tháng tăng không bất thường,/gdp-6-thang-tang-khong-bat-thuong-20210629233717853.htm,2021-06-30,0,1048
"Bất chấp dịch bệnh, GDP 6 tháng đầu năm tăng 5,64%",/bat-chap-dich-benh-gdp-6-thang-dau-nam-tang-5-64-202106291025292.htm,2021-06-29,0,1055
Đọc báo cùng bạn 29-6: Xét nghiệm toàn thành phố tìm F0,/doc-bao-cung-ban-29-6-xet-nghiem-toan-thanh-pho-tim-f0-20210629052305735.htm,2021-06-29,0,497
"Số thẻ bảo hiểm y tế, số bảo hiểm xã hội sẽ đồng bộ với số căn cước công dân",/so-the-bao-hiem-y-te-so-bao-hiem-xa-hoi-se-dong-bo-voi-so-can-cuoc-cong-dan-20210628211536872.htm,2021-06-28,0,727
"Thái Bình thêm 2 ca COVID-19, áp dụng giãn cách xã hội theo chỉ thị 15 một huyện",/thai-binh-them-2-ca-covid-19-ap-dung-gian-cach-xa-hoi-theo-chi-thi-15-mot-huyen-20210625212231833.htm,2021-06-25,0,898
"Phát hiện 5 trường hợp dương tính COVID-19, Sơn La cách ly xã hội toàn huyện Thuận Châu",/phat-hien-5-truong-hop-duong-tinh-covid-19-son-la-cach-ly-xa-hoi-toan-huyen-thuan-chau-20210625155632821.htm,2021-06-25,0,920
"Hà Nội sẽ tiếp tục nới lỏng các hoạt động, sẵn sàng tổ chức thi tốt nghiệp THPT",/ha-noi-se-tiep-tuc-noi-long-cac-hoat-dong-san-sang-to-chuc-thi-tot-nghiep-thpt-20210624134741404.htm,2021-06-24,0,1159
Đoàn tàu thứ 4 tuyến metro số 1 về depot Long Bình trong đêm TP.HCM giãn cách,/doan-tau-thu-4-tuyen-metro-so-1-ve-depot-long-binh-trong-dem-tp-hcm-gian-cach-20210621042208676.htm,2021-06-21,0,673
Siêu thị tăng lượng hàng dự trữ khi TP.HCM nâng mức giãn cách,/sieu-thi-tang-luong-hang-du-tru-khi-tp-hcm-nang-muc-gian-cach-20210620172843766.htm,2021-06-20,0,1285
"TP.HCM triển khai nhanh mua máy thở, máy lọc máu và thiết bị y tế khác",/tp-hcm-trien-khai-nhanh-mua-may-tho-may-loc-mau-va-thiet-bi-y-te-khac-20210619213202008.htm,2021-06-19,0,788
Bita’s trao tặng nhiều phần quà ý nghĩa tiếp sức cho học sinh trong đại dịch COVID-19,/bitas-trao-tang-nhieu-phan-qua-y-nghia-tiep-suc-cho-hoc-sinh-trong-dai-dich-covid-19-20210617143546605.htm,2021-06-17,0,1207
TP.HCM: Chỉ đạo khẩn vì vẫn còn lơ là 5K,/tp-hcm-chi-dao-khan-vi-van-con-lo-la-5k-20210616172103561.htm,2021-06-16,0,860
Bảo hiểm Bảo Việt triển khai Bảo hiểm 37 Bệnh hiểm nghèo (CI37),/bao-hiem-bao-viet-trien-khai-bao-hiem-37-benh-hiem-ngheo-ci37-20210615144458657.htm,2021-06-15,0,1545
"Dân Trinidad và Tobago 'soi' Mỹ tặng 400 liều vắc xin, Trung Quốc tặng gấp... 750 lần",/dan-trinidad-va-tobago-soi-my-tang-400-lieu-vac-xin-trung-quoc-tang-gap-750-lan-20210615104159571.htm,2021-06-15,0,1051
"Thêm 3 ca mắc COVID-19, Hà Tĩnh lấy 100.000 mẫu xét nghiệm bằng nguồn xã hội hóa",/them-3-ca-mac-covid-19-ha-tinh-lay-100-000-mau-xet-nghiem-bang-nguon-xa-hoi-hoa-20210615084128663.htm,2021-06-15,0,965
An Giang cảnh báo nhiều kênh trên mạng xã hội mạo danh đại tá Đinh Văn Nơi,/an-giang-canh-bao-nhieu-kenh-tren-mang-xa-hoi-mao-danh-dai-ta-dinh-van-noi-20210612211912973.htm,2021-06-13,0,691
Chuỗi lây nhiễm liên quan nhóm truyền giáo Phục Hưng 'đã được kiểm soát',/chuoi-lay-nhiem-lien-quan-nhom-truyen-giao-phuc-hung-da-duoc-kiem-soat-20210613084709296.htm,2021-06-13,0,1055
"Đọc báo cùng bạn 12-6: Còn 3 ngày giãn cách, TP.HCM 'chạy nước rút'",/doc-bao-cung-ban-12-6-con-3-ngay-gian-cach-tp-hcm-chay-nuoc-rut-20210612051527574.htm,2021-12-06,0,386
Nghệ sĩ Việt cần 'đổ mồ hôi' hơn trên mạng xã hội,/nghe-si-viet-can-do-mo-hoi-hon-tren-mang-xa-hoi-20210610211510033.htm,2021-11-06,0,1621
Bắc Ninh gỡ phong tỏa toàn huyện Yên Phong,/bac-ninh-go-phong-toa-toan-huyen-yen-phong-20210610234947301.htm,2021-11-06,0,954
"9 người ăn giỗ bị phạt 135 triệu đồng, sau đó có 1 F0, 8 người đi cách ly tập trung",/9-nguoi-an-gio-bi-phat-135-trieu-dong-sau-do-co-1-f0-8-nguoi-di-cach-ly-tap-trung-20210610114817157.htm,2021-10-06,0,959
"Số ca mắc giảm, Bắc Giang gỡ phong tỏa huyện Lạng Giang và chuyển sang giãn cách xã hội",/so-ca-mac-giam-bac-giang-go-phong-toa-huyen-lang-giang-va-chuyen-sang-gian-cach-xa-hoi-20210610101309629.htm,2021-10-06,0,885
Đóng bảo hiểm xã hội 10 - 15 năm vẫn được nhận lương hưu?,/dong-bao-hiem-xa-hoi-10-15-nam-van-duoc-nhan-luong-huu-20210608212319447.htm,2021-10-06,0,1605
Hỗ trợ toàn bộ tiền ăn cho trẻ em F0 và F1 bị cách ly,/ho-tro-toan-bo-tien-an-cho-tre-em-f0-va-f1-bi-cach-ly-20210609113151803.htm,2021-09-06,0,765
"TP.HCM vận hành gói an sinh lần 2, dự kiến khoảng 1.076 tỉ hỗ trợ người dân và doanh nghiệp",/tphcm-van-hanh-goi-an-sinh-lan-2-du-kien-khoang-1076-ti-ho-tro-nguoi-dan-va-doanh-nghiep-20210609123501078.htm,2021-09-06,0,899
"Cảnh báo mạo danh bác sĩ 'khuyên' người bệnh chuyển tiền để mua thuốc, thực phẩm chức năng",/canh-bao-mao-danh-bac-si-khuyen-nguoi-benh-chuyen-tien-de-mua-thuoc-thuc-pham-chuc-nang-20210607155850494.htm,2021-07-06,0,1028
"Làm gì khi con bị bắt nạt trên mạng là 'đồ không có não', 'đồ sò'...?",/lam-gi-khi-con-bi-bat-nat-tren-mang-la-do-khong-co-nao-do-so-20210606203934219.htm,2021-07-06,0,2051
"Bộ Văn hóa đề nghị chấn chỉnh nghệ sĩ quảng cáo sai sự thật, dùng mạng xã hội xúc phạm cá nhân",/bo-van-hoa-de-nghi-chan-chinh-nghe-si-quang-cao-sai-su-that-dung-mang-xa-hoi-xuc-pham-ca-nhan-20210604182629475.htm,2021-04-06,0,1030
"Thương hiệu nào đang ‘khuấy đảo’ mạng xã hội, được nhiều người quan tâm?",/thuong-hieu-nao-dang-khuay-dao-mang-xa-hoi-duoc-nhieu-nguoi-quan-tam-20210603183621697.htm,2021-04-06,0,1084
Âm nhạc vỗ về nỗi niềm mùa dịch,/am-nhac-vo-ve-noi-niem-mua-dich-20210602213824186.htm,2021-03-06,0,1274
Chen chúc lấy mẫu xét nghiệm COVID-19 tiềm ẩn nguy cơ lây lan dịch,/chen-chuc-lay-mau-xet-nghiem-covid-19-tiem-an-nguy-co-lay-lan-dich-20210531114900214.htm,2021-05-31,0,1095
Facebook trả tiền cho 14 cơ quan báo chí Canada,/facebook-tra-tien-cho-14-co-quan-bao-chi-canada-20210527111308159.htm,2021-05-27,0,762
Địa phương nơi Hoài Linh dự tính làm từ thiện nói ‘cập rập quá nên nhầm lẫn thời gian’,/dia-phuong-noi-hoai-linh-du-tinh-lam-tu-thien-noi-cap-rap-qua-nen-nham-lan-thoi-gian-20210525103730834.htm,2021-05-25,0,1050
Vietcombank hỗ trợ gần 70 tỉ đồng cho phòng chống dịch COVID-19,/vietcombank-ho-tro-gan-70-ti-dong-cho-phong-chong-dich-covid-19-20210524092624247.htm,2021-05-24,0,1238
Nghệ sĩ quảng cáo thuốc tiểu đường: Em quảng cáo thôi chứ em đâu có bệnh!,/nghe-si-quang-cao-thuoc-tieu-duong-em-quang-cao-thoi-chu-em-dau-co-benh-20210521083844091.htm,2021-05-21,0,1107
Nhắc nhở các nghệ sĩ tham gia quảng cáo trên các trang mạng sai quy định,/nhac-nho-cac-nghe-si-tham-gia-quang-cao-tren-cac-trang-mang-sai-quy-dinh-20210520122240084.htm,2021-05-20,0,652
Chỉ 12 người phát tán 65% tin giả về vắc xin COVID-19 toàn cầu,/chi-12-nguoi-phat-tan-65-tin-gia-ve-vac-xin-covid-19-toan-cau-20210518145352708.htm,2021-05-18,0,932
TP Bắc Ninh cách ly xã hội 220.000 người từ 6h ngày 18-5,/tp-bac-ninh-cach-ly-xa-hoi-220000-nguoi-tu-6h-ngay-18-5-20210518093558405.htm,2021-05-18,0,942
Một số vấn đề lý luận và thực tiễn về chủ nghĩa xã hội và con đường đi lên chủ nghĩa xã hội ở VN,/mot-so-van-de-ly-luan-va-thuc-tien-ve-chu-nghia-xa-hoi-va-con-duong-di-len-chu-nghia-xa-hoi-o-vn-20210516203550852.htm,2021-05-16,0,8735
"102 người Trung Quốc làm việc ở dự án điện gió Đắk N’Drung, chỉ... 1 người có giấy phép",/102-nguoi-trung-quoc-lam-viec-o-du-an-dien-gio-dak-ndrung-chi-1-nguoi-co-giay-phep-20210512115841704.htm,2021-12-05,0,913
Trách nhiệm xã hội của doanh nghiệp tới phát triển bền vững,/trach-nhiem-xa-hoi-cua-doanh-nghiep-toi-phat-trien-ben-vung-20210511115820879.htm,2021-11-05,0,1125
Bắc Giang giãn cách xã hội 3 huyện liên quan ổ dịch Công ty Shin Young,/bac-giang-gian-cach-xa-hoi-3-huyen-lien-quan-o-dich-cong-ty-shin-young-20210511125035615.htm,2021-11-05,0,862
"CẬP NHẬT COVID-19 ngày 11-5: Bắc Ninh 'áp đảo' số ca mới, thêm nhiều nơi giãn cách xã hội",/cap-nhat-covid-19-ngay-11-5-bac-ninh-ap-dao-so-ca-moi-them-nhieu-noi-gian-cach-xa-hoi-20210511094323096.htm,2021-11-05,0,506
Long Hải - đô thị ven biển không còn xa,/long-hai-do-thi-ven-bien-khong-con-xa-202105081538547.htm,2021-08-05,0,454
Đọc báo cùng bạn 8-5: Nâng mức cảnh báo COVID-19 lên cao nhất,/doc-bao-cung-ban-8-5-nang-muc-canh-bao-covid-19-len-cao-nhat-20210508041947034.htm,2021-08-05,0,466
40% doanh nghiệp vừa và nhỏ tại Việt Nam phải cắt giảm nhân sự,/40-doanh-nghiep-vua-va-nho-tai-viet-nam-phai-cat-giam-nhan-su-2021050715481811.htm,2021-07-05,0,834
TP Thủ Đức sẽ là nơi của những thử nghiệm mới,/tp-thu-duc-se-la-noi-cua-nhung-thu-nghiem-moi-20210427152635177.htm,2021-04-29,2,2717
Có lấy được căn cước công dân gắn chip số đẹp không?,/co-lay-duoc-can-cuoc-cong-dan-gan-chip-so-dep-khong-20210429084711994.htm,2021-04-29,0,1453
"7.000 nhân viên y tế toàn cầu tử vong, ILO kêu gọi các nước có biện pháp khẩn cấp",/7-000-nhan-vien-y-te-toan-cau-tu-vong-ilo-keu-goi-cac-nuoc-co-bien-phap-khan-cap-20210427173855166.htm,2021-04-27,0,1215
"Làm thế nào để không chọn nhầm nghề, không ngồi nhầm trường?",/lam-the-nao-de-khong-chon-nham-nghe-khong-ngoi-nham-truong-20210424092401746.htm,2021-04-24,0,1085
Ai bị 3 sinh viên rao sim số đẹp lừa nhiều người hàng tỉ đồng này liên hệ công an,/ai-bi-3-sinh-vien-rao-sim-so-dep-lua-nhieu-nguoi-hang-ti-dong-nay-lien-he-cong-an-20210420162617195.htm,2021-04-20,0,824
Cần xóa tận gốc nạn đua xe trái phép,/can-xoa-tan-goc-nan-dua-xe-trai-phep-20210419233241391.htm,2021-04-20,0,1046
Mobile Money - không ai bị bỏ lại phía sau,/mobile-money-khong-ai-bi-bo-lai-phia-sau-20210419113253192.htm,2021-04-19,0,1549
Cặp xe sang Porsche Macan trùng biển số 'chạm mặt' ở Hà Nội,/cap-xe-sang-porsche-macan-trung-bien-so-cham-mat-o-ha-noi-20210419114910207.htm,2021-04-19,0,831
