Title,URL,Publish Date,Mentioned Times,Word Count
Kế hoạch phát triển kinh tế - xã hội năm 2023,/ke-hoach-phat-trien-kinh-te-xa-hoi-nam-2023-20221231151556621.htm,2022-12-31,0,450
"Thưởng Tết dương lịch 2023: Trung bình doanh nghiệp nhà nước hơn 2 triệu đồng, tư nhân chỉ 870.000",/thuong-tet-duong-lich-2023-trung-binh-doanh-nghiep-nha-nuoc-hon-2-trieu-dong-tu-nhan-chi-870-000-20221229101713977.htm,2022-12-29,0,1371
"Giao dịch đất nền gấp 4 lần so với giao dịch chung cư, nhà riêng",/giao-dich-dat-nen-gap-4-lan-so-voi-giao-dich-chung-cu-nha-rieng-20221223165325378.htm,2022-12-23,0,937
"Ngăn rút bảo hiểm xã hội một lần: Giảm số năm đóng, lương hưu phải đủ sống",/ngan-rut-bao-hiem-xa-hoi-mot-lan-giam-so-nam-dong-luong-huu-phai-du-song-2022122315143925.htm,2022-12-23,0,1624
"Ngăn rút bảo hiểm xã hội một lần, được không?",/ngan-rut-bao-hiem-xa-hoi-mot-lan-duoc-khong-20221223090449968.htm,2022-12-23,0,3585
"Ra ngõ gặp hoa hậu, tại ai?",/ra-ngo-gap-hoa-hau-tai-ai-20221222165401514.htm,2022-12-22,0,1295
Xổ số kiến thiết Sóc Trăng dành trên 169 tỉ đồng làm công tác an sinh,/xo-so-kien-thiet-soc-trang-danh-tren-169-ti-dong-lam-cong-tac-an-sinh-20221219142543261.htm,2022-12-19,0,724
Tin tức thế giới 19-12: Triều Tiên thử vệ tinh do thám mới; Giáo hoàng ký sẵn giấy từ chức,/tin-tuc-the-gioi-19-12-trieu-tien-thu-ve-tinh-do-tham-moi-giao-hoang-ky-san-giay-tu-chuc-20221219060439009.htm,2022-12-19,0,1700
EU dọa trừng phạt Elon Musk vì Twitter đình chỉ tài khoản nhà báo,/eu-doa-trung-phat-elon-musk-vi-twitter-dinh-chi-tai-khoan-nha-bao-20221217071736838.htm,2022-12-17,0,881
"Người rút bảo hiểm xã hội một lần tăng, Phó chủ tịch Quốc hội: 'Nói không bất thường là không đúng'",/nguoi-rut-bhxh-mot-lan-tang-pho-chu-tich-quoc-hoi-noi-khong-bat-thuong-la-khong-dung-202212151545212.htm,2022-12-15,0,1430
Bộ Xây dựng đề nghị các địa phương xử nghiêm việc mua bán nhà ở xã hội không đúng đối tượng,/bo-xay-dung-de-nghi-cac-dia-phuong-xu-nghiem-viec-mua-ban-nha-o-xa-hoi-khong-dung-doi-tuong-20221212200330241.htm,2022-12-12,0,1063
"Câu 'Nhìn gì vậy, đồ ngốc. Biến đi!' của Messi được dùng để quảng cáo",/cau-nhin-gi-vay-do-ngoc-bien-di-cua-messi-duoc-dung-de-quang-cao-20221210201138571.htm,2022-10-12,0,766
Bà Rịa - Vũng Tàu: Tăng trưởng đạt hai con số,/ba-ria-vung-tau-tang-truong-dat-hai-con-so-20221210165936858.htm,2022-10-12,0,746
Sinh viên bất ngờ bị yêu cầu đóng thêm chục triệu đồng học phí,/sinh-vien-bat-ngo-bi-yeu-cau-dong-them-chuc-trieu-dong-hoc-phi-20221209152649577.htm,2022-09-12,0,817
VieON giành thêm giải thưởng công nghệ danh giá,/vieon-gianh-them-giai-thuong-cong-nghe-danh-gia-20221209080330328.htm,2022-09-12,5,1643
"Vì sao nhiều người chưa tham gia bảo hiểm thất nghiệp, bảo hiểm xã hội?",/vi-sao-nhieu-nguoi-chua-tham-gia-bao-hiem-that-nghiep-bao-hiem-xa-hoi-20221205090301351.htm,2022-06-12,0,706
"Thủ tướng Hà Lan 'chọc' Tổng thống Biden: 'Xin lỗi Joe, bóng đá đã chiến thắng'",/thu-tuong-ha-lan-choc-tong-thong-biden-xin-loi-joe-bong-da-da-chien-thang-20221204165304516.htm,2022-04-12,0,840
"Bộ Chính trị thống nhất ban hành nghị quyết về phát triển TP.HCM đến 2030, tầm nhìn 2045",/bo-chinh-tri-thong-nhat-ban-hanh-nghi-quyet-ve-phat-trien-tphcm-den-2030-tam-nhin-2045-20221202112941049.htm,2022-02-12,2,1346
Kỳ họp cuối năm của HĐND TP.HCM sẽ diễn ra trong 3 ngày từ 7-12,/ky-hop-cuoi-nam-cua-hdnd-tp-hcm-se-dien-ra-trong-3-ngay-tu-7-12-20221201175720578.htm,2022-01-12,0,859
Bà Rịa - Vũng Tàu: Những cơ sở và bước đi ban đầu để hình thành khu thương mại tự do Cái Mép Hạ,/ba-ria-vung-tau-nhung-co-so-va-buoc-di-ban-dau-de-hinh-thanh-khu-thuong-mai-tu-do-cai-mep-ha-20221201103416107.htm,2022-01-12,0,1689
Bí thư Nguyễn Văn Nên: 'Kiên quyết triệt phá băng nhóm cướp giật đường phố',/bi-thu-nguyen-van-nen-kien-quyet-triet-pha-bang-nhom-cuop-giat-duong-pho-20221130184258099.htm,2022-11-30,0,1387
Mạng xã hội thiện nguyện: Phục vụ cộng đồng nhờ công nghệ,/mang-xa-hoi-thien-nguyen-phuc-vu-cong-dong-nho-cong-nghe-20221130111107891.htm,2022-11-30,0,1275
Thưởng tiến độ dự án giao thông trọng điểm: Dự án nào sẽ được hưởng cơ chế?,/thuong-tien-do-du-an-giao-thong-trong-diem-du-an-nao-se-duoc-huong-co-che-20221129170743721.htm,2022-11-29,0,1310
Loài nhện đang tiến hóa để có tập tính xã hội hơn,/loai-nhen-dang-tien-hoa-de-co-tap-tinh-xa-hoi-hon-20221128142133737.htm,2022-11-28,0,594
Đóng bảo hiểm thất nghiệp được nhận lương như thế nào khi mất việc? Lương có đủ sống?,/dong-bao-hiem-that-nghiep-duoc-nhan-luong-nhu-the-nao-khi-mat-viec-luong-co-du-song-20221127105227677.htm,2022-11-28,0,677
Elon Musk tuyên bố lượt đăng ký người dùng mới của Twitter cao kỷ lục,/elon-musk-tuyen-bo-luot-dang-ky-nguoi-dung-moi-cua-twitter-cao-ky-luc-2022112723394729.htm,2022-11-27,0,764
Dành hơn 137.000 tỉ đồng phát triển kinh tế - xã hội vùng đồng bào dân tộc thiểu số,/danh-137-000-ti-dong-phat-trien-kinh-te-xa-hoi-vung-bao-dan-toc-thieu-so-20221124192934397.htm,2022-11-24,0,1126
Cụ thể hóa hành động phát triển đột phá vùng Đông Nam Bộ,/cu-the-hoa-hanh-dong-phat-trien-dot-pha-vung-dong-nam-bo-20221123203723892.htm,2022-11-24,0,1082
Phó thủ tướng Vũ Đức Đam: Có dữ liệu mà không truy cập được như xây nhà không móng,/pho-thu-tuong-vu-duc-dam-co-du-lieu-ma-khong-truy-cap-duoc-nhu-xay-nha-khong-mong-20221122131820029.htm,2022-11-22,0,1001
Thái Lan gồng mình vì cờ bạc cuồng World Cup,/thai-lan-gong-minh-vi-co-bac-cuong-world-cup-20221121202114999.htm,2022-11-22,0,823
"Phát hiện sai phạm hơn 2,2 tỉ đồng tại Sở Lao động - Thương binh và Xã hội tỉnh Gia Lai",/phat-hien-sai-pham-hon-2-2-ti-dong-tai-so-lao-dong-thuong-binh-va-xa-hoi-tinh-gia-lai-20221119164124246.htm,2022-11-19,0,839
Hộ chiếu văn hóa Việt Nam - Văn hóa thời đại số: Mạng xã hội và mối lo ngại phân cực thế hệ,/ho-chieu-van-hoa-viet-nam-van-hoa-thoi-dai-so-mang-xa-hoi-va-moi-lo-ngai-phan-cuc-the-he-20221118100017822.htm,2022-11-18,0,1763
Đà Nẵng: Chuyển đổi số giúp cuộc sống dân thuận tiện hơn,/da-nang-chuyen-doi-so-giup-cuoc-song-dan-thuan-tien-hon-20221116144652767.htm,2022-11-17,1,1842
"Làm việc tự do, làm sao để có lương hưu, Nhà nước hỗ trợ thế nào?",/lam-viec-tu-do-lam-sao-de-co-luong-huu-nha-nuoc-ho-tro-the-nao-20221114121833564.htm,2022-11-15,0,736
Chỉ tiêu chủ yếu tại nghị quyết về kế hoạch phát triển kinh tế - xã hội 2023,/chi-tieu-chu-yeu-tai-nghi-quyet-ve-ke-hoach-phat-trien-kinh-te-xa-hoi-2023-20221111085751806.htm,2022-11-11,0,430
Sở VH-TT Khánh Hòa phản hồi về việc sửa tháp Trầm Hương,/so-vhtt-khanh-hoa-phan-hoi-ve-viec-sua-thap-tram-huong-2022111011041482.htm,2022-10-11,0,1210
Cần cơ chế cho bảo vật hồi hương,/can-co-che-cho-bao-vat-hoi-huong-20221109075211922.htm,2022-09-11,0,1244
Thuyết âm mưu tràn ngập mạng xã hội Mỹ ngày bỏ phiếu giữa kỳ,/thuyet-am-muu-tran-ngap-mang-xa-hoi-my-ngay-bo-phieu-giua-ky-20221109065131725.htm,2022-09-11,0,996
Hơn 270.000 hộ dân vượt ngưỡng nghèo sau 20 năm,/hon-270-000-ho-dan-vuot-nguong-ngheo-sau-20-nam-20221104173652587.htm,2022-04-11,0,1049
"Bị chiếm đoạt SIM điện thoại, mất tiền tỉ",/bi-chiem-doat-sim-dien-thoai-mat-tien-ti-20221101215223421.htm,2022-02-11,0,1647
Ấm lòng cảnh sát đẩy xe lăn đi vá cho ông cụ bán vé số,/am-long-canh-sat-day-xe-lan-di-va-cho-ong-cu-ban-ve-so-20221031083714583.htm,2022-10-31,0,1012
Minh bạch thông tin là chìa khóa,/minh-bach-thong-tin-la-chia-khoa-20221028085345928.htm,2022-10-28,0,1002
"Tỉ phú Elon Musk tiếp quản Twitter, sa thải dàn lãnh đạo cấp cao",/ti-phu-elon-musk-tiep-quan-twitter-sa-thai-dan-lanh-dao-cap-cao-20221028084822322.htm,2022-10-28,0,804
TP Thủ Đức được tăng quyền ở 4 lĩnh vực,/tp-thu-duc-duoc-tang-quyen-o-4-linh-vuc-20221025182955068.htm,2022-10-25,0,1318
Bộ Công an: Thông tin 'tiếp tục xử lý một số tập đoàn kinh tế lớn' là sai sự thật,/bo-cong-an-thong-tin-tiep-tuc-xu-ly-mot-so-tap-doan-kinh-te-lon-la-sai-su-that-2022102516232298.htm,2022-10-25,0,1117
Quận 3 ra mắt Trung tâm dữ liệu và điều hành thông minh,/quan-3-ra-mat-trung-tam-du-lieu-va-dieu-hanh-thong-minh-20221020135057414.htm,2022-10-20,0,983
"Khai mạc kỳ họp thứ 4 Quốc hội khóa XV, xem xét nhân sự 3 bộ trưởng, trưởng ngành",/khai-mac-ky-hop-thu-4-quoc-hoi-khoa-xv-xem-xet-nhan-su-3-bo-truong-truong-nganh-20221020065628959.htm,2022-10-20,0,1418
TP.HCM tổ chức tọa đàm giá trị tác phẩm của Tổng bí thư về xây dựng chủ nghĩa xã hội,/tphcm-to-chuc-toa-dam-gia-tri-tac-pham-cua-tong-bi-thu-ve-xay-dung-chu-nghia-xa-hoi-20221018120744221.htm,2022-10-18,0,1129
"Có tâm lý e ngại, sợ sai khi thực hiện chương trình phục hồi kinh tế - xã hội",/co-tam-ly-e-ngai-so-sai-khi-thuc-hien-chuong-trinh-phuc-hoi-kinh-te-xa-hoi-20221017095852097.htm,2022-10-17,0,1397
"Cần nhiều hơn sự gắn kết, nghĩa tình ở các khu đô thị mới",/can-nhieu-hon-su-gan-ket-nghia-tinh-o-cac-khu-do-thi-moi-20221013200921862.htm,2022-10-13,0,1543
"Sau đại dịch COVID-19, gần 70% số nước trên thế giới không tăng lương tối thiểu",/sau-dai-dich-covid-19-gan-70-so-nuoc-tren-the-gioi-khong-tang-luong-toi-thieu-20221012141120958.htm,2022-12-10,0,941
SCB phủ nhận tin đồn về các thành viên ban kiểm soát và ban điều hành,/scb-phu-nhan-tin-don-ve-cac-thanh-vien-ban-kiem-soat-va-ban-dieu-hanh-20221012113218251.htm,2022-12-10,0,574
Đồng Tháp công bố đề án chuyển đổi số hơn 3.000 tỉ đồng,/dong-thap-cong-bo-de-an-chuyen-doi-so-hon-3-000-ti-dong-20221010184627693.htm,2022-10-10,3,897
Việt Nam đăng cai Tuần lễ số quốc tế 2022,/viet-nam-dang-cai-tuan-le-so-quoc-te-2022-20221010105112941.htm,2022-10-10,4,959
"245 dự án nhà ở xã hội, nhà ở công nhân ‘nằm chờ’ thủ tục",/245-du-an-nha-o-xa-hoi-nha-o-cong-nhan-nam-cho-thu-tuc-20221005150214416.htm,2022-05-10,0,1229
Đề nghị công an xác minh vụ vu khống phó chủ tịch HĐND 'đi ngoại tình bằng xe biển xanh',/de-nghi-cong-an-xac-minh-vu-vu-khong-pho-chu-tich-hdnd-di-ngoai-tinh-bang-xe-bien-xanh-20220930115921152.htm,2022-09-30,0,933
Phó chủ tịch HĐND tỉnh Đắk Lắk nói mình bị vu khống 'đi ngoại tình bằng xe biển xanh',/pho-chu-tich-hdnd-tinh-dak-lak-noi-minh-bi-vu-khong-di-ngoai-tinh-bang-xe-bien-xanh-2022093008271663.htm,2022-09-30,0,819
"Sự cố cầu Nguyễn Hữu Cảnh: Ngày mai mới có thông tin cụ thể nguyên nhân, giải pháp",/su-co-cau-nguyen-huu-canh-ngay-mai-moi-co-thong-tin-cu-the-nguyen-nhan-giai-phap-2022092917231254.htm,2022-09-29,0,912
TP.HCM chưa có trường cao đẳng tư thục nào được kiểm định tiêu chuẩn của Bộ LĐ-TB&XH,/tp-hcm-chua-co-truong-cao-dang-tu-thuc-nao-duoc-kiem-dinh-tieu-chuan-cua-bo-ld-tb-xh-202209291625044.htm,2022-09-29,0,838
"GDP 9 tháng qua tăng 8,83%, cao nhất giai đoạn 2011-2022",/gdp-9-thang-qua-tang-8-83-cao-nhat-giai-doan-2011-2022-20220929095301221.htm,2022-09-29,0,1339
Bí thư Nguyễn Văn Nên chủ trì hội nghị Thành ủy sơ kết việc phục hồi kinh tế sau dịch COVID-19,/bi-thu-nguyen-van-nen-chu-tri-hoi-nghi-thanh-uy-so-ket-viec-phuc-hoi-kinh-te-sau-dich-covid-19-20220929095813721.htm,2022-09-29,0,1242
Chính quyền TP Thuận An nói gì về video 'chở thi thể nạn nhân vụ cháy về quê lấy 6 triệu'?,/chinh-quyen-tp-thuan-an-noi-gi-ve-video-cho-xac-nan-nhan-vu-chay-ve-que-lay-6-trieu-20220911122256413.htm,2022-11-09,0,1017
Tại sao năm nào các bộ cũng phải có ý kiến và trình đề xuất số ngày nghỉ Tết?,/tai-sao-nam-nao-cac-bo-cung-phai-co-y-kien-va-trinh-de-xuat-so-ngay-nghi-tet-20220909100908341.htm,2022-09-09,0,1280
Tin thế giới 5-9: Truy lùng 2 hung thủ đâm hàng chục người; Siêu bão vào Trung Quốc,/tin-the-gioi-5-9-truy-lung-2-hung-thu-dam-hang-chuc-nguoi-sieu-bao-vao-trung-quoc-2022090500113397.htm,2022-05-09,0,1801
"Leonardo DiCaprio chỉ hẹn hò với những cô gái dưới 25 tuổi, có bình thường không?",/leonardo-dicaprio-chi-hen-ho-voi-nhung-co-gai-duoi-25-tuoi-co-binh-thuong-khong-20220904153002929.htm,2022-04-09,0,1067
Thường vụ Quốc hội không đồng ý chuyển tiền dành cho y tế sang làm đường,/thuong-vu-quoc-hoi-khong-dong-y-chuyen-tien-danh-cho-y-te-sang-lam-duong-2022082918484212.htm,2022-08-29,0,1489
"Giám đốc Sở Tài nguyên và môi trường xin chuyển công tác, được bầu làm phó trưởng Ban Dân tộc tỉnh",/giam-doc-so-tai-nguyen-va-moi-truong-xin-chuyen-cong-tac-duoc-bau-lam-pho-truong-ban-dan-toc-tinh-20220827115632145.htm,2022-08-27,0,857
Các trò giải trí cuốn hút hiện nay,/cac-tro-giai-tri-cuon-hut-hien-nay-2022082511252745.htm,2022-08-25,0,1076
Vì sao công chức TP.HCM bị quá tải?,/vi-sao-cong-chuc-tp-hcm-bi-qua-tai-20220825094031839.htm,2022-08-25,0,3526
"Sau khi mua trái phiếu, các công ty chứng khoán mang bán lại cho nhà đầu tư cá nhân",/sau-khi-mua-trai-phieu-cac-cong-ty-chung-khoan-mang-ban-lai-cho-nha-dau-tu-ca-nhan-20220819222918046.htm,2022-08-19,0,1034
Tin sáng 19-8: TP.HCM để quận huyện tự quyết 'số phận' chung cư cũ,/tin-sang-19-8-tp-hcm-de-quan-huyen-tu-quyet-so-phan-chung-cu-cu-20220818203406685.htm,2022-08-19,0,1665
Chuyển đổi số ở Đà Nẵng - động lực mới và cơ hội tăng tốc,/chuyen-doi-so-o-da-nang-dong-luc-moi-va-co-hoi-tang-toc-2022081808573015.htm,2022-08-18,2,1733
Lãnh đạo Đà Nẵng: Không có chủ trương bắt buộc học sinh tiêm vắc xin mới đến trường,/lanh-dao-da-nang-khong-co-chu-truong-bat-buoc-hoc-sinh-tiem-vac-xin-moi-den-truong-20220817212200516.htm,2022-08-17,0,775
"Mạng xã hội 'rần rần' review 'dìm hàng' quán ăn, TikToker có vi phạm Luật an ninh mạng?",/mang-xa-hoi-ran-ran-review-dim-hang-quan-an-tiktoker-co-vi-pham-luat-an-ninh-mang-20220811221924921.htm,2022-12-08,0,1781
"5,2 tỉ đồng hỗ trợ sinh viên 9 ngành khoa học cơ bản, ngôn ngữ",/52-ti-dong-ho-tro-sinh-vien-9-nganh-khoa-hoc-co-ban-ngon-ngu-20220808142040308.htm,2022-08-08,0,820
"Làm nhà ở xã hội: Doanh nghiệp có đất, tiền nhưng nản vì thủ tục",/lam-nha-o-xa-hoi-doanh-nghiep-co-dat-tien-nhung-nan-vi-thu-tuc-20220805230234714.htm,2022-06-08,0,1077
Không có bằng lái còn chạy xe biển giả ngũ quý 9 ‘cho oai’,/khong-co-bang-lai-con-chay-xe-bien-gia-ngu-quy-9-cho-oai-20220805093130892.htm,2022-05-08,0,765
"Cơ quan thuế rà soát truy thu, chủ shop online tìm trăm đường... trốn biệt",/co-quan-thue-ra-soat-truy-thu-chu-shop-online-tim-tram-duong-tron-biet-2022080508301017.htm,2022-05-08,0,2597
Bộ Thông tin và truyền thông thành lập 3 đơn vị chuyên về chuyển đổi số,/bo-thong-tin-va-truyen-thong-thanh-lap-3-don-vi-chuyen-ve-chuyen-doi-so-20220727170013707.htm,2022-07-27,3,744
"Vingroup động thổ dự án nhà ở xã hội tại Thanh Hóa, Quảng Trị",/vingroup-dong-tho-du-an-nha-o-xa-hoi-tai-thanh-hoa-quang-tri-20220727114514831.htm,2022-07-27,0,927
"Quá rắc rối, nhiêu khê, sao doanh nghiệp làm được nhà ở xã hội?",/qua-rac-roi-nhieu-khe-sao-doanh-nghiep-lam-duoc-nha-o-xa-hoi-20220726112250541.htm,2022-07-26,0,1139
'Sao kê' để nhẹ lòng từ thiện,/sao-ke-de-nhe-long-tu-thien-20220719083600457.htm,2022-07-19,0,1034
"Từ ngày 1-9, kêu gọi và phân phối nguồn từ thiện phải mở sổ kế toán ghi chép minh bạch",/tu-ngay-1-9-keu-goi-va-phan-phoi-nguon-tu-thien-phai-mo-so-ke-toan-ghi-chep-minh-bach-20220718112958885.htm,2022-07-18,0,974
Nhà ở xã hội 'dư mà thiếu',/nha-o-xa-hoi-du-ma-thieu-20220713183705764.htm,2022-07-13,0,470
"Hàn Quốc không giãn cách xã hội, chấp nhận ‘sống chung’ với làn sóng COVID-19 mới",/han-quoc-khong-gian-cach-xa-hoi-chap-nhan-song-chung-voi-lan-song-covid-moi-20220713141635763.htm,2022-07-13,0,1155
3 năm chỉ mới xong 20% thủ tục,/3-nam-chi-moi-xong-20-thu-tuc-20220711232346784.htm,2022-12-07,0,1049
Thế giới đạt 8 tỉ người năm 2022: cột mốc đầy cơ hội,/the-gioi-dat-8-ti-nguoi-nam-2022-cot-moc-day-co-hoi-20220711095931805.htm,2022-11-07,0,1292
"Chợ phiên Không tiền mặt: Cơ hội để bà con, công nhân tiếp cận những tiện ích mới nhất của xã hội",/cho-phien-khong-tien-mat-co-hoi-de-ba-con-cong-nhan-tiep-can-nhung-tien-ich-moi-nhat-cua-xa-hoi-20220709235252261.htm,2022-10-07,1,1781
Thủ tướng chủ trì hội nghị về vùng Đông Nam Bộ và vùng kinh tế trọng điểm phía Nam,/thu-tuong-chu-tri-hoi-nghi-ve-vung-dong-nam-bo-va-vung-kinh-te-trong-diem-phia-nam-2022070908203311.htm,2022-09-07,0,806
"Thí sinh nói bài thi khoa học xã hội dễ, bài khoa học tự nhiên có tính phân loại",/thi-sinh-noi-bai-thi-khoa-hoc-xa-hoi-de-bai-khoa-hoc-tu-nhien-co-tinh-phan-loai-20220708104457591.htm,2022-08-07,0,3698
"10 năm, Long An phát hiện 552 nguồn tin tội phạm về tham nhũng",/10-nam-long-an-phat-hien-552-nguon-tin-toi-pham-ve-tham-nhung-20220707165158726.htm,2022-07-07,0,977
"Giải ngân gói hỗ trợ tiền thuê nhà mới được hơn 1%, nhiều địa phương, doanh nghiệp 'sợ sai'",/giai-ngan-goi-ho-tro-tien-thue-nha-moi-duoc-hon-1-nhieu-dia-phuong-doanh-nghiep-so-sai-2022070420454042.htm,2022-04-07,0,1105
"Thủ tướng Phạm Minh Chính: Tình trạng thiếu thuốc, vật tư y tế... cần giải pháp phù hợp",/thu-tuong-pham-minh-chinh-tinh-trang-thieu-thuoc-vat-tu-y-te-can-giai-phap-phu-hop-2022070409363524.htm,2022-04-07,0,1261
"Đầu tư 4.950 tỉ đồng cáp ngầm kéo điện ra Côn Đảo, các bộ ngành, địa phương lưu ý gì?",/dau-tu-4-950-ti-dong-cap-ngam-keo-dien-ra-con-dao-cac-bo-nganh-dia-phuong-luu-y-gi-2022062810313553.htm,2022-06-28,0,1301
"Chuyển đổi số ngành báo chí: 'Podcast là thực tế, không còn là xu hướng'",/chuyen-doi-so-nganh-bao-chi-podcast-la-thuc-te-khong-con-la-xu-huong-20220627121607719.htm,2022-06-27,0,1117
"40-55% tàu cá cả nước nằm bờ vì giá dầu tăng, Bộ Nông nghiệp đề nghị hỗ trợ ngư dân",/40-55-tau-ca-ca-nuoc-nam-bo-vi-gia-dau-tang-bo-nong-nghiep-de-nghi-ho-tro-ngu-dan-20220624190510748.htm,2022-06-24,0,1024
Phá dây đề ở Bảo Lộc giao dịch hơn 300 triệu mỗi ngày,/pha-day-de-o-bao-loc-giao-dich-hon-300-trieu-moi-ngay-20220624143307618.htm,2022-06-24,0,950
Thanh toán không tiền mặt  - Cùng chuyển đổi và thích ứng,/thanh-toan-khong-tien-mat-cung-chuyen-doi-va-thich-ung-20220620122050473.htm,2022-06-20,0,442
An Giang: Vận hành thử nghiệm Trung tâm điều hành thông minh để giám sát 10 lĩnh vực,/an-giang-van-hanh-thu-nghiem-trung-tam-dieu-hanh-thong-minh-de-giam-sat-10-linh-vuc-20220620112833276.htm,2022-06-20,1,797
Phó thủ tướng Chính phủ tham quan và trải nghiệm triển lãm tại Ngày không tiền mặt,/pho-thu-tuong-chinh-phu-tham-quan-va-trai-nghiem-trien-lam-tai-ngay-khong-tien-mat-20220617172408283.htm,2022-06-17,0,1211
Video: Hội thảo 'Chuyển đổi số để hướng tới xã hội không dùng tiền mặt',/video-hoi-thao-chuyen-doi-so-de-huong-toi-xa-hoi-khong-dung-tien-mat-2022061711533217.htm,2022-06-17,0,396
Thanh toán không dùng tiền mặt là xu hướng phát triển trên thế giới,/thanh-toan-khong-dung-tien-mat-la-xu-huong-phat-trien-tren-the-gioi-20220617103434508.htm,2022-06-17,0,1308
Đoàn công tác xã hội BV ĐHYD TP.HCM: Không chỉ là hoạt động thiện nguyện mà còn đền ơn đáp nghĩa,/doan-cong-tac-xa-hoi-bv-dhyd-tphcm-khong-chi-la-hoat-dong-thien-nguyen-ma-con-den-on-dap-nghia-20220615173808752.htm,2022-06-15,0,489
"Cùng con vào thời đại số: Cha mẹ livestream, con lãnh hậu quả",/cung-con-vao-thoi-dai-so-cha-me-livestream-con-lanh-hau-qua-20220603231634938.htm,2022-04-06,0,1958
Đề xuất nhân thêm hệ số K vì lương tối thiểu giờ quá thấp,/de-xuat-nhan-them-he-so-k-vi-luong-toi-thieu-gio-qua-thap-20220603115118464.htm,2022-03-06,0,1244
AFC so sánh cú vô lê của Văn Tùng với huyền thoại Van Basten,/afc-so-sanh-cu-vo-le-cua-van-tung-voi-huyen-thoai-van-basten-20220603012358172.htm,2022-03-06,0,775
"Đại biểu Nguyễn Lân Hiếu: Ngành y 'đụng đâu cũng vướng, làm gì cũng có thể sai'",/dai-bieu-nguyen-lan-hieu-nganh-y-dung-dau-cung-vuong-lam-gi-cung-co-the-sai-20220601113440509.htm,2022-01-06,0,1257
Mỗi người dân Việt Nam sẽ đều có tài khoản nhận hỗ trợ từ Chính phủ,/moi-nguoi-dan-viet-nam-se-deu-co-tai-khoan-nhan-ho-tro-tu-chinh-phu-20220530195952464.htm,2022-05-30,0,1012
"Cùng tham gia khởi tạo gương mặt số, xây dựng trang web cá nhân",/cung-tham-gia-khoi-tao-guong-mat-so-xay-dung-trang-web-ca-nhan-20220530173033821.htm,2022-05-30,0,854
"Người già nhiều lên, vẫn loay hoay tìm 'mô hình viện dưỡng lão'",/nguoi-gia-nhieu-len-van-loay-hoay-tim-mo-hinh-vien-duong-lao-20220529083348263.htm,2022-05-29,0,2721
Học Big Data - đáp ứng 'cơn khát' nhân lực,/hoc-big-data-dap-ung-con-khat-nhan-luc-2022052710563949.htm,2022-05-29,0,1206
"Intel tiếp tục đầu tư vào Việt Nam, quy mô gấp nhiều lần hiện nay",/intel-tiep-tuc-dau-tu-vao-viet-nam-quy-mo-gap-nhieu-lan-hien-nay-20220527194220124.htm,2022-05-27,2,1190
"Gói hỗ trợ tiền thuê trọ: Chờ người lao động, doanh nghiệp làm hồ sơ",/goi-ho-tro-tien-thue-tro-cho-nguoi-lao-dong-doanh-nghiep-lam-ho-so-20220525223924376.htm,2022-05-26,0,1505
Cấp nước cho 10 triệu dân TP.HCM như thế nào?,/cap-nuoc-cho-10-trieu-dan-tp-hcm-nhu-the-nao-20220522102131771.htm,2022-05-22,0,1308
"Không chân, hai lần vượt cửa tử vẫn lạc quan sống",/khong-chan-hai-lan-vuot-cua-tu-van-lac-quan-song-20220517093520264.htm,2022-05-17,0,1589
Nói dối,/noi-doi-2022051608221968.htm,2022-05-16,0,937
Các bệnh viện đề xuất gì sau văn bản dừng thanh toán bảo hiểm y tế chi phí dịch vụ kỹ thuật?,/cac-benh-vien-de-xuat-gi-sau-van-ban-dung-thanh-toan-bao-hiem-y-te-chi-phi-dich-vu-ky-thuat-20220514120530004.htm,2022-05-14,0,1644
Trà Vinh khởi tố 7 bị can tham ô tài sản,/tra-vinh-khoi-to-7-bi-can-tham-o-tai-san-20220513194714823.htm,2022-05-13,0,663
"Elon Musk hoãn mua Twitter, giá cổ phiếu trượt xuống đáy",/elon-musk-hoan-mua-twitter-gia-co-phieu-truot-xuong-day-20220513190356189.htm,2022-05-13,0,825
Cô gái trong clip ‘đi xe số thì hơi dơ dơ’ báo công an vì cho rằng bị cắt ghép lời nói,/co-gai-trong-clip-di-xe-so-thi-hoi-do-do-bao-cong-an-vi-cho-rang-bi-cat-ghep-loi-noi-20220510174828026.htm,2022-10-05,0,776
"Trẻ tiêu chảy, nôn, sốt tăng, nhiều phụ huynh lo lắng",/tre-tieu-chay-non-sot-tang-nhieu-phu-huynh-lo-lang-20220509131614118.htm,2022-09-05,0,1519
Rút tiền mặt tại máy ATM bằng căn cước công dân gắn chip chỉ trong vài giây,/rut-tien-mat-tai-may-atm-bang-can-cuoc-cong-dan-gan-chip-chi-trong-vai-giay-20220509101236588.htm,2022-09-05,0,1055
Thí sinh chọn bài thi khoa học xã hội 'áp đảo',/thi-sinh-chon-bai-thi-khoa-hoc-xa-hoi-ap-dao-20220508093408379.htm,2022-08-05,0,1895
"Hạ viện Nga đề xuất đáp trả 'ăn miếng, trả miếng' việc tịch thu tài sản",/ha-vien-nga-de-xuat-dap-tra-an-mieng-tra-mieng-viec-tich-thu-tai-san-20220501144526583.htm,2022-01-05,0,844
Điều tra vụ một phụ nữ bị lừa đảo qua app chiếm đoạt hơn 700 triệu đồng,/dieu-tra-vu-mot-phu-nu-bi-lua-dao-qua-app-chiem-doat-hon-700-trieu-dong-20220430114902257.htm,2022-04-30,0,781
Bình Phước: Lấy người dân và doanh nghiệp làm trung tâm chuyển đổi số,/binh-phuoc-lay-nguoi-dan-va-doanh-nghiep-lam-trung-tam-chuyen-doi-so-20220428190915352.htm,2022-04-29,4,1135
"‘Trẻ hóa’ rút bảo hiểm xã hội một lần, số đông ở 20 - 30 tuổi",/tre-hoa-rut-bao-hiem-xa-hoi-mot-lan-so-dong-o-20-30-tuoi-20220428194303936.htm,2022-04-28,0,1122
"Khách phản ánh 'cân gian', Mũi Né lập điểm cân đối chứng ở ngay nơi bán hải sản",/khach-phan-anh-can-gian-mui-ne-lap-diem-can-doi-chung-o-ngay-noi-ban-hai-san-20220428171521666.htm,2022-04-28,0,879
BHXH TP.HCM đề nghị Bệnh viện Chợ Rẫy nhanh chóng cung ứng thuốc BHYT đang thiếu,/bhxh-tp-hcm-de-nghi-benh-vien-cho-ray-nhanh-chong-cung-ung-thuoc-bhyt-dang-thieu-20220428103913757.htm,2022-04-28,0,763
Hoạt động thiện nguyện - Nét đẹp trong văn hóa doanh nghiệp của Đại Hùng Thịnh,/hoat-dong-thien-nguyen-net-dep-trong-van-hoa-doanh-nghiep-cua-dai-hung-thinh-20220427183133949.htm,2022-04-28,0,1158
Nhà ở xã hội: Cần thêm nhiều hỗ trợ,/nha-o-xa-hoi-can-them-nhieu-ho-tro-20220427231034089.htm,2022-04-28,0,797
