Title,URL
Đón 1.250 du khách tàu biển,/don-1250-du-khach-tau-bien-334886.htm
Thế nào là quốc gia cạnh tranh? (tiếp theo),/the-nao-la-quoc-gia-canh-tranh-tiep-theo-334454.htm
Hàng Việt thẳng đường qua Mỹ,/hang-viet-thang-duong-qua-my-334322.htm
Tin tức cười,/tin-tuc-cuoi-331772.htm
Cần gói kích cầu thứ hai,/can-goi-kich-cau-thu-hai-332955.htm
"Hội Thảo ""Marketing qua internet - Hãy để khách hàng tìm thấy bạn""",/hoi-thao-marketing-qua-internet---hay-de-khach-hang-tim-thay-ban-332710.htm
Có nên thuê phun hóa chất diệt khuẩn?,/co-nen-thue-phun-hoa-chat-diet-khuan-332583.htm
Tin vắn 19-8,/tin-van-19-8-332471.htm
HP - Khẳng định một vị thế,/hp---khang-dinh-mot-vi-the-331695.htm
Khách sạn cao cấp vẫn chưa thể mở cửa muộn,/khach-san-cao-cap-van-chua-the-mo-cua-muon-331569.htm
"Hội Thảo ""Marketing qua internet - Hãy để khách hàng thấy bạn""",/hoi-thao-marketing-qua-internet---hay-de-khach-hang-thay-ban-331506.htm
Thuê bao trả trước phải đăng ký lại: Không để người sử dụng mất tiền,/thue-bao-tra-truoc-phai-dang-ky-lai-khong-de-nguoi-su-dung-mat-tien-331459.htm
Một số chủ xe ngưng chở hàng qua quốc lộ 80,/mot-so-chu-xe-ngung-cho-hang-qua-quoc-lo-80-331312.htm
Facebook mua FriendFeed giá 50 triệu USD,/facebook-mua-friendfeed-gia-50-trieu-usd-331227.htm
"Twitter, Facebook và Google bị dội bom DoS",/twitter-facebook-va-google-bi-doi-bom-dos-330598.htm
Chuyển tiền qua ngân hàng giao tận nhà,/chuyen-tien-qua-ngan-hang-giao-tan-nha-330502.htm
Chuỗi liên tục của hàng hóa,/chuoi-lien-tuc-cua-hang-hoa-329853.htm
StockOnMobile.com: phần mềm chứng khoán trên di động,/stockonmobilecom-phan-mem-chung-khoan-tren-di-dong-330235.htm
"Làm ăn gian dối, sớm muộn cũng phá sản",/lam-an-gian-doi-som-muon-cung-pha-san-329433.htm
Bán điện giá cao bị phạt 20-30 triệu đồng,/ban-dien-gia-cao-bi-phat-20-30-trieu-dong-328926.htm
Digiworld trở thành nhà phân phối thứ ba của Genius tại Việt Nam,/digiworld-tro-thanh-nha-phan-phoi-thu-ba-cua-genius-tai-viet-nam-327978.htm
Khu dân cư xây dựng mới được thêm tầng,/khu-dan-cu-xay-dung-moi-duoc-them-tang-327206.htm
Thận trọng khi mua hàng qua điện thoại,/than-trong-khi-mua-hang-qua-dien-thoai-327077.htm
Top 5 ứng dụng nghe nhạc miễn phí trên iPhone,/top-5-ung-dung-nghe-nhac-mien-phi-tren-iphone-326686.htm
"Đào hố gây sụt đất, ảnh hưởng nhà dân",/dao-ho-gay-sut-dat-anh-huong-nha-dan-325037.htm
Thận trọng với repo bất động sản,/than-trong-voi-repo-bat-dong-san-324992.htm
"""Thủ tiêu"" số điện thoại quấy rầy",/thu-tieu-so-dien-thoai-quay-ray-324770.htm
Viettel đơn phương dừng dịch vụ trên các đầu số,/viettel-don-phuong-dung-dich-vu-tren-cac-dau-so-324786.htm
"Viettel lại bị tố ""độc quyền""",/viettel-lai-bi-to-doc-quyen-324577.htm
Canon chiếm 62% thị phần máy in laser đơn chức năng tại Việt Nam,/canon-chiem-62-thi-phan-may-in-laser-don-chuc-nang-tai-viet-nam-321944.htm
Chỉ một cửa kiểm soát thực phẩm (*),/chi-mot-cua-kiem-soat-thuc-pham-320885.htm
Yahoo bổ sung một số dịch vụ mới,/yahoo-bo-sung-mot-so-dich-vu-moi-320498.htm
"Nhiều ""đại gia"" ""nhòm ngó"" đầu số 099",/nhieu-dai-gia-nhom-ngo-dau-so-099-320358.htm
Những dịch vụ lưu ảnh số tốt nhất,/nhung-dich-vu-luu-anh-so-tot-nhat-319633.htm
Phương pháp giảm cân toàn diện: Giảm… nhưng phải khỏe!,/phuong-phap-giam-can-toan-dien-giam…-nhung-phai-khoe-319357.htm
Samsung thu hồi khẩn cấp 160.000 điện thoại,/samsung-thu-hoi-khan-cap-160000-dien-thoai-319201.htm
"""Dế"" Sony Ericsson tích hợp dịch vụ tải phim miễn phí",/de-sony-ericsson-tich-hop-dich-vu-tai-phim-mien-phi-319178.htm
Tin vắn,/tin-van-318477.htm
Miễn phí đăng ký nhãn hiệu cho doanh nghiệp,/mien-phi-dang-ky-nhan-hieu-cho-doanh-nghiep-317981.htm
Viettel cung cấp thử nghiệm dịch vụ chuyển vùng quốc tế cho thuê bao di động trả trước,/viettel-cung-cap-thu-nghiem-dich-vu-chuyen-vung-quoc-te-cho-thue-bao-di-dong-tra-truoc-317467.htm
Hàn Quốc gặp khó trong phát triển IPTV,/han-quoc-gap-kho-trong-phat-trien-iptv-316696.htm
"Nguyên nhân các dịch vụ Google ""đột quỵ""",/nguyen-nhan-cac-dich-vu-google-dot-quy-316683.htm
Ai bảo vệ người tiêu dùng nông thôn?,/ai-bao-ve-nguoi-tieu-dung-nong-thon-316290.htm
Tạo email tạm để tránh thư rác,/tao-email-tam-de-tranh-thu-rac-316065.htm
Mẹo sao lưu album ảnh trực tuyến,/meo-sao-luu-album-anh-truc-tuyen-316063.htm
Nhà Đẹp - Không gian mua sắm mới,/nha-dep---khong-gian-mua-sam-moi-314716.htm
Khuyến mãi hấp dẫn dành cho dịch vụ điện thoại quốc tế,/khuyen-mai-hap-dan-danh-cho-dich-vu-dien-thoai-quoc-te-314988.htm
Từ chuyện các kênh truyền hình bị cắt sóng,/tu-chuyen-cac-kenh-truyen-hinh-bi-cat-song-314967.htm
Hủy chuyến bay: không được hoàn toàn bộ tiền vé,/huy-chuyen-bay-khong-duoc-hoan-toan-bo-tien-ve-313975.htm
"""Đổ nợ"" vì tin nhắn SMS",/do-no-vi-tin-nhan-sms-313806.htm
VDC cung cấp dịch vụ mạng riêng ảo giữa TP.HCM và Hong Kong,/vdc-cung-cap-dich-vu-mang-rieng-ao-giua-tphcm-va-hong-kong-313701.htm
Mang xe của khách đi luôn thì sao?,/mang-xe-cua-khach-di-luon-thi-sao-311710.htm
"""Loạn"" giá văcxin",/loan-gia-vacxin-311084.htm
Cổ phiếu OTC: nhiều lệnh mua số lượng lớn,/co-phieu-otc-nhieu-lenh-mua-so-luong-lon-310666.htm
Ra mắt mạng di động Vietnamobile,/ra-mat-mang-di-dong-vietnamobile-310193.htm
"""Thủ tiêu"" số điện thoại quấy rầy",/thu-tieu-so-dien-thoai-quay-ray-309077.htm
SPSC tuyển 300 du HS sang Nhật Bản,/spsc-tuyen-300-du-hs-sang-nhat-ban-308804.htm
Viettel thêm đầu số 0165,/viettel-them-dau-so-0165-307758.htm
Viettel cung cấp đầu số mới 0165,/viettel-cung-cap-dau-so-moi-0165-307766.htm
Dịch vụ du lịch tàu biển vẫn chưa hấp dẫn,/dich-vu-du-lich-tau-bien-van-chua-hap-dan-307437.htm
Năm 2009: 10 công nghệ mới đáng chú ý,/nam-2009-10-cong-nghe-moi-dang-chu-y-306908.htm
"Chương trình ""Thu Pin cũ – Đổi Pin mới""",/chuong-trinh-thu-pin-cu-–-doi-pin-moi-305993.htm
Gọi quốc tế rẻ như gọi di động trong nước,/goi-quoc-te-re-nhu-goi-di-dong-trong-nuoc-305974.htm
"Thưởng thức hải sản trên nhà hàng làng bè Long Sơn, Vũng Tàu",/thuong-thuc-hai-san-tren-nha-hang-lang-be-long-son-vung-tau-305466.htm
Phòng khám tư được nhượng quyền chăm sóc sức khỏe sinh sản,/phong-kham-tu-duoc-nhuong-quyen-cham-soc-suc-khoe-sinh-san-305260.htm
Giải quyết tình trạng mất việc: Dập lửa khi mới bắt đầu…,/giai-quyet-tinh-trang-mat-viec-dap-lua-khi-moi-bat-dau…-305084.htm
Yamaha- Hành trình xuyên Việt cùng Taurus chặng đông bắc,/yamaha--hanh-trinh-xuyen-viet-cung-taurus-chang-dong-bac-304040.htm
Kiến nghị tăng cường quản lý thuê bao Internet trả trước,/kien-nghi-tang-cuong-quan-ly-thue-bao-internet-tra-truoc-303823.htm
Thông tin thị trường,/thong-tin-thi-truong-303781.htm
Bơm tiền: DN có dễ tiếp cận?,/bom-tien-dn-co-de-tiep-can-302382.htm
Sẽ có thiết bị sạc điện thoại chuẩn toàn cầu,/se-co-thiet-bi-sac-dien-thoai-chuan-toan-cau-302345.htm
Đầu tư cho giáo dục - giải pháp sinh lợi cho tương lai,/dau-tu-cho-giao-duc---giai-phap-sinh-loi-cho-tuong-lai-302215.htm
430 triệu người dùng WiMAX,/430-trieu-nguoi-dung-wimax-301590.htm
"""TP.HCM: 100 điều thú vị""",/tphcm-100-dieu-thu-vi-301617.htm
Quản lý Gmail bằng thư mục,/quan-ly-gmail-bang-thu-muc-300477.htm
Đây là hình thức phạt bổ sung,/day-la-hinh-thuc-phat-bo-sung-300440.htm
Vietravel đón đoàn khách đầu tiên năm 2009 từ xứ sở Mặt trời mọc,/vietravel-don-doan-khach-dau-tien-nam-2009-tu-xu-so-mat-troi-moc-299704.htm
Cùng liên kết để kéo khách đến,/cung-lien-ket-de-keo-khach-den-297319.htm
"Năm mới, tản mạn về nhà tắm hơi kiểu Nga",/nam-moi-tan-man-ve-nha-tam-hoi-kieu-nga-296705.htm
"HP Scanjet G4050 và G4010: Quét rõ nét, phục hồi tài",/hp-scanjet-g4050-va-g4010-quet-ro-net-phuc-hoi-tai-298752.htm
Rồng rắn trước ATM,/rong-ran-truoc-atm-298670.htm
Email lừa đảo giả mạo Google,/email-lua-dao-gia-mao-google-298235.htm
Khởi động dự án đường sắt trên cao Yên Viên-Ngọc Hồi,/khoi-dong-du-an-duong-sat-tren-cao-yen-vien-ngoc-hoi-297637.htm
"Nguyễn Hoàng Trí Hiếu: giải đặc biệt chương trình ""Truy tìm số 9 may mắn"" của Vietravel",/nguyen-hoang-tri-hieu-giai-dac-biet-chuong-trinh-truy-tim-so-9-may-man-cua-vietravel-297566.htm
Thông tin thị trường,/thong-tin-thi-truong-297520.htm
Chưa thể bán tour giảm giá,/chua-the-ban-tour-giam-gia-296245.htm
Top 20 dịch vụ mạng xã hội năm 2008,/top-20-dich-vu-mang-xa-hoi-nam-2008-295778.htm
"Tuổi thọ tăng nhưng ""tuổi sức khỏe"" thấp",/tuoi-tho-tang-nhung-tuoi-suc-khoe-thap-295135.htm
Công ty Cổ phần Thế giới số Trần Anh hoàn tiền khi có biến động giá từ 20-12-2008 đến hết 15-2-2009,/cong-ty-co-phan-the-gioi-so-tran-anh-hoan-tien-khi-co-bien-dong-gia-tu-20-12-2008-den-het-15-2-2009-293935.htm
HP tiếp tục theo đuổi các giải pháp in màu tiết kiệm,/hp-tiep-tuc-theo-duoi-cac-giai-phap-in-mau-tiet-kiem-293629.htm
Chào năm mới với đầu số 0167 của Viettel,/chao-nam-moi-voi-dau-so-0167-cua-viettel-291859.htm
"Minute Maid Splash triển khai chiến dịch ""Không phải tép cam nào cũng như nhau""",/minute-maid-splash-trien-khai-chien-dich-khong-phai-tep-cam-nao-cung-nhu-nhau-291833.htm
"""Tháng xét nghiệm HIV tự nguyện tại VN""",/thang-xet-nghiem-hiv-tu-nguyen-tai-vn-291710.htm
"Vé tàu tết: trong hết, ngoài… vô tư",/ve-tau-tet-trong-het-ngoai…-vo-tu-291586.htm
Tăng trưởng phải nhìn thấy được,/tang-truong-phai-nhin-thay-duoc-291257.htm
Kích cầu thông qua tái cấu trúc kinh tế,/kich-cau-thong-qua-tai-cau-truc-kinh-te-291290.htm
Blog Yahoo!360 không bị đóng cửa,/blog-yahoo360-khong-bi-dong-cua-291139.htm
"""Tháng xét nghiệm HIV tự nguyện""",/thang-xet-nghiem-hiv-tu-nguyen-290890.htm
Chuyển đổi chức năng của các trường cai nghiện,/chuyen-doi-chuc-nang-cua-cac-truong-cai-nghien-290797.htm
Không tìm thấy melamine trong Enfamil Lipil của Mead Johnson tại Mỹ,/khong-tim-thay-melamine-trong-enfamil-lipil-cua-mead-johnson-tai-my-290414.htm
Chất lượng dịch vụ công ở TP.HCM: Dân kêu là phải!,/chat-luong-dich-vu-cong-o-tphcm-dan-keu-la-phai-290210.htm
Dịch vụ công ở TP.HCM: Mức độ hài lòng của người dân giảm,/dich-vu-cong-o-tphcm-muc-do-hai-long-cua-nguoi-dan-giam-289895.htm
Các ngân hàng thương mại được thu phí giao dịch thẻ ATM,/cac-ngan-hang-thuong-mai-duoc-thu-phi-giao-dich-the-atm-289087.htm
"Sài Gòn Co.op sẽ mua ""khu đất vàng"" 168 Nguyễn Đình Chiểu",/sai-gon-coop-se-mua-khu-dat-vang-168-nguyen-dinh-chieu-288988.htm
10.000 cẩm nang XKLĐ tặng người lao động,/10000-cam-nang-xkld-tang-nguoi-lao-dong-288796.htm
Ấn Độ - tình yêu của tôi,/an-do---tinh-yeu-cua-toi-288611.htm
Ngày hội việc làm Hoa ngữ,/ngay-hoi-viec-lam-hoa-ngu-288404.htm
Đặt chỗ mua vé tàu Tết qua tin nhắn: Không có số thứ tự sẽ được hoàn cước,/dat-cho-mua-ve-tau-tet-qua-tin-nhan-khong-co-so-thu-tu-se-duoc-hoan-cuoc-288367.htm
Stock on Mobile: Phần mềm chứng khoán trên di động,/stock-on-mobile-phan-mem-chung-khoan-tren-di-dong-286144.htm
Cách quay số điện thoại cố định theo đầu số mới,/cach-quay-so-dien-thoai-co-dinh-theo-dau-so-moi-285465.htm
AOL ngưng cung cấp hàng loạt dịch vụ,/aol-ngung-cung-cap-hang-loat-dich-vu-285448.htm
Cải chính,/cai-chinh-285242.htm
ORBIS tặng trang thiết bị nhãn khoa cho Hà Tĩnh,/orbis-tang-trang-thiet-bi-nhan-khoa-cho-ha-tinh-283299.htm
Xử lý hành chính học sinh tấn công các website,/xu-ly-hanh-chinh-hoc-sinh-tan-cong-cac-website-282951.htm
Tiếp tục điều tra học sinh tấn công các website,/tiep-tuc-dieu-tra-hoc-sinh-tan-cong-cac-website-282857.htm
Bắt giữ thủ phạm tấn công BKIS,/bat-giu-thu-pham-tan-cong-bkis-282640.htm
Sử dụng nguồn lực ngoài doanh nghiệp,/su-dung-nguon-luc-ngoai-doanh-nghiep-282444.htm
Israel - hành trình thiêng,/israel---hanh-trinh-thieng-282290.htm
HP Scanjet N9120 - giải pháp quét hoàn hảo dành cho doanh nghiệp,/hp-scanjet-n9120---giai-phap-quet-hoan-hao-danh-cho-doanh-nghiep-282257.htm
"Thêm số ""6"" vào số ĐTCĐ Viettel",/them-so-6-vao-so-dtcd-viettel-282071.htm
Chương trình hỗ trợ nạn nhân dioxin VN: Giải ngân 1 triệu USD đầu tiên,/chuong-trinh-ho-tro-nan-nhan-dioxin-vn-giai-ngan-1-trieu-usd-dau-tien-281332.htm
"""Công nghệ"" làm cao siêu tốc: thật hay dỏm?",/cong-nghe-lam-cao-sieu-toc-that-hay-dom-280843.htm
TCL - thành công từ chiến lược sáp nhập,/tcl---thanh-cong-tu-chien-luoc-sap-nhap-280395.htm
"""Vui có chừng - Dừng đúng lúc""",/vui-co-chung---dung-dung-luc-280020.htm
Điện thoại quốc tế 174 giá chỉ 1.990 đ/phút,/dien-thoai-quoc-te-174-gia-chi-1990-dphut-280017.htm
Kênh HDTV tại Việt Nam: Đã hoàn toàn là HD?,/kenh-hdtv-tai-viet-nam-da-hoan-toan-la-hd-279487.htm
Tôi đã gầy dựng được niềm tin và lòng nhân ái,/toi-da-gay-dung-duoc-niem-tin-va-long-nhan-ai-278381.htm
Quét virus trực tuyến miễn phí,/quet-virus-truc-tuyen-mien-phi-277860.htm
"""Siêu khuyến mại"" hỗ trợ giá từ 100.000 - 3 triệu đồng",/sieu-khuyen-mai-ho-tro-gia-tu-100000---3-trieu-dong-277700.htm
"Niêm phong hơn 600 bình gas ""lậu""",/niem-phong-hon-600-binh-gas-lau-276178.htm
"Cẩn thận với linh kiện ""độ""",/can-than-voi-linh-kien-do-275774.htm
Đội chủ giải thắng lớn,/doi-chu-giai-thang-lon-275370.htm
Đội chủ giải thắng lớn,/doi-chu-giai-thang-lon-892155.htm
"Mê hồn trận ""đại tu"" nhan sắc!",/me-hon-tran-dai-tu-nhan-sac-275288.htm
Tin nhắn ma lại hoành hành,/tin-nhan-ma-lai-hoanh-hanh-274921.htm
Quy định mức tiền môi giới tối đa NLĐ phải hoàn trả doanh nghiệp XKLĐ,/quy-dinh-muc-tien-moi-gioi-toi-da-nld-phai-hoan-tra-doanh-nghiep-xkld-274748.htm
Kiểm tra tình trạng nick Y! Messenger chính xác,/kiem-tra-tinh-trang-nick-y-messenger-chinh-xac-273027.htm
Treo ảnh lên internet với PhotoOnweb,/treo-anh-len-internet-voi-photoonweb-273019.htm
Xây dựng cam kết phục vụ cộng đồng,/xay-dung-cam-ket-phuc-vu-cong-dong-272846.htm
"Đấu giá khu đất 2-6 bis Điện Biên Phủ, TP.HCM: Chủ tài sản sẽ quyết định kết quả",/dau-gia-khu-dat-2-6-bis-dien-bien-phu-tphcm-chu-tai-san-se-quyet-dinh-ket-qua-272556.htm
"Khảo sát chỉ số hài lòng dịch vụ công: Dân hiểu mới ""chấm"" thật lòng",/khao-sat-chi-so-hai-long-dich-vu-cong-dan-hieu-moi-cham-that-long-272167.htm
"Những con ""dế"" rẻ và tốt nhất",/nhung-con-de-re-va-tot-nhat-272144.htm
Đấu giá khu đất đường Hùng Vương: Giá khởi điểm hơn 700 tỉ đồng,/dau-gia-khu-dat-duong-hung-vuong-gia-khoi-diem-hon-700-ti-dong-272027.htm
"Yahoo ""không cần xin phép""?",/yahoo-khong-can-xin-phep-271203.htm
Máy bay taxi lớn mạnh ở Brazil,/may-bay-taxi-lon-manh-o-brazil-271132.htm
"95% ""kêu"" về chất lượng đường truyền VN",/95-keu-ve-chat-luong-duong-truyen-vn-271061.htm
"Hàng nghìn website Việt ""chết"" do PAvietnam bị tấn công",/hang-nghin-website-viet-chet-do-pavietnam-bi-tan-cong-270900.htm
Pepsi Giai điệu số đang bước vào giai đoạn nước rút,/pepsi-giai-dieu-so-dang-buoc-vao-giai-doan-nuoc-rut-270258.htm
Khảo sát dịch vụ công năm 2008,/khao-sat-dich-vu-cong-nam-2008-270177.htm
Hàn Quốc: theo chồng thì bỏ cuộc chơi,/han-quoc-theo-chong-thi-bo-cuoc-choi-269509.htm
Nối tuyến du lịch Nhật Bản - Hoa Kỳ,/noi-tuyen-du-lich-nhat-ban---hoa-ky-269298.htm
"Icahn, Microsoft đề nghị giúp Yahoo kiếm 2,3 tỉ USD/năm",/icahn-microsoft-de-nghi-giup-yahoo-kiem-23-ti-usdnam-268623.htm
TP.HCM: Hội chợ Sức khỏe và dinh dưỡng 2008,/tphcm-hoi-cho-suc-khoe-va-dinh-duong-2008-267468.htm
"HP - COMPAQ ""Tài trợ thời bão giá""",/hp---compaq-tai-tro-thoi-bao-gia-267154.htm
VN cải thiện chỉ số minh bạch nhà đất,/vn-cai-thien-chi-so-minh-bach-nha-dat-266564.htm
"Xe 3-4 bánh tự chế từ 1-7: Xe nào được chạy, xe nào không?",/xe-3-4-banh-tu-che-tu-1-7-xe-nao-duoc-chay-xe-nao-khong-266443.htm
"Bảo hiểm Y tế: Báo động nguy cơ ""vỡ quĩ""!",/bao-hiem-y-te-bao-dong-nguy-co-vo-qui-266257.htm
Thị trường nhà đất cần tính minh bạch,/thi-truong-nha-dat-can-tinh-minh-bach-265444.htm
Yahoo! Mail có thêm 2 tên miền mới: Ymail và RocketMail,/yahoo-mail-co-them-2-ten-mien-moi-ymail-va-rocketmail-264879.htm
Du lịch kết hợp thăm thân nhân tại Mỹ,/du-lich-ket-hop-tham-than-nhan-tai-my-264321.htm
"TP.HCM: CPI tháng 6 tăng 2,37%",/tphcm-cpi-thang-6-tang-237-264423.htm
Trang web tiếp sức mùa thi,/trang-web-tiep-suc-mua-thi-264431.htm
Đình chỉ hai cơ sở đào tạo lái ôtô,/dinh-chi-hai-co-so-dao-tao-lai-oto-264198.htm
Đưa dịch vụ sức khỏe sinh sản về cộng đồng,/dua-dich-vu-suc-khoe-sinh-san-ve-cong-dong-263697.htm
DELL XPS M1330 tuyệt tác công nghệ số,/dell-xps-m1330-tuyet-tac-cong-nghe-so-262193.htm
Ra mắt tạp chí Hoa Hậu,/ra-mat-tap-chi-hoa-hau-260827.htm
"TP.HCM: chỉ số giá tiêu dùng tháng 5 tăng 4,24%",/tphcm-chi-so-gia-tieu-dung-thang-5-tang-424-259439.htm
Thông tin thị trường,/thong-tin-thi-truong-255986.htm
"""Trung Quốc xây căn cứ tàu ngầm hạt nhân trên biển Đông""",/trung-quoc-xay-can-cu-tau-ngam-hat-nhan-tren-bien-dong-255825.htm
"AOL, RN và Yahoo phải trả 100 triệu USD tiền bản quyền nhạc số",/aol-rn-va-yahoo-phai-tra-100-trieu-usd-tien-ban-quyen-nhac-so-255598.htm
Blogger sử dụng thống kê Analytics của Google,/blogger-su-dung-thong-ke-analytics-cua-google-255608.htm
Khi đạo đức kinh doanh cũng... nghỉ lễ!,/khi-dao-duc-kinh-doanh-cung-nghi-le-255711.htm
Vinasat 1 chuẩn bị vào đúng quĩ đạo,/vinasat-1-chuan-bi-vao-dung-qui-dao-255031.htm
"Chỉ 8,5 triệu thanh thiếu niên VN tiếp cận dịch vụ chăm sóc SKSS",/chi-85-trieu-thanh-thieu-nien-vn-tiep-can-dich-vu-cham-soc-skss-254375.htm
Mạng VNN gián đoạn gần mười ngày,/mang-vnn-gian-doan-gan-muoi-ngay-253988.htm
FPT Telecom được cung cấp dịch vụ VoIP,/fpt-telecom-duoc-cung-cap-dich-vu-voip-252031.htm
Mỹ: Chất lượng giao thông hàng không đang xuống dốc,/my-chat-luong-giao-thong-hang-khong-dang-xuong-doc-251666.htm
Đăng ký công chứng qua điện thoại như thế nào?,/dang-ky-cong-chung-qua-dien-thoai-nhu-the-nao-251518.htm
MobiFone cung cấp SIM nhiều tính năng,/mobifone-cung-cap-sim-nhieu-tinh-nang-251632.htm
Quảng Nam: tai nạn giao thông 2 người bị thương,/quang-nam-tai-nan-giao-thong-2-nguoi-bi-thuong-249667.htm
Giá văn phòng cho thuê tại Việt Nam: Đắt thứ 13 trên thế giới,/gia-van-phong-cho-thue-tai-viet-nam-dat-thu-13-tren-the-gioi-248886.htm
Thí điểm khám sức khỏe trước khi kết hôn,/thi-diem-kham-suc-khoe-truoc-khi-ket-hon-244365.htm
Thị trường địa ốc,/thi-truong-dia-oc-243956.htm
Đón xuân bên người thân,/don-xuan-ben-nguoi-than-243567.htm
Unilever Việt Nam chuyển về trụ sở làm việc mới,/unilever-viet-nam-chuyen-ve-tru-so-lam-viec-moi-242827.htm
"Kinh doanh dịch vụ vi tính, đóng thuế thu nhập thế nào?",/kinh-doanh-dich-vu-vi-tinh-dong-thue-thu-nhap-the-nao-241742.htm
"Đứt mạng Mega VNN, nhà cung cấp không biết",/dut-mang-mega-vnn-nha-cung-cap-khong-biet-239422.htm
Ưu đãi du lịch mùa tết tại Vietravel,/uu-dai-du-lich-mua-tet-tai-vietravel-239187.htm
Hoàn thành việc đổ bê tông tại cảng xuất sản phẩm Dung Quất,/hoan-thanh-viec-do-be-tong-tai-cang-xuat-san-pham-dung-quat-237975.htm
"""Xem mặt"" ngân hàng để làm thẻ ATM",/xem-mat-ngan-hang-de-lam-the-atm-238026.htm
Nhật: giới taxi nói không với thuốc lá,/nhat-gioi-taxi-noi-khong-voi-thuoc-la-237926.htm
"Những ""quả bom tấn"" tại CES 2008",/nhung-qua-bom-tan-tai-ces-2008-237774.htm
Ít siêu thị vì thiếu mặt bằng,/it-sieu-thi-vi-thieu-mat-bang-237708.htm
Quản thuê bao trả trước: Khách hàng giảm,/quan-thue-bao-tra-truoc-khach-hang-giam-237147.htm
Tải phim lên mạng dễ dàng hơn với Vidmetrix,/tai-phim-len-mang-de-dang-hon-voi-vidmetrix-235966.htm
Vì sao có hai số liệu về chỉ số giá?,/vi-sao-co-hai-so-lieu-ve-chi-so-gia-235912.htm
Du lịch dịp năm mới: giá tour sẽ tăng 20-30%,/du-lich-dip-nam-moi-gia-tour-se-tang-20-30-235431.htm
Quảng Ngãi: Khởi công Trung tâm dịch vụ dầu khí,/quang-ngai-khoi-cong-trung-tam-dich-vu-dau-khi-234975.htm
"Khu dân cư phường 25, quận Bình Thạnh sẽ phân thành hai vùng",/khu-dan-cu-phuong-25-quan-binh-thanh-se-phan-thanh-hai-vung-234782.htm
"Xin ông MobiFone đừng ""quấy rối"" nữa",/xin-ong-mobifone-dung-quay-roi-nua-232907.htm
Yahoo Flickr có thêm công cụ chỉnh sửa ảnh,/yahoo-flickr-co-them-cong-cu-chinh-sua-anh-232682.htm
"Phân khúc thị trường căn hộ cao cấp đang rất ""nóng""",/phan-khuc-thi-truong-can-ho-cao-cap-dang-rat-nong-232482.htm
"Du khách nước ngoài ""ghiền"" may đồ tốc hành",/du-khach-nuoc-ngoai-ghien-may-do-toc-hanh-231708.htm
Lỗi Firefox đe doạ người dùng Gmail,/loi-firefox-de-doa-nguoi-dung-gmail-229103.htm
Văcxin tả chỉ dùng cho vùng có nguy cơ,/vacxin-ta-chi-dung-cho-vung-co-nguy-co-229013.htm
Tra cứu nhạc chuông S-Fone bằng tin nhắn,/tra-cuu-nhac-chuong-s-fone-bang-tin-nhan-228394.htm
Sách nói kỹ thuật số cho người khiếm thị,/sach-noi-ky-thuat-so-cho-nguoi-khiem-thi-227419.htm
Câu chuyện ĐTDĐ ở Việt Nam,/cau-chuyen-dtdd-o-viet-nam-227290.htm
Nhà đầu tư cần biết (30-10),/nha-dau-tu-can-biet-30-10-227005.htm
Nở rộ dịch vụ chia sẻ video trực tuyến,/no-ro-dich-vu-chia-se-video-truc-tuyen-226803.htm
"Chỉ số giá tiêu dùng tháng 10 tăng 0,74%",/chi-so-gia-tieu-dung-thang-10-tang-074-226313.htm
TP Điện Biên Phủ sẽ được nâng cấp từ nguồn vốn WB,/tp-dien-bien-phu-se-duoc-nang-cap-tu-nguon-von-wb-226191.htm
Về An Giang mùa nước nổi,/ve-an-giang-mua-nuoc-noi-225011.htm
"Chấm dứt tình trạng tuyển lao động đi xuất khẩu phải có ""giấy phép con""",/cham-dut-tinh-trang-tuyen-lao-dong-di-xuat-khau-phai-co-giay-phep-con-223701.htm
"Chính phủ yêu cầu Bộ Quốc phòng sắp xếp lại nhà, đất tại TP.HCM",/chinh-phu-yeu-cau-bo-quoc-phong-sap-xep-lai-nha-dat-tai-tphcm-224810.htm
"Bạn đã biết cuộc thi ""Tú tài Số""?",/ban-da-biet-cuoc-thi-tu-tai-so-224215.htm
12 công nghệ sáng tạo nhất tại CEATEC,/12-cong-nghe-sang-tao-nhat-tai-ceatec-223536.htm
Tổng cục Du lịch yêu cầu chấn chỉnh hoạt động kinh doanh du lịch,/tong-cuc-du-lich-yeu-cau-chan-chinh-hoat-dong-kinh-doanh-du-lich-223379.htm
Trung Quốc: Thị trường sách trực tuyến có đóng phí đang phát triển,/trung-quoc-thi-truong-sach-truc-tuyen-co-dong-phi-dang-phat-trien-223306.htm
Đưa 34 lao động Việt Nam sang Nga làm việc,/dua-34-lao-dong-viet-nam-sang-nga-lam-viec-222844.htm
Tổng cục Du lịch yêu cầu: Chấn chỉnh hoạt động kinh doanh du lịch,/tong-cuc-du-lich-yeu-cau-chan-chinh-hoat-dong-kinh-doanh-du-lich-222576.htm
"Giá cả ""hăm he"" tăng thêm",/gia-ca-ham-he-tang-them-222315.htm
Loạn phí dịch vụ du học!,/loan-phi-dich-vu-du-hoc-220824.htm
VDC2 thay đổi mạng lưới - Internet gián đoạn,/vdc2-thay-doi-mang-luoi---internet-gian-doan-220210.htm
Nhà đầu tư cần biết (13-9),/nha-dau-tu-can-biet-13-9-219883.htm
Thanh niên xung phong thay công an trông giữ xe vi phạm,/thanh-nien-xung-phong-thay-cong-an-trong-giu-xe-vi-pham-219152.htm
Lao động dịch vụ thắng thế,/lao-dong-dich-vu-thang-the-218968.htm
ILO: Lao động dịch vụ đông nhất,/ilo-lao-dong-dich-vu-dong-nhat-85856.htm
Chủ thuê bao trả trước phải khai tên tuổi,/chu-thue-bao-tra-truoc-phai-khai-ten-tuoi-218774.htm
Trẻ không chỉ cần có chữ,/tre-khong-chi-can-co-chu-217952.htm
"Đập chợ Văn Thánh, xây casino Thanh Đa",/dap-cho-van-thanh-xay-casino-thanh-da-218259.htm
Hôn nhân = thay đổi số mệnh?,/hon-nhan-thay-doi-so-menh-218158.htm
ĐBSCL muốn phát triển thị trường vốn,/dbscl-muon-phat-trien-thi-truong-von-217766.htm
Trung Quốc: Khuyến khích blogger dùng tên thật,/trung-quoc-khuyen-khich-blogger-dung-ten-that-216812.htm
300 triệu USD cho du lịch và dịch vụ,/300-trieu-usd-cho-du-lich-va-dich-vu-216169.htm
Chủ nhà quá mạnh,/chu-nha-qua-manh-942945.htm
Chủ nhà quá mạnh,/chu-nha-qua-manh-214535.htm
"TP.HCM: xe ép rác gây tai nạn, 4 người bị thương",/tphcm-xe-ep-rac-gay-tai-nan-4-nguoi-bi-thuong-214946.htm
Nhà đầu tư cần biết (10-8),/nha-dau-tu-can-biet-10-8-214733.htm
Cảnh giác với nhắn tin trúng thưởng,/canh-giac-voi-nhan-tin-trung-thuong-214356.htm
