Title,URL
Năm 2017: được giữ nguyên số khi chuyển mạng di động,/nam-2017-duoc-giu-nguyen-so-khi-chuyen-mang-di-dong-570976.htm
EQVN – Khai giảng khóa học Facebook Marketing chuyên sâu,/eqvn-–-khai-giang-khoa-hoc-facebook-marketing-chuyen-sau-570810.htm
Đã được trả lại tiền bị chiếm dụng,/da-duoc-tra-lai-tien-bi-chiem-dung-570608.htm
Khóa học Digital Marketing - Chuyên Viên Tiếp Thị &amp; Quảng Cáo Internet,/khoa-hoc-digital-marketing---chuyen-vien-tiep-thi-amp-quang-cao-internet-570593.htm
Ngày hội văn hóa Nhật Bản tại TP.HCM,/ngay-hoi-van-hoa-nhat-ban-tai-tphcm-570585.htm
Dự án ODA đầu tiên dành cho phát triển trẻ mầm non,/du-an-oda-dau-tien-danh-cho-phat-trien-tre-mam-non-570597.htm
4 hậu quả khôn lường khi trẻ biếng ăn,/4-hau-qua-khon-luong-khi-tre-bieng-an-570532.htm
Yêu cầu chấn chỉnh chất lượng máy ATM,/yeu-cau-chan-chinh-chat-luong-may-atm-569965.htm
Dừng hoạt động các cơ sở giết mổ gia cầm nhỏ lẻ từ năm 2014,/dung-hoat-dong-cac-co-so-giet-mo-gia-cam-nho-le-tu-nam-2014-569751.htm
Khóa học Digital Marketing - Chuyên Viên Tiếp Thị &amp; Quảng Cáo Internet,/khoa-hoc-digital-marketing---chuyen-vien-tiep-thi-amp-quang-cao-internet-569394.htm
Ra mắt hệ thống đọc số liệu công tơ điện tử từ xa,/ra-mat-he-thong-doc-so-lieu-cong-to-dien-tu-tu-xa-569388.htm
Quảng cáo trên phim - thế nào là đủ?,/quang-cao-tren-phim---the-nao-la-du-568772.htm
Sẽ lập ban chỉ đạo điều hành giá của Thủ tướng,/se-lap-ban-chi-dao-dieu-hanh-gia-cua-thu-tuong-568601.htm
EQVN - Làm sao tăng doanh thu với Internet Marketing?,/eqvn---lam-sao-tang-doanh-thu-voi-internet-marketing-568401.htm
"Lương y Phạm Trọng Hùng với ""Vị Thống Hoàn"" trị đau dạ dày",/luong-y-pham-trong-hung-voi-vi-thong-hoan-tri-dau-da-day-568398.htm
EQVN- Làm sao tăng doanh thu với Internet Marketing?,/eqvn--lam-sao-tang-doanh-thu-voi-internet-marketing-568178.htm
METRO An Phú tăng diện tích bán hàng và tung khuyến mại lớn,/metro-an-phu-tang-dien-tich-ban-hang-va-tung-khuyen-mai-lon-567467.htm
"Doanh nghiệp nông, lâm, thủy sản dừng hoạt động tăng 71,3%",/doanh-nghiep-nong-lam-thuy-san-dung-hoat-dong-tang-713-567398.htm
Sự liên quan giữa tình hình tài chính và khả năng tư duy của não bộ,/su-lien-quan-giua-tinh-hinh-tai-chinh-va-kha-nang-tu-duy-cua-nao-bo-567084.htm
Yêu cầu cao hơn trong tuyển dụng,/yeu-cau-cao-hon-trong-tuyen-dung-566817.htm
Cuba hút khách bằng dịch vụ du lịch y tế,/cuba-hut-khach-bang-dich-vu-du-lich-y-te-566404.htm
Trưng bày Trang sức cổ Việt Nam,/trung-bay-trang-suc-co-viet-nam-566009.htm
Chủ tịch TP.HCM nói về vụ giám đốc nhận lương khủng,/chu-tich-tphcm-noi-ve-vu-giam-doc-nhan-luong-khung-566020.htm
Trưng bày Trang sức cổ Việt Nam,/trung-bay-trang-suc-co-viet-nam-565980.htm
Tiết kiệm gửi góp: Giải pháp tài chính cho tương lai,/tiet-kiem-gui-gop-giai-phap-tai-chinh-cho-tuong-lai-565860.htm
Ngày hội Vầng trăng yêu thương,/ngay-hoi-vang-trang-yeu-thuong-565815.htm
Khánh thành nhiều công trình giao thông trọng điểm,/khanh-thanh-nhieu-cong-trinh-giao-thong-trong-diem-565813.htm
"Chọn mua TV Android Box, xem phim trực tuyến từ HDTV",/chon-mua-tv-android-box-xem-phim-truc-tuyen-tu-hdtv-565308.htm
Vui Tết Trung thu tại Hà Nội,/vui-tet-trung-thu-tai-ha-noi-565435.htm
Thừa phát lại - Ông là ai ?,/thua-phat-lai---ong-la-ai-565432.htm
"Dân sống gần nơi gom rác ""kêu trời""!",/dan-song-gan-noi-gom-rac-keu-troi-565331.htm
Trường Đại Học UBIS – Thụy Sĩ xét tuyển học bổng,/truong-dai-hoc-ubis-–-thuy-si-xet-tuyen-hoc-bong-565030.htm
"Không được dùng vàng giữ hộ để cầm cố, thế chấp",/khong-duoc-dung-vang-giu-ho-de-cam-co-the-chap-564621.htm
"Những cách đơn giản giúp giảm đau, mệt mỏi ngày ""ấy""",/nhung-cach-don-gian-giup-giam-dau-met-moi-ngay-ay-564518.htm
"Khi bệnh huyết trắng ""tấn công"" nữ công sở",/khi-benh-huyet-trang-tan-cong-nu-cong-so-564293.htm
"Trò chuyện nghệ thuật về ""Ấn phẩm của nghệ sĩ""",/tro-chuyen-nghe-thuat-ve-an-pham-cua-nghe-si-564286.htm
Cùng trò chuyện về nhạc cổ điển với các nghệ sĩ,/cung-tro-chuyen-ve-nhac-co-dien-voi-cac-nghe-si-564287.htm
Đặt hàng Nokia Lumia 925 chính hãng nhận ngay quà tặng,/dat-hang-nokia-lumia-925-chinh-hang-nhan-ngay-qua-tang-563909.htm
Nỗi khổ huyết trắng tuổi tiền mãn kinh,/noi-kho-huyet-trang-tuoi-tien-man-kinh-563759.htm
"Hội thảo ""Viêm gan siêu vi B - Tác nhân gây Ung thư gan và Xơ gan""",/hoi-thao-viem-gan-sieu-vi-b---tac-nhan-gay-ung-thu-gan-va-xo-gan-563599.htm
Chất lượng không khí đang suy giảm nghiêm trọng,/chat-luong-khong-khi-dang-suy-giam-nghiem-trong-563577.htm
Nỗi khổ huyết trắng tuổi tiền mãn kinh,/noi-kho-huyet-trang-tuoi-tien-man-kinh-563575.htm
Đường dây nóng tiếp nhận thông tin về chủ quyền biển đảo,/duong-day-nong-tiep-nhan-thong-tin-ve-chu-quyen-bien-dao-562945.htm
"Dân Hà Nội xuống phố bắt cá, sửa xe",/dan-ha-noi-xuong-pho-bat-ca-sua-xe-562832.htm
Cuộc sống tiện nghi với những chuyển động uyển chuyển,/cuoc-song-tien-nghi-voi-nhung-chuyen-dong-uyen-chuyen-562290.htm
TP.HCM tổ chức thi thiết kế trang trí ánh sáng đường phố,/tphcm-to-chuc-thi-thiet-ke-trang-tri-anh-sang-duong-pho-562165.htm
Bài thuốc Gia truyền  Bẩy đời cho Bệnh Nhân Viêm Khớp,/bai-thuoc-gia-truyen-bay-doi-cho-benh-nhan-viem-khop-562181.htm
"""Thế hệ C"" đâu mong chờ chuyện giật gân?",/the-he-c-dau-mong-cho-chuyen-giat-gan-561774.htm
Gửi file dung lượng 1TB miễn phí,/gui-file-dung-luong-1tb-mien-phi-561559.htm
Học bổng bán phần từ ĐH Victoria (New Zealand),/hoc-bong-ban-phan-tu-dh-victoria-new-zealand-561411.htm
HP Pavilion TouchSmart 14 Sleekbook Tiện nghi 2 trong 1,/hp-pavilion-touchsmart-14-sleekbook-tien-nghi-2-trong-1-561194.htm
"Khi bệnh huyết trắng ""tấn công"" nữ công sở",/khi-benh-huyet-trang-tan-cong-nu-cong-so-561390.htm
"""Thần y phố núi"" và bài thuốc chữa dạ dày",/than-y-pho-nui-va-bai-thuoc-chua-da-day-561352.htm
"Khi bệnh huyết trắng ""tấn công"" nữ công sở",/khi-benh-huyet-trang-tan-cong-nu-cong-so-561223.htm
Nước Nga trong bảo tàng giữa làng quê Việt,/nuoc-nga-trong-bao-tang-giua-lang-que-viet-561225.htm
Ngày hội trao đổi sách cũ,/ngay-hoi-trao-doi-sach-cu-560468.htm
Giới thiệu nghề truyền thống tại phố cổ Hà Nội,/gioi-thieu-nghe-truyen-thong-tai-pho-co-ha-noi-560467.htm
"Xem miễn phí chương trình ""Chạm tay vào quá khứ""",/xem-mien-phi-chuong-trinh-cham-tay-vao-qua-khu-560466.htm
"Chương trình ""Họ ra đi khi còn rất trẻ""",/chuong-trinh-ho-ra-di-khi-con-rat-tre-560284.htm
"Khi bệnh huyết trắng ""tấn công"" nữ công sở",/khi-benh-huyet-trang-tan-cong-nu-cong-so-560224.htm
Bất cập nhất là giá dịch vụ ăn uống,/bat-cap-nhat-la-gia-dich-vu-an-uong-559645.htm
Khóa học Digital Marketing - Chuyên Viên Tiếp Thị &amp; Quảng Cáo Internet,/khoa-hoc-digital-marketing---chuyen-vien-tiep-thi-amp-quang-cao-internet-559434.htm
Khóa học Digital Marketing - Chuyên Viên Tiếp Thị &amp; Quảng Cáo Internet,/khoa-hoc-digital-marketing---chuyen-vien-tiep-thi-amp-quang-cao-internet-559432.htm
"Một số loại ""dược liệu"" thân thiện với tóc",/mot-so-loai-duoc-lieu-than-thien-voi-toc-558785.htm
Ép du khách sử dụng dịch vụ,/ep-du-khach-su-dung-dich-vu-558683.htm
Không được phép nhận mới các khoản giữ hộ vàng,/khong-duoc-phep-nhan-moi-cac-khoan-giu-ho-vang-558729.htm
Hoàng Tố Nữ - Chia sẻ nỗi lo thầm kín với chị em phụ nữ,/hoang-to-nu---chia-se-noi-lo-tham-kin-voi-chi-em-phu-nu-558436.htm
Hoàng Tố Nữ - Chia sẻ nỗi lo thầm kín với chị em phụ nữ,/hoang-to-nu---chia-se-noi-lo-tham-kin-voi-chi-em-phu-nu-558437.htm
Gắn kết bác sĩ tư và bảo hiểm y tế,/gan-ket-bac-si-tu-va-bao-hiem-y-te-558300.htm
"Một số loại ""dược liệu"" thân thiện với tóc",/mot-so-loai-duoc-lieu-than-thien-voi-toc-558013.htm
Hà Nội tăng viện phí lên gấp đôi mức hiện hành,/ha-noi-tang-vien-phi-len-gap-doi-muc-hien-hanh-557757.htm
Triển lãm ảnh Việt Nam - Venezuela,/trien-lam-anh-viet-nam---venezuela-557627.htm
Sử dụng an toàn các thiết bị có nguy cơ cháy nổ cao trong gia đình,/su-dung-an-toan-cac-thiet-bi-co-nguy-co-chay-no-cao-trong-gia-dinh-557626.htm
"Một số loại ""dược liệu"" thân thiện với tóc",/mot-so-loai-duoc-lieu-than-thien-voi-toc-557585.htm
"TP.HCM đề xuất tăng viện phí, học phí",/tphcm-de-xuat-tang-vien-phi-hoc-phi-557501.htm
Nhà vô địch Olympia 2012 Đặng Thái Hoàng chia sẻ kỹ năng viết trong IELTS,/nha-vo-dich-olympia-2012-dang-thai-hoang-chia-se-ky-nang-viet-trong-ielts-557434.htm
"Tưng bừng đón hè cùng ""Super Summer Sales"" của H.I.S",/tung-bung-don-he-cung-super-summer-sales-cua-his-557446.htm
TP.HCM đề xuất tăng phí các dịch vụ kỹ thuật y tế,/tphcm-de-xuat-tang-phi-cac-dich-vu-ky-thuat-y-te-557454.htm
Triển khai thử nghiệm Tổng đài thông tin du lịch 1087,/trien-khai-thu-nghiem-tong-dai-thong-tin-du-lich-1087-557263.htm
Máy tính xách tay HP Pavilion m4 - Mảnh mai hơn nhưng mạnh mẽ hơn,/may-tinh-xach-tay-hp-pavilion-m4---manh-mai-hon-nhung-manh-me-hon-557218.htm
Hoàng Tố Nữ - Chia sẻ nỗi lo thầm kín với chị em phụ nữ,/hoang-to-nu---chia-se-noi-lo-tham-kin-voi-chi-em-phu-nu-557202.htm
Địa chỉ giúp học sinh nhận bằng tốt nghiệp THPT của Hoa Kỳ hoặc Việt Nam,/dia-chi-giup-hoc-sinh-nhan-bang-tot-nghiep-thpt-cua-hoa-ky-hoac-viet-nam-557211.htm
Hoàng Tố Nữ - Chia sẻ nỗi lo thầm kín với chị em phụ nữ,/hoang-to-nu---chia-se-noi-lo-tham-kin-voi-chi-em-phu-nu-557025.htm
Nghiện rượu - Là thói xấu,/nghien-ruou---la-thoi-xau-556880.htm
"Một số loại ""dược liệu"" thân thiện với tóc",/mot-so-loai-duoc-lieu-than-thien-voi-toc-556824.htm
Hà Nội: phó phòng giao dịch thông đồng rút tiền ngân hàng,/ha-noi-pho-phong-giao-dich-thong-dong-rut-tien-ngan-hang-556498.htm
Có thể cải thiện vòng một sau sinh?,/co-the-cai-thien-vong-mot-sau-sinh-556435.htm
Dịch vụ xe ba bánh miễn phí cho người khuyết tật,/dich-vu-xe-ba-banh-mien-phi-cho-nguoi-khuyet-tat-554978.htm
"Sẽ có Internet tốc độ cao, giá rẻ",/se-co-internet-toc-do-cao-gia-re-556170.htm
Ngổn ngang Khu kinh tế Vân Phong,/ngon-ngang-khu-kinh-te-van-phong-555913.htm
Hoàng Tố Nữ - Chia sẻ nỗi lo thầm kín với chị em phụ nữ,/hoang-to-nu---chia-se-noi-lo-tham-kin-voi-chi-em-phu-nu-555929.htm
Điểm sáng trong giáo dục tư thục thành phố Hồ Chí Minh,/diem-sang-trong-giao-duc-tu-thuc-thanh-pho-ho-chi-minh-555935.htm
Bảo vệ động vật hoang dã chỉ bằng 1 cuộc điện thoại,/bao-ve-dong-vat-hoang-da-chi-bang-1-cuoc-dien-thoai-555944.htm
Hà Nội đề xuất tăng viện phí với 819 dịch vụ,/ha-noi-de-xuat-tang-vien-phi-voi-819-dich-vu-555619.htm
"BIDV Chợ Lớn trao giải đợt 1 chương trình ""May mắn trọn niềm vui""",/bidv-cho-lon-trao-giai-dot-1-chuong-trinh-may-man-tron-niem-vui-555360.htm
Khám phá Đông Dương bí ẩn với Indochina Project,/kham-pha-dong-duong-bi-an-voi-indochina-project-555207.htm
Có thể cải thiện vòng một sau sinh?,/co-the-cai-thien-vong-mot-sau-sinh-555130.htm
Không đăng ký dịch vụ nhạc chờ cũng bị trừ tiền,/khong-dang-ky-dich-vu-nhac-cho-cung-bi-tru-tien-554869.htm
Bệnh huyết trắng và giải pháp từ thiên nhiên,/benh-huyet-trang-va-giai-phap-tu-thien-nhien-554730.htm
Tham dự buổi giao lưu chuyên đề khoa học,/tham-du-buoi-giao-luu-chuyen-de-khoa-hoc-554577.htm
Tôn vinh những giá trị văn hóa trong Ngày hội Gia đình Việt Nam,/ton-vinh-nhung-gia-tri-van-hoa-trong-ngay-hoi-gia-dinh-viet-nam-554574.htm
Bệnh huyết trắng và giải pháp từ thiên nhiên,/benh-huyet-trang-va-giai-phap-tu-thien-nhien-554523.htm
"Hội thảo ""Theo dõi và điều trị tăng huyết áp""",/hoi-thao-theo-doi-va-dieu-tri-tang-huyet-ap-554531.htm
Tiếp cận phương pháp chăm sóc răng miệng theo tiêu chuẩn Nhật Bản,/tiep-can-phuong-phap-cham-soc-rang-mieng-theo-tieu-chuan-nhat-ban-554329.htm
Có thể cải thiện vòng một sau sinh?,/co-the-cai-thien-vong-mot-sau-sinh-554301.htm
Khóa học Digital Marketing - Chuyên viên tiếp thị &amp; quảng cáo internet,/khoa-hoc-digital-marketing---chuyen-vien-tiep-thi-amp-quang-cao-internet-553480.htm
Hỗ trợ sinh viên dân tộc khởi nghiệp,/ho-tro-sinh-vien-dan-toc-khoi-nghiep-553308.htm
"Gửi tiết kiệm ""Hè sôi động"" tại VietinBank trúng ô tô Corolla Altis",/gui-tiet-kiem-he-soi-dong-tai-vietinbank-trung-o-to-corolla-altis-553075.htm
Hoàng Tố Nữ - Chia sẻ nỗi lo thầm kín với chị em phụ nữ,/hoang-to-nu---chia-se-noi-lo-tham-kin-voi-chi-em-phu-nu-553125.htm
Một số loại dược liệu thân thiện với tóc,/mot-so-loai-duoc-lieu-than-thien-voi-toc-552607.htm
Triển lãm Sắc màu Bengal,/trien-lam-sac-mau-bengal-552454.htm
Đầu tư cho con cao lớn cùng thế giới - cha mẹ cần biết,/dau-tu-cho-con-cao-lon-cung-the-gioi---cha-me-can-biet-552467.htm
"Cửa đóng nhiều lớp, bên trong tiếp viên có biểu hiện khiêu dâm",/cua-dong-nhieu-lop-ben-trong-tiep-vien-co-bieu-hien-khieu-dam-552407.htm
Chương trình liên kết đào tạo trường ĐH Kinh Tế TP.HCM &amp; ĐH Victoria - New zealand,/chuong-trinh-lien-ket-dao-tao-truong-dh-kinh-te-tphcm-amp-dh-victoria---new-zealand-552112.htm
"Hạ nhiệt cho ngôi nhà mùa nóng bằng vật liệu ""xanh""",/ha-nhiet-cho-ngoi-nha-mua-nong-bang-vat-lieu-xanh-551908.htm
Thiếu máu và suy nhược ở người bệnh ung thư.,/thieu-mau-va-suy-nhuoc-o-nguoi-benh-ung-thu-551917.htm
Một số loại dược liệu thân thiện với tóc,/mot-so-loai-duoc-lieu-than-thien-voi-toc-551853.htm
"Làm gì khi bị u xơ tử cung, u nang buồng trứng?",/lam-gi-khi-bi-u-xo-tu-cung-u-nang-buong-trung-551514.htm
"Làm gì khi bị u xơ tử cung, u nang buồng trứng?",/lam-gi-khi-bi-u-xo-tu-cung-u-nang-buong-trung-550946.htm
Giải pháp mới ngăn ngừa và kiểm soát bệnh tiểu đường,/giai-phap-moi-ngan-ngua-va-kiem-soat-benh-tieu-duong-550904.htm
"Làm gì khi bị u xơ tử cung, u nang buồng trứng?",/lam-gi-khi-bi-u-xo-tu-cung-u-nang-buong-trung-550707.htm
"Cần dọn sạch ""rác"" trong khám chữa bệnh",/can-don-sach-rac-trong-kham-chua-benh-550595.htm
"Những điều chưa biết về u xơ tử cung, u nang buồng trứng",/nhung-dieu-chua-biet-ve-u-xo-tu-cung-u-nang-buong-trung-550062.htm
"""Phím số diệu kỳ-1800 1567"", đường dây tư vấn và hỗ trợ trẻ em",/phim-so-dieu-ky-1800-1567-duong-day-tu-van-va-ho-tro-tre-em-549720.htm
Trình diễn giao hưởng miễn phí dành cho giới trẻ,/trinh-dien-giao-huong-mien-phi-danh-cho-gioi-tre-549716.htm
"""Ăn theo"" lễ hội vía Bà",/an-theo-le-hoi-via-ba-549675.htm
Công khai đường dây nóng của Sở Y tế Hà Nội,/cong-khai-duong-day-nong-cua-so-y-te-ha-noi-549565.htm
"Những điều chưa biết về u xơ tử cung, u nang buồng trứng",/nhung-dieu-chua-biet-ve-u-xo-tu-cung-u-nang-buong-trung-549478.htm
Tư vấn miễn phí trong điều trị ung thư,/tu-van-mien-phi-trong-dieu-tri-ung-thu-549392.htm
"Những điều chưa biết về u xơ tử cung, u nang buồng trứng",/nhung-dieu-chua-biet-ve-u-xo-tu-cung-u-nang-buong-trung-549314.htm
Chứng rụng tóc và giải pháp hàng đầu,/chung-rung-toc-va-giai-phap-hang-dau-549013.htm
"Tham gia ngày hội nhân ái, vì sức khỏe cộng đồng 19-5",/tham-gia-ngay-hoi-nhan-ai-vi-suc-khoe-cong-dong-19-5-548840.htm
"Những điều chưa biết về u xơ tử cung, u nang buồng trứng",/nhung-dieu-chua-biet-ve-u-xo-tu-cung-u-nang-buong-trung-548820.htm
Chứng rụng tóc và giải pháp hàng đầu,/chung-rung-toc-va-giai-phap-hang-dau-548619.htm
Bức tranh ảm đạm,/buc-tranh-am-dam-548463.htm
Hoàng Tố Nữ - Chia sẻ nỗi lo thầm kín với chị em phụ nữ,/hoang-to-nu---chia-se-noi-lo-tham-kin-voi-chi-em-phu-nu-548443.htm
Chứng rụng tóc và giải pháp hàng đầu,/chung-rung-toc-va-giai-phap-hang-dau-548442.htm
Lập đường dây nóng cho du khách địa phương,/lap-duong-day-nong-cho-du-khach-dia-phuong-548286.htm
Chứng rụng tóc và giải pháp hàng đầu,/chung-rung-toc-va-giai-phap-hang-dau-548246.htm
Hà Nội điều chỉnh tăng viện phí bình quân gấp đôi,/ha-noi-dieu-chinh-tang-vien-phi-binh-quan-gap-doi-548201.htm
Bí quyết nhanh chóng mua được nhà,/bi-quyet-nhanh-chong-mua-duoc-nha-548125.htm
Hoàng Tố Nữ - Chia sẻ nỗi lo thầm kín với chị em phụ nữ,/hoang-to-nu---chia-se-noi-lo-tham-kin-voi-chi-em-phu-nu-548089.htm
Hoàng Tố Nữ - Chia sẻ nỗi lo thầm kín với chị em phụ nữ,/hoang-to-nu---chia-se-noi-lo-tham-kin-voi-chi-em-phu-nu-547589.htm
Hoàng Tố Nữ - Chia sẻ nỗi lo thầm kín với chị em phụ nữ,/hoang-to-nu---chia-se-noi-lo-tham-kin-voi-chi-em-phu-nu-547388.htm
EQVN - Ưu đãi 500.000đ khi đăng ký khóa học Internet Marketing.,/eqvn---uu-dai-500000d-khi-dang-ky-khoa-hoc-internet-marketing-547209.htm
Hoàng Tố Nữ - Chia sẻ nỗi lo thầm kín với chị em phụ nữ,/hoang-to-nu---chia-se-noi-lo-tham-kin-voi-chi-em-phu-nu-547175.htm
Khóa học Digital Marketing - Chuyên Viên Tiếp Thị &amp; Quảng Cáo Internet,/khoa-hoc-digital-marketing---chuyen-vien-tiep-thi-amp-quang-cao-internet-547166.htm
Hoàng Tố Nữ - Chia sẻ nỗi lo thầm kín với chị em phụ nữ,/hoang-to-nu---chia-se-noi-lo-tham-kin-voi-chi-em-phu-nu-546812.htm
Viettel được cấp phép triển khai dịch vụ truyền hình cáp,/viettel-duoc-cap-phep-trien-khai-dich-vu-truyen-hinh-cap-546506.htm
"Ngày hội Hướng nghiệp, dạy nghề",/ngay-hoi-huong-nghiep-day-nghe-546386.htm
Hà Nội cấp sổ đỏ cho các tổ chức qua mạng,/ha-noi-cap-so-do-cho-cac-to-chuc-qua-mang-546137.htm
Nguyễn Kim ưu đãi mua sắm đến 30%,/nguyen-kim-uu-dai-mua-sam-den-30-545379.htm
Ngày hội văn hóa - ẩm thực quốc tế tại Đà Nẵng,/ngay-hoi-van-hoa---am-thuc-quoc-te-tai-da-nang-545066.htm
Hoàng Tố Nữ - Chia sẻ nỗi lo thầm kín với chị em phụ nữ,/hoang-to-nu---chia-se-noi-lo-tham-kin-voi-chi-em-phu-nu-544757.htm
EQVN - Khai giảng khóa học Chuyên Viên Internet Marketing 57,/eqvn---khai-giang-khoa-hoc-chuyen-vien-internet-marketing-57-544640.htm
"Người Thượng Hải chi 8,64 tỉ USD mua hàng hiệu",/nguoi-thuong-hai-chi-864-ti-usd-mua-hang-hieu-544676.htm
Lễ hội bánh dân gian Nam Bộ lần 3,/le-hoi-banh-dan-gian-nam-bo-lan-3-544464.htm
Từ ngày 1-6 triển khai tháng hành động vì trẻ em năm 2013,/tu-ngay-1-6-trien-khai-thang-hanh-dong-vi-tre-em-nam-2013-543796.htm
Khóa học Digital Marketing - Chuyên viên tiếp thị &amp; quảng cáo internet,/khoa-hoc-digital-marketing---chuyen-vien-tiep-thi-amp-quang-cao-internet-543688.htm
Hoàng Tố Nữ - Chia sẻ nỗi lo thầm kín với chị em phụ nữ,/hoang-to-nu---chia-se-noi-lo-tham-kin-voi-chi-em-phu-nu-543378.htm
Hà Nội hỗ trợ lãi suất sau đầu tư cho doanh nghiệp,/ha-noi-ho-tro-lai-suat-sau-dau-tu-cho-doanh-nghiep-543195.htm
TP.HCM tăng hơn 500 chuyến xe buýt trong dịp lễ,/tphcm-tang-hon-500-chuyen-xe-buyt-trong-dip-le-543036.htm
Lên Hà Giang ăn cháo ấu tẩu,/len-ha-giang-an-chao-au-tau-542143.htm
Tiếp tục đổi mũ bảo hiểm chuẩn ở nhiều địa phương,/tiep-tuc-doi-mu-bao-hiem-chuan-o-nhieu-dia-phuong-541480.htm
"Đến Lai Châu thăm ""Tây Bắc đệ nhất động""",/den-lai-chau-tham-tay-bac-de-nhat-dong-541444.htm
"Vé số rách rời 8 mảnh,  Công ty XSKT Đà Nẵng vẫn trả thưởng",/ve-so-rach-roi-8-manh-cong-ty-xskt-da-nang-van-tra-thuong-540988.htm
Thiếu máu và suy nhược ở người bệnh ung thư.,/thieu-mau-va-suy-nhuoc-o-nguoi-benh-ung-thu-540770.htm
Thiết kế nội thất: Cánh tay đắc lực của kiến trúc công trình,/thiet-ke-noi-that-canh-tay-dac-luc-cua-kien-truc-cong-trinh-540729.htm
Lễ hội du lịch Cửa Lò 2013,/le-hoi-du-lich-cua-lo-2013-540317.htm
Xem phim cổ tích Đức miễn phí,/xem-phim-co-tich-duc-mien-phi-540161.htm
Tư vấn sức khỏe sinh sản tiền hôn nhân miễn phí,/tu-van-suc-khoe-sinh-san-tien-hon-nhan-mien-phi-540167.htm
"Hội thảo ""Tầm soát và điều trị ung thư cổ tử cung""",/hoi-thao-tam-soat-va-dieu-tri-ung-thu-co-tu-cung-540108.htm
Khóa học Digital Marketing - Chuyên viên tiếp thị &amp; quảng cáo internet,/khoa-hoc-digital-marketing---chuyen-vien-tiep-thi-amp-quang-cao-internet-539948.htm
"Triển lãm ảnh về Huế - ""Thành phố nước""",/trien-lam-anh-ve-hue---thanh-pho-nuoc-539675.htm
Nhiều cơ hội việc làm từ Cao đẳng Viễn Đông,/nhieu-co-hoi-viec-lam-tu-cao-dang-vien-dong-539640.htm
"Hội thảo "" Đầu tư vào đâu cho hiệu quả cao nhất ngay từ hôm nay """,/hoi-thao-dau-tu-vao-dau-cho-hieu-qua-cao-nhat-ngay-tu-hom-nay-539389.htm
"""Càng gọi càng may, trúng ngay tiền tỷ"" với Vietnamobile",/cang-goi-cang-may-trung-ngay-tien-ty-voi-vietnamobile-538944.htm
Phát hiện sớm rung tâm nhĩ bằng công nghệ AFIB - Microlife,/phat-hien-som-rung-tam-nhi-bang-cong-nghe-afib---microlife-538726.htm
"Chương trình khuyến mãi ""7 Ngày vàng Toshiba"" tại Siêu thị Điện máy Chợ Lớn",/chuong-trinh-khuyen-mai-7-ngay-vang-toshiba-tai-sieu-thi-dien-may-cho-lon-538142.htm
MobiFone khóa đầu số tin nhắn rác,/mobifone-khoa-dau-so-tin-nhan-rac-537945.htm
Tập đoàn AIA công bố kết quả kinh doanh kỷ lục trong năm 2012,/tap-doan-aia-cong-bo-ket-qua-kinh-doanh-ky-luc-trong-nam-2012-536755.htm
Hội thảo quốc tế về nghề dệt truyền thống,/hoi-thao-quoc-te-ve-nghe-det-truyen-thong-536458.htm
"Hội thảo tư vấn ""An toàn thai sản""",/hoi-thao-tu-van-an-toan-thai-san-535691.htm
Ga Sài Gòn giảm từ 5-20% giá vé trên một số tuyến,/ga-sai-gon-giam-tu-5-20-gia-ve-tren-mot-so-tuyen-535568.htm
Bệnh nhân chờ đợi vì sự cố mạng,/benh-nhan-cho-doi-vi-su-co-mang-535446.htm
Trên 52% doanh nghiệp kỳ vọng tăng doanh thu,/tren-52-doanh-nghiep-ky-vong-tang-doanh-thu-534735.htm
Miễn giảm học phí cho một số chuyên ngành y tế,/mien-giam-hoc-phi-cho-mot-so-chuyen-nganh-y-te-534646.htm
"Muốn đẹp như ""sao"" Hàn",/muon-dep-nhu-sao-han-533924.htm
An Giang: nhiều khu du lịch giảm giá cho SVHS,/an-giang-nhieu-khu-du-lich-giam-gia-cho-svhs-533531.htm
"Trưng bày chuyên đề ""Đèn cổ Việt Nam""",/trung-bay-chuyen-de-den-co-viet-nam-532740.htm
Thưởng thức nhạc Jazz tại Hà Nội,/thuong-thuc-nhac-jazz-tai-ha-noi-532745.htm
"Xóa, giảm nhiều khoản phí tại bến xe Cần Thơ",/xoa-giam-nhieu-khoan-phi-tai-ben-xe-can-tho-532640.htm
"Hà Nội tổ chức lễ hội dân gian ""Ông Công - Ông Táo""",/ha-noi-to-chuc-le-hoi-dan-gian-ong-cong---ong-tao-532154.htm
Lục lạc vàng và những cặp bò vàng,/luc-lac-vang-va-nhung-cap-bo-vang-532115.htm
Ngày hội giao lưu văn hóa Nhật Việt Touch 2013,/ngay-hoi-giao-luu-van-hoa-nhat-viet-touch-2013-531966.htm
"Quản lý, nhưng phải nhân văn",/quan-ly-nhung-phai-nhan-van-531731.htm
Lập đoàn kiểm tra thu phí tại bến xe Cần Thơ,/lap-doan-kiem-tra-thu-phi-tai-ben-xe-can-tho-531680.htm
Chỉ giải quyết phần ngọn...,/chi-giai-quyet-phan-ngon-531551.htm
Triển khai bán vé xe khách Tết qua mạng,/trien-khai-ban-ve-xe-khach-tet-qua-mang-531387.htm
Xây dựng tiêu chí và minh bạch phí dịch vụ chung cư,/xay-dung-tieu-chi-va-minh-bach-phi-dich-vu-chung-cu-531091.htm
20 giây,/20-giay-531136.htm
"Bảo hiểm y tế: 3 năm, kết dư trên 7.700 tỉ đồng",/bao-hiem-y-te-3-nam-ket-du-tren-7700-ti-dong-530658.htm
Bỗng dưng bị đăng ký dịch vụ xổ số,/bong-dung-bi-dang-ky-dich-vu-xo-so-530083.htm
Hướng dẫn quản lý và sử dụng phí qua phà,/huong-dan-quan-ly-va-su-dung-phi-qua-pha-530038.htm
Quy định mới về điều kiện thăng hạng viên chức,/quy-dinh-moi-ve-dieu-kien-thang-hang-vien-chuc-530032.htm
Mức quà tặng Tết cho người có công với cách mạng,/muc-qua-tang-tet-cho-nguoi-co-cong-voi-cach-mang-530034.htm
Một số điểm mới về thủ tục đăng ký và giải thể doanh nghiệp,/mot-so-diem-moi-ve-thu-tuc-dang-ky-va-giai-the-doanh-nghiep-529850.htm
28-6 là Ngày Gia đình Việt Nam,/28-6-la-ngay-gia-dinh-viet-nam-529687.htm
Rối loạn tập trung và biện pháp khắc phục,/roi-loan-tap-trung-va-bien-phap-khac-phuc-529425.htm
"Tăng ""zoom"" cho bộ nhớ trong của điện thoại thông minh",/tang-zoom-cho-bo-nho-trong-cua-dien-thoai-thong-minh-529381.htm
"Chương trình ""Gia đình - suối nguồn yêu thương""",/chuong-trinh-gia-dinh---suoi-nguon-yeu-thuong-529261.htm
Hàng công nghiệp nguy hiểm phải đóng gói khi vận chuyển,/hang-cong-nghiep-nguy-hiem-phai-dong-goi-khi-van-chuyen-529257.htm
