Title,URL
"K-Pop 'bùng nổ' toàn cầu, Boy with luv của BTS được streaming 380 triệu lượt",/k-pop-bung-no-toan-cau-boy-with-luv-cua-bts-duoc-streaming-380-trieu-luot-20200224144317958.htm
"Người làm việc tại các siêu thị, khu dịch vụ phải đo thân nhiệt trước khi đi làm",/nguoi-lam-viec-tai-cac-sieu-thi-khu-dich-vu-phai-do-nhiet-do-truoc-khi-di-lam-20200223181721193.htm
Đám cưới trong tháng 2 năm 2020 có gì vui?,/dam-cuoi-trong-thang-2-nam-2020-co-gi-vui-2020032093858215.htm
"Cần Thơ: kinh doanh du lịch, thương mại chịu tác động lớn của dịch corona",/can-tho-kinh-doanh-du-lich-thuong-mai-chiu-tac-dong-lon-cua-dich-corona-20200212131932451.htm
TP Hồ Chí Minh áp dụng thẻ thanh toán thông minh cho giao thông công cộng,/tp-ho-chi-minh-ap-dung-the-thanh-toan-thong-minh-cho-giao-thong-cong-cong-20200211135752744.htm
Cạnh tranh hàng không Việt Nam sẽ xoay quanh cuộc đua đúng giờ?,/canh-tranh-hang-khong-viet-nam-se-xoay-quanhcuoc-dua-dung-gio-20200205143434486.htm
Khẳng định vai trò dẫn dắt trong chuyển đổi số của nền kinh tế,/khang-dinh-vai-tro-dan-dat-trong-chuyen-doi-so-cua-nen-kinh-te-20200123120759729.htm
Nhiều dịch vụ đưa đón sân bay dịp tết,/nhieu-dich-vu-dua-don-san-bay-dip-tet-20200108084527461.htm
"Dân nhậu đã biết... sợ, quán sẵn sàng đưa về tận nhà",/dan-nhau-da-biet-so-quan-san-sang-dua-ve-tan-nha-20200107083807134.htm
Tương lai việc làm: Chuyển dịch từ lao động giản đơn sang lao động kỹ thuật bậc trung,/tuong-lai-viec-lam-chuyen-dich-tu-lao-dong-gian-don-sang-lao-dong-ky-thuat-bac-trung-1550676.htm
"Bị ‘hét giá’ gửi xe ngày tết, gọi đường dây nóng",/bi-het-gia-gui-xe-ngay-tet-goi-duong-day-nong-20200105132609197.htm
"Đi cùng, bứt phá, vươn lên bằng công nghệ",/di-cung-but-pha-vuon-len-bang-cong-nghe-20200101081005081.htm
5 ưu đãi 'vàng' cho khách hàng chuyển sang mạng MobiFone giữ nguyên số,/5-uu-dai-vang-cho-khach-hang-chuyen-sang-mang-mobifone-giu-nguyen-so-20191230164213554.htm
"Bùng nổ du lịch, Nhật siết chặt kiểm soát nhập cư năm 2020",/bung-no-du-lich-nhat-siet-chat-kiem-soat-nhap-cu-nam-2020-2019123009420618.htm
Đừng quá tin kết quả xét nghiệm mà 'sôi sục' rằng con là thần đồng,/dung-qua-tin-ket-qua-xet-nghiem-ma-soi-suc-rang-con-la-than-dong-20191227083154532.htm
VietinBank iPay: Đưa mọi trải nghiệm ngân hàng lên di động,/vietinbank-ipay-dua-moi-trai-nghiem-ngan-hang-len-di-dong-20191224155106198.htm
"Đập bỏ, xây mới ở làng bích họa Tam Thanh",/dap-bo-xay-moi-o-lang-bich-hoa-tam-thanh-20191212092538173.htm
Buồn thay làng bích họa Tam Thanh!,/buon-thay-lang-bich-hoa-tam-thanh-20191212083915565.htm
Đà Lạt vận hành trung tâm điều hành thông minh,/da-lat-van-hanh-trung-tam-dieu-hanh-thong-minh-20191211113855735.htm
"Du lịch Đà Nẵng: Nên chú trọng khách giàu, giảm phụ thuộc khách Hàn Quốc, Trung Quốc",/du-lich-da-nang-nen-chu-trong-khach-giau-giam-phu-thuoc-khach-han-quoc-trung-quoc-20191205132104196.htm
"Mỹ doạ áp thuế đến 100% đối với 2,4 tỉ USD hàng nhập khẩu từ Pháp",/my-doa-ap-thue-den-100-doi-voi-24-ti-usd-hang-nhap-khau-tu-phap-20191203100531581.htm
Cá nhân được xài ví điện tử không quá 100 triệu/tháng,/ca-nhan-duoc-xai-vi-dien-tu-khong-qua-100-trieu-thang-2019113016010539.htm
"Trục trặc phần mềm, Facebook bị lỗi trong nhiều giờ",/truc-trac-phan-mem-facebook-bi-loi-trong-nhieu-gio-20191129094049869.htm
"Dân TP.HCM được cấp đổi bằng lái xe qua mạng 'mọi lúc, mọi nơi' từ đầu tháng tới",/dan-tp-hcm-duoc-cap-doi-bang-lai-xe-qua-mang-moi-luc-moi-noi-tu-dau-thang-toi-20191122190951586.htm
Khách hàng Agribank đã có thể thanh toán dịch vụ trên ví điện tử VNPT Pay,/khach-hang-agribank-da-co-the-thanh-toan-dich-vu-tren-vi-dien-tu-vnpt-pay-20191119173500091.htm
"Số người dùng mạng 5G tăng nhanh, Hàn Quốc chuẩn bị ngừng dịch vụ 2G",/so-nguoi-dung-mang-5g-tang-nhanh-han-quoc-chuan-bi-ngung-dich-vu-2g-20191105111420674.htm
Thanh toán dịch vụ công không dùng tiền mặt,/thanh-toan-dich-vu-cong-khong-dung-tien-mat-20191105113611279.htm
Google đang bỏ dần một số dịch vụ lưu trữ miễn phí,/google-dang-bo-dan-mot-so-dich-vu-luu-tru-mien-phi-20191023145529482.htm
Sở Y tế khẳng định sẽ đình chỉ các cơ sở 'tay ngang' làm đẹp,/so-y-te-khang-dinh-se-dinh-chi-cac-co-so-tay-ngang-lam-dep-20191018142246061.htm
MobiFone Text To Speech Cloud: nền tảng cho giải pháp dịch vụ 4.0,/mobifone-text-to-speech-cloud-nen-tang-cho-giai-phap-dich-vu-4-0-20191011163524822.htm
Bộ trưởng Nguyễn Chí Dũng: Phải hành động để hiện thực hóa khát vọng thịnh vượng,/bo-truong-nguyen-chi-dung-phai-hanh-dong-de-hien-thuc-hoa-khat-vong-thinh-vuong-20190919102903184.htm
Quốc hội sẽ có nghị quyết riêng cho các vùng nghèo nhất,/quoc-hoi-se-co-nghi-quyet-rieng-cho-cac-vung-ngheo-nhat-20190918171648005.htm
Áp dụng trí tuệ nhân tạo trong bảo hiểm nhân thọ,/ap-dung-tri-tue-nhan-tao-trong-bao-hiem-nhan-tho-20190916103957517.htm
Vietnamobile đề nghị dừng chuyển mạng giữ số,/vietnamobile-de-nghi-dung-chuyen-mang-giu-so-20190813173726011.htm
Vietbank từng bước số hóa sản phẩm ngân hàng truyền thống,/vietbank-tung-buoc-so-hoa-san-pham-ngan-hang-truyen-thong-20190808154232718.htm
"Từ 20-8, viện phí tăng thêm 2-10% một số loại dịch vụ",/tu-20-8-vien-phi-tang-them-2-10-mot-so-loai-dich-vu-20190809143312381.htm
Phát triển thêm 50.000 doanh nghiệp ICT để đẩy nhanh chuyển đổi số,/phat-trien-them-50-000-doanh-nghiep-ict-de-day-nhanh-chuyen-doi-so-2019080813202487.htm
"Bảo vệ niềm tin công dân: Sửa tận gốc, dựng lòng tin",/bao-ve-niem-tin-cong-dan-sua-tan-goc-dung-long-tin-20190805080509828.htm
Điểm khác biệt trong chiến lược phát triển ngân hàng số,/diem-khac-biet-trong-chien-luoc-phat-trien-ngan-hang-so-201908011504337.htm
MB ra mắt hệ sinh thái số dành cho khách hàng doanh nghiệp,/mb-ra-mat-he-sinh-thai-so-danh-cho-khach-hang-doanh-nghiep-20190730112808168.htm
Thanh tra Chính phủ sẽ thí điểm tiếp dân qua mạng,/thanh-tra-chinh-phu-keu-kho-tiep-dan-qua-mang-20190730003819972.htm
Chi 15 triệu đồng có ngay luận văn thạc sĩ,/chi-15-trieu-dong-co-ngay-luan-van-thac-si-20190729091457145.htm
"Hoạt động tư vấn pháp luật, đại diện pháp lý phải theo quy định của Luật luật sư",/hoat-dong-tu-van-phap-luat-dai-dien-phap-ly-phai-theo-quy-dinh-cua-luat-luat-su-20190719152154573.htm
"Đầu tư shop: Ăn chắc mặc bền, gia tăng lợi nhuận",/dau-tu-shop-an-chac-mac-ben-gia-tang-loi-nhuan-20190718212922905.htm
Xử phạt hai khách sạn 27 triệu đồng vụ 'dùng khăn tắm lau bồn cầu',/xu-phat-hai-khach-san-27-trieu-dong-vu-dung-khan-tam-lau-bon-cau-2019071820524068.htm
"Pháp thông qua thuế mới, có thể khơi mào thương chiến Mỹ - Âu",/phap-thong-qua-thue-moi-co-the-khoi-mao-thuong-chien-my-au-20190711184805002.htm
TP.HCM cần dành thêm quỹ đất phát triển hạ tầng dịch vụ,/tphcm-can-danh-them-quy-dat-phat-trien-ha-tang-dich-vu-20190703183740157.htm
Viettel muốn trở thành nhà cung cấp dịch vụ số,/viettel-muon-tro-thanh-nha-cung-cap-dich-vu-so-20190626164553301.htm
Dịch vụ đặt đồ ăn trực tuyến nở rộ khiến Trung Quốc ngập rác nhựa,/dich-vu-dat-do-an-truc-tuyen-no-ro-khien-trung-quoc-ngap-rac-nhua-20190531102808552.htm
Sắp khai trương hệ thống eCabinet - chính phủ không giấy tờ,/sap-khai-truong-he-thong-ecabinet-chinh-phu-khong-giay-to-2019052916461834.htm
Khi nhà tù ở Bắc Kinh cũng không xài tiền mặt,/khi-nha-tu-o-bac-kinh-cung-khong-xai-tien-mat-20190516132946625.htm
"TP.HCM: Nơi nấu ăn một số trường có côn trùng, động vật gây hại",/tp-hcm-noi-nau-an-mot-so-truong-co-con-trung-dong-vat-gay-hai-20190510123331794.htm
"Hệ quả của tăng giá điện, xăng dầu, dịch vụ y tế dồn dập",/he-qua-cua-tang-gia-dien-xang-dau-dich-vu-y-te-don-dap-20190505221413422.htm
Mỹ điều tra 2 trường hợp nhiễm HIV do làm đẹp bằng lăn kim,/my-dieu-tra-2-truong-hop-nhiem-hiv-do-lam-dep-bang-lan-kim-20190501120444711.htm
Thêm một nhà mạng di động tham gia thị trường viễn thông,/them-mot-nha-mang-di-dong-tham-gia-thi-truong-vien-thong-20190425140630579.htm
Hạn mức giao dịch ví điện tử cá nhân không quá 20 triệu đồng/ ngày,/han-muc-giao-dich-vi-dien-tu-ca-nhan-khong-qua-20-trieu-dong-ngay-20190421171855714.htm
"Khởi tố, bắt tạm giam 4 tháng tài xế lái Lexus tông đội dịch vụ mai táng",/khoi-to-bat-tam-giam-4-thang-tai-xe-lai-lexus-tong-doi-dich-vu-mai-tang-20190419092500008.htm
"Video xe Lexus lao vào đội đưa tang, 3 người chết",/video-xe-lexus-lao-vao-doi-dua-tang-3-nguoi-chet-20190411171434218.htm
Trói chân người dùng trong thời thuê bao số,/troi-chan-nguoi-dung-trong-thoi-thue-bao-so-1494819.htm
Đặt điều kiện với ngành kinh doanh dịch vụ phụ trợ bảo hiểm,/dat-dieu-kien-voi-nganh-kinh-doanh-dich-vu-phu-tro-bao-hiem-2019041016202923.htm
Gọi hotline để được trợ giúp khi bị quấy rối tình dục trên xe buýt,/goi-hotline-de-duoc-tro-giup-khi-bi-quay-roi-tinh-duc-tren-xe-buyt-20190409162435604.htm
E ngại tiêm chủng mở rộng?,/e-ngai-tiem-chung-mo-rong-20190402083241167.htm
"Cuối 2019 cấp đổi bằng lái, đấu giá biển số xe qua mạng",/cuoi-2019-cap-doi-bang-lai-dau-gia-bien-so-xe-qua-mang-20190322094552183.htm
Nhiều tài khoản không dám chi tiền chạy quảng cáo trên Facebook,/nhieu-tai-khoan-khong-dam-chi-tien-chay-quang-cao-tren-facebook-20190314164518099.htm
Tổng cục Du lịch khuyến cáo về việc đi du lịch Ai Cập,/tong-cuc-du-lich-khuyen-cao-ve-viec-di-du-lich-ai-cap-20190312150946232.htm
Sống xanh hơn mỗi ngày: Thay đổi thói quen là hành trình dài,/song-xanh-hon-moi-ngay-thay-doi-thoi-quen-la-hanh-trinh-dai-20190311190006776.htm
"Ca mổ thành tựu 117-130 triệu đồng, làm sao người nghèo với tới?",/ca-mo-thanh-tuu-117-130-trieu-dong-lam-sao-nguoi-ngheo-voi-toi-20190302101024724.htm
"3 tháng, 53% thuê bao đăng ký chuyển mạng thành công",/3-thang-53-thue-bao-dang-ky-chuyen-mang-thanh-cong-20190223105242724.htm
Những dịch vụ nổi bật trên website ngân hàng số VIB,/nhung-dich-vu-noi-bat-tren-website-ngan-hang-so-vib-20190215104225327.htm
BOT phải minh bạch,/bot-phai-minh-bach-20190215081158432.htm
"Phó thủ tướng Vương Đình Huệ: Năm 2019, tập trung phát triển 5G",/pho-thu-tuong-vuong-dinh-hue-nam-2019-tap-trung-phat-trien-5g-20190211162306686.htm
Nhân dạng số - thật hay ảo?,/nhan-dang-so-that-hay-ao-20190128164250087.htm
Nhân dạng số - thật hay ảo?,/nhan-dang-so-that-hay-ao-1483933.htm
VIB tặng đến 300 triệu đồng khi đăng ký sản phẩm qua website,/vib-tang-den-300-trieu-dong-khi-dang-ky-san-pham-qua-website-20190124160821861.htm
VNPT chuyển hướng thành nhà cung cấp dịch vụ số,/vnpt-chuyen-huong-thanh-nha-cung-cap-dich-vu-so-2019011614490164.htm
Người nước ngoài đổ về Việt Nam khám bệnh,/nguoi-nuoc-ngoai-do-ve-viet-nam-kham-benh-20190114220253599.htm
"Nhà mạng tung chiêu kéo thuê bao mới, giữ chân khách cũ",/nha-mang-tung-chieu-keo-thue-bao-moi-giu-chan-khach-cu-20190106203356486.htm
Khi người trẻ vui vẻ đăng ký hiến tạng,/khi-nguoi-tre-vui-ve-dang-ky-hien-tang-20190104221613906.htm
115 triệu thuê bao di động trả trước bắt đầu được chuyển mạng giữ số,/115-trieu-thue-bao-di-dong-tra-truoc-bat-dau-duoc-chuyen-mang-giu-so-20190101104144814.htm
VNPAY được công nhận là ứng dụng công nghệ số xuất sắc năm 2018,/vnpay-duoc-cong-nhan-la-ung-dung-cong-nghe-so-xuat-sac-nam-2018-20181228170153351.htm
EVNSPC: Ra mắt Công ty Dịch vụ Điện lực miền Nam,/evnspc-ra-mat-cong-ty-dich-vu-dien-luc-mien-nam-20181228172503697.htm
Nhiều ngân hàng ngó lơ khiếu nại của khách hàng,/nhieu-ngan-hang-ngo-lo-khieu-nai-cua-khach-hang-2018122511045501.htm
Cho vay ngang hàng có thể mất tiền nếu xảy ra tranh chấp,/cho-vay-ngang-hang-co-the-mat-tien-neu-xay-ra-tranh-chap-20181224212210042.htm
Liên thông dữ liệu nhà đất: Người dân làm thủ tục 'phi địa giới',/lien-thong-du-lieu-nha-dat-nguoi-dan-lam-thu-tuc-phi-dia-gioi-2018122208405606.htm
Nhắn tin điện thoại ở California sẽ bị thu phí?,/nhan-tin-dien-thoai-o-california-se-bi-thu-phi-2018121411134798.htm
"Âm thanh, hình ảnh trên online sẽ bị 'quản chặt'?",/am-thanh-hinh-anh-tren-online-se-bi-quan-chat-20181212153706088.htm
"Cơ quan chức năng ra cảnh báo hình thức ""cho vay không cần gặp mặt""",/co-quan-chuc-nang-ra-canh-bao-hinh-thuc-cho-vay-khong-can-gap-mat-20181212142532486.htm
"Vừa ra mắt xe tay ga Pháp, đại lý đề nghị giảm giá để hút khách",/vua-ra-mat-xe-tay-ga-phap-dai-ly-de-nghi-giam-gia-de-hut-khach-20181207113834523.htm
Bcons lấn sân mạnh sang mảng dịch vụ,/bcons-lan-san-manh-sang-mang-dich-vu-20181206093552388.htm
Nhà mạng 'làm khó' chuyển mạng giữ số?,/nha-mang-lam-kho-chuyen-mang-giu-so-20181206080709012.htm
"Nhà mạng tung gói cước 0 đồng, đưa nhân viên tới tận nhà khách hàng",/nha-mang-tung-goi-cuoc-0-dong-dua-nhan-vien-toi-tan-nha-khach-hang-20181203081949216.htm
"Cứ 3 người Việt xài smartphone, có 2 người để chụp ‘tự sướng’",/cu-3-nguoi-viet-xai-smartphone-co-2-nguoi-de-chup-tu-suong-20181128115450441.htm
Bắt đầu chuyển mạng giữ số: chưa có khách,/bat-dau-chuyen-mang-giu-so-chua-co-khach-20181116110110246.htm
Quy trình khách hàng chuyển mạng giữ số ra sao?,/quy-trinh-khach-hang-chuyen-mang-giu-so-ra-sao-20181114152951346.htm
"Từ 16-11, thuê bao VinaPhone, Viettel và MobiFone được chuyển mạng giữ số",/tu-16-11-thue-bao-vinaphone-viettel-va-mobifone-duoc-chuyen-mang-giu-so-20181113151335033.htm
Tuần tới sẽ công bố mức phí chuyển đổi mạng giữ nguyên số,/tuan-toi-se-cong-bo-muc-phi-chuyen-doi-mang-giu-nguyen-so-20181112154838701.htm
"Ai sẽ phải “lưu dữ liệu, mở văn phòng”?",/ai-se-phai-luu-du-lieu-mo-van-phong-1468179.htm
"Xả thải vượt chuẩn, bị phạt hơn 800 triệu đồng",/xa-thai-vuot-chuan-bi-phat-hon-800-trieu-dong-20181108122257332.htm
Bắt đầu thực hiện chuyển mạng giữ số di động từ ngày 16-11,/bat-dau-thuc-hien-chuyen-mang-giu-so-di-dong-tu-ngay-16-11-2018102616205273.htm
Phá điểm đánh bạc lớn núp bóng game bắn cá ở Cai Lậy,/pha-diem-danh-bac-lon-nup-bong-game-ban-ca-o-cai-lay-20181026103613171.htm
Tôi đã có thẻ xanh như thế nào?,/toi-da-co-the-xanh-nhu-the-nao-1457729.htm
ACV vẫn quyết thu phí vào sân bay,/acv-van-quyet-thu-phi-vao-san-bay-20180716092147844.htm
Người dân Bình Dương sẽ được sử dụng internet theo chất lượng Nhật Bản,/nguoi-dan-binh-duong-se-duoc-su-dung-internet-theo-chat-luong-nhat-ban-20180706172638667.htm
Ông Nguyễn Đức Chung giải thích ý tưởng 'chia sẻ dữ liệu dân cư',/ong-nguyen-duc-chung-giai-thich-y-tuong-chia-se-du-lieu-dan-cu-20180705105553746.htm
Hà Nội đề xuất chia sẻ dữ liệu dân cư với ngành khác để thu giá,/ha-noi-de-xuat-chia-se-du-lieu-dan-cu-voi-nganh-khac-de-thu-gia-20180702154648644.htm
"Quảng Bình mạnh tay với nạn chèo kéo, 'chặt chém' giá cả ở Phong Nha",/quang-binh-manh-tay-voi-nan-cheo-keo-chat-chem-gia-ca-o-phong-nha-20180629150659503.htm
Người dân Bình Dương sử dụng internet theo chất lượng Nhật Bản,/nguoi-dan-binh-duong-su-dung-internet-theo-chat-luong-nhat-ban-20180620101835289.htm
"Chuyển 11 số thành 10 số, thuê bao di động lại khổ",/chuyen-11-so-thanh-10-so-thue-bao-di-dong-lai-kho-20180618082703119.htm
Đăng ký internet banking phải dùng số điện thoại 'chính chủ',/dang-ky-internet-banking-phai-dung-so-dien-thoai-chinh-chu-2018061618462226.htm
Mở rộng dịch vụ tài chính cho phụ nữ dân tộc thiểu số,/mo-rong-dich-vu-tai-chinh-cho-phu-nu-dan-toc-thieu-so-20180612201633512.htm
Đề nghị được dùng thẻ cào thanh toán các dịch vụ ngoài viễn thông,/de-nghi-duoc-dung-the-cao-thanh-toan-cac-dich-vu-ngoai-vien-thong-20180607170340844.htm
Viettel công bố chiến lược kinh doanh tại Myanmar,/viettel-cong-bo-chien-luoc-kinh-doanh-tai-myanmar-201806051428156.htm
"Các trường không cần 'giá dịch vụ', chỉ cần định nghĩa lại học phí",/cac-truong-khong-can-gia-dich-vu-chi-can-dinh-nghia-lai-hoc-phi-20180531143426496.htm
Bảo vệ chung cư 'điểm mặt' các tật xấu ảnh hưởng cộng đồng,/bao-ve-chung-cu-diem-mat-cac-tat-xau-anh-huong-cong-dong-20180519102102477.htm
6.100 tỉ USD có tiềm năng chuyển thành giao dịch điện tử,/6100-ti-usd-co-tiem-nang-chuyen-thanh-giao-dich-dien-tu-20180518182842089.htm
Gần 20% phụ nữ thành thị từ 15 - 49 tuổi từng phá thai,/gan-20-phu-nu-thanh-thi-tu-15-49-tuoi-tung-pha-thai-20180508172358915.htm
Báo cáo Thủ tướng về biện pháp quản lý thẻ cào di động,/bao-cao-thu-tuong-ve-bien-phap-quan-ly-the-cao-di-dong-20180504204611452.htm
Phải trả lại tiền 'thuế bò gặm cỏ' trước ngày 30-4,/phai-tra-lai-tien-thue-bo-gam-co-truoc-ngay-30-4-20180420190551268.htm
VTVcab hứa hoàn tiền nếu khách hàng muốn ngưng hợp đồng,/vtvcab-hua-hoan-tien-neu-khach-hang-muon-ngung-hop-dong-20180418150639806.htm
Ngân hàng Quân Đội thu khách sạn Bavico Đà Lạt để siết nợ,/ngan-hang-quan-doi-thu-khach-san-bavico-da-lat-de-siet-no-20180417182626615.htm
Sắp điều chỉnh giá dịch vụ khám chữa bệnh,/sap-dieu-chinh-gia-dich-vu-kham-chua-benh-20180410162039497.htm
"Khách hàng VTVCab, Viettel bỗng dưng mất HBO, Cinemax, Disney channel...",/khach-hang-vtvcab-viettel-bong-dung-mat-hbo-cinemax-disney-channel-20180402145950991.htm
"Trên 80% dân TP.HCM hài lòng, số liệu có thực chất?",/tren-80-dan-tp-hcm-hai-long-so-lieu-co-thuc-chat-20180315190348695.htm
Thu nhập của người lao động ở mọi ngành đều tăng,/thu-nhap-cua-nguoi-lao-dong-o-moi-nganh-deu-tang-20180315162129826.htm
Có thể quyết toán thuế thu nhập cá nhân qua dịch vụ điện tử,/co-the-quyet-toan-thue-thu-nhap-ca-nhan-qua-dich-vu-dien-tu-20180307104330262.htm
Cảnh cáo Đảng nguyên phó giám đốc Sở Tài chính Đồng Nai,/canh-cao-dang-nguyen-pho-giam-doc-so-tai-chinh-dong-nai-20180302135715603.htm
"Điện, xăng dầu đẩy CPI tháng sát tết tăng cao",/dien-xang-dau-day-cpi-thang-sat-tet-tang-cao-20180129164201888.htm
Một nửa dân số Việt Nam chưa có tài khoản ngân hàng,/mot-nua-dan-so-viet-nam-chua-co-tai-khoan-ngan-hang-20180122170556113.htm
"Sau 8 năm bị cấm, Google Maps tái xuất tại Trung Quốc",/sau-8-nam-bi-cam-google-maps-tai-xuat-tai-trung-quoc-20180116092512304.htm
Nhiều bệnh viện quá tải lo lắng,/nhieu-benh-vien-qua-tai-lo-lang-20180110095444751.htm
Dịch vụ chuyển mạng giữ số: Người dùng vẫn phải chờ,/dich-vu-chuyen-mang-giu-so-nguoi-dung-van-phai-cho-2018010308123973.htm
Cơ hội sở hữu iPhone X với giá 50.000 đồng,/co-hoi-so-huu-iphone-x-voi-gia-50000-dong-20171225174330529.htm
Người 'chữa bệnh' cho hệ thống y tế Mỹ,/nguoi-chua-benh-cho-he-thong-y-te-my-20171203104425342.htm
Thuê... sếp!,/thue-sep-20171128094215085.htm
"Gần 1,2 triệu điểm dịch vụ trên bản đồ số Cốc Cốc Map",/gan-12-trieu-diem-dich-vu-tren-ban-do-so-coc-coc-map-20171125182714458.htm
Nhân vật và doanh nghiệp có ảnh hưởng lớn nhất đến Internet VN 2007-2017,/nhan-vat-va-doanh-nghiep-co-anh-huong-lon-nhat-den-internet-vn-2007-2017-20171122172710172.htm
"Bán thông tin khách đi máy bay, chẳng lẽ bất lực?",/ban-thong-tin-khach-di-may-bay-chang-le-bat-luc-20171122150750265.htm
TP.HCM miễn phí cho khách đi buýt sông 10 ngày đầu tiên,/tphcm-mien-phi-cho-khach-di-buyt-song-10-ngay-dau-tien-20171122112756065.htm
Mexico - nơi Boyish của Hippo Campus được nghe 300 ngàn lần/tháng,/mexico-noi-boyish-cua-hippo-campus-duoc-nghe-300-ngan-lan-thang-20171119145503867.htm
Khó phát hiện gian lận bảo hiểm thất nghiệp,/kho-phat-hien-gian-lan-bao-hiem-that-nghiep-20171114085626057.htm
Công ty Vạn Thái trao hơn 153 triệu đồng hỗ trợ đồng bào vùng bão,/cong-ty-van-thai-trao-hon-153-trieu-dong-ho-tro-dong-bao-vung-bao-20171113174812187.htm
Một loạt hàng hóa tăng giá đẩy CPI tháng 10 tăng,/mot-loat-hang-hoa-tang-gia-day-cpi-thang-10-tang-20171029100942235.htm
Hơn 1 tỷ người trên thế giới không có danh tính chính thức,/hon-1-ty-nguoi-tren-the-gioi-khong-co-danh-tinh-chinh-thuc-20171016150547263.htm
"2,7 nghìn tỉ USD để phủ sóng đủ trạm sạc cho xe điện trên toàn cầu",/27-nghin-ti-usd-de-phu-song-du-tram-sac-cho-xe-dien-tren-toan-cau-20171012172209447.htm
"Không còn là mối đe dọa, ransomware giờ đã phát triển như một ngành công nghiệp",/khong-con-la-moi-de-doa-ransomware-gio-da-phat-trien-nhu-mot-nganh-cong-nghiep-20171012170257298.htm
50% chương trình truyền hình sẽ được xem trên smart-phone và máy tính bảng vào năm 2020,/50-chuong-trinh-truyen-hinh-se-duoc-xem-tren-smart-phone-va-may-tinh-bang-vao-nam-2020-2017101014463904.htm
Isuzu Việt Nam ra mắt trung tâm dịch vụ hậu mãi tại TP.HCM,/isuzu-viet-nam-ra-mat-trung-tam-dich-vu-hau-mai-tai-tphcm-20171003093637318.htm
Khách quốc tế đến TP.HCM tăng dịp cuối năm,/khach-quoc-te-den-tphcm-tang-dip-cuoi-nam-1396636.htm
"Chuyển mạng giữ số: 7 bước, 7 ngày",/chuyen-mang-giu-so-7-buoc-7-ngay-20170921132857122.htm
"Coi bài Tarot ở Sài Gòn, mê tín hay phong trào?",/78-la-bai-tarot-me-hoac-gioi-tre-sai-gon-20170919083128103.htm
"Chịu đóng phí tác quyền tivi, các chủ khách sạn đâu có... ngu!",/chiu-dong-phi-tac-quyen-tivi-cac-chu-khach-san-dau-co-ngu-20170919140948131.htm
Bí thư Hà Tĩnh: 'Không lợi dụng bão để ép giá vật liệu',/bi-thu-ha-tinh-khong-loi-dung-bao-ma-ep-gia-nang-gia-vat-lieu-20170917145538613.htm
Ngừng hỗ trợ cho website ủng hộ phân biệt chủng tộc,/ngung-ho-tro-cho-website-ung-ho-phan-biet-chung-toc-2017081715581965.htm
Châu Âu quyết ra tay xử dịch vụ Airbnb,/chau-au-quyet-ra-tay-xu-dich-vu-airbnb-1367578.htm
Tốc độ phát triển 4G ở VN không cao,/nhip-song-so/toc-do-phat-trien-4g-o-vn-khong-cao-20170727160558172.htm
Những thủ thuật dành cho dân 'ghiền' Netflix,/thu-thuat-kien-thuc/nhung-thu-thuat-danh-cho-dan-nghien-netflix-20170719125153059.htm
"SoundCloud lâm nguy, người dùng lo mất kho nhạc",/nhip-song-so/soundcloud-lam-nguy-nguoi-dung-lo-mat-kho-nhac-20170714144703105.htm
6 triệu khách hàng của Verizon bị rò rỉ dữ liệu,/nhip-song-so/6-trieu-khach-hang-cua-verizon-bi-ro-ri-du-lieu-20170714101532306.htm
Trung Quốc giới hạn giờ chơi game với trẻ,/nhip-song-so/trung-quoc-gioi-han-gio-choi-game-voi-tre-20170705103232613.htm
Bát nháo 'dịch vụ' dán tờ rơi,/bat-nhao-dich-vu-dan-to-roi-1342303.htm
Xin phép xây dựng trực tuyến: Quá khó!,/xin-phep-xay-dung-truc-tuyen-qua-kho-1335621.htm
Phạt 4 doanh nghiệp nhắn tin rác 240 triệu đồng,/nhip-song-so/phat-4-doanh-nghiep-nhan-tin-rac-240-trieu-dong-1324431.htm
​Prudential: Nâng cao dịch vụ vì lợi ích khách hàng,/prudential-nang-cao-dich-vu-vi-loi-ich-khach-hang-1322439.htm
​Số hóa ngân hàng là xu thế tất yếu,/so-hoa-ngan-hang-la-xu-the-tat-yeu-1320462.htm
Khi 'thượng đế' vẫn xếp ở chiếu dưới...,/khi-thuong-de-van-xep-o-chieu-duoi-1310577.htm
Du lịch Việt bỏ ngỏ thị trường trực tuyến,/du-lich/du-lich-viet-bo-ngo-thi-truong-truc-tuyen-1300413.htm
Nhà mạng Việt Nam đầu tiên chính thức cung cấp dịch vụ 4G,/nhip-song-so/nha-mang-viet-nam-dau-tien-chinh-thuc-cung-cap-dich-vu-4g-1300142.htm
Hơn 3.000 chỗ làm chờ người lao động,/hon-3000-cho-lam-cho-nguoi-lao-dong-1300034.htm
Hà Nội phải xem lại mình khi chỉ số PAPI xếp cuối,/ha-noi-phai-xem-lai-minh-khi-chi-so-papi-xep-cuoi-1293921.htm
Tỷ lệ dân phải 'lót tay' tăng lên,/lo-ngai-o-nhiem-moi-truong-tang-tham-nhung-chua-giam-1291991.htm
​Đà Nẵng cho người dân 'xếp hàng điện tử' làm thủ tục,/da-nang-cho-nguoi-dan-xep-hang-dien-tu-lam-thu-tuc-1287320.htm
"​Chặn cuộc gọi và tin nhắn quấy rối, cách nào?",/nhip-song-so/chan-cuoc-goi-va-tin-nhan-quay-roi-cach-nao-1285439.htm
"Hơn 8.000 clip độc, một số gắn quảng cáo thương hiệu lớn",/nhip-song-so/hon-8000-clip-doc-co-gan-quang-cao-tren-youtube-google-1281494.htm
Sẽ có thêm kênh nước ngoài trên truyền hình trả tiền,/se-co-them-kenh-nuoc-ngoai-tren-truyen-hinh-tra-tien-1278419.htm
Hàng không tăng chi phí vì giá xăng dầu,/hang-khong-tang-chi-phi-vi-gia-xang-dau-1271333.htm
