Title,URL,Publish Date,Mentioned Times,Word Count
Nâng cao chất lượng sống khi trải nghiệm số trở thành trải nghiệm của số đông,/nang-cao-chat-luong-song-khi-trai-nghiem-so-tro-thanh-trai-nghiem-cua-so-dong-1851516793.htm,2022-01-11,8,1236
KBank đặt mục tiêu cải tiến dịch vụ ngân hàng bằng công nghệ vượt trội,/kbank-dat-muc-tieu-cai-tien-dich-vu-ngan-hang-bang-cong-nghe-vuot-troi-1851494974.htm,2022-08-31,1,1140
Trải nghiệm số dành cho doanh nghiệp xuất nhập khẩu trên BIZ MBBANK: Tiện và nhanh,/trai-nghiem-so-danh-cho-doanh-nghiep-xuat-nhap-khau-tren-biz-mbbank-tien-va-nhanh-1851494853.htm,2022-08-31,2,1202
VNPT thúc đẩy chuyển đổi số tại Bình Dương,/vnpt-thuc-day-chuyen-doi-so-tai-binh-duong-1851470595.htm,2022-06-21,1,537
Vietnamobile và những bước ‘chuyển mình’ trong thời đại số,/vietnamobile-va-nhung-buoc-chuyen-minh-trong-thoi-dai-so-1851411253.htm,2021-12-14,2,877
FWD đứng đầu về trải nghiệm khách hàng tại Việt Nam,/fwd-dung-dau-ve-trai-nghiem-khach-hang-tai-viet-nam-1851397467.htm,2021-03-11,2,684
MB - FTU Digital Hub góp phần mở ra trải nghiệm số cho sinh viên Ngoại thương,/mb-ftu-digital-hub-gop-phan-mo-ra-trai-nghiem-so-cho-sinh-vien-ngoai-thuong-1851044842.htm,2021-10-03,2,1280
Spotify giúp người hâm mộ Liên Minh Huyền Thoại khám phá phong cách chơi game của họ,/spotify-giup-nguoi-ham-mo-lien-minh-huyen-thoai-kham-pha-phong-cach-choi-game-cua-ho-1851148489.htm,2020-10-28,1,488
Nam A Bank hợp tác cùng MISA nâng cao trải nghiệm ‘số hóa’ cho khách hàng,/nam-a-bank-hop-tac-cung-misa-nang-cao-trai-nghiem-so-hoa-cho-khach-hang-185936487.htm,2020-03-18,0,335
