Title,URL,Publish Date,Mentioned Times,Word Count
Bình Phước đứng đầu cả nước về thanh toán trực tuyến nghĩa vụ tài chính đất đai,/binh-phuoc-dung-dau-ca-nuoc-ve-thanh-toan-truc-tuyen-nghia-vu-tai-chinh-dat-dai-1851453411.htm,2022-04-29,16,458
Chuyển đổi số cần sản phẩm thật,/chuyen-doi-so-can-san-pham-that-1851453109.htm,2022-04-28,10,966
Chuyển đổi số gặp khó vì thiếu nhân lực chuyên môn,/chuyen-doi-so-gap-kho-vi-thieu-nhan-luc-chuyen-mon-1851452958.htm,2022-04-27,16,750
Eximbank triển khai tính năng mới trên online banking,/eximbank-trien-khai-tinh-nang-moi-tren-online-banking-1851452413.htm,2022-04-26,3,734
Nửa đêm chen lấn xếp hàng,/nua-dem-chen-lan-xep-hang-1851451956.htm,2022-04-25,2,798
10.10 là ngày chuyển đổi số quốc gia,/10-10-la-ngay-chuyen-doi-so-quoc-gia-1851451547.htm,2022-04-23,20,480
Thái Nguyên lập tổ hỗ trợ chuyển đổi số đến từng nhà,/thai-nguyen-lap-to-ho-tro-chuyen-doi-so-den-tung-nha-1851451465.htm,2022-04-23,11,880
"Lập tổ hỗ trợ miễn phí hợp tác xã, hộ kinh doanh chuyển đổi số",/lap-to-ho-tro-mien-phi-hop-tac-xa-ho-kinh-doanh-chuyen-doi-so-1851450625.htm,2022-04-20,17,777
Đồng Tháp thúc đẩy chuyển đổi số trên quy mô toàn tỉnh,/dong-thap-thuc-day-chuyen-doi-so-tren-quy-mo-toan-tinh-1851450226.htm,2022-04-20,13,1196
Bước phát triển mới trong chuyển đổi số ở Bình Dương,/buoc-phat-trien-moi-trong-chuyen-doi-so-o-binh-duong-1851450293.htm,2022-04-20,7,1146
FPT trình diễn hệ sinh thái giải pháp thúc đẩy kinh tế số,/fpt-trinh-dien-he-sinh-thai-giai-phap-thuc-day-kinh-te-so-1851449302.htm,2022-04-16,12,894
"Năm 2021, nền kinh tế số Việt Nam đạt giá trị 21 tỉ USD",/nam-2021-nen-kinh-te-so-viet-nam-dat-gia-tri-21-ti-usd-1851449181.htm,2022-04-16,12,847
"Tập trung thúc đẩy chuyển đổi số, kinh tế số để phát triển",/tap-trung-thuc-day-chuyen-doi-so-kinh-te-so-de-phat-trien-1851449082.htm,2022-04-16,4,1765
"VNPT trình diễn nền tảng, hệ sinh thái ứng dụng chuyển đổi số",/vnpt-trinh-dien-nen-tang-he-sinh-thai-ung-dung-chuyen-doi-so-1851449013.htm,2022-04-15,22,1161
"Bộ TN-MT: Số hóa đất đai, môi trường để làm động lực phát triển bền vững",/bo-tn-mt-so-hoa-dat-dai-moi-truong-de-lam-dong-luc-phat-trien-ben-vung-1851448869.htm,2022-04-15,5,747
Nuôi dưỡng nhân lực chuyển đổi số từ cấp học cơ sở,/nuoi-duong-nhan-luc-chuyen-doi-so-tu-cap-hoc-co-so-1851448585.htm,2022-04-15,12,1144
"Không chuyển đổi số, báo chí sẽ mất độc giả",/khong-chuyen-doi-so-bao-chi-se-mat-doc-gia-1851448632.htm,2022-04-14,11,736
TP.HCM: Thời gian mất điện giảm hơn 35% mỗi năm,/tp-hcm-thoi-gian-mat-dien-giam-hon-35-moi-nam-1851447801.htm,2022-12-04,3,482
Tuổi trẻ Cảng Đà Nẵng sáng tạo trong công cuộc chuyển đổi số,/tuoi-tre-cang-da-nang-sang-tao-trong-cong-cuoc-chuyen-doi-so-1851446116.htm,2022-06-04,3,712
6 định hướng chuyển đổi số năm 2022,/6-dinh-huong-chuyen-doi-so-nam-2022-1851446064.htm,2022-06-04,11,546
ĐBSCL đối mặt nhiều khó khăn trong chuyển đổi số,/dbscl-doi-mat-nhieu-kho-khan-trong-chuyen-doi-so-1851445811.htm,2022-05-04,2,590
TP.HCM: Chủ tịch Phan Văn Mãi làm Trưởng ban chỉ đạo chuyển đổi số,/tp-hcm-chu-tich-phan-van-mai-lam-truong-ban-chi-dao-chuyen-doi-so-1851444921.htm,2022-03-04,10,553
"Bộ Nội vụ chi hàng trăm tỉ chuyển đổi số, lập trung tâm điều hành thông minh",/bo-noi-vu-chi-hang-tram-ti-chuyen-doi-so-lap-trung-tam-dieu-hanh-thong-minh-1851444727.htm,2022-02-04,16,842
Fintech 'khát' nhân lực ngành CNTT,/fintech-khat-nhan-luc-nganh-cntt-1851444684.htm,2022-02-04,4,1032
Đẩy mạnh quan hệ hợp tác Việt Nam - Liên bang Đức,/day-manh-quan-he-hop-tac-viet-nam-lien-bang-duc-1851444304.htm,2022-01-04,2,464
MSB nhận giải thưởng Ngân hàng chuyển đổi số tiêu biểu,/msb-nhan-giai-thuong-ngan-hang-chuyen-doi-so-tieu-bieu-1851444160.htm,2022-03-31,5,1130
BIDV nhận đồng thời 4 giải thưởng Ngân hàng Việt Nam tiêu biểu,/bidv-nhan-dong-thoi-4-giai-thuong-ngan-hang-viet-nam-tieu-bieu-1851443830.htm,2022-03-31,6,993
Báo chí cần sẵn sàng tâm thế chuyển đổi số,/bao-chi-can-san-sang-tam-the-chuyen-doi-so-1851443933.htm,2022-03-31,13,596
"Chuyển đổi số trong cơ quan báo chí: Muốn an toàn, sợ rủi ro thì không thể thực hiện",/chuyen-doi-so-trong-co-quan-bao-chi-muon-an-toan-so-rui-ro-thi-khong-the-thuc-hien-1851443843.htm,2022-03-30,14,820
Giải mã lý do người dùng Việt dần ưa chuộng đồ nội địa: Sức mạnh của TMĐT,/giai-ma-ly-do-nguoi-dung-viet-dan-ua-chuong-do-noi-dia-suc-manh-cua-tmdt-1851443818.htm,2022-03-30,2,1132
Bộ trưởng Nguyễn Mạnh Hùng: 'Thanh niên Việt Nam hãy giương cao ngọn cờ chuyển đổi số',/bo-truong-nguyen-manh-hung-thanh-nien-viet-nam-hay-giuong-cao-ngon-co-chuyen-doi-so-1851443783.htm,2022-03-30,16,1017
Thanh Niên Online ra mắt trang Công nghệ - Game,/thanh-nien-online-ra-mat-trang-cong-nghe-game-1851443544.htm,2022-03-30,3,1207
Techcombank chinh phục hành trình số để nâng tầm giá trị cuộc sống,/techcombank-chinh-phuc-hanh-trinh-so-de-nang-tam-gia-tri-cuoc-song-1851442280.htm,2022-03-26,9,1047
Nhu cầu chuyển đổi số tăng mạnh sau đại dịch Covid-19,/nhu-cau-chuyen-doi-so-tang-manh-sau-dai-dich-covid-19-1851442391.htm,2022-03-26,3,775
Nỗ lực chuyển đổi số của Hội Doanh nhân trẻ Bình Định,/no-luc-chuyen-doi-so-cua-hoi-doanh-nhan-tre-binh-dinh-1851441218.htm,2022-03-22,2,815
Thanh niên là nòng cốt trong chuyển đổi số,/thanh-nien-la-nong-cot-trong-chuyen-doi-so-1851441210.htm,2022-03-22,12,756
Thủ tướng Phạm Minh Chính: Sớm nghiên cứu xây cầu Mã Đà nối Bình Phước - Đồng Nai,/thu-tuong-pham-minh-chinh-som-nghien-cuu-xay-cau-ma-da-noi-binh-phuoc-dong-nai-1851440616.htm,2022-03-20,3,762
"Hỗ trợ người trẻ khởi nghiệp đổi mới, sáng tạo",/ho-tro-nguoi-tre-khoi-nghiep-doi-moi-sang-tao-1851440233.htm,2022-03-20,13,1065
Những tiện ích trên Cổng thông tin Chuyển đổi số TP.HCM,/nhung-tien-ich-tren-cong-thong-tin-chuyen-doi-so-tp-hcm-1851440069.htm,2022-03-18,14,660
"TP.HCM tập trung thúc đẩy chuyển đổi số, chính quyền số",/tp-hcm-tap-trung-thuc-day-chuyen-doi-so-chinh-quyen-so-1851440009.htm,2022-03-18,13,513
Tỉnh đoàn Hải Dương cấp mã QR cho di tích,/tinh-doan-hai-duong-cap-ma-qr-cho-di-tich-1851439779.htm,2022-03-18,2,740
20% người dân sẽ sử dụng định danh điện tử trong năm 2022,/20-nguoi-dan-se-su-dung-dinh-danh-dien-tu-trong-nam-2022-1851439696.htm,2022-03-17,6,634
"Western Digital Việt Nam: 'Trong chuyển đổi số, đừng nghĩ về A.I với quá nhiều thuật toán'",/western-digital-viet-nam-trong-chuyen-doi-so-dung-nghi-ve-a-i-voi-qua-nhieu-thuat-toan-1851439275.htm,2022-03-17,8,943
Cách tra cứu thông tin cá nhân trên cơ sở dữ liệu quốc gia,/cach-tra-cuu-thong-tin-ca-nhan-tren-co-so-du-lieu-quoc-gia-1851437542.htm,2022-11-03,1,666
Ông Nguyễn Tử Quảng giữ chức Chủ tịch Ủy ban phát triển Trí tuệ nhân tạo,/ong-nguyen-tu-quang-giu-chuc-chu-tich-uy-ban-phat-trien-tri-tue-nhan-tao-1851437305.htm,2022-11-03,3,436
Số hóa từ việc giản đơn nhất,/so-hoa-tu-viec-gian-don-nhat-1851437443.htm,2022-11-03,10,781
Nữ tiến sĩ tâm huyết với công nghệ chuyển đổi số ứng dụng,/nu-tien-si-tam-huyet-voi-cong-nghe-chuyen-doi-so-ung-dung-1851436895.htm,2022-10-03,4,1256
"VNPT Cloud: Dịch vụ điện toán đám mây toàn diện, thúc đẩy chuyển đổi số tại VN",/vnpt-cloud-dich-vu-dien-toan-dam-may-toan-dien-thuc-day-chuyen-doi-so-tai-vn-1851436993.htm,2022-09-03,9,1125
Cách tìm số định danh cá nhân khi chưa đổi sang CCCD gắn chip,/cach-tim-so-dinh-danh-ca-nhan-khi-chua-doi-sang-cccd-gan-chip-1851436072.htm,2022-07-03,3,795
"Viettel IDC áp dụng mô hình Agile: Tăng tốc chuyển đổi số, tạo lợi thế cạnh tranh",/viettel-idc-ap-dung-mo-hinh-agile-tang-toc-chuyen-doi-so-tao-loi-the-canh-tranh-1851435314.htm,2022-04-03,8,1028
Microsoft Việt Nam bổ nhiệm Tổng giám đốc mới,/microsoft-viet-nam-bo-nhiem-tong-giam-doc-moi-1851434582.htm,2022-02-03,3,415
Bắc Giang đẩy mạnh chuyển đổi số cho doanh nghiệp vừa và nhỏ,/bac-giang-day-manh-chuyen-doi-so-cho-doanh-nghiep-vua-va-nho-1851433544.htm,2022-02-27,9,542
FSI hợp tác Iron Mountain giới thiệu bộ giải pháp quản lý thông tin dữ liệu,/fsi-hop-tac-iron-mountain-gioi-thieu-bo-giai-phap-quan-ly-thong-tin-du-lieu-1851433294.htm,2022-02-26,3,476
Samsung hợp tác với Google tăng cường chuyển đổi số trong lĩnh vực giáo dục,/samsung-hop-tac-voi-google-tang-cuong-chuyen-doi-so-trong-linh-vuc-giao-duc-1851432670.htm,2022-02-24,2,585
"Ngày mai, bắt đầu triển khai phần mềm Quản lý nghiệp vụ công tác đoàn viên",/ngay-mai-bat-dau-trien-khai-phan-mem-quan-ly-nghiep-vu-cong-tac-doan-vien-1851431942.htm,2022-02-22,5,1273
VietinBank đồng hành cùng doanh nghiệp trong chuyển đổi số hoạt động thanh toán,/vietinbank-dong-hanh-cung-doanh-nghiep-trong-chuyen-doi-so-hoat-dong-thanh-toan-1851430340.htm,2022-02-17,6,606
VietinBank đồng hành cùng doanh nghiệp trong chuyển đổi số hoạt động thanh toán,/vietinbank-dong-hanh-cung-doanh-nghiep-trong-chuyen-doi-so-hoat-dong-thanh-toan-1851430053.htm,2022-02-16,6,580
TP.HCM: Q.5 cần đầu tư khoảng 2.000 tỉ đồng để quay lại thời 'vàng son',/tp-hcm-q-5-can-dau-tu-khoang-2-000-ti-dong-de-quay-lai-thoi-vang-son-1851429887.htm,2022-02-16,4,699
Keysight khai trương cổng thông tin Cấp phép thỏa thuận phần mềm,/keysight-khai-truong-cong-thong-tin-cap-phep-thoa-thuan-phan-mem-1851429409.htm,2022-02-14,2,397
eKYC - tối ưu trải nghiệm sản phẩm dịch vụ ngân hàng ngay tại nhà,/ekyc-toi-uu-trai-nghiem-san-pham-dich-vu-ngan-hang-ngay-tai-nha-1851424205.htm,2022-01-24,1,1029
Triển khai đề án phát triển ứng dụng dữ liệu về dân cư,/trien-khai-de-an-phat-trien-ung-dung-du-lieu-ve-dan-cu-1851422724.htm,2022-01-19,7,526
VietCredit ra mắt hệ thống hợp đồng điện tử và chữ ký điện tử,/vietcredit-ra-mat-he-thong-hop-dong-dien-tu-va-chu-ky-dien-tu-1851422452.htm,2022-01-19,7,926
"“Dữ liệu dân cư phải đúng, đủ, sạch, sống”",/du-lieu-dan-cu-phai-dung-du-sach-song-1851422508.htm,2022-01-19,4,613
Mavin đưa vào vận hành hệ thống ERP SAP S/4HANA cho ngành chăn nuôi heo,/mavin-dua-vao-van-hanh-he-thong-erp-sap-s-4hana-cho-nganh-chan-nuoi-heo-1851420859.htm,2022-01-13,10,1079
Úc giúp Việt Nam chuyển đổi số ứng phó thiên tai,/uc-giup-viet-nam-chuyen-doi-so-ung-pho-thien-tai-1851420780.htm,2022-01-13,11,766
"Tích hợp giấy tờ, ví điện tử, điện, nước… lên CCCD gắn chip và app VNEID",/tich-hop-giay-to-vi-dien-tu-dien-nuoc-len-cccd-gan-chip-va-app-vneid-1851420654.htm,2022-01-13,3,626
'Chuyến xe tri thức' cho các thanh niên khởi nghiệp Bình Phước,/chuyen-xe-tri-thuc-cho-cac-thanh-nien-khoi-nghiep-binh-phuoc-1851419826.htm,2022-10-01,6,943
Chàng trai Việt góp phần giúp đại học Mỹ chuyển đổi số,/chang-trai-viet-gop-phan-giup-dai-hoc-my-chuyen-doi-so-1851419378.htm,2022-09-01,7,1021
63 tỉnh thành trên cả nước ứng dụng Zalo trong quá trình chuyển đổi số,/63-tinh-thanh-tren-ca-nuoc-ung-dung-zalo-trong-qua-trinh-chuyen-doi-so-1851419058.htm,2022-07-01,6,1200
"Quảng Bình có 'bộ não số' giám sát, điều hành thông minh tại TP.Đồng Hới",/quang-binh-co-bo-nao-so-giam-sat-dieu-hanh-thong-minh-tai-tp-dong-hoi-1851418659.htm,2022-06-01,2,659
"""Suốt dịch Covid-19, tôi chỉ coi YouTube Báo Thanh Niên""",/suot-dich-covid-19-toi-chi-coi-youtube-bao-thanh-nien-1851417520.htm,2022-02-01,3,625
Thái Nguyên đặt mục tiêu vào top 10 địa phương dẫn đầu về chuyển đổi số,/thai-nguyen-dat-muc-tieu-vao-top-10-dia-phuong-dan-dau-ve-chuyen-doi-so-1851416907.htm,2021-12-31,21,1350
Những dấu chân trên đường mới mở,/nhung-dau-chan-tren-duong-moi-mo-1851415767.htm,2021-12-28,10,1764
Chuyển đổi số là chìa khoá để Vĩnh phúc xây dựng nền nông nghiệp thông minh,/chuyen-doi-so-la-chia-khoa-de-vinh-phuc-xay-dung-nen-nong-nghiep-thong-minh-1851415764.htm,2021-12-27,4,1392
Hỗ trợ báo chí trong chuyển đổi số,/ho-tro-bao-chi-trong-chuyen-doi-so-1851414976.htm,2021-12-25,14,1780
VNPT hoàn thành 'mục tiêu kép' năm 2021 với nhiều dấu ấn,/vnpt-hoan-thanh-muc-tieu-kep-nam-2021-voi-nhieu-dau-an-1851414875.htm,2021-12-24,6,1102
Chuyển đổi số ngành khí tượng thủy văn để tăng cường khả năng dự báo thiên tai,/chuyen-doi-so-nganh-khi-tuong-thuy-van-de-tang-cuong-kha-nang-du-bao-thien-tai-1851414906.htm,2021-12-24,5,895
Mong tiếp tục có thêm cơ chế hỗ trợ báo chí,/mong-tiep-tuc-co-them-co-che-ho-tro-bao-chi-1851414816.htm,2021-12-24,5,1601
Làm thế nào để mỗi thanh niên nông thôn là một thương nhân?,/lam-the-nao-de-moi-thanh-nien-nong-thon-la-mot-thuong-nhan-1851414774.htm,2021-12-24,10,1139
Báo chí tạo niềm tin của nhân dân đối với Đảng và chế độ,/bao-chi-tao-niem-tin-cua-nhan-dan-doi-voi-dang-va-che-do-1851414716.htm,2021-12-24,9,1999
‘Truyền hình Báo Thanh Niên là minh chứng cho chuyển đổi số’,/truyen-hinh-bao-thanh-nien-la-minh-chung-cho-chuyen-doi-so-1851414578.htm,2021-12-24,13,897
Giáo dục vượt qua đại dịch: Thay đổi trên nền tảng chuyển đổi số,/giao-duc-vuot-qua-dai-dich-thay-doi-tren-nen-tang-chuyen-doi-so-1851414631.htm,2021-12-24,9,1780
Tận dụng chuyển đổi số nâng tầm thương hiệu báo chí,/tan-dung-chuyen-doi-so-nang-tam-thuong-hieu-bao-chi-1851414628.htm,2021-12-24,18,920
Tin tức giáo dục đặc biệt 24.12: Tuần sau học sinh TP.HCM trở lại trường thế nào?,/tin-tuc-giao-duc-dac-biet-24-12-tuan-sau-hoc-sinh-tp-hcm-tro-lai-truong-the-nao-1851414574.htm,2021-12-23,1,641
Chuyển đổi số để nâng tầm thương hiệu tờ báo,/chuyen-doi-so-de-nang-tam-thuong-hieu-to-bao-1851414384.htm,2021-12-23,31,2148
"Năm 2022 sẽ kết nối cơ sở dữ liệu dân cư, doanh nghiệp và tài nguyên",/nam-2022-se-ket-noi-co-so-du-lieu-dan-cu-doanh-nghiep-va-tai-nguyen-1851414259.htm,2021-12-23,11,788
Bộ trưởng TT-TT: Đôi cánh để Việt Nam bay lên là công nghệ và khát vọng,/bo-truong-tt-tt-doi-canh-de-viet-nam-bay-len-la-cong-nghe-va-khat-vong-1851414217.htm,2021-12-22,9,1465
Mã độc tống tiền tại Việt Nam tăng gần 200%,/ma-doc-tong-tien-tai-viet-nam-tang-gan-200-1851413555.htm,2021-12-21,2,781
Hiến kế cho thanh niên khởi nghiệp theo hướng chuyển đổi số,/hien-ke-cho-thanh-nien-khoi-nghiep-theo-huong-chuyen-doi-so-1851413497.htm,2021-12-20,7,633
Thủ tướng: Hải Phòng cần dựa vào chuyển đổi số để phát triển bền vững,/thu-tuong-hai-phong-can-dua-vao-chuyen-doi-so-de-phat-trien-ben-vung-1851413110.htm,2021-12-19,4,871
Nhu cầu lớn về tuyển dụng các ngành liên quan công nghệ số,/nhu-cau-lon-ve-tuyen-dung-cac-nganh-lien-quan-cong-nghe-so-1851412637.htm,2021-12-18,6,1156
Đẩy mạnh chuyển đổi số và áp dụng các phương pháp quản lý tiên tiến tại EVNGENCO1,/day-manh-chuyen-doi-so-va-ap-dung-cac-phuong-phap-quan-ly-tien-tien-tai-evngenco1-1851412390.htm,2021-12-17,3,854
Digital Space cung cấp giải pháp số toàn diện cho doanh nghiệp SME,/digital-space-cung-cap-giai-phap-so-toan-dien-cho-doanh-nghiep-sme-1851412348.htm,2021-12-17,2,937
"Bà Rịa - Vũng Tàu xây dựng chính quyền điện tử, phát triển đô thị thông minh",/ba-ria-vung-tau-xay-dung-chinh-quyen-dien-tu-phat-trien-do-thi-thong-minh-1851412062.htm,2021-12-16,2,1098
Người dân được hưởng lợi nhờ chuyển đổi số trong việc cấp và sử dụng BHYT,/nguoi-dan-duoc-huong-loi-nho-chuyen-doi-so-trong-viec-cap-va-su-dung-bhyt-1851411714.htm,2021-12-15,3,926
Hàn Quốc sẽ hỗ trợ Việt Nam trở thành quốc gia số,/han-quoc-se-ho-tro-viet-nam-tro-thanh-quoc-gia-so-1851411267.htm,2021-12-13,2,1122
"Ngân hàng, bán lẻ bứt phá tăng trưởng nhờ robot tự động hóa",/ngan-hang-ban-le-but-pha-tang-truong-nho-robot-tu-dong-hoa-1851411134.htm,2021-12-13,4,1107
Viettel thử nghiệm dịch vụ mạng 5G tại Đà Nẵng,/viettel-thu-nghiem-dich-vu-mang-5g-tai-da-nang-1851411005.htm,2021-12-13,2,470
"Doanh nghiệp, người dân là trọng tâm chuyển đổi số",/doanh-nghiep-nguoi-dan-la-trong-tam-chuyen-doi-so-1851410669.htm,2021-12-12,15,884
'Phủ sóng' căn cước công dân gắn chip,/phu-song-can-cuoc-cong-dan-gan-chip-1851410667.htm,2021-12-12,1,1958
Thủ tướng ‘đặt hàng’ chuyển đổi số và quyết tâm của Bộ trưởng,/thu-tuong-dat-hang-chuyen-doi-so-va-quyet-tam-cua-bo-truong-1851410566.htm,2021-11-12,23,1898
Covid-19 khiến doanh nghiệp đẩy nhanh chuyển đổi số,/covid-19-khien-doanh-nghiep-day-nhanh-chuyen-doi-so-1851410499.htm,2021-11-12,10,741
"Đổi mới sáng tạo và chuyển đổi số - ‘Chìa khóa’ phát triển nhanh, bền vững",/doi-moi-sang-tao-va-chuyen-doi-so-chia-khoa-phat-trien-nhanh-ben-vung-1851410259.htm,2021-10-12,5,579
Vietlott nhận giải Doanh nghiệp chuyển đổi số xuất sắc năm 2021,/vietlott-nhan-giai-doanh-nghiep-chuyen-doi-so-xuat-sac-nam-2021-1851410158.htm,2021-10-12,16,751
TNG Holdings Vietnam được vinh danh ‘Doanh nghiệp chuyển đổi số xuất sắc’,/tng-holdings-vietnam-duoc-vinh-danh-doanh-nghiep-chuyen-doi-so-xuat-sac-1851410129.htm,2021-10-12,19,824
EVN lần thứ 3 liên tiếp nhận giải doanh nghiệp chuyển đổi số xuất sắc,/evn-lan-thu-3-lien-tiep-nhan-giai-doanh-nghiep-chuyen-doi-so-xuat-sac-1851410035.htm,2021-10-12,9,940
GapoWork được vinh danh chuyển đổi số tiêu biểu Việt Nam 2021,/gapowork-duoc-vinh-danh-chuyen-doi-so-tieu-bieu-viet-nam-2021-1851410053.htm,2021-10-12,6,510
"Hỗ trợ nông dân chuyển đổi số, phát triển nông nghiệp hữu cơ",/ho-tro-nong-dan-chuyen-doi-so-phat-trien-nong-nghiep-huu-co-1851409495.htm,2021-08-12,4,675
AIA Việt Nam được vinh danh tại Asian Technology Excellence Awards 2021 với bộ đôi giải thưởng,/aia-viet-nam-duoc-vinh-danh-tai-asian-technology-excellence-awards-2021-voi-bo-doi-giai-thuong-1851409006.htm,2021-07-12,5,1023
Chìa khóa khôi phục phát triển kinh tế hậu Covid-19,/chia-khoa-khoi-phuc-phat-trien-kinh-te-hau-covid-19-1851408795.htm,2021-07-12,9,2092
Kết nối khát vọng doanh nghiệp số vươn tầm khu vực,/ket-noi-khat-vong-doanh-nghiep-so-vuon-tam-khu-vuc-1851407362.htm,2021-02-12,7,332
"Trước khi thành cường quốc nông nghiệp 4.0, nông dân Israel cũng không khác gì Việt Nam",/truoc-khi-thanh-cuong-quoc-nong-nghiep-4-0-nong-dan-israel-cung-khong-khac-gi-viet-nam-1851407370.htm,2021-02-12,11,1366
Lễ ký kết hợp tác chuyển đổi số lĩnh vực sức khỏe và truyền thông quảng cáo,/le-ky-ket-hop-tac-chuyen-doi-so-linh-vuc-suc-khoe-va-truyen-thong-quang-cao-1851407282.htm,2021-02-12,12,949
TNR Holdings Vietnam chính thức vận hành giai đoạn 1 hệ thống ERP SAP S/4HANA,/tnr-holdings-vietnam-chinh-thuc-van-hanh-giai-doan-1-he-thong-erp-sap-s-4hana-1851407254.htm,2021-02-12,5,786
Tỉnh đầu tiên trên cả nước ra mắt ứng dụng nền tảng xã hội số,/tinh-dau-tien-tren-ca-nuoc-ra-mat-ung-dung-nen-tang-xa-hoi-so-1851406999.htm,2021-01-12,3,846
"Tránh cục bộ trong xây dựng, chia sẻ dữ liệu",/tranh-cuc-bo-trong-xay-dung-chia-se-du-lieu-1851406810.htm,2021-01-12,5,618
eKYC và chiến lược số hóa của HDBank,/ekyc-va-chien-luoc-so-hoa-cua-hdbank-1851406355.htm,2021-11-29,3,995
Bốn hiểu lầm game thủ và người dùng thường gặp xoay quanh kết nối 5G,/bon-hieu-lam-game-thu-va-nguoi-dung-thuong-gap-xoay-quanh-ket-noi-5g-1851405728.htm,2021-11-27,3,1961
‘Đòi hợp tác xã sản xuất an toàn nhưng giá mua nông sản như hàng trôi nổi’,/doi-hop-tac-xa-san-xuat-an-toan-nhung-gia-mua-nong-san-nhu-hang-troi-noi-1851405657.htm,2021-11-27,6,1045
Trí thức trẻ khuyến nghị: Muốn chuyển đổi số cần '4 chung',/tri-thuc-tre-khuyen-nghi-muon-chuyen-doi-so-can-4-chung-1851405439.htm,2021-11-26,10,1386
Chuyển đổi số ở EVNNPC: Thành công đến từ ‘người truyền lửa’,/chuyen-doi-so-o-evnnpc-thanh-cong-den-tu-nguoi-truyen-lua-1851404689.htm,2021-11-24,10,1052
Thủ tướng: 'Việt Nam có khả năng thích ứng cao với chuyển đổi số',/thu-tuong-viet-nam-co-kha-nang-thich-ung-cao-voi-chuyen-doi-so-1851404597.htm,2021-11-24,27,1257
177 đại biểu tham gia Diễn đàn Trí thức trẻ Việt Nam toàn cầu lần thứ 4,/177-dai-bieu-tham-gia-dien-dan-tri-thuc-tre-viet-nam-toan-cau-lan-thu-4-1851404550.htm,2021-11-24,9,1157
Phải làm gì khi trường học bị ‘cái ảo’ xâm lấn?,/phai-lam-gi-khi-truong-hoc-bi-cai-ao-xam-lan-1851403216.htm,2021-11-21,4,1884
NAPAS làm 'cầu nối' hướng Việt Nam tiến tới 'quốc gia không tiền mặt',/napas-lam-cau-noi-huong-viet-nam-tien-toi-quoc-gia-khong-tien-mat-1851403131.htm,2021-11-20,2,1339
EVNNPC ra mắt sản phẩm chuyển đổi số lĩnh vực tài chính kế toán và kinh doanh,/evnnpc-ra-mat-san-pham-chuyen-doi-so-linh-vuc-tai-chinh-ke-toan-va-kinh-doanh-1851402626.htm,2021-11-18,4,1116
Cô giáo Sán Dìu chuyển đổi số trong dạy lịch sử,/co-giao-san-diu-chuyen-doi-so-trong-day-lich-su-1851402360.htm,2021-11-18,7,860
Nông nghiệp chuyển đổi số để tạo động lực tăng trưởng mới,/nong-nghiep-chuyen-doi-so-de-tao-dong-luc-tang-truong-moi-1851402296.htm,2021-11-17,14,1240
"EVNGENCO1: Chuyển đổi số là tất yếu, phải làm",/evngenco1-chuyen-doi-so-la-tat-yeu-phai-lam-1851402143.htm,2021-11-17,15,809
"1,9 triệu văn bản điện tử giúp Thái Nguyên tiết kiệm 7,5 tỉ đồng",/1-9-trieu-van-ban-dien-tu-giup-thai-nguyen-tiet-kiem-7-5-ti-dong-1851401723.htm,2021-11-16,5,834
Giáo viên 'so tài' giữa dịch Covid-19,/giao-vien-so-tai-giua-dich-covid-19-1851400913.htm,2021-11-13,2,629
Chuyển đổi số không phải câu chuyện vĩ mô,/chuyen-doi-so-khong-phai-cau-chuyen-vi-mo-1851400631.htm,2021-11-13,7,683
"Bình Phước ký kết hợp tác chuyển đổi số, tăng tốc xây dựng chính quyền điện tử",/binh-phuoc-ky-ket-hop-tac-chuyen-doi-so-tang-toc-xay-dung-chinh-quyen-dien-tu-1851400180.htm,2021-11-11,12,537
"Đẩy mạnh chuyển đổi số, HDBank đạt giải thưởng Ngân hàng Số tốt nhất Việt Nam 2021",/day-manh-chuyen-doi-so-hdbank-dat-giai-thuong-ngan-hang-so-tot-nhat-viet-nam-2021-1851400039.htm,2021-11-11,6,745
Hành trình thanh niên khởi nghiệp đổi mới sáng tạo sẽ làm gì khi đi qua 4 tỉnh?,/hanh-trinh-thanh-nien-khoi-nghiep-doi-moi-sang-tao-se-lam-gi-khi-di-qua-4-tinh-1851398613.htm,2021-06-11,4,629
"Chuyển đổi số: 'Ở đâu có kết nối mạng, ở đó có Trường ĐH Sư phạm Huế'",/chuyen-doi-so-o-dau-co-ket-noi-mang-o-do-co-truong-dh-su-pham-hue-1851398551.htm,2021-06-11,4,690
Du lịch bắt nhịp chuyển đổi số mạnh mẽ,/du-lich-bat-nhip-chuyen-doi-so-manh-me-1851397403.htm,2021-03-11,6,1124
Chuyển đổi số Đà Nẵng gặt hái trái ngọt đầu mùa,/chuyen-doi-so-da-nang-gat-hai-trai-ngot-dau-mua-1851396742.htm,2021-01-11,4,1403
Hình thành mạng lưới trí thức trẻ ngành kinh tế,/hinh-thanh-mang-luoi-tri-thuc-tre-nganh-kinh-te-1851395311.htm,2021-10-27,7,769
ASEAN cần sự đồng hành của doanh nghiệp trong nỗ lực phục hồi kinh tế,/asean-can-su-dong-hanh-cua-doanh-nghiep-trong-no-luc-phuc-hoi-kinh-te-1851394662.htm,2021-10-25,4,919
vHost ra mắt bộ ba giải pháp bảo mật hỗ trợ chuyển đổi số,/vhost-ra-mat-bo-ba-giai-phap-bao-mat-ho-tro-chuyen-doi-so-1851394481.htm,2021-10-25,4,731
"Bình Phước hướng đến 2025 cơ bản hình thành chính quyền số, nền kinh tế số",/binh-phuoc-huong-den-2025-co-ban-hinh-thanh-chinh-quyen-so-nen-kinh-te-so-1851393251.htm,2021-10-21,9,618
"Xuất sắc xử lý nghẽn lệnh HoSE, SOVICO và FPT nhận bằng khen của Bộ Tài chính",/xuat-sac-xu-ly-nghen-lenh-hose-sovico-va-fpt-nhan-bang-khen-cua-bo-tai-chinh-1851391438.htm,2021-10-15,7,1547
Điện lực Quảng Nam hướng đến xây dựng văn phòng số,/dien-luc-quang-nam-huong-den-xay-dung-van-phong-so-1851391199.htm,2021-10-15,6,488
Bộ trưởng Nguyễn Mạnh Hùng: Tắt sóng 2G vào năm 2023,/bo-truong-nguyen-manh-hung-tat-song-2g-vao-nam-2023-1851390817.htm,2021-10-14,3,1040
"Thủy điện Thác Mơ ứng dụng công nghệ 4.0 trong công tác quản lý, đào tạo",/thuy-dien-thac-mo-ung-dung-cong-nghe-4-0-trong-cong-tac-quan-ly-dao-tao-1851390686.htm,2021-10-14,2,742
Chuyển đổi số trong khuyến nông: Biến lớp học trực tiếp thành lớp học online,/chuyen-doi-so-trong-khuyen-nong-bien-lop-hoc-truc-tiep-thanh-lop-hoc-online-1851390635.htm,2021-10-13,8,1108
