Title,URL,Publish Date,Mentioned Times,Word Count
Giá trị vượt thời gian từ bản lĩnh của 'người tiên phong' số hóa ngành ngân hàng,/gia-tri-vuot-thoi-gian-tu-ban-linh-cua-nguoi-tien-phong-so-hoa-nganh-ngan-hang-185230918144213896.htm,2023-09-18,6,1848
Giới trẻ tiên phong thực hiện mục tiêu phát triển bền vững,/gioi-tre-tien-phong-thuc-hien-muc-tieu-phat-trien-ben-vung-185230917031405824.htm,2023-09-17,9,2067
'Mách nước' cho thanh niên cách bán hàng trực tuyến,/mach-nuoc-cho-thanh-nien-cach-ban-hang-truc-tuyen-185230916174345545.htm,2023-09-16,8,1118
Hội nghị Nghị sĩ trẻ toàn cầu lần thứ 9 đã phá vỡ nhiều kỷ lục,/hoi-nghi-nghi-si-tre-toan-cau-lan-thu-9-da-pha-vo-nhieu-ky-luc-185230916174657075.htm,2023-09-16,4,1135
Tuyên bố Hội nghị Nghị sĩ trẻ toàn cầu lần thứ 9 tại Hà Nội,/tuyen-bo-hoi-nghi-nghi-si-tre-toan-cau-lan-thu-9-tai-ha-noi-185230916144125485.htm,2023-09-16,15,3317
Thúc đẩy đổi mới sáng tạo,/thuc-day-doi-moi-sang-tao-185230915235106736.htm,2023-09-16,17,1160
'Ngọn hải đăng' trao quyền cho giới trẻ về công nghệ,/ngon-hai-dang-trao-quyen-cho-gioi-tre-ve-cong-nghe-185230915235224251.htm,2023-09-16,7,2132
"EVNGENCO1 quyết tâm hoàn thành mục tiêu, nhiệm vụ năm 2023",/evngenco1-quyet-tam-hoan-thanh-muc-tieu-nhiem-vu-nam-2023-185230915174140759.htm,2023-09-15,3,1171
Nghị sĩ nước ngoài mong muốn điều gì tại Hội nghị Nghị sĩ trẻ toàn cầu?,/nghi-si-nuoc-ngoai-mong-muon-dieu-gi-tai-hoi-nghi-nghi-si-tre-toan-cau-185230915175632911.htm,2023-09-15,6,879
Schneider Electric cải tiến các công nghệ AI để chuyển đổi số ngành năng lượng,/schneider-electric-cai-tien-cac-cong-nghe-ai-de-chuyen-doi-so-nganh-nang-luong-185230915153739268.htm,2023-09-15,3,574
Vững bước trên hành trình đổi mới sáng tạo và khởi nghiệp,/vung-buoc-tren-hanh-trinh-doi-moi-sang-tao-va-khoi-nghiep-185230915145616138.htm,2023-09-15,2,1144
Tặng smartphone cho đồng bào Cơ Tu để hỗ trợ chuyển đổi số,/tang-smartphone-cho-dong-bao-co-tu-de-ho-tro-chuyen-doi-so-185230915104903114.htm,2023-09-15,10,756
Vì sao Việt Nam vẫn thiếu hụt hàng trăm ngàn nhân lực công nghệ thông tin?,/vi-sao-viet-nam-van-thieu-hut-hang-tram-ngan-nhan-luc-cong-nghe-thong-tin-185230914155828013.htm,2023-09-14,1,673
Bí thư thứ nhất T.Ư Đoàn Bùi Quang Huy: 'Cơ hội để thanh niên đi nhanh hơn',/bi-thu-thu-nhat-tu-doan-bui-quang-huy-co-hoi-de-thanh-nien-di-nhanh-hon-185230914153842473.htm,2023-09-14,15,1468
'AI là công nghệ dẫn dắt hoạt động chuyển đổi số',/ai-la-cong-nghe-dan-dat-hoat-dong-chuyen-doi-so-185230914114928476.htm,2023-09-14,10,749
Báo Thanh Niên ký kết hợp tác với Đài Phát thanh và Truyền hình Quảng Ngãi,/bao-thanh-nien-ky-ket-hop-tac-voi-dai-phat-thanh-va-truyen-hinh-quang-ngai-185230914134022804.htm,2023-09-14,0,92
Nạn nhân cay đắng khi bị các 'siêu lừa' chiếm đoạt tiền tài khoản ngân hàng,/nan-nhan-cay-dang-khi-bi-cac-sieu-lua-chiem-doat-tien-tai-khoan-ngan-hang-185230914081041262.htm,2023-09-14,1,1317
"Số hóa di tích lịch sử, văn hóa",/so-hoa-di-tich-lich-su-van-hoa-185230913220159846.htm,2023-09-14,2,622
Bảo vệ bản quyền báo chí trên môi trường số là vấn đề cấp bách,/bao-ve-ban-quyen-bao-chi-tren-moi-truong-so-la-van-de-cap-bach-18523091315233005.htm,2023-09-13,2,1325
Hội nghị Nghị sĩ trẻ toàn cầu: Gen Z hào hứng với chủ đề chuyển đổi số,/hoi-nghi-nghi-si-tre-toan-cau-gen-z-hao-hung-voi-chu-de-chuyen-doi-so-185230911215851313.htm,2023-12-09,17,1153
Doanh nghiệp cung cấp nước khuyến khích khách hàng chuyển đổi số,/doanh-nghiep-cung-cap-nuoc-khuyen-khich-khach-hang-chuyen-doi-so-185230911114259891.htm,2023-11-09,14,530
Thúc đẩy phát triển du lịch Việt Nam bằng cách đẩy nhanh chuyển đổi số,/thuc-day-phat-trien-du-lich-viet-nam-bang-cach-day-nhanh-chuyen-doi-so-185230908080928041.htm,2023-08-09,6,716
Chuyển đổi số báo chí: Đẩy mạnh ứng dụng công nghệ mới vào báo điện tử,/chuyen-doi-so-bao-chi-day-manh-ung-dung-cong-nghe-moi-vao-bao-dien-tu-185230908012342512.htm,2023-08-09,18,938
"Tivi thông minh sẽ cài đặt, tích hợp ứng dụng VTVGo",/tivi-thong-minh-se-cai-dat-tich-hop-ung-dung-vtvgo-185230907140641019.htm,2023-07-09,3,744
Chủ tịch FPT: Chuyển đổi số đem lại hạnh phúc cho mỗi người,/chu-tich-fpt-chuyen-doi-so-dem-lai-hanh-phuc-cho-moi-nguoi-185230906164009609.htm,2023-06-09,11,818
Bain & Company mở văn phòng tại Việt Nam,/bain-company-mo-van-phong-tai-viet-nam-185230906175404254.htm,2023-06-09,1,660
"ASEAN cùng chia sẻ hợp tác, cùng nhau chiến thắng",/asean-cung-chia-se-hop-tac-cung-nhau-chien-thang-185230905002034456.htm,2023-05-09,3,2211
Việt Nam sẽ trở thành quốc gia số,/viet-nam-se-tro-thanh-quoc-gia-so-185230825155258263.htm,2023-04-09,8,1594
Ứng dụng AI để đẩy nhanh chuyển đổi số trong doanh nghiệp,/ung-dung-ai-de-day-nhanh-chuyen-doi-so-trong-doanh-nghiep-185230830154713435.htm,2023-08-30,8,569
Nhiều giải pháp thúc đẩy chuyển đổi số của người trẻ,/nhieu-giai-phap-thuc-day-chuyen-doi-so-cua-nguoi-tre-185230830012705045.htm,2023-08-30,10,904
"Thanh niên góp phần xây dựng Việt Nam - Singapore hùng cường, thịnh vượng",/thanh-nien-gop-phan-xay-dung-viet-nam-singapore-hung-cuong-thinh-vuong-185230830011630094.htm,2023-08-30,3,1937
Công ty Nhiệt điện Mông Dương đẩy mạnh chuyển đổi số,/cong-ty-nhiet-dien-mong-duong-day-manh-chuyen-doi-so-185230829150959597.htm,2023-08-29,3,336
TP.HCM đưa 'hiến kế' của người dân lên cổng thông tin Chuyển đổi số,/tphcm-dua-hien-ke-cua-nguoi-dan-len-cong-thong-tin-chuyen-doi-so-185230829123015117.htm,2023-08-29,4,610
VinBrain phát triển nền tảng AI tạo sinh thúc đẩy chuyển đổi số y tế,/vinbrain-phat-trien-nen-tang-ai-tao-sinh-thuc-day-chuyen-doi-so-y-te-185230828225654621.htm,2023-08-29,3,593
"Ngày truyền thống, nhớ Anh hùng Lao động Đặng Văn Thân, 'linh hồn' cách mạng số ngành bưu điện",/ngay-truyen-thong-nho-anh-hung-lao-dong-dang-van-than-linh-hon-cach-mang-so-nganh-buu-dien-185230827085531111.htm,2023-08-28,6,1893
Chủ đề 'Năm chuyển đổi số' đã tiếp thêm động lực cho người trẻ,/chu-de-nam-chuyen-doi-so-da-tiep-them-dong-luc-cho-nguoi-tre-185230825131315649.htm,2023-08-26,53,2665
Giải pháp bảo mật đồng hành cùng chuyển đổi số,/giai-phap-bao-mat-dong-hanh-cung-chuyen-doi-so-1852308251803457.htm,2023-08-25,6,701
"Tăng kết nối, trải nghiệm với 'Festival thanh niên tiên phong chuyển đổi số'",/tang-ket-noi-trai-nghiem-voi-festival-thanh-nien-tien-phong-chuyen-doi-so-185230825150320175.htm,2023-08-25,14,601
Chuyển đổi số - chuyến tàu không thể lỡ: Đừng để bị bỏ lại phía sau,/chuyen-doi-so-chuyen-tau-khong-the-lo-dung-de-bi-bo-lai-phia-sau-185230824214614246.htm,2023-08-25,29,1786
Đoàn Thanh niên cơ quan T.Ư Đoàn ra mắt Hệ thống rút gọn Link 263,/doan-thanh-nien-co-quan-tu-doan-ra-mat-he-thong-rut-gon-link-263-185230824145108241.htm,2023-08-24,3,1035
Ứng dụng giải pháp giám sát mạng sử dụng mã nguồn mở Zabbix,/ung-dung-giai-phap-giam-sat-mang-su-dung-ma-nguon-mo-zabbix-185230824083834641.htm,2023-08-24,2,1166
Doanh nghiệp Việt giới thiệu giải pháp chuyển đổi số tại diễn đàn quốc tế,/doanh-nghiep-viet-gioi-thieu-giai-phap-chuyen-doi-so-tai-dien-dan-quoc-te-185230823170126785.htm,2023-08-24,5,960
Chuyển đổi số - chuyến tàu không thể lỡ: Sinh viên y lập công ty công nghệ,/sinh-vien-y-thanh-lap-cong-ty-cong-nghe-185230823132106122.htm,2023-08-24,7,1578
"Phó thủ tướng Trần Hồng Hà: Chậm chuyển đổi xanh sẽ đối mặt rào cản, thách thức",/pho-thu-tuong-tran-hong-ha-cham-chuyen-doi-xanh-se-doi-mat-rao-can-thach-thuc-185230823200347044.htm,2023-08-23,4,1051
Chuyển đổi số - chuyến tàu không thể lỡ: Đưa sản vật quê nhà phát triển nhờ nền tảng số,/dua-san-vat-que-nha-phat-trien-nho-nen-tang-so-185230822194430617.htm,2023-08-23,14,1567
T.Ư Đoàn ký kết hợp tác với Ngân hàng BIDV giai đoạn 2023 - 2025,/tu-doan-ky-ket-hop-tac-voi-ngan-hang-bidv-giai-doan-2023-2025-185230822170219003.htm,2023-08-22,6,1069
"Chuyển đổi số - chuyến tàu không thể lỡ: Công việc hiệu quả, năng suất tăng cao",/chuyen-doi-so-chuyen-tau-khong-the-lo-cong-viec-hieu-qua-nang-suat-tang-cao-185230821194617848.htm,2023-08-22,26,1506
Chuyển đổi số tại EVNSPC: Tăng hiệu quả kinh doanh và chất lượng dịch vụ,/chuyen-doi-so-tai-evnspc-tang-hieu-qua-kinh-doanh-va-chat-luong-dich-vu-185230820191053691.htm,2023-08-21,8,976
"Chuyển đổi số - Chuyến tàu không thể lỡ: Sẽ tụt hậu rất nhanh, nếu…",/chuyen-doi-so-chuyen-tau-khong-the-lo-se-tut-hau-rat-nhanh-neu-185230820165517539.htm,2023-08-21,39,1910
Nhiều hàng quán đã áp dụng cách này làm cho khách hàng thích thú...,/nhieu-hang-quan-da-ap-dung-cach-nay-lam-cho-khach-hang-thich-thu-185230819113549974.htm,2023-08-20,3,1005
GS Ngô Bảo Châu: ‘Hãy để con trẻ phát huy khả năng một cách tự nhiên’,/gs-ngo-bao-chau-hay-de-con-tre-phat-huy-kha-nang-mot-cach-tu-nhien-185230818152912537.htm,2023-08-18,11,1278
'Chuyển đổi số không có nghĩa ngay lập tức phải đầu tư một số tiền lớn',/chuyen-doi-so-khong-co-nghia-ngay-lap-tuc-phai-dau-tu-mot-so-tien-lon-185230818083658775.htm,2023-08-18,8,702
Siemens cam kết tiếp tục hỗ trợ Việt Nam,/siemens-cam-ket-tiep-tuc-ho-tro-viet-nam-185230817150338836.htm,2023-08-17,3,902
'Tòa soạn số' trở thành xu thế tất yếu của các cơ quan báo chí,/toa-soan-so-tro-thanh-xu-the-tat-yeu-cua-cac-co-quan-bao-chi-185230817161508021.htm,2023-08-17,7,926
Ký kết hợp tác về chuyển đổi số thị xã Ninh Hòa,/ky-ket-hop-tac-ve-chuyen-doi-so-thi-xa-ninh-hoa-185230817113430167.htm,2023-08-17,18,1006
Tập đoàn T&T Group hợp tác chiến lược với Tập đoàn FPT,/tap-doan-tt-group-hop-tac-chien-luoc-voi-tap-doan-fpt-185230816203238371.htm,2023-08-17,8,1558
Doscom - Đối tác chiến lược của nhiều doanh nghiệp trong lĩnh vực công nghệ an ninh,/doscom-doi-tac-chien-luoc-cua-nhieu-doanh-nghiep-trong-linh-vuc-cong-nghe-an-ninh-185230816130505262.htm,2023-08-16,1,336
BIDV - Thương hiệu có tốc độ tăng trưởng nhanh nhất Việt Nam 2023,/bidv-thuong-hieu-co-toc-do-tang-truong-nhanh-nhat-viet-nam-2023-185230816125507768.htm,2023-08-16,2,802
Dịch vụ thuê ngoài tăng trưởng nhờ chuyển đổi số,/dich-vu-thue-ngoai-tang-truong-nho-chuyen-doi-so-185230815132614442.htm,2023-08-16,7,923
Công nghệ số 'phủ sóng' bảo tàng,/cong-nghe-so-phu-song-bao-tang-185230815200642818.htm,2023-08-16,3,957
"Chuyển đổi số sẽ thay đổi cách kết nối, nhắn tin và kinh doanh",/chuyen-doi-so-se-thay-doi-cach-ket-noi-nhan-tin-va-kinh-doanh-185230815003256177.htm,2023-08-15,2,814
Nhân rộng cách làm hay,/nhan-rong-cach-lam-hay-185230811195136057.htm,2023-12-08,3,1038
Chuyển đổi số báo chí coi độc giả là trung tâm,/chuyen-doi-so-bao-chi-coi-doc-gia-la-trung-tam-185230811183256658.htm,2023-11-08,23,821
Đổi bằng lái xe ở... trung tâm y tế,/doi-bang-lai-xe-o-trung-tam-y-te-185230809112229291.htm,2023-10-08,3,868
Việt Nam tạo thuận lợi cho doanh nghiệp Mỹ mở rộng đầu tư,/viet-nam-tao-thuan-loi-cho-doanh-nghiep-my-mo-rong-dau-tu-185230810015553133.htm,2023-10-08,3,670
Bạn trẻ cần số hóa hồ sơ tìm việc,/ban-tre-can-so-hoa-hosotimviec-18523080919422992.htm,2023-10-08,6,1066
EVNCPC sẵn sàng ứng phó thiên tai,/evncpc-san-sang-ung-pho-thien-tai-185230809193741912.htm,2023-10-08,4,843
Google hỗ trợ TP.HCM chuyển đổi số ngành giáo dục,/google-ho-tro-tphcm-chuyen-doi-so-nganh-giao-duc-185230809145349939.htm,2023-09-08,6,763
OneSME giúp doanh nghiệp gia tăng nhanh doanh thu trên môi trường số,/onesme-giup-doanh-nghiep-gia-tang-nhanh-doanh-thu-tren-moi-truong-so-185230809095120757.htm,2023-09-08,6,957
Bát nháo khóa học trực tuyến,/bat-nhao-khoa-hoc-truc-tuyen-185230806162934142.htm,2023-07-08,1,1705
"Sôi nổi ngày hội sáng tạo trẻ, khởi nghiệp và tham gia chuyển đổi số",/soi-noi-ngay-hoi-sang-tao-tre-khoi-nghiep-va-tham-gia-chuyen-doi-so-185230805143407174.htm,2023-05-08,12,546
Triết lý ‘đồng hành’ tạo dựng nơi làm việc hạnh phúc tại FPT IS,/triet-ly-dong-hanh-tao-dung-noi-lam-viec-hanh-phuc-tai-fpt-is-185230805113758443.htm,2023-05-08,3,1252
Ngân hàng giữ chân nhân sự: Yếu tố nào quan trọng nhất?,/ngan-hang-giu-chan-nhan-su-yeu-to-nao-quan-trong-nhat-18523080415405115.htm,2023-04-08,5,1163
TP.HCM sẽ giải quyết cơ bản các tồn đọng cuối tháng 9.2023,/tphcm-se-giai-quyet-co-ban-cac-ton-dong-cuoi-thang-92023-185230801221056481.htm,2023-02-08,2,722
Nông dân ngồi nhà 'chốt đơn' nông sản toàn quốc: Chuyển đổi số là đây chứ đâu!,/nong-dan-ngoi-nha-chot-don-nong-san-toan-quoc-chuyen-doi-so-la-day-chu-dau-185230731195741288.htm,2023-01-08,8,1147
Bình Phước hoàn thành số hóa thông tin đất đai tỉnh trong năm 2023,/binh-phuoc-hoan-thanh-so-hoa-thong-tin-dat-dai-tinh-trong-nam-2023-185230728164040999.htm,2023-07-28,12,619
Nông dân Thái Nguyên ngồi nhà 'chốt đơn' nông sản toàn quốc,/nong-dan-thai-nguyen-ngoi-nha-chot-don-nong-san-toan-quoc-185230727183407298.htm,2023-07-28,10,1383
An toàn dữ liệu khi chuyển đổi số bằng công nghệ Veeam,/an-toan-du-lieu-khi-chuyen-doi-so-bang-cong-nghe-veeam-185230727103243986.htm,2023-07-27,7,646
Số hóa chuỗi cung ứng: Triển vọng mới tạo sức bật cho doanh nghiệp,/so-hoa-chuoi-cung-ung-trien-vong-moi-tao-suc-bat-cho-doanh-nghiep-185230726173553966.htm,2023-07-27,5,1023
CMC hướng tới trở thành tập đoàn công nghệ toàn cầu năm 2025,/cmc-huong-toi-tro-thanh-tap-doan-cong-nghe-toan-cau-nam-2025-185230727011214811.htm,2023-07-27,1,586
Ra mắt ứng dụng 'Bản đồ địa chỉ đỏ' để giáo dục thế hệ trẻ,/ra-mat-ung-dung-ban-do-dia-chi-do-de-giao-duc-the-he-tre-185230723155544682.htm,2023-07-23,3,743
Chuyển đổi số thúc đẩy nhu cầu phát triển giải pháp bảo mật mới,/chuyen-doi-so-thuc-day-nhu-cau-phat-trien-giai-phap-bao-mat-moi-185230723130528595.htm,2023-07-23,11,1162
TP.HCM và ĐBSCL hợp tác phát triển nhiều lĩnh vực quan trọng,/tphcm-va-dbscl-hop-tac-phat-trien-nhieu-linh-vuc-quan-trong-185230721175925118.htm,2023-07-21,3,1049
Advantech ký kết hợp tác chiến lược cùng ETEK,/advantech-ky-ket-hop-tac-chien-luoc-cung-etek-185230721155909005.htm,2023-07-21,8,1007
"Năm học mới, TP.HCM tập trung chuyển đổi số và giảng dạy tin học quốc tế",/nam-hoc-moi-tphcm-tap-trung-chuyen-doi-so-va-giang-day-tin-hoc-quoc-te-185230720171637414.htm,2023-07-20,10,1083
Trường Đại học CMC: Đào tạo bền vững để không lỗi thời trong tương lai số,/truong-dai-hoc-cmc-dao-tao-ben-vung-de-khong-loi-thoi-trong-tuong-lai-so-185230720102325851.htm,2023-07-20,3,1155
Trường ĐH Tây Đô triển khai trường học thông minh,/truong-dh-tay-do-trien-khai-truong-hoc-thong-minh-185230719205356447.htm,2023-07-19,3,543
Cục Báo chí đón nhận Huân chương Lao động hạng nhì,/cuc-bao-chi-don-nhan-huan-chuong-lao-dong-hang-nhi-185230719141058638.htm,2023-07-19,3,1109
Triển khai sự kiện InnoEx 2023 thúc đẩy chuyển đổi số,/khai-mac-su-kien-innoex-2023-thuc-day-chuyen-doi-so-185230719145411315.htm,2023-07-19,6,399
Chủ tịch Hà Nội: Còn 'khoán trắng' chuyển đổi số cho tin học thì còn thất bại,/chu-tich-ha-noi-con-khoan-trang-chuyen-doi-so-cho-tin-hoc-thi-con-that-bai-185230717201708067.htm,2023-07-17,11,912
Ngân hàng bắt tay fintech thúc đẩy chuyển đổi số,/ngan-hang-bat-tay-fintech-thuc-day-chuyen-doi-so-185230713090332379.htm,2023-07-13,10,556
Chuyển đổi số giúp xử lý nhanh dữ liệu theo thời gian thực,/chuyen-doi-so-giup-xu-ly-nhanh-du-lieu-theo-thoi-gian-thuc-18523071311413901.htm,2023-07-13,6,773
Chuyển đổi số: Nhân rộng phố thanh toán không tiền mặt,/chuyen-doi-so-nhan-rong-pho-thanh-toan-khong-tien-mat-185230712075957805.htm,2023-07-13,4,1012
Đẩy nhanh cấp phiếu lý lịch tư pháp trên VNeID,/day-nhanh-cap-phieu-ly-lich-tu-phap-tren-vneid-185230712230859508.htm,2023-07-13,6,1086
Chủ tịch TP.HCM: Hợp nhất hơn 40 cổng dịch vụ công là thách thức rất lớn,/chu-tich-tphcm-hop-nhat-hon-40-cong-dich-vu-cong-la-thach-thuc-rat-lon-185230712190804663.htm,2023-12-07,6,843
2 dự án FDI 250 triệu USD 'chốt' trong 12 giờ,/2-du-an-fdi-250-trieu-usd-chot-trong-12-gio-18523071217440889.htm,2023-12-07,9,1289
Sức hút ngành Khoa học Máy tính tại Trường Đại học CMC,/suc-hut-nganh-khoa-hoc-may-tinh-tai-truong-dai-hoc-cmc-185230710172539779.htm,2023-11-07,1,1059
"Anh Bùi Quang Huy: Giá trị chuyển đổi số rất lớn, nếu không theo kịp sẽ lỡ 'chuyến tàu'",/anh-bui-quang-huy-gia-tri-chuyen-doi-so-rat-lon-neu-khong-theo-kip-se-lo-chuyen-tau-185230710194326958.htm,2023-10-07,14,1318
Đón đầu xu thế công nghệ trong quản trị tài chính - kế toán - thuế,/don-dau-xu-the-cong-nghe-trong-quan-tri-tai-chinh-ke-toan-thue-185230710142101348.htm,2023-10-07,6,1266
Cần hình thành thói quen chuyển đổi số trong người trẻ,/can-hinh-thanh-thoi-quen-chuyen-doi-so-trong-nguoi-tre-185230708212017129.htm,2023-09-07,18,1346
Chung sức đẩy nhanh chuyển đổi số,/chung-suc-day-nhanh-chuyen-doi-so-185230708102306256.htm,2023-08-07,3,1005
Sớm chuyển đổi số để phục vụ tuyển sinh tốt hơn,/som-chuyen-doi-so-de-phuc-vu-tuyen-sinh-tot-hon-185230707200152442.htm,2023-08-07,9,1226
Triển lãm Biztech Việt Nam 2023 thúc đẩy chuyển đổi số,/trien-lam-biztech-viet-nam-2023-thuc-day-chuyen-doi-so-185230707161559472.htm,2023-07-07,12,625
Công nghệ số hóa và đám mây: Yếu tố cốt lõi cho bản sắc Techcombank,/cong-nghe-so-hoa-va-dam-may-yeu-to-cot-loi-cho-ban-sac-techcombank-18523070715114626.htm,2023-07-07,6,1870
Tập đoàn công nghệ Thái Lan thúc đẩy chuyển đổi số tại Việt Nam,/tap-doan-cong-nghe-thai-lan-muon-thuc-day-chuyen-doi-so-tai-viet-nam-185230707013913092.htm,2023-07-07,5,960
Tư duy sử dụng dữ liệu giúp doanh nghiệp chuyển đổi số thành công,/tu-duy-su-dung-du-lieu-giup-doanh-nghiep-chuyen-doi-so-thanh-cong-185230706143724985.htm,2023-06-07,11,891
"Cảm thấy xấu hổ trước hạn chế mà cử tri kiến nghị, đại biểu chất vấn",/cam-thay-xau-ho-truoc-han-che-ma-cu-tri-kien-nghi-dai-bieu-chat-van-185230705183007975.htm,2023-05-07,9,948
Hà Nội miễn phí cho người dân khi thực hiện dịch vụ công trực tuyến,/ha-noi-mien-phi-cho-nguoi-dan-khi-thuc-hien-dich-vu-cong-truc-tuyen-185230704191657804.htm,2023-04-07,4,739
Thúc đẩy thu hút FDI chất lượng cao,/thuc-day-thu-hut-fdi-chat-luong-cao-185230704020501045.htm,2023-04-07,2,576
"Tình nguyện vì cộng đồng, tiên phong chuyển đổi số",/tinh-nguyen-vi-cong-dong-tien-phong-chuyen-doi-so-185230703105047346.htm,2023-04-07,5,408
Quảng Ngãi quyết tâm đẩy mạnh thực hiện chuyển đổi số,/quang-ngai-quyet-tam-day-manh-thuc-hien-chuyen-doi-so-185230701090145026.htm,2023-01-07,21,1117
Khi EU có thêm tiền 'ảo',/khi-eu-co-them-tien-ao-185230629123236203.htm,2023-06-30,1,484
Đồng Tháp ra mắt hợp tác xã nông nghiệp số của thanh niên,/dong-thap-ra-mat-hop-tac-xa-nong-nghiep-so-cua-thanh-nien-18523062815581058.htm,2023-06-28,2,530
Ông Nguyễn Văn Thể: ‘Bí thư Đoàn phải là những người đi trước trong chuyển đổi số’,/ong-nguyen-van-the-bi-thu-doan-phai-la-nhung-nguoi-di-truoc-trong-chuyen-doi-so-185230628143810449.htm,2023-06-28,26,1103
Quảng Ngãi: Hơn 71 tỉ đồng thực hiện chuyển đổi số năm 2023,/quang-ngai-hon-71-ti-dong-thuc-hien-chuyen-doi-so-nam-2023-185230627164436422.htm,2023-06-27,8,421
Noventiq ứng dụng AI để hỗ trợ chuyển đổi số cho doanh nghiệp,/noventiq-ung-dung-ai-de-ho-tro-chuyen-doi-so-cho-doanh-nghiep-185230626161258768.htm,2023-06-26,5,684
Phụ huynh 'quên' trang web trường học,/phu-huynh-quen-trang-web-truong-hoc-1852306260102016.htm,2023-06-26,3,1143
Giúp thanh niên bán sản phẩm OCOP trên nền tảng TikTok,/giup-thanh-nien-ban-san-pham-ocop-tren-nen-tang-tiktok-18523062416411126.htm,2023-06-24,12,1296
"Lark, Tanca và Rikkei hợp tác đẩy mạnh chuyển đổi số",/lark-tanca-va-rikkei-hop-tac-day-manh-chuyen-doi-so-185230624173325564.htm,2023-06-24,5,846
Nâng cao nhận thức và kỹ năng chuyển đổi số trong quản trị nội bộ,/nang-cao-nhan-thuc-va-ky-nang-chuyen-doi-so-trong-quan-tri-noi-bo-185230623172639147.htm,2023-06-24,25,1133
Lenovo ra mắt giải pháp kiến tạo môi trường làm việc số,/lenovo-ra-mat-giai-phap-kien-tao-moi-truong-lam-viec-so-185230624022624413.htm,2023-06-24,3,649
Đừng để xảy ra nhầm lẫn như đùa,/dung-de-xay-ra-nham-lan-nhu-dua-185230623212248499.htm,2023-06-24,1,1149
Đảm bảo quyền riêng tư trẻ em khi chuyển đổi số trong giáo dục,/dam-bao-quyen-rieng-tu-tre-em-khi-chuyen-doi-so-trong-giao-duc-185230623153155416.htm,2023-06-23,10,1156
Ứng dụng công nghệ giúp doanh nghiệp phát triển bền vững,/ung-dung-cong-nghe-giup-doanh-nghiep-phat-trien-ben-vung-18523062223522936.htm,2023-06-23,3,664
Trường ĐH Nguyễn Tất Thành kết nối trường đại học nước ngoài tổ chức hội thảo Fintech và Blockchain,/truong-dh-nguyen-tat-thanh-ket-noi-truong-dai-hoc-nuoc-ngoai-to-chuc-hoi-thao-fintech-va-blockchain-185230622172540582.htm,2023-06-22,1,421
"Dự án giúp bạn trẻ vừa chơi mạng xã hội, vừa đọc sách, học văn hiệu quả…",/du-an-giup-ban-tre-vua-choi-mang-xa-hoi-vua-doc-sach-hoc-van-hieu-qua-185230621110734435.htm,2023-06-21,3,1056
MobiFone ký kết hợp tác về chuyển đổi số với Tổng công ty đường sắt Việt Nam,/mobifone-ky-ket-hop-tac-ve-chuyen-doi-so-voi-tong-cong-ty-duong-sat-viet-nam-185230621151826264.htm,2023-06-21,13,1213
VNPT hỗ trợ cấp miễn phí chữ ký số,/vnpt-ho-tro-cap-mien-phi-chu-ky-so-185230621152627871.htm,2023-06-21,2,443
Sớm khai thông 'ổ khóa' dữ liệu,/som-khai-thong-o-khoa-du-lieu-185230620010505354.htm,2023-06-20,3,753
Vấn đề & Giải pháp: Chuyển đổi số có phải là chìa khóa vàng?,/van-de-giai-phap-chuyen-doi-so-co-phai-la-chia-khoa-vang-185230619191411621.htm,2023-06-19,5,408
Chuyển đổi số: Chính sách chưa theo kịp thực tiễn,/chuyen-doi-so-chinh-sach-chua-theo-kip-thuc-tien-185230619075806862.htm,2023-06-19,8,1014
Căn cước gắn chip chậm thành 'chìa khóa vạn năng': Loạt kiến nghị gỡ vướng mắc,/can-cuoc-gan-chip-cham-thanh-chia-khoa-van-nang-loat-kien-nghi-go-vuong-mac-185230619010021756.htm,2023-06-19,3,817
Căn cước gắn chip chậm thành 'chìa khóa vạn năng',/can-cuoc-gan-chip-cham-thanh-chia-khoa-van-nang-185230619005608158.htm,2023-06-19,2,2712
Khánh thành nhà ga sân bay 2.300 tỉ đồng tại Thừa Thiên-Huế,/khanh-thanh-nha-ga-san-bay-2300-tidong-tai-thua-thien-hue-18523061801111774.htm,2023-06-18,2,447
Đẩy mạnh tốc độ chuyển đổi số báo chí,/day-manh-toc-do-chuyen-doi-so-bao-chi-185230617014716689.htm,2023-06-17,5,740
"Ninh Thuận đẩy mạnh chuyển đổi số, chuyển đổi xanh",/ninh-thuan-day-manh-chuyen-doi-so-chuyen-doi-xanh-185230616212858205.htm,2023-06-17,3,524
124 tác phẩm báo chí được trao giải Báo chí quốc gia năm 2022,/124-tac-pham-bao-chi-duoc-trao-giai-bao-chi-quoc-gia-nam-2022-185230616111224024.htm,2023-06-16,2,812
Hơn 10.000 chữ ký số được cấp miễn phí cho người dân Hà Nội,/hon-10000-chu-ky-so-duoc-cap-mien-phi-cho-nguoi-dan-ha-noi-185230615174713328.htm,2023-06-15,3,781
VieON tuổi lên 3: Giữ vững tín nhiệm và từng bước chiếm lĩnh thị trường giải trí,/vieon-tuoi-len-3-giu-vung-tin-nhiem-va-tung-buoc-chiem-linh-thi-truong-giai-tri-185230614131108438.htm,2023-06-15,2,1005
Tinh thần 'chiến binh' là yếu tố tiên quyết trên chặng đường chuyển đổi số,/tinh-than-chien-binh-la-yeu-to-tien-quyet-tren-chang-duong-chuyen-doi-so-18523061420512845.htm,2023-06-15,20,1383
"Thần tốc trong chuyển đổi số, tăng trưởng xanh",/than-toc-trong-chuyen-doi-so-tang-truong-xanh-185230615005855084.htm,2023-06-15,13,1795
Tin tức đặc biệt trên báo in ngày 15.6.2023,/tin-tuc-dac-biet-tren-bao-in-ngay-1562023-185230615011305125.htm,2023-06-15,5,357
Thủ tướng: 'Thần tốc hơn nữa trong chuyển đổi số và tăng trưởng xanh',/thu-tuong-than-toc-hon-nua-trong-chuyen-doi-so-va-tang-truong-xanh-18523061418222647.htm,2023-06-14,10,1494
Giải pháp truyền dữ liệu cân than hỗ trợ giám sát đốt than trộn tại nhà máy,/giai-phap-truyen-du-lieu-can-than-ho-tro-giam-sat-dot-than-tron-tai-nha-may-185230614125113192.htm,2023-06-14,1,694
