Title,URL,Publish Date,Mentioned Times,Word Count
30 năm MobiFone: Chuyển mình để bứt phá,/30-nam-mobifone-chuyen-minh-de-but-pha-185230525142203277.htm,2023-05-25,1,1239
15 triệu công nhân phải thích nghi tốt nhất với chuyển đổi số,/15-trieu-cong-nhan-phai-thich-nghi-tot-nhat-voi-chuyen-doi-so-185230509143455459.htm,2023-09-05,2,767
Sóc Trăng đẩy mạnh chuyển đổi số,/soc-trang-day-manh-chuyen-doi-so-185230428144523203.htm,2023-04-28,2,1318
TP.HCM sắp thành lập Trung tâm chuyển đổi số,/tphcm-sap-thanh-lap-trung-tam-chuyen-doi-so-185230304022426396.htm,2023-04-03,2,433
VieON được tín nhiệm vinh danh tại giải thưởng của bộ thông tin truyền thông,/vieon-duoc-tin-nhiem-vinh-danh-tai-giai-thuong-cua-bo-thong-tin-truyen-thong-1851530246.htm,2022-09-12,3,1071
CMC đồng hành chuyển đổi số cùng Ủy ban Dân tộc,/cmc-dong-hanh-chuyen-doi-so-cung-uy-ban-dan-toc-1851509076.htm,2022-11-10,1,674
Mạng 5G MobiFone phủ sóng tại Khánh Hòa từ tháng 9.2022,/mang-5g-mobifone-phu-song-tai-khanh-hoa-tu-thang-92022-1851502597.htm,2022-09-22,1,600
Từ CCCD gắn chip đến mục tiêu Xã hội số,/tu-cccd-gan-chip-den-muc-tieu-xa-hoi-so-1851494633.htm,2022-08-31,9,1024
Ngân hàng Nhà nước cần tiên phong chuyển đổi số,/ngan-hang-nha-nuoc-can-tien-phong-chuyen-doi-so-1851485109.htm,2022-05-08,1,595
Bộ trưởng thừa nhận Thái Lan sử dụng phần mềm gián điệp,/bo-truong-thua-nhan-thai-lan-su-dung-phan-mem-gian-diep-1851480244.htm,2022-07-20,3,668
Thái Nguyên lập tổ hỗ trợ chuyển đổi số đến từng nhà,/thai-nguyen-lap-to-ho-tro-chuyen-doi-so-den-tung-nha-1851451465.htm,2022-04-23,3,880
Phát triển kinh tế số đạt 20% GDP vào năm 2025,/phat-trien-kinh-te-so-dat-20-gdp-vao-nam-2025-1851445066.htm,2022-04-04,1,382
Viettel đạt giải thưởng 'Nhà cung cấp dịch vụ viễn thông về chất lượng dịch vụ băng thông rộng di động',/viettel-dat-giai-thuong-nha-cung-cap-dich-vu-vien-thong-ve-chat-luong-dich-vu-bang-thong-rong-di-dong-1851437271.htm,2022-10-03,1,428
Thái Nguyên đặt mục tiêu vào top 10 địa phương dẫn đầu về chuyển đổi số,/thai-nguyen-dat-muc-tieu-vao-top-10-dia-phuong-dan-dau-ve-chuyen-doi-so-1851416907.htm,2021-12-31,5,1350
Tỉnh đầu tiên trên cả nước ra mắt ứng dụng nền tảng xã hội số,/tinh-dau-tien-tren-ca-nuoc-ra-mat-ung-dung-nen-tang-xa-hoi-so-1851406999.htm,2021-01-12,7,846
"Bình Phước ký kết hợp tác chuyển đổi số, tăng tốc xây dựng chính quyền điện tử",/binh-phuoc-ky-ket-hop-tac-chuyen-doi-so-tang-toc-xay-dung-chinh-quyen-dien-tu-1851400180.htm,2021-11-11,3,537
Bức xúc chuyện lấy mật khẩu ứng dụng VssID phải trả phí,/buc-xuc-chuyen-lay-mat-khau-ung-dung-vssid-phai-tra-phi-1851399308.htm,2021-09-11,1,1041
Lấy mật khẩu ứng dụng BHXH số phải trả phí!,/lay-mat-khau-ung-dung-bhxh-so-phai-tra-phi-1851398425.htm,2021-06-11,1,1289
"Bình Phước hướng đến 2025 cơ bản hình thành chính quyền số, nền kinh tế số",/binh-phuoc-huong-den-2025-co-ban-hinh-thanh-chinh-quyen-so-nen-kinh-te-so-1851393251.htm,2021-10-21,2,618
Thủ tướng chỉ thị: Phải có sóng và máy tính hỗ trợ học sinh học trực tuyến,/thu-tuong-chi-thi-phai-co-song-va-dien-thoai-ho-tro-hoc-sinh-hoc-truc-tuyen-1851109252.htm,2021-07-09,2,632
Nhiều shipper ở Hà Nội bị phạt vì ra đường không có lý do chính đáng,/nhieu-shipper-o-ha-noi-bi-phat-vi-ra-duong-khong-co-ly-do-chinh-dang-1851093963.htm,2021-07-26,0,995
Ứng dụng VssiD - Bảo hiểm xã hội số: Những tiện ích cơ bản,/ung-dung-vssid-bao-hiem-xa-hoi-so-nhung-tien-ich-co-ban-1851078321.htm,2021-06-14,7,667
"Tin tức Covid-19 hôm nay 7.6: Giãn cách xã hội, số ca nhiễm ở TP.HCM giảm dần",/tin-tuc-covid-19-hom-nay-76-gian-cach-xa-hoi-so-ca-nhiem-o-tphcm-giam-dan-1851075645.htm,2021-07-06,0,753
Phụ huynh thức đến 12 giờ đêm cài đặt VssID cho con,/phu-huynh-thuc-den-12-gio-dem-cai-dat-vssid-cho-con-1851070147.htm,2021-05-22,1,1694
"BHXH Ninh Thuận: Triển khai cài đặt, sử dụng VssID trong phạm vi toàn tỉnh",/bhxh-ninh-thuan-trien-khai-cai-dat-su-dung-vssid-trong-pham-vi-toan-tinh-1851061373.htm,2021-04-28,2,761
Hiện đại hóa quản lý công dân,/hien-dai-hoa-quan-ly-cong-dan-1851042031.htm,2021-02-03,3,1355
Hiện thực hóa 2 hệ thống quản lý công dân bằng điện tử,/hien-thuc-hoa-2-he-thong-quan-ly-cong-dan-bang-dien-tu-1851040869.htm,2021-02-26,4,1494
Có cần thiết phải xác minh danh tính người dân khi sử dụng BHXH số?,/co-can-thiet-phai-xac-minh-danh-tinh-nguoi-dan-khi-su-dung-bhxh-so-1851021300.htm,2020-12-17,2,1112
"Thủ tướng: 'Việc gì có lợi cho dân, chúng ta cần phải làm từ những việc nhỏ nhất'",/thu-tuong-viec-gi-co-loi-cho-dan-chung-ta-can-phai-lam-tu-nhung-viec-nho-nhat-1851012525.htm,2020-11-16,3,1292
Ứng dụng VssID - Bảo hiểm xã hội số,/ung-dung-vssid-bao-hiem-xa-hoi-so-1851012123.htm,2020-11-15,4,303
Kiến tạo xã hội số: Việt Nam cần xây dựng xa lộ cáp quang biển lớn,/kien-tao-xa-hoi-so-viet-nam-can-xay-dung-xa-lo-cap-quang-bien-lon-1851011310.htm,2020-12-11,1,1313
"Bộ trưởng Nguyễn Mạnh Hùng: 'Việt Nam đã sẵn sàng cho kinh tế số, xã hội số'",/bo-truong-nguyen-manh-hung-viet-nam-da-san-sang-cho-kinh-te-so-xa-hoi-so-1851004575.htm,2020-10-20,2,719
"'Cái khó, ló cái khôn'",/cai-kho-lo-cai-khon-185949531.htm,2020-04-24,0,565
TP.HCM: Cơ hội bứt phá dịch vụ công trực tuyến trong trạng thái bình thường mới,/tphcm-co-hoi-but-pha-dich-vu-cong-truc-tuyen-trong-trang-thai-binh-thuong-moi-185948626.htm,2020-04-23,0,1193
Phong cách sống tích cực lan tỏa từ gian bếp,/phong-cach-song-tich-cuc-lan-toa-tu-gian-bep-185947968.htm,2020-04-20,0,725
"An toàn, an ninh mạng có ý nghĩa sống còn trong xây dựng chính phủ điện tử",/an-toan-an-ninh-mang-co-y-nghia-song-con-trong-xay-dung-chinh-phu-dien-tu-185904969.htm,2019-11-30,2,700
Máy tính đọc não bộ của Facebook đạt tiến bộ đáng kể,/may-tinh-doc-nao-bo-cua-facebook-dat-tien-bo-dang-ke-185871330.htm,2019-01-08,1,587
Nền kinh tế số là cơ hội bùng nổ của doanh nghiệp Việt,/nen-kinh-te-so-la-co-hoi-bung-no-cua-doanh-nghiep-viet-185862499.htm,2019-06-28,6,1109
"Không xóa nội dung xấu, lãnh đạo mạng xã hội có thể bị Úc phạt tù",/khong-xoa-noi-dung-xau-lanh-dao-mang-xa-hoi-co-the-bi-uc-phat-tu-185839034.htm,2019-04-04,0,539
Nới cửa vốn cho doanh nghiệp siêu nhỏ: VPBank tiếp tục tiên phong,/noi-cua-von-cho-doanh-nghiep-sieu-nho-vpbank-tiep-tuc-tien-phong-185811923.htm,2018-12-14,0,1065
"Cuối tuần, hãy tắt điện thoại và đọc sách đi!",/cuoi-tuan-hay-tat-dien-thoai-va-doc-sach-di-185579241.htm,2016-07-30,0,486
Ứng xử với cây xanh,/ung-xu-voi-cay-xanh-185455723.htm,2015-03-19,0,656
Du lịch - Khách sạn - Nhà hàng: Thiếu nhân lực có kỹ năng,/du-lich-khach-san-nha-hang-thieu-nhan-luc-co-ky-nang-185375524.htm,2014-11-08,0,1381
Chuyển toàn bộ trẻ mồ côi tại chùa Bồ Đề vào trung tâm bảo trợ xã hội,/chuyen-toan-bo-tre-mo-coi-tai-chua-bo-de-vao-trung-tam-bao-tro-xa-hoi-185375485.htm,2014-11-08,1,367
Trẻ nhiễm HIV khó đến trường vì bị kỳ thị,/tre-nhiem-hiv-kho-den-truong-vi-bi-ky-thi-18575100.htm,2014-05-31,1,501
Facebook bành trướng sang “dế giá rẻ”,/facebook-banh-truong-sang-de-gia-re-18520857.htm,2013-07-23,3,588
Facebook bốc hơi 25 tỉ USD,/facebook-boc-hoi-25-ti-usd-18563979.htm,2012-05-31,1,181
Hơn 500 học viên thoát khỏi nơi cai nghiện,/hon-500-hoc-vien-thoat-khoi-noi-cai-nghien-185355729.htm,2010-05-17,1,318
Tin vắn 10.11.2009,/tin-van-10112009-185354089.htm,2009-10-11,1,549
